Num,ID,is_Original,Flair,num_comments,Title,Subreddit,Body,URL,Upvotes,Comments,creation_date
908,ge188m,False,Advice,9,Mathematics for CS,computerscience,"If we have no taken Calculus before, would many of you suggest taking it before Discrete Math?",https://www.reddit.com/r/computerscience/comments/ge188m/mathematics_for_cs/,1,"My discreet math course did use some summation notation and proofs that involved a very small amount of calculus. I would recommend taking Calc before discreet math just to make it a little easier if possible, but if you don’t it won’t kill you ",2020-05-05 16:43:22
801,howuon,False,Advice,7,"I want to learn enough to get an entry level job and save up money, which of the bootcamps (chi, IL) that I listed is the best for this?",computerscience,Grave hooper vs coding dojo vs Northwestern,https://www.reddit.com/r/computerscience/comments/howuon/i_want_to_learn_enough_to_get_an_entry_level_job/,1,"I don’t really don’t know much about bootcamps but there is no possible fast track to computer science, there’s just so much to take in that anything other than a holistic approach will leave u hindered at the time of problem solving and seeking optimal solutions to problems ",2020-07-10 20:46:14
274,gh43bw,False,Discussion,4,What really is the problem with sensor fusion in robotics and autonomous vehicles?,computerscience,"I’m a CS student and becoming involved in robotics. It is commonly said that the hardest problem in autonomous vehicles and robotics in general is sensor fusion. But it seems like companies like Waymo have this figured out, so what is the problem with this exactly that we’re trying to solve?",https://www.reddit.com/r/computerscience/comments/gh43bw/what_really_is_the_problem_with_sensor_fusion_in/,3,"It's important to grasp that the actual traction of humans efforts to create solutions for the worlds problems have and will fundamentally begin and end in software.
This is in contrast to many peoples perception that software is simply the glue which sticks the latest lidar sensor to the latest tensor stream processor.
The real issues that plague real software systems are as rampant as they are virilent. Even tech giants displaying best efforts have shown severe ongoing issues when it comes to actually sharing and layering technologies in a useful way (especially when those technologies represent complex sensory-model and or control-systems) Put short Sensor fusion is a pure software problem, it's very easy to do 'badly', but projects like Enfuse and Enblend show us how hard they are to do right, but also how proper tech usage for data fusion can be soo amazing! ",2020-05-10 16:02:51
226,hjosju,False,Discussion,3,Where do u guys see computers go in the future,computerscience,"So i’m a pretty big computer fanatic. Like besides basketball, hanging out, and robotics I just love seeing what i can do with code. My question is that where do u guys see computers going in the future. In the 20th century apple and pixar made computers an artistic medium and now i think that we have a chance to actively shape where computers can go next. So where do u think computers will go next?",https://www.reddit.com/r/computerscience/comments/hjosju/where_do_u_guys_see_computers_go_in_the_future/,0,"Software is not going anywhere.  If anything, it'll get more deeply ingrained within society.  Other areas of potential growth are robotics and space exploration. ",2020-07-02 02:39:13
910,gdh3di,False,Advice,9,It is said that Computer Science degree is one of if not the very least stressful college majors? How is this true and what are your thoughts about it?,computerscience,I'm currently considering taking Computer Science for college and I need some advice since there are times where I'm bad at handling stress. What were your experiences?,https://www.reddit.com/r/computerscience/comments/gdh3di/it_is_said_that_computer_science_degree_is_one_of/,1,"I just finished my first year as a CS major and in my experience it wasn’t very stressful. The course load gets pretty heavy (at my university anyway) and can be intense, but as long as you put your head down and grind through it it’s not bad. It’s lot of work but you have tangible results. ",2020-05-04 18:27:24
192,91cw4t,False,General,4,How much do computer science majors make after college?,computerscience,"I have a passion for programming and was wondering, for those of you that have a computer science degree, we're you able to land a job right after college and make a comfortable living? And if you don't mind me asking, how much are you making per year? ",https://www.reddit.com/r/computerscience/comments/91cw4t/how_much_do_computer_science_majors_make_after/,1,I think 50-65k is the normal range. Been researching this for a while. ,2018-07-24 01:10:03
514,c2ep0o,False,Article,0,An open-source app to annotate online social network documents to be used in opinion mining,computerscience,,https://www.researchgate.net/publication/333828021_Noytext_A_Web_platform_to_annotate_social_media_documents_on_noise_perception_for_their_use_in_opinion_mining_research,7,,2019-06-19 08:59:53
825,gg9waj,False,Advice,15,First Project,computerscience,"I'm looking to start working on beginner projects for programming, but I'm clueless of where to start. I know  Python and Java currently, but I'm unsure of how to actually put it to use outside of college. 

Does anyone have a suggestion for how i should start applying what I've learned to a basic project of some sort?",https://www.reddit.com/r/computerscience/comments/gg9waj/first_project/,42,"Look for open source projects that interest you and match your language skills on github.  There will be bugs, features, and docs to work on, and if you pick the right project, a friendly community to mentor you. ",2020-05-09 05:53:15
558,8f52t6,False,Article,0,Can you build Artificial Intelligence systems for the Army?,computerscience,,https://pals.vet/index.php/news/army-news/army-signal-classification-challenge,0,,2018-04-26 18:43:27
56,f87uyq,False,General,5,"I created a website for quick searching 8085 microprocessor opcodes for my microprocessor lab, hope you guys can also make use of it",computerscience,,https://thesyncoder.github.io/micro,120,Which grade dude? ,2020-02-23 10:33:52
87,f1x0fm,False,General,0,Learn JavaScript and algorithms by assembling patterns together,computerscience,"I'm Jacques, an ex-google software engineer turned programming instructor. My students were struggling solving algorithm challenges so I created a tool that guides them through the process. For each exercise, you are given all the you need and need to figure out how to assemble them to get to the solution. It's a stepping stone towards being able to solve algorithm exercises without any clues.

Here's the link: [https://wakata.io/learn/info/wakassemble](https://wakata.io/learn/info/wakassemble)

Enjoy :)",https://www.reddit.com/r/computerscience/comments/f1x0fm/learn_javascript_and_algorithms_by_assembling/,9,,2020-02-10 21:12:19
578,3d2rif,False,Article,0,Compression - Computerphile,computerscience,,https://www.youtube.com/watch?v=Lto-ajuqW3w,3,,2015-07-13 01:41:26
80,f7vrde,False,General,1,"EDSAC, early computer built in 1949 at Cambridge University. Picture Computer History Museum.",computerscience,,https://i.redd.it/xom3tf86hii41.jpg,19,There’s a decent EDSAC emulator ,2020-02-22 17:35:57
836,guqfab,False,Advice,8,Getting started with coding. What language should I learn?,computerscience,"Since it's lockdown and my college won't open anytime sooner, I was thinking of learning to program. Mostly I'm interested in what goes on behind a particular website, how it's made and how a particular feature is made to work. Basic logical stuff. I'm not even sure if this makes sense.

It would really help if anyone guided me. What language should I begin with, and how I should go from there.",https://www.reddit.com/r/computerscience/comments/guqfab/getting_started_with_coding_what_language_should/,5,"Look at the HTML, CSS, PHP, and MySQL videos (in that order) on elithecomputerguy.com as it’s designed perfectly for newbies to get started on their own. The lectures are interesting as he spent many years working in tech, and adds his own experiences. Eli shows you how to get set up in your own environment and doesn’t give you too much too fast. He also walks you through beginner and intermediate level projects. Pair it up with one of these books: 
HTML and CSS: https://www.amazon.com/HTML-CSS-Visual-QuickStart-Guide/dp/0321928830/ref=mp_s_a_1_3?dchild=1&keywords=html+and+css+visual+quickstart+guide+8th+edition&qid=1591058924&sprefix=HTML+and+CSS+visual&sr=8-3 
PHP for the web:
https://www.amazon.com/PHP-Web-Visual-QuickStart-Guide/dp/0134291255/ref=mp_s_a_1_3?dchild=1&keywords=php+for+the+web+visual+quickstart+guide&qid=1591058994&sprefix=PHP+&sr=8-3

After that, look into Team treehouse and do one of their web dev tracks or Techdegree programs.

Another free resource I would recommend is the Odin Project (if you want to learn ruby instead and have a structured curriculum). ",2020-06-01 18:51:49
463,fdicvw,False,Article,1,"Computer science education bill gains momentum, passes key committee hurdle",computerscience,,https://www.mpelembe.net/pr-newswire/news-releases/?rkey=20200304CL38787&filter=19466#.XmACVjns_CM.reddit,0,I attend the University of Mississippi for computer science. It's awesome to see a movement like this to come out of Mississippi! ,2020-03-04 19:35:06
775,fm0mcm,False,Help,0,"Suggestions: A ""fuzzy"" hash/digest for genetic algorithm population visualization",computerscience,"I have a project where I'd like to create a real-time time-series waterfall visualization for the population of genes in a genetic algorithm. 

I did this years ago with a GA program (Artificial Life, actually) where there could be a sizeable sub-population of individuals with the exact same genes. So a bar graph of populations where one axis is a hash of the gene data would show spikes, which would meaningfully grow and shrink over time: (below, Y axis is hash of gene data, X axis is population)

    X
    X
    XX
    X
    XXX
    XXXXXXXXXXXXXXXXX
    XX
    XXXXX
    X
    XX

However, in my current project, there is only ever one individual with exactly the same gene, so doing a conventional hash would result in a flat graph. My question: Are there any ""fuzzy"" hash algorithms around that would tend to produce values close to each other if the inputs are kind of close? For example, one that would produce two hash values close to each other if the inputs had a small Levenshtein distance?

Is there a name for the kind of thing I'm looking for?",https://www.reddit.com/r/computerscience/comments/fm0mcm/suggestions_a_fuzzy_hashdigest_for_genetic/,1,,2020-03-20 19:02:22
508,budcyo,False,Article,5,What do yall think of what's being said in this article?,computerscience,From Discover on Google https://www.fastcompany.com/90355969/want-to-fix-big-tech-change-what-classes-are-required-for-a-computer-science-degree,https://www.reddit.com/r/computerscience/comments/budcyo/what_do_yall_think_of_whats_being_said_in_this/,6,"I think that ethics in computing is important and often overlooked. My capping class in college was more of a science fiction literature class than anything technical. We explored how the technologies engineers have created, or may someday create, impact society. I think it's an important mental exercise.

Smartphones and social media play a tremendous role in shaping an individual's worldview - as such, we need to be conscientious of what that's promoted to the top, beyond just user engagement.

I think it's important for engineers to be able to discuss ethical issues with their creations, not just product people. The engineers understand how their applications actually work and can be better equipped to discuss how a feature may be misused, biased, or otherwise harmful. ",2019-05-29 11:17:16
199,8b00he,False,General,4,Tools for learning/studying/retaining information in CS?,computerscience,I ended up having to drop one of my CS courses due to being absent for too long and missing too many assignments after a death in my family. I’m going to be retaking this course during the summer and I don’t want to lose my prior knowledge and maybe even get ahead. I’m currently only learning Java but tools for anything would be nice since eventually I want to get a head start on my other classes. Thank you!,https://www.reddit.com/r/computerscience/comments/8b00he/tools_for_learningstudyingretaining_information/,4,"There're a lot of techniques that could help you but just one of them is the key: learning by making mistakes. When you understand the mistakes, in that time, you understand it and just THEN you'll remember it (for long time). 

This is my personal opinion and this is what is working for me. If you don't find it useful you could try another technique but remember that  the key is the understanding.

If you understand it you'll remember it. If you understand you'll make connections in your mind with other topics, strengthening synapses then your memory and your understanding. That's it. ",2018-04-09 17:00:42
623,gtggg4,False,Help,6,I know java and python. Im looking to learn about rasberri pi however and drone building.,computerscience,Looking for a course or book on building a drone with rasberi pi. I want to program the drone as well over time and add things like facial detection and image recognition classification.,https://www.reddit.com/r/computerscience/comments/gtggg4/i_know_java_and_python_im_looking_to_learn_about/,3,"You should learn how to use Linux for it, I prefer the command line raspbian as it's very simple (go learn the commands and basic stuff) than go check a tutorial for how to develop programing on raspberry pi, I know pi4j library for java, you also need wiringpi for the gpio pins (sudo apt-get install wiringpi) something like that,and that's the first step of developing programing on the raspberry pi, than you can learn to make a drone after you will master the raspberry pi. ",2020-05-30 15:58:22
599,gq77y9,False,Help,9,What does 'sampling' mean in the context of computer science (image processing/CG)?,computerscience,I am a student and I see the word thrown around quite frequently online and I feel like I am missing a lot.,https://www.reddit.com/r/computerscience/comments/gq77y9/what_does_sampling_mean_in_the_context_of/,34,"Random Sampling just basically means to chose randomly. In computer vision using various loss functions one can choose the output based on the output of the loss functions but sometimes it wont give the required output but randomly choosing output gives answer nearer to the required answer.

There are various articles about various sampling methods give a read to understand the scenarios that it is used

Edit : I made a mistake of substituting Sampling with Random Sampling that just one of the techniques of Sampling. ",2020-05-25 08:22:38
706,gb3ygh,False,Help,1,Can user programs directly access physical addresses?,computerscience,"I have a doubt regarding address binding in OS. I saw a statement that read ""User programs can never directly access physical addresses"". It can access physical addresses using logical addresses using MMU. 
I also saw that in compile-time and load-time binding, the logical address and physical address is the same. So, won't the user program be able to access or see the real physical address. When taking this case, isn't the above statement false?

Another doubt I have is :
The compiled code has the absolute address of physical memory in it. Doesn't that create a problem? I mean, the logical addresses itself is created to protect the data on the physical memory. If the compiled code has the absolute physical address, then the true meaning for using logical addresses is lost, right?

If what I understood is wrong, please correct me.",https://www.reddit.com/r/computerscience/comments/gb3ygh/can_user_programs_directly_access_physical/,0,"It depends on the hardware and the OS. 

The ""modern"" OSes we use today isolate the loaded code from the physical hardware via several layers of translations. In fact, most executables are built as ""relocatable"" code sections specifically for that reason. At any moment the OS may physically relocate any code section, modify the code's physically mapping address registers, then continue processing. The programs themselves never see or even know any address translation is occurring. 

However, for some hardware - like certain microprocessors commonly used as Arduino targets without any significant OS that performs such memory address translations - the addresses a program references are exactly the same as the physical address. This is also true for certain data processing systems that must be certified for critical processing (think flight computers onboard a commercial airplane) so the chances of failure are as small as possible. ",2020-04-30 20:49:07
803,g9pjz2,False,Advice,60,"I want to automate a repetitive task, but I don't know much about coding and computers.",computerscience,"Hello Guys.

So I'm not really sure if this belongs in here but I'm just looking for some advice or tips. So I started this temp job and we seem to do the same thing all day long as its a data entry. I was thinking can't I program or build something that would do the task im doing more efficiently and without me doing the same repetitive process all day long. Basically we get the ID from excel, copy that on to another program, which we grab another number, and go to the safari to get 2 diff. values which we plug into that program. Then save the screen from the safari page(print to pdf) and then upload those to another program. The thing is its the same repetitive process, so its extremely irritating doing it all day long. Tbh im only doing it for the money as im straight out of college and lost right now. Hopefully that made some sense and would be greatly appreciated if someone can guide me.",https://www.reddit.com/r/computerscience/comments/g9pjz2/i_want_to_automate_a_repetitive_task_but_i_dont/,122,"It can be probably done but it will be difficult in my opinion without previous knowledge.
Specially because some of the tasks are well explained but require extensive setup.
Also when you say programs, do you mean websites or just software?
If websites it will make it easier, if its software it will be more complicated.

Nevertheless I suggest starting on just automating one step (not necessarily the first) and the moving to the next. ",2020-04-28 15:44:22
180,adqtr7,False,General,3,"Are there any careers in the tech world for those who are mediocre at coding, yet have wonderful ideas?",computerscience,"Hi! My boyfriend 20(M) is currently a junior computer science major. He switched his major sophomore year, so he is a tad behind in terms of understanding coding language in comparison to the other kids in his classes. I bought him a few coding books to help, however, he isn’t sure if he will ever be able to catch up. 

He has a brilliant creative mind and loves the realm of technology and computers. Are there any jobs that focus mainly on the beginning stages of an app or software that serves to come up with the idea and what it will look like. I have heard of front end developers, but does that still require a grandiose grasp on coding? 

I just want him to have some career options. If he has to be a wizard coder, than I will push him to be a tad more disciplined. 

Thanks!
",https://www.reddit.com/r/computerscience/comments/adqtr7/are_there_any_careers_in_the_tech_world_for_those/,1,"Its true, I didnt feel to strong in my skills when I first started but if you can grasp the basics then with experience the more complicated tasks will work there way out. Java is really not that hard to learn and use, almost everything has been done for you. Tell him to focus on how java works and try no to get to bogged down with the computer science part of it. How to manually reorder a list or build your own data structures can be a daunting task to someone who knows very little. The best thing here is you dont have to because someone else has already done it for you, just learn what they are and how they work and java/C# will do the rest for you. ",2019-01-08 05:01:25
686,gl5122,False,Help,2,Free online computer science courses?,computerscience,"I remember reading somewhere on reddit that someone self taught themselves computer science from I think MITs free online lessons but I couldn’t find them anywhere, I could be wrong that it was from MIT but I was wondering if anyone knew where I would be able to find them at! Any help would be much appreciated!",https://www.reddit.com/r/computerscience/comments/gl5122/free_online_computer_science_courses/,1,I would search Harvard's CS50. That would start you off in the right direction. ,2020-05-16 23:47:25
128,as1s1p,False,General,17,Meta: mods please use a bot to auto-remove career advice posts and limit posts to news and discussion posts about the general field of CS.,computerscience,I’m not sure what the point of having u/askcomputerscience and u/computerscience are if the posts are the same career advice. ,https://www.reddit.com/r/computerscience/comments/as1s1p/meta_mods_please_use_a_bot_to_autoremove_career/,70,Maybe they should just be in the rules/sidebars with clickable links as things you might not want to post here but 'over there'. So that would be r/cscareerquestions and r/careerguidance ? ,2019-02-18 20:40:20
88,ce5hj6,False,General,71,Why do Computer Science students seem so unfocused in class,computerscience,I am a Senior CS major at a fairly large university (Approx 35k students) and In my upper-level CS classes 300-400 level it seems like my fellow classmates including myself just never listen to what the professors are saying. Do any other CS students notice this also? What is the reasoning that no one seems to be listening to material that seems fairly important?,https://www.reddit.com/r/computerscience/comments/ce5hj6/why_do_computer_science_students_seem_so/,163,"I myself am soooo guilty of this, I just get too easily distracted by things like Facebook and Discord. ",2019-07-17 00:26:39
288,g63tlw,False,Discussion,7,Procedural vs. Object Oriented,computerscience,"I’ve been wanting learn C for awhile now, but I have been working with more modern OO languages (Java and Python) recently. I’m not too familiar to the procedural paradigm, but I know C is a cornerstone and I would love to work with it in the coming weeks. I plan on purchasing the classic K&R book to study through, but my main question is, what is the learning curve between learning procedural if I only know object oriented programming? I know there is a big emphasis on DS&A in procedural, but when in doubt, I’ve always had the luxury of creating an object that does exactly what I need. Is that something that’s easy to overcome?",https://www.reddit.com/r/computerscience/comments/g63tlw/procedural_vs_object_oriented/,1,"Very few people really program OO, they program procedurally using some OO features.

You won't have a problem learning procedural programming. 

You can just download a PDF copy of K&R, it's all over the place. 

just google ""K&R pdf""

  
I also recommend learning some functional programming.  MIT's intro to CS used to be based on Lisp

 [https://sarabander.github.io/sicp/html/index.xhtml](https://sarabander.github.io/sicp/html/index.xhtml) ",2020-04-22 16:04:02
713,ghchbp,False,Help,1,Is it possible to study enough to apply to computer science major in a year if your math level is equal to 10th grader's?,computerscience,,https://www.reddit.com/r/computerscience/comments/ghchbp/is_it_possible_to_study_enough_to_apply_to/,0,yes ,2020-05-10 23:49:50
222,hdd54l,False,Discussion,7,How much did/do you guys make straight out of undergrad?,computerscience,I’m trying to be a software engineer and was curious I live in DC and Planned to do an internship at the nsa as well thanks not sure if I want federal or not let me know!!!!,https://www.reddit.com/r/computerscience/comments/hdd54l/how_much_diddo_you_guys_make_straight_out_of/,1,"$78k in MA, not in Boston, with the potential to be making up to $84k at the end of my first year based on quarterly performance reviews ",2020-06-21 19:43:40
