Num,ID,is_Original,Flair,num_comments,Title,Subreddit,Body,URL,Upvotes,Comments,creation_date
662,gkw85n,False,Help,5,Can you help me suggesst some resources for an important upcoming job interview?,computerscience,"Hi everyone, I need your help with some resources (videos/websites) for the below mentioned topics. Also, if you know some mock test MCQs for it, it will be of much help.

The job is of Technical Assistant. It is basically an entry level job (similar to Tech Support) in a college in which I will be handling a computer lab where freshman/other CS students perform their lab experiments (including coding, network, OS etc.).

My job is to maintain lab: Proper networking, cabling, Installing of IDE/other softwares to lab PCs, Helping as TA to Professor, keeping user profiles of students in lab PCs.

The component of the job process will consist of:

1. Written exam (MCQs) from below mentioned topics
2. An interview (10-15 minutes; oral Q/A in front of 5-6 panelists, 3 of which will be domain expert- rest their oraganisation management)
3. **No practical/skill test** will be conducted, however candidate should know details.

**Additional information for anybody Indian here**: Level of the exam will be similar to IT Diploma level students, B. Tech. CS/IT.

Suggest any other useful info/tips, you think will be helpful for this job.

[Syllabus for exam](https://preview.redd.it/vqffyhh715z41.png?width=893&format=png&auto=webp&s=cfc7c77f5ad13b9bed8c8b4aebadd2ad7436e462)",https://www.reddit.com/r/computerscience/comments/gkw85n/can_you_help_me_suggesst_some_resources_for_an/,1,"Because I am also cramming for an Interview like this lol:  

[http://www.redbooks.ibm.com/redbooks/pdfs/sg247786.pdf](http://www.redbooks.ibm.com/redbooks/pdfs/sg247786.pdf) 

Very in depth knowledge on networking principles here.

For more networking stuff, check network direction on youtube and the associated website.

Im learning about DNS from:  [https://www.youtube.com/watch?v=4a3MGDAoljI&t=600s](https://www.youtube.com/watch?v=4a3MGDAoljI&t=600s) 

Good luck!

CS50 has a general CS section, while caleb curry has a great C peogramming tutorial on youtube. ",2020-05-16 15:13:31
703,fxjxf8,False,Help,7,Starting CS from scratch,computerscience,"I'm a 24 year old female who graduated in Spring 2018 with a BA in English with a minor in Professional Writing. I wanted to attend law school and was a paralegal upon graduation for in house counsel for a FinTech company in DC. Long story short, I realized I was more interested in finance and the development side of the company. Transferred positions as a paralegal in the company to a Business Advisor to get more of an account manager/loan advisor experience with hopes to go for my MBA. I love. However, while in limbo between the two positions (about a month), I interned with the Dev team doing some minor, excel ""data analytics."" I did fine.

Bottom line, I am starting from scratch. I could make an easy move to finance and to get my MBA and maybe go towards a high end Relationship Manager role, which would be my end goal. However, I cannot shake the thrill of computers -- I grew up with three older brothers who were all techy and computer nerds. Safe to say, I was exposed to computers and technology growing up.

I have had plenty of ""info sessions"" from colleagues, family friends, etc. in finance, banking, and CPA/CFP ""stuff."" However, I do not have any information about what it takes, let alone start from square 1 with NO official background, in CS.

Advice, thoughts, honesty, perspective -- write away.",https://www.reddit.com/r/computerscience/comments/fxjxf8/starting_cs_from_scratch/,1,"All of programming is fundamentally the same. It's logic and structure to give random assortments of data meaning. So when you look at all the different languages and techniques, the best thing to do is not to be scared of them, but to remember they all work to this goal. Along with this, remember that all of programming is made by people as opposed to physics that is dictated by nature. Not every concept will have a nice meaning and you'll encounter things that don't make sense until you see them enough.

A little more practical, pick a language that is forgiving to begin with. You can adapt almost all code into any language, but some are nicer than others. These are organized from high to low level. The lowest is machine code. 1's and 0's whose meaning is dictated by the instruction set. And the highest level is something like html or java. I recommend starting at high-level and going down. Python and Java are pretty smart and can be nice to beginners, while something like C is going require you to have a lot of knowledge and be a diligent programmer to make good work.

The best advice above all else is just to start and fumble your way through the learning curve until you get good. Google is your friend here. And remember to enjoy yourself! ",2020-04-09 02:15:16
231,hchjns,False,Discussion,6,Will coding ever fall into obsolescence?,computerscience,"In the perspective of AI, it seems we can say that programmers will be necessary until the computer can program itself, therefore catching up to its deficiencies through learning/training.

However, another danger to CS is NLP. If we abstract language design so perfectly (and to the needs of society) that it surpasses the need for programmers to close the gap between a client's needs and the limitations of a given language (yes, I know that skilled programmers can create beautiful abstractions of logic to handle lots of functionality, however, I am assuming that there is an upper bound on human intellect at any given time when operating from the perspective of a programmer), then there would be no market for coders anymore (just as in the case with AI).

I believe the latter case will happen in some way, way before the emergence of the singularity.",https://www.reddit.com/r/computerscience/comments/hchjns/will_coding_ever_fall_into_obsolescence/,1,Yes ,2020-06-20 07:03:38
507,d5w6dw,False,Article,0,This AI-powered Infinity Stone helps you remember people’s names,computerscience,,https://youtu.be/Wb7zlCrwNiE,2,,2019-09-18 11:10:30
735,g5506t,False,Help,0,Examples of Superscalar Processors,computerscience,"Hello everyone! So I've been searching the internet, trying to find some examples of superscalar processors, and I've been having a lot of trouble with it. If anyone could give me some examples, I'd be more than appreciative. Thank you!",https://www.reddit.com/r/computerscience/comments/g5506t/examples_of_superscalar_processors/,1,,2020-04-21 00:36:10
896,gozijs,False,Advice,3,Building applications and projects vs solving coding problems: What's most important when learning?,computerscience,"Hey everyone, I'm a second year CompSci student who's majoring in computer science and IT. 

My first experience with coding was in my first year and needless to say it was very hard for me, I did not enjoy solving problems like making a game with a 2D array such as Battleship, Parsing strings or files or similar questions e.g Like on CodingBat.

Now in second year, and since I'm in lockdown I decided to work on some projects on my own with Java since it's the language were using  now (First year was Python), and I enjoy building systems like a POS or a database management system and creating a GUI to function a long with it, or using interesting/famous algorithms. It feels useful and applicable.

Though I understand the need for testing a students logic and creativity with the ""battleship"" style questions or open ended questions, It's kind of discouraging when something so simple takes you forever to figure out compared to others.

Do you believe solving these styles of questions are important in preparing for the working world or are they just not necessary?",https://www.reddit.com/r/computerscience/comments/gozijs/building_applications_and_projects_vs_solving/,2,It is all about improving your logic and design skills. You start with simple problems to solve for this and grow from there. ,2020-05-23 05:30:49
16,hresk4,False,General,1,csrankings.org is biased. We need a better research based ranking website for CS.,computerscience,"Many of you know the importance of university rankings while applying to a grad school, especially if you are an international student. I am an international student and I relied upon [csrankings.org](https://csrankings.org) to shortlist the universities based on the research. I always thought this website was well maintained and could be trusted. However, a recent incident has changed my opinion.

Being a beneficiary of the website, I was personally motivated to keep it upto date to help new international students applying to grad schools. I noticed there were many missing faculties in the AI field at McGill University and thought I would submit a pull request. To my surprise the pull request was denied by the repo owner citing that a particular faculty was not a full-time employed at the university (the policy was to exclude faculty who are <75% at the University). In this case, I personally know the faculty and I told the owner that the faculty was a full-time employee and is in a tenure track. I also told him that they supervise newly admitted students (MS and PhD). But then came a big surprise. The repo owner told me that the faculty is a head at an industrial lab and hence only way to verify if that person is >75% at the university is to check their financial records.

This reply made me upset because:

* The website essentially gets updated at the discretion of one person. He chooses to ignore a particular pull request (PR) citing some policy of the website. However, there are many other faculties on the website who are part-time researchers / head at some research labs (I can speak for many AI faculties in this case). There is no way to get their names removed because one can't produce the faculties' financial records to prove that they are correct.
* Many so called policies are not mentioned on the website but the owner brings them up while submitting a PR. In my opinion these policies should be put on the website so that the students who look at the website are not being misled.
* The owner doesn't accept ECE faculties who supervise students admitted to CS because they don't fit the policy. However FAQ page of the website mentions the following statement:

>As mentioned above, tenure-track faculty who can advise PhD students in CS can be included regardless of their home department. The primary audience of CSRankings is prospective graduate students who are seeking a postgraduate degree in Computer Science.

But when I asked him about this, the person mentioned that the faculty of ECE has to be listed on the CS website. However, in a later part of the conversation, he says 

>websites are generally lagging indicators at best

You can find the entire conversation during [here](https://github.com/emeryberger/CSrankings/pull/2723#pullrequestreview-448465670). I find it hard to accept the fact that the website I trusted the most is actually faulty.

I hope there was a better research ranking website that is unbiased, give a good indicator of whether a faculty supervises a PhD or MS students (irrespective of the % spent at the university) and where the policies are applied to all the universities and faculties. In fact, the website should have a better policies.",https://www.reddit.com/r/computerscience/comments/hresk4/csrankingsorg_is_biased_we_need_a_better_research/,0,Ranking things that vary along so many axes is a fundamentally flawed approach to begin with. You'll have a better time building your shortlist by looking at who's been publishing work related to your interests lately. ,2020-07-15 01:53:59
644,gugxh7,False,Help,4,"This may seem simple, but why does Extended ASCII use the same amount of memory as Standard ASCII?",computerscience,,https://www.reddit.com/r/computerscience/comments/gugxh7/this_may_seem_simple_but_why_does_extended_ascii/,1,"Traditionally computers have used 8 bits (a byte) as the smallest grouping for data, in C (and many other languages) this is known as a `char`.

Conveniently standard ASCII fits into these 8 bits (values 0-127) however, this leaves values 128-255 unused. This is where extended ASCII comes in. Extended ASCII uses up the remaining values of the byte to “extend” standard ASCII with more symbols.

This is why both standard ASCII and extended ASCII are able to occupy the same amount of space. ",2020-06-01 08:40:32
710,ew2pi4,False,Help,21,I need your Help,computerscience,"I am searching for a good algorithm (better than O(N^2), N beeing the amount of edges)  to repeatedly check the shortest path between two nodes. 

The Graph: 
I am using a grid like graph where i one after another add some edges. So the graph has about the same amount of edges and vertices and has no weight's nor is it directed. Before i add a new edge i want to check the distance between the 2 vertices i am Connecting and later decide on that result whether or not i want to add this Edge. 

My question is, is there a Data structure that allows me to find the Distance between vertices in less then O(N^2) (wich would be just a BFS for the other Vertex)? That Data structure of course still needs to hold after i added a few edges. If possible i would like to have a space Complexity of O(N).

If you have any ideas i would really like to hear them.

(The last thing i looked into was a disjoint set used in the Kruskal algorithm. With this i can check quickly whether two vertices are connected through a path or not)

Edit:
Practical Description of what i want to do:

I am creating a dungeon generating algorithm that is based on Kruskall. You have a essentially Bool matrix wich says whether or not a Tile is walkable or not. Now i want that the algorithm creates cycles if they have a certain size. So if a add a new walkable tile i need to check whether or not i am creating a cycle and then check how long the cycle.",https://www.reddit.com/r/computerscience/comments/ew2pi4/i_need_your_help/,32,"Since you can't do better than *O(N)* I'd opt for BFS (if you're willing to pay a heavy pre-processing cost you might be able to do better). You could also keep track of the path and cost for further queries, and then use them as an upper bound for a directed search that uses the structure of the graph (for example A\*).

It could be paying off since it's a ""grid-like"" graph and the paths can only get shorter when you only add edges. But it's still gonna be *O(N)* which you can't beat. ",2020-01-30 09:15:48
550,72fzzf,False,Article,3,Expanding Access to High Quality STEM and Computer Science Education Provides More Pathways to Good Jobs,computerscience,,https://www.whitehouse.gov/the-press-office/2017/09/25/expanding-access-high-quality-stem-and-computer-science-education,31,I read something somewhere (maybe here) that there's a big push for tech jobs so that the pay will become stagnant. Do you think this is the case? ,2017-09-25 22:24:39
404,hrhl8u,False,Article,0,Perceptron Learning Algorithm Explained in Detail,computerscience,,https://www.mygreatlearning.com/blog/perceptron-learning-algorithm/?utm_source=redditalgorithm,2,,2020-07-15 05:10:53
99,eaaz2w,False,General,5,"Is there an ""Elements of Style"" for coding?",computerscience,"I'm wondering if anyone has any book suggestions on coding with good style. I'm looking for general rules of thumb, do's and dont's. That sort of thing.

Thanks in advance.",https://www.reddit.com/r/computerscience/comments/eaaz2w/is_there_an_elements_of_style_for_coding/,2,The [Linux Kernel style guide](https://www.kernel.org/doc/html/latest/process/coding-style.html) is good to read over. ,2019-12-13 22:26:29
511,cr6fgp,False,Article,1,How To Build A Website - Create A Website Tutorial For Beginners (2019),computerscience,,https://www.buildawebsite.biz/,6,"You have an EIG site there, not recommended. [Avoid EIG hosting providers](https://www.onlinetoolsexpert.com/full-list-of-eig-web-hosting-companies/). ",2019-08-16 13:33:37
867,gjez6p,False,Advice,9,What’s some advice for a freshman going into computer science? Was there anything that you wish that you knew?,computerscience,Particularly skills or study and lifestyle habits related things,https://www.reddit.com/r/computerscience/comments/gjez6p/whats_some_advice_for_a_freshman_going_into/,5,Truth? Pay attention to your database courses - you'll see them for the rest of your life. ,2020-05-14 04:07:07
352,eqsof6,False,Discussion,1,[Discussion] College vs Uni,computerscience,"Not sure how it works in other countries, but I’m in Ontario. Comp Sci is only available in Uni. All the college programs are called programming, web development, blockchain development, and game programming (that’s all I could find relating to compsci). The college courses have lower math requirements. 

If anyone is from Ontario, let me know how college programming is vs university compsci.

If you’re from somewhere else, I’m still interested in how it works there. I’d love to know how compsci is in your school systems 

Thanks",https://www.reddit.com/r/computerscience/comments/eqsof6/discussion_college_vs_uni/,0,"One of the main differences from College and Uni computer science courses is that college level courses teach you how to program, while Uni level courses teach you how to program and comp sci theory. For example in college you might learn how to code in Java and how the language works, but in Uni they will teach you that as well as classes like data structures and algorithms which teach how to use efficient algorithms for certain tasks in programming. If you are just wanting to learn how to code college is a good start, but if you want to take more in depth courses Uni would be the place to go. Hope this helps. ",2020-01-19 06:03:07
156,b5qglq,False,General,3,When and why do we use subnet mask?,computerscience,I was told subnet and masking is like using a mask in spray painting. But I guess that makes sense but when would you use it and why?,https://www.reddit.com/r/computerscience/comments/b5qglq/when_and_why_do_we_use_subnet_mask/,9,"As the name implies, it creates sub-networks. All of your computers might be on one big physical network but you can logically divide them into smaller sub-networks that can then be firewalled off or whatever makes sense for operational or security reasons. Put important data in a special protected subnet away from your office machines that browse the internet for example. Makes sure computers in one subnet can't talk to ones in another subnet. It keeps things separated.

A mask is what enables you to tell if a specific computer is on a specific subnet. Computers are identified on the network by IP address (ok technically a MAC address too but let's focus on the IP layer which is where subnetting comes in). Often you see an IP address written as something like 192.168.42.1. but that's the human friendly decimal representation: the ""real"" IP address is in binary, sequence of 1s and 0s. In IPv4 (still the dominant network protocol I think but IPv6 is growing) the IP address is 32 bits so that means 32 1s and 0s are used to give a computer a unique ""name"". Usually the 32 bits are split into 4 8-bit groups called ""octets"" that are when written in decimal. That's why you see 192.168.42.1, each number between dots represents 8 bits so all together is 32 bits.

So how do you make a subnet? Well it makes sense to group IP addresses together based on some of the 1s and 0s being in common. Sort of like having a family name, you and family members like share the same family name but have a different person name (John Doe, Jane Doe are both in the Doe family but have different first names to tell them apart on paper).

So your subnet is kind of like a family name, all the computers on that subnet share the same ""name"" which in the case of binary means they share the same sequence of 0s and 1s at the beginning of their name.

The mask is therefore the thing that tells you which of the 32 bits is the ""family"" name (subnet, like Doe) and which are the first name (computer name on network, like John). The way it does this is that you write out all 32 bits of the IP but you put a 1 in every spot where that bit is part of the family subnet name and a 0 where that bit is part of the computer name. 32 is a lot to type out so let's use an example of an 8 bit IP address. If the first 5 bits are the family subnet name, then the last 3 bits must be the computer name. So the subnet mask is 5 1s representing the subnet + 3 0s representing the computer name = 11111000. If you wrote the binary into decimal, you'd get 248 so you might see the subnet mask written as 248... To make it a little more human readable but really it's the bits that are important.

It's become a lot more common to use CIDR notation instead or writing masks. CIDR is just writing the number of bits that are used for the subnet name, so in our example above of an 8 bit IP address with a 5 bit subnet name, then you'd write the subnet mask in CIDR as just /5. Slash, with number of bits, and you're done.

You could have /8, or /16 or /24 or /27 or whatever you want as a subnet mask. What's the difference between them? Well the bigger the subnet number, the more bits are used for the subnet, which means you can lots more unique subnet names. But there's less bits for unique computer names so you can have less computers on that network. So you need to pick a good subnet mask that allows you to have enough networks to do what you need while allowing enough bits for computer names to accommodate the number of computers that need to be on that subnet. It can be tough to estimate that especially in a rapidly growing company so that takes some thought and experience to get right.

Hope that helps! ",2019-03-26 14:36:24
692,g1zfpm,False,Help,8,Change the text on a button in a Windows program,computerscience,"Hey, I suck at computer science but I do VFX in the program Blender and there's a button in blender that says ""Free Data"" and just because I want to do useless things I want to change the text on that button to ""Liberate Data"" as a joke. Is that even remotely possible?

I'm competent with tech so I can follow more complex instructions it's just that I don't have a computer science background so I can't do this myself. I also didn't find any forums or explanations online so if there's an easy one of those that would be cool, I don't mind.",https://www.reddit.com/r/computerscience/comments/g1zfpm/change_the_text_on_a_button_in_a_windows_program/,1,"Likely not.  Labels for buttons are usually hard coded into the source code, so unless you have access to it and can recompile it, or it uses user accessible resource files to label buttons, which is unlikely, you may have to use a sharpie on your screen to change it. ",2020-04-15 19:56:54
626,he7jio,False,Help,1,Best books/subjects about physics/hardware to understand computer hardware from zero?,computerscience,,https://www.reddit.com/r/computerscience/comments/he7jio/best_bookssubjects_about_physicshardware_to/,4,The Art of Electronics ,2020-06-23 04:00:15
497,diiuj5,False,Article,0,Ways To Leverage The Power Of Big Data To Create Competitive Advantages,computerscience,"Productivity data comes from a set of traditional computing platforms such as PCs, servers, phones, and tablets. Embedded data, on the other hand, comes from a broad variety of device types. the average rate per capita of data-driven interactions per day is expected to increase 20-fold in the next 10 years as our homes, workplaces, appliances, vehicles, wearables, and implants become data enabled - [Don’t Let Data Collect Digital Dust: Leverage The Power Of Information To Create Competitive Advantages](https://blog.panoply.io/dont-let-data-collect-digital-dust) - the article looks at a few approaches that allow you to leverage the power of data:

* Data Visualization
* Smart Data Warehousing
* Big Data and Data Analytics",https://www.reddit.com/r/computerscience/comments/diiuj5/ways_to_leverage_the_power_of_big_data_to_create/,0,,2019-10-16 02:39:49
208,gic172,False,Discussion,61,"I’m a junior CS student and I feel like I’m just an intermediate or even still a beginner programmer, is this normal?",computerscience,"For the first two years of college I’ve wasted my time on gen eds, math classes, and I’ve only taken 5 computer science courses.

Now I’m starting my third year of college. I’m about 55% of the way done. 

I’m worried that when I graduate I won’t have the skill set to actually be a developer. I feel like I know nothing.

I even work at a job doing web scraping and writing custom JavaScript and regular expressions and I still feel like I know nothing. 

Is this normal? I really only know two languages which is JavaScript and python.::",https://www.reddit.com/r/computerscience/comments/gic172/im_a_junior_cs_student_and_i_feel_like_im_just_an/,323,All these people saying they feel like this even after getting a job is pretty sad tbh. Im in highschool and already know alot about python and algorithms self taught. I dont wanna end up like yall lol. ,2020-05-12 14:16:27
504,cjwp2y,False,Article,1,"A new algorithm enables more realistic sound effects in VR: If a character in a virtual environment drops a plate, software can generate that sound at just the right time.",computerscience,,https://engineering.stanford.edu/magazine/article/new-algorithm-enables-more-realistic-sound-effects-vr?utm_source=Reddit&utm_medium=social&utm_campaign=reddit-tests&utm_content=sounds-reddit,22,"Cool, so now my parents can also realistically throw plates at eachother in VR! ",2019-07-30 19:25:05
