Num,ID,is_Original,Flair,num_comments,Title,Subreddit,Body,URL,Upvotes,Comments,creation_date
891,fys6ag,False,Advice,24,is a laptop really required?,computerscience,"Gonna explain myself a bit.

&#x200B;

I'm a freshman at CSE and I'm currently having trouble with deciding whether I should buy a laptop or a tablet. I have a great computer at home capable of handling any task I give it and we have a computer lab that's very cool at my university. But I still feel like I need a device to help me with tasks because notebooks and pen aren't cutting it.

&#x200B;

Some of my biggest concerns:

* The class only have 2 plugs and I spend 8-10 hours a day at the uni so I can't go for used laptops because their batteries may be worn out.
* Some of my subjects require me to send the homework done manually and I feel like a tablet like the samsung tab with S pen would be a significant improvement over scanning all the pages multiple times until it's presentable.
* I have quite the small budget (300$) so I don't know if I'll be able to get a powerful enough laptop at that pricetag.

I might be overreacting in some issues but I really don't know what to look for. So if any of you could help me I would be really grateful!",https://www.reddit.com/r/computerscience/comments/fys6ag/is_a_laptop_really_required/,4,can you program on a tablet?? ,2020-04-11 00:01:08
736,fnc6uq,False,Help,1,Predict javascript Math.random given integers,computerscience,"I am trying to predict javascript's Math.random function given integers.  The Math.random method uses the XorShift128 algorithim which outputs a decimal between 0 and 1.  This can be predicted given the output of three values using this method [here](https://blog.securityevaluators.com/hacking-the-javascript-lottery-80cc437e3b7f).  However, in my case the data we have is 15 integers generated by `Math.floor(Math.random() * (max - min + 1) + min)`.  Whenever I try to recover the original value it is a few hundreths off due to the Math.floor.  This makes it much harder for the script to work and I can't figure out an effective way to do this.  [Here](https://gist.github.com/jgc37/6456222408f17a874bd4bdd8e6923771) is my attempt at modifying the other script, but it currently does not work.  Any help would be appreciated.",https://www.reddit.com/r/computerscience/comments/fnc6uq/predict_javascript_mathrandom_given_integers/,22,,2020-03-23 02:19:04
165,aad767,False,General,5,"After 3 years of programming on a daily basis in React, I've finally come to a point where it is enjoyable to learn new things about React because I understand the underlying methodology of the framework to which I am using.",computerscience,"I've written in a lot of different languages, but settled into React as my main framework for web and mobile applications. I've put in at least 500 hours of coding over the last year in React mainly and have finally come to a point of feeling comfortable with my understanding of how it works. This has created an increase in my enjoyment of learning new mechanics that help me do things more efficiently like using local storage instead of making an api call to a database every time I need to make a change. 

This has led to more efficient code and has revolutionized how I go about creating applications. I am much better at assessing my direction I will use to make my code more fast and more flexible. I look forward to finding an industry job after I graduate with my BS. ",https://www.reddit.com/r/computerscience/comments/aad767/after_3_years_of_programming_on_a_daily_basis_in/,6,"Good stuff man, im glad it's going well for ya. Hoping to say the same in the coming years. Here's to another year of learning and edification: Cheers!   ",2018-12-28 19:04:29
190,8jehkg,False,General,11,How is a barchelor in statistics useful in computer science?,computerscience,I am an undergraduate student in the field of statistics but I plan on getting a MSc in Computer Science. Is there any specialization or area that uses statistics (or something in correlation to that) in this new field so my barchelor won't go to waste?,https://www.reddit.com/r/computerscience/comments/8jehkg/how_is_a_barchelor_in_statistics_useful_in/,0,Google “Data Science”! it’s a bit of a “hot”thing right now.  ,2018-05-14 18:13:03
110,dhx806,False,General,8,written by u/ttvezb & u/McQuillus23 (not very complicated but still proud),computerscience,,https://i.redd.it/4sftk0vnoks31.png,4,Nice ,2019-10-14 21:14:27
674,fke77s,False,Help,17,Best free website for code learning,computerscience,"I am new to the whole coding thing, I’m planning on learning a bit of it during this coronavirus quarantine we are all going through, any recommendations? Thanks in advance",https://www.reddit.com/r/computerscience/comments/fke77s/best_free_website_for_code_learning/,11,I would suggest Udemy it's not free but it's cheap.... You could get a full course for around $13 US dollars ,2020-03-17 22:12:08
820,gf1qsw,False,Advice,21,Student interested in post-graduate study/career in Big Data Machine Learning.,computerscience,I am CS student and I’m trying to narrow down classes to help me learn skills for this field. If anyone is willing to list some general classes/skills or quickly look through my university’s course catalog I would really appreciate it.,https://www.reddit.com/r/computerscience/comments/gf1qsw/student_interested_in_postgraduate_studycareer_in/,48,"Hi from the University of California

Interested in learning more about Computational Social Science? The University of California is offering a Specialization on Coursera that features distinguished professors from all 10 UC campus. The specialization consists of five courses: ""[Computational Social Science Methods](https://www.coursera.org/learn/computational-social-science-methods?specialization=computational-social-science-ucdavis)"", ""[Big Data + A.I. + Ethics](https://www.coursera.org/learn/big-data-ai-ethics?specialization=computational-social-science-ucdavis)"", ""[Social Network Analysis](https://www.coursera.org/learn/social-network-analysis?specialization=computational-social-science-ucdavis)"", ""[Computer Simulations](https://www.coursera.org/learn/computer-simulations?specialization=computational-social-science-ucdavis)"", and a ""[Capstone Project](https://www.coursera.org/learn/css-capstone)"". At the end of the course, students will have web-scraped data from the web, visualized and analyzed their own social network, found hidden patterns with machine learning and natural language processing, and created agent-based computer simulations of artificial societies. If you are interested in learning more, please check out the link to the course page below!

[https://www.youtube.com/watch?v=kXmh90XOPcg&feature=youtu.be](https://www.youtube.com/watch?v=kXmh90XOPcg&feature=youtu.be) ",2020-05-07 07:05:54
978,gc2ca0,False,Advice,0,Something to help me with binary search trees,computerscience,"I understand the concept somewhat but I don’t know how to even begin to implement it in java, is there an easy guide out there that lets you code along with it so that little by little I learn about it. I have a quiz due in two days and can’t even begin to try to code it",https://www.reddit.com/r/computerscience/comments/gc2ca0/something_to_help_me_with_binary_search_trees/,0,,2020-05-02 07:19:53
591,homxwn,False,Help,7,Variable names in C,computerscience,"While I was studying C, there was like an unspoken rule to write variables like this:

>stringName  
busNum  
birthDateMonth

Or basically, start with small letters and succeeding words will have their first letters capitalized. What exactly is this called and is there a counterpart for Java?

Thank you very much!",https://www.reddit.com/r/computerscience/comments/homxwn/variable_names_in_c/,0,"As mentioned, there are many coding styles out there. Every software development shop I've worked in had its own style guide, often slightly different. Also, as languages evolve and communities try to integrate large numbers of software engineers, these ""conventions"" get debated, modified, and mixed up. I'm sure you'll run across lots of code - sometimes within the same project or file - that contains different styles. All I can say is: if you have the opportunity and authority, reformat it, otherwise, roll with it. ",2020-07-10 11:01:20
675,ggfsmv,False,Help,4,Portable python IDE that can also install plugins/frameworks with no admin?,computerscience,"Hi,

Is there a way to get a portable python IDE that can use pip install without needing admin? E.g. something I can put on a usb and bring to any computer and use it there?. I've tried using Visual Studio Code on a usb but it doesn't really work that well.  


Any help will be much appreciated :).",https://www.reddit.com/r/computerscience/comments/ggfsmv/portable_python_ide_that_can_also_install/,1,How about using a bootable USB? ,2020-05-09 13:54:02
332,cadd4e,False,Discussion,55,How do you balance sitting on a computer as a job to living a healthy life?,computerscience,"Im about to start my first year of my cs degree but i've been feeling low energy recently and attribute most of it to how often I use the computer, its making me worried about how I will be in the future as a career. So how do you manage between a healthy lifestyle and comp sci as a job?

&#x200B;

Also not looking for any ""I dont"" answers, thanks!",https://www.reddit.com/r/computerscience/comments/cadd4e/how_do_you_balance_sitting_on_a_computer_as_a_job/,126,"What I do is I take martial arts class, and go running on the weekends. Also my job has desks that can go from standing desk to sitting by pressing a button.  The classes are good because its  a commitment, I have classes the days I have classes and I don't miss them for nothing. ",2019-07-07 23:12:13
693,gp4nn2,False,Help,0,Need help regarding quadratic probing in hashtables,computerscience,"So I was reading about implementations of hashtables and in the ""array"" implementation,I came about the quadratic probing .There was a statement claiming that the distinct no.of probes which will occur are (hashsize+1)/2....I am not able to comprehend this proof .Can someone explain the proof to me?You would be a lot of help....",https://www.reddit.com/r/computerscience/comments/gp4nn2/need_help_regarding_quadratic_probing_in/,1,,2020-05-23 13:09:43
257,grht8f,False,Discussion,5,CS Software engineer Salaries,computerscience,"Is there any conceivable reality where you can end up poor having a bachelor of CS and having adequate savings skills? Is it at all a hit and miss field, from what i gather the job security in our sector is very stable. Just wondering whether the information matches reality. Thanks team.",https://www.reddit.com/r/computerscience/comments/grht8f/cs_software_engineer_salaries/,0,Near entirely dependent on location as with all things ,2020-05-27 11:13:29
669,gtpcpi,False,Help,0,I have a question about tools to track my time for coding questions,computerscience,"I've been practicing coding technical questions on different platforms (Leetcode and HackerRank). I've found my approach and the time it takes has been inconsistent with my experiences in actual interviews.

1. Are there any guidelines on the process of answering these questions? (Time breakdowns for formulating an algorithm, test cases, time analysis, code, and final review)
2. Are there any tools (app or chrome extension) to track my performance/time while I practice answering questions on the coding platforms?

I want to simulate the process of problem-solving coding questions in technical interviews outside of mock interviews. Just practicing the coding technical question is not enough for me, as it is easier to solve the questions without any pressure. 

Thanks in advance!",https://www.reddit.com/r/computerscience/comments/gtpcpi/i_have_a_question_about_tools_to_track_my_time/,2,,2020-05-31 00:35:52
158,bld0ws,False,General,3,"Was doing an a level paper for computing and this was the 9 marker, ffs",computerscience,,https://i.redd.it/qacdfcz5slw21.jpg,2,"Yeah, when I did A Levels I found they like to squeeze a lot of ethics onto the curriculum, both for Computing and Computer Science. This question is a really poor attempt at assessing that. ",2019-05-06 14:43:10
602,hfjcbp,False,Help,5,What are the sequential Programming Languages?,computerscience,"Dear Experts, Novice Here,  What are the sequential programming languages, One of my course requires to know one of the sequential programming language . Is Java a sequential programming language? What about python? Thanks

&#x200B;

https://preview.redd.it/5myl69yt12751.png?width=651&format=png&auto=webp&s=432058b706c1c28a8bf7d5f520f43c3c859b91bb",https://www.reddit.com/r/computerscience/comments/hfjcbp/what_are_the_sequential_programming_languages/,0,What is a sequential programming language? ,2020-06-25 09:47:23
462,d5y8hf,False,Article,16,IBM will soon launch a 53-qubit quantum computer – TechCrunch,computerscience,,https://techcrunch.com/2019/09/18/ibm-will-soon-launch-a-53-qubit-quantum-computer/,179,What have these things actually computed? ,2019-09-18 14:02:32
281,guhqad,False,Discussion,0,Explain Networking b/w devices like I’m five.,computerscience,,/r/compsci/comments/gu8woa/explain_networking_bw_devices_like_im_five/,0,,2020-06-01 09:50:19
604,gzrpbr,False,Help,8,Free online computer Science courses,computerscience,"I don’t know if this is the right sub to ask this so apologies in advance. 

So i am a high school student who just completed AP computer Science A. I am looking to major in cs in college and i wanted to learn and code more before I go off to college. 

So I was hoping to to take a free online computer science course(s) this summer to build upon my skills i have already learned. And I dont know where to start. 

So if anyone has any ideas on free online classes or courses i can take, it would be greatly appreciated!",https://www.reddit.com/r/computerscience/comments/gzrpbr/free_online_computer_science_courses/,3,Harvard's CS50 is by far one of the best online courses I've come across. I highly recommend it https://www.edx.org/course/cs50s-introduction-to-computer-science there's an AP version of it as well. There's a great FB community that is a great help for finding other resources. I'd totally recommend it over any others (I've done dozens of online courses throughout the years and completed a good handful) and can tell you that this is the ONE to do. ,2020-06-09 17:28:21
783,hltdtq,False,Advice,41,What are some interesting areas for a CS masters project that are not at all related to AI or Data Science?,computerscience,"I'm doing my masters in CS with a non-CS undergrad and trying to plan what to do for my masters project. Right now AI and ML seem to be all the rage but they're honestly not my cup of tea. I'm interested in computer networking(socket programming etc.), I liked my DS&A class a lot and I'm interested in low level stuff(C, ASM, OS, etc.) but I'm not sure what I can do with all that or if there are other areas of the subject that I haven't considered that are popular in industry right now. 

What do you think are some good subfields of CS for a masters capstone project?

Update: Thanks everyone for all your advice and suggestions! Please keep 'em coming!

So far the areas that you guys have mentioned that I'm looking at are:

*Distributed Computing

*Combinatorial Optimization

*Programming Languages

*Etherium/Blockchain",https://www.reddit.com/r/computerscience/comments/hltdtq/what_are_some_interesting_areas_for_a_cs_masters/,127,There’s a lot of cool opportunities for optimization and mathy/algorithmic world in graphics ,2020-07-05 20:16:41
725,fe31ut,False,Help,12,Where to begin for starting a small coding project?,computerscience,"Hello everyone! I'm a a noob to computer science; switched to the major not too long ago and have honestly struggled through the classes but will manage to finish my degree soon.

In my experience, the way that they taught the classes and concepts were all in different coding languages- every semester we learned a new language, from C to C++ to OCaml to Java and so on. I feel like I was just trying to cram and keep up with classes, which caused me to lack the depth in each language since I was just trying to pass the classes (stacking like 4 CS classes each semester) so I could graduate on time. The lack of depth hits hard when I'm faced with simple tasks like creating a simple program to do \_\_\_ or coding challenges that are open ended.

All the projects that I've done is through my classes- no internship, no side projects- and the projects that I've done have mostly been really small ones with a lot of help and backbone code provided to the students. The projects also lacked application to the real world and were simply stuff that taught us like algorithms and operating system concepts.

I want to start doing side projects and honestly have no idea where to start! I only have experience with the basic computer science concepts and don't know much about JavaScript or web programming, which I wish my school offered as part of my track. The other part that is annoying is that my school taught the classes on their computers with all the proper libraries and tools installed. I want to be able to create my own project on my own device (Mac) and to be able to create a project that users can interact with and run, and don't even know where to begin.

Does anyone have tips for how to start a small project? What languages are useful for doing web programming? What are good places to host the project and be able to see the results?

Any tips would be great!! I'm a such a noob in this industry and I feel like I am lacking compared with everyone else.",https://www.reddit.com/r/computerscience/comments/fe31ut/where_to_begin_for_starting_a_small_coding_project/,3,"Hey Man,

I felt the same way in first year but I was able to get the right guidance, and was able to build a couple amazing web applications which acquired users and landed me my first job... here is what I recommend.

Start off with Web Development, specifically look into the MERN stack (Mongo, Express, React, Node). This is an industry standard stack and employers love seeing it.  To learn this what I recommend.

&#x200B;

1. Udemy (Node with React: Full Stack Web Development -by Stephen Grider)
2. This course legit was a blessing and helped me out so much
3. Follow along with the course, but try doing a few things different, veer off and experiment! Don't just copy and paste, but understand through application!

If udemy isnt your thing there are many you tube tutorials out there for the mern stack, so start with that. The rest is all up to you! ",2020-03-05 22:07:23
950,gmijyq,False,Advice,0,Advice for Masters/Grad School,computerscience," 

Purdue University, **CS major with GPA 3.64 and CS GPA 3.12**, finished my junior year and graduating May 2021

Cuz of this pandemic, as an Internatonal student, I'm starting to give up on the idea of getting a full time job when I graduate. So, thinking of going to grad school for CS

Any suggestions on what could I do, or what schools should I target (safe) considering I don't have much time

it'd be good if I could find schools offering **financial assistance in any form**

I'm thinking of applying for **ML and AI**

Should I retake classess to improve my CS GPA?",https://www.reddit.com/r/computerscience/comments/gmijyq/advice_for_mastersgrad_school/,0,,2020-05-19 05:36:30
560,692rbr,False,Article,0,Tech Jobs in Non-Tech Hubs,computerscience,,https://www.paysa.com/blog/2017/05/03/tech-jobs-in-non-tech-hubs/,28,,2017-05-03 19:58:24
323,f7k499,False,Discussion,4,Are you worried about the computer science market becoming saturated?,computerscience,,https://www.reddit.com/r/computerscience/comments/f7k499/are_you_worried_about_the_computer_science_market/,0,"Computer Science is a field of research, but we get what you are saying. Tech is the future. Everybody wants in with IT and software engineering. That's why it is good to build a portfolio so one can stand out. Passion is what drives our pursuit with technology I feel. ",2020-02-21 23:52:50
586,hq8g1w,False,Help,9,i know NOTHING about computer science - but want to get into,computerscience,"when i say nothing i mean i have a macbook, by choice and i can’t even figure out how to work boot camp 

what are some books that’ll help me start from the beginning with the basics??",https://www.reddit.com/r/computerscience/comments/hq8g1w/i_know_nothing_about_computer_science_but_want_to/,6,I used udemy just to have a structured environment. ,2020-07-13 04:03:56
505,decljc,False,Article,0,Designing Data Intensive Applications - Book Review,computerscience,,https://hatem-hassan.com/blog/Designing-Data-Intensive-Applications-Review/,1,,2019-10-07 01:24:20
509,d5i9ut,False,Article,0,What a little more computing power can do,computerscience,,http://news.mit.edu/2019/what-extra-computing-power-can-do-0916,2,,2019-09-17 15:05:23
217,hhaom0,False,Discussion,11,Why is c++ taught in University?,computerscience,"Hey so I'm learning JS and I have a fairly good grasp of the basics, however, my dad, (who is a senior software developer) said that I should learn C++ first. So I did a quick search and I found out the school I'm gonna be enrolling in for shs teaches C++ in their programming club (which I'm going to join). Anw point being, should I listen to ny dad's advice and take up C++ and take a break from JS for a while? Also, why is it still being taught in Computer Science degrees when languages like Javascript and Python are more widely used? Thanksss

Reposting here because there are more people in this subreddit.",https://www.reddit.com/r/computerscience/comments/hhaom0/why_is_c_taught_in_university/,0,"Because C++ is super cut and dry on data types! Also, C++ is nicely structured, with every tool a programmer could possibly need. It provides reliability, as well as visualization. ",2020-06-28 08:03:08
663,gpwk3s,False,Help,3,Why is this time complexity O(total*n)?,computerscience,"Namely I'm having trouble understanding why at worst case that blue part runs (total\*n\*2+1) steps. The video this screenshot is from: [https://youtu.be/nqlNzOcnCfs](https://youtu.be/nqlNzOcnCfs). Thanks in advance.

https://preview.redd.it/v0dwp6lwsr051.png?width=1144&format=png&auto=webp&s=f2bb9941e22c5e6309599ab84ad7e27531bab4f9",https://www.reddit.com/r/computerscience/comments/gpwk3s/why_is_this_time_complexity_ototaln/,1,"Using memoization, with the key as ""total:i"" the max amount of keys is total*n since i <= n. The memo table could only be filled after total*n calls. In the hypothetical worst case, the final ""else:"" block would be called for each key and each call would envoke two calls to dp. That gives you total*n*2 so far. And I am assuming the +1 is added to account for the initial call to do from the other function. 

Since big-oh is an upper bound, this worst case must be considered. Also in big-oh notation the lower order terms, such as +1, and the constants, *2, are ""dropped out"" which is why it is O(total*n). ",2020-05-24 20:16:56
729,g93jg9,False,Help,0,What skills do I need to learn to do these magical stuffs?,computerscience,"Hello, I am an amateur animator from Bangladesh and always wanted to be. But recently I am feeling that I have always wanted to create the algorithms of animation and simulation rather than actually animating. For example, in this video, this talented person creates an AI to compute cloth simulation. He has also made videos about fluid simulation and stuffs. My question is what particular skills do I need to develop to create simulations that will help art? 

 [https://www.youtube.com/watch?v=atcKO15YVD8](https://www.youtube.com/watch?v=atcKO15YVD8)",https://www.reddit.com/r/computerscience/comments/g93jg9/what_skills_do_i_need_to_learn_to_do_these/,0,,2020-04-27 16:05:31
23,f7prc6,False,General,44,How the computer industry changed in 55 years!,computerscience,,https://i.redd.it/vlam2iwtofi41.jpg,1430,What will computers look/ram/memory will be in 2090? Nvm I’ll be dead before then.. ,2020-02-22 08:13:32
297,g8797t,False,Discussion,3,Will machine learning or AI eventually replace all jobs including software engineers?,computerscience,Opinion: How likely is it that Ai will take over even the most human jobs like programming?,https://www.reddit.com/r/computerscience/comments/g8797t/will_machine_learning_or_ai_eventually_replace/,0,"Not all jobs.

I do believe that if AI is advanced enough it can grow exponentially, but it would still lack human ingenuity. ",2020-04-26 03:28:19
607,hrhkrw,False,Help,1,Best resources to learn Data Structures and Algorithms?,computerscience,"Hello World! Can anyone tell me some best free resources to learn DSA.
YouTube playlists if possible,
Online courses,
Online articles/tutorials
(In Python or JavaScript if possible)",https://www.reddit.com/r/computerscience/comments/hrhkrw/best_resources_to_learn_data_structures_and/,1,I feel that data structures are something that is independent of the programming language. I would suggest just doing leetcode ,2020-07-15 05:09:41
643,hdz3wx,False,Help,1,Do you have any advice from articles on CS to read?,computerscience,I just joined the CS course and I want to read the most important articles on the topic! can you recommend me some?,https://www.reddit.com/r/computerscience/comments/hdz3wx/do_you_have_any_advice_from_articles_on_cs_to_read/,0,[Dancing Links](https://arxiv.org/abs/cs/0011047) by Prof. Donald E. Knuth ,2020-06-22 19:34:02
