Num,ID,is_Original,Flair,num_comments,Title,Subreddit,Body,URL,Upvotes,Comments,creation_date
483,e3ja9x,False,Article,0,Designing Distributed Cache - Part I | Google/Facebook/Amazon/Netflix System Design Interview,computerscience," Hello all,

This is the first part of my two part video tutorial on designing a distributed cache. Please let me know your feedback.

[https://www.youtube.com/watch?v=tzsOc-hBPfw](https://www.youtube.com/watch?v=tzsOc-hBPfw)

Thanks.",https://www.reddit.com/r/computerscience/comments/e3ja9x/designing_distributed_cache_part_i/,3,,2019-11-29 19:14:26
903,fpeyis,False,Advice,20,"My high school requires a ~40hr project for all seniors to complete, any topic. I completed AP Comp Sci A and can pick up new material fairly well. How feasible is it for me to build an AI that moves a ball past an obstacle course (avoiding walls, basically)? I have about 2 months.",computerscience,"Title. Excuse my naivety if this is absurdly difficult, I am trying to get a picture for how feasible a machine learning project is for me to complete. Or perhaps this is simple relative to a 2 month, \~40hr project. I don't know. But the hours are self-logged and include any time I spend researching  and learning what I need for the project. 

If you happen to know a little about this, what language would you recommend I take this up in?",https://www.reddit.com/r/computerscience/comments/fpeyis/my_high_school_requires_a_40hr_project_for_all/,20,"You have a great high school. And if you're in the united states, may I ask which high school is this? ",2020-03-26 16:52:38
967,fwf33m,False,Advice,6,"Why are ""automate"" programs typically in Python?",computerscience,"Hi guys, I'm a beginner in Java, I starting learning it about 2 months ago and can do a lot of basic tasks, but I've never been able to any fun personal projects with it. I have been getting videos in my Youtube recommended about web automation such as videos on how to link Youtube videos to Spotify, how to make instagram bots and how to automate Tinder. I don't know Python and so I hoped that there would be similar videos for Java, but there were really none. Why is this? And do I need to learn Python to do fun programs like these or are they easily made on Java as well?",https://www.reddit.com/r/computerscience/comments/fwf33m/why_are_automate_programs_typically_in_python/,0,It's because it's a dynamically typed scripting language with a lot of built in data structures and libraries with a decent REPL. Automated programs are usually written in a scripting language and python is the goto language these days. Used to be Perl5 for the same reasons above. Before that it was bash (and still is for simple automata.) ,2020-04-07 05:53:56
520,bmdtsk,False,Article,0,Understanding Unicode better,computerscience,,https://live2makeblog.wordpress.com/2019/05/09/a-study-on-unicode/,8,,2019-05-09 01:38:06
628,hj7r7h,False,Help,0,"How do I do this!? Design for Gallery/Saved Images: A gallery-like design should be made for the saved images . Super new to this, please help me out?",computerscience," 

Also my mentor didn't even mention if we got to use Android Studio? and whether we need to use ListView or RecyclerView?  
I am literally too nervous to ask him because this is my first SERIOUS internship

Again the task is : Design for Gallery/Saved Images: A gallery-like design should be made for the saved images",https://www.reddit.com/r/computerscience/comments/hj7r7h/how_do_i_do_this_design_for_gallerysaved_images_a/,1,,2020-07-01 10:33:31
205,gxzdej,False,Discussion,76,Movies about CS?,computerscience,I’ve seen The Imitation Game. Any other movies like that one?,https://www.reddit.com/r/computerscience/comments/gxzdej/movies_about_cs/,117,"Swordfish, obviously. Aren't you forgetting something? Before you can access the secure cluster you have to find a terminal on the backbone of the network. ",2020-06-06 21:25:54
239,gc2r3v,False,Discussion,15,Let's discuss!!! Found this on a random post in LinkedIn,computerscience,,https://i.redd.it/oaifx0y66bw41.jpg,20,Utkarsh Sharma - an intellectual ,2020-05-02 07:59:50
188,91s6j7,False,General,2,5 ways the world’s fastest supercomputer could change the world,computerscience,,https://www.nbcnews.com/mach/science/5-ways-world-s-fastest-supercomputer-could-change-world-ncna883766,12,"fukin clickbait, get this out of here ",2018-07-25 14:12:57
259,gq6zja,False,Discussion,3,What happens to softwares written in deprecated versions of languages like Python 2 got deprecated in Jan 2020? Will they need to upgrade their complete codebase to Python 3 no matter how huge the codebase is?,computerscience,,https://www.reddit.com/r/computerscience/comments/gq6zja/what_happens_to_softwares_written_in_deprecated/,3,"They just change the requirement ""needs an up to date version of python 2"" to ""Needs an version of python 2"".

Rewriting software is expensive. ",2020-05-25 08:03:20
24,fr4dmn,False,General,12,[Source code with demo] Here is my python implementation of Deep Q-learning for playing Tetris,computerscience,,https://i.redd.it/t8pin9ceilp41.gif,603,C++? ,2020-03-29 11:17:21
428,gr91uy,False,Article,0,Understanding & Implementing Shape Detection using Hough Transform with OpenCV & Python,computerscience,"Hi all,

Here is an article I wrote ""Understanding & Implementing Shape Detection using Hough Transform with OpenCV & Python"".

Read it on medium

[https://medium.com/livecodestream/understanding-implementing-shape-detection-using-hough-transform-with-opencv-python-cd04346115c0](https://medium.com/livecodestream/understanding-implementing-shape-detection-using-hough-transform-with-opencv-python-cd04346115c0)

Or if you don't have a medium account on my website

[https://livecodestream.dev/post/2020-05-26-hough-transformation/](https://livecodestream.dev/post/2020-05-26-hough-transformation/)

&#x200B;

Thanks",https://www.reddit.com/r/computerscience/comments/gr91uy/understanding_implementing_shape_detection_using/,3,,2020-05-27 00:20:13
34,gnpfr8,False,General,4,What should I know as a freshman Computer Science major?,computerscience,"In the fall, I’m starting college and I plan to major in computer science. Obviously the whole point of higher education is to learn more, but I’m curious as to what I should know before showing up on campus. I’m pretty fluent in Java, and I can write things in C if I really have to. I don’t really know anything about frameworks or APIs but I’m eager to learn more. Thats pretty much the extent of my knowledge, so I hope some of you can suggest some thingsI can do or resources I can study to prepare myself over the summer. Thanks!",https://www.reddit.com/r/computerscience/comments/gnpfr8/what_should_i_know_as_a_freshman_computer_science/,2,"I didn't know anything about coding when I started my degree. 4 years later I have graduated with honours and have a full-time job. So I think you are already well prepared. As the others mentioned, do not be overwhelmed and take things one at a time. Do not snob math, especially if things like Machine Learning/AI sound interesting to you. As for tutorials and resources recommendations, i would say that it is not so much about what you study but what you do with it. It is more beneficial to code sth from scratch no matter how small, than to watch a lengthy tutorial and just copy the commands. ",2020-05-21 03:32:47
216,he4joh,False,Discussion,7,"After making a rare diagnosis that he hasn’t seen in years or maybe ever, a doctor feels proud to have remembered the symptoms and to have used the full extent of his knowledge. What is the CS equivalent of making a difficult, rare diagnosis?",computerscience,,https://www.reddit.com/r/computerscience/comments/he4joh/after_making_a_rare_diagnosis_that_he_hasnt_seen/,7,Diagnosing a subnetting error in a hyper tree topology network ,2020-06-23 00:42:44
44,ejwk2d,False,General,51,How programming languages got their names,computerscience,,https://i.redd.it/5piswsrtir841.jpg,855,Python is python because this language of web integrations and scripts. It's like a snake creeping through web ,2020-01-04 13:20:18
77,frjspb,False,General,0,Survey of CS/Math/EE grads or professionals,computerscience,"This 3-5 minute survey is for individuals with an undergraduate degree in computing, mathematics or electrical engineering and/or enough professional experience (2+ years) in those fields to potentially qualify them for admission to an online graduate degree program in Computer Science. The purpose of this survey is to research causes for the low representation of women and minorities in the Online Master of Science Computer Science program at GaTech. The survey asks a series of personal questions and should take less than 5 minutes. If at any time you do not wish to continue with the survey you may close it and your answers will not be recorded. Your survey responses will be kept entirely confidential and will be reported only in aggregate. Your help in providing this vital data is greatly appreciated. If you consent to participate, please click the link below and 'Submit Your Responses' when you have finished.

[**http://peersurvey.cc.gatech.edu/s/926569cfd4ed4161aa211f11b5f9ed8e**](http://peersurvey.cc.gatech.edu/s/926569cfd4ed4161aa211f11b5f9ed8e)",https://www.reddit.com/r/computerscience/comments/frjspb/survey_of_csmathee_grads_or_professionals/,2,,2020-03-30 03:56:35
695,gbdlyl,False,Help,2,Want to to take a course on mobile apps. Flutter? Swift?,computerscience,"I’m on Mac and have an iPhone so swift will be fine, but nowadays what is the leading language/software for mobile apps? 
Any other recommendations other than flutter and swift?",https://www.reddit.com/r/computerscience/comments/gbdlyl/want_to_to_take_a_course_on_mobile_apps_flutter/,1,"React Native is a powerful alternative. Companies, such as Facebook and Uber use it. It is essentially a way to build native applications using JavaScript and CSS, which is waaaayyy easier to use than Swift or Flutter imo. ",2020-05-01 07:19:13
541,a34l5w,False,Article,1,Network analysis finds 'The Wizard of Oz' to be the most influential movie of all time.,computerscience,,https://arstechnica.com/science/2018/12/study-finds-the-wizard-of-oz-is-the-most-influential-film-of-all-time/,3,"Abstract 

The success of a film is usually measured through its box-office revenue or through the opinion of professional critics; such measures, however, may be influenced by external factors, such as advertisement or trends, and are not able to capture the impact of a film over time. Thanks to the recent availability of data on references among movies, some researchers have started to use citations patterns as an alternative method for ranking movies. In this paper, we propose a novel ranking method for films based on the network of references among movies, calculated by combining four well known centrality indexes: in-degree, closeness, harmonic and PageRank. Our objective is to measure the success of a movie by accounting how much it has influenced other movies produced after its release, from both the artistic and the economic point of view. We apply our method on a subset of the IMDb (Internet Movie Database) citation network consisting of around 47,000 international movies, and we derive a list of films that can be considered milestones in the history of cinema. For each movie we also collect data on its year of release, genres and countries of production, to analyze trends and patterns in the film industry according to such features. We also collect data on 20,000 directors and almost 400,000 performers (actors and actresses), and we use the network of references and our score of movies for evaluating their career, and for ranking them. Since the IMDb dataset we employ is highly biased toward European and North American movies and personalities, our findings can be considered relevant principally for Western culture.

Lunk to the study:
https://appliednetsci.springeropen.com/articles/10.1007/s41109-018-0105-0 ",2018-12-04 20:35:54
346,dl57eq,False,Discussion,7,What kind of projects have those of you in the computer science/ software engineering field worked on?,computerscience,I’m curious what projects/ coding those of you in the computer science/ software engineering field have been assigned to work on. Feel free to share anything else that might be related. Thanks!,https://www.reddit.com/r/computerscience/comments/dl57eq/what_kind_of_projects_have_those_of_you_in_the/,13,"Worked on the Top Golf game software, Telemedicine/Video Streaming software, built prototypes (web apps, mobile apps, backends) for a holding company that had a bunch of hardware and software products/data we could tap into in the automotive industry, built an API gateway with authentication/authorization, rate limiting etc for a real estate saas company along with an API for their mobile team, and have worked on a product for connecting healthcare systems so they can book appointments into each other's  patient management systems. ",2019-10-21 19:04:17
757,fq6raa,False,Help,0,[Question] ER diagram: Each individual hospital checks on process of patient treatment using Aggregate ?,computerscience,"Hey folks,

I am currently working on an [ER diagram](https://imgur.com/a/QUUyjXH) for a virus database, including tables for virus, associated viral disease, doctors, hospital, citizens.

Now I was curious on how I would be able to create map that each individual hospital is checking up in their own hospital how the process of treatment is going on each citizen/patient. I thinking of using an aggregation, but I am unsure on how this can be implemented in this specific scenario.",https://www.reddit.com/r/computerscience/comments/fq6raa/question_er_diagram_each_individual_hospital/,2,,2020-03-27 21:55:20
306,g8v5l7,False,Discussion,0,Alarm Script Hypothetical,computerscience,"If I set an alarm on my computer to go off some time in the future, would the program need to check the time for every minute (or second) to determine if now is the correct time to enable the alarm? 

In this logic, if I increased the precision of my alarm’s ‘trigger time checker’ to the length of time for the CPUs clock cycle, couldn’t I hijack all other processes with my simple alarm program?",https://www.reddit.com/r/computerscience/comments/g8v5l7/alarm_script_hypothetical/,0,,2020-04-27 06:24:15
177,9xkomh,False,General,5,Computer Science audio book recommendations for beginners!,computerscience,"Hi, 

I'm a second year uni physics student and as part of our course we've been learning how to use python to do data analysis and solve problems for us and I've been really enjoying it and not having had the option to do computer science at school I feel like I'm missing out on a lot of the theory and background to what I'm doing and why I'm doing it, and would like recommendations for audio books because I've got a long walk to uni that cover the general topics of computer science. Something like 'A brief history of time' by steven hawking but for computer science.

Hope this makes sense, thanks for any suggestions!",https://www.reddit.com/r/computerscience/comments/9xkomh/computer_science_audio_book_recommendations_for/,3,"I don't know if there's an audiobook for Code by Charles Pettzold, but it's good enough to recommend anyway. ",2018-11-16 09:25:34
135,aams9u,False,General,15,Font that is scientifically designed to help you remember your study notes.,computerscience,,http://sansforgetica.rmit/,114,Doesn't exercise the actual parts of your brain that help you remember... ,2018-12-29 17:00:31
256,fjzo4s,False,Discussion,15,"Google's new logo be only 305 bytes, while its old logo is 14,000 bytes",computerscience,,/r/computersciencehub/comments/fjznkh/googles_new_logo_be_only_305_bytes_while_its_old/,199,Nice ,2020-03-17 05:16:27
534,8r19d1,False,Article,4,Computers Inspired by Your Brain,computerscience,,https://medium.com/@corlettnovis_82477/new-computers-inspired-by-your-brain-415df3cd5519,20,So basically the bits are influenced by serial values instead of a binary value? ,2018-06-14 11:58:31
176,b36r7e,False,General,2,"Got to listen to Google Engineer, Award Winning Robotics/Coding Expert and Assistant Professor James McLurkin!",computerscience,,https://i.redd.it/tujbtofmv6n21.jpg,0,Maybe this is the wrong sub  ,2019-03-20 02:58:35
486,e1iwpc,False,Article,0,10 Visualizations Every Data Scientist Should Know,computerscience,,https://towardsdatascience.com/10-viz-every-ds-should-know-4e4118f26fc3,0,,2019-11-25 17:02:49
926,gl8tdq,False,Advice,1,"What would you tell yourself, if you have a chance to go back to the time when you have just started your CS major?",computerscience,"What is up guys. Let me introduce a little about myself. I'm an A level graduates and now I'm going to study a degree in computer science. Why I want to study computer science? Some people would say its going to get you a ""future"" job, or you can get "" 6 figure"" salary, or "" I don't know what to study so I study  CS"" . Yeah, all of these seem to be correct but I am neither one of them. I am not feeling that I'm better or smtg, in fact, its just that I rarely hear this reason from who study CS. I study CS simply because I really love the satisfaction of solving complex problems and spending hours thinking logic  of that  algorithm, just that simple. I never enjoy this kind of satisfaction in any of other subject area before. When I was junior in primary and high school, everyone sees that engineering, lawyer, accountant and doctors are good job, but, this just leaving me behind not knowing what to do. I follow everyone to study in science stream during high schl( bio math add math phys and chemistry are main subjects) in order to have more options in the future. Looking back, I was always choosing a safest choice. (being a student in Asia country, somehow we are expected to be good in everything)

Eventually I've graduated from my uni after struggling and Studying stuff I don't really like for years. And I've got an average result at my schl(A+, As, Bs) that allow me to study A level afterwards. The first dya I've got into A level, the very first class of CS, I've no idea what CS is, I choose CS SIMPLY because I don't know what to study at that moment. The first term I've got an C in my exam, I started to wonder if it's correct for me. All people around me typing at a GOD LEVEL speed which I still need to look for the key before I can type it. However, With days and nights staring at stackoverflow and youtube channels I manage to get a not exceptional, but I consider a decent grade for A level with 89 marks after all.

To be honest, I think I study CS simply becuz it's like a fun game for me. In Asia, everyone is so focus on the career prospects and how much we can earn in the future. Whatever I've learned in A level was just a very basic level of python programming and introduction. Now, I've chosen a not famous uni to study CS instead of A qs Ranking top 15 Uni to study smtg that I'm less interested in. I seems to be irresponsible for myself, my family and everyone supported me. 

I am looking for suggestions, great opinions from yall. Just let me know what you think about my situation, or what you would like suggest me as I still have 3 months to sharpen my tech skills before I get into uni.

I'm neither a genius nor a smart guy, I don't even know whether I'm suitable to study CS or not. I choose it as I ""feel"" so much better when I study it. It simply require less memorization and more logic thinking. So yeah, let me know what you think. 

For those who spend even only a sec seeing and reading this post, Thank you. Have a nice day.",https://www.reddit.com/r/computerscience/comments/gl8tdq/what_would_you_tell_yourself_if_you_have_a_chance/,5,"Still got a year or two left, depending if I go for hons degree, I do it because it because it feels right, I think, I don't think about my perfect career anymore, I feel like a part of my life that is just okay. Although I worry about going into next academic year, weve done no mathematics classes so far through the course and ill be thrown in the deep end with intelligent systems, algorithms, ds etc ",2020-05-17 04:00:08
393,c5jede,False,Discussion,8,What’s the best beginners language in ur opinion?,computerscience,,https://www.reddit.com/r/computerscience/comments/c5jede/whats_the_best_beginners_language_in_ur_opinion/,0,"I truly believe javascript is the best just because you can start making functions and defining variables really quickly. I like to look at it like the piano of programming languages because you can start throwing things up pretty quickly. After you learn loops and how to make classes and dip into algorithms, I would start looking into a language like C or C++ to see what's really going on under the hood. I wish I started that language sooner. ",2019-06-26 02:02:31
22,hal96d,False,General,2,Lecture#1 - Introduction to the Course | Programming Fundamentals,computerscience," 

In reference to my last post: [https://www.reddit.com/r/csMajors/comments/h9wcb6/productive\_summer\_plan\_free\_youtube\_courses/](https://www.reddit.com/r/csMajors/comments/h9wcb6/productive_summer_plan_free_youtube_courses/)

I finally launched my first lecture of the CS101 - Programming Fundamental's course. I would appreciate some honest feedback so I may improve the quality of my delivery (I've got some regarding how my tone should be more excited to teach).

Lecture 001 - Introduction to the Course: [https://youtu.be/1Rb4vsSe9Dc](https://youtu.be/1Rb4vsSe9Dc)

Again, this is a course that will teach you how to think and code problems using the C programming language, and its a course for students starting out their journey in Computer Science, or students that are weak at building logic.

Subscribe to the channel for more upcoming videos of this course.

The next lectures will focus on the following: Computer basics, Introduction to Flowcharts, Solving basic problems w/ Flowcharts, Building a Calculator using a Flowchart, Assignment #1",https://www.reddit.com/r/computerscience/comments/hal96d/lecture1_introduction_to_the_course_programming/,5,I am expecting great things from your channel. Looking forward to the first lecture on the course. ,2020-06-17 05:51:06
705,gjbpla,False,Help,1,What school should I go to for computer science (in cyber security) in Michigan?,computerscience,"I’m currently at Mott for my general classes and I’m planning on transferring to a school with a good program, any suggestions?",https://www.reddit.com/r/computerscience/comments/gjbpla/what_school_should_i_go_to_for_computer_science/,0,"Michigan Tech just started up a proper cybersecurity course in the past couple years. Seems to be a good mix of CompSci and IT related things, based on what I've heard. ",2020-05-14 00:38:51
313,e7pgcs,False,Discussion,16,Foundational books about Comp Sci,computerscience,"What would y'all say are some of the fundamental quintessential books every person in CS must read?

Edit: wording",https://www.reddit.com/r/computerscience/comments/e7pgcs/foundational_books_about_comp_sci/,56,Currently wrapping up CS50 and I'm reading **Computer Science Distilled** as a primer for my CS degree in 2020. Afterwards I might look at SICP. ,2019-12-08 04:48:56
925,gj4z0b,False,Advice,3,Computer Engineering or Computer Science,computerscience,"If I chose computer engineering over cs is anything going to be different in terms of employment, job types and what are the pros and cons of it?",https://www.reddit.com/r/computerscience/comments/gj4z0b/computer_engineering_or_computer_science/,1,"I think CS is more suitable if you go for academy, while CE is more suitable if you plan to join industry, especially the one that deals with machinery. ",2020-05-13 18:45:23
495,dna1or,False,Article,0,Interesting Coding problems,computerscience,"Hey guys, this is our group's first blog containing a couple of competitive questions.
I'm sure it will be interesting.
Make sure to check it out, and leave your claps.

https://medium.com/@harikumar20112000/cracking-the-code-ca398240a03d




>!P.S. Our professor has assured us that we would get movie tickets if we get claps more than 150 people. So please help us win guys! 😁!<",https://www.reddit.com/r/computerscience/comments/dna1or/interesting_coding_problems/,1,,2019-10-26 06:14:15
885,gzujih,False,Advice,2,What is the best way to teach and disseminate tribal knowledge?,computerscience,"My company has run on a lot of tribal knowledge for years. I've been able to finally break down some of those walls and get control and info out to more than just one or two people, but there is still a lot more.

My boss is at the point where he needs to focus more on management and administrative tasks and needs to reduce focus on code. What has work for other people to most efficiently teach others and disseminate information to coworkers?",https://www.reddit.com/r/computerscience/comments/gzujih/what_is_the_best_way_to_teach_and_disseminate/,1,[Oral Tradition in Software Engineering](https://youtu.be/4PaWFYm0kEw) ,2020-06-09 19:48:36
702,gkt69s,False,Help,0,Sites,computerscience,"Hello guys, 

I'm an aspiring AI developer with not a lot of money. I was wondering if anyone knows any good free website where I can improve my maths and learn to program/code. I think a lot of people can benefit from this. 

Thank you,",https://www.reddit.com/r/computerscience/comments/gkt69s/sites/,0,,2020-05-16 11:30:51
636,hekw2r,False,Help,1,Is this possible?,computerscience,,/r/AskComputerScience/comments/heipl9/is_it_possible_to_build_an_android_application/,2,I would ask /r/androiddev . This sub isn't about software engineering. Computer Science is an academic field. ,2020-06-23 19:11:49
