Num,ID,is_Original,Flair,num_comments,Title,Subreddit,Body,URL,Upvotes,Comments,creation_date
774,f8rc2v,False,[AEROSPACE],59,"Design equipment for NASA's proposed Venus rover and win $15,000",engineering,,https://www.cnn.com/2020/02/23/world/nasa-venus-rover-design-competition-scn-trnd/index.html,403,"Pretty positive I can make composite fairings that will withstand that environment.

Electrickytee is magic to me though. Never mind confusers.

Also have worked as a design engineer at a systems integrator for more local aspirations, so there's that. ",2020-02-24 13:38:59
20,64pycw,False,,82,Installation of a ski lift,engineering,,https://i.imgur.com/YF57Kez.gifv,2599,"Yea engineering was involved, but it was the guy doing the layout that made that happen. 

An engineer would tell you where that pad has to go and how it should be made, but it was the field guy that laid that out that should get the credit.  ",2017-04-11 10:11:28
785,bgg3g2,False,,9,How are Underwater Structures Built?,engineering,,https://www.youtube.com/watch?v=URC125wpMS4,390,Mostly assembled above water and sent down for installation. However your video explains it better and I found out that this wasn't an actual question while answering. ,2019-04-23 13:00:25
641,e2gtr3,False,[ARTICLE],25,CFD Analysis Of A Turkey - How to Cook a Turkey Like an Engineer,engineering,,https://www.digitalengineering247.com/article/how-to-cook-a-turkey-like-an-engineer/,449,solidworks flow? seriously? ,2019-11-27 14:34:54
70,dhrlly,False,[CIVIL],98,Video Captures the Moment A Dam Fails,engineering,,https://gfycat.com/femaleblaringcougar,1505,Dam ,2019-10-14 14:49:12
592,rew33,False,,70,Constant Velocity Joint [xpost from gifs],engineering,,http://i.imgur.com/PnhN0.gif,473,"When those tracks get dirty, that joint becomes worthless. 
 ",2012-03-26 22:26:34
15,5317a5,False,[CIVIL],241,800 tons of lead blocks to stabilize the Leaning Tower of Pisa,engineering,,http://i.imgur.com/AP7UMej.jpg,2887,They're discretely poisoning the Italians. ,2016-09-16 10:11:42
909,28t44l,False,,38,How a Jet Engine Works,engineering,,http://animagraffs.com/inside-a-jet-engine/,363,"The diagram of the core engine has the LP spool and HP spool spinning in opposite directions.

This is not correct, at least for Pratt & Whitney, GE, and Rolls Royce commercial airliners (JT3D, JT8D, JT9D, PW2000, and PW4000, GE90, CF6 and, CFM56, RB211). There are a few turbine engines that do this, but it's extremely rare.

They typically spin in the same direction (the English spin theirs backwards, of course), but at slightly different speeds. ",2014-06-22 18:21:48
726,5g418v,False,,78,World's biggest engineering project - the Iter Nuclear Fusion Reactor in France,engineering,,https://www.theguardian.com/environment/2016/dec/02/after-60-years-is-nuclear-fusion-finally-poised-to-deliver,420,"What an incredible waste.  Energy is all around us.  We know that now.  This is like remodeling the buggy whip factory.  We can gather energy at or near the point of use.  What a shame.
 ",2016-12-02 16:07:20
776,guneh8,False,[INDUSTRIAL],39,Photos show huge new nuclear reactor base at Hinkley Point C,engineering,,http://www.somersetlive.co.uk/news/somerset-news/hinkley-point-c-latest-reactor-4176612,394,"so proud to be french

in january I carpooled with a female engineer who was working on an EPR, but in finland I think.

I asked her so many questions she missed an exit ",2020-06-01 16:12:50
228,cimtyb,False,,101,3D Printed Pneumatic Bag Opener for stand up barrier pouches,engineering,,https://v.redd.it/b1k9h0n9twc31,805,Nice work! I see so many Kaizen opportunities... That's the engineer in me. ,2019-07-27 20:55:20
563,14055h,False,,60,"Went on SparkFun to buy some sensors, decided to buy an oscilloscope as well, got this: ",engineering,,http://imgur.com/MxBLs,493,"No, it's not for free. Something can be given free or for nothing. But not for free. ",2012-11-29 17:58:31
562,emqjiq,False,[AEROSPACE],105,Boeing Employees Mocked FAA In Internal Messages Before 737 Max Disasters,engineering,,https://www.npr.org/2020/01/09/795123158/boeing-employees-mocked-faa-in-internal-messages-before-737-max-disasters,487,"This exchange is my favorite: 

>By the way, I want a really honest assessment from you: are TRU really doing their job fully, and by extension, am I?
Don't have to give now, and don't ever have to stop
I just want to be sure I'm adding value, not just taking up space (especially since I'm clearly an awful FO)

03:43:

>you don't need to ask such silly questions. You are doing a better job than the PMs - if I ask you something, I get
an answer or what I need. If ask SMS PM, I get buggered with a banana

J03:43:
>That's a low bar, mate.
>I appreciate it, but it's a fantastically low bar ",2020-01-10 12:53:25
791,kd5z9,False,,38,How to fix anything...,engineering,,http://imgur.com/oNsv5,394,"Would you mind reposting this to /r/alaska? It, y'know, just *belongs* there, but I don't want to steal your karma. ",2011-09-12 15:54:10
867,gv6nkr,False,[MANAGEMENT],15,One of the best illustrations of Game theory I have come across : Evolution of trust.,engineering,,https://ncase.me/trust/,381,This is fantastic. Pertinent to r/Economics & r/BehavioralEconomics too. ,2020-06-02 12:44:28
737,fwl8kl,False,,82,Is it okay to not be passionate about something within engineering but just the sheer fact of loving to solve problems?,engineering,"Hi. I'm a junior year mechanical engineering student. It seems like everyone around me has their life figured out. I have friends who are really into cars, some friends who are really into fighter aircraft, some robotics, some HVAC. I do lean more towards aerospace and aviation interests, but other than that, I don't just have one thing I'm interested in but a bunch of things. I haven't met another person like me, so I am asking",https://www.reddit.com/r/engineering/comments/fwl8kl/is_it_okay_to_not_be_passionate_about_something/,413,"I agree with what others have said about it not being important what specific things you're interested it. But I do have a bias, when hiring engineers, toward candidates who have hobbies or interests outside of work that they apply their engineering skills to. It doesn't matter at all to me what those interests are. I'm only looking for signs that they're an engineer in their heart, so to speak, as opposed to someone who studied engineering because it looked like a good career path and they could handle the math. Almost without exception, the really good engineers I've known regularly did engineering outside of work. ",2020-04-07 14:15:18
355,7y8e7e,False,[IMAGE],18,The Art of Plasma Exhibition in Museum of Neon Art,engineering,,https://i.imgur.com/uoGzl3l.gifv,630,did anyone else jack off to this? not my proudest fap lol ,2018-02-17 18:32:16
515,1exk9d,False,,105,I work at an engineering firm. This was submitted to our 'General Inquiries' section on our website by a middle schooler. I will be inviting him in for a visit.,engineering,,http://imgur.com/lcJWMqH,519,Kansas City kid!! I wonder if he goes to the same middle school I went to c:  ,2013-05-23 22:04:57
299,ab7okp,False,,65,Some serious Fluid Flow Porn,engineering,,https://i.imgur.com/7wBq8tI.gifv,689,"That's not air! it's water!

It's too different from smoke wind tunnel videos to appear accurate, so I think it is inaccurate and ""fun"" rather than science. I figure that an industry study (professionals) would use a wind tunnel and smoke for precise, reliable videos of the airflow.

[https://history.nasa.gov/SP-4103/p531.jpg](https://history.nasa.gov/SP-4103/p531.jpg)

Air is too elastic to flow in that fashion, the high pressure areas mix into the low and diffuse and even out, whereas in a liquid the lack of compression-diffusion elasticity causes the turbulance to stay constant as it does in this video.

Perhaps it was developed on top of a fluid library and it lacks the graphics to illustrate elasticity of air.

[wing wind tunnel](https://www.google.com/search?biw=1431&bih=734&tbm=isch&sa=1&ei=zTsrXMODCL-Bi-gPls2NiAo&q=wing+wind+tunnel) ",2018-12-31 14:43:53
553,ep19us,False,[IMAGE],49,Here is a 3D computer model I created of a nuclear power plant control room.,engineering,,https://imgur.com/a/kuAL93P,495,Beautiful ,2020-01-15 11:43:50
740,4ws9ma,False,[GENERAL],73,Excellent Anecdote explaining how engineering is different from science,engineering,"I'm pulling this from ""How are Scientists and Engineers Different"" at http://www.drewgl.com/posts/2041 . The post says that the writer is a student at UPenn. **I'd like to know if others find this anecdote to be accurate regarding the difference between the two fields.**

""I'm currently pursuing degrees in Mechanical Engineering and in Physics. Perhaps this personal anecdote can shed light on the difference:

When I was a sophomore I was taking a waves and oscillations course housed in the Physics department along with a statics / strength of materials course housed in the engineering department. This rarely happens, but the material lined up across the two courses almost perfectly for about one week. Even rarer was that I was assigned the same exact problem in both classes!

The problem, for those interested (skip without loss of meaning if not), was to determine, for a cable clamped at two ends, the displacement at any given point if the cable were subjected to symmetric, asymmetric, and random loading. The problem was fairly complex.

In the engineering class I began by drawing diagrams, applying some fundamental physics laws, and seeing where it would take me. It took me down a nasty path full of nonlinear equations. After getting to these equations, I complained to the professor that it was almost impossible to find an exact solution to the problem. His response: ""Ya I know. We're engineers we don't care about exact solutions. Exact solutions don't exist in the real world. The best we can do is approximate."" He then advised that I go write a MATLAB script to apply some numerical methods to the equations I derived. I did just that and got a pretty good solution.

In the Physics class I handed in the solution that I had received full marks for in the engineering class. My physics professor was not impressed. ""Drew, Physicists build mathematical models, not numerical models. Go back and work through the math so you can find a general Mathematical solution for the displacement"". I complained that no one could solve the derived equations, that I had to use the numerical methods. He told me to use some sneaky math tricks to simplify the equations. After applying some of these tricks (for those interested, I used a bunch of Taylor expansions + limit elimination) I boiled down the final equation to a fairly routine  equation that I could easily solve. The final solution wasn't even that bad looking. However, I looked at the assumptions I made to arrive to the equation and I realized that it described nothing in the real world. Yet, this model ended up helping us derive some complicated wave equations later on in the course. 

Thus, for a physicist, it made sense to come up with a simplified mathematical model so that it could be applied to other systems and built upon for greater use. For an engineer, it didn't make sense because these simplified models would not have accurately described the immediate system they were working with.""",https://www.reddit.com/r/engineering/comments/4ws9ma/excellent_anecdote_explaining_how_engineering_is/,411,Later ,2016-08-08 20:21:42
319,4ljqkc,False,[PROJECT],81,"I procastinated while writing my master thesis, so I made a nice gif for you",engineering,,http://imgur.com/S7QSdLO,671,"oh shit, it's that buoy ",2016-05-29 08:37:28
916,1ah27h,False,,43,I thought you guys might like my clipboard ,engineering,,http://i.imgur.com/hRKB6yH.jpg,367,"What are you attempting to measure here, because if it's you're trying to measure power you're doing it wrong. [Power factor](http://en.wikipedia.org/wiki/Power_factor) ",2013-03-17 17:55:17
146,4fp51w,False,,110,Oops. This is why we design on computers.,engineering,,http://imgur.com/htUAwa9,1020,"Low polygon count, was this rendered on a Xboxone? ",2016-04-20 19:41:01
369,9ghjvr,False,[INDUSTRIAL],24,Approximating Pi using Monte Carlo analysis,engineering,,https://gfycat.com/BewitchedViciousAltiplanochinchillamouse,624,Anyone could replicate this in Scratch ,2018-09-17 05:13:17
539,17zb7s,False,,137,Engineering Conundrum ,engineering,,http://i.imgur.com/QIMEPKD.png,505,Actually been a rocket scientist - most engineers aren't close. ,2013-02-06 04:17:10
882,hg91s7,False,[ARTICLE],75,The World's Largest Passenger Ships from 1831 to Present (by gross tonnage),engineering,,https://www.hmy.com/timeline-worlds-largest-passenger-ships/,370,[r/coolguides ](http://Reddit.com/r/coolguides) ,2020-06-26 14:54:19
309,1swubw,False,,86,My homemade roller coaster... Yes it's fully functional,engineering,,http://i.imgur.com/PWj3MEc.jpg,676,The album will be up shortly with videos and a lot of pictures!! ,2013-12-15 03:50:11
395,1vvg86,False,,41,Found this in one of my school's engineering Labs... Also it's my Cake day!,engineering,,http://imgur.com/KAHpa2I,603,"Because of the (flattenned) copper tubing, I’d say AC current, right? ",2014-01-22 19:17:58
901,geirq5,False,[AEROSPACE],65,Plasma jet thrusters make push for propulsion | The Engineer The Engineer,engineering,,https://www.theengineer.co.uk/plasma-jet-microwave-wuhan/,362,Hopefully this idea doesn’t get weaponised by the CCP ,2020-05-06 12:07:28
35,5x26bm,False,[CHEMICAL],83,Recycling of old computers,engineering,,https://i.imgur.com/Qq1L87M.gifv,2008,Why do all that when you can just get a bunch of poor Asian kids to take them apart by hand? ,2017-03-02 08:47:37
725,e8gybr,False,[MECHANICAL],10,Cool video showing detailed design changes of the apex seal: The Challenge Of Designing A Wankel Rotary Engine,engineering,,https://www.youtube.com/watch?v=ivpBu9k7JJE&fbclid=IwAR0o9GJJFdN0x_zVQxaOPATfzzZeJqHxRcPKBkyjhg7CQbRK9HXcmKySoIs,419,Maybe I missed something in the video there but what is the purpose of the triangular corned piece? ,2019-12-09 22:12:24
927,eo4t5w,False,,8,The Magic of Origami,engineering,,https://www.youtube.com/watch?v=--DvsE84LNg,352,"Yeah I'm sorry but ""origami"" doesn't have sole ownership of the concept of folding things to save space or accomplish some 3D super structure.  Particularly when you start adding in segmentation, hinges, ball joints, etc.  It's becoming a meaningless buzzword for anything that folds from some, usually, flatter structure. ",2020-01-13 14:28:48
818,5i0dxt,False,[IMAGE],60,Simulation of A NREL 5MW wind turbine in Atmospheric conditions,engineering,,http://i.imgur.com/jlilkJG.gifv,387,"Finally, some original content and not ripped YouTube videos!

Thanks for sharing this simulation.  Fluid dynamics always interested me but I never took classes or spent time learning it. ",2016-12-13 00:24:57
305,24q11n,False,,49,Electronically stabilized spoon helping someone with Parkinson's (X-post r/oddlysatisfying ),engineering,,http://i.imgur.com/fG7Ye9N.gif,685,"Its eerie when I see look something up (because I saw this on reddit months ago, twice, actually.) and then its on reddit when I get on. YOU ARE SUPPOSED TO WAIT! ",2014-05-04 21:28:55
582,52d6lv,False,[CIVIL],140,"11 Feet, 8 Inches: Infamous “Can Opener” Bridge Continues to Catch Trucks - ""In a way, the bridge represents a perfect storm of variables conspiring against a complete and permanent design solution. The railroad, state and city have all done what they can and called it a day.""",engineering,,http://99percentinvisible.org/article/11-feet-8-inches-infamous-can-opener-bridge-continues-catch-trucks/,479,[deleted] ,2016-09-12 07:31:12
856,9ksw39,False,Hiring Thread,60,r/engineering's Q4 2018 Professional Engineering Hiring Thread,engineering,"## Overview

If you have open positions at your company for engineering professionals (including technologists, fabricators, and technicians) and would like to hire from the r/engineering user base, please leave a comment detailing any open job listings at your company.

We would also like to encourage you to post internship positions as well. Many of our readers are currently in school or are just finishing their education.

### Top-level comments are reserved for posting open positions. 

Any top-level comments that are not a job posting will be removed, and you'll be kindly pointed to the [Weekly Career Discussion Thread.](https://www.reddit.com/r/engineering/search?q=flair%3A%22Weekly+Discussion%22&sort=new&restrict_sr=on&t=all)

## Rules & Guidelines

1. Include the company name in the post.

1. Include the geographic location of the position along with the availability of relocation assistance or remote work.

1. If you are a third-party recruiter, you must disclose this in your posting.

1. Please be thorough and upfront with the position details. Use of non-hr'd (realistic) requirements is encouraged.

1. Please clearly list citizenship, visa, and security clearance requirements.

1. While it's fine to link to the position on your company website, provide the important details in your comment.

1. Mention if applicants should apply officially through HR, or directly through you.

1. Please avoid making duplicate posts. This thread uses Contest Mode, which means all posts are forced to randomly sort with scores hidden. If you want to advertise new positions, edit your original comment.

## Feedback

Feedback and suggestions are welcome, but please don't hijack this thread — [**message us**](https://www.reddit.com/message/compose?to=%2Fr%2Fengineering&subject=Feedback:%20Quarterly%20Hiring%20Thread) instead.",https://www.reddit.com/r/engineering/comments/9ksw39/rengineerings_q4_2018_professional_engineering/,379,"https://www.dynasil.com/about/careers/posting/optometrics-sales-account-manager/

I got this posting from my old boss who is am executive at dynasil.

I would be willing to forward your resume directly to him.  

They really want some who has technical acumen in optics (so practical lab experience is a great plus). ",2018-10-02 17:52:01
14,94i8zt,False,[GENERAL],82,Fine control,engineering,,https://gfycat.com/EnragedFickleCommongonolek,2975,"Ok, so when the singularity happens, who's going to explain 'art' to our new robot overlords? ",2018-08-04 10:38:54
522,gfx4os,False,[ARTICLE],15,"In one of the driest deserts on Earth, microbes live inside of rocks. New materials research shows how they can extract the water. They say it could lead to new water storage technology",engineering,,https://massivesci.com/articles/microbes-desert-extremophiles-atacama-rocks-gypsum-mars/,516,"This technology is probably more useful in stellar explorations. Maybe they use this tech for water extraction on the moon to allow manufacturing and mining facilities to exist there. Regardless, material science is a very interesting topic that always surprises me. ",2020-05-08 17:11:21
729,f27pti,False,,19,What is Air Lock?,engineering,,https://www.youtube.com/watch?v=zdkp9N3qfkI,418,. ,2020-02-11 12:35:14
637,1lm27k,False,,78,The pencil speaks for itself,engineering,,http://imgur.com/QauM7R3,453,It baffles me that anyone could go through four years of school and still fail such a Fucking Easy test ,2013-09-03 00:44:54
568,67ejvd,False,[ARTICLE],241,Here’s Why Juicero’s Press is So Expensive,engineering,,https://blog.bolt.io/heres-why-juicero-s-press-is-so-expensive-6add74594e50,486,"Wow, sounds like your insurers are muppets! Wish you the best, sir! ",2017-04-25 05:09:17
302,1cr0q7,False,,126,Some of you may recognize this,engineering,,http://i.imgur.com/udsctCT.jpg,685,But Matlab sucks sooooo hard.... ,2013-04-20 17:22:26
783,fuvmqs,False,,63,A Guide To Designing Low-Cost Ventilators for COVID-19,engineering,,https://www.youtube.com/watch?v=7vLPefHYWpY,399,A guide? I was hoping this vidi will preset the solution or at least idea how to do it. ,2020-04-04 15:32:31
661,50kwg1,False,[ARTICLE],8,"Joe Sutter, 'Father of the Boeing 747', dies",engineering,,http://www.bbc.com/news/business-37231980,443,His poor wife... ,2016-09-01 02:06:38
926,10i9a5,False,,55,How to conduct PhD oral exams,engineering,,http://i.imgur.com/Ls9aV.jpg,354,This is sooo true!!!!! They have to show they are as smart or smarter than the other doctors on your commitee. My bad luck I have a physicist on mine- everybody was trying to one up one another with tough questions- but the geologist won! The astrogeochemist asked me to sketch the chemical structure of carbonic acid as it exists on Earth. After watching me grasp at straws for five minutes or so and finally admitting defeat he gleefully announced to the other doctors that the theoretical construct known as carbonic acid cannot exist in earth's gravity and pressure. He laughed as he said that not many people knew that! I did not pass. I had to expand upon my oral examination by numerically deriving the dissolution of calcium in a Ca-CO2-H2O system - in order to prove I understood the chemistry!!!! I hate those friggin trick questions!!! ,2012-09-26 14:13:39
963,8e9e33,False,[GENERAL],403,What’s it really like to be an engineer?,engineering,"I’m an engineering student who’s not 100% sure what I’m getting myself into.

Do you enjoy your job? How much break do you get per year? Is it possible to go travelling without quitting your job? Is a 4 year degree worth the work/stress?
Are you glad your became an engineer?

I just got told that engineers get about 5 days break per year, and work their ass off basically all day every day and now I’m really reconsidering what I’m gonna do with my life.

Edit: thanks for all the replies guys, I appreciate it :)",https://www.reddit.com/r/engineering/comments/8e9e33/whats_it_really_like_to_be_an_engineer/,346,[deleted] ,2018-04-23 06:19:58
465,4h1ns3,False,[IMAGE],26,The plaque outside the Holland Tunnel in NYC,engineering,,https://i.imgur.com/9zviAJB.jpg,554,I surprise it is the port authority and not Federal Highway administration that maintaines the tunnel.  ,2016-04-29 21:38:50
857,51rsyy,False,[ARTICLE],88,Don’t Blame A 'Skills Gap' For Lack Of Hiring In Manufacturing,engineering,,http://fivethirtyeight.com/features/dont-blame-a-skills-gap-for-lack-of-hiring-in-manufacturing/,380,"Boss makes a dollar

I make a dime

That's why I shit on company time



-some comment I read ",2016-09-08 15:17:38
914,43xr78,False,[MECHANICAL],207,Got sent an 'interview test' by SpaceX with an hour to complete this problem. Wasn't moved on.,engineering,"Anyone have any ideas on the best way to solve this? Excel was recommended and I wasn't selected to move on to the next stage. Had a few grad students in my lab look at it after I finished (primarily thermal fluids researchers) and they didn't know the best ways to do so. 

My guess was calculating the tangential hoop stress from the pressure and then using superposition to calculate stresses on the cases (using the yield and ultimate strengths of A36 steel to calculate if it failed and if it did if the failure was catastrophic).

http://imgur.com/Y6uoePo

EDIT: Didn't know this would cause controversy for publishing the problem, just wanted to know the solution (as I didn't know the answers). Thanks to those who answered it though, your insight was appreciated!",https://www.reddit.com/r/engineering/comments/43xr78/got_sent_an_interview_test_by_spacex_with_an_hour/,365,"This looks like a textbook case for FEA. I'd plug that whole assembly into solid works and analyze. Doing all 3 cases with 6 test points each in under an hour is going to be ungodly difficult. 

Model it in SW, add forces and pressure, wham bam, find the red bits, and you're done.  ",2016-02-03 02:35:59
819,1ci6i9,False,,83,Things were different back then...,engineering,,http://imgur.com/a/cIZm4,393,"I recall something like these on Mr. Wizard. They are still available with ""Almost infinite wattage/voltage combinations ranging from 100W to 1,200W and from 100V to 240V"": http://www.processheating.com/coneheater.htm . ",2013-04-17 01:54:54
734,1p4jd3,False,,36,We had a contaminated polishing wheel at work. This is the design it made on my mount.,engineering,,http://imgur.com/BodB9dH,418,"Take it to an art show

??? 

Profit ",2013-10-24 14:58:23
78,bv6tfw,False,,106,"After almost 7 years of learning how to be a structural engineer, I finally feel like I am good at something",engineering,,https://i.redd.it/2hn2vl8ifj131.jpg,1437,I'm always curious how you prevent intergranular corrosion with all the welding if plate structures. Do you state the Tig or mig welding requirements to minimise the chromium reacting? I work on much smaller projects and I'm only a year and a bit into my career but this is really an impressive job!  Did you use hand checks to verify and were they  yeild line checks or more simple plate checks like pounders theorem? ,2019-05-31 12:18:32
