Num,ID,is_Original,Flair,num_comments,Title,Subreddit,Body,URL,Upvotes,Comments,creation_date
803,6xwx8o,False,,89,This Tesla Model S is literally floating in a flood bag in flooded garage in Houston - REALLY???,engineering,,https://www.torquenews.com/1/tesla-model-s-literally-floating-flood-bag-flooded-garage-houston,394,[deleted] ,2017-09-04 00:28:04
516,5xwlei,False,[ELECTRICAL],21,"The Scientist and Engineer's Guide to Digital Signal Processing (free, entry-level textbook and a great resource to have bookmarked)",engineering,,http://www.dspguide.com/pdfbook.htm,514,There are some really bad mistakes in the book including something as basic as convolution. ,2017-03-06 22:55:07
387,61lzt5,False,,28,Hydraulic robotic arm made from cardboard,engineering,,https://youtu.be/P2r9U4wkjcc,604,"So where does the robotic part come in?
 ",2017-03-26 15:09:20
808,crmk6m,False,,20,Why Fighter Jets Can Be Too Unstable,engineering,,https://www.youtube.com/watch?v=h6NsYyAUOHE,389,Always an upvote for brian. ,2019-08-17 14:06:24
890,c0tn38,False,[MECHANICAL],36,I wonder how this works. Some type of indexing? Can anyone here help me understand?,engineering,,https://i.imgur.com/b9Xk032.gifv,369,You made a typo ,2019-06-15 04:56:08
917,16eq9n,False,,66,"As a mechanical engineering student who only last semester learned how to use CAD, I am quite proud of my winter break project.",engineering,,http://i.imgur.com/OsUgZ.jpg,366,"Let's get serious. The design of the dragon and the CAD files they use are way more complex. This is more or less an art project.

-Lol, love the downvotes. Have you guys ever seen the CAD files for the Orion space module? They actually show functional components.  ",2013-01-11 23:50:27
782,gaisjh,False,[GENERAL],12,Man Builds Lifejacket to Save His Pet Goldfish From Dying,engineering,,https://nypost.com/2020/04/29/man-builds-life-jacket-to-save-his-pet-goldfish-from-dying/,398,Is it possible to learn this power? ,2020-04-29 22:01:57
107,8h6buz,False,[MECHANICAL],36,These custom prosthetics give amputees better motor capabilities,engineering,,https://i.imgur.com/st3lxnV.gifv,1205,AUTOMAILLLLLLL ,2018-05-05 08:42:55
604,gv66zg,False,[MECHANICAL],20,"Vibration Damping, Isolation and Analysis. My attempt to tie it all together.",engineering,,https://youtu.be/B2Cg8_2wDAw,469,"I’m about to take a final in System Dynamics Analysis, and this video is basically the entire class haha ",2020-06-02 12:12:04
433,a0l3lb,False,[GENERAL],357,"GM to lay off 15 percent of salaried workers, halt production at five plants in U.S. and Canada",engineering,,https://www.washingtonpost.com/business/2018/11/26/gm-lay-off-percent-salaried-workers-halt-production-five-plants-us-canada/?utm_term=.3c5559012754,571,"Thanks for this, I’ve got stock in GM lol ",2018-11-26 16:58:28
10,3o3j4u,False,[CIVIL],160,I built this model to illustrate how groundwater flows around a cutoff wall.,engineering,,http://imgur.com/lQxQmzn,3526,"Wow, fuck fluid mechanics. This makes no da sense... ",2015-10-09 13:18:04
662,1tn8sr,False,,49,Two Axis Pendulum [From /r/gifs],engineering,,http://i.imgur.com/S6aA4hc.gif,441,Am I on the tilt-a-whirl ? ,2013-12-25 01:37:22
453,aqk9cu,False,,71,New technique developed to weld 7075 aluminum,engineering,,https://newatlas.com/welding-aa7075-aluminum-alloy/58449/,557,"No, the technique has existed for millennia, but it was only discovered recently. I know, kinda difficult to wrap your mind around, but that's the more accurate wording.  ",2019-02-14 14:24:22
310,139i7l,False,,57,Held upright by constant stress (x-post from r/pics),engineering,,http://i.imgur.com/0M1zV.jpg,679,I'm very skeptical about this.  ,2012-11-15 22:18:43
754,siy4t,False,,20,Here is an picture I took from our robotics lab on campus.  Happy cake day.,engineering,,http://imgur.com/JE0OH,408,You're title have incorrect grammar usage; and it makes me angry.  ,2012-04-20 02:29:22
847,gs6gz8,False,[MECHANICAL],13,Mechanics + Object recognition + Algorithms = ROBOT. How I made a table hockey robot within 18 months,engineering,,https://www.youtube.com/watch?v=Zs5S-yGAO-M&t=42,380,This is really cool!  How did you decide the design of your mechanics? ,2020-05-28 13:40:44
810,37b3o4,False,[GENERAL],22,The physics of floating screwdrivers,engineering,,https://www.youtube.com/watch?v=jAYP6pWrdkc,393,This would be a great ELI5 post. ,2015-05-26 09:11:12
915,1biveb,False,,176,Last year a bunch of Redditors applied for an engineering show on Discovery channel. The show was made and premieres next month!,engineering,,http://dsc.discovery.com/tv-shows/the-big-brain-theory,360,Why are they all white? Not really representative of the engineer demographic where I live.  ,2013-04-02 16:39:33
479,7wqapo,False,[IMAGE],76,What would call this structure,engineering,,https://i.imgur.com/MgzJ27T.jpg,535,Fourir Transform ,2018-02-11 03:01:26
148,en70uq,False,,78,Combustion powered ground pounder,engineering,,https://gfycat.com/playfulblondblackbird,1016,"This is how a Jalapeño on a stick hoops

https://youtu.be/VN3CUQAEbGc ",2020-01-11 12:47:38
88,f3q08p,False,,108,World largest gas turbine,engineering,,https://imgur.com/g2xXL6U,1333,A marvel of engineering for sure... But that doesn't help the fact that natural gas plants will be uneconomical within 10-15 years... ,2020-02-14 09:48:30
960,34181x,False,[IMAGE],119,1-A through a 1/4-W resistor releases the magic smoke,engineering,,http://i.imgur.com/PThkEuU.jpg,344,That /r/titlegore call yourself an engineer and use watts for resistance......  ,2015-04-27 14:36:11
340,gwkavx,False,,29,SpaceX sets new mark in rocket reuse 10 years after first Falcon 9 launch,engineering,,https://spaceflightnow.com/2020/06/04/spacex-sets-new-mark-in-rocket-reuse-10-years-after-first-falcon-9-launch/,642,10 years? Time really flies... It feels like 5 years ago... ,2020-06-04 16:04:30
966,pe5r9,False,,26,Was doing my Mechanics homework when...,engineering,,http://i.imgur.com/q1siH.jpg,349,"So, I heard that the Israelis put in a 27th character: the $. ",2012-02-07 03:44:27
573,1u8nvd,False,Electrical,69,I am not a smart man...,engineering,,http://imgur.com/o17gYei,485,You just got upvoted for using Tau. Yay! ,2014-01-02 17:21:14
80,ftmukh,False,,30,Antique safe from early 1800s Italy,engineering,,https://i.imgur.com/43anR4v.gifv,1407,OP is a great big phony ,2020-04-02 14:01:51
743,x1e1y,False,,56,Sometimes I wonder if text authors are just messing with me.,engineering,,http://i.imgur.com/Dngei.jpg,410,"ahhhhhhh, engineering abbreviations are the worst abomination unto mankind.  Wanna find the meaning of some greek symbol you can't find in the symbol section of Microsoft Word?  Get ready to scan 40 pages until you find it embedded in a wall of text.  Why textbooks don't redefine variables at every main introduction of a formula, I will never understand.  Furthermore, why textbooks are written like narrative books rather than an encyclopedia (i.e. Hibbeler's books) I will never understand.  I taught myself HTML 4 in junior high with a book written in Encylopedia format.  Had I stuck with the ""for dummies"" that required reading through a narrative format, I would've given up. ",2012-07-23 21:50:23
180,6gtvuq,False,[CIVIL],91,"While house hunting, i found an interesting use for unused concrete samples",engineering,,http://i.imgur.com/Dh5zNkI.jpg,909,"Not samples. They are used for making walls, lining driveways etc... ",2017-06-12 17:54:01
419,2biey0,False,,177,An office full of engineers... Somebody fucking crossthreads the sugar dispenser. >_<,engineering,,http://imgur.com/fUi4k7U,584,Get the fuck outside if this is a big deal! ,2014-07-23 17:12:27
132,8kria8,False,[MECHANICAL],85,How subway tunnels are built,engineering,,https://i.imgur.com/Y0lMBdh.gifv,1095,but can it file EIRs and respond to CEQA lawsuits?  ,2018-05-20 08:53:12
69,21ia9x,False,,29,Three men demonstrate the cantilever bridge system (x-post /r/mildlyinteresting),engineering,,http://i.imgur.com/NJNbCoc.jpg,1510,Is that Leonardo DiCaprio in the center? ,2014-03-27 14:42:24
644,4hjpxf,False,[MECHANICAL],76,The Monospinner: a controllable flying vehicle with a single moving part,engineering,,https://www.youtube.com/watch?v=P3fM6VwXXFM,449,"Uh, motor + propeller = 2 moving parts, right? ",2016-05-02 20:50:33
128,448ny2,False,,42,"Awesome drafting cake! (Disclaimer, I studied engineering, but wound up as a designer/draftsman in the entertainment industry)",engineering,,http://imgur.com/a/OPZr4,1112,What firm do you work for? I'm also an engineer in the entertainment industry. ,2016-02-05 02:05:35
391,bdx576,False,[GENERAL],51,"Boston Dynamics: Mush, Spot, Mush!",engineering,,https://www.youtube.com/watch?v=OnWolLQSZic,601,I think we broke it 😅 ,2019-04-16 18:08:59
3,f5re3j,False,,313,Somewhere there’s a structural engineer sweating profusely,engineering,,https://i.imgur.com/iGnTYDt.gifv,5224,"This link has been shared 1 time. Please consider making a crosspost instead of reposting next time 

First seen [Here](https://redd.it/exnyuy) on 2020-02-02. Last seen [Here](https://redd.it/exnyuy) on 2020-02-02 

**Searched Links:** 53,304,277 | **Indexed Posts:** 409,601,221 | **Search Time:** 0.006s 

*Feedback? Hate? Visit r/repostsleuthbot* ",2020-02-18 12:56:48
731,90hrjx,False,[MANAGEMENT],50,"Open plan offices don’t live up to the hype, finds Harvard Business School study",engineering,,https://www.fastcompany.com/90204593/heres-the-final-nail-in-the-coffin-of-open-plan-offices,413,Still better than cubicle farms though.... ,2018-07-20 17:05:44
628,5sf8lz,False,[GENERAL],77,"""The developers behind the sinking Millennium Tower paid for an independent review of the tower itself before it was built, but did no geotechnical investigation of the site it sits on.""",engineering,,http://sf.curbed.com/2017/2/3/14500782/millennium-tower-peer-revie,458,"How could you not look at the dirt? Every project I have ever been on they look at the dirt closely and build from there. Proctors, Overexcavate, compaction, all that stuff ",2017-02-06 16:38:12
56,1cw7x1,False,,170,Someone underestimated Wyoming winds.,engineering,,http://i.imgur.com/yrGnWQf.jpg,1646,DAYUM! ,2013-04-22 22:36:50
929,78vzw3,False,[GENERAL],99,Incredible automated lamb processing plant,engineering,,https://youtu.be/za2dsB0qrMg,354,But... WHERE’S THE LAMB SAUCE!?! ,2017-10-26 14:42:27
666,1hfqcp,False,,36,Even the Software tells me I'm shit at my job.,engineering,,http://i.imgur.com/6ZKbZuH.jpg,443,im guessing the first popup said OY MATE ,2013-07-01 17:16:24
238,5vvdbp,False,,29,How to visualize your data,engineering,,http://imgur.com/VaqjSKA,787,Comparing spectroscopy data (ex: absorbance vs wavelength) doesn't fit into any of these appropriately.  ,2017-02-24 04:00:25
381,cx4u34,False,[PROJECT],265,The Engineering Notebooks have arrived!,engineering,"Much to our pleasure and surprise the engineering notebooks arrived way ahead of schedule. We received them this morning and they are now ready and available on our website. [https://cognitive-surplus.com/collections/the-engineer](https://cognitive-surplus.com/collections/the-engineer). Thank you all very much for your help. Hopefully you can see the impact that your comments, suggestions and discussions had on the final designs. This project all started when an aerospace engineer contacted us about wanting a hardcover engineering pad. It's been amazing to see how the project has grown from that initial seed, I couldn't have done it without you. Special thanks to u/[raoulduke25](https://www.reddit.com/user/raoulduke25/) for permitting me to post this update with weblinks, thank you!

**Links**

* Astronautical [https://cognitive-surplus.com/collections/the-engineer/products/astronautical-engineering-bound-pad](https://cognitive-surplus.com/collections/the-engineer/products/astronautical-engineering-bound-pad)
* Chemical [https://cognitive-surplus.com/collections/the-engineer/products/chemical-engineering-bound-pad](https://cognitive-surplus.com/collections/the-engineer/products/chemical-engineering-bound-pad)
* Aeronautical [https://cognitive-surplus.com/collections/the-engineer/products/aeronautical-engineering-bound-pad](https://cognitive-surplus.com/collections/the-engineer/products/aeronautical-engineering-bound-pad)
* Marine [https://cognitive-surplus.com/collections/the-engineer/products/marine-engineering-bound-pad](https://cognitive-surplus.com/collections/the-engineer/products/marine-engineering-bound-pad)
* Power [https://cognitive-surplus.com/collections/the-engineer/products/power-engineering-bound-pad](https://cognitive-surplus.com/collections/the-engineer/products/power-engineering-bound-pad)
* General Engineering [https://cognitive-surplus.com/collections/the-engineer/products/engineering-bound-pad](https://cognitive-surplus.com/collections/the-engineer/products/engineering-bound-pad)
* Nuclear [https://cognitive-surplus.com/collections/the-engineer/products/nuclear-engineering-bound-pad](https://cognitive-surplus.com/collections/the-engineer/products/nuclear-engineering-bound-pad)
* Electronics [https://cognitive-surplus.com/collections/the-engineer/products/electronics-engineering-bound-pad](https://cognitive-surplus.com/collections/the-engineer/products/electronics-engineering-bound-pad)
* Civil [https://cognitive-surplus.com/collections/the-engineer/products/civil-engineering-bound-pad](https://cognitive-surplus.com/collections/the-engineer/products/civil-engineering-bound-pad)
* Material Science [https://cognitive-surplus.com/collections/the-engineer/products/materials-science-engineering-bound-pad](https://cognitive-surplus.com/collections/the-engineer/products/materials-science-engineering-bound-pad)
* Software [https://cognitive-surplus.com/collections/the-engineer/products/software-engineering-bound-pad](https://cognitive-surplus.com/collections/the-engineer/products/software-engineering-bound-pad)
* Mechanical [https://cognitive-surplus.com/collections/the-engineer/products/mechanical-engineering-bound-pad](https://cognitive-surplus.com/collections/the-engineer/products/mechanical-engineering-bound-pad)

&#x200B;

https://preview.redd.it/tcifqvmxjfj31.jpg?width=1800&format=pjpg&auto=webp&s=7e4ab76b43151f88f4788c7971e12f52aeefc6b2

&#x200B;

https://preview.redd.it/mf89pslclfj31.jpg?width=1800&format=pjpg&auto=webp&s=8d7d261652fc772afe39b10b8a371044466dd9b6

https://preview.redd.it/nvd3zse1lfj31.jpg?width=1440&format=pjpg&auto=webp&s=85c7541bb85c2d67779ea23af1747b80464afe9e

&#x200B;

https://preview.redd.it/8djcoff3lfj31.jpg?width=1800&format=pjpg&auto=webp&s=31e6e515c1bf22d81c66f1cf571253dec1c4ce3a

&#x200B;

https://preview.redd.it/jg4sn7m7lfj31.jpg?width=1800&format=pjpg&auto=webp&s=067196a7c805d851a868585a7c4ea2e697036538

**Full Specs**

* Dimensions: 8.5"" x 11""     
* Page Count: 192 pages (96 sheets)   
* Paper Type: 5 mm green engineering grid
* Paper Weight: 64 gsm
* Binding: Lay-flat hardcover
* Paper Composition: 100% recycled
* Printing: Soy-based ink
* Cover Icon: Silver foil stamp
* Cost: $27.95",https://www.reddit.com/r/engineering/comments/cx4u34/the_engineering_notebooks_have_arrived/,621,I make $74k a year and I definitely don't have the money to buy a **$34 pad Of engineering paper.** ,2019-08-29 18:30:05
505,4txm70,False,[GENERAL],70,Tesla Autopilot reportedly prevented serious injury or saved the life of a pedestrian in DC,engineering,,http://electrek.co/2016/07/21/tesla-autopilot-saved-life-prevented-serious-injury-pedestrian-dc/,527,You just know the mainstream tv news won't report on this. They can't use it to slant for political gains or fear monger. Hopefully some local DC news stations will pick the story up at least. ,2016-07-21 15:44:11
152,f6netr,False,,64,Does anyone know the name of this type of spring?,engineering,,https://i.imgur.com/JNBLqmQ.gifv,979,"Hope I'm not breaking any rules here, but the rash guard / athletic wear is made by my friend's company, Dynasty Clothing!

If anyone's interested, links to the [rash guard](https://www.dynastyclothingstore.com/collections/no-gi-collection/products/legendary-spirit-elite-bruce-lee-rash-guard) and [spats](https://www.dynastyclothingstore.com/collections/no-gi-collection/products/legendary-spirit-elite-bruce-lee-grappling-spats) are here, meant to be Bruce Lee-inspired. ",2020-02-20 04:14:34
87,80e0ze,False,[GENERAL],137,This Free online calculator me and my friends built for engineering professionals and students contains a library which just reached 1999 equations. Please let me know which Important missing formula should be No. 2000,engineering,,https://www.fxsolver.com,1345,No aerospace engineering category? ,2018-02-26 15:59:48
788,5gsh4i,False,[PROJECT],24,Lego Rotating System,engineering,,https://youtu.be/FNfHac_Q68I,399,"I built a linear screw actuator out of legos last year, it was quite a bit more complicated than this however ",2016-12-06 12:02:23
474,fgc4ho,False,,14,Why Pipes Move Underground,engineering,,https://www.youtube.com/watch?v=msxMRwQyXI8,542, . ,2020-03-10 11:08:18
642,agvh3a,False,[MECHANICAL],18,Walt Disney has got style,engineering,,https://i.imgur.com/FE8dBTU.gifv,450,Defund Boston Dynamics-> move all funding to Disney. ,2019-01-17 07:48:23
789,20qn1b,False,,35,Question for automation engineers out there. How do you come up with gear designs like these?,engineering,,http://imgur.com/a/uotTQ,397,I think I have an Engineering boner! ,2014-03-18 18:52:49
330,1qus4g,False,,150,Just been to see Gravity..,engineering,"Out of ten, I'd give it a 9.81!",https://www.reddit.com/r/engineering/comments/1qus4g/just_been_to_see_gravity/,657,"What about the scene where Sandar Bollock is attached to the arm assembly and spinning but once she detaches herself, the assembly flies off. Since they are spinning together shouldn't they continue to spin together regardless of whether she is still attached or not? ",2013-11-17 23:22:12
167,a7fn27,False,[PROJECT],97,Porch Pirates BEWARE! Engineers will find you and catch you!,engineering,,https://www.youtube.com/watch?v=xoxhDk-hwuo,932,It would have been more entertaining if the cup sprayed 15 molar hydrochloric acid in all directions ,2018-12-18 21:47:00
850,dd0jj6,False,[MECHANICAL],23,I could teach a semester of Manufacture Engineering with old black and white videos.,engineering,,https://youtu.be/0KXPuBUdDtw,379,I could listen to that all day. ,2019-10-04 01:30:20
192,1ko6dd,False,,45,I've been telling people this is how bridges are built for years now.,engineering,,http://imgur.com/Cr4vYaS,890,And the sad thing is I am sure most of them believed you... ,2013-08-19 15:38:20
820,dcqfkg,False,,43,"The tallest elevator test tower in the world , in Rottweil Germany",engineering,,https://www.youtube.com/watch?v=QJfB02_j3YI,392,[deleted] ,2019-10-03 12:49:27
514,18j1w1,False,,61,How a fuel cell operates (.gif) (X-post from technology),engineering,,http://i.imgur.com/Ay5UbJB.gif,520,Engineers didn't know this? ,2013-02-14 18:37:26
0,6d9csu,False,[MECHANICAL],111,Acrobot (xpost r/interestingasfuck),engineering,,https://i.imgur.com/etwZRfv.gifv,10750,https://m.imgur.com/qbvgzBN ,2017-05-25 12:41:32
201,7it2q7,False,[MECHANICAL],54,easily drive through snow,engineering,,https://i.imgur.com/cLhDrh9.gif,867,So do you drive in reverse to go forward? ,2017-12-10 09:29:10
21,4xjw3n,False,[PROJECT],263,I was hired to complete a treehouse after the first contractor was injured,engineering,,https://imgur.com/a/AmAQP,2512,"Carpenter here. Those 'metal grates' are gang nails. They hold trusses and many other things together. To be honest a lot of this isnt as horrific as some of the stuff in your standard condo or townhouse. Especially if the job wasnt finished. 

I doubt you're an engineer or carpenter if you can't name common building materials. Not to mention its a fucking treehouse ",2016-08-13 16:54:51
609,bs2kno,False,,102,Rochester NY area engineer faked inspection reports for spaceship parts sent to SpaceX,engineering,,https://www.rochesterfirst.com/news/local-news/feds-rochester-area-engineer-faked-inspection-reports-for-spaceship-parts-sent-to-spacex/2019031582?utm_medium=social&utm_source=facebook_News_8_WROC_Rochester,468,"I come from Canada where engineers are regulated by an outdated law that mostly applied to a bygone Era. 

Please elaborate on what kind of legislation you think would be worthwhile. ",2019-05-23 12:52:16
767,6u971a,False,,20,How To Anchor a Mega-Ship,engineering,,https://youtu.be/62O7KYfb4GA,402,I love how this gets reposted every month  ,2017-08-17 10:56:57
925,4jwtzn,False,[PROJECT],79,I made a game with lots of little control engineering puzzles,engineering,"Link: http://janismac.github.io/ControlChallenges/

In this game you write control algorithms to achieve some goal, which is different for each level. The algorithms need to be written in javascript (because that's the only thing that runs in a browser).

Actually I made this a while ago, but now got around to creating more levels and adding the option to share your results.

Any feedback, suggestions?",https://www.reddit.com/r/engineering/comments/4jwtzn/i_made_a_game_with_lots_of_little_control/,363,[deleted] ,2016-05-18 14:10:25
645,1erlsq,False,,52,Rotary snow plow. I would hate to be near the business end of this while it is running.,engineering,,http://i.imgur.com/729gVoG.jpg,446,"If you haven't seen it, find the snow melting railway machine.  It's a jet engine affixed to a train.  YouTube ""Jet Train"" I'm sure you'll find it. ",2013-05-21 14:58:20
199,bbxr3r,False,,34,the Black Hole Photo is the result of a gigantic engineering project in which numerous telescopes around the world were synchronized using atomic clocks so accurate that they lose just one second per hundred million years,engineering,,https://ponderwall.com/index.php/2019/04/10/black-hole-photo-confirms-einsteins-relativity/,871, Name Messier 87 after Katie Bouman  http://chng.it/NQPY7mHmWc ,2019-04-11 09:21:56
921,85bub6,False,,76,Crack on Florida Bridge Was Discussed in Meeting Hours Before Collapse,engineering,https://www.nytimes.com/2018/03/17/us/florida-bridge-collapse-crack.html,https://www.reddit.com/r/engineering/comments/85bub6/crack_on_florida_bridge_was_discussed_in_meeting/,360,"Concrete is no good under tension, if the post tension cables broke or were not tightened to a proper spec then that is likely what caused the crack and eventual failure.  ",2018-03-18 15:20:56
700,gic39l,False,,67,The Truth About 5G - Real Engineering,engineering,,https://www.youtube.com/watch?v=g-gGeAe-PJA,431,"""Real Engineering"" my arse.

This is pure marketing pamphlet with ""explanations"" on pre-school moronic level. ",2020-05-12 14:19:44
659,1gzazo,False,,87,"Double helical gear failure: Excessive oil velocity from spray nozzles resulted in foaming of the lubricant, causing cavitation. The pitting on the top gear is located right below the nozzle.",engineering,,http://i.imgur.com/aehz5ZA.jpg,442,"How exactly would ""foaming"" of the lubricant cause cavitation? Foaming implies air is thoroughly dispersed throughout the lube, not the same as a void that would rapidly expand and implode  ",2013-06-24 17:36:05
190,agoiuw,False,[IMAGE],29,311 megapixel image of electromagnetic spectrum,engineering,,https://i.imgur.com/F36OPXZ.jpg,893,"3... 11, 
3,
3,
11!  ",2019-01-16 19:09:16
822,41seu5,False,[GENERAL],73,"Every time I see a fountain like this, I'm mesmerized.",engineering,,https://www.youtube.com/watch?v=g4cjHuMPK9s,385,Def not laminar at that velocity ,2016-01-20 03:18:28
112,5jwye7,False,,43,100 ft rebar cage for a drilled shaft foundation,engineering,,https://i.reddituploads.com/69cc64d4436e4abe83ade3b099bf3aa3?fit=max&h=1536&w=1536&s=25ad5bcd9fd865188294ef67f6d571f1,1183,gypsy danger's fleshlight. ,2016-12-23 12:53:53
636,3pfkwl,False,[MECHANICAL],174,Pratt & Whitney’s new Turbofan is 16% more efficient than today's best jet engineers and took 30 years to develop,engineering,"[link](http://www.bloomberg.com/news/articles/2015-10-15/pratt-s-purepower-gtf-jet-engine-innovation-took-almost-30-years)

I specially love this line from the article: “It’s the antithesis of a Silicon Valley innovation”. “The Silicon Valley guys seem to have the attention span of 3-year-olds.”

",https://www.reddit.com/r/engineering/comments/3pfkwl/pratt_whitneys_new_turbofan_is_16_more_efficient/,455,"/r/hailcorporate

Geared turbofan is not a new idea, it's obvious that if you make an ""ideal turbine"", it's rotation speed will never match the ""ideal fan"" speed. A gearbox fixes that but such a high power high speed gearbox was not economically viable before. 

Most of that 30 years it was not ""in development"" as much as on the back burner.

Also that 16% figure is highly suspect. It's more efficient than a similar sized turbofan, not more efficient than all other turbofan designs, that reduces the competition a lot. ",2015-10-20 01:32:49
934,1jm8tw,False,,14,Warsaw University has some really cool wall art.,engineering,,http://i.imgur.com/8cngZTa.jpg,358,8/10. Would have been a perfect 10 had they used the differential form of MEs. ,2013-08-03 08:01:20
835,5etce9,False,[PROJECT],30,Removing rubber from an airport runway,engineering,,https://youtu.be/wb0IGES6S-M,386,Very ineffective method compared to what Chemtek does.   ,2016-11-25 12:27:48
400,68wgqs,False,[IMAGE],53,My Grandpa's Rocketdyne Space Shuttle Main Engine (SSME) pocket data book from 1987,engineering,,http://imgur.com/a/dvjCt,600,How can I get a hand in one of these????? ,2017-05-02 22:43:08
428,442cuu,False,[AEROSPACE],148,Designing an Aircraft Wing Rib,engineering,,https://gfycat.com/GrayVioletAgouti,575,Solidworks? ,2016-02-03 22:46:32
