Num,ID,is_Original,Flair,num_comments,Title,Subreddit,Body,URL,Upvotes,Comments,creation_date
876,14chuj,False,,33,"Having dealt with weld symbols for a while, this one still gets me.",engineering,,http://i.imgur.com/DJz98.jpg,376,Can I get the source? Need higher-res pics please. ,2012-12-05 22:08:08
346,3lc2on,False,[GENERAL],70,"The new ""golf carts"" we got at the place I work.",engineering,,http://i.imgur.com/oom2WQA.jpg,643,Fore in the hole! ,2015-09-17 18:51:42
852,4qw3a7,False,[MECHANICAL],36,Micro camera footage from within the cylinder of internal combustion engine,engineering,,https://youtube.com/watch?v=q0Rsa-zWGEo,379, ,2016-07-02 06:07:51
306,7824zh,False,[ARTICLE],52,The Taylor hydraulic compressor used no moving parts to power an entire mine via compressed air,engineering,,http://www.coppercountryexplorer.com/2011/07/the-taylor-compressor/,683,Awesome but is one of those pics seeing water pollution roll over the dam? ,2017-10-22 18:55:22
177,3j8k2e,False,,115,Bugatti factory mechanical track [x-post r/gifs],engineering,,http://i.imgur.com/DsgYeDl.gifv,919,Now they need to make escalators with this type of tech so we don't hear another story about a woman falling through. ,2015-09-01 16:35:56
135,1d12dd,False,,36,its like porn. (sfw),engineering,,http://i.imgur.com/favEeKx.gif,1087,I found the perfect song for it... https://www.youtube.com/watch?v=M7VTByl6WqA ,2013-04-24 19:26:26
386,atar5b,False,[GENERAL],33,Engineering Ethics and Legalities - Please Don't Let yourself Become a Reddit Post,engineering,"So an unfortunately common topic I see come up is ""my workplace is being shoddy in these illegal and unethical ways"". The advice is usually as follows:

* Document everything
* Find a better job
* Report the activities to the relevant party (client, safety organisations, managers, etc)

So the way the writers put their situation forward, they often say that ""the company"", or ""we"" are forging signatures, skimming materials, etc. But what I see when reading between the lines is that the poster has actually knowingly taken part of the activities, but has reached a breaking point, but don't know how to proceed.

This creates a problem for the ""document and report it"" advice - They would be implicating themselves. If I'm being honest to myself, I wouldn't report something that I was a part of, for fear of losing my job, and potentially gaol time. So when we see these posts, it's already too late; the poster dun goofed.

Now, engineers hold a very powerful role in society, and everyone in the developed world relies on our work in hundreds of ways that impact their safety and livelihoods, yet they dont even know about it. They don't get the choice of choosing which engineers (especially civil) built their apartment, or designed their traffic lights, or provided their drinking water. So ethically it falls on us. And then legally, there are many checks to make sure that these ethics are approximately upheld; even if one has different ethical beliefs. Which brings me to my point.

**The only way to win is not to play.**

Don't let yourself be put in this situation. If something feels or is wrong, don't ignore it; investigate it. If you're given a task that seems a bit 'off', ask the person if they understand the legal implications of their request. Under no circumstances take on something you know or reasonably suspect to be illegal, because then you're a part of it, and there is no turning back. This applies to many tasks, such as tendering, design, signing off, and worksite safety.

---

To show it can be done, even as a graduate, I have examples. I have occasionally questioned my site-manager when I suspected something was amiss. Half the time I was just young and dumb, but sometimes it was enough for him to think about it himself. It might be a quick question like ""what happens if the subbies build to a drawing that hasn't got that signature?"", and I would see the cogs turning in his head about time delays, safety issues, and up to legal issues if it fails. In many cases, that would be enough, because he had missed that self-check because he were given instructions and was following through without much thought, forgetting he was liable too.

Hopefully by having a bit of foresight, we can prevent some of these ethics posts by stopping them at their source.",https://www.reddit.com/r/engineering/comments/atar5b/engineering_ethics_and_legalities_please_dont_let/,602,"It's very important to be honest and humble enough to realize and admit when you've made a mistake too. It's happened to me a few times where I've realized we fucked up, whether it's something as simple as a drafting typo, or something bigger that we've missed entirely. Most of those times the mistakes would most likely never have been found out, or at least not for some time so I probably could have gotten away with it. But I informed the client, took the heat, and it was dealt with. The client is pissed off a bit, but after that wears off they ultimately respect your honesty and it builds trust. Everyone makes mistakes, it's how you deal with it that counts. ",2019-02-22 00:33:48
256,7g437w,False,[GENERAL],95,Water Hammer Breaking my Pressure Gauge,engineering,,https://i.imgur.com/ZTE0dHV.gifv,757,"You can add a snubber between the pipe and the gage. In this case just use one of the porous disc type snubbers, that should do the trick. ",2017-11-28 13:22:06
584,fm1awf,False,[MECHANICAL],24,I love these old films- 1937 How Oil Lubrication Protects Engines,engineering,,https://youtu.be/CCtJlgtZnBY,473,"If it flows fast enough to fill a bathtub in three minutes and the engine reuses the same oil every 4 minutes, doesn't that suggest there's 1.33 bathtubs of oil in there? ",2020-03-20 19:41:26
176,5h1i34,False,[MECHANICAL],30,a great old school video explaining how transmissions work,engineering,,https://www.youtube.com/watch?v=RQWejyx0gi8,919,"\>Thumbnail of an automatic transmission

\>Video of a manual transmission ",2016-12-07 18:19:00
493,c3d7ir,False,,161,So which of you geniuses responsible for this?,engineering,,https://youtu.be/1BB6wj6RyKo,530,"This cant be real... It must be a fake website.  I have to call the helpline to make sure its not real 

[https://support.cbyge.com/hc/en-us/articles/360015498292-How-To-Factory-Reset-Your-C-by-GE-Smart-Bulbs](https://support.cbyge.com/hc/en-us/articles/360015498292-How-To-Factory-Reset-Your-C-by-GE-Smart-Bulbs) ",2019-06-21 16:59:10
982,70hmuo,False,[MECHANICAL],37,Autocanoe: An amphibious all terrain Vehicle you can build in your backyard. designed by my dad.,engineering,"Autocanoe: An Amphibious All Terrain Vehicle You Can Build In Your Backyard. Designed By My Dad.

https://www.youtube.com/watch?v=8WotfE6ZOAo",https://www.reddit.com/r/engineering/comments/70hmuo/autocanoe_an_amphibious_all_terrain_vehicle_you/,342,"The seat looks uncomfortable and it looks like it would tip onto its nose while riding on land, but other than that it looks sweet! Has he thought about adding an electric motor? ",2017-09-16 15:58:21
399,7373s8,False,[MECHANICAL],43,Section of cryogenic storage tank for liquefied natural gas (from r/thingscutinhalfporn),engineering,,https://i.imgur.com/5AoJ9XE.jpg,598,How does this make more sense than the internals of a car do? ,2017-09-29 11:05:57
22,hqvm7o,False,,84,Former Myth Buster Grant Imahara Dead at 49,engineering,,https://www.hollywoodreporter.com/news/grant-imahara-dead-mythbusters-host-was-49-1303101,2433,Can I get a rip in chat :/ ,2020-07-14 05:24:25
711,orr2n,False,,43,LOVE that Google does this.,engineering,,http://i.imgur.com/ioJaB.jpg,423,V=IR is the only formula I need to know.  ,2012-01-22 19:38:46
313,22mwl8,False,,89,Greatest achievement to date.,engineering,,http://i.imgur.com/ck2jiT1.jpg,677,Congrats. But I did the same thing. Wasn't that hard.... ,2014-04-09 20:30:31
427,39125x,False,,51,A custom built BBQ spit cooking 500 chickens at the same time.,engineering,,http://i.imgur.com/MK7CIYj.jpg,575,"""And that is why I am a vegan"" ",2015-06-08 13:53:53
624,cl7cke,False,,59,"Only in the US, standards for telecom equipment include resistance to a shotgun",engineering,,https://i.imgur.com/VyoxsYZ.jpg,458,Yah. Don't you have a shooting and school shooter problem? ,2019-08-02 17:43:13
417,hf2vlg,False,,42,I made a video on how radar works and how aircrafts like the B-2 are designed to avoid detection!,engineering,,https://www.youtube.com/watch?v=UlOzU5_yc44,582,"Nice! But the plural of ""aircraft"" is just ""aircraft"" in English-speaking countries. ""Aircrafts"" identifies you as a non-native speaker.

https://www.merriam-webster.com/dictionary/aircraft ",2020-06-24 15:21:17
708,4bgvya,False,[ARTICLE],19,"Bob Ebeling, NASA engineer who warned of Challenger disaster, dies at 89",engineering,,http://www.huffingtonpost.com/entry/challenger-engineer-bob-ebeling-dies_us_56f09f3be4b09bf44a9e41f2,426,"Oh damn, were were talking about him and about whistleblowing  just yesterday on my Engineering Ethics elective. ",2016-03-22 10:39:03
809,3t6zkb,False,,68,I thought you would appreciate the innovation and engineering behind this truck,engineering,,http://imgur.com/7TwOui1,393,"If it's behind the truck, how are we supposed to see it?  ",2015-11-17 19:16:03
690,4hvpof,False,,192,"Two Tesla Production Chiefs to Leave Ahead of Model 3 Ramp-Up, Tesla has now seen five vice presidents leave in three months.",engineering,,http://www.bloomberg.com/news/articles/2016-05-04/two-tesla-production-chiefs-to-leave-ahead-of-biggest-challenge-yet,435,"so freaking what, they'll get some other management person to take his position and boss employees around. Whether results are actually achieved is up to the actual workers doing the job and low level managers, not some top level executive that barely knows how to write a coherent email. ",2016-05-04 17:53:14
398,c8wfy6,False,,84,10 Tricks Engineers Need to Know About Fasteners,engineering,,https://engineerdog.com/2015/01/11/10-tricks-engineers-need-to-know-about-fasteners/,599,Give me the tldr of this ,2019-07-04 01:26:30
108,dbtgqk,False,[ARTICLE],70,An engineer created growable ice towers to help combat droughts in the Himalayas,engineering,,https://gfycat.com/realisticmemorableambushbug,1196,What’s with all the comments in this thread calling the inventor a genius? Sock puppet accounts? This looks like an ad for a neat idea but it’s just an ad. ,2019-10-01 13:33:50
501,4n3rnt,False,[MECHANICAL],12,Barrel cam mechanism found inside a microscope,engineering,,https://media.giphy.com/media/I1n6WCQh6fo3u/giphy.gif,527,Now I get how the 2 spurving bearings were in a direct line with the panametric fan. ,2016-06-08 06:57:03
334,698zwr,False,[CIVIL],53,Building sinking as a result of soil failure,engineering,,http://i.imgur.com/2bHnMW4.gifv,651,r/watchhousesdie ,2017-05-04 17:34:23
626,c92r1w,False,[MECHANICAL],60,One of the best engineering educators on YouTube demonstrating a practical evaporative cooling system.,engineering,,https://youtu.be/R_g4nT4a28U,452,I'm pretty skeptical as to how well this thing scales for giant buildings or building systems. ,2019-07-04 13:43:34
634,gua5ng,False,[ELECTRICAL],25,Electronics have come a long way in the past half-century!,engineering,,https://youtu.be/lLvfjLi4NKY,453,Aren't 4 just the covered version of 5 ,2020-06-01 00:12:39
989,hrspkz,False,[ELECTRICAL],24,Found a 1969 Tektronix video offering a look at PCB design before CAD. Old PCB traces look organic because they are - engineers sketched them freehand with pencil and tape.,engineering,"If you've heard graybeards at your company talking about ""tape-out"" as a synonym for layout, this is what they're talking about.  Sorry for potato quality, if anyone can find a better version please post it!

[https://youtu.be/7weZ0TNRcuw?t=400](https://youtu.be/7weZ0TNRcuw?t=400)",https://www.reddit.com/r/engineering/comments/hrspkz/found_a_1969_tektronix_video_offering_a_look_at/,340,I actually laid out boards that way. ,2020-07-15 18:10:25
756,3wdf90,False,[CHEMICAL],108,Dow Chemical and DuPont announce merger,engineering,,http://www.dowdupontunlockingvalue.com,409,Pimping ain't easy ,2015-12-11 13:20:39
880,1lc87o,False,,93,I'm a university student that has been working on a SolidWorks model of a DOHC 12-Cylinder Combustion engine. I would love some feedback! It's my most prized model.,engineering,,http://i.imgur.com/TfKQlxP.png,377,Will it be efficient? What is the specific fuel consumption? What is the compression ratio? Is it at least designed for good performance?  ,2013-08-29 16:33:31
159,bi7wcr,False,[MECHANICAL],110,The pressure required to crush this lego vehicle,engineering,,https://gfycat.com/KeyImpureGalapagosmockingbird,970,"Amazing, is that psi or total pressure? ",2019-04-28 05:10:24
839,2x75r6,False,,118,CT scanner rotating with the outer cover off,engineering,,http://www.youtube.com/watch?v=2CWpZKuy-NE,385,"This may be a silly question but - how does all the data from those sensors and instrumentation make it to the stationary part of the housing? Or the imaging computer in the other room?

I feel like wireless signals would interfere with the imaging, no? ",2015-02-26 04:28:22
181,1pjjfh,False,,108,Universal Joint. xpost r/gifs,engineering,,https://d2t1xqejof9utc.cloudfront.net/screenshots/pics/5861891c555e080697c2864fb810c580/medium.gif,904,Mhmm that beautiful Solidworks ,2013-10-30 15:07:02
185,3ymt1h,False,,190,Engineers vs. Machinists,engineering,,http://youtu.be/7rn4ByKtGBY,895,This is why I gave up a full MEE degree for a quality BSMET degree. :) ,2015-12-29 07:51:44
382,3ozuhv,False,[PROJECT],49,Converting old Fiat into an electric vehicle,engineering,,http://imgur.com/gallery/cZdgX,619,"[deleted]  
 ^^^^^^^^^^^^^^^^0.0608 
 > [What is this?](https://pastebin.com/64GuVi2F/71281) ",2015-10-16 14:46:56
235,g3v6th,False,[AEROSPACE],31,The Insane Engineering of the SR-71 Blackbird,engineering,,https://www.youtube.com/watch?v=3hYSnyVLmGE,786,"The video mentions the successor being in development. With the advent of satellites, there must be a new use case. Or will it still be a hypersonic spy plane? ",2020-04-18 21:13:25
462,gh2qi1,False,[ELECTRICAL],45,SSDs / VNAND make me want to find and thank an Engineer.,engineering,,https://youtu.be/5Mh3o886qpg,550,[deleted] ,2020-05-10 14:45:15
541,4gvx7s,False,[CIVIL],106,This device is used to identify imperfections in welds. It creates a magnetic field and the pink powder is magnetic.,engineering,,http://i.imgur.com/9UuHyfU.jpg,495,"I wouldn't consider this ""civil""? ",2016-04-28 20:25:14
439,5eloa3,False,[ELECTRICAL],38,"Starting in 2018, China will begin turning coal plants into nuclear reactors (literally)",engineering,,https://www.extremetech.com/extreme/239588-starting-2018-china-will-begin-turning-coal-plants-nuclear-reactors,569,Noooooooo!    ,2016-11-24 03:42:43
643,8u0bfq,False,[GENERAL],35,What is Cavitation? - Practical Engineering with AvE,engineering,,https://www.youtube.com/watch?v=zCE26J0cYWA,447,Never watched the PE channel before...isn't practical engineering redundant? I mean aside from those misnamed professions which are still practical but not necessarily engineering. Thanks for the vidjeo. ,2018-06-26 14:11:28
293,c5e7b8,False,[GENERAL],99,[TIP] Browsing the McMaster-Carr online catalog is a great way to expand your knowledge of mechanical components and design options.,engineering,"If you will have to do any sort of mechanical design at any scale (for a job, internship, design team, club, etc.) take some time to browse the McMaster-Carr site and the different parts they offer. (I recommend MMC specifically because of the large catalog and amazing site).

Just searching terms like ""valves"", ""hinges"", or ""bolts"" has given me so many options to click through. When you see a part you've never heard of, a quick Google search can get you up to speed.

This process is how I learned about countless parts that I can use in future designs that are not necessarily covered in classes. I didn't know about things like lag bolts, solenoid valves, vented screws (for vacuum), ball screws until I just started exploring.

Having a better idea of all the different components out there, even at a very general level, really opens up your ability to be creative and effective in your designs. Plus, it's fun if you're an engineering nerd.

Edit: A few people have mentioned Misumi as another great hardware supplier and Digikey as the equivalent for any electronics",https://www.reddit.com/r/engineering/comments/c5e7b8/tip_browsing_the_mcmastercarr_online_catalog_is_a/,698,And buying from McMaster is a great way to incur surprise shipping fees! ,2019-06-25 19:57:08
538,9o29o6,False,,146,"I 3D printed a steel mini gas turbine stator, more pics of the engine and details in the comments.",engineering,,https://i.imgur.com/qffY5Oj.jpg,501,"No offense dude, but that is one fugly-ass build. You need more robust supports toward the edges and you seriously need to refine your upskin parameters, or at least build it on a 5–15 degree slant, geometry permitting. ",2018-10-14 12:13:20
559,2xp2ky,False,[CIVIL],118,John Oliver's take on the State of American Infrastructure,engineering,,https://www.youtube.com/watch?v=Wpzvaqypav8,492,"Itt, people who have never paid a single penny in taxes yelling about raising taxes.  ",2015-03-02 18:55:36
147,9zneab,False,[GENERAL],35,239 Engineering courses that are free to learn [various institutions],engineering,,https://www.edukatico.org/en/courses/engineering?free=true&language=2,1015,Commenting for later. ,2018-11-23 11:02:13
482,d55kxw,False,[GENERAL],75,Uncovered CT scanner spinning up,engineering,,https://youtu.be/ih_mTjMrrb0,539,SPEEN ,2019-09-16 19:50:44
269,2gsd1d,False,,64,"Stress analysis of a ""bracket""",engineering,,http://i.imgur.com/IWZpfzJ.jpg,743,[Whoa](http://imgur.com/tTc9cKQ?tags) ,2014-09-18 19:03:41
682,1x1gtg,False,,123,"They're on fans now, too!",engineering,,http://imgur.com/pXdHXC7,433,[deleted] ,2014-02-05 01:39:39
449,1r8jv2,False,,40,The head of the Ceramics department at my university sent out this e-mail after we (the students) lost the canned food drive.,engineering,,http://imgur.com/IQ0HKZF,555,How many of those cans went to Walmart employees?  ,2013-11-22 19:35:30
495,2gcl4i,False,,112,How engineers play Hangman,engineering,,http://imgur.com/eJoYKHU,532,"Last I checked people don't weigh lb-ft.  

And hopefully sleep deprived, if the answer were to follow the units it'd be lb-ft^2. ",2014-09-14 05:31:55
343,cf89zl,False,,164,Has CAD completely taken over pen and paper or do you still prefer to draft concept and early designs with a quick sketch?,engineering,,https://i.redd.it/b5tdnw5st9b31.jpg,643,Who the hell is claiming that its taken over?!  WTF? ,2019-07-19 14:32:53
554,18os9w,False,,48,As a power engineer I have to say...,engineering,,http://imgur.com/rfr5gJ6,491,"Your mom's going to want those back, you know. ",2013-02-17 11:23:14
733,3mppqp,False,[MECHANICAL],288,"I work in Diesel Emissions (not at VW), some information about our niche and AMA.",engineering,"Watching this VW thing unfold has been like watching the last ~10 years of my work show show up in main stream media. We're usually the guys that no one remembers exists.

I don't work at VW, but at a contemporary. As soon as I heard about what they were accused of doing I thought about how I would do something similar. I can't guarantee this is *exactly* how VW does it, but just looking at [Indeed it's how a large number of companies do it.](http://www.indeed.com/q-Calibration-Diesel-Engineer-Engineer-jobs.html)

1. IMHO, forget any ""it was an an accident"". It's hard enough to make things work the way you want them to as is. This went through no more than a dozen people for multiple stages of development.

2. There are really only 3 OEMs for Diesel ECMs: [Bosch, Denso & Delphi](http://imgur.com/pPpn1DC). VW isn't running their own custom hardware, they outsource it to Bosch. The latest Bosch diesel ECM is the EDC17.

3. The EDC17 is running a [Infineon 32-Bit Tricore uC](http://www.infineon.com/cms/en/product/microcontroller/32-bit-tricore-tm-microcontroller/channel.html?channel=ff80808112ab681d0112ab6b64b50805).

4. The ECMs is most likely through [Simulink](http://www.mathworks.com/products/connections/product_detail/product_35878.html) (Ours is). There are a few companies that provide [Simulink/Matlab support](http://www.infineon.com/cms/en/product/microcontroller/development-tools-software-and-kits/tricore-tm-development-tools-software-and-kits/simulation/modelling/channel.html?channel=ff80808112ab681d0112ab6b596207e5).

5. ECMs are tuned through [VectorCANape](https://vector.com/vi_canape_en.html). Everyone I know of uses CANape. As far as I know there isn't really any competitors. [Here's a youtube video showing the 'latest features' of CANape12](https://www.youtube.com/watch?v=OrlCRuHr0XQ&list=PL36EEEC4559038DF6). (When I started we were stuck with CANape 6.5 for ages).

6. A decade ago there may have been 10-20 adjustment maps. Temperature, boost pressure, barometric pressure, coolant temperature, etc. Now there are dozens if not hundreds of maps. At $10k/hr+ for test cell time you don't 'accidentally' calibrate a map that you don't need.

7. The EPA has mandated that I have to try and defeat you defeating me. This includes encrypting everything, checking if you try and remove the DPF or EGR, etc.

Edit: Some more things.

8\. Not sure who VW uses but there are only [3 compilers for the Infineon Tricore.](http://www.infineon.com/cms/en/product/microcontroller/development-tools-software-and-kits/tricore-tm-development-tools-software-and-kits/compiler-tool-chains/channel.html?channel=ff80808112ab681d0112ab6b55d607d9). All of support of any of those compilers doesn't come cheap either.

9\. I've found *some* documentation that the EDC17 is [AUTOSAR](https://en.wikipedia.org/wiki/AUTOSAR) compliant. However a lot of this documentation is under NDA so it's hard to find decent information on Google.

10\. The EDC17 is *9* years old. Once you get something working you stop trying to be the 'newest'. You can't just toss a RaspPi or Adruino under the hood to run these things. Under the hood with diesel engines in one of the worst environments. It shakes, it's dirty, you have to be able to handle a lot of stray voltages. 

11\. If this is stuff that interests you and you want to go into this industry as a living:

- EE's look into the [ST SPC5-32bit](http://www.st.com/web/en/catalog/sense_power/FM2098/SC963?icmp=sc963_pron_launch-eiger_apr2015&sc=spc5-pr1) chips/boards or the [FreeScale e200](http://cache.freescale.com/files/32bit/doc/white_paper/E200CORELCNWP.pdf)/[Freescale MPC56xx](http://www.freescale.com/products/power-architecture-processors/mpc5xxx-5xxx-32-bit-mcus/mpc56xx-mcus:MPC56XX?cof=0&am=0).

- ME's, [learn Simulink](http://ctms.engin.umich.edu/CTMS/index.php?example=AircraftPitch&section=SimulinkModeling). Inside and out. [Model based control](https://en.wikipedia.org/wiki/Model-based_design) is becoming the industry standard. As far as I know everyone uses some variant [of what Caterpllar published](http://www.mathworks.com/tagteam/20303_91198_Caterpillar_2004-01-0894.pdf) they do in 2004. That stuff is mature enough to be in the [Aerospace industry](http://www.mathworks.com/company/user_stories/airbus-helicopters-accelerates-development-of-do-178b-certified-software-with-model-based-design.html?by=product). Those non-Free compilers [go ""out of their way""](http://www.mathworks.com/hardware-support/vxworks.html) to support Simulink. [Boeing](http://www.mathworks.com/company/user_stories/matlab-and-simulink-help-land-unpiloted-boeing-spacecraft.html?by=product), [Bell Helicopter](http://www.mathworks.com/company/user_stories/video-using-model-based-design-bell-helicopter-creates-the-worlds-first-civilian-tiltrotor.html?by=product), [ABB](http://www.mathworks.com/company/user_stories/abb-accelerates-application-control-software-development-for-a-power-electronic-controller.html?by=product), [Daimler](http://www.mathworks.com/company/user_stories/daimler-designs-cruise-controller-for-mercedes-benz-trucks.html?by=product), [NASA](http://www.mathworks.com/company/user_stories/nasa-marshall-space-flight-center-internship-program.html?by=product), etc.

12\. Learn about eTPU's. [FreeScale has some precompiled](http://www.freescale.com/webapp/etpu/) functions. As far as I know there isn't a free eTPU compiler. There's [Ashware](https://www.ashware.com/) and [Bytecraft](http://www.bytecraft.com/eTPU_C).

Also, if there are any EE hardware engineers out there that would like to develop a modern diesel ECM for 4-6 cylinder engines. From rotary pump, [Pumpe Düse""](https://en.wikipedia.org/wiki/Unit_injector), to[Common Rail](http://de.bosch-automotive.com/en/parts/parts_and_accessories/motor_and_sytems/diesel/common_rail_injection/common_rail_diesel_motorsys_parts)... PM me. MegaSquirt is ~20 years behind industry. ",https://www.reddit.com/r/engineering/comments/3mppqp/i_work_in_diesel_emissions_not_at_vw_some/,420,"I knew Vin Diesel was a human, but are we really testing his darts? ",2015-09-28 16:06:39
291,8njqy0,False,[ARTICLE],49,Florida brewery unveils six-pack rings that feed sea turtles rather than kill them,engineering,,http://www.nola.com/environment/index.ssf/2018/05/six-pack_rings_that_feed_sea_t.html,696,Florida man bad.  Florida m**e**n good! ,2018-05-31 16:20:21
384,2il9cq,False,,113,There was a small dent in a piece of 80/20 we ordered,engineering,,http://i.imgur.com/PjCyXDB.jpg,605,Nothing that the combined powers of WD-40 and duct tape can't take care of. ,2014-10-07 19:55:53
543,1125wf,False,,76,How engineers see the world,engineering,,http://imgur.com/RyFaB,498,I can't see the difference?  Guys?  Can anybody help me out? ,2012-10-06 21:49:18
