Num,ID,is_Original,Flair,num_comments,Title,Subreddit,Body,URL,Upvotes,Comments,creation_date
367,50nm20,False,[MECHANICAL],63,"Two wonderful machines, One amazing hit.",engineering,,https://media.giphy.com/media/l3vRcYCp0jcRHZjW0/giphy.gif,622,"Videos in this thread: [Watch Playlist &#9654;](http://subtletv.com/_r50nm20?feature=playlist)

	VIDEO|COMMENT
	-|-
[Chomp vs. Bite Force - BattleBots](https://youtube.com/watch?v=KqZhfoADvOE)|[21](https://reddit.com/r/engineering/comments/50nm20/_/d75p7qu?context=10#d75p7qu) - 89 updoots and no link to the video?  Reddit, I'm not mad, I'm just disappointed...  Watch the full carnage here 
[Hypershock vs. Warrior Clan - BattleBots](https://youtube.com/watch?v=UNk5-3fGNqI)|[7](https://reddit.com/r/engineering/comments/50nm20/_/d7601dt?context=10#d7601dt) -   That rake was a brilliant adaptation of the existing design. I know the drone was mostly for show, but the exploding gas cylinder (i'm assuming) made for a great kill. Probably the most satisfying I've seen. 
[[BattleBots 1.0] Diesector vs. Grendel](https://youtube.com/watch?v=MQnx1URup9A)|[2](https://reddit.com/r/engineering/comments/50nm20/_/d76nwiw?context=10#d76nwiw) - Grendel  Video 
I'm a bot working hard to help Redditors find related videos to watch.
***
[Info](https://np.reddit.com/r/SubtleTV/wiki/mentioned_videos) | Get it on [Chrome](https://chrome.google.com/webstore/detail/mentioned-videos-for-redd/fiimkmdalmgffhibfdjnhljpnigcmohf) / [Firefox](https://addons.mozilla.org/en-US/firefox/addon/mentioned-videos-for-reddit) ",2016-09-01 15:02:34
654,76tcvf,False,,129,FREE Legit Educational version of CATIA,engineering,,https://academy.3ds.com/en/software/catia-v5-student-edition,440,...Windows only. ,2017-10-16 20:27:45
610,44z6pf,False,[ARTICLE],94,"Hundreds of California homes, buildings used plans drafted by 2 phony engineers, say authorities",engineering,,http://www.foxnews.com/us/2016/02/09/hundreds-california-homes-buildings-used-plans-drafted-by-2-phony-engineers-say-authorities.html?intcmp=hpbt4,463,[deleted] ,2016-02-09 21:53:13
248,9rm2n1,False,[ARTICLE],35,190 universities just launched 600 free online courses. Here’s the full list.,engineering,"At first glance it looks like there are a ton of currently relevant engineering courses for you to get your hands on. At least based on the open positions that I see posted in my area of the US

[List found here.](https://qz.com/1437623/600-free-online-courses-you-can-take-from-universities-worldwide/)",https://www.reddit.com/r/engineering/comments/9rm2n1/190_universities_just_launched_600_free_online/,763,"here comes all the ""self taught"" people (eye roll) ",2018-10-26 16:08:30
552,f7m41g,False,[MECHANICAL],108,Germany gears up to test 20MW wind turbines,engineering,,https://reneweconomy.com.au/germany-gears-up-to-test-20mw-wind-turbines-79007/,494,[deleted] ,2020-02-22 02:27:34
23,7n6b9y,False,[ELECTRICAL],168,For part of my masters I had to fabricate LEDs. Here is an album showing the process.,engineering,,https://imgur.com/a/ajeFs,2397,I always wondered if it was possible to make and LED bulb at home. This answers that question.  Nope. ,2017-12-31 03:50:08
601,fk4xxm,False,[CIVIL],20,Top 20 Construction Projects Completing in 2020,engineering,,https://www.youtube.com/watch?v=LZQsMSaeLO8,470,Where is motera stadium. It is 100k+ capacity stadium ,2020-03-17 13:07:26
237,4hqs7i,False,,14,60 Free Online Course in Engineering,engineering,,http://betteryourselfonline.com/63-free-online-courses-engineering/,786,Thank you for this. I'm going to check out microcontrollers.  ,2016-05-03 22:05:25
793,59yqgq,False,[GENERAL],48,Project meetings from the engineer viewpoint. Probably a repost.,engineering,,https://youtu.be/BKorP55Aqvg,392,"TBH I view this as an engineer who is completely unable to attune himself to an audience. Rather than arguing over the details, this man should have tried to understand and solve the real problem at the table. Explaining what the word perpendicular means is irrelevant here. This man should never have came to the meeting. And this is largely why sales engineers exist. 

I know engineers typically dislike business people, but I wonder if we reached a point where management can bring an engineer into a meeting like this, maybe we would have less disconnect between managements expectations and the engineers ability to solve a given problem. 

 ",2016-10-29 03:41:23
275,2ebamu,False,,176,Why is this a thing... why...,engineering,,http://i.imgur.com/PLQCEgJ.png,725,"Bahahaha 
The way that I rank the basic forms of engineering are:
Chemical
Mechanical
Computer
Civil
Electrical 

Civil and computer are kinda tied for second to last....
But if you are towards the top, you learn everything that the people below you learn.
EE's are glorified electricians
And civils are glorified architects 

 ",2014-08-22 21:17:24
157,1ecmm6,False,,168,I just got fired today. And it was awesome.,engineering,"Working as an engineering technologist for smaller job shop. Been somewhat miserable since December. Snuffed on bonus work I completed. Zero appreciation for work done and extra hours put in. Working on desk from the 1980's, doing CAD work on laptop. No talking, no music, anti-fun. Got yelled at for smiling (seriously). Boss hires friend without interview. Know my days are numbered. Let go on a beautiful day, hit a bucket of balls, hung out with some contract drafting friends, offered to get setup with one of the clients. Finances are fine and the S/O is supportive. Going out for supper.

",https://www.reddit.com/r/engineering/comments/1ecmm6/i_just_got_fired_today_and_it_was_awesome/,966,[/r/happy](/r/happy)  ,2013-05-15 00:15:12
802,1uw8db,False,,24,"While researching a job designing play structures, I came across my new favorite engineering diagram",engineering,,http://i.imgur.com/y3TXu4S.jpg,396,"Definitely read that as ""exciting section"". ",2014-01-10 17:43:13
422,b8yl8b,False,[GENERAL],186,Rant: Give me the rejection email at least!,engineering,"I got an interview a while ago and they asked me what I dislike the most about a company or soemthing. I replied with the title. Not getting at least a rejection email because I feel like there's no conclusion. Anyways they reply assuring me that they will 100 percent do that by next week. Guess what? Never replied back to me. Even after I sent a follow up. I guess to you veterans you guys are used to it lol. But I would like some minimal level of respect and tell me I didn't get the job. That shouldn't be so hard. Damn these companies that lead you on. Gotta keep licking their booty to get anything ffs. If you've read this far, thank you. Although we were very impressed with your patience reading this, we have moved on to other qualified things to hate on. Have a great day! ",https://www.reddit.com/r/engineering/comments/b8yl8b/rant_give_me_the_rejection_email_at_least/,580,"Get used to it. Particularly if you're dealing with a small company. People don't like to give bad news.

I learned the hard way that there are some people who simply will not tell you no, even if you call them directly and ask if you're still in the running. However, if you tell them ""I have a job offer elsewhere. If I'm still in the running, and you're interested, please give me an offer."" Then they will finally adult up and tell you that they won't be making an offer because they don't feel bad about saying no since you have an offer elsewhere.

But most companies will simply ignore you if they don't want you. You can bitch about it all you like, but all you will do is piss somebody off. They hold all the cards so just learn to suck it up and move on. ",2019-04-03 14:22:40
893,67ignt,False,[ARTICLE],217,"Oregon man sues state licensing board for violating first amendment through overzealous enforcement of restrictions on the title of ""engineer""",engineering,,http://www.oregonlive.com/portland/index.ssf/2017/04/beaverton_man_claims_oregon_st.html,365,[deleted] ,2017-04-25 18:27:49
481,1vqfml,False,,55,I asked for a hammer at work today... (X-post from r/funny),engineering,,http://i.imgur.com/YGmTzq1.jpg,536,USA!  USA!  USA! ,2014-01-21 03:51:20
61,cv092h,False,[MECHANICAL],118,Smoke shows how passive airflow is used to cool disc brakes,engineering,,https://i.imgur.com/bskcbQ2.gifv,1596,How badly do people drive to actually need this level of cooling?  In towns I am not going fast so not much heat would be generated. Between towns I don't touch the brakes much. ,2019-08-24 22:43:14
378,3ltcju,False,[CIVIL],160,My civil engineering senior design project 4 years ago sparked a lot of interest in diverging diamond interchanges from the DOT. They just finished up work on the first one in my state!,engineering,,https://www.youtube.com/watch?v=kF-IU-1lDzU,621,[deleted] ,2015-09-21 15:26:57
344,21ucl8,False,,154,Tesla's new titanium underbody shield vs. a block of concrete.,engineering,,https://d262ilb51hltx0.cloudfront.net/max/800/1*jX6zAXW-xmUgkNDhi891zQ.gif,646,"Not reinforced, your mama's fat ass could also break it. ",2014-03-31 17:19:43
717,3vkfmw,False,[MECHANICAL],18,[Video] Model V8 engine made out of paper. Runs on compressed air.,engineering,,https://www.youtube.com/watch?v=Pf3jnP6AbM0,422,Neat art project.  I'd be more impressed if the pistons did the work. ,2015-12-05 18:43:37
373,5fl5d3,False,,73,Unique engineering feat concluded as Chernobyl arch has reached resting place,engineering,,https://www.youtube.com/watch?v=n7aMcKinrWY,619,This video is about a minute too long. Other than that- holy crap! ,2016-11-29 20:46:24
332,18lu78,False,,100,10 years of hard work and dedication,engineering,,http://i.imgur.com/jD8nkwq.jpg,657,[deleted] ,2013-02-15 22:41:56
76,3olqmh,False,[CIVIL],328,An Engineer Explains Why Trump's Wall Is So Implausible,engineering,,http://imgur.com/gallery/n0JUK,1433,"> The men and women doing the work of actually installing the wall would have to be provided with food, water, shelter, lavatory facilities, safety equipment, transportation, and medical care.

Devil's advocate, but why would these things have to be *provided*. We're talking cheap labor here. 

They can bring their own food and water. Where they sleep and how they get to and from work is their own concern. The desert is their bathroom. If they die on the job that is their problem.  ",2015-10-13 16:28:07
967,cue5o8,False,[GENERAL],9,Sad News. Dr Angelo Grubisic died earlier this week,engineering,"Some sad news to share with everyone. Dr Angelo Grubisic died on Tuesday during a planned jump in Saudi Arabia. 

Angelo was an astronautical engineer and led the wingsuit design team at the University of Southampton. 

He inspired students to consider careers in science and engineering. We were lucky enough to spend a week with him a few years ago when we worked on a film with him. A really inspirational guy and a fantastically talented Engineer and lecturer at Southampton.

( There is a bit more info about Angelo and his work @ https://www.bbc.co.uk/news/uk-england-hampshire-49438378 )",https://www.reddit.com/r/engineering/comments/cue5o8/sad_news_dr_angelo_grubisic_died_earlier_this_week/,347,That’s the dude that worked on the Ironman suit ,2019-08-23 13:49:38
648,2l27hl,False,,84,"On his deathbed, Tesla was asked ""Of your inventions, what is your favorite?"" He answered: ""My turbine""",engineering,,https://www.youtube.com/watch?v=mrnul6ixX90,445,There's a hidden sex joke in there somewhere.  ,2014-11-02 13:07:44
902,boyten,False,[GENERAL],87,"Boeing altered key switches in 737 MAX cockpit, limiting ability to shut off MCAS",engineering,,https://www.seattletimes.com/business/boeing-aerospace/boeing-altered-key-switches-in-737-max-cockpit-limiting-ability-to-shut-off-mcas/,364,Boeing is FUCKED! imagine owning shares of it. ,2019-05-15 14:46:25
174,b7ozl7,False,,40,I built a 360 rotating rig for slow motion videos - 150 RPM,engineering,,https://www.youtube.com/watch?v=bVx-PFkDf_E,921,lol faek ,2019-03-31 15:34:29
777,efiyja,False,[BIO],12,"In a bid to make upper-limb amputees feel whole again, U researchers join human and machine in the new 'Luke Skywalker' prosthetic arm.",engineering,,https://magazine.utah.edu/issues/winter-2020/a-new-hope/,399,[deleted] ,2019-12-25 17:13:40
710,191dgj,False,,119,Never has there been an event so empty,engineering,,http://i.imgur.com/4a8CP8s.jpg,424,I wish this wasn't true.  Although there are a lot of babes in the Man Eng program at my school. ,2013-02-22 19:37:48
143,7d5mmj,False,[MECHANICAL],176,How not to dimension/design,engineering,,https://imgur.com/tPgvAOX,1026,cad techs are a dying breed. ,2017-11-15 17:26:06
911,bd8nnf,False,[GENERAL],32,I’ve just found out my Grandfather is the last Plumbing Engineer Alive in the United States and will probably be the last one.,engineering,"In my state (Massachusetts) a few decades ago, this was the only state where Plumbing Engineering was officially recognized, and my grandfather registered as one. 

Eventually, Plumbing Engineering was no longer recognized, and so nobody else in the Entire Country can be a plumbing Engineer. My grandfather became officially recognized as an Engineer of this sort, all the others went into Mechanical Engineering, Fire Engineering, etc.",https://www.reddit.com/r/engineering/comments/bd8nnf/ive_just_found_out_my_grandfather_is_the_last/,361,"I saw a video regarding salaries by I believe Watchcut, and it featured a relatively young plumbing engineer, though my memory may be failing me ",2019-04-14 22:42:00
103,g8stxy,False,[GENERAL],437,"Engineering boot camps need to stop. The title of engineer needs to be more regulated. The ethical and practical implications of loosely regulated software engineering standards could be disastrous, as society increasingly depends on software.",engineering,"*^(This post is meant to spark constructive discourse on the matter. Please keep it civil. Everything written is from my point of view and I happily welcome the possibility of being completely wrong. I am all for engineers who haven't been able to acquire a formal education for whatever reason but who are actually, truly, worthy of the title.)*

&#x200B;

>*When it comes to skyscrapers and bridges and power plants and elevators and the like, engineering has been, and will continue to be, managed partly by professional standards, and partly by regulation around the expertise and duties of engineers. But fifty years’ worth of attempts to turn software development into a legitimate engineering practice have failed.* [Source](https://www.nspe.org/resources/blogs/nspe-blog/the-cheapening-the-engineer-title)

&#x200B;

The other day, I was browsing Reddit and I stumbled upon yet another echo-chamber of deluded people who were encouraging these so called **S*****oftware Engineering boot camps***: ""*become a Software Engineer in* ***three months***!"" I kid you not when I say that the comments were along the lines of ""I got bored one summer so I took a three month course and I am now a software engineer!"".

Excuse me? Are we a joke to these people? Most importantly, have the companies that are allowing them to be hired under the title of ""engineer"" gone mad? (hint hint: it's so much cheaper to pretend programmers are engineers, pay them way less, make them feel important and allow the release of buggy, faulty software that one day might actually result in disaster - because to these people, software engineering = programming!).

In some countries, the title engineer is, for some arcane reason, not (as) protected (as it should be), meaning anyone can legally (find a way to) call themselves an engineer. Engineering is a serious profession and requires years of carefully regulated formal education to acquire the theoretical background and tools to support the practical applications of said theory.

It seems as if an alarmingly large amount of people believe that Software Engineering, Computer Engineering, Computer Science, Software Development and Programming are all *synonyms*.

**They are not**. You **cannot** ""boot camp"" your way to becoming an engineer in the span of three months (and so many of these boot camps **do** exist, just google them) just as you cannot boot camp yourself to becoming a psychologist, a mathematician or a physicist. You can learn anatomy, you can learn to solve equations, but that is just a *tiny* portion of each profession. I feel like the same must be said about software engineering.

Engineers are supposed to have knowledge in Mathematics and Science, amongst many other things, enough so to apply them in the designing and manufacturing of systems and in effectively solving a problem.

**Please** stop calling yourselves engineers when all you have are 12 weeks of training in programming languages. Software Engineers are so much more than that! Understanding to its core how a computer functions or how neural networks are structured, applying differential equations to solving mechanical movements in robotic arms, designing a quantum computer system capable of running trillions of calculations in the blink of an eye without crashing or drawing too much power to black out an entire city. These are just examples of the many things engineers can do, given adequate time to **adapt** to each scenario.

**We do not work our butts off to learn how to program the ""Add Friend"" button on Facebook or the ""Order Now"" button on Amazon.** Sure, we can do that and a numerous amount of Software Engineers choose software development as their career path, which is wonderful and diverse, but the difference is in the **method**, the **attention to technical detail**, the management of resources. The difference is in the fact that **an engineer has the background to adapt** to changes, any changes. We don't simply code what we're told to code and go home. We take a problem, dissect it, figure out the most efficient, safe and practical approach, and structure a proper testing of said approach.

The Software industry is turning into a mess, where standardized approaches and international standards are thrown out the window. Do you see many buildings, bridges or satellites spontaneously crumbling or blowing up? Maybe a few here and there, but they are by and large well built, solid works of engineering. Notice how many websites, databases, and applications, save for a few lucky cases where true professionals are involved, are constantly broken, sloppily designed pieces of copy-paste code put together with duct tape.

Now, I understand that *civil* engineering, to make an example, requires more regulation due to safety reasons, but let's not forget the implications a poorly designed system can have on a rocket going to Mars, or in a centralized home automation system that can ultimately result in catastrophic failures and the loss of lives.

Software and Computer Engineering should be treated with the same respect any Engineering field merits. Software Development is a practice that Software Engineers should be capable of doing with excellent skill, but is in no way the only thing we do. When I see amateur programmers being given the title of engineer in companies, I die a little inside.

Ultimately, I believe the problem stems from the fact that in this oh-so-young profession, there is so much money to be made in developing websites for large companies that many engineers have shifted their focus towards this market. Just look at how much money FAANG companies are willing to throw at you. It has been forgotten that engineers do so much more than just basic Software Development.

Given that society is rapidly approaching a future where software governs our lives, I believe firmer regulations must be extended to all fields of engineering, including software. After all, automated-driving is a rapidly approaching reality and Tesla is already the top seller in many places. What would happen if these purported ""boot-camped"" engineers laid hands on the core self-driving software that ultimately decides the fate of so many lives? Let us never find out.  


EDIT 1: I will further emphasize this as I do hope nobody misinterprets me - I am in no way elitist and saying that formal education must be a requirement to do anything. That would be silly. There are infinite ways people can learn things and not everyone has access to the very fortunate avenue of University, for which I am eternally grateful. A certification from three months of summer camp is not enough, however. Just to be clear :)",https://www.reddit.com/r/engineering/comments/g8stxy/engineering_boot_camps_need_to_stop_the_title_of/,1241,"Haha OP I thought you meant real engineering, like mechanical, or chemical.

Software engineering is coding, you don't need a deep knowledge of physics or mathematics for that! 

I agree with you tho, the day I found out satellite engineers install satellites on the side of houses I decided I wouldn't stay in the UK after my degree. ",2020-04-27 03:33:42
674,7ddivd,False,[MECHANICAL],30,How a differential Works,engineering,"https://www.youtube.com/watch?v=yYAw79386WI

I came across this video recently and the way it is explained is magnificent, so I thought I would share. ",https://www.reddit.com/r/engineering/comments/7ddivd/how_a_differential_works/,437,"i was going to scream if this was another ""engineering"" explained video. ",2017-11-16 16:31:08
446,6632an,False,[MECHANICAL],68,What can you cut with paper? (xpost r/interstingasfuck),engineering,,https://www.youtube.com/watch?v=eLXHLRa37_g,567,[deleted] ,2017-04-18 14:13:13
323,5b4sai,False,,57,Omnidirectional conveyor belts are pretty cool,engineering,,https://www.youtube.com/watch?v=tqLYhhV7u7Y,666,Wow! Super cool!!! I wanna do that!!! ,2016-11-04 17:06:45
348,4bcqth,False,[MECHANICAL],56,"Drone spine I've designed for final year project. Made from 2&3mm ply. 50x25mm box section, 1m OAL, 90g total. Static load of 20N at 0.6m, 3.5mm deflection, no plastic deformation.",engineering,,http://imgur.com/zSSsWdz,638,Embry-Riddle? ,2016-03-21 15:36:35
990,hijscv,False,,78,Science books for engineers and students,engineering,"During the quarantine I designed this website dedicated to the best rated science books on amazon. I had this idea because I am an engineer myself and I like scientific books.  
Please give it a try and share with your friends if you like it.  
I welcome any improvement suggestions and remarks.  
[https://goodsciencebooks.com](https://goodsciencebooks.com/)",https://www.reddit.com/r/engineering/comments/hijscv/science_books_for_engineers_and_students/,336,"A universe from nothing, by Krauss not a textbook though. Working with wood by Bruce hoadley, great book on mechanics of wood. ",2020-06-30 09:08:40
447,1f89hz,False,,22,Happy Birthday you sexy thing! You don't look a day over 22.,engineering,,http://www.imgur.com/pFYnEWh.jpeg,560,If only more bridges were as young and stout.  ,2013-05-28 22:33:38
47,g77v9x,False,[CIVIL],107,Military setting up a temporary bridge over the Colorado river,engineering,,https://gfycat.com/slightbriskhomalocephale,1818,Wouldn’t it just be easier to make the tanks buoyant? ,2020-04-24 12:54:14
749,ft45ve,False,[AEROSPACE],25,NASA's James Webb Space Telescope Primary Mirror Deployment Test a Success,engineering,,https://i.redd.it/3ykxc03wq8q41.jpg,404,"JWST ~ 10 Billion USD

ELT ~ 1.2-1.4 Billion USD

We could have seven or eight ELTs for the price of this over priced delayed telescope.  A waste of money even if it does successfully deploy and work as intended. ",2020-04-01 17:26:52
224,5wvg8u,False,[PROJECT],141,"6 years & $16 Billion Dollars later, the Hebron Platform is in final stages of construction.",engineering,,http://imgur.com/mppypc3,819,deleted  ^^^^^^^^^^^^^^^^0.1798  [^^^What ^^^is ^^^this?](https://pastebin.com/FcrFs94k/45873) ,2017-03-01 12:33:51
456,80nwrf,False,[CIVIL],28,Why Bridges Move (and other thoughts on thermal movement of civil works),engineering,,https://www.youtube.com/watch?v=pH7VfJDq7f4,546,"Big world, small internet, Grady. We grew up together in P-handle until we moved away in our 8th grade! 

Anyways, I've seen many of your videos and finally bumped into your user on Reddit. Awesome work and keep it up! ",2018-02-27 16:48:13
266,1ghasa,False,,30,My husband received his degree in Electrical Engineering yesterday. This is the cake I made him...,engineering,,http://i.imgur.com/Vd8ts5G.jpg,743,Waterloo? ,2013-06-16 23:06:29
732,1k7f2a,False,,34,Chart of Electromagnetic Radiations. (Original 10000x6958),engineering,,http://www.flickr.com/photos/llnl/9403051123/sizes/l/,414,I know where my $150 of free Uni printing credit is going! ,2013-08-12 13:42:53
771,1so08q,False,Mechanical,112,Paint roller cleaner for my Senior Design Project,engineering,,https://www.youtube.com/watch?v=0wcxWIkl-WY#t=20,403,"That's pretty cool, but unless you had to clean at least 10 rollers a day, I don't see how the whole setup would be worthwhile. ",2013-12-11 22:01:25
623,ea3vli,False,[GENERAL],192,Can we get flairs next to our names for engineering types?,engineering,Wouldn't that be nice?,https://www.reddit.com/r/engineering/comments/ea3vli/can_we_get_flairs_next_to_our_names_for/,458,Now thats what i call flair ,2019-12-13 13:17:50
945,cs6nxo,False,[MECHANICAL],37,Hydraulic hot riveting. Looks interesting,engineering,,https://youtu.be/PQP1TU47RqE,351,this was quite a riveting experience to watch... ,2019-08-18 20:32:35
692,2r7fqv,False,,35,Chevrolet suspension 1938,engineering,,http://youtu.be/1W_J6UhQP6s,426,"This bugs me, but in a double wishbone system the two arms do not have to be parallel. 

Depending on the amount of camber desired, the inner frame mounting locations should be closer together than the knuckle locations. 

They can be parallel, but do not have to be.  ",2015-01-03 14:55:32
