Num,ID,is_Original,Flair,num_comments,Title,Subreddit,Body,URL,Upvotes,Comments,creation_date
824,evfpfp,False,,17,"REALLY GOOD BOOK for beginners and intermediates!!! I highly recommend!! Detailed core descriptions of signs, planets, houses, aspects.",astrology,,https://i.redd.it/ucw7gtu9hmd41.jpg,112,Hmmmm thank you ,2020-01-29 01:43:01
558,awtojd,False,,83,Why is Aquarius the Water Bearer an air sign?,astrology,"Aquarius is an air sign because it deals with ideas, information, thinking. And with the sharing of ideas and information with others, with the ""group"". As for the water bearer, that represents, *is a symbol for*,  the pouring out of knowledge and information to others. In ancient times, people met at the well. That's where information about the village, about life, etc., was shared. A cup, or a vessel is a container, holding something which is given out to others. (There is also an entirely internal process like this with Aquarius.) As with every sign, there is much more to it, but that's the short answer.",https://www.reddit.com/r/astrology/comments/awtojd/why_is_aquarius_the_water_bearer_an_air_sign/,181,Aquarian’s think they’re water signs but they’re not.. they think they’re more open and emotional than they actually are imo.  ,2019-03-03 12:45:23
56,hmx9fs,False,,86,Mars conjunct Chiron,astrology,,https://i.redd.it/egsxiab1kg951.jpg,715,Moon conjunct Mars and Chiron as triple conjunction on July 11th amplifies the unhealed wound and trauma from the past considering Mars is at its home Aries. It's about stepping into action to face and process your unhealed wounds from the Past. The triple conjunction square Mercury in Cancer to remind you any past verbal abuse that might hurt your heart on deeper level will resonate from this energy. Take some to explore the nature will help you much better to process this uneasy aspect. Cheers\~ ,2020-07-07 16:00:06
87,ho5w2e,False,Noob Help,81,"Asteroids Cheat Sheet. One must be careful not to give them too much weight in a Natal Chart. When using asteroids the orbs must be very tight, not more than 1º orb. They are really only relevant astrologically if the Asteroid is conjunct the Sun, Moon, chart ruler, rising or Midheaven degree.",astrology,,https://i.redd.it/5x574v5dwu951.jpg,597,My Chiron is conjunct my sun mercury + Venus ,2020-07-09 16:14:06
578,feytwr,False,,121,Do those of you with multiple capricorn placements feel as if you’re aging in reverse?,astrology,,https://www.reddit.com/r/astrology/comments/feytwr/do_those_of_you_with_multiple_capricorn/,174,"Gemini with Cap Moon, Uranus, Neptune, North Node, and Lilith. I am an old soul aka an empath. My parents tell me often at 28 I am way more mature than they ever were. That's a weird statement. I also don't fit in with most of my peers or co workers since I have the mind of a 40 year old but the face of a teenager. For real, the struggles are real haha. ",2020-03-07 18:05:41
80,cgtgn3,False,,27,Here's Mars ♥️ Jupiter is next!,astrology,,https://i.redd.it/kas104g1f2c31.jpg,619,Hi .. ,2019-07-23 14:41:52
835,ha308a,False,,11,Easy way to check upcoming 2020-2025 eclipses and their transits through your natal chart,astrology,,https://i.redd.it/3pnofwbpm9551.jpg,107,can’t wait for that eclipse on algol 🥴 ,2020-06-16 12:26:15
463,7v313j,False,,15,Astronomical phenomena that will be seen in 2018,astrology,,https://imgur.com/ifg8RNV,226,Fab infographic! ,2018-02-03 23:37:25
774,bx2gh0,False,,24,Anyone know what this is and how to use it?,astrology,,https://i.redd.it/g2d4nre9gj231.jpg,123,A yarmulke ,2019-06-05 13:18:13
508,fe3eia,False,,27,JoJo (Singer) And the Blessing of the Saturn Return.,astrology,"Edit: Posted this on Twitter and JoJo read and responded! She found it fascinating and loves astrology 🥰✨


Random but it had to be written. UPROXX recently uploaded a short documentary on JoJo and it resonated so well with what I saw in her chart, rated AA. 

At 13, JoJo experienced massive success (2nd house profection year, hers ruled by expansive Jupiter, which trines her MC--more on that later), but was subsequently held hostage by a greedy (and now defunct) music label. As a result, she couldn't release music for more than a decade.

JoJo is an Aquarius Rising, and her Saturn is at 24 degrees of Capricorn, placing it in the 12th. When the ruling planet of the ASC is averse or ""hidden"" from the ASC, a theme of ""delay"" can prevail, as the steersman of your ship cannot see where it is going. Very frustrating. In JoJo's case, it is further compounded by the fact that her ASC ruler *is* the planet of delay and restriction. And that is further compounded by the fact that its a 12th house placement of loss. Whew!

In the midst of recording additional songs, her label dissolved (12th), yet she was still bound (Saturn) by the terms in her contract. She continued to record music but was not allowed to release any of it. **We need to note that JoJo has a massive 12th house Capricorn stellium--Mercury RX, Venus, Neptune, Saturn, Uranus and NN.** That she was forced into relative obscurity reinforces 12th house themes of things hidden, things ending, doing things in secret. Music studios are also the 12th house--forced creative isolation. She remarked in the documentary that she would constantly read articles that proclaimed she must have died. She recalled how frustrating it was to see musicians who started after her start to pass and out-succeed her. (Personally, this is such a huge Saturn struggle. It is the bane of my existence. Anyway....)

JoJo has Neptune and Venus closely conjunct in the 12th. In the documentary, she was gaslit into taking medication to make her thinner, under the guise that her label just wanted her to be ""healthy"". The fogginess of Neptune playing out next to her creative planet, Venus, is also indicative of being sold a bill of goods that never comes to be. In the beginning, she was very glamourized by Hollywood, private jets, opening for Usher, etc.--but when the fog settled, she was completely and utterly screwed by signing that contract: Mercury RX in the 12th. RX Mercury begs of you to dive into the details, to double check, to be sure, transit or natal. And music contracts are complicated and obtuse already. Placed in the 12th, she became a victim of her own pen. (Not blaming her, by the way.)

What ensued were years of substance abuse, another 12th house theme, especially with Venus ad Neptune co present. Unable to release or perform music, JoJo became ""a shell of herself"" and had to be ""buzzed"" in order to function. Only the realization that her dad was an addict (who died of his addiction it seemed--went to sleep and never woke up) snapped her back into reality, and she begun to take control. She hired a lawyer and became embroiled in a bitter legal dispute with her former label. Her Venus, in the 12th and conj. Neptune, rules her 9th house Libra of contracts, law, legal endeavors. So she was in for an uphill battle. But she has Mars square her ASC, which, yes, can render one a victim to martial energies from others (her label), but also energizes you for battle as a result. In Taurus, it also meant/means she has to fight for her art. 

In the meantime, she decided to release free mixtapes. A Saturn theme is stripping down to bare essentials. Ideally wanting to release music for profit, she had to settle for releasing music for free, and self-funding a lot of her creative endeavors. Though not firmly in her Saturn Return when she released these mixtapes, Saturn themes prevail for as it is her final dispositor. 

Anyway, the story gets happier. In 2014, she was freed from her contract. It was a 12th house profection year, and during Capricorn season. So matters of the 12th house were doubly activated. And Saturn lurked still behind it all. Mars trine Saturn natives also never give up no matter how steep the odds are stacked. Go JoJo!

*""Just imagine how the free bird will sing after being caged for so long,""* wrote one reporter. Holy 12th house! Only now, instead of entering a prison, she was leaving it. And thus began a new cycle for her, as she entered a 1st house year soon after. She signed to Atlantic Records. 

Despite being away for almost a decade, JoJo still had very loyal fans. During her legal battles ""#FreeJoJo"" was used on social media as a means of support for the singer, and many media outlets and blogs publicized her struggle. Fans and celebrities alike stood in solidarity. And when she was finally able to tour and release music again--she sold out shows, was streamed/downloaded tens of millions of times, soared to #1 on iTunes, and recouped all her expenses. Why? Sun and MC in the 11th house in Sag, ruled *and* trined by benefic Jupiter in Leo in her 7th. The 11th house describes the nature of our fans and friends. Though a ""victim"" of her business relationships early on, Jupiter in the 7th and ruling the 11th ensured JoJo would *always* have support from others. It also ensured that her public image, career, and reputation would always remain afloat and gifted positivity and expansion. The Sun and Jupiter also have mutual reception, each in the sign that the other rules. That's a wonderful tag-team to have by yourself to mediate the 12th house loss. Jupiter and Sun inflate you up again---and again and again. Jupiter also rules her second house so: money.

As her Saturn Return started, JoJo re-recorded and re-released her first albums, as her former label removed all of her music from the Internet. Having to go back and re-do everything, and with precision and perfection, (Mercury RX) is Saturnian, but JoJo found it extremely cathartic. She also changed some of the lyrics to reflect that she was in her late 20s now, and not an adolescent. Saturn as ruler of time and maturity.

As her Saturn Return became exact in early 2020, JoJo won her first GRAMMY for a comeback single released in 2019. She went on to be nominated for several other awards, and is slated for bigger things in the future. She announced a new album and tour for Spring 2020.

Whew, won't Saturn do it y'all! After he hits you with 2 by 4 after 2 by 4.

I hope this is reflection for people with heavy 12th house, and retrogrades, and heavy Saturn. Or people just curious/afraid of the Saturn Return. Mine is exact today so I found JoJo's story extremely resonate and because I'm also a trapped musician with Saturn in aversion to the ASC. Yes, shit does end up sucking hard---but never forever. And usually for the better. Saturn came back around for JoJo and as a result, all the planets in the 12th were loosened up to express more freely, retribution was delivered, debts were paid and money was flowing, and most importantly, life purpose was solidified and confirmed. 

p.s. One of her collaborators noted that she had a wise soul trapped inside the body of a young girl. Apropos for Saturn dominate people.

[EDIT: you can watch the short documentary here ](https://youtu.be/1Qpk1cb9C7Q)",https://www.reddit.com/r/astrology/comments/fe3eia/jojo_singer_and_the_blessing_of_the_saturn_return/,199,"Wow, being only a kid when her career suddenly halted I had no idea what was going on! That's absolutely mental. I coined that nickname in 2005 inspired by her, my name is Jordan. ",2020-03-05 22:30:47
199,es41md,False,,109,Thought you guys might be interested in this! An analysis of the signs of 50 of the most popular rappers over the last couple of decades (more info in the comments),astrology,,https://i.redd.it/zhjrrvyd78c41.png,395,"I think it’s interesting to note that a lot of rappers aren’t nearly as hard as they make their lives seem

Edit: LOL @ the downvote ",2020-01-22 00:39:53
623,fyil51,False,,70,The Planet Jupiter,astrology,"I felt compelled to write about my thoughts on the planet Jupiter for anyone who might be interested- the good and the bad. 

Imagine you're staring up at the stars or standing at the edge of the Grand Canyon overlooking the *vast* expanse in front of you. It's *awe-inspiring*. It fills you with *wonder*. It makes you realise that there are much greater forces at work beyond your tiny little self. The realities of bill paying and mundane chores are a world away. You look out at the horizon and start to think big and dream and hope. You suddenly have a sense of perspective, understanding, faith, belief in something greater, something higher, something *more*\- this is Jupiter. It is epic in scale, legendary, mythic, beyond words. It fills you up and carries you on a high, makes you soar on optimism and a fascination for what's out there, waiting to be uncovered and explored. It makes you seek out and discover, it gives you meaning and purpose in life, it's your compass. This is why it's the Greater Benefic. It rules priests and sages and gurus and philosophers and scholars. Those who dispense advice and spiritual wisdom. Those who journey to find the truth and then teach and preach it to those willing to learn. And Jupiter does have the potential to shower you with knowledge, wonder, and blessings. Astronomically it's the Great Protector, its gravity pulling in comets that would otherwise smash into the Earth and slinging them away into deep space. 

HOWEVER Jupiter can also become self-righteous, self aggrandising and self-mythologising. Like the Sun it can have an inflated sense of self importance, which with Jupiter can veer into ""I'm divinely chosen, my beliefs are the *right* beliefs, and I'm meant to do something great, it's my calling."" Jupiter can become a zealot. Jupiter can also be too abstract and theoretical and ungrounded, not at all rooted in reality. The professor who lectures from their ivory tower, who promises a lot with big dreams and grand visions but doesn't always deliver. Jupiter can leave you disappointed and disillusioned, the expectations you had about your life lying in pieces all around you. You'll see all these themes (the good and the bad) in the two signs it rules- Sagittarius and Pisces. You'll also see in them Jupiter's indulgence- its indulgence in experiences, alcohol, drugs, food, TV- whatever your vice is, Jupiter (when unhealthy) will want more of it. The expansiveness of Jupiter becomes untameable and unmanageable and can spiral into addiction.  

I wrote a bit of an essay there but I love writing about Jupiter. I feel I can speak to its nature with some authority because I have it conjunct my Ascendant and aspecting other vital planets in my chart. But I feel it's important for all of us to access our Jupiter and find that greater sense of purpose and vision in our lives. I'd love to know your thoughts on Jupiter.",https://www.reddit.com/r/astrology/comments/fyil51/the_planet_jupiter/,164,What are the effects of Jupiter with Mercury and Sun in the 12th house of Sagittarius ascendent? ,2020-04-10 16:02:45
599,hquusf,False,,73,why is not many people talking about the fact there is 4 planets in retrograde right now?,astrology,"I am just curious, in June there were 6 planets in retrograde at once and seemed like no one talked about it and only cared about Mercury.

&#x200B;

Also, how do this many planets being in retrograde affect us?",https://www.reddit.com/r/astrology/comments/hquusf/why_is_not_many_people_talking_about_the_fact/,167,"They say this is why the virus seems to have a slower advance now, due to the planets and that once they'll go direct again in September - October, the second wave will come back stronger. 🤷 Still hope not. ",2020-07-14 04:26:23
706,9apjkm,False,,25,Mars Now Direct,astrology,,https://i.redd.it/zpes6d19fni11.png,137,..and fits of rage along with it ,2018-08-27 14:48:25
802,cxo586,False,,23,Everything is in Virgo and EVERYTHING IS ON SALE.,astrology,"All of these Labor Day sales are having me want to shop. And the mutable earth sign energy is not helping. I do not need another jade roller, even if this one is better. I do not need that summer dress for next year. But dang... I want it.",https://www.reddit.com/r/astrology/comments/cxo586/everything_is_in_virgo_and_everything_is_on_sale/,116,"I'm new to astrology... But I suspect that my Virgo ascendant combined with my Taurus sun and Aries moon is going to have a LOT of fun with the bonus I just got this week.

I want to buy ALL of the luxurious comfortable things... and I want to buy them NOW!!! ",2019-08-30 22:45:20
180,a34jbx,False,,31,Repost r/funny: Aries and Taurus can be friends :),astrology,,https://gfycat.com/welloffalivecolt,419,Funny but Aries and Taurus often end up being best friends in my experience 😊 ,2018-12-04 20:30:35
686,birwfa,False,,31,I made Game of Thrones house sigils for each sign,astrology,,https://imgur.com/a/s17xH95,146,"I was this close to putting:
“House Cancer: Big Meaty Claws” ",2019-04-29 17:03:11
128,b8kqjl,False,,6,We are all forgiven,astrology,,https://i.redd.it/8qfu7opsthp21.jpg,495,I needed this. Lol ,2019-04-02 15:32:46
88,cft8dg,False,,34,found this mural and immediately thought of taurus and aries!,astrology,,https://i.redd.it/95mq92yh1kb31.jpg,599,"Lol that’s a goat, not a ram. ",2019-07-21 00:54:00
288,c2jj6r,False,,67,Anyone else have horoscope related knickknacks displayed in their home?,astrology,,https://i.redd.it/azfgttvzfc531.jpg,317,"♎️ rising so everything in my room is luxurious, but with ♍️ moon I have this need that my aesthetics be equally matched by utility. Any ♌️ indicators are usually pretty well hidden. There’s only two things I own that have the Leo indicator, a necklace of the Leo constellation and a pen holder with the constellation on it. 

I fell weird about overtly displaying those things to people in rl. ",2019-06-19 16:56:07
713,gnuke8,False,,10,Tip for new astrologers,astrology,"Every Thursday, astro.com unlocks all the delineations on your Personal Daily Horoscope so you can not only read the transit that is offered free, but all of the “Other transits occurring today” and the “Important long-term influences.”

These are high quality cookbook delineations (R. Hand) and specific to you. It’s quality stuff and a good snapshot of what transits are happening in your chart.",https://www.reddit.com/r/astrology/comments/gnuke8/tip_for_new_astrologers/,134,tyyy ,2020-05-21 10:43:45
222,babeek,False,,13,My fiance painted this for me!,astrology,,https://i.redd.it/emywcno0xqq21.jpg,376,Beautiful ,2019-04-07 01:34:31
610,c61mp4,False,,82,Is anyone else super interested in reading the birth charts of “evil” people?,astrology,"Like Ted bundy, Aileen wuornos (I know her case is a little more complicated), jodi arias etc? Even just people who are seen as problematic, like crazy reality stars lol. It’s super interesting to see how their placements interact and make them tick",https://www.reddit.com/r/astrology/comments/c61mp4/is_anyone_else_super_interested_in_reading_the/,160,No. ,2019-06-27 05:39:27
409,appz01,False,,21,Some zodiac art!,astrology,,https://i.redd.it/uftpe3glr2g21.jpg,249,Dot art? I remember I did something like this too in one of my high school classes. I think it was a Scorpion too but I may be wrong ,2019-02-12 05:40:00
