Num,ID,is_Original,Flair,num_comments,Title,Subreddit,Body,URL,Upvotes,Comments,creation_date
411,hr743v,False,,32,A Beautiful Astrological Portrait Connecting Naya Rivera and Cory Monteith,astrology,"I want to preface this by saying that this post will be centered on celebrating the life of Naya Rivera, and finding cosmic catharsis about what Astrology can show us about this moment in time for her and her soul. I will be couching everything in my Aquarius brand of impartiality, which I hope conveys a spirit of education and understanding versus usurping a tragic moment for clout. Though, if you see it that way, I do understand. I figured that since now all the what if's and when's and how's of the event have been answered, it would be an ok time to approach this event from a spiritual POV, and add to the zeitgeist of the moment.

I won't be examining the death of Naya or the circumstances surrounding it. I instead was curious about the Astrological through-line between Cory and Naya, and how the day of her recovery marked 7 years since his passing.

One of their Glee costars stated that Cory, in spirit, helped find Naya yesterday, bringing closure and peace. That made me go ""hmm"". And instead of excavating the crude facts of the moment, I was curious to examine what Astrology had to say about more intangible things like spirit guides, or help from beyond, the soul, and other karmic resonances.

Naya's body was recovered at 9:10 am in Ventura, CA (Lake Piru) on July 13th, 2020. [source](https://www.buzzfeednews.com/article/juliareinstein/naya-rivera-dead-glee-star-body-drowning-obituary?bfsource=relatedmanual)

For this, I want to focus on the NN (soul stuff), the MC (the most elevated part of the chart) and the Sun. Why? I figured that a recovery mission, something brought to light, would engage the planet of spotlight (Sun) and the highest moment in the sky (midheaven/MC). NN would point more towards the soul direction of a moment. I will also incorporate the 12th house--where things hide, and especially in water. Here is what I found:

\-The chart of the moment of recovery for Naya has the MC at 27 degrees of Taurus. Cory's Sun in Taurus conjuncts that point.

\-Cory's Sun in Taurus is also in Naya's natal 12th house. When you read this from a synastry POV, there are overwhelming themes of unconscious/subconscious bonds. Trouble, endings, loss. The Sun person illuminates the 12th house. Extrapolate if you will, to see Cory's Sun as helper/finder of Naya's resting place, where she lost her life, where she transitioned into the unconscious

\-The asteroid ""Cora"", closest to Cory (which I've learned is okay--to find the object with the name CLOSEST to the one you're looking for), is exactly conjunct the NN of the moment, 28 Gemini. Naya's natal Moon is also 28 Gemini in the 1st house. Cora, besides being facsimile for ""Cory"", is a name derived from the Greek goddess Persephone. She was goddess of the underworld, and represents the ""perennial change from life to death""

\-With the NN of the moment at 28 Gemini, exactly conjunct her natal Moon--we can see that the direction of karma in the moment related to her identity as mother. She put the responsibility of being a mother ahead of herself (Moon in 1st house). Reports are now showing that Naya used the last of her energy to boost her son up on the boat, unable to muster the energy to save herself.

\-In the chart of Naya's recovery, the asteroid ""Nayam"" was in the 12th house, and ""Nayan"" in the 7th conjunct Neptune, a planet responsible for drownings.

\-Cory's Cancer NN conjunct the Cancer Sun of the moment Naya was found

\-Seven years ago, Mars was at 29 degrees of Gemini, conj Naya's Moon. Conj. the NN of her recovery. Not sure what this means but wanted to make mention.

\-Naya's NN in Aries squares Cory's NN in Cancer almost exactly:

&#x200B;

>*""When one person's Nodes squares the other person's Nodes in synastry this will correlate to two  Souls who have been in some kind of relationship in which various dynamics and issues between them has caused them to separate from one another previous to the current life.  Coming into this life with that signature correlates to the intentions of each of their Soul's to 'pick up where it was left off' in order to continue to confront those issues so that the evolution together can continue in some way.""*

I find that to be very resonate, given that she was found on an anniversary of his death, and generally also died around the anniversary of his death. Both of their souls were working in tangent, but it is not up to us to clearly know or see how.

That is all I have for now, or perhaps forever. Without Cory's actual birth time and therefore house placement, there is only so much excavation that can be done. But I hope what I provided above helped you to be able reframe the breadth (and depth) of astrology, and see how it can be used to tie together resonance between two souls.

Thoughts? I'm 100% down with people thinking this is a stretch.

&#x200B;

Edit: The sabian symbol for 20 degrees Cancer is ""Gondoliers in serenade"". Two singers on the water. 20 cancer is the Sun on the moment of Naya’s recovery and the Sun on Cory’s death.",https://www.reddit.com/r/astrology/comments/hr743v/a_beautiful_astrological_portrait_connecting_naya/,249,The stars are beautiful and everything does happen for a reason.. ,2020-07-14 18:36:15
407,ftnvat,False,,79,Famous Astrology Quotes,astrology,"My favorite is by Arthur C Clarke, who said

“I don’t believe in astrology. I’m a Sagittarius and we are skeptical”.

Does anyone know any other great astrology based quotes?",https://www.reddit.com/r/astrology/comments/ftnvat/famous_astrology_quotes/,248,"'Astrology is astronomy in its nascent form.'

\- Jordan Peterson

[https://www.youtube.com/watch?v=mF05iXlH2KA](https://www.youtube.com/watch?v=mF05iXlH2KA) ",2020-04-02 15:03:58
711,dazli0,False,,26,"Learning Astrology has really helped me with the meaning of the phrase ""Out of your element""",astrology,"Knowing that I am a Gemini (an air) and learning that my Sun is in that, it really helps me understand why emotional situations are so awkward for me.  People that are extremely practical and grounded throw me off as well as really passionate people....these are all not my element.  So, knowing what the elements pertain to, it really makes it easy to see when I am truly ""out of my element""",https://www.reddit.com/r/astrology/comments/dazli0/learning_astrology_has_really_helped_me_with_the/,139,"I love the idea of this, but I don’t think it applies to me. I’m mostly earth and air with a little bit of fire and no water (except my MC). I love water signs and most of my closest friends are water signs. The keep me in touch with my emotions even with my air moon. If anything, I feel out of place around fire signs. Their energy is too much for me and my taurus placements. ",2019-09-29 19:07:16
667,8hkdio,False,,30,"Anyone else find it fascinating that as uranus enters taurus, the volcanoes started erupting in hawaii, basically creating new earth through destruction?",astrology,"Good ole Uranus, the planet of revolution and change in the way we think and feel.  The planet of the rebel and the ones standing up to the old way of things.  Taurus is the first Earth sign, sign of the fleshly senses.  Put those together and it just blows me away to see these volcanoes erupt and see a true example of this union.  To see the microcosm truly reflect the macrocosm...is awesome!",https://www.reddit.com/r/astrology/comments/8hkdio/anyone_else_find_it_fascinating_that_as_uranus/,148,"Yes, new manifestations of earth (taurus) radically changing for the future (uranus) stimulated by the new cycle's fire ejaculations (aries). I see it! ",2018-05-07 02:48:26
672,czjmmh,False,,11,Starting my study of astrology with this combo. Even better when the original is in your mother tongue!,astrology,,https://i.redd.it/dlkbnh5wckk31.jpg,144,Dos coka colas por favor ,2019-09-04 11:34:58
351,e5klxi,False,Noob Help,39,Just got a prism set up in my window and had an interesting idea... I know Isaac Newton had some thoughts on this but what about you guys?,astrology,,https://i.redd.it/o3kb2fpagg241.jpg,279,"thank you for this, i've been seeing the sign in the sacral (which i know now to be the jupiter symbol) for a while now. had no idea what it was until i saw this and realized it means something -- appreciate it! ",2019-12-03 17:41:20
427,hee5dv,False,,50,Themes of Neptune Retrograde,astrology,"Themes of Neptune Retrograde  
By [Ascendifi](https://www.ascendifi.com)

1.  **Face the Truth**: Has there been a situation in your life you have been turning a blind eye to? Neptune likes to keep the blinders over our eyes but since it’s Retrograde in its home sign of Pisces it is ripping off your glasses and pushing you straight into the sunlight. It may seem intense at first, but you can no longer hide how you feel about a person/situation any longer. Change is scary, but nothing is scarier than staying stagnant because it may be rough for an undisclosed amount of time. If you think back, weren’t you always happy you chose change over comfort?  


2.  **Tap into your spiritual side**: It’s time to take a hold of your anxiety and show it who is boss. Don’t try to fight these feelings but rather observe them and see what you can do to soothe yourself until the feeling passes. Meditate, ground yourself in nature, be present in the moment, get to know yourself again.  


3.  **Turn your vision into reality:** Neptune has been direct since November 27, 2019. How many of your promises have you kept to yourself? Have you worked on your dreams or even acknowledged them? Have you cut through subconscious thoughts and limiting beliefs? It is now time to look at your progress and make the necessary changes to heal and build your vision. Neptune opens all the realms of progression and possibility.",https://www.reddit.com/r/astrology/comments/hee5dv/themes_of_neptune_retrograde/,238,The energy of a planet does not reverse and become its opposite during a retrograde. ,2020-06-23 12:58:53
152,9tq345,False,,37,Cancers being protective of their loved ones,astrology,,https://v.redd.it/qi374ljiuyv11,460,"dont see the cancer connection tho , cancer just wants attention and gets emo when somones right or theyre not getting there way lol , cute lil crabbys tho (ffuck u downvotes this is how i kick who i am ) lets inspire the next generation 🤙🔥❤️ ",2018-11-03 01:15:28
378,fgzusg,False,,42,Harvey Weinstein sentenced to 23 years in prison,astrology,"his chart is rated C, so take with grain of salt.

I was interested in examining his transits for today (and other timings techniques) versus a natal explanation (which has been done here, If you search there’s a really good one by u/SmoothieGoat) to see what planetary energies contributed to his sentencing. He will likely die in prison, as his lawyers said even 5 years would be a life sentence.

His birthday is March 19th. So I saw it fitting to cast his solar return chart. There, he is in for a Gem Rising year with transit Uranus and Venus in his 12th. He is being imprisoned for his acts of sexual violence towards women (Venus). Uranus there, to me, completes a sad story shown in his natal chart. He has natal Uranus in Cancer opposite his Capricorn Moon. His relationship to his mom and childhood was most likely cold, hardened, and erratic in some way, and that first relationship to a woman, for men, can indeed portend how one may treat women as an adult. Uranus in his Solar Return 12th, almost at the exact same degree, illustrates a disturbing culmination to that natal promise. And indeed, with all the planets that have and are transiting Capricorn right now, those issues are at the very least karmically highlighted for him if not literally. He has Capricorn moon in the 3rd, which relates to upbringing. 

His solar return Chiron is placed in the 11th (honors, fame) conjunct his Sun in the 10th. Soiled reputation. Chiron in Aries is also ruled by Mars, and his is natally precariously placed in square to Pluto. 

His natal 7th house (Taurus) becomes his SR 12th house (imprisonment revolving around personal relationships), and for what it’s even worth, his SR 5th house, Libra (sexual desires), is his natal 12th. Venus rules both Libra and Taurus. So generally just a lot of themes of sexual impropriety, women, relationships, prisons, endings, death, etc.

His natal 8th, the place of death and mortality, is his solar return 1st house. Maybe he will literally die. Who knows. But he is certainly in the last chapters of his life. His solar return 8th house is Capricorn, with all 3 malefics currently placed there plus Jupiter. Heavy 8th and 12th emphasis is going to make for a dark year. 

His solar return Venus (and thus transit Venus) is forming a trine with Saturn and Pluto. Retribution and punishment for crimes against women. 

His solar return Moon is in Aquarius in the 9th. Aquarius occupies the 4th house of his natal, opposite that ruthless Pluto conjunct MC in Leo. He will probably be coming to terms with his career, his role in his own demise, and likely through 9th house themes of faith and religion. It’s not uncommon that convicted criminals come to devote their lives to Jesus (or whatever and whomever) while incarcerated. A real test of faith is beginning.

Transit wise, Mercury direct in his natal 5th. Whatever legal deliberations were needed were carried through with the directness of a Mercury direct station. Inward analysis became outwardly expressed conclusions. Pisces occupies his natal 5th so: sex crimes and the general dark side Piscean gaslighting, seeing how far one can take things, zero boundaries, etc.

There’s something about his NN at 0 Pisces (conj Venus) and his Sun at 29 Pisces that is profound to me. I can’t articulate it but his soul incarnated for some challenged lessons around women, sex and pleasures. Yeesh. 

Interestingly but not exact, his natal progressed mars stationed retrograde and is marching backwards into his 12th house to join his natal RX Neptune and RX Saturn. While his natal progressed Venus is marching up into his 8th. 

His progressed Moon is also conjunct that natal Uranus I spoke about above. He is also in his 8th house year right now about to enter a 9th house one, where that Uranus and progressed moon are. 

A culmination of themes.

Bye bye bad guy.",https://www.reddit.com/r/astrology/comments/fgzusg/harvey_weinstein_sentenced_to_23_years_in_prison/,263,Why would you give him so attention? I bet you dream about him. ,2020-03-11 16:27:45
650,e41e5f,False,,73,Most common placements on this sub survey results,astrology,"First off I just want to apologize for taking this long, I’ve been very busy with work and studying for college finals. Also I’m sorry but I wasn’t able to make bar graphs for all placements like I promised, I didn’t really know how to. I went on Excel and made 3 bar graphs but they looked really ugly and confusing so I decided to only make bar graphs for the most common sun, moon and rising sign. If you want to see that as well as the pie graphs that google forums automatically generated you can find that here: [https://imgur.com/gallery/PH8YjIG](https://imgur.com/gallery/PH8YjIG)

Feel free to share how common (or rare) your placements are in the comments. Also let me know if there’s anything that surprises or interests you. 

Also, I might post more surveys on here when I have the time (most likely during winter break after finals are over). I was thinking the next survey I could do would be about what houses are your placements in. I might also make a survey about what the most common aspects on this sub are. Let me know if you’d be interested in this, also feel free to suggest other types of surveys I could make. Also, this survey includes 1% of the community. Ok so without further ado, here are the results: 

In order from the most to least common sun sign (out of 1,459 responses), they are: 1. Gemini (140, 9.6%) 2. Cancer (134, 9.2%) 3. Leo (131, 9%) 4. Pisces (126, 8.6%) 5. Scorpio (125, 8.6%) 6. Sagittarius (124, 8.5%) 7. Taurus (121, 8.3%) 8. Libra (120, 8.2%) 9. Aquarius (113, 7.7%) 9. Virgo (113, 7.7%) 11. Aries (111, 7.6%) 12. Capricorn (101, 6.9%)

Most to least common moon sign (1,456 responses): 1. Scorpio (133, 9.1%) 2. Taurus (131, 9%) 3. Capricorn (130, 8.9%) 4. Cancer (129, 8.9%) 5. Virgo (127, 8.7%) 6. Gemini (125, 8.6%) 7. Sagittarius (121, 8.3%) 8. Leo (116, 8%) 9. Libra (113, 7.8%) 10. Pisces (112, 7.7%) 11. Aries (111, 7.6%) 12. Aquarius (108, 7.4%)

Most to least common rising sign (1,454 responses): 1. Sagittarius (163, 11.2%) 2. Scorpio (162, 11.1%) 3. Libra (157, 10.8%) 4. Virgo (150, 10.3%) 5. Leo (138, 9.5%) 6. Cancer (133, 9.1%) 7. Gemini (118, 8.1%) 8. Capricorn (114, 7.8%) 9. Taurus (98, 6.7%) 10. Pisces (84, 5.8%) 10. Aquarius (84, 5.8%) 12. Aries (53, 3.6%)

Most to least common mercury sign (1,419 responses): 1. Scorpio (140, 9.9%) 2. Cancer (137, 9.7%) 3. Sagittarius (128, 9%) 4. Virgo (121, 8.5%) 5. Aries (119, 8.4%) 5. Capricorn (119, 8.4%) 7. Libra (117, 8.2%) 7. Pisces (117, 8.2%) 9. Taurus (114. 8%) 10. Leo (108, 7.6%) 11. Gemini (103, 7.3%) 12. Aquarius (96, 6.8%)

Most to least common venus sign (1,420 responses): 1. Scorpio (143, 10.1%) 2. Aries (142, 10%) 3. Gemini (140, 9.9%) 4. Capricorn (130, 9.2%) 5. Leo (125, 8.8%) 6. Cancer (124, 8.7%) 7. Virgo (121, 8.5%) 8. Aquarius (119, 8.4%) 9. Libra (7%) 10. Taurus (95, 6.7%) 11. Pisces (91, 6.4%) 12. Sagittarius (90, 6.3%)

Most to least common mars sign (1,411 responses): 1. Virgo (152, 10.8%) 2. Scorpio (151, 10.7%) 3. Libra (146, 10.3%) 4. Leo (134, 9.5%) 5. Cancer (120, 8.5%) 6. Aries (115, 8.2%) 7. Sagittarius (109, 7.7%) 8. Gemini (105, 7.4%) 8. Taurus (105, 7.4%) 10. Capricorn (97, 6.9%) 10. Aquarius (97, 6.9%) 12. Pisces (80, 5.7%)

Most to least common jupiter sign (1,377 responses): 1. Capricorn (137, 9.9%) 2. Scorpio (135, 9.8%) 3. Aquarius (132, 9.6%) 4. Pisces (128, 9.3%) 5. Cancer (116, 8.4%) 6. Gemini (115, 8.4%) 7. Sagittarius (114, 8.3%) 8. Virgo (112, 8.1%) 9. Leo (106, 7.7%) 10. Libra (101, 7.3%) 11. Taurus (97, 7%) 12. Aries (84, 6.1%)

Most to least common saturn sign (1,371 responses): 1. Aries (240, 17.5%) 2. Pisces (208, 15.2%) 3. Aquarius (206, 15%) 4. Taurus (183, 13.3%) 5. Capricorn (168, 12.3%) 6. Sagittarius (105, 7.7%) 7. Gemini (87, 6.3%) 8. Scorpio (64, 4.7%) 9. Cancer (40, 2.9%) 10. Libra (34, 2.5%) 11. Leo (19, 1.4%) 12. Virgo (17, 1.2%)

Most to least common uranus sign (1,036 responses): 1. Aquarius (417, 40.3%) 2. Capricorn (395, 38.1%) 3. Sagittarius (140, 13.5%) 4. Scorpio (35, 3.4%) 5. Pisces (29, 2.8%) 6. Libra (7, .7%) 7. Leo (5, .5%) 8. Virgo (4, .4%) 9. Cancer (2, .2%)

Most to least common neptune sign (1,030 responses): 1. Capricorn (672, 65.2%) 2. Aquarius (264, 25.6%) 3. Sagittarius (71, 6.9%) 4. Scorpio (14, 1.4%) 5. Libra (3, .3%) 5. Pisces (3, .3%) 7. Virgo (1, .1%)

Most to least common pluto sign (1,029 responses): 1. Scorpio (479, 46.5%) 2. Sagittarius (459, 44.6%) 3. Libra (69, 6.7%) 4. Capricorn (9, .9%) 5. Virgo (8, .8%) 6. Leo (5, .5%) 

Most to least common chiron sign (863 responses): 1. Virgo (112, 13%) 2. Scorpio (111, 12.9%) 3. Cancer (110, 12.7%) 4. Libra (109, 12.6%) 5. Gemini (103, 11.9%) 6. Sagittarius (98, 11.4%) 7. Leo (92, 10.7%) 8. Capricorn (49, 5.7%) 9. Taurus (46, 5.3%) 10. Aquarius (15, 1.7%) 11. Aries (13, 1.5%) 12. Pisces (5, .6%)

Most to least common lilith sign (885 responses): 1. Scorpio (91, 10.3%) 2. Libra (86, 9.7%) 3. Capricorn (80, 9%) 4. Aries (79, 8.9%) 4. Virgo (79, 8.9%) 6. Cancer (77, 8.7%) 7. Gemini (70, 7.9%) 7. Leo (70, 7.9%) 9. Taurus (67, 7.6%) 10. Pisces (65, 7.3%) 11. Aquarius (61, 6.9%) 12. Sagittarius (60, 6.8%)

Most to least common north node sign (932 responses): 1. Virgo (121, 13%) 2. Libra (101, 10.8%) 3. Scorpio (91, 9.8%) 4. Leo (81, 8.7%) 4. Capricorn (81, 8.7%) 6. Sagittarius (80, 8.6%) 7. Cancer (79, 8.5%) 8. Gemini (72, 7.7%) 9. Aquarius (71, 7.6%) 10. Aries (57, 6.1%) 11. Taurus (49, 5.3%) 11. Pisces (49, 5.3%)",https://www.reddit.com/r/astrology/comments/e41e5f/most_common_placements_on_this_sub_survey_results/,151,"I'm a little surprised more venus signs arent Taurus, because it's the ruling sign. But I also know that's my bias as a Taurus Venus, I love love 😂 ",2019-11-30 18:54:18
660,96le4p,False,,24,"House polarities, so helpful",astrology,,https://i.redd.it/y05gogk98kf11.jpg,153,Thanks great  ,2018-08-12 00:50:43
788,fsm247,False,,7,"The conjunction over Melbourne, Australia",astrology,,https://i.redd.it/il5xb5tei2q41.jpg,119,Pluto is somewhere in the far background there :) ,2020-03-31 21:45:01
651,dn5dmu,False,Western,386,What’s your Mars sign and something that riles you up?,astrology,My mars is Cancer. For me it’s being ignored and taken for granted. Basically people not noticing and appreciating caring things I do.,https://www.reddit.com/r/astrology/comments/dn5dmu/whats_your_mars_sign_and_something_that_riles_you/,150,"Mars in pisces (ew hate it so much, quite possibly the worst possible mars placement).  I get irritated by lies and being ignored the most.  Blantant homophobia, racism, or sexism also can ruffle my feathers.  It’s super hard for me to see where my mars placement actually comes thru because I have an overwhelming amount of air placements in my chart ",2019-10-25 23:02:48
894,f591az,False,,256,MERCURY RETROGRADE MEGATHREAD. ALL OTHER MERC RX POSTS WILL BE REMOVE,astrology,"It's that time if year again and we know you all have lots of questions and thoughts about mercury retrograde. Here's the place for all mercury rx discussion and questions.

All other mercury rx posts will be removed, and discussion redirected here. 

-mods",https://www.reddit.com/r/astrology/comments/f591az/mercury_retrograde_megathread_all_other_merc_rx/,101,"Is it just me or is anyone else having issues with communication and taking things personally today? Just wrote a long response to the head honcho of my company (which I have never done before) because they called me out by emailing the whole company a general email about staying positive (I shared a news article about coronavirus). It irks me when people try to gloss over real concerns by simply saying, “be positive.” Ugh. ",2020-02-17 13:53:44
517,9nxbrn,False,,80,"Venus in retrograde, big mood. Don’t text your ex.",astrology,,https://i.redd.it/d60daaz8r0s11.jpg,199,Hehe this is awesome  ,2018-10-13 21:15:15
434,c8dwh9,False,,20,Birthday gifts for my sister and mom,astrology,,https://i.redd.it/bz5beq2l0y731.jpg,236,"I am a 
Sun: Cancer
Moon: Pisces
Rising: Taurus

What exactly can you guess from me? Sorry, I’m kinda new to the astrology game, haha ",2019-07-02 19:37:17
196,g16542,False,,52,"You can play Victim to your placements, or you can take the tools you've been given and Stand in your Own Power",astrology,,https://i.redd.it/5rtaja4hiss41.jpg,399,"It’s not that easy master, if it was that easy everyone would be doing it. In some cases it doesn’t even depends on you but on the experiences you have ",2020-04-14 14:07:13
331,ej9tzk,False,,120,Have y’all felt extra tired recently?,astrology,,https://www.reddit.com/r/astrology/comments/ej9tzk/have_yall_felt_extra_tired_recently/,287,Big time. I just moved house so I'm trying to figure out how my sleep pattern fits in with my boyfriend getting up to pee 100 times in the night. I slept like a kitten last night though. ,2020-01-03 03:58:21
107,e18js1,False,,17,"Júpiter-Venus from Mazatlán, México.",astrology,,https://i.redd.it/9dgt3btdkq041.jpg,558,Simply beautiful! Too bad you can't observe the night sky in modern civilization... #fucklightpollution ,2019-11-25 01:33:48
916,9hlr7z,False,,5,Leo Love (pisces/Leo/Pisces here),astrology,,https://i.redd.it/esh833lbgin11.jpg,100,"Beautiful! I am a Leo sun, venus Leo (Vedic) and Leo mars! (Both)  ",2018-09-21 03:25:24
209,alr70s,False,,11,"Saturnalia was an ancient partying carnival festival in honour of the grumpy god Saturn. This ""saturniidae carnival caterpillar"" (emperor moth) reminds me how this festival could look like :)",astrology,,https://i.imgur.com/7F6dlDZ.jpg,390,I wonder what it looks like after! ,2019-01-31 16:28:17
451,grognb,False,Noob Help,16,Handwritten Cheat Sheet Given to My Father in 1993.,astrology,,https://i.redd.it/csh1yoxbhc151.jpg,232,Confused and out of touch with reality... Sounds about right ,2020-05-27 17:44:55
112,gtwg0b,False,,259,Entering the age of Aquarius,astrology,"I think it’s very clear now that we are transitioning into the age of Aquarius. With all the current events, I think it it lines up very well with what the dawning of the age of Aquarius has always been predicted to be, people rebelling against injustice systems and bringing about a revolution. Furthermore, anonymous have started to become a large part of this aswell, also lining up with Aquarius traits (humanitarian, bringing the truth, using technology). Thoughts?",https://www.reddit.com/r/astrology/comments/gtwg0b/entering_the_age_of_aquarius/,540,Anonymous is a CIA compromised psy op. When Pluto moves into Aquarius you can expect the evil Satanists who run the world to start getting scared that humanity is waking. ,2020-05-31 10:00:54
307,e47l7m,False,,32,Astrological Overview for December 2019,astrology,,https://i.redd.it/nua0mke5ex141.png,308,mercury enters sag twice? ,2019-12-01 01:37:11
585,b6qp30,False,,36,"michael scott’s birth chart! it’s pretty rare that characters on tv shows or in movies will ever give us the info for their birth chart, but in one episode from the office michael does. Obviously he’s a fictional character so there isn’t much weight given to this but oh well",astrology,,https://i.redd.it/8uqhe3ludyo21.jpg,171,Who cares  ,2019-03-29 00:32:59
