Num,ID,is_Original,Flair,num_comments,Title,Subreddit,Body,URL,Upvotes,Comments,creation_date
907,90s6ss,False,,23,Closing out Cancer season and hello Leo season!,astrology,"Wow. Cancer season was a ride, right? Cancers are the mothers of the zodiac and ruled by the moon. We have all been asked to see ourselves for what we really are. The mother is sometimes tough love. Where do you need to be better? Hopefully the Capricorn full moon shed some light on what you need to let go of so you can keep moving forward toward your higher self. That one was conjunct Pluto as well. Oof. Deep digging way down in the underworld of your psyche. I know some of you love that spooky shit lol, but some of us... damn.

That eclipse. The eclipse/new moon in Cancer. Where do you need to mother yourself better? Are you taking care of yourself? Are you punishing yourself for something bad you did a long time ago that you haven't let go of yet? Take the last bit of cancer season to flush out your emotional wounds with salt water. Our bodies are 70% salt water. We all possess the healing power of salt water within us. 

Many people feel bad. I feel bad too sometimes. All this retrograde action, the eclipses, transiting Pluto is conjunct my natal moon right now, retrograde Mars is conjunct my natal Saturn. It's a tough time for everyone. But now, it's time. Cancer season has washed you off with the ocean and this is who you are. 

This is who you are and now it'll be Leo season. If there's one thing you can learn from a Leo, it's how to use your heart to live your life out loud. It's how to be the most genuine, most authentic version of yourself and it's time to fall in love with that person. Whatever you found out about yourself in Cancer season IS YOU. And this is what you have to work with. Use your heart. Do what you love and keep doing that thing. Open your heart to everything and everyone. Keep what makes you happy. Accept yourself for who you are and work to make yourself better. Ask yourself, ""is this really who I am?"". Most of all, have fun! Leo season is homecoming for the sun. No more deep dark moody times. Everything is about to get light-hearted and joyful. Don't miss it.",https://www.reddit.com/r/astrology/comments/90s6ss/closing_out_cancer_season_and_hello_leo_season/,104,what a great post 💛 ,2018-07-21 20:17:12
817,fcyfdq,False,,123,astrology and the COVID-19 virus,astrology,"well i’ve been following this train of thought and i wanna hear what everyone else thinks about this. i’m not sure if this is insensitive..? so do let me know if it is.

but i feel like the coronavirus has some Saturn energy tied to it because of the vengeful nature that it has. because saturn is known for being karmic etc etc and for repaying what people give out. i’m not saying all the patients got it because of karma, what i’m saying is that the biggest stories that surface about the virus and the groups involved tend to have some sort of lesson to be learned from it.

for example, in singapore, there was some christian church group who talked mad shit about the coronavirus being some sort of “divine retribution” like a punishment from God because of the growing LGBTQ+ support in the country. and IRONICALLY, a while later, the group contracted said virus, and it spread to many members of the church. it was like a talk shit get hit kind of situation.

then, there was a korean christian cult that was rather notorious and they experienced the same thing. where a woman literally refused treatment to spread it to the rest of the cult because she believed that they were the chosen ones to go to heaven or something like that. don’t quote me lol.

there have been a few more instances of stuff like this that i’ll get into if requested, because it’s a lot. and very complex too, and i’m a little too tired to type it all out.

can anyone give any insight into the karmic energy attached to the coronavirus? according to the timeline i think also the virus might have been born during Capricorn season, which is ruled by Saturn.

would love to hear everyone’s thoughts!",https://www.reddit.com/r/astrology/comments/fcyfdq/astrology_and_the_covid19_virus/,114,"I'm a bot, *bleep*, *bloop*. Someone has linked to this thread from another place on reddit:

- [/r/classified] [Astrology and the COVID-19 virus](https://www.reddit.com/r/classified/comments/fdcubx/astrology_and_the_covid19_virus/)

&nbsp;*^(If you follow any of the above links, please respect the rules of reddit and don't vote in the other threads.) ^\([Info](/r/TotesMessenger) ^/ ^[Contact](/message/compose?to=/r/TotesMessenger))* ",2020-03-03 17:53:57
274,gc7mcd,False,,145,chat application that matches you based on astrological signs,astrology,"Hey everyone! 

I posted about creating an app where you can make friends a while ago on here lol. I thought of maybe having an algorithm where you can be matched with people who have compatible inner planets with you? This option can be turned off as well. You would also be matched with other things about yourself too!

Good idea or bad idea? Feel free to say what you think and why :).

I also want to reallyyyy avoid it being used as a dating app, its focus will be on making lasting friendships.

I'm new to coding, so the app will probably take a couple of years to put out there.",https://www.reddit.com/r/astrology/comments/gc7mcd/chat_application_that_matches_you_based_on/,331,"If you’re talking about something complex, that makes sense, but if it’s sun signs, I’ll pass.  I’m a Taurus with heavy fire in my chart.  And Plutonian.  I am not the stereotypical Taurus, but I’m pretty convinced no one is the stereotypical anything.  Astrology is too complex to boil things down easily. ",2020-05-02 14:45:56
226,cnqagr,False,,29,"Found this in a used book store, no publishing date to be found, anyone recognize it at all? It old enough that it still calls Uranus ""Herschel""",astrology,,https://i.redd.it/qr1ixzm3w9f31.jpg,368,Can I buy this ,2019-08-08 19:02:32
909,82etww,False,,59,"This Is Your Deepest, Darkest and Secret Fear According To Your Zodiac Sign",astrology,,https://i.redd.it/n8pc0isq35k01.jpg,101,"OMG I'M A SCORPIO......AND YESSSSS THAT IS ME......wow how are these so accurate
 ",2018-03-06 12:50:53
192,gb2o9g,False,Natal,79,Just a lil pro-tip (for western/modern interpretations),astrology,,https://i.redd.it/2kzicnshd0w41.jpg,402,"Pro-tip? is just a regular tip. It's Obvious you need to analyse the planets besides their aspects, stelliums included. ",2020-04-30 19:41:17
