Num,ID,is_Original,Flair,num_comments,Title,Subreddit,Body,URL,Upvotes,Comments,creation_date
669,gjq0o0,False,,22,[meta] Would it Make Sense to Have a Weekly Megathread On Random Astrology Thoughts and Questions?,astrology,"I know this sub attracts both newbies and those who have studied Astrology for years. 

Even though I've been studying Astrology for 10+ years, not gonna lie, the Aries/Gemini in me wants to share silly thoughts, like the fact I find celebrities I'm attracted to share the same Venus and Mars signs as my Partner very amusing.

I also sometimes get tired of the same ""How is the Mercury Retrograde Gonna Effect Me"" or ""Are all Geminis and Scorpios psychos?""

What does the sub think? Would a megathread be something people would enjoy?",https://www.reddit.com/r/astrology/comments/gjq0o0/meta_would_it_make_sense_to_have_a_weekly/,148,My 3rd house stellium agrees! ,2020-05-14 16:47:16
158,dcas4f,False,,23,I painted this during Leo season and I feel like it captures the fiery and complex energy of Leos. What do you guys think?,astrology,,https://i.redd.it/h7hwc9zyy4q31.jpg,447,leo's suck ,2019-10-02 14:15:01
602,fi8tui,False,Predictive,25,Repost: Saturn & Pluto conjuctions (1915-2020). Do you want to see Mars & Jupiter included?,astrology,,https://i.redd.it/qfbjfukwuim41.gif,164,What happened during the 2008 one? ,2020-03-13 23:13:44
462,9xl5wy,False,,45,Venus Now Direct,astrology,,https://i.redd.it/e2z496c2boy11.jpg,219,"I’ve had Scorpio dragging me around for the past 5 years (hard transits) and my chart is ruled by Venus so I’m exhausted. My mercury is in Sagittarius 8th house so at this point, I’m a rag doll. lol  ",2018-11-16 10:52:13
281,dpad96,False,,21,Tree of life inspired by astrological chart,astrology,,https://i.redd.it/6d8l8q91ypv31.png,318,"Really beautiful, bright art. ",2019-10-30 18:07:59
604,e6u160,False,,55,Huge energetic shift in the mid 2020's!!!,astrology,"Uranus will shift to Gemini in 2025/2026.

Neptune will Shift to Aries in 2025/2026.

Pluto will shift to Aquarius in 2023/2024.

And finally, Saturn will shift to Aries in 2025/2026.

That's a whole lotta energetic shifts in just two, or three years!! 

I would take 2020 to 2024 to prepare for these outer planets, and Saturn, shifts! :)",https://www.reddit.com/r/astrology/comments/e6u160/huge_energetic_shift_in_the_mid_2020s/,166,Thanks. How does this relate to the 2020 triple conjunction with Jupiter Saturn and Pluto ? ,2019-12-06 05:06:00
782,fziyyf,False,Discussion/Debate ,33,astrology and lord of the rings part 2,astrology,"i thought i’d share my interpretation of the characters and their signs!!! mostly for shits don’t take it too seriously hahahahah 

aries :: boromir — he really did have the best intentions and i’m sure his heart was in the right place but the impulsive fuck of a human let his ego get the best of him and he literally tried to murder our beloved frodo and that’s all i have to say. ripskis 

taurus :: samwise — comfort based, food enthusiast, a little stubborn and incredibly loyal to those he cares for (frodo) shy and loving and soft. funnily enough he’s the one who enjoys cooking the food and he’s incredibly disappointed when they’re only left with lembas 

gemini :: mary and pippin — mischievous, theres two of them hehehe so they fit the twin archetype, they’re always having fun and they have v lighthearted personalities, trouble makers who aren’t sure how they got there or became part of the fellowship but they’re jus goin wit it 

cancer :: frodo — the calm in the storm, pretty laidback and relaxed in even the most unideal situations, pretty kept to himself and doesn’t enjoy conflict but he’s determined af. he’s hesitant with gollum at first but overtime accepts him into their clan with a nurturing attitude. also he has those big watery eyes 

leo :: gimli — loud and proud, warm-hearted and funny!!!! a little prideful and stubborn, doesn’t want anyone to see his failures or shortcomings so he puts up a lil bit of a facade but hes incredibly loyal and he’s willing to fight for those who he loves. HAIRY AF

virgo :: arwen — delicate mannerisms, pure intentions and an eye for detail. gives up her immortality for her love (living up to the 6h act of service or duty) a natural healer!!!!! she seems very innocent on the surface but she’s lowkey an elvish warrior bad bish 

libra :: lady galadriel — the peacemaker, a divine source of light who’s able to overrule all types of conflict. the fucking epitome of venusian energy, she basically has gandalf wrapped around her finger with her feminine magnetism LMAO

scorpio :: aragorn — he’s mysterious as fuck and he tends to rub people the wrong way or intimidate them only because they can’t figure him out, intense energy, literally summons the army of dead to fulfil an oath to the mortal (???? this is eighth house as fuck)

sagittarius ::  bilbo — adventurous, fun loving lil hobbit, always longing for a taste of adventure or a new experience, never wants to grow old, can sometimes come off a lil harsh or incoherent (queue his birthday speech LMAO) 

capricorn :: gandalf — calm, collected, level-headed wizard daddy who successfully leads the fellowship to victory. he’s a little nervous and self doubting but still maintains great leadership skills!!! he’s well respected (especially by treebeard and the ents which is HUGE) and everyone knows him!!! 

aquarius :: legolas — he’s clever, intelligent and always a few steps ahead of everyone but he has a lil bit of a god complex. typically remains indifferent and detached during conflict though he really struggles with gimli at first due to their ancestors rivalry and inflated egos (hence the leo/aquarius axis heheh)  

pisces :: gollum — idk man do i rly have to explain it????,,,,, he’s balls deep in neptunian waters",https://www.reddit.com/r/astrology/comments/fziyyf/astrology_and_lord_of_the_rings_part_2/,124,"All Pisces people relate to Gollum, the eyes, the feet. In the end, he is sacrificed. There's a great song on the soundtrack ""Gollum's Song"", I think it's called, SUPER Piscean. Those two fish pulling in different directions.  ""Serve or suffer"". ",2020-04-11 20:54:53
725,cxxf6y,False,,8,"I found this in a box a few days ago that belong ed to a relative, who passed away a few years ago, he always drummed into us about the stars etc, must be at least 12 years old and still in fact thought it was pretty cool 💫💫",astrology,,https://i.redd.it/w8qlgisd9tj31.jpg,136,I have a similar one but bigger and on my ceiling in my room :) very cool! ,2019-08-31 16:27:23
949,gjp5ah,False,,28,"I was searching for 8+ stelliums in one sign ... and found out, that there were 9 planets/objects in Taurs on my May 9th birthady ... 1600 years ago :)",astrology,,https://i.redd.it/enp7jk0g6ry41.gif,90,Saturn Pluto Venus Neptune conjunction ! ,2020-05-14 16:01:36
560,b5cd0u,False,,141,A big fuck you to mercury retrograde,astrology,"Alright, I’m not one to hate on mercury retrograde because it is what it is. But I’m SICK OF ITS SHIT OKAY.


I feel so exhausted and tired no matter how much I sleep the last 2 weeks, I got marks deducted off my assignment because I didn’t redo a calculation/missed some minor details (obviously my fault, but also I’d like to blame mercury retrograde in Pisces), I had to pay $90 to retake my G drivers test because I “didn’t check my mirrors enough” and failed, my laptop charger broke so now I have to pay $100 for a new one, and I just got a $30 parking ticket (that’s like $220 on dumb stuff).


Okay obviously I could’ve tried to check my mirrors more and made it obvious af, but why did I book that during the retrograde. The parking ticket was because I parked in the wrong parking lot at school but didn’t know it wasn’t the meter parking!! The assignment, I could’ve paid more attention for sure. I work part time as a student so all this unforeseen money coming out my pockets is annoying!! 
I blame it on the retrograde but I’ll take responbility for my lack of paying more attention 😂.


I’m ready for this bullshit to be over now thanks. Also mercury in Pisces squares my gemini sun and moon, and I often feel like Pisces makes me so HAZY, I don’t jive well w Pisces transits. 

Update: so mercury and Neptune are conjunct at 16* Pisces, an almost exact square to my 15* gemini sun, makes a lot of sense now why I feel like a FOGGY BRAIN LOW ENERGY MESS. Thankfully, it’s over soon!",https://www.reddit.com/r/astrology/comments/b5cd0u/a_big_fuck_you_to_mercury_retrograde/,182,Got a summons on Friday cause nypd suck dick that way. ,2019-03-25 15:53:19
323,9hls4y,False,,25,"Virgo, who was almost forgotten at the bus station. Almost.",astrology,,https://i.redd.it/nhk7tcp0hin11.jpg,293,Amazing work.  Facial and physical characteristics are spot on.  Thank you so much for putting your time and effort into this. ,2018-09-21 03:29:19
586,8jqi11,False,,33,For those with sun in cancer... (photo credit: u/VenomousUnicorn),astrology,,https://i.redd.it/1ymv2wx214y01.jpg,173,Literally so true 😕 ,2018-05-16 00:11:39
505,aamtmu,False,,42,Did you know that “The Curious Case of Benjamin Button” was representation of the life of a Capricorn?,astrology,,https://i.redd.it/rhiomjqp09721.jpg,204,I have thought of this but do you have a actual official source? ,2018-12-29 17:04:34
509,b3q32p,False,,56,Husband bought a computer during mercury retrograde,astrology,"For about a year my husband has been borrowing my computer and I finally put my foot down last week as he can afford and needs a computer of his own. I was cranky and worried he would break my new computer which he can not afford to replace. 

I did not expect him to go out and buy one the next day but that's what he did. I told him he should wait for mercury to go direct and I would help him but he's not too into astrology...or wasn't until now. He is a Taurus rising so a bit stubborn about asking for help. 

The first computer had a cracked screen that was not noticeable until he turned it on at home. He went back to the store for an exchange, but they were out of that model. So he got a different model for the same price. 

The second computer has this horrible, very bad, nearly fascist OS called Windows 10 Mode S. Mode S means you can only install programs from the Microsoft store, which is useless. So he went back today to complain and got a refund and went to another store. 

At the new store he described exactly what he needs and specified no Mode S. The sales rep recommended a new model with Windows 10, no Mode S on the box. 

He got home and the third computer is also Mode S. He is not happy. 

At this point I feel bad for not letting him borrow my computer until the 25th so have offered to buy him a Chromebook myself...after Mercury goes direct.

He is now a believer 😂",https://www.reddit.com/r/astrology/comments/b3q32p/husband_bought_a_computer_during_mercury/,206,"Sorry for my ignorance, but what does mercury retrograde actually entail? Like what happens and therefore what does it mean? ",2019-03-21 12:44:08
217,d9k6ia,False,,39,Zodiac War - an astrology themed board game.,astrology,,https://i.redd.it/04utb9ot4yo31.jpg,382,Any news on this and why it was cancelled? I really want this in my life :( ,2019-09-26 14:12:17
663,e1ibo8,False,,1,"Venus Jupiter conjunction from Kurukshetra, India",astrology,,https://i.redd.it/otdotzxyyu041.jpg,151,"Thanks for posting a topic for astrological discussion! Please remember:

Creating new threads about yourself, your chart, or your placements is not allowed on this subreddit. If you have done so, remove your post and post in r/AskAstrologers.

We do not allow topics that generalize or stereotype by sun sign, for example, posting about ""Scorpios"" or ""a Capricorn woman"", ""signs you have dated,"" or ""air signs"" if you mean people.

**If you have broken these or [another subreddit rule](https://www.reddit.com/r/astrology/about/sidebar), delete your post or you could end up with a temporary or permanent ban on participation.**


*I am a bot, and this action was performed automatically. Please [contact the moderators of this subreddit](/message/compose/?to=/r/astrology) if you have any questions or concerns.* ",2019-11-25 16:22:45
729,hk60w5,False,Noob Help,60,The Ascendant,astrology,,https://i.redd.it/0k08ou7mji851.jpg,136,Why is that my ascendant and north node are the same? Libra .... ,2020-07-02 21:37:13
23,bus4st,False,,89,I'm Illstrating the Zodiac! This is my take on Aries :),astrology,,https://i.redd.it/j5o6ubxx5c131.jpg,940,Hahah if this chick was blonde she wpuld be me. Love it! ,2019-05-30 11:43:31
297,ge1e9g,False,Natal,117,"NEW CYCLE ALERT: SOUTH NODE SAGITTARIUS, NORTH NODE GEMINI, and what it means FOR YOU",astrology,"*Extra extra, read all about it!*

That’s the energy of Gemini NN to me haha.

On a societal level...

SN in Sagittarius: end of my way or highway soap-boxing, end of dogmatic thinking being accepted as Truth, the illusion of fake news lifting, losses to the way we travel globally, less my way or the high way

NN in Gemini: fact over philosophy and theorizing, able to hold many ideas at once, expanding on the ability to change your mind, common sense, letting new information in

In general, SN Sag is the archetype of a well-traveled and knowledgeable sage, in whatever field, seeking to share what they know. This archetype appears to know it all, about everything, and will make sure you know that. The plus side is what this placement does indeed have a lot to share. The downside is that they don’t listen to other people, factor in the details, and have a hard time separating their ego from their smarts. Marco Polos.

NN Gemini is seeking to be that better listener, to siphon through all the relevant details and facts, to be comfortable learning from others. This placement is community oriented and less about traveling far and wide. Time to be in the present moment, here and now, what matters this second.

On a personal level...

It depends a lot on what houses Sag and Gemini are for you. And if there are planets there.

My basic approach: SN DRAIN, NN GAIN.

So wherever the NN is where we can experience gains, and wherever the SN is where we can experience drains.

Here are some ideas to get you thinking.

**ARIES ASC**: gains in the third house, drains in the ninth. a period of community oriented endeavors, of letting new ideas permeate your daily life. less lusting after faraway places and lofty mindsets, but letting the here and now spark wonder

**TAURUS ASC**: gains in the second, drains in the eighth. personal income from your own personal endeavors. make right with what you owe people and get your head around your debt. retooling your beliefs around money and possession.

**GEMINI ASC**: gains in the first house, drains in the seventh. a period of coming into your own without seeing other people as a necessity in that journey. speaking up for yourself, face forward now, retooling which relationships are needed and which you can jettison

**CANCER ASC**: gains in the twelfth, drains in the sixth. the daily habits or jobs that once sustained you are becoming beige boring or broken. looking towards the metaphysical to bring back a sense of magic and wonder, and letting that seep into your routines

**LEO ASC**: gains in the eleventh, drains in the fifth. less about what personally makes you feel good and more about what you can bring to the community to make them feel good. creation needs an audience, be it a piece of work, art, a child or yourself. you may make lifelong friends and associates, time to find your tribe. mingle

**VIRGO ASC**: gains in the tenth, drains in the fourth. volume is turned up on your place on the world stage. opportunities to bolster your sense of purpose will be abound. you may have to say goodbye to staying small or staying hidden, and bloom past what your family expects of you. an end of the comfort zone.

**LIBRA ASC**: gains in the ninth, drains in the third. a period of travel, whether journeys of the mind or journeys in real life. commit knowing all there is to know and seeing all there is to see and practicing all there is to practice. this will expand your horizons. true wisdom requires time and a nimble mind. spiritual passages await

**SCORPIO ASC**: gains in the eighth house, drains in the second. your sense of personal insecurity will be made up for by the graciousness of others. a period of true sharing, investment, and resourceful intimacy. the ways that you waste money or valuables (your time and energy and patience too) will become apparent, and asking for help from others is your best bet

**SAG ASC**: gains in the seventh house, drains in the first. a period of relationships that can help you reevaluate who you are and where you’re going. not the loss of self sufficiency per se, but the ability to let others co-pilot this stretch

**CAP ASC**: gains in the sixth, drains in the twelfth. time to be more real world oriented. the isolation that serves you, the spiritual practices that unnerve you, these are to keep and help you become better in life, on the job, and for others. all the other psychic chatter, alienation, trauma, sabotage that does not bolster you must go. break down to build up, not to stay broken. this opens up new ways to be of service, to remain flexible in your duties, and to remain childlike and light as you approach each day

**AQUA ASC**: gains in the fifth, drains in the eleventh. social exhaust. extraneous friends. arsenals of acquaintances. groups and beliefs you have grown out of. time to spring clean your social networks. a true sense of belonging comes from authenticity of self, and all else that spring from that. opportunities for pleasure, joy, art, creation, romance and love remind you who you are and who is worth keeping around. your own best friend.

**PISCES ASC**: gains in the fourth, drains in the tenth. a place for solid roots, a home, a family. these are all themes that are of concern. it is less important that you be respected by the world, by your colleagues, than it is that you have a place to relax and retreat, to feel safe and secure, to delight in the smaller successes of comfort, a family dinner, a mortgage in your name, and a place to lay your head. you step down from an authority figure, and are content to just feel content. your mom, your dad, your home.

NOTE that the drain/gain paradigm isn’t black and white. There won’t be complete losses in one area so don’t expect that. Rather, a clearing up, drain, allows for the gains to have space to settle in. For example, Gemini rising draining of relationships that don’t serve gives Gemini rising the space to come into their own. Doesn’t mean all relationships are doomed.

The SN and NN work in tangent. No need to completely ignore or abhor or fear one in service of the other. The SN is the launching pad. The NN is where we go once launched.

Also remember that the Sag/Gem axis is one that is inherently cerebral in nature. It deals a lot with the mind. So Gemini information gather versus Sag ""I know it all"" is what is fundamentally at play here. At the end of this period, you will **KNOW** more about what there is for you to learn i.e. these changes could, for some, play out entirely in your brain. ",https://www.reddit.com/r/astrology/comments/ge1e9g/new_cycle_alert_south_node_sagittarius_north_node/,312,so that means that sn was in scorpio all this time?? MAKES SO MUCH SENSE IF THAT’S THE CASE OMG ,2020-05-05 16:52:06
607,ejmv7p,False,,102,Who/what is the Saturn in your life? Why it may not be as obvious and cliche as you think,astrology,"Approaching this upcoming notorious Saturn/Pluto conjunction, I have been seeing a lot of posts on different platforms talking about power and how to not give your power away to anyone else.  In other words, the real power comes from inside yourself, and anything coming from something outside yourself is limiting your own power.

At first glance, I always considered myself as someone who was ""above"" anything that would normally be perceived as authority.  For example, I have always seen my parents and older family members as equals to me.  And at work, I have always proudly considered myself to not be a victim of the manager's influence. Even when it came to taking drugs, I always knew confidently that I can live with or without them, and the choice was always up to me.

So when I would see these messages about not giving away your power, I would naturally think this doesn't really apply to me.  I could check that box off my ""to do"" list.

However, this past year, having done more internal work on my fears than ever before, I realized there had been an elephant in the room my entire life that I had been giving my power to.

The best way I can describe it is that I always felt I had been banished to live within certain limits.  Growing up in a lower middle class environment, I just always assumed that I was never going to be ""one of those"" people.  Some people lived a great life who got to have all of the nice things, with a family, a nice house, a nice car, and a job that they loved. But I was not one of those.

I created this ""phantom God"" in my mind, who limited my existence to where I could only live in apartments and work minimum wage jobs.  Maybe if I were really lucky, I would be able to even have a spouse that loved me.  But overall, I was to live in this small circle of limitations, and other people were living beyond the circle.

So when you think of who is really controlling you, it might not be as obvious as you think.  It might not be an authority figure that you can point to and say ""There! That's it!"".  It might be something much more ethereal and vague than you could have imagined consciously.",https://www.reddit.com/r/astrology/comments/ejmv7p/whowhat_is_the_saturn_in_your_life_why_it_may_not/,161,What does everyone think of Saturn in the 8th? ,2020-01-03 22:24:53
643,bruu7m,False,,33,"JUST GOT PUBLISHED AND WILL OFFICIALLY BE WRITING HOROSCOPES, CHECK OUT MY GEMINI READING FOR MY FELLOW TWINS or ya know, feel free to check out the article and see if its keeps you intrigued ❤",astrology,,http://futurism.media/gemini-gemini-season-energy-reading,153,"“How did it feel to be told about yourself this Taurus season... What ugly truths came out?”

Wow. That accuracy was scary. I got called out for complaining and being negative. Let’s just say the past few weeks have been... a time of self reflection. It’s hard to look at our twin in the mirror sometimes but I’m turning it around for Gemini season. 

Gemini Sun / Scorpio Moon / Leo Rising
It’s been wild.. ",2019-05-22 21:57:02
439,hgg4ve,False,,492,What sign is your Venus in and what qualities are you most attracted to in a partner?,astrology,"Also, what qualities are you most put-off by?

Mine is in Aquarius and I am so attracted to independent partners who are intellectually stimulating and are able to honor how much time I need to myself. 

I'm put off by clingy partners for sure.",https://www.reddit.com/r/astrology/comments/hgg4ve/what_sign_is_your_venus_in_and_what_qualities_are/,231,"Straight guy here with Venus in Leo/4th house, Taurus Ascendant and Virgo Sun.

There is no much mistery about, I can resume in 3 rules.

- Don't lie to me. I don't like to lose time, have in mind that I'll try to love you. So be yourself. Don't try to impressionate me, I want to love you, cooperate. 

- I'm extremely monogamic, so don't cheat/betray me. I'm pretty much into anything that doesn't hurt this rule (everything has limits, and I don't want to use your toys). I'm yours, you're mine. Sound possessive, but I don't want control you, that's kinda much because in essence what turn me on is duality, duo, the couple idea. Like Bonnie and Clyde, Tristan and Isolde, I love the idea of partnership in love. So clingy girls makes me turned on. Well... Be ready if you are into me and is clingy... 

- Take responsibility for yourself. Or don't make me guilty for things that aren't actually my fault. Basically if something in me makes you feel bad indirectly, don't act like I'm guilty on your inner trauma. Ofc, I care a lot about how you feel, but I care even more about what makes you feel like that, so I won't be condecending. We'll talk and I'll try to understand you, help you and work on it with you. But you need to be honest with me and say me the truth on preference in a objective way, draw if necessary. If something makes you feel bad, I'll try destroy it at once. I want to protect you, so I think that act as a Terminator sometimes is good for that... Hasta lá vista. 

If you're genuinely kind, you got 20% on way. 

Also, idc much about your body, you can looks like Jinx, Illaoi or Miss Fortune, just avoid be obese or anorexic, I'm not superman and neither want to break you. If you give me what I've wrote above I'll suck you mostly every day, just have hygienic habits, spend in soap, not in make up.

 I prefer if the girl is smart, has strong traditional values (I want a family, kids) and it's fair.There are some shallow stuff like be nerdy and wear glasses, but actually I'm mostly careless about (please, don't be dumb or shallow.) 

On overall, just don't be a pain on ass. ",2020-06-26 21:09:58
157,fhzohk,False,,44,Just reposting that now that we are in the situation we're in,astrology,,https://i.redd.it/55e0eczrzfm41.jpg,450,[deleted] ,2020-03-13 13:31:26
