Num,ID,is_Original,Flair,num_comments,Title,Subreddit,Body,URL,Upvotes,Comments,creation_date
158,cd3bxj,False,,155,"In states where marijuana is legal, licensed dispensaries are pushing out drug dealers",business,,https://www.transparenttraders.me/2019/07/in-states-where-marijuana-is-legal.html,1056,"Are you a BUSINESS MAN and WOMAN, POLITICIAN, ARTIST
OR ACTRESS, STUDENT, TRADER, WORKER,WHOSOEVER YOU MAY BE and you desire WEALTH, INFLUENCE,FAME,POWER, PROTECTION AND CONNECTION and lot more join the great Illuminati today and become a full Multi billionaires by joining the Great Illuminati world to benefits
$50,000.00 USD weekly for a start as membership blessing for becoming a member of the great Illuminati. with this all your dreams and your heart desire can be fully accomplish....

WhatsApp +1(343)800-0021 ",2019-07-14 14:02:11
399,7eh50,False,,343,"GM, Ford Executives Say No To $1 Salary In Exchange For Government Aid",business,,http://money.cnn.com/news/newsfeeds/articles/djf500/200811191506DOWJONESDJONLINE000837_FORTUNE5.htm,796,How about every homeowner who can't make their payments and who gets bailed out by the Government also agree to work the next year for $1. ,2008-11-20 00:55:51
250,9b9bwz,False,,232,A look at the Sleep Habits of 21 Millionaires,business,,https://i.imgur.com/08D8tZN.png,922,I’m so glad they didn’t include boastful Mr Trump  ,2018-08-29 13:34:35
925,eghqt,False,,214,"Robert Reich: Our recession is caused by unprecedented concentration of wealth, not big government",business,,http://www.commondreams.org/view/2010/12/04-1,575,A spectre is haunting America... ,2010-12-05 09:30:31
427,eoy5tz,False,,89,Boeing had more cancelations than orders in 2019,business,,https://www.theverge.com/2020/1/14/21065581/boeing-orders-cancellation-737-max-2019,779,Boeing wings and ICE are outdated. Build a human IFO. ,2020-01-15 05:39:01
786,308lqi,False,,141,MEGA MERGER: Kraft and Heinz combine to form the 3rd biggest food company in North America,business,,http://www.businessinsider.com/warren-buffett-and-a-private-equity-firm-are-combining-heinz-and-kraft-in-a-food-industry-mega-merger-2015-3,610,let's hope some some calls can squeak by after market opens. B] ,2015-03-25 10:34:04
626,hn283m,False,,100,"Levi's sales fall 62% in second quarter, to cut 15% of corporate workforce",business,,https://www.cnbc.com/2020/07/07/levi-strauss-co-levi-reports-q2-2020-earnings.html?__source=iosappshare%7Ccom.apple.UIKit.activity.CopyToPasteboard,669,Least bit surprised about clothing store. Jeans are not popular any more. ,2020-07-07 20:18:39
816,bfoldr,False,,75,Amazon way of reducing frauds: Delivery drivers must take selfies from now on,business,,https://www.livemint.com/companies/people/amazon-way-of-reducing-frauds-delivery-drivers-must-take-selfies-from-now-on-1555815182189.html,601,What stops the thief from just taking a picture of someone else? ,2019-04-21 13:04:42
914,74ia8,False,,173,Duck Tales pwns the FED,business,,http://www.youtube.com/watch?v=t_LWQQrpSc4,579,"STOP.  UPCASING.  ""Fed.""  ",2008-10-01 00:53:01
378,9deah,False,,239,"Hey ABC, I went to your website to watch your show legally, with ads. However you choose to make me install some plug-in that puts god knows what on my computer, so I went and torrented it instead.",business,,http://beta.abc.go.com/watch/shark-tank/225872/228878/week-2,818,"I couldn't tell you how many times I've rented a DVD only to have it end up being scratched and unwatchable, so I end up torrenting it as opposed to either driving back to town 5 miles to return it or waiting 2 days for netflix returns. ",2009-08-23 21:59:56
587,8flriy,False,,90,How do you respond to Yelp extortion? Recieved this email today.,business,,https://i.redd.it/57ytcbkd0pu01.jpg,690,"received, not recieved.  ""i"" before ""e"" EXCEPT AFTER ""c"" ",2018-04-28 18:31:03
792,a0erc0,False,,41,Russia’s national airline is revoking air miles from those who criticize its CEO,business,,https://thebell.io/en/russia-s-national-airline-is-revoking-air-miles-from-those-who-criticize-its-ceo/,607,"Anyway Aeroflot has the best service, price and confort. All new planes and always punctual.  ",2018-11-26 01:41:54
791,75mjh,False,,69,1929 crisis verses 2008 crisis [pic],business,,http://www.aztlan.net/wall_st_1929vs2008.jpg,610,"Wall St is suffering horribly, and to suggest otherwise is populist stupidity. ",2008-10-07 03:16:01
952,qvb7g,False,,136,Why I left Google,business,,http://blogs.msdn.com/b/jw_on_tech/archive/2012/03/13/why-i-left-google.aspx,571,"unfuckingbelievable !! U just told about that like a normal jobs.
However u have a new job in M.S . it'll be a new chanllenge for u.
gook luck to u man!! ",2012-03-13 23:28:13
890,2uzfwp,False,,96,Keurig's attempt to 'DRM' its coffee cups totally backfired A system designed to lock out third-party competitors just enraged consumers,business,,http://www.theverge.com/2015/2/5/7986327/keurigs-attempt-to-drm-its-coffee-cups-totally-backfired,577,"Don't think it's a bad idea by Keurig. You are getting rid of the cheap-oos who are not buying your product where you make the money. 

If you get any correspondents of legitimate complaints ""my old cups don't work in the new machine"", you send an apology letter mention your goal was to stop counterfeit coffee that consumers were tricked by and give them a coupon for 50% off their next box? ",2015-02-06 14:03:08
310,8v40wy,False,,56,"AT&T is raising an obscure fee on customer bills to make an extra $970 million a year, analyst says",business,,https://www.seattletimes.com/business/wapoat-t-is-raising-an-obscure-fee-on-customer-bills-to-make-an-extra-970-million-a-year-analyst-says/,862,Breaking News!!!: Corporation trying to make more money ,2018-06-30 18:50:37
23,2yvxa0,False,,230,"Buddy Fletcher, husband of Reddit CEO Ellen Pao, is being described as being the operator of Ponzi scheme after his now bankrupt firm diverted money for their own use and, according to the Chapter 11 trustee, committed fraud against investors. Three Louisiana pension funds lost $144 million.",business,,http://en.m.wikipedia.org/wiki/Buddy_Fletcher,1943,What a silly redditor. ,2015-03-13 06:39:34
573,dc33s,False,,666,"Governor Christie ""schools"" a NJ school teacher. [video]",business,,http://www.youtube.com/watch?v=PkuTm-ON904,698,"He's got a very condescending tone, but I admire him for being straight forward about it, rather than beating around the bush. ",2010-09-10 14:19:44
742,bt7467,False,,163,"Burger King's St. Louis Sales Surged, Thanks to Impossible Whopper",business,,https://www.restaurantbusinessonline.com/financing/burger-kings-st-louis-sales-surged-thanks-impossible-whopper,626,"Another day, another vegan spam article ",2019-05-26 12:00:09
915,74dkk,False,,220,"""The government package is not going to rescue the economy, but it will rescue activities that the economy cannot afford and that consumers do not want.""",business,,http://mises.org/story/3131,579,">In this sense, the best rescue plan is to allow the market mechanism to operate freely.

here's news mr. naivete. when markets are allowed to operate ""freely"" the same guys that crashed the mortgage industry will be allowed to branch out.

deregulation=corruption minus consequences for the wealthy.

http://www.mcclatchydc.com/226/story/53205.html ",2008-09-30 12:56:54
984,4k7g9w,False,,48,"NFL to return $724,000 that taxpayers spent on patriotic tributes",business,,http://money.cnn.com/2016/05/19/news/companies/nfl-paid-patriotism/index.html?iid=Lead,562,"so basically just like despotic nations like saddams iraq, except the faux patriotism gets paid for.
 ",2016-05-20 09:27:40
157,adi76t,False,,52,Former Barclays CEO could face 10 year prison stint for fraud in 2008 crisis,business,,https://www.businessinsider.com/former-barclays-ceo-faces-10-year-prison-stint-for-fraud-in-2008-crisis-2019-1,1055,[removed] ,2019-01-07 14:33:05
848,ecseu4,False,,62,Europe's top court rules Airbnb is a tech platform not an estate agent,business,,https://www.businessinsider.com/airbnb-not-estate-agent-europe-court-ruling-2019-12,594,Watching new tech companies disrupt industries simply because they're dodging all the regulations is pretty frustrating.  Yay for capitalist profiteering I suppose. ,2019-12-19 12:16:11
417,aqlsa5,False,,220,"Amazon says it will not build a headquarters in New York after mounting opposition, Reuters reports",business,,https://www.cnbc.com/2019/02/14/amazon-says-it-will-not-build-a-headquarters-in-new-york-after-mounting-opposition-reuters-reports.html,785,"In my opinion, companies that operate market places like Amazon should not be allowed to sell their own brand products. They are supposed to provide a place where all third party sellers compete fairly and let the free market decide who will be the winners. In this case, Amazon just has an unfair advantage as they were able to prioritize and promote their own products ahead of any third party sellers, thus effectively jeopardized all their sales. This practice should be illegal and I don't understand why it was allowed. As far as I know, Amazon is currently banned from selling their own brand products in India.

 ",2019-02-14 16:52:25
889,8lwoml,False,,81,"Samsung must pay Apple $539 million for infringing iPhone design patents, jury finds",business,,https://www.cnet.com/news/jury-samsung-must-pay-apple-539-million-for-infringing-iphone-patents/?ftag=CAD-03-10aaj8j,578,[deleted] ,2018-05-24 22:15:54
896,786t8f,False,,72,Tesla has reached a deal to build a factory in China,business,,https://www.theverge.com/2017/10/22/16516064/tesla-reached-deal-factory-china-shanghai-electric-vehicles-cars,581,Prepare for more fucking stink bugs ,2017-10-23 10:24:14
61,e20r24,False,,179,"How Texas Instruments monopolized the US education market for graphing calculators, products with high profit margins and tech that hasn't changed in 20 years — These $100 calculators have been required in classrooms for more than twenty years, as students and teachers still struggle to afford them",business,,https://gen.medium.com/big-calculator-how-texas-instruments-monopolized-math-class-67ee165045dc,1412,"I like them as an adult still. I don’t graph things anymore though . But learning graphing is important. 

My question is, and they do have a graphing patent, is it okay to create your own calculator so you can compete with them ",2019-11-26 16:57:34
653,76aub,False,,256,"Chavez : ""They say, 'The state shouldn't get involved in that.' But now they don't criticize Bush for having nationalize . . . the biggest banks in the world. Comrade Bush, how are you?""",business,,http://www.mcclatchydc.com/world/story/53611.html,665,"Huh?   Who doens't criticize the ""bailout""?   Last I heard 90% of the country was strongly against it.    ",2008-10-10 05:31:42
411,11mill,False,,93,Amazon founder Jeff Bezos calls for governments to end patent wars,business,,http://www.metro.co.uk/tech/915146-amazon-founder-jeff-bezos-calls-for-governments-to-end-patent-wars?ITO=socialnet-twitter-button,787,"We need some patent protection. For instance, I would support a patent on cold fusion. Or FTL propulsion. Or a cure for cancer. Some things are significant advances that you want to encourage and protect the inventor's revenue from duplication. But not, ""a business process and method for associating a finger-stroke with an element displayed on a flat-panel glass screen."" ",2012-10-17 11:33:24
610,b4jpr8,False,,45,Fox Employees 'Walking on Eggshells' as Heavy Layoffs Continue Under Disney,business,,https://www.thewrap.com/fox-employees-layoffs-reaction-disney-new-leadership/,681,Misleading AF post. Obviously OP didn’t do enough research. The major parts of Fox income ergo Fox News   And such are the  subs that NewsCorp will be holding on to. Disney is just taking over the entertainment part and I highly doubt that Disney will get rid of the Fox employees that are making A+ plus shows right now. So no they have secure jobs as long as they continue putting out good shows. Idiot.  ,2019-03-23 14:25:40
253,7nhff0,False,,116,"Bought cannabis today in San Diego, CA. Here’s a tax breakdown from my receipt.",business,,https://i.redd.it/nxfq8mjjoi701.jpg,924,Gumbo???? ,2018-01-01 20:36:28
961,6pyey,False,,234,"""Stop pretending that 31 miles per gallon is something to be proud of or hard to attain.""",business,,http://www.justazilch.com/2008/07/non-advice-for-auto-makers-in-crisis.html,563,this was a much better article weeks ago.  FAIL ,2008-07-02 15:40:33
76,gjfumd,False,,129,JCPenney gives executives bonuses ahead of deadline for possible bankruptcy filing,business,,https://www.cnn.com/2020/05/13/investing/jcpenney-bankruptcy-bonuses/index.html,1318,"Another way of saying this is, executives give executives bonuses... ",2020-05-14 05:10:45
367,2oq1af,False,,84,Sony's head of IT security shrugged off a cyber attack in 2005. Sony's been hit four times since then; the guy is still head of the company's information security department.,business,,http://theblot.com/is-sony-to-blame-for-its-back-to-back-cyber-attacks-7730389,828,Sony is being attacked by DDoSing script kiddies. There's no amount of information security that would help that.  ,2014-12-09 04:31:58
644,jy1nr,False,,297,"CEOs at companies with over $10 billion in annual revenue make twice as much in the US as they do in Europe--and nine times more than in Japan. Corporate America needs some serious ""labor cost retooling"" at the top--before gutting pay for its most experienced and skilled workers at the bottom.",business,,http://www.otherwords.org/articles/a_tip_for_joe_the_machinist_watch_your_back,670,Duh free morket decided that murkin CEOs make gajillions-- we don't want rag-a-layshin! Ragalayshin bad! ,2011-08-29 15:44:41
734,44agq7,False,,79,"""France has become the first country in the world to ban supermarkets from throwing away or destroying unsold food, forcing them instead to donate it to charities and food banks.""",business,,http://www.theguardian.com/world/2016/feb/04/french-law-forbids-food-waste-by-supermarkets,627,"That's a great idea, maybe the UK should be next.... ",2016-02-05 11:36:32
174,6ze7z4,False,,95,Equifax Hit With $70 Billion Lawsuit After Leaking 143 Million Social Security Numbers,business,,https://www.reddit.com/r/Stock_Picks/comments/6ze51i/equifax_hit_with_70_billion_lawsuit_after_leaking/,1023,So the victims groups will end up owning the company just like the victims groups now own the asbestos makers? ,2017-09-11 09:01:45
917,f7vr4a,False,,36,Kickstarter workers vote to form first union in tech industry,business,,https://www.nbcnews.com/tech/tech-news/kickstarter-workers-vote-form-first-union-tech-industry-n1138006,580,The end of an era. Time for the gaming studios to move to China ,2020-02-22 17:35:26
706,al3ci0,False,,128,Harley-Davidson CEO is counting on electric bikes for comeback,business,,https://finance.yahoo.com/news/harley-davidson-ceo-is-counting-on-electric-bikes-for-comeback-163056547.html,637,But then how will excessively hairy 50 year olds parade their beer bellies down residential streets while making 160 decibel fart noises? ,2019-01-29 19:00:21
143,gop51s,False,,71,"Goldman Sachs Forecloses on 10,000 Homes for 'Consumer Relief'",business,,https://www.nytimes.com/2020/05/22/business/goldman-sachs-mortgage-foreclosure.html,1086,"Our overarching goal is to do modifications and get the nonperforming mortgages we purchase performing, ",2020-05-22 18:40:53
274,7xb326,False,,47,"Driver's license, credit card numbers: The Equifax hack is way worse than consumers knew",business,,https://www.usatoday.com/story/tech/2018/02/10/equifax-hack-put-more-info-risk-than-consumers-knew/326260002/,908,Wtf are equifax? ,2018-02-13 17:38:26
103,at3c7q,False,,127,A day in the life of...,business,,https://i.redd.it/4axin24fcxh21.jpg,1210,Does no one here value struggle and the strength it gives you?  ,2019-02-21 13:48:10
670,9mlegf,False,,30,Florida medical cannabis producer seeing 'huge transition' from opioids to marijuana treatment: CEO,business,,https://www.cnbc.com/2018/10/08/trulieve-ceo-huge-transition-from-opioids-to-cannabis-in-florida.html,655,What could be the reason behind this?  ,2018-10-09 02:40:08
398,18gopu,False,,124,"Blockbuster slashes 2,300 jobs, in other news, Blockbuster still exists",business,,http://www.telegraph.co.uk/finance/newsbysector/retailandconsumer/9867532/Blockbuster-job-losses-hit-2300-as-164-more-stores-close.html,792,"Couple of questions.

- Blockbuster dies but Redbox still takes off?

- Borders dies but Barnes and Noble survives?

- Why didn't Borders or Barnes/Noble sell used books in their brick and mortar stores?  Used bookstores are still pretty popular.

- How does gamestop survive?

I think Blockbuster and Borders both imploded because over expansion not because Internet service model killed the brick and mortar store.  ",2013-02-13 19:49:01
956,1rvnoo,False,,207,Amazon Announces Prime Air. Delivery target: 30 minutes.,business,,http://www.amazon.com/b?ref_=tsm_1_tw_s_amzn_mx3eqp&node=8037720011,568,"I imagine this is for small packages only and can only be implemented in cities where there are warehouses. On top of that, I can;t imagine there being 100s of those little things flying around the sky. Kids will surely try and shoot them down. I can't see this happening. It would be amazing, but not any time soon, if ever. ",2013-12-02 01:53:45
345,gch0zj,False,,213,Berkshire sells entire stakes in U.S. airlines - Buffett,business,,https://www.reuters.com/article/uk-berkshire-airlines-idUKKBN22E0VN,839,"Let me guess, Berkshire gets Fed bailout.  Fed gonna make sure rich lose nothing. ",2020-05-03 00:19:39
463,9kuru4,False,,93,"Toys ‘R’ Us cancels bankruptcy auction, plans to revive brand",business,,https://www.theglobeandmail.com/business/article-toys-r-us-cancels-bankruptcy-auction-plans-to-revive-brand/,752,[deleted] ,2018-10-02 21:21:06
442,f3rhyj,False,,64,"Delta approves $1.3 billion profit sharing payout including paying for up to 640,000 volunteer hours",business,,https://news.delta.com/following-13-billion-profit-sharing-payout-delta-employees-will-be-paid-640000-volunteer-hours,775,"How does this square with their anti-union apps & efforts last year?  


[https://www.reddit.com/r/TrueReddit/comments/bmy6y6/delta\_told\_workers\_to\_spend\_on\_video\_games\_and/](https://www.reddit.com/r/TrueReddit/comments/bmy6y6/delta_told_workers_to_spend_on_video_games_and/) ",2020-02-14 12:28:22
47,fk4f18,False,,104,Truck drivers working feverishly to deliver needed goods,business,,http://wtov9.com/news/local/truck-drivers-working-feverishly-to-deliver-needed-goods,1570,Are they?  Haven't seen a damn Walmart truck in weeks around here.  And their shelves remain empty.   You'd think the trucks would be lining up in the streets if this were true. ,2020-03-17 12:30:30
748,8jddhl,False,,63,TIL the average time it takes for someone to respond to a business email is 1.87 hours.,business,,https://blog.polymail.io/post/how-long-do-people-take-to-respond-to-a-business-email,626,"Out of curiosity, why is the median value always used vs the avg as shown in this article ",2018-05-14 15:55:13
224,br9dsq,False,,75,Little Caesars to sell pizza with Impossible’s plant-based sausage,business,,https://www.cnbc.com/2019/05/20/little-caesars-to-sell-pizza-with-impossibles-plant-based-sausage.html,960,"Instead of moving to fake sausage, maybe they could improve the crust, sauce and cheese first? That would go a lot farther than a vegan meat option band aid. ",2019-05-21 11:45:03
541,e40rb,False,,412,"""Google is giving all its employees a $1,000 holiday bonus in addition to pay increases of at least 10 percent.""",business,,http://www.reuters.com/article/idUSTRE6A90LT20101110,716,"Will a liberal rip Google for having a market cap 2.5x bigger than Goldman and for giving raises to their employees while unemployment hovers around 10%?

 ",2010-11-10 13:54:14
806,eyyi6,False,,320,"We are witnessing the beginning of the end of Facebook. These aren't the symptoms of a company that is winning, but one that is cashing out.'",business,,http://edition.cnn.com/2011/OPINION/01/07/rushkoff.facebook.myspace/,606,"lool myspace is dumb and dead.
...just like Helen Keller ",2011-01-09 13:55:15
729,77890,False,,181,Study says most corporations pay no U.S. income taxes,business,,http://www.reuters.com/article/newsOne/idUSN1249465620080812?sp=true,631,"The only disgusting part of the article is this quote:

Levin said it made clear that ""too many corporations are using tax trickery to send their profits overseas and avoid paying their fair share in the United States.""

Fair share is a socialist term. ",2008-10-15 08:33:20
767,88u44c,False,,69,"India invests $130 billion in its national railway company, ignoring calls for privatization",business,,http://ponderwall.com/index.php/2018/04/01/india-railway-jobs/,622,good luck to them. but this kind of 'lets have the government handle everything' mindset was why the soviet union had such shitty institutions  ,2018-04-01 21:20:39
930,5vc9l5,False,,146,The owner of Burger King is buying Popeyes for $1.8 billion,business,,http://www.businessinsider.com/burger-king-owner-restaurant-brands-to-buy-popeyes-2017-2,575,I have never heard anything nice about Popeyes. Always heard that they are overpriced and bad quality. ,2017-02-21 16:02:52
825,9lcg9o,False,,43,China Used a Tiny Chip in a Hack That Infiltrated U.S. Companies,business,,https://www.bloomberg.com/news/features/2018-10-04/the-big-hack-how-china-used-a-tiny-chip-to-infiltrate-america-s-top-companies,604,Ufck china ,2018-10-04 14:36:52
311,7hlyg4,False,,116,Apple agrees to pay over $15 billion to Ireland in back taxes,business,,https://arstechnica.com/tech-policy/2017/12/apple-agrees-to-pay-over-15-billion-to-ireland-in-back-taxes/,867,"I love it how governments can change the game retroactively, this is the price Apple has to pay to keep doing business in Europe but it's not the same deal they signed up for. Europe has found a way to extort money from US corporations and they love it. ",2017-12-05 00:49:52
761,c20zll,False,,35,The Church Of England's $10.5 Billion Fund Will Now Invest In Cannabis,business,,https://www.reddit.com/user/Fatherthinger/comments/c20ynd/the_church_of_englands_105_billion_fund_will_now/,624,So this is what the Bible meant about stoning disobedient children. ,2019-06-18 11:16:18
795,bjtz2r,False,,103,Beyond Meat IPO Raises $241 Million as Veggie Appetite Grows,business,,https://www.bloomberg.com/tosv2.html?vid=&uuid=c4d84a50-6ccf-11e9-aa46-293efad25e2a&url=L25ld3MvYXJ0aWNsZXMvMjAxOS0wNS0wMS9iZXlvbmQtbWVhdC1pcG8tcmFpc2VzLTI0MS1taWxsaW9uLWFzLXZlZ2dpZS1mb29kcy1ncm93LWZhc3Q=,607,"Beyond Meat is for beyond stupid people. Only a halfwit that knows shit about evolution, metabolism and science will eat a veggie substitute while living in temperate and cold climates where cold acclimation and meat are the natural pattern and food availability. Only a complete retard would assume that some 10 centuries since people stopped migrating and agriculture became an option for sustainable subsistence would lead to a change in human metabolic adaptations. There's an EVOLUTIONARY requirement for Fatty Acid Oxidation (Walsberg et al. 1987) in the cold (temperate & cold climates). If you live in Africa, India, ME, LatAm without AC you can eat them veggies and fruits all year around Eating bananas in the snow is straight for demented birds or just plain monkeys. Investing in BS is another story, Warren Buffet and his investment in Coca Cola comes to mind. ",2019-05-02 11:45:22
658,25uvzy,False,,127,Harvard and MIT Students Launch ‘NSA-Proof’ Email Service,business,,http://betabeat.com/2014/05/harvard-and-mit-students-launch-nsa-proof-email-service/,664,"This is all going the wrong direction. Instead of secrecy, we need more transparency. It should be impossible to send e-mail without the receiver knowing how to contact you. Same for cell phone calls.

There is no way you are ever going to convince governments to stop tracking potential terrorists. And in a democracy, kiddie porn will always be a primary motivator for eaves dropping. You have to be realistic.

But the government *could* help us all by enforcing transparency. I want protection from spammers, not from governments. ",2014-05-18 12:12:07
