Num,ID,is_Original,Flair,num_comments,Title,Subreddit,Body,URL,Upvotes,Comments,creation_date
190,6u0ozx,False,,161,"​PayPal to pull services from sites linked to hate, violence & intolerance",business,,http://www.zdnet.com/article/paypal-to-pull-services-from-sites-linked-to-hate-violence-intollerance/,1006,How can people fight for net neutrality at a isp level but then be okay when internet services start doing the same thing.  ,2017-08-16 08:30:17
171,3j0s7b,False,,152,"Netflix is dropping old movie partnerships in pursuit of making Netflix Original movies, as well as continuing to create shows. They're also partnering up with Walt Disney Co. to bring us a lot more movies as soon as they leave theaters.",business,,http://www.bloomberg.com/news/articles/2015-08-30/netflix-to-drop-epix-channel-in-push-to-develop-original-films,1035,I bet they made an assessment of how frequently their long tail content was accessed be their original content. The long tail shit being so whored out is just no longer with even $40 for the meth it needs to keep going. People are walking novelty detectors. ,2015-08-31 00:36:08
275,gne6a1,False,,109,Amazon Is Reportedly Eyeing Bankrupt J.C. Penney As Coronavirus Stokes M&A Activity,business,,https://www.forbes.com/sites/andriacheng/2020/05/19/as-amazon-reportedly-eyes-bankrupt-jc-penney-coronavirus-may-be-heating-up-ma-deal-activities/#7a44a37e6b91,904,Is this good for my JCP call options? ,2020-05-20 16:09:02
911,7u0y7a,False,,104,"Amazon, Berkshire Hathaway and JPMorgan Team Up to Disrupt Health Care",business,,https://nyti.ms/2GuXbBp,580,"Next step after that, Oligarchy.  ",2018-01-30 13:21:47
913,fkjcl,False,,102,Bank of America using Private Intel Firms to Attack Wikileaks,business,,http://wikileaks.ch/IMG/pdf/WikiLeaks_Response_v6.pdf,579,This is goddamn terrorism. ,2011-02-13 13:32:17
396,dblqm,False,,204,"My god, a company that asked their employees what they needed...and listened?! What happened next? Productivity went up 7%!",business,,http://www.autoblog.com/2010/09/09/video-bmw-plans-for-tomorrows-older-workforce-today/,804,"The problem is always that someone *just isn't listening* to us little people.

We know better than our leaders what we need, because we're the people doing it!

Our entire human history is filled with oppression because our leaders simply would not listen to their workers, and make life easier for them, so they could be more productive. ",2010-09-09 14:20:13
804,1wdd7a,False,,300,"Obama raises minimum wage to $10.10 by executive order for ""hundreds of thousands"" of workers under federal contract",business,,http://www.huffingtonpost.com/2014/01/28/obama-minimum-wage_n_4677355.html,603,"Well, ok, good for them, but it's not going to solve the problem, not by a long shot. I don't know how federally funded contracts are awarded, but I do know some information about state or state agency contracts. In those, a contractor is paid a certain percentage of profit that's accounted got within the bid, as dictated by the agency requesting work. So if this is structured similarly, or even just if bidders expect a similar return on investment, the total will increase and the rich get richer at all of our expense, and only a few people see any benefit.

Hopefully a comprehensive minimum wage law is passed, and it's coupled with higher taxes on the top bracket. ",2014-01-28 14:21:40
87,g2ntmv,False,,77,"Carnival Cruise Executives Knew They Had a Virus Problem, But Kept the Party Going",business,,https://www.bloomberg.com/features/2020-carnival-cruise-coronavirus/,1264,If you can’t post truthful info then shut the fuck up. ,2020-04-16 21:14:34
559,7pzmz,False,,233,CNBC:  Is Now the Time to Legalize Drugs?,business,,http://www.cnbc.com/id/28672671,709,but obama *did* say the war was a failure... ,2009-01-15 18:33:13
56,ghtryj,False,,111,"Tyson linked to 4,500 COVID-19 cases, as meat industry blames workers",business,,https://www.businessinsider.com/tyson-4500-covid-19-cases-as-meat-industry-blames-workers-2020-5,1468,I'm very anti union... except meat processing. After spending some time in these places early in my career I'm convinced they need organized labor for a few decades to get standards where they need to be. ,2020-05-11 18:50:37
88,6vsy66,False,,177,Amazon will lower Whole Foods prices right away and Prime members will get special discounts,business,,https://www.recode.net/2017/8/24/16198716/amazon-whole-foods-lower-prices-prime-discounts-benefits,1271,">lower Whole Foods prices

kek, and people still expect to get quality food? ",2017-08-24 18:48:25
409,fdbs4i,False,,94,Coronavirus takes aim at the US$1.7 trillion global tourism industry as leisure and business travellers stay home,business,,https://www.scmp.com/business/article/3065027/coronavirus-takes-aim-us17-trillion-global-tourism-industry-leisure-and,791,Traveling to Rome  in June and a bunch of other European countries. This shit better be over by then cause I wana see the damn Colosseum. ,2020-03-04 11:40:39
80,fw51dp,False,,125,"Target’s Delivery Workers Are Staging a Walkout: Gig workers on the delivery platform Shipt say they’re asking for the bare minimum: paid leave, hazard pay and protective gear for all shoppers.",business,,https://www.vice.com/en_us/article/z3b9kw/shipt-workers-are-staging-a-walkout,1298,"I'm working on a local market type of personal shopper. I welcome anyone from Shipt to work with me. 

People want local, they feel good about paying a little extra for local, and local is inheritly cheaper to the businessepeople using them.

If your interested in working with me PM me. I can design a site and work the business side pretty decently... But a real web developer and someone with working knowledge of the delivery business would help me and we can be the next Apple -steal an idea and make billions. ",2020-04-06 19:20:06
572,7xnwwy,False,,54,Twitch just passed MSNBC and CNN for January viewers,business,,https://dotesports.com/business/news/twitch-msnbc-cnn-viewers-21102,700,"Yeah, but they’re all poor viewers.  ",2018-02-15 04:02:16
407,do9185,False,,42,Lyft offers free rides to job interviews,business,,https://fox5sandiego.com/2019/10/27/lyft-offers-free-rides-to-job-interviews/,795,[deleted] ,2019-10-28 13:44:51
201,59nkuo,False,,197,Hotel CEO openly celebrates higher prices after anti-Airbnb law passes,business,,https://www.washingtonpost.com/news/the-switch/wp/2016/10/26/hotel-executive-openly-celebrates-higher-prices-after-anti-airbnb-law-passes/,986,If airbnb we're smart they'd get out ahead of this and have all the users form an association to self-regulate so the .gov doesn't step in  ,2016-10-27 12:01:35
297,gh7ufw,False,,86,Work From Home For Rest Of Year? Some Tech Companies Say “Yes”,business,,https://www.forbes.com/sites/zackfriedman/2020/05/08/google-facebook-amazon-work-home/,872,"Just a note: this may be something being considered in countries where the COVID crisis is out of control, but not in Oz where we have it cautiously under control. My organisation has a recognition of the value of the workplace for the mindset of the workforce. Sure, we've held it together through this, but gradually we'll get back to BAU. I'm slated to be amomgst the first to return in the next few weeks. ",2020-05-10 19:32:15
217,hgqfja,False,,43,Consumer Reports finds harmful levels of arsenic in Whole Foods' bottled water,business,,https://www.cnn.com/2020/06/24/business/whole-foods-arsenic-water-consumer-reports-wellness/index.html,967,"Don’t worry, it’s Trump solution against Covid-19 ",2020-06-27 09:18:27
828,cwrg9t,False,,106,Facebook no longer says 'free and always will be' on homepage,business,,https://www.usatoday.com/story/tech/2019/08/27/facebook-no-longer-says-free-and-always-be-homepage/2133300001/,602,"Did you know Facebook uses facial recognition? That's why they ask for a photo, so they can put that in there data base... along with your other info. ",2019-08-28 21:50:34
757,4dd1ss,False,,252,Millennials are being dot.conned by cult-like tech companies,business,,http://nypost.com/2016/04/03/millennials-are-being-dot-conned-by-cult-like-tech-companies,623,"This sounds like a typical propaganda piece by the right-wing tabloid rag trying to paint tech companies in a negative light since they are all currently opposing LGBT discrimination laws across the country.

Murdoch media never fails to unimpress. ",2016-04-04 20:47:09
607,55x42u,False,,85,PepsiCo sued for exaggerating health benefits of Naked Juice,business,,http://www.foxnews.com/health/2016/10/04/pepsico-sued-for-exaggerating-health-benefits-naked-juice.html,677,"> In the lawsuit filed Tuesday in the United States District Court for the Eastern District of New York,  CSPI writes that Naked Juice’s “NO SUGAR ADDED” claims imply that the products are low in sugar when they actually are not. For example, the brand’s Pomegranate Blueberry Juice contains 61 grams of sugar, or 50 percent more sugar than a 12-ounce can of Pepsi, despite not having any sugar added.


I laughed hard at that, because only an idiot could misinterpret what ""no sugar added"" means. 

So you have apple juice, a fruit with a high level of natural sugars (fructose). Pepsi did not add any sugar to the juice, which is common practice, to sweeten the taste. So the claim of no sugar added is valid.  NOTE: the claim is not ""No sugar"", it's ""No sugar added"".

However, if this juice were not natural, they might have to synthesize the flavors, and that might require adding sugar to take the place of what the natural juice would provide.

This seems so utterly brain dead, it's hard to know where to start. ",2016-10-05 01:44:20
368,ibbrx,False,,112,"A little house of secrets on the Great Plains: More than 2,000 companies are registered to a 1,700-square-foot brick house in Cheyenne, Wyoming.",business,,http://www.reuters.com/article/2011/06/28/us-usa-shell-companies-idUSTRE75R20Z20110628,822,Mark ,2011-06-28 14:40:54
107,838l54,False,,217,"Price changes per industry, 1997 - 2017",business,,http://pbs.twimg.com/media/DWaHhiXVwAA7ip5.jpg,1199,"This graph is terrible. Is it inflation adjusted, or not? Rather than percentages, does it mean linear multiplication on the Y axis? Because going down by 100% is a mite different than going down by a factor 1/2. 

There is no way to meaningfully interpret this.  ",2018-03-09 17:48:52
288,gs4h87,False,,76,GE is saying goodbye to its 129-year-old light bulb business,business,,https://edition.cnn.com/2020/05/27/business/ge-light-bulbs-sale/index.html,883,I guess today Nobody knows how big of a deal this is. ,2020-05-28 11:23:31
971,7ub83h,False,,159,About 800 workers to lose jobs as Harley-Davidson closes its Kansas City assembly plant,business,,http://www.kansascity.com/news/business/article197340544.html,562,I am surprised the stable genius behind clean coal wasn't able to save this ,2018-01-31 16:45:05
891,2m7tr9,False,,188,Reddit CEO Resigns,business,,http://www.cnbc.com/id/102183717,584,Have Snowden become a proximal CEO.  ,2014-11-13 21:10:24
636,d9wew,False,,354," America's misguided culture of overwork ____ 
Germany's workers have higher productivity, shorter hours and greater quality of life. How did we get it so wrong?",business,,http://www.salon.com/books/feature/2010/08/25/german_usa_working_life_ext2010,671,[deleted] ,2010-09-05 18:11:28
301,wewm0,False,,342,"Last year, local retailers successfully lobbied to force Amazon to collect sales tax with or without a local presence.  Looks like this may backfire — Amazon is building warehouses in major metro areas and plans to offer delivery within hours.",business,,http://www.slate.com/articles/business/small_business/2012/07/amazon_same_day_delivery_how_the_e_commerce_giant_will_destroy_local_retail_.html,870,"I lived near the Newegg Edison, New Jersey warehouse, and ordered something using standard free UPS shipping. It came within 8 hours. Almost everything from Newegg came within 24 hours. Luckily I was able to resist getting things from them. 

Reliably getting things within usually 3 business days makes me pay a premium to a good extent for Newegg over other stores (it's usually 48 hours to where I currently live). When it was within 24 hours, even more of one. UPS ground usually is within 24 hours if you live within 6 hours worth of Interstate driving to your location. 

This is where I stopped using Amazon. Their free $25 saver is no longer fast. Most of my stuff arrives nowadays towards the end of their shipment estimate, which happens to be around 21 days. Their standard rate is, but I used to really love their free saver. So, if Newegg costs $5-8 more, I get it from them instead if it's not Egg Saver. Even Egg saver is quicker than Amazon Free Saver.

With 24-hour service, many people might be willing to pay the sales tax premium. However, I'm not sure if I'll bother if it takes them 2 weeks to physically ship something out (Newegg, by contrast, usually is only 1-24 hours) ",2012-07-12 00:01:50
708,tcgoa,False,,193,"$500,000 for unlimited 1st-class passes on American Airlines? Only until they decide you didn't comply with terms they never enumerated.",business,,"http://www.latimes.com/business/la-fi-0506-golden-ticket-20120506,0,3094073,full.story",642,">Heavy users, including Vroom and Rothstein, were costing it millions of dollars in revenue, the airline concluded.

/Sigh... unlikely. ",2012-05-08 04:45:44
290,1rkiz9,False,,104,"The media loses its shit when a Model S catches fire. Meanwhile, Ford issues its fifth recall for the Escape SUV after 13 reports of spontaneous combustion.",business,,http://www.detroitnews.com/article/20131126/AUTO0102/311260052/Ford-recalling-140-000-13-Escape-SUVs-fire-risks,885,"Look through your newspapers. How many Tesla adds are there? How many Ford adds? It is the same online. 

Your answer to why is right there.  ",2013-11-27 13:25:39
785,4s8irx,False,,59,'Pokémon GO' Is About To Surpass Twitter In Daily Active Users On Android,business,,http://www.forbes.com/sites/jasonevangelho/2016/07/10/pokemon-go-about-to-surpass-twitter-in-daily-active-users/#32c8c22c5174,610,How is this going to sell? When most people sit in one place and play their games.  ,2016-07-11 01:38:46
257,36r82s,False,,305,"GM says you don't own your car, you just license it",business,,http://boingboing.net/2015/05/21/gm-says-you-dont-own-your-ca.html,918,[deleted] ,2015-05-21 14:06:47
3,fl2oor,False,,287,"Mark Cuban says bailed out companies should never be allowed to buy back their stocks ever again. “Not now. Not a year from now. Not 20 years from now. Not ever,” Cuban said.",business,,https://www.cnbc.com/2020/03/18/mark-cuban-says-bailed-out-companies-should-never-be-allowed-to-buy-back-their-stocks-ever-again.html,4883,Sorta. For this one idk. This is government made. No one is asking for this.now for big companies who should be prepared for situations like GM yeah. So they won’t just pocket it. There will be a downside to it ,2020-03-19 02:57:53
439,8azci7,False,,87,Amazon spent nearly $23 billion on R&D last year — more than any other U.S. company,business,,https://www.recode.net/2018/4/9/17204004/amazon-research-development-rd,768,"Take that IBM!
 ",2018-04-09 15:37:52
226,27z8ie,False,,86,"Tesla Motors opens its patents, ""in the spirit of the open source movement, for the advancement of electric vehicle technology.""",business,,http://www.teslamotors.com/blog/all-our-patent-are-belong-you,954,"How bout, ""in the spirit of Nikola Tesla..."" ",2014-06-12 17:10:45
100,75xb2,False,,179,"The Smoking Gun - AIG executives spent $440,000 partying at a swanky California resort days after YOUR $85 billion bailout -- HERE'S THE ACTUAL INVOICE",business,,http://www.thesmokinggun.com/archive/years/2008/1007083aig1.html,1223,peanuts ,2008-10-08 13:33:21
307,gumz71,False,,78,Facebook's Zuckerberg faces employee backlash over Trump protest comments,business,,https://www.reuters.com/article/us-facebook-trump-employee-criticism/facebooks-zuckerberg-faces-employee-backlash-over-trump-protest-comments-idUSKBN2382D0?feedType=RSS&feedName=businessNews,869,Lol Facebook haters going around spreading any clickbait news they can. ,2020-06-01 15:49:34
332,gl91m7,False,,61,The coronavirus exposed the US' reliance on India for generic drugs. But that supply chain is ultimately controlled by China,business,,https://www.cnn.com/2020/05/16/business-india/india-pharma-us-china-supply-china-intl-hnk/index.html,853,[deleted] ,2020-05-17 04:16:54
985,4aiegk,False,,189,"iHeart, the largest U.S. owner of radio stations, is crumbling under $20.6 billion in debt",business,,http://www.dispatch.com/content/stories/business/2016/03/12/owner-of-radio-stations-faces-mountain-of-debt.html,560,[deleted] ,2016-03-15 13:21:28
492,9q6qm1,False,,70,"A Billionaire Pledges to Fight High Drug Prices, and the Industry Is Rattled",business,,https://www.wsj.com/articles/a-billionaire-decided-to-fight-high-drug-prices-and-the-industry-is-rattled-1540145686,743,Please do this! And thank you! So many lives could be saved! 🤗💕 ,2018-10-21 20:13:37
629,g9oolf,False,,57,Mnuchin warns some U.S. firms could face criminal liability over coronavirus loans,business,,https://www.reuters.com/article/us-health-coronavirus-usa-mnuchin/mnuchin-warns-some-u-s-firms-could-face-criminal-liability-over-coronavirus-loans-idUSKCN22A22L?il=0,674,"This administration hold corporations accountable? Hahahahaha, ok ok, sure thing. ",2020-04-28 14:56:31
560,8bktdo,False,,70,A first-in-the-U.S. proposal would give employees in New York City the right to ignore work-related emails and texts outside of working hours.,business,,https://www.hpe.com/us/en/insights/articles/would-the-right-to-disconnect-help-workers-in-the-city-that-doesnt-sleep-1804.html,700,"This is such a bad idea. Government needs to stop putting restrictions on business not adding more ridiculous ones like this. If you don’t want to answer your emails, don’t and accept the consequences. There are plenty of people out there very willing to work harder than you that would love to take your salary. ",2018-04-11 21:32:41
209,9xf7cp,False,,76,Tesla slashes prices on home solar systems by 25% to spur sales,business,,https://www.reuters.com/article/us-tesla-solar/tesla-slashes-prices-on-home-solar-systems-to-spur-sales-idUSKCN1NK2UP,973,But I thought everyone wanted one?? ,2018-11-15 20:57:15
847,7evt8,False,,125,CEO of Japan Airlines cuts own payrate to below pilot salaries,business,,http://tinyurl.com/japanceo,596,"I don't understand why we even have pilots any more. The newer jets can taxi to and from a gate, take off and land and navigate all by themselves. I think there still should be 1 pilot, but there is no need for 2 pilots anymore. Pilots are now pretty much just glorified bus drivers. 

As a final note, if you could get a ticket for 75% of the normal price, but there was only 1 pilot and all the flights are run on autopilot, would you fly the airline?  ",2008-11-21 19:30:41
525,m2zce,False,,144,"High school teachers write their own textbook, save $175,000",business,,http://www.therepublic.com/view/story/1dbc25bcc4ae4060a421fa204e91c0c8/MN--Online-Textbooks/,722,"Tehy turk uor jerbs!!!

signed,
textbook company ",2011-11-07 01:38:13
481,fx5j43,False,,100,"Logan’s Roadhouse fires employees, closes 261 locations",business,,https://www.witn.com/content/news/Logans-Roadhouse-fires-employees-closes-all-locations-569446581.html,742,[deleted] ,2020-04-08 12:22:30
615,74erl8,False,,17,Former CEO struggles to defend why Equifax deserves $7 million IRS contract to prevent fraud,business,,https://www.washingtonpost.com/news/business/wp/2017/10/04/former-ceo-struggles-to-defend-why-equifax-deserves-7-million-irs-fraud-prevention-contract/?utm_term=.b4cda1161fe0,677,This is kind of like not trusting doctor providing diabetes treatment because he/she's fat.  ,2017-10-05 09:06:57
386,27sdub,False,,152,"FDA May Destroy American Artisan Cheese Industry by banning practice of aging cheese on wooden boards - Corporate cheese makers like Kraft will be able to weather this regulatory storm — but for small businesses and artisan cheese makers, wood boards are in fact essential to the making of cheese.",business,,http://www.forbes.com/sites/gregorymcneal/2014/06/09/fda-may-destroy-american-artisan-cheese-industry/,807,https://petitions.whitehouse.gov/petition/lift-fda-restrictions-ripening-cheese-wooden-boards-which-will-devastate-american-craft-cheese/JXNNnM7x ,2014-06-10 14:32:14
641,5s0ups,False,,100,Amazon soars to more than 341K employees — adding more than 110K people in a single year,business,,http://www.geekwire.com/2017/amazon-soars-340k-employees-adding-110k-people-single-year/,668,i dont care about any jobs outside the US. if its not a job created inside the US it doesnt matter to me in the slightest. ,2017-02-04 14:29:24
831,gj82la,False,,203,"After years without turning a profit, Tesla is now poised to be a powerhouse",business,,https://www.cnn.com/2020/05/13/business/tesla-profit-outlook/index.html,597,CNN is fake news ,2020-05-13 21:21:22
0,56go6v,False,,294,EpiPen makers to pay massive $465 million fine for ripping off Medicaid over the lifesaving device,business,,http://www.nydailynews.com/life-style/health/epipen-makers-pay-465-million-fine-ripping-medicaid-article-1.2822016,8024,"Oh please, it's obvious they're getting a slap on the wrist for making the news and making it obvious how crooked the system they're a part of is. By making them pay a fine the powers that be make themselves appear to be operating in the public interest. It's all rigged. ",2016-10-08 12:06:46
21,aj3rsm,False,,177,CEO of IBM says hiring based on skills instead of college degrees is vital for the future of tech,business,,https://gizmodo.com/ceo-of-ibm-says-hiring-based-on-skills-instead-of-colle-1831977815,1995,Racist. ,2019-01-23 19:59:32
799,7ukp8,False,,282,"Jon Stewart presents economic recovery plan.  DON'T give the money to the banks, give it to the consumers for the sole goal of paying off debt.   Banks get liquidity, we get less debt. ",business,,http://www.thedailyshow.com/video/index.jhtml?videoId=217029&title=lawrence-lindsey,607,But but but ... that's *socialism*!!! ,2009-02-03 17:50:18
349,1qowqc,False,,139,Costco's to Give Employees Thanksgiving Off,business,,http://www.thebraiser.com/costcos-closed-for-thanksgiving/,836,And just when I thought I couldn't love Costco any more than I already do..... <333 ,2013-11-15 14:18:20
868,39wpuq,False,,149,CVS Health buys Target pharmacy business for $1.9B,business,,http://www.usatoday.com/story/money/2015/06/15/cvs-health-target-pharmacy-acquisition/71239452/,589,I read that as $1.98 and thought it strangely fitting. ,2015-06-15 12:40:30
69,ahkyv1,False,,81,Bill Gates: Increasing access to vaccines and medicines for people in need is the best investment I've ever made,business,,https://www.cnbc.com/2019/01/17/bill-gates-says-this-is-the-best-investment-he-has-ever-made.html,1360,Too bad everyone’s going to die of measles ,2019-01-19 10:20:33
939,8si6e6,False,,120,China Rolling Out An Obligatory Program That Places Monitoring Chips In Every Car,business,,https://smartmobtech.com/news/china-rolling-obligatory-program-places-monitoring-chips-every-car/,570,As if the Citizen social credit system used to rate citizens and punish them through it wasn’t bad enough.  ,2018-06-20 13:11:21
920,1qczjo,False,,91,Amazon starts Sunday delivery with USPS starting in LA and NYC first and expanding in 2014 with no extra charge to users. Prime subscribers can order on Friday and get their package on Sunday.,business,,http://www.usatoday.com/story/tech/2013/11/11/amazon-sunday-delivery-usps/3479055/,573,One problem.. The USPS doesn't deliver mail on Sundays and in many places on Saturdays either.. ,2013-11-11 06:10:28
167,3bidl7,False,,118,"According to the 2015 AMI (American-Made Index), Toyota Camry is the most ""American"" car based on parts manufactured. Ford's entire lineup does not even qualify as American anymore.",business,,http://fortune.com/2015/06/29/cars-made-in-america/,1036,"So *that's* why their mid+ lineup is so great!

(The Focus and under are junk still.) ",2015-06-29 13:54:17
112,94buvv,False,,105,An engineer for General Electric has been arrested for stealing wind turbine technology from GE and using it to start a company in China...with the help of Chinese government,business,,https://blog.twinstate.com/news/ge-trade-secrets-theft,1182,Funny how there were basically none of these caught spy stories during obummer's administration other than Anna Chapman. Now there's like one every couple months and we're still in the first 1/2 of term 1 for Trump. ,2018-08-03 17:59:19
756,7dh66h,False,,32,"'Say Goodbye to Local Media, FCC Opens Corporate Merger Floodgates • r/worldpolitics",business,,https://www.reddit.com/r/worldpolitics/comments/7dg4v0/say_goodbye_to_local_media_fcc_opens_corporate/,619,This could create an opening for bloggers to cover local news in their respective communities. ,2017-11-17 01:08:13
674,63tapj,False,,64,Jeff Bezos Says He Is Selling $1 Billion a Year in Amazon Stock to Finance Race to Space,business,,https://www.nytimes.com/2017/04/05/science/blue-origin-rocket-jeff-bezos-amazon-stock.html?_r=1,658,Amazon's share price has been on the upswing. Bezos is showing strong dedication with this move. He's gotta believe space is the better bet.  ,2017-04-06 14:35:33
10,4vgqs9,False,,110,Getty Images is facing a $1 billion lawsuit for selling photos that were in the public domain,business,,http://qz.com/746255/photographer-files-1-billion-suit-against-getty-images-for-selling-photos-in-the-public-domain/,3454,"She was given a $120 fine, and sued for 1 billion. I will never understand the values of software companies these days. ",2016-07-31 11:39:19
