Num,ID,is_Original,Flair,num_comments,Title,Subreddit,Body,URL,Upvotes,Comments,creation_date
340,ga74xz,False,,606,"""FREE AMERICA NOW"": Elon Musk protests US coronavirus lockdowns",business,,https://www.businessinsider.com/elon-musk-protests-us-coronavirus-lockdowns-on-twitter-2020-4,840,"So he “protested” with a tweet? What a renegade!

Not everyone drinks the kool-aid. Sheeple.


In New York alone they counted 3.000 people as corona victims without evidence.

https://www.nytimes.com/2020/04/14/nyregion/new-york-coronavirus-deaths.html

That's a logical fallacy right there: We don't know what killed them, therefore it was the corona virus.

The mortality rates are not facts. They are models based on assumptions which have yet to be proven.

They counted people dying of unknown causes as corona virus victims. Therefore any deriving numbers and models from the death count is false.

The media does not report it like that. They report the WHO Numbers wihtout questioning them.

The lockdown was suggested by the same people, who came up with the flawed models.

The death count says absolutely nothing because any other explanation than ""Corona Virus is responsible"" is deemed garbage because one expert says so. ",2020-04-29 10:40:48
238,gn1obx,False,,108,Pier 1 going out of business and closing all 540 stores,business,,https://www.cbsnews.com/news/pier-1-close-all-540-stores/,944,"Crap, where am I going to buy my white nationalist protest torches now? ",2020-05-20 01:12:40
316,m9fed,False,,230,"This 28-Year-Old's Startup Is Moving $350 Million And Wants To Completely Kill Credit Cards: Unlike PayPal, Dwolla doesn't take a percentage of the transaction. It only asks for $0.25  whether it's moving $1 or $1,000",business,,http://boingboing.net/2011/11/11/this-28-year-olds-startup-is.html,855,will never work... it just makes people drive their prices up. 2 dollar item with a .25 transaction fee? are you stupid? ,2011-11-12 02:59:06
638,8g7ew5,False,,257,Subway Closing 500 Locations in U.S.,business,,https://finance.yahoo.com/news/subway-closing-500-locations-u-165048171.html,669,What’s with all the subway hate? This chain is fantastic and everyone knows it  ,2018-05-01 10:24:01
648,hgl6ai,False,,69,Coca-Cola pauses advertising on all social media platforms globally,business,,https://www.cnbc.com/2020/06/26/coca-cola-pauses-advertising-on-all-social-media-platforms-globally.html,659,"If they really want to change something, they can stop selling cancer to people: they can remove aspartame from their recipe and replace it with real sugar as they’ve done in most/all other countries of the world. Aspartame is to my knowledge the only food product *known to cause cancer* and still permitted by the FDA, because Coco-Cola’s lobbyists are more powerful than FDA regulators.

But Coke doesn’t care. They just want to look like they do. ",2020-06-27 02:15:22
344,7yo7o,False,,298,"'Socialist' Sweden refuses to bail out GM-owned Saab. ""Voters did not pick me to buy loss-making car factories"".",business,,http://news.bbc.co.uk/1/hi/business/7899244.stm,840," Redditors, I'm sure they would be more than happy to let you all in.  ",2009-02-19 16:12:56
771,976aec,False,,195,"Elon Musk confirms his bid to take Tesla private, backed by Saudi Arabia’s sovereign wealth fund",business,,https://techcrunch.com/2018/08/13/elon-musk-confirms-his-bid-to-take-tesla-private-backed-by-saudi-arabias-sovereign-wealth-fund/,622,"The fund is not the Saudi government folks, it also won’t own all of Tesla it will be a larger share holder of the private entity but I do not expect a majority stake in any case. ",2018-08-14 07:15:34
152,ddqf8,False,,522,"Corn producers want to relabel ""high fructose corn syrup"" as ""corn sugar"" to get around consumers wanted to eliminate HCFS from their diets.",business,,http://www.huffingtonpost.com/2010/09/14/corn-sugar-high-fructose-corn-syrup_n_716007.html,1067,Let's keep the H. Post links over at Digg. ,2010-09-14 15:57:51
381,7wgja,False,,88,How to solve the toxic asset problem: give them to bank executives as bonuses.,business,,http://baselinescenario.com/2009/02/08/heres-an-idea/,815,Brilliant! ,2009-02-11 04:07:30
942,bx1m07,False,,98,Beyond Meat’s stock pops on report that meatless companies are struggling to keep up with surging demand,business,,https://www.cnbc.com/2019/06/04/beyond-meats-stock-pops-on-report-that-meatless-companies-are-struggling-to-meet-demand.html,570,"Is this a fad?  I'm sensing this is a fad.  I've never had one, but it seems that the consensus is all the same, that the taste is off compared to a real burger.  But maybe it's an acquired taste?  I also don't think there's enough information for people to know if there are any negative health side effects.  Are people automatically assuming these are healthier than real burgers because we already know the negative side effects of a real burger?  I mean, it'd be pretty ironic if the country converted to these burgers, only to then discover empirical evidence that showed lab-grown meat is worst than farm grown.  I aint joinin' this band wagon just yet! ",2019-06-05 11:45:03
907,9d7dvm,False,,66,Big Pharma companies spend more on marketing than R&D,business,,https://grafiti.io/facts/49223,582,"I think this is a marketing piece for Roche! :)


Jokes aside, go Roche! ",2018-09-05 15:04:31
148,994bk6,False,,185,It's Official: Open Plan Offices Are Now the Dumbest Management Fad of All Time,business,,https://www.inc.com/geoffrey-james/its-official-open-plan-offices-are-now-dumbest-management-fad-of-all-time.html,1075,"I'm not even sure I understand what the definition is for ""open plan"" in this case. Are they talking about the kind of offices where all spaces are shared and you don't have desk assignments? Or are they simply talking about not having cubicles? 

Personally, I went from a company that did cubicles to a company with a more modern office where there's a short wall on one side and a cubby on the other so there's a little separation, but much more open. We still have our own desls. Then we moved into an even newer office and all cubicle walls were gone completely  because we were instead each given ""standing desks"" that have an electric motor so you can stand or sit. It doesn't really work well with cubicle walls because the desk height can change.

In the newest office, our standing desks were smaller than our older desks. So what they did is allotted the same amount of sq feet per person in real estate, and since our desk spaces were smaller they used the leftover space for a bunch of collab seating and lounges everywhere.

And I'm going to go ahead and call bullshit on this article. Our office is phenomenal and the workplace culture is a million times better than where I used to work, and even better compared to some team members we have in my current company that are in a 20 year old office up north that still uses the cubicles. They're a bunch of recluses who hate each other and do shit work because they don't learn to get better from each other. Most of them even have a mirror in their cubicle so they can see if anyone is behind them. Shady.  ",2018-08-21 15:53:17
391,eszdgw,False,,91,"Wells Fargo former CEO John Stumpf fined $17.5 million, banned for life from banking",business,,https://www.bizjournals.com/sanfrancisco/news/2020/01/23/wells-fargo-former-ceo-john-stumpf-fined-17-5.html,803,Wells Fargo needs to be permanently shut down they are well aware they can make money scamming people because the fine is only a tiny fraction of the made profit. ,2020-01-23 21:01:43
951,2qv1ny,False,,162,Google got it wrong. The open-office trend is destroying the workplace.,business,,http://www.washingtonpost.com/posteverything/wp/2014/12/30/google-got-it-wrong-the-open-office-trend-is-destroying-the-workplace/?tid=pm_pop,566,long story short: I had an office and the big bad man took it away from me.....WHAAAAAAAA!!!! ,2014-12-30 23:08:21
237,dwqbd1,False,,128,"Burger King Puts Impossible Burger on the Kids’ Menu, Tests More Plant-Based Options",business,,https://www.yahoo.com/lifestyle/burger-king-puts-impossible-burger-162117806.html,944,Could be another reason the are all closed in Canada. ,2019-11-15 12:47:46
132,84ewoh,False,,31,Adidas sold 1 million shoes made out of ocean plastic in 2017,business,,https://www.usatoday.com/story/money/retail/2018/03/14/environmental-initiative-adidas-sold-1-million-shoes-made-out-ocean-plastic-2017/423271002/,1098,"Hey guys, would anyone be able to fill out my survey about ticket touts for my dissertation? It only takes 5 minutes, thank you! https://plymouthbusiness.eu.qualtrics.com/jfe/form/SV_0H8Iw6xDkSHcDB3 ",2018-03-14 16:51:54
387,8at32z,False,,106,"Amazon didn't kill Toys R Us, greedy Wall Street profiteers did it",business,,https://www.usatoday.com/story/opinion/2018/04/08/amazon-didnt-kill-toys-r-us-wall-street-profiteers-did-column/491434002/,806,Otay. ,2018-04-08 21:12:16
514,7bjzpw,False,,134,"I poured my blood, sweat and life savings into my restaurant. Dumbest thing I've ever done",business,,https://torontolife.com/food/restaurant-ruined-life/,730,"I got to where he found this guy a plot to buy, and couldn't read any more of what this dumbass had to say. He deserves everything bad that happened, and some. What a fucking moron. ",2017-11-08 08:11:02
419,1w633f,False,,738,How does one become the CEO of a Fortune 500 company?,business,"What does it take? How big of a factor does luck play? How important is the education you got, the school you went to? Do you have to know a lot of people? What qualities do you need to have? How are the CEOs chosen?",https://www.reddit.com/r/business/comments/1w633f/how_does_one_become_the_ceo_of_a_fortune_500/,784,"1) Be born rich

2) Have daddy pay for you to get into some pompous ivy league school

3) Get an internship at Goldman Sachs doing sexual favors to your boss

4) Screw everyone in your path to get what you want

5) CEOs are chosen by who is most unethical. Try to disrespect people a lot, a la Marissa Mayer. That'll show how amazingly gifted you must be, since you don't care about anyone but you.

6) At this point, you can't live without thinking you're the most successful human to ever live. Greed will naturally make you obsessed with profits, at all moral and human costs. 

7) Wait until you grow old and look like a senior individual who dedicated his/her life to extracting profit from dishonorable opportunities. Eventually some sickly old CEO will consider you his successor, and you will ascend to the position. ",2014-01-26 03:51:56
485,6snls3,False,,115,"SeaWorld attendance keeps dropping, and its stock falls 7%",business,,http://www.latimes.com/business/la-fi-seaworld-attendance-20170808-story.html,748,"SeaWorld could try harder, ORCAn choose another main attraction...  ",2017-08-09 18:49:03
640,cpcxxo,False,,82,22-year-old in Spain allegedly scammed Amazon out of $370K with return shipments filled with dirt,business,,https://www.newsweek.com/22-year-old-allegedly-scammed-amazon-out-370k-return-shipments-filled-dirt-1452452,667,This guy should be given an award! Everyone should start doing this actually. Jeff Bezos is the real criminal... ,2019-08-12 14:14:58
220,73x2s,False,,337,Google publicly backs gay marriage,business,,http://googleblog.blogspot.com/2008/09/our-position-on-californias-no-on-8.html,966,Why do people even need a license to get married? ,2008-09-27 17:58:29
323,5m6svv,False,,197,"Sears to Sell Craftsman for $900 Million, Shutter 150 Stores",business,,https://www.bloomberg.com/news/articles/2017-01-05/stanley-to-buy-craftsman-brand-from-sears-for-about-900-million?cmpid=socialflow-twitter-business&utm_content=business&utm_campaign=socialflow-organic&utm_source=twitter&utm_medium=social,859,"This is a pretty easy fix -- just have Donald Trump give them a call. In a pinch, a tweet will probably do. Thanks. ",2017-01-05 14:56:25
353,aklvae,False,,114,$1.5 trillion U.S. tax cut has no major impact on business capex plans: survey,business,,https://www.reuters.com/article/us-usa-economy-investment/15-trillion-us-tax-cut-has-no-major-impact-on-business-capex-plans-survey-idUSKCN1PM0B0,834,But I've seen wages increased from the morally sound companies ,2019-01-28 09:28:38
690,7acpu,False,,98,Bailout Swindle Revealed: Taxpayers paid $125 billion for bank stock that a private investor could purchase for $62.5 billion.,business,,http://www.thenation.com/doc/20081110/greider2,649,"*sigh* To be honest, its just too much money, and I am really too tired to do anything about it. ",2008-10-30 18:25:17
712,85pjit,False,,77,TIL Mark Zuckerberg is dumping his personal Facebook stock... he plans to sell $13 billion by 2019,business,,https://www.cnbc.com/2018/03/18/facebook-failing-zuckerberg-and-sandberg-absent-commentary.html,637,"Facebook is a website with ads. Nothing else. You can also post messages on that site.

A high-school kid can make exactly the same site. ",2018-03-20 03:00:03
732,37gh3h,False,,143,FIFA Rocked as U.S. Charges 14 in Corruption Investigation,business,,http://www.wsj.com/articles/six-soccer-officials-arrested-in-fifa-corruption-investigation-1432710956,630,FIFA Fo Fum! ,2015-05-27 13:26:04
921,gw21v0,False,,41,Beyond Meat brings its plant-based burgers to KFC and Pizza Hut in China,business,,https://www.cnn.com/2020/06/03/business/yum-china-beyond-meat-intl-hnk/index.html,577,[deleted] ,2020-06-03 20:35:02
726,7livf,False,,355,"If we allow this money, the trillion dollar stimulus Obama will implement, to be spent on pork, it will be the end of us. ",business,,http://www.nytimes.com/2008/12/24/opinion/24friedman.html?ref=opinion,628,"Personally, I wouldn't mind a trillion dollars worth of bacon. ",2008-12-24 16:25:36
894,fcb4db,False,,174,Coronavirus Is Different. It’s Rapidly Hitting Supply and Demand.,business,,https://www.wsj.com/articles/coronavirus-is-different-almost-no-company-is-safe-11583064000,585,"The people will survive  
In their environment  
The dirt, scarcity, and the emptiness of our south  
The injustice of our greed  
The practice we inherit

The dirt, scarcity and the emptiness of our south  
There on the beach  
I could see it in her eyes  
I only had a Corona  
Five cent deposit ",2020-03-02 12:08:53
192,1n6dn5,False,,192,Imgur Is Now Bigger Than Reddit And Profitable,business,,http://www.buzzfeed.com/jwherrman/imgur-is-now-bigger-than-reddit,997,"imgur profitable?

Bullshit. ",2013-09-26 14:08:35
266,3kj332,False,,331,Judge rules on taxi industry lawsuit: Compete with Uber or die,business,,http://www.crainsnewyork.com/article/20150909/BLOGS04/150909863/judge-rules-on-taxi-industry-lawsuit-compete-with-uber-or-die,908,"Thank god. I had a nightmare about taking a Yellow Cab light night, and woke up in a sweat.  Must have been worrying about this upcoming judgement.   ",2015-09-11 11:24:20
554,crx8u6,False,,72,"Devastating Banana Fungus Arrives In Colombia, Threatening The Fruit's Future",business,,https://www.npr.org/sections/thesalt/2019/08/16/751499719/devastating-banana-fungus-arrives-in-colombia-threatening-the-fruits-future,703,"As someone who is allergic to bananas to the point where being in the same room causes my mouth to bleed, I’m okay with this. ",2019-08-18 05:16:49
456,dw7uf,False,,588,Mass Firings At Digg,business,,http://www.businessinsider.com/mass-firings-at-digg-2010-10,764,I guess they just [failed](http://i.imgur.com/s0l4N.jpg) ,2010-10-25 19:21:36
273,7uvx2,False,,195,The more I read about bank bailouts the more I feel I'm a victim of the biggest con ever.,business,,http://www.webtvhub.com/bankrupt-britain/britain-loves-banks.php,904,"Someone coming up to you saying they are going to mug you and then clubbing you in the face before taking your wallet is not a con man. You were mugged not con'd.

You aren't the victim of a con when you knew what the result was going to be, at no point did you have any confidence that the would work and at no point willfully gave money or access to money over. 

 ",2009-02-04 19:20:03
128,62cs6k,False,,283,Amazon CEO Jeff Bezos is now the second richest man in the world,business,,http://uk.businessinsider.com/amazon-ceo-now-second-richest-man-in-world-after-stock-surge,1108,How about you give away a billion dollars a year. ,2017-03-30 08:50:57
248,dkhud,False,,304,Al Franken's proposed bill would make it an unfair practice under federal law for private firms to use arrest warrants in debt collections. Consumers would have the right to sue collectors over the practice,business,,http://www.americablog.com/2010/09/al-franken-seeks-legislation-to-reduce.html,934,"Government is overstepping here there needs to be some middle ground here, obviously this is being abused but it's not like it doesn't server a purpose people should pay their debts and we seem to be making it easier and easier for people to skip out on them and many already don't take them serious. ",2010-09-29 13:40:11
883,b87440,False,,191,Burger King’s new Impossible Whopper is 0% beef. That’s a big deal.,business,,https://www.vox.com/future-perfect/2019/4/1/18290762/burger-king-impossible-whopper-plant-based-meat,587,McDonald's could easily go meat-free as well because their burgers are fairly tasteless.  ,2019-04-01 19:07:07
652,6595s8,False,,188,"The shoppers with the highest likelihood to shop secondhand are those with incomes above $125,000.",business,,https://m.forbes.com/sites/richardkestenbaum/2017/04/11/fashion-retailers-have-to-adapt-to-deal-with-secondhand-clothes-sold-online/?c=0&s=ShopTalk,663,but below...? ,2017-04-13 23:37:17
453,9xmrh9,False,,87,"Disney Is Spending More on Theme Parks Than It Did on Pixar, Marvel and Lucasfilm Combined",business,,https://www.nytimes.com/interactive/2018/11/16/business/media/disney-invests-billions-in-theme-parks.html,761,And they only have kiddie coasters with only 1-2 exceptions. That’s kinda sad... ,2018-11-16 14:46:20
980,em38ds,False,,94,Tesla's market value zooms past that of GM and Ford - combined,business,,https://www.reuters.com/article/us-usa-stocks-tesla/teslas-market-value-zooms-past-that-of-gm-and-ford-combined-idUSKBN1Z72MU,560,Makes literally no sense ,2020-01-09 02:33:56
433,781hi,False,,116,"Police discovered an inventory of 66 cameras, 31 laptops, assorted jewelry, and more when they searched his home.  Who stole this? A TSA employee while at work. ",business,,http://tech.yahoo.com/blogs/null/107092/tsa-agent-steals-200k-worth-of-gear-resells-it-on-ebay/,776,I favor the Saudi solution to this problem. Cut off his hands. He won't steal with them again. ,2008-10-19 13:56:58
586,amzy8z,False,,114,Top 10 Companies that spend the most on R&D,business,,https://i.redd.it/8612792kpie21.jpg,685,No pharmaceuticals on here? I thought new drugs were *so expensive* to develop. ,2019-02-04 09:08:52
341,9kpg4h,False,,232,"Amazon will raise its minimum wage to $15 for all 350,000 U.S. workers",business,,https://www.recode.net/2018/10/2/17927340/amazon-minimum-wage-15-dollars,845,"The headline is great PR; but, what is the actual impacted number of how many actual people get the raise? Likely much less than 350K, the article does not address this. Not all of Amazon’s 350k US workforce is below $15/ hour. This does nothing for the people who are currently making more than that. Likely their wages will remain the same. ",2018-10-02 10:26:27
12,3nttwu,False,,409,"If Apple didn’t hold $181B overseas, it would owe $59B in US taxes",business,,http://arstechnica.com/business/2015/10/apple-google-microsoft-hold-more-than-336b-overseas-via-legal-tax-loopholes/,2947,"It's totally cool if corporations dodge taxes, but very criminal for me to do so. Don't we just love the world we live in? Whose to say some of that money won't be used to buy a politician or a small army one day? ",2015-10-07 11:26:31
571,3pix3m,False,,154,A 23-year-old Google employee lives in a truck in the company's parking lot and saves 90% of his income,business,,http://www.businessinsider.com/google-employee-lives-in-truck-in-parking-lot-2015-10,702,"He must have gotten the idea from Gonzo, a character from  Trapper John MD. (A MASH spinoff.)

It was a camper called the Titanic.

https://www.youtube.com/watch?v=KIdRgqfHSGQ ",2015-10-20 18:32:23
451,9tlnjo,False,,80,It’s time to stop spending billions on cheap conference swag,business,,https://www.fastcompany.com/90260185/its-time-to-stop-spending-billions-on-cheap-conference-swag,765,I hate how old people use the word swag in an attempt to be cool. It's just pathetic. Don't use SWAG unless your under the age of 15. ,2018-11-02 16:30:15
754,bmk3cc,False,,133,Shaving upstart Harry's is selling for $1.37 billion to the company that owns Schick razors,business,,https://www.cnbc.com/2019/05/09/edgewell-to-buy-shaving-startup-harrys-for-1point37-billion-nyt.html,619,Dicks.... ,2019-05-09 13:53:31
199,6qpxyr,False,,177,Reddit raised $200 million in funding and is now valued at $1.8 billion,business,,https://www.recode.net/2017/7/31/16037126/reddit-funding-200-million-valuation-steve-huffman-alexis-ohanian,990,[deleted] ,2017-07-31 17:26:51
774,duehm,False,,402,"The Tax Haven That's Saving Google Billions: Google uses a complicated structure to send most of its overseas profits to tax havens, keeping its corporate rate at a super-low 2.4%.",business,,http://www.businessweek.com/magazine/content/10_44/b4201043146825.htm,614,"Google is a fuckwad that is stealing from you and I.  Just because this is legal, it is clearly a loophole when you zoom out to the big picture.  Google = Nazi ",2010-10-21 15:01:10
38,ipdqz,False,,212,"Reporter issues apology: Remember how Reuters reported that Newscorp got a 4.8 billion dollar tax refund? Well, actually, that was how much they *paid*, on 10.8 billion in profits.",business,,http://www.reuters.com/article/2011/07/13/column-dcjohnston-murdoch-idUSN1E76C25320110713?mwh=1,1645,"That's ok, Newscorp has been spreading lies for years.  ",2011-07-14 12:43:04
585,3x7dye,False,,59,"Shkreli, CEO Reviled for Drug Price Gouging, Arrested on Securities Fraud Charges",business,,http://www.bloomberg.com/features/2015-martin-shkreli-securities-fraud/,693,"The way he pisses everyone off like the everyman equivalent of ISIS, why isn't anonymous hacking for his dirt yet? ",2015-12-17 11:54:17
101,2mgwm6,False,,99,Tech Company Organizational Chart,business,,http://i.imgur.com/jrsoHo3.jpg,1217,ELI5 Amazon isn't a pyramid scheme ,2014-11-16 15:17:07
74,aliemz,False,,227,Chaos has reportedly erupted inside Facebook as employees find themselves unable to open the company's apps on their iPhones.,business,,https://www.businessinsider.com/facebook-chaos-after-apple-blocks-internal-iphone-apps-report-2019-1,1318,Ok.  ,2019-01-30 22:31:30
55,hjnsp4,False,,322,"Tesla is now worth more than Toyota, Disney and Coke",business,,https://www.cnn.com/2020/07/01/investing/tesla-market-value/index.html,1478,"Okay idk why everyone assumes I’m in the states? Anyway, my point is despite it overtaking those companies in value, it’s not a global brand yet. ",2020-07-02 01:32:00
793,6afe23,False,,68,"Snapchat expected to lose $2 billion in 2017, greater than Tesla and Twitters losses",business,,https://www.google.com/amp/amp.timeinc.net/fortune/2017/03/30/snapchat-snap-stock-profit-amazon-tesla-twitter/%3Fsource%3Ddam,608,I hate snap chat  ,2017-05-10 20:28:09
94,7ssg1w,False,,83,"Uber, the world’s largest taxi company, owns no vehicles. Facebook, the world’s most popular media owner, creates no content. Alibaba, the most valuable retailer, has no inventory. And Airbnb, the world’s largest accommodation provider, owns no real estate.",business,,https://techcrunch.com/2015/03/03/in-the-age-of-disintermediation-the-battle-is-all-for-the-customer-interface/,1228,"Bitcoin, worlds biggest bank. Holds no money ",2018-01-25 01:56:12
552,a3agry,False,,103,Wells Fargo computer glitch blamed as hundreds lose their homes,business,,https://www.cbsnews.com/news/wells-fargo-loan-modification-error-homeowners-who-went-into-foreclosure-seek-answers/,705,[deleted] ,2018-12-05 08:33:42
505,edm76,False,,137,"Wikileaks Next Target: ""A Big US Bank"" - Please say this is TRUE!",business,,http://www.zerohedge.com/article/wikileaks-next-target-big-us-bank?utm_source=feedburner&utm_medium=feed&utm_campaign=Feed%3A+zerohedge%2Ffeed+%28zero+hedge+-+on+a+long+enough+timeline%2C+the+survival+rate+for+everyone+drops+to+zero%29,734,How about FoxNews or the Republican party. ,2010-11-30 00:27:54
127,79nf9,False,,84,The rescue plan [PIC],business,,http://bigpicture.typepad.com/comments/images/2008/10/23/080924_rescue_plan.jpg,1110,Again ? How many times has this been posted on reddit already ? ,2008-10-27 16:23:45
900,5u1d59,False,,300,Milllenials aren’t moving because they don’t have the Money to move.,business,,http://www.nbcnews.com/business/consumer/why-millennials-aren-t-moving-why-s-problem-n720646,581,"I'll just save all the publishing companies a ton of time publishing these articles. ""Millennials aren't doing anything because they have no money."" Glad that's over. Let's report on some other shit now. ",2017-02-14 17:00:16
780,bfdq9v,False,,18,"Sears owner Eddie Lampert, Steven Mnuchin sued over 'asset stripping'",business,,https://www.usatoday.com/story/money/2019/04/18/sears-lawsuit-eddie-lampert-esl-investments/3507382002/,613,Dot know don't car e guylokks like a Moron ,2019-04-20 16:02:06
377,5vi4bg,False,,119,Billionaire Elon Musk credits his success to these 8 books,business,,http://www.cnbc.com/2017/02/21/billionaire-elon-musk-credits-his-success-to-these-8-books.html,815,Really? It wasn't the decades of fanatical work? ,2017-02-22 11:15:18
650,glwfh4,False,,50,Japan falls into recession as virus takes its toll,business,,https://www.bbc.com/news/business-52570721,662," How to attract Americans to read a news article ? 
Post a picture of any damn gun ",2020-05-18 06:51:56
