Num,ID,is_Original,Flair,num_comments,Title,Subreddit,Body,URL,Upvotes,Comments,creation_date
534,cers0k,False,,62,7 types of income streams.,business,,https://i.redd.it/11ftqfhi12b31.png,717,And all of these should be taxed at the same rates. How you earn should be irrelevant. ,2019-07-18 12:22:03
886,4l9hpy,False,,111,"American Airlines: 70,000 Passengers Delayed Due to TSA",business,,http://time.com/4349766/airline-70000-passengers-missed-flights-due-to-security-lines/,583,"   The Airlines along with GOP are creating this as a feature, not a bug- they are both against unionization and the only way they know to prevent that is to privatize the process.    Check out the lack of funding by Congress - why would they want to have fewer agents- to create a bottleneck and then whine long and loud.

Don't be stupid - this has always been the GOP action plan...underfund and then complain about delay or access.   ",2016-05-27 06:13:47
471,wzmml,False,,92,Jack Daniel’s Sends the Most Polite Cease-and-Desist Letter Ever,business,,http://mashable.com/2012/07/22/jack-daniels-trademark-letter/,757,"Yep, if everyone did business like that the world would be a wonderful place full of gum drops and whiskey and rainbows. But they don't, so it's full of money and business success instead. ",2012-07-23 00:14:26
448,d47dt9,False,,96,The world's largest oil plant in Saudi Arabia was attacked by 10 explosive drones ahead Aramco's plans for the biggest IPO ever,business,,https://www.businessinsider.com/saudi-arabia-oil-aramco-drone-strike-2019-9,771,Inb4 The US did it ,2019-09-14 16:26:57
71,38wus9,False,,105,"""Chipotle Mexican Grill Inc. will expand benefits formerly reserved for salaried workers, including full tuition reimbursements, sick pay and paid vacations, to all employees on July 1, executives said Thursday [4 June 2015].""",business,,http://nrn.com/hr-training/chipotle-expand-benefits-hourly-employes,1351,"Will this make the guacamole cheaper? I don't care about the workers.  Just please, make the guac cheaper. ",2015-06-07 14:51:17
623,35xs74,False,,45,US FTC agrees w Tesla that consumers shouldn't have to buy cars from dealerships,business,,http://pando.com/2015/05/12/the-ftc-agrees-with-tesla-people-shouldnt-have-to-buy-vehicles-from-dealerships/,669,hello all auto dealers:  suck my ass! ,2015-05-14 12:14:07
479,57ugcw,False,,62,Retailers are finally realizing that starting Black Friday on Thanksgiving is a terrible idea,business,,http://www.businessinsider.com/thanksgiving-day-shopping-is-no-longer-a-thing-2016-10,747,"I stopped shopping on Black Friday when I read that the stores expect bottom feeders looking for gifts or re-sellers and the brands send cheap-shit, sub-par stuff. So even though you think you are getting some name-brand item, inside, it's garbage components.  ",2016-10-17 00:04:29
373,flifwy,False,,87,"Former UN ambassador Nikki Haley resigns from Boeing board, opposing government aid",business,,https://www.cnbc.com/2020/03/19/former-un-ambassador-nikki-haley-resigns-from-boeing-board-opposing-government-aid.html,820,"Knew this was coming.. Yea I'm completely against handouts and free bees but it sucks to say Boeing’s going to help get us back to work more than you as an individual alone bubby, wrong? sure but ...

“eet ees what eet ees” ",2020-03-19 21:41:28
50,f5odau,False,,365,Jeff Bezos says he's giving $10 billion to fight climate change - about 7.7% of his net worth,business,,https://www.businessinsider.in/science/news/jeff-bezos-says-hes-giving-10-billion-to-fight-climate-change-about-7-7-of-his-net-worth/articleshow/74182211.cms,1524,The good news is oligarchs and the idle rich are getting nervous and trying to buy their way out of consequences. This 10b is of course a joke as far as combating climate change ,2020-02-18 07:56:33
520,3lnq6p,False,,102,Ernst & Young Removes Degree Classification From Entry Criteria As There's 'No Evidence' University Equals Success,business,,http://www.huffingtonpost.co.uk/2015/08/04/ernst-and-young-removes-degree-classification-entry-criteria_n_7932590.html?viksra,728,Cross post to /r/consulting  ,2015-09-20 09:05:03
393,1ko2la,False,,580,Forever 21 drops all full time retail employees to part time to avoid provisions of the ACA.,business,,http://www.policymic.com/articles/59981/obamacare-strikes-and-forever-21-cuts-employees-hours,800,"But, but. but .... Obama has HopeNChange and he's got a Peace Prize ...  ",2013-08-19 14:45:55
519,a4wl2l,False,,69,Facebook's fall: From the friendliest face of tech to perceived enemy of democracy,business,,https://www.foxnews.com/tech/facebook-went-from-happy-face-of-tech-to-perceived-enemy-of-democracy,722,"Do not let the stock price fool you, it is self cannabalism...

https://www.thestreet.com/investing/stocks/facebook-jumps-on-9-billion-stock-buyback--plan-bullish-deutsche-bank-note-14805336 ",2018-12-10 15:27:07
357,akswz1,False,,115,Fortnite Battle Royale had amassed 125 million active players by June 2018 and made US$1.2 billion (A$1.6 billion) for Epic Games. It has also been linked to 200 divorces.,business,,https://ponderwall.com/index.php/2019/01/28/stay-alive-something-moves-shoot-fortnite/,835,Vidya is for man babies ,2019-01-28 22:22:31
113,6ijt5y,False,,191,Uber CEO Travis Kalanick resigns,business,,https://www.nytimes.com/2017/06/21/technology/uber-ceo-travis-kalanick.html,1179,"He helped build the world's biggest scam, where people effectively steal money from their future selves, and give part of it to Uber.

Because Uber is the world's biggest payday loan scam, with interest at 25%. 

But instead of simply going to Uber to borrow money, you have to drive a fuckton of miles in your car, to borrow that money from yourself, and pay Uber for the privelege.

So, if you are driving for Uber, you are either retarded, or desperate, and most likely, both. ",2017-06-21 05:29:41
338,136w6t,False,,457,Black Friday slips into 'Grey Thursday' as retail giants face staff backlash. Workers criticise 'pure greed' as stores like Walmart and Target encroach on family time by opening on Thanksgiving Day,business,,http://www.guardian.co.uk/business/2012/nov/14/black-friday-grey-thursday-staff-backlash,842,"If it's just so outrageous, then why don't you quit? I guess it really isn't that outrageous then, eh?

Consumers want this, the suppliers will oblige. It's profitable. ",2012-11-14 17:58:00
503,78ndsz,False,,72,Congress votes to disallow consumers from suing Equifax and other companies with arbitration agreements | TechCrunch,business,,https://techcrunch.com/2017/10/24/congress-votes-to-disallow-consumers-from-suing-equifax-and-other-companies-with-arbitration-agreements/,734,"Neither party gives an F about the consumer.  
The real issue is class action lawsuits, in which the consumer gets shafted and the lawyers make a killing.  
Real class action reform would not come in the form of favoring arbitration over lawsuits (or vice versa) but in requiring that attorneys’ fees in class action suits be paid in the same form as the payment to consumers and requiring that people opt-in to join a class, rather than having to actively opt-out.
Ending payment of attorneys’ fees in cash but consumers getting coupons (which are only good one buys more of the alleged wrong-doing firms’ products/services) would ensure consumers get a fair shake.  This would hurt the lawyer lobby, and thus most Democrats (and many Republicans) would never support it.
Requiring people to opt-in to class-action suits (rather than go through a long process of opting-out) would reduce the number of frivolous class action suits.  Again, this would hurt the lawyer lobby, and thus most of our politicians wouldn’t support it.
In short, it comes down to most Democrats favoring the lawyer lobby over the business lobby, and most Republicans favoring the opposite.
Neither cares about the consumer/citizen.
 ",2017-10-25 12:37:14
524,7izqm,False,,112,Fed Refuses Bloomberg Request to Name Recipients of $2 Trillion in Lending,business,,http://bloomberg.com/apps/news?pid=20601087&sid=apx7XNLnZZlc&refer=home,719,"one month away and the new fed chairman will disclose it all and the the lawsuits will fly, its not like they got cold hard assets like gold any bullshit and the loan could be squashed, remember the credit card people can cancel how much from their agreement just by letting you know the next month, then who get hit? ",2008-12-12 06:09:11
981,7t83z,False,,238,Michael Dell asked Vladimir Putin how the US could help Russia improve its IT infrastructure. Putin's response?,business,,http://money.cnn.com/2009/01/28/news/companies/dell.davos.fortune/index.htm,558,"I yearn for the old days Comrade, when this идиот ""Dell"" would not have escaped with his life.. ",2009-01-29 02:27:22
499,6gl6wu,False,,258,“Pink slime” lawsuit worth $5.7 billion could change journalism,business,,https://news.vice.com/story/pink-slime-lawsuit-worth-5-7-billion-could-change-journalism,737,"""Fake News"" = real journalism + fake meat ",2017-06-11 12:45:21
869,9egdka,False,,85,"Jack of All Trades, Master of None: Why Every New Skill Doubles Your Chance of Success - ""Our entire skillset is often more important than any individual skill. And when we can combine two skills that seem completely unrelated, then we build an even more specialized version of ourselves...""",business,,https://www.theemotionmachine.com/jack-of-all-trades-master-of-none-every-new-skill-doubles-your-chance-of-success/,589,Garbage. People just get taken advantage of when their employers find out about their multiple skills. Ask me how I know. ,2018-09-09 20:50:11
667,9gk00e,False,,169,US Vegan Food Sales Explode - Exceeding $3.7 Billion In One Year,business,,https://www.plantbasednews.org/post/us-vegan-food-sales-explode-exceeding-3-7-billion,661,"This will continue to be a growth industry. It isn't good for people, but high profit, fast growing industries never are. ",2018-09-17 12:45:26
428,4sgffb,False,,122,Pokemon GO Is Driving Insane Amounts Of Sales At Small Local Businesses. Here's How It Works,business,,http://www.inc.com/walter-chen/pok-mon-go-is-driving-insane-amounts-of-sales-at-small-local-businesses-here-s-h.html,779,"I want to get in on this somehow, Maybe own some portion or stock of some business and tell them to do this, or do it myself? ",2016-07-12 11:02:41
389,hsfplf,False,,115,"KFC will sell Beyond Fried Chicken at 50+ California restaurants after wildly successful test launches in Atlanta, Nashville, and Charlotte",business,,https://www.businessinsider.com/kfc-will-sell-beyond-fried-chicken-at-select-california-restaurants-2020-7?amp&__twitter_impression=true,806,"I bought Beyond Burgers from Costco. I'm not vegetarian. They were pretty tastey and looked good for imitation meat. There are two issues I have with them from a nutrition stand point though:

1) They are about 40 calories MORE than an 80/20 ground beef patty of the same weight.

2) They are made with canola oil, which isn't the healthiest fat for our livers plus almost all canola these days is gmo. Even if they used non-gmo canola, there's risk of cross-pollination from neighboring plants that are gmo. ",2020-07-16 18:53:39
544,ahg4t5,False,,84,Germany looks to ban Huawei from 5G,business,,https://www.ft.com/content/8f08f824-1a5f-11e9-b93e-f4351a53f1c3,709,Looks like companies like Apple and Samsung didn't like the added competition. Why compete when you can just shut your competition out. ,2019-01-18 23:02:25
281,8wg782,False,,59,Report: Amazon will publish toy catalog this holiday to fill Toys ‘R Us void,business,,https://arstechnica.com/information-technology/2018/07/report-amazon-will-publish-toy-catalog-this-holiday-to-fill-toys-r-us-void/,900,[deleted] ,2018-07-06 01:56:36
687,afkxj2,False,,57,Amazon and Microsoft are currently the two largest providers of public cloud services. That business is generating nearly $50 billion a year in revenue now between the two and is expected to double by the end of 2020,business,,https://stockmarketnews.today/2019/01/13/amazon-and-microsoft-are-currently-the-two-largest-providers-of-public-cloud-services-that-business-is-generating-nearly-50-billion-a-year-in-revenue-now-between-the-two-and-is-expected-to-double-by/,644,"I’m considering moving from onedrive to amazon because when I send a link to a client to download their pictures in onedrive it try’s to force them to sign in, when they don’t or want a an MS account.

However both don’t seem to have good system for mobile to download a more then 1 photo at a time. I still hope for better system from both sides.  ",2019-01-13 16:35:12
776,fo6nx0,False,,19,Trucking Companies Increase Hiring During Crisis,business,,https://www.ttnews.com/articles/trucking-companies-increase-hiring-bolster-supply-chain,618,"“Maybe I could learn to be a truck driver. Mav, you got the number to that truck driving school we saw on TV? Truck Master I think it is? I might need that”

Source: am pilot ",2020-03-24 15:10:01
594,cge50f,False,,155,'Our paychecks bounced': US workers in limbo as coalmines suddenly close,business,,https://www.theguardian.com/business/2019/jul/22/blackjewel-mines-shut-down-layoffs-future,687,"I can't stand the Trump comments related to this:
1. Coal industry was dying. 
2. Trump courted coal industry offering support. 
3. Trend continues =/= trump lied/failed. He probably did in fact slow the inevitable. 
Disclaimer: I don't like Trump but Trump bashing related to this is stupid. ",2019-07-22 14:48:28
512,aqhg4a,False,,80,Warren Buffett on why bubbles happen: People see neighbors 'dumber than they are' getting rich,business,,https://www.cnbc.com/2018/09/12/warren-buffett-on-why-the-next-financial-crisis-is-unavoidable-greed.html,729,"Easy, bubbles occur when governments and big corporations meddle in free markets and artificially designate value that the forces of supply and demand would not have. ",2019-02-14 07:56:07
133,dg8h8n,False,,328,Feds hit GirlsDoPorn owners with criminal sex trafficking charges,business,,https://arstechnica.com/?p=1583425,1105,"If someone lies to you and is coercive, you have the power to walk away. ",2019-10-11 02:13:18
6,33cfwy,False,,388,Kraft announces that it's dropping all artificial preservatives and synthetic colors from its Mac and Cheese recipe,business,,http://money.cnn.com/2015/04/20/news/companies/kraft-macaroni-cheese-fake-color/,4125,"Who the hell eats Mac and Cheese and worries about the health benefits at the time?  You eat mac and cheese because it's frigging mac and cheese, not because it's part of a balanced diet. ",2015-04-21 11:59:40
41,isxvb,False,,451,"""Why I will never pursue cheating again"" -- a business professor discovers a large percentage of his class is cheating.  When he confronts them, his evaluation numbers go down and the university gives him less of a raise at the end of the year.  ",business,,http://behind-the-enemy-lines.blogspot.com/2011/07/why-i-will-never-pursue-cheating-again.html,1621,"so he doesn't care that his students are cheating and getting a bad education as a result, only what his performance numbers and salary are. sorry if i'm unsympathetic. ",2011-07-18 16:48:53
578,23yc97,False,,94,"FTC Backs Up Tesla, Says States Shouldn’t Block Direct Auto Sales -- FTC states that dealerships are scared of competition",business,,http://www.dailytech.com/FTC+Backs+Up+Tesla+Says+States+Shouldnt+Block+Direct+Auto+Sales/article34792.htm,693,"Yes! The 1% deserve to get their cars without the markup introduced by middlemen!

Why are people who can probably never afford a Tesla in this fight? ",2014-04-25 14:35:21
196,2t1xu4,False,,507,Uber CEO Reveals Mind-Boggling New Statistic That Skeptics Should Put In Their Pipes And Smoke: Uber’s revenues in San Francisco are now running at $500 million per year - more than 3-times the size of the taxi market,business,,http://www.businessinsider.my/uber-revenue-san-francisco-2015-1/?op=1,988,"WHATTTTT????? You mean innovation, competitive markets, and capitalism work????  Don't tell Reddit (or Obama, or Reid, or Pelosi, or Boehner, or ...) ",2015-01-20 14:44:01
547,1eu1yj,False,,176,The U.S. Senate may — and should — review the NFL’s tax-exempt status,business,,http://sports.yahoo.com/blogs/nfl-shutdown-corner/congress-may-review-nfl-tax-exempt-status-004521453.html,704,[deleted] ,2013-05-22 14:13:06
443,cjbouj,False,,46,Banks face $1.2 billion civil lawsuit over rigging currency markets,business,,https://www.marketwatch.com/story/banks-face-12-billion-civil-lawsuit-over-rigging-currency-markets-2019-07-29?siteid=rss&rss=1,775,"They will plead down to a million dollar fine, just the cost of doing business for them ",2019-07-29 14:05:36
936,d7jc98,False,,69,Crash Course - Toxic Management at Boeing Killing Passengers and Profit,business,,https://newrepublic.com/article/154944/boeing-737-max-investigation-indonesia-lion-air-ethiopian-airlines-managerial-revolution?utm_source=pocket-newtab,572,Weren’t the crashes a result of runaway trim and easily corrected taking manual control? ,2019-09-22 00:43:44
777,70ite8,False,,71,Will Vegas be the next Amsterdam? Nevada opens the door for pot lounges,business,,https://www.nbcnews.com/storyline/legal-pot/will-las-vegas-be-amsterdam-steroids-door-opens-pot-lounges-n801311,609,Too bad a lot of the dispensaries have people working there that have no clue what they're selling ,2017-09-16 19:21:25
245,a5a7pr,False,,287,Delta bans kittens and puppies as support animals on all flights and all emotional support animals on longer hauls,business,,https://www.marketwatch.com/story/delta-bans-kittens-and-puppies-as-support-animals-on-all-flights-and-all-emotional-support-animals-on-longer-hauls-2018-12-10,937,[deleted] ,2018-12-11 19:45:21
577,4780rd,False,,88,"Google Fiber Expanding Faster, Further -- And Making Comcast Very Nervous",business,,https://www.techdirt.com/articles/20160222/09101033670/google-fiber-expanding-faster-further-making-comcast-very-nervous.shtml,697,Comcast could you know build out their own infrastructure... ,2016-02-23 18:32:58
543,daa0tp,False,,52,"FTC sues Match.com, saying it falsely led singles to believe that someone wanted to meet them",business,,https://www.nydailynews.com/news/ny-ftc-match-dating-app-false-ads-20190926-mwxfmkn5qnbahkroqeqsnpg4fq-story.html,707,Ha Knew it ,2019-09-28 02:05:10
849,e9kyup,False,,68,"Learning at work is work, and we must make space for it",business,,https://sloanreview.mit.edu/article/learning-for-a-living/,595,Let’s just force all businesses to provide 20 paid hours of learning time per week. That oughta help the economy! /s ,2019-12-12 08:28:20
212,9bi78h,False,,120,"Emails while commuting 'should count as work': Commuters are so regularly using travel time for work emails that their journeys should be counted as part of the working day, researchers say.",business,,https://www.bbc.com/news/education-45333270,971,Who uses email anymore? Leading companies are pretty much completely eliminating email in favor of Skype and Slack groups. Nobody at the company I consult for gets more than one or two emails a day.  ,2018-08-30 09:43:53
698,1ki2vv,False,,218,"Ten years on, The Pirate Bay has made it clear that no laws in the world can shut down a service wanted by hundreds of millions of people. It will keep decentralizing to protect itself from legal assaults, says Swedish Pirate Party founder Rick Falkvinge",business,,http://rt.com/op-edge/pirate-bay-censorship-copyright-567/,647,"Wait, this is only true because the US intelligence agencies don't care about piracy. They just have to pretend to care for political reasons. If the pirate bay was a terrorist web site, it would be shut down in an instant.  ",2013-08-16 18:10:48
584,arwg60,False,,123,"Amazon paid no federal taxes on $11.2 billion in profits last year, according to group's analysis",business,,https://www.chicagotribune.com/business/ct-amazon-federal-taxes-profits-analysis-20190216-story.html,697,[deleted] ,2019-02-18 11:46:26
180,9lvl1p,False,,176,"Verizon Lays Off 44,000, Transfers 2,500 More IT Jobs To Indian Outsourcer Infosys",business,,https://www.forbes.com/sites/jeanbaptiste/2018/10/05/verizon-lays-off-44000-transfers-2500-more-it-jobs-to-indian-outsourcer-infosys/,1020,"Edit: every company ships jobs across seas. You all act like Verizon is the only one. Atleast they provide good service. You guys can talk all the shit you want about Verizon but that doesnt change the fact there are many places in the US where Verizon is the only company getting a signal. I was in the Colorado mountains and, att, tmobile, and sprint had 0 service everywhere. Verizon had signal the whole time. I'm at Dave n buster's right now with my gf, mom, and sister, my girlfriend and I have Verizon and my mom and sis have att. My mom and sis have no service but my girl and I do. It happens all the time. I also sold contracts for att Verizon and sprint and Verizon kills att and sprint. The plans are a lot better too. I just dont understand the hate. ",2018-10-06 12:30:42
617,ejiwu,False,,155,Blockbuster laughed at Netflix partnership offer in 2000,business,,http://news.cnet.com/8301-31001_3-20025235-261.html?part=rss&subj=news&tag=2547-1_3-0-20,674,"Here's how it went down:

**Blockbuster Employee:** Hey guys I think we should look into this Netflix thing.  They have a great UI that they take seriously with customer support and they have streaming movies and they actually support Macs.  It would also be a great opportunity to hedge our bets in case users actually start watching movies over the internet.

**Blockbuster Management:**You're fired. ",2010-12-10 13:27:10
165,etpsn3,False,,56,'Plague Inc.' Becomes Top-Selling iOS App After Coronavirus Outbreak In China; Dev Comments,business,,https://www.ibtimes.com/plague-inc-becomes-top-selling-ios-app-after-coronavirus-outbreak-china-dev-comments-2909282,1045,Profiting from viruses. This should turn out well in the future. ,2020-01-25 11:40:16
191,galjxp,False,,127,"Boeing will cut 16,000 jobs after posting a massive loss",business,,https://www.cnn.com/2020/04/29/business/boeing-loss-staff-cuts/index.html,1002,"LOL They literally did this on purpose, If you think Boeing does not manufacture **Electrogravitics** crafts or is on MARS you are dead wrong.  They even boast about it in their ""The Future Is Built Here"" [https://www.youtube.com/watch?v=02VX-wmepAA](https://www.youtube.com/watch?v=02VX-wmepAA) commercial, at the end you can see that Open Eyes is about underway as well. ",2020-04-30 00:40:05
110,g81r3t,False,,345,"Kanye West Is Now a Billionaire, Thanks Mostly to His Yeezy Sneaker Brand",business,,https://www.hollywoodreporter.com/news/kanye-west-is-now-a-billionaire-thanks-his-yeezy-sneaker-brand-1291888?utm_source=instagram&utm_medium=social,1180,Fake news lmao ,2020-04-25 21:29:44
676,am4u5e,False,,65,"AT&T Lost 267,000 Subscribers - A Blow On The Streaming Economy",business,,https://z6mag.com/current-events/att-lost-267000-subscribers-a-blow-on-the-streaming-economy-1630933.html,661,Title gore! ,2019-02-01 18:02:57
867,7v7bpc,False,,125,"Best Buy to Pull CDs, Target Threatens to Pay Labels for CDs Only When Customers Buy Them",business,,https://www.billboard.com/articles/business/8097929/best-buy-to-pull-cds-target-threatens-to-pay-labels-for-cds-only-when,588,Do people really not buy cds anymore? haha. ,2018-02-04 15:30:40
983,9ptrfo,False,,35,Tesco doubles vegan food range as demand for plant-based food soars,business,,https://www.mirror.co.uk/money/tesco-doubles-vegan-food-range-13424290,561,"All about the push for plant based/vegan food as long as regulations tighten up because there are a lot of manufactured ""vegan"" products that have dangerous and harmful additives.  ",2018-10-20 12:30:14
592,87sd39,False,,100,Proposed New York City law would give workers right not to respond to emails after work hours,business,,http://thehill.com/homenews/state-watch/380583-proposed-new-york-city-law-would-give-workers-right-not-to-respond-to,689,[deleted] ,2018-03-28 14:32:29
715,fgpz12,False,,75,"U.S. Recession Odds Jump to 53% in Next Year, Highest Since 2009",business,,https://www.bloomberg.com/graphics/us-economic-recession-tracker/?srnd=premium,635,Thanks Obama ,2020-03-11 02:30:11
400,agxeiu,False,,36,Free Trials Without The Hassle: Mastercard rule change will stop free trials from automatically billing once ended,business,,https://newsroom.mastercard.com/2019/01/16/free-trials-without-the-hassle/,798,Goodbye free trials then ,2019-01-17 12:44:02
695,bjg4ms,False,,114,Impossible Foods is Struggling to Meet Skyrocketing Demand — Is It In Over its Head?,business,,https://thespoon.tech/impossible-foods-is-struggling-to-meet-skyrocketing-demand-is-it-in-over-its-head/,641,"The burger is actually disgusting. 

Smells like PUreee Catfood. 


Does not taste like meat, but if you havent eaten meat in like 6m-2years it’s probably good for yah. 


But it does taste nothing like meat, more on like catfood. ",2019-05-01 11:45:18
222,9dmnvk,False,,115,"Whole Foods employees step up efforts to unionize, cite laundry list of grievances under Amazon",business,,https://www.cnbc.com/2018/09/06/whole-foods-employees-want-to-unionize-under-amazon-ownership.html?__source=sharebar%7Creddit&par=sharebar,957,What amazon is a success company what happen? ,2018-09-06 20:23:23
876,944xiz,False,,59,Note the date,business,,https://i.redd.it/0b90ctewxrd11.jpg,587,How did that thumb become a hand model? ,2018-08-03 00:38:35
