Num,ID,is_Original,Flair,num_comments,Title,Subreddit,Body,URL,Upvotes,Comments,creation_date
923,9fc5m7,False,,33,"I lied and it got me in a stupid career pickle, any suggestions?",careerguidance,"**Backstory:** I started my career about 2 years ago in a junior IT position, and a salary to match. Well, I've grown professionally a lot since then and thought I'd start looking around for an opportunity that might pay more. I got 3 offers, all in the +10% range, and chose one of them that I liked.

Well, when I told my current company that I'd be moving on, they wanted to know how much the new place was offering, and what it'd take for me to stay. I gave them a number that seemed astronomical to me, and I thought they'd never accept. Well, they did. Today they offered me an annual salary just shy of twice my current, a position as lead engineer, and a relocation package to move to the company headquarters. Basically my dream job.

**The problem:** When they initially asked me how much the other place's offer was, I gave them a number a bit higher than it actually was. I don't know why, but it was really stupid. I guess I said that out of spite since I felt they had been underpaying me. The manager that talked with me about this (upper management actually, not my regular manager) requested a copy of that offer letter as part of whatever processing they do to get me into the new position. I said I'd get it to him....

What should I do??? I'm someone who values honesty, and this just makes me feel really really bad. If I confess, it makes me look stupid and dishonest. I have no logical reason to not send it over. I thought about ""correcting"" the letter, but I'm sure they will call to verify, and then I'm really screwed (with both companies).

I'm not going to do that again for sure.",https://www.reddit.com/r/careerguidance/comments/9fc5m7/i_lied_and_it_got_me_in_a_stupid_career_pickle/,61,Personally I would just take a screenshot of the email and Photoshop the number. ,2018-09-12 21:57:16
921,a8yojg,False,,30,"Failed one of those ""would you rather"" pre-job assessments and I meet all the preferred qualifications for the job. What now?",careerguidance," There is an internship that I found that I am very interested in. I met all the basic qualifications and 4/5 of the preferred qualifications. The preferred qualifications are things that only a small amount of people have. I spent hours on the cover letter and perfecting my resume. Sweet. The problem is that they sent me one of those assessments where they ask questions of you strongly disagree/disagree/agree/strongly disagree on a number of topics. I completed the assessment and a day later, I got an email at 1:30am saying that I failed the assessment and that I would have to wait 6 months if I wanted to reapply. Is there anything that I can do to counter this situation? I know that I am qualified for the position but it looks like a computer kicked me out of the recruitment process. Thanks. ",https://www.reddit.com/r/careerguidance/comments/a8yojg/failed_one_of_those_would_you_rather_prejob/,59,Sorry to hear that. Honestly best way is like an earlier guy said. Plead your case to someone who is in charge. The only way those things are overridden is by intervention. If not then sadly you'll have to move on. I know it sucks and it hurts. It's very hard not to put emotion into a position you want badly.  ,2018-12-23 21:45:13
516,dx78r9,False,,33,How do I break out of solely Administrative Assistant positions?,careerguidance,"I (31 m) graduated just under a year ago with my BA in Social Welfare. I have been more drawn to training and development roles since graduating, supporting diversity, equity, and inclusion initiatives along the way. 

The problem is, the only positions I'm finding are entry level admin work. I've been working in Administrative roles for nearly 6 years now so I don't feel especially challenged, but keep getting blocked from other opportunities. I run projects for other departments consistently, and stay on top of my own tasks while training new hires, and I've only been in my current position for a few months.

The company I'm working for now is not one that I plan to stay at long term because of its toxic upper management. Right now I'm just working on building my resume and getting experience with a few other projects, but it's running me ragged with everything I'm responsible for. Not to mention what a bummer it is to not feel appreciated by the organization. Thinking about getting my HR certificate just so I have another piece of paper to back up my abilities.

I appreciate any advice or insight on how I could get out of this position and make myself more marketable.",https://www.reddit.com/r/careerguidance/comments/dx78r9/how_do_i_break_out_of_solely_administrative/,118,You need some hard skills ,2019-11-16 14:02:16
87,bztdbx,False,,82,"Why do people assume just because you love a hobby (esp if you excel at it in amateur levels), that you will love doing it for a living? Has anyone found out how hard the pro leagues can be the hard way?",careerguidance,"We always hear stuff like ""follow your dreams!"" and the best recipe for successful wealth is ""pick something you love so much an make a career out of it!"".

And indeed you see to many people and not just kids and teens, but even adults, think that being a professional MMA fighter would be a fun job or assume just because you love eating cheeseburgers you can make a career at food eating contests, etc.

Recently I attempted to go pro at Magic The Gathering. I used to always beat my friends as well as other random people at bars and restaurants in betting matches and win big bucks. I won a small local tournament earlier this year so I decided I would go pro. But when I started this month I was getting my but whooped against even bottom tier ranking pro players and even amateur tournies that are above the ones I used to win at the local level. I practically lost all my gambling money and a large chunk of reserve cash I put specifically for this career on a rainy day.

In addition I never thought how stressful and hard stuff I used to do such as organizing my magic deck could be when your paycheck is dependent on it. And I'm so surprised how even the worst of the worst players at upper level amateur contests and professional gambling and dueling can be! Every trick I used that easily won me cash against friends and other people in my local neighborhood was easily countered and I could not develop any new strategy. In addition even just buying the equipment to keep up with the recent trends is extremely expensive.

So I am curious if anyone here ever tried to go pro at their favorite hobbies and backed out instead for an easy secure job or college like I did with Magic? Why do so many people especially commentators giving advice think that not only will you excel at something you love if you work at it for a living, but you will still easily stay in said career despite failures and setbacks simply because you love the job? 

Its repeated so often in the media and by commentators that you'd think its a guaranteed formula! But I learned first hand the hard way even the bottom levels of professionalism of your favorite hobby is so difficult you might end up hating the hobby (which I actually did with Magic after I decided to abandon pro gaming for almost a month until my sister convinced me to start playing with her again).

Has anyone here tried to go for the NBA or become a professional martial artist or played at esports as a pro gamer or other stuff you had a passion for as an amateur and backed out because of the shock of how hard a career is? Even going as far as temporarily abandoning the hobby because you grown to hate it for a while after attempting to go pro with it and seeing how much of a pain in the but doing your hobby is when you work at it for a living and not just for fun and games?

Please put your examples when you tried to go pro when you were younger!",https://www.reddit.com/r/careerguidance/comments/bztdbx/why_do_people_assume_just_because_you_love_a/,298,"I have a masters in playwriting and drama studies. The lack of financial stability scared me to the point of near breakdown.

Now I have a nice office job processing social welfare. It's incredibly eerie to see the amount of actors and writers on my system trying to live on welfare and odd jobs. I still write scripts but it is such a profound relief to not have to depend on it to pay the bills! I can still work on it in my free time and book days off if needed to advise directors! 

There's no shame in getting yourself financially stable. I think the myth of ""if you want it bad enough you'll fight for it!"" While well-meaning, can be dangerously misleading and unrealistic.

That being said, if you're tipped for greatness and have agencies interested, go for it while your young but PLEASE upskill in the meantime so there's always a fall back option! ",2019-06-12 16:33:00
879,ej81vz,False,,19,"Do I actually hate my job, or does everybody feel this way?",careerguidance,"Sorry for formatting, I’m on mobile!

I’m an engineer working for a consumer products company. This is my first job out of college, I’ve been here for 2 years.

On paper, I feel like I should love my job. I make great money, have a lot of autonomy to take on and lead many different types of projects, work reasonable hours, and live in a decent mid-sized city. My work is low stress and has a lot of flexibility, my current boss is a little absent but otherwise we get along fine.

This all said, the reality is that I find myself DREADING work every single day. I can’t make myself care about my projects anymore, which is shocking from somebody who has been an ambitious workaholic their entire life. I end up crying in the bathroom an embarrassing amount. I feel like I’m losing my drive by the day.

To try to articulate what I don’t like in my job:
- I love working on teams, closely with people. The culture of my group doesn’t facilitate this, we work very isolated from each other.
- I don’t care about the final products I work on. I always envisioned myself “making a difference in the world”, and it’s hard to see how that’s true in CPG.
- I don’t feel challenged like I did in undergrad, much of my work is paper pushing or hunting down other people to make sure their work is getting done.

However, these are all normal complaints! None of these should be reasons to feel as miserable as I am! Right??! Or maybe they are?

So, Reddit, I’m looking to hear how others feel about their work / felt about their first jobs. I’m starting to look for a new role within the company, but hesitant to start looking for positions externally quite yet because I’m stuck wondering: is the grass just greener on the outside? Is this simply what work feels like for everyone, and I need to suck it up and appreciate what I have?

Thanks in advance for any inputs!",https://www.reddit.com/r/careerguidance/comments/ej81vz/do_i_actually_hate_my_job_or_does_everybody_feel/,64,Do you have any hobbies or things that you look forward to outside of work? ,2020-01-03 01:38:27
463,cyt7g5,False,,90,What are the best trades to get into?,careerguidance,"I'm 15 and realized that I don't wanna pay out college loans untill I'm 40, so I want a career that you don't need college for. I have been looking into electrician and HVAC but not sure if they are for me. What other trades do you recommend?",https://www.reddit.com/r/careerguidance/comments/cyt7g5/what_are_the_best_trades_to_get_into/,126,"Stagehand for IATSE if you like odd, crazy hours. journeymen in major metropolitan areas typically make between 50-130k/year depending on the position. ",2019-09-02 18:50:51
112,e1j19v,False,,51,Does HR suck at every company in the world?,careerguidance,"Long story but ill try to keep it short; i got a great job at offer with shorter hours at a different firm in September. After some negotiations I decided to take the job and quit, since I really hated my old job. I was supposed to start my new job in late October/early November, but their HR keeps asking for a whole set of different paperwork every time they contact me; last email was last week after i signed disclosures regarding the position, but nothing like a binding contract. I spoke to HR and they said that my whole package has to go to their panel or something for final approval, which no one told me about before. The offer they gave me had every detail about the job with benefits and they asked me to start the process of quitting my job, which i did. Now, i feel like I’m being gaslighted and just confused with the process because it’s taking so long and they’re being a bit dodgy about the whole thing. 
Any insight on this? Or advice? Im just stressing out over here",https://www.reddit.com/r/careerguidance/comments/e1j19v/does_hr_suck_at_every_company_in_the_world/,270,Yep ,2019-11-25 17:10:48
297,c8o4fp,False,,118,"People who had a hard time getting full time work after college, what are you doing now?",careerguidance,"I went to college around the recession, during the height of the ""just go to college, a degree in anything will open doors"" mindset.


Since it was the recession, companies were not actively recruiting much on campus.  It kind of seemed like an extension of high school since no one had concrete plans for their careers.  Formal internship programs with companies did not seem to be common back then, it was all unpaid crappy internships.  I was doing premed, graduated, and worked very low paying jobs in my field (biochemistry) while applying to med school.



I eventually ended up in software development at a large tech company after doing cloud/data related work.  I was doing this while getting my MS in CS and after getting sick of waiting 9 months to hear yes/no after a med school interview.


Most of my friends from college have similar stories.  We all aimlessly worked years before breaking into a good career path.  Some are currently applying to law school, others got into non-tech work at technology companies.  But we all agree going to college after high school is pointless and we should have worked a few years before college to get a sense for the job market.",https://www.reddit.com/r/careerguidance/comments/c8o4fp/people_who_had_a_hard_time_getting_full_time_work/,170,All these comments prove my point I constantly try to tell people college isn't it worth it 70% of time. Lucky to have been in that 30%. High schools need to stop pushing college so much. ,2019-07-03 13:31:19
417,gukdkh,False,Education & Qualifications,54,What trades or backup careers can I learn on the weekends or at nights?,careerguidance,"I'm a 25 year old software engineer, and I make good money doing it. However, I want to have some kind of fallback career in case my industry collapses, I get burnt out, or I just decide that I don't want to live near a major metropolitan area anymore.

I wanted to learn something tangible, something where I could work with my hands. Electrician, Plumber, etc. and not something which requires a degree or less hands-on work. Something where there's pretty much always SOME kind of demand for that skill (though I know there's no such thing as an industry invulnerable to recession).

I looked into learning to be an electrician in my area, but it seems impossible to learn and be certified just on the nights or weekends - these things require a pretty much full time commitment through shadowing and apprenticeship.

Are there good trades I can learn and take night or weekend classes at a community college or through a trade school?

Obviously, the ability to actually attend any of these classes is limited by the present medical situation on the planet, but let's just pretend it's 2019 again.",https://www.reddit.com/r/careerguidance/comments/gukdkh/what_trades_or_backup_careers_can_i_learn_on_the/,138,I hear that pole dancing and/or stripping are good evening and weekend careers.  You could also do escort work.  It goes hand in hand with the dancing. ,2020-06-01 13:10:47
658,e2ge0w,False,,18,How do you deal with decision fatigue?,careerguidance,"As I reflect back on my life, I'm reminded by just how far I've come. This time last year, I wasn't too happy. I was in a dead beat job, and while I'm still not where I desire to be, or my friends are at, I'm slowly matching the gap. I guess, how do you guys decide what you are going to do in any given day, or in regards to your job. I often find myself thinking that perhaps maybe I should of went to a better school, which would've allowed me better connections. But then I'm reminded I graduated debt free. I wish I took this job offer, so I could gain more valuable experiences, but I stayed behind since I wasn't sure if it was necessarily better for my career. I do this so often. Even clothes. I didn't grow up rich, and we had enough to scrape by. But that mentality and feeling had carried me on. I have nice clothes that I've attained over the years, but I prefer comfy clothes, since I'd rather deal with washing clothes I don't care about, because if I wore nice clothes, I'd feel I waste them. Now I'm not insane, or crazy, I still get out of bed and I'm not depressed. I'm in a good place, I just wonder if things would of turned out differently if I worked harder or maybe lazier, so to speak. I wonder if I maybe left home later how my life might turn out different. It's kind of bizarre when you think about it. Am I the only one that feels this way? Please tell me you think about this as well. Thanks in advance for reading.",https://www.reddit.com/r/careerguidance/comments/e2ge0w/how_do_you_deal_with_decision_fatigue/,89,"All the time. Was on a great trajectory up until high school. I was in the gifted program at school, made straight A’s, played sports etc. Then I completely stopped trying for 4 years. Turned it around in college, but I often think about how I would’ve likely gotten into better schools had I stayed focused. Oh well, gotta keep pushing. ",2019-11-27 14:00:51
344,ebkkas,False,,119,What LEGIT jobs/careers allow you to work remotely?,careerguidance,"This has been my dream for years, but most of what I find is either some BS transcription contract that pays nowhere near a living, or things that require a degree.  

(I'm a good worker and this is not due to me being lazy or anything similar, so please keep the meanness to a minimum. LOL)",https://www.reddit.com/r/careerguidance/comments/ebkkas/what_legit_jobscareers_allow_you_to_work_remotely/,156,**the job** ,2019-12-16 20:21:39
830,9nv9jr,False,,44,"Headhunter got upset after I turned down job, revealed a signing bonus that was never mentioned. Is this common?",careerguidance,"I am a remote contractor and was contacted by a headhunter with an opportunity at a local firm. I interviewed, they liked me, and made me a job offer. Offer good, but not good enough - about a $10k income drop plus a 30 minute commute and all the other unknowns that come with a new job.
Odd stuff occurred as well, hiring manager called me and said headhunter asked him to give me a call, “he didn’t really know why” and then said, “do you have specific questions on your offer?”
What offer?
Turns out they had sent an offer letter that day. So he gives me the verbal, and it is ok, but doesn’t make me giddy, and I say, “thanks, I’ll look it over.”
It’s Friday. Takes them a while to get me a benefit premium breakdown. Insurance costs lower, but numbers don’t add up, I still have a $10k deficit. I like working remotely, in an earlier time zone, in my PJs. So I call the hiring manager and tell him it is a soft no, and he says, “well if you change your mind we have a lot if hiring to do.”
Headhunter emails me saying, “what happened? I specifically told you to contact me if the numbers were off. We have a significant amount of money earmarked for this situation. I guess I’ll never understand.”
So three things struck me:
1) the assumption that it was the money (well, TBH I made the mistake(?) of telling them what I was making, so she knew there was a gap)
2) this “significant amount of money” was never mentioned until after the fact
3) the “I guess I’ll never understand” makes me think this same scenario has played out at least once (and probably several times) before.

I think I am going to stop using headhunters. In my last 2 interactions, I was harassed to disclose “the number I would take”. I guess I’ll never understand.",https://www.reddit.com/r/careerguidance/comments/9nv9jr/headhunter_got_upset_after_i_turned_down_job/,69,"I was harassed to disclose “the number I would take”

Why not just tell them and make everyones life easier? ",2018-10-13 16:58:04
10,estl25,False,,257,"Reddit, can we have a Reddit job fair?",careerguidance,"Most of us surfing Reddit don’t have a clue what to do with life, so how about a mini job fair? Please comment what your job is and why you chose it. Will it grow in the next 5 years? Decent salary? Job sucks? Please answer questions if asked.

EDIT: Thanks everyone for sharing your careers! Great feedback in just a day. One of the top posts on here!",https://www.reddit.com/r/careerguidance/comments/estl25/reddit_can_we_have_a_reddit_job_fair/,682,"This is a great post, just wish it didn't seem like every job out there didn't required you to financially kill yourself by taking out loans for college degrees. ",2020-01-23 14:08:03
56,frbgyf,False,,84,Do others around the age of 30 struggle with career direction?,careerguidance,"I am approaching 30. Work in sales and  have done for just shy of a year, before that I was in a financial  brokerage for a year, and an investment bank for a year. Graduated in Business Management in the UK, on a 4 year with a placement.

The  thing is and this has been the case for all my life and probably is for  many - there's just not something I am so passionate about that I want  to invest all my time specialising in. I left finance because I actually  hated the environment, the people. It was so toxic at one point I  resigned from my brokerage and luckily landed a job in tech sales. It's  now been just shy of a year and there's always so much pressure with  targets and aside from COVID for one moment, your job is under threat  after a period of time if you don't keep up with the numbers.

As  I approach 30, I have come to realise that life ISN'T worth this kind  of stress. And yet I'm earning £50k GBP which is in terms of averages,  pretty decent going for a 29 year old. But it's somehow not important to  me. If anything, it's easy to compare to some of my younger friends who  are in banking and earn even more than that and will continue to earn  more and more. I find myself looking up and thinking I should be doing  better, rather than looking down at say retail workers who earn 20k for  example. Heck, I'm talking to a Brazilian lady on a dating app who is 35  and works in a retail store as well as a restaurant receptionist - I  suddenly look much better than her. It's easy to forget.

But  I think I would be happier if you told me that I found my  girlfriend/wife to be, and was earning 20k, rather than earning say 50k  as I am and being single. There's just nothing that makes me think life  is worth repeating day in day out just to pay a mortgage, retire, and  then die. It just feels so unimportant. I guess I was never lucky enough  to discover my 'passion' from a young age and implement it into my  work. I'm into football but don't want any job around that other than be  a professional football player, which I am not.

I  recently started to look into coding and weigh up whether this would be  worth my time. It's actually interesting, but reading between the lines  it seems that it's going to be very challenging finding work in this  area without a degree, notto mention take years to learn enough to be  job ready.

I just feel kind of  lost and always have done with 'work'. Like there's never been an  underlying purpose/motivation behind it. Anyone else having career blues  around a similar age?",https://www.reddit.com/r/careerguidance/comments/frbgyf/do_others_around_the_age_of_30_struggle_with/,358,"It sounds like you are unhappy with the other parts of your life (like being lonely) and career doesn't affect that.

It is easy to say that a career is why you aren't happy with your life, but it really comes down to your priorities - if you had been looking harder you could have found the wife at 22, etc.

It's not a binary.  You can make $50k and date more.  You can make time for a hobby, for a passion, to diet, to do whatever you want to do.

But you have to put as much effort into those as you have for a job, and you've put more effort into that. ",2020-03-29 19:19:37
615,aopubw,False,,50,Should I start a website with the purpose of giving career advice to youth?,careerguidance,"Hi everyone! I'm an alumnus from Dartmouth College working in product management in San Francisco. I have been giving high schoolers college interviews and helping recent graduates with finding jobs and general career advice.

I'm thinking of starting a website and volunteering some of my spare time to give career advice. I was wondering what the interest level would be for this kind of assistance. I thought this might be a good place to ask.

Would it be a good use of my time? Would anyone be interested in this?",https://www.reddit.com/r/careerguidance/comments/aopubw/should_i_start_a_website_with_the_purpose_of/,94,"You mean like this? 

[https://www.careervillage.org/](https://www.careervillage.org/)  ",2019-02-09 06:30:38
