Num,ID,is_Original,Flair,num_comments,Title,Subreddit,Body,URL,Upvotes,Comments,creation_date
679,eskoi9,False,,36,Introvert transitioning out of marketing. Can you help me find a path?,careerguidance,"28-y.o. Canadian with a BA in Communications and 5 years of digital marketing experience under my belt. I'm ready for a change. Churning out creative content leaves me mentally exhausted, and, as an introvert, I've always struggled with the soft skills. While my work is pretty good, I'm a lot slower than my coworkers.

I'm looking for an alternative career with decent prospects that doesn't require another 4-year degree. I'm drawn to jobs like librarian, researcher, technical writer, conservator, archivist, or prosthetic/lab tech. Do you have any suggestions for me? Thanks in advance.

**I like...**

* Research
* Independent work
* Writing reports, formal documents
* Organizing, planning, strategizing
* A slow pace and perfectionism (I'd rather do one big project well than speed through a dozen small ones)
* Working with my hands
* Living in a big city (I hear library jobs are tough to find unless you're willing to move)

**I don't like...**

* Lots of interpersonal interaction
* More than 75% of my day spent on the computer (I'm flexible on this, but things like programming and graphic design aren't for me)
* Writing creative content
* Travel
* Long hours
* Math, other than marketing analytics

**My top skills:**

* Qualitative research
* Analysis and overthinking stuff  ¯\\\_(ツ)\_/¯
* Writing
* Visual art and graphic design
* Attention to detail and organizational skills",https://www.reddit.com/r/careerguidance/comments/eskoi9/introvert_transitioning_out_of_marketing_can_you/,82,"What about becoming a statistician? Might a lot of time at the computer... but it would be mentally stimulating, similar to analytics, and it pays well. ",2020-01-23 00:02:39
94,f72m3c,False,,168,Only work about 3 actual hours per day (non salaried) and boss is non the wiser and thinks I do good work. Should I tell her the reality?,careerguidance,"I work as a staff accountant for a credit union, and other than the month-end closing periods, I only do about 3 hours of actual dedicated work per day. 

This is not because I'm lazy, but because I have fine tuned/automated my processes to such a level that all of my work is completed by noon most days.

I am starting to get bored, and want more projects to work on. However, I don't want to do more work for the same pay. 

Im hoping that if I show my boss how much I get done in such a little amount of time, she will be impressed and request to increase my pay, while also giving me more stuff to do. 

Is this risky? Will I be shooting myself in the foot and get more work for no additional pay?. Any positives?

Thanks in advance.

Edit- Obligatory, Wow this blew up!. Thanks for your responses.

Some clarification, I'm not saying I won't do more work without a raise, moreso that I want to set an expectation that the value of doing extra work warrants a raise/promotion at the next review. My boss is very laid back and likes me as an employee, but in the end it's the CFO who approves/disapproves raises",https://www.reddit.com/r/careerguidance/comments/f72m3c/only_work_about_3_actual_hours_per_day_non/,288,">I am starting to get bored, and want more projects to work on. However, I don't want to do more work for the same pay.

Sigh. So you can now do your work in 3 hours but don't want to do more work than that for the same pay? Sigh. That's a good path to never getting promoted or making more money. 

You're an accountant. There are always going to be busy and slow times. Month-ends will always be busy and there will be less demands on your time during other periods. ",2020-02-21 00:21:06
793,bfv5zg,False,,46,"I want to go into forensics, or be a blood spatter analysis, what grade in science do I need, and what colleges do I go to for this?",careerguidance,"I’m 14, and I’m the eighth grade. I know I need a good grade in science, but I don’t know what types of colleges to go to for when I’m ready. Any help? I can answer any questions related

UPDATE: I spoke to my science teacher, and there is actually a science class in my high school dedicated to forensics. I think I know my career now.",https://www.reddit.com/r/careerguidance/comments/bfv5zg/i_want_to_go_into_forensics_or_be_a_blood_spatter/,71,is this a shitpost ,2019-04-21 23:34:24
427,ca2zqr,False,,17,How do you deal with performance reviews and goal setting when you no longer care about your job?,careerguidance,"I am going in for my annual goal setting and performance review this week with my line manager. 


I’ve been at this company for about 2.5 years, but my heart has never been in it. I took the job for the money. I moved from client-side back to consulting.


Though I’ve been looking for a new role elsewhere since I started the job, (and gotten a few offers over this duration), I liked my coworkers and wanted to give it an honest try.  TBH, it wasn’t going so badly. 


Then at the start of 2019, there was a leadership change both at CEO level, and Regional Director (RD) for my geography.  It’s been a massive cultural shift, especially in our region where the new RD was brought in from a competitor with a very different business approach.  It’s a very poor cultural alignment. 


Now there is lots of alienation among the existing leadership cohort as new RD brings in his team from his past company. Of course these new joiners all have a similar cultural approach.  It’s getting pretty toxic all around as several of us know we are being setup to exit the business. 


I’m not immune.  My role is being redefined under this new regime. RD no longer wants me in a region-wide team leadership and oversight role, he just wants me to focus on my city, hands on with projects. It’s great that I won’t have to travel so much, but it feels like a demotion, not the next step to long term success.


HQ (on another continent) loves my work so far and has offered me additional equity in the company. I have great support back there and my overall salary situation is fantastic. As the new RD seems to be pushing me out the door, the award of equity feels like a mind-f**k.


I’m eager to move on, but golden handcuffs are tough to shake off.  I need to do the best I can where I am at until I find another landing spot. 


So what to say in the goal setting?  I’m totally unengaged, disinterested, and resentful. 


I know playing it too candidly isn’t the right thing, even though my line manager is equally disaffected by the organisational transformation that surrounds us. 


Any suggestions on how to do this dance would be appreciated. My emotions are getting in the way and clouding my judgement.",https://www.reddit.com/r/careerguidance/comments/ca2zqr/how_do_you_deal_with_performance_reviews_and_goal/,135,"Sounds like you and your line manager are in kind of the same boat. What are their business performance goals? Take them, say ""my goal is to help you achieve your goal, and here's how,"" and boom! One goal down. 


Acknowledge the elephant in the room - culture shift. Maybe a second goal can be about how you'll embrace these new colleagues and help them learn the ropes. Doesn't have to be true, but you don't want to alienate everyone just yet. Also you need to BS a goal here. 


Third, what about personal development? Think of your next job, and a skill that you'd need on the job there that you have yet to possess/perfect. There's your personal goal, and when you're working on it, you're taking time at your current job preparing you to be more successful at your next one. Win win. ",2019-07-07 04:33:21
858,bnojli,False,,45,Evaluation interview after 3 months @ big 4 - should I tell them that I want to quit ?,careerguidance,"Hello,

&#x200B;

I'm fresh out of college (business law bachelor degree, top 10%) and 3 months into a big 4 company as a tax consultant and I have my first evalution interview in a few days. They are going to rate my performance and I'm supposed to give them feedback and where I see my future in the company.

&#x200B;

The thing is: I hate the job. Mostly because I discovered that I hate tax (even though I'm barely doing tax law, I'm a glorified accountant right now and I hate calculating and numbers). Partly because they lied to me at the job interview about home office and flexible working. They also won't train me because the company policy prohibits this (the seniors won't get a promotion if they train new colleagues - aka wasting time). They literally just dumped me alone in another room at the end of the building away from my colleagues the first 2 weeks.

&#x200B;

I'm looking for a new job since 2 months but it's tough if you are fresh out of college and working full time. So I'm thinking if I should tell them that I want into another department on another location which focuses more on actual law (preferably not tax) and with less numbers to calculate. This is super risky because I'm still on probation so they could easily fire me. So I'm not sure if I'm better off just to continue looking for another job? But not sure if I can sit through this.

&#x200B;

What should I do ?



. 


Update: I used my contacts and managed to get the contact information of our head of customs and international trade. He is willing to talk to me because they are looking for new people and this position would fit very well with my major.

So I'm calling him tomorrow. How should I handle this?",https://www.reddit.com/r/careerguidance/comments/bnojli/evaluation_interview_after_3_months_big_4_should/,62,"This is why they have the evaluation review, so you can tell them these things and they can help you solve the issues.

If you’re quitting after only 4 months (actually 2 months) then you’re pretty soft and not disciplined. ",2019-05-12 12:42:50
201,hpw3ms,False,,141,How did you guys find your career?,careerguidance,I'm almost 30 years old and I still don't have a career. Sure I have a lot of work experience but ive never really truly been able to find my career. I only stayed at jobs for 1-2 year's before moving on. I've got a BA in Public administration and criminal justice and been out of school for 3 years. The current job I'm at now has a lot of room for growth but it's not something I want to make a career out of. I'm just not sure how I'd be able to find my career. How do you know what you're doing now is what you want to do for the rest of your life?,https://www.reddit.com/r/careerguidance/comments/hpw3ms/how_did_you_guys_find_your_career/,208,"I got a degree in English. I became a substitute teacher for a year and then decided to go back to school to get a Masters in Teaching. After that, I became a full time teacher. ",2020-07-12 15:24:23
381,dk791n,False,,67,How do I craft a resume to avoid age/sex-discrimination ?,careerguidance,"We all know its there. 

If I get a foot in the door and an interview I can at least impress with my abilities. I know there is no way to stop from being not offered a position because of team ""fit"".   Being a dumpy middle aged woman with kids ...unless I kill it in the interview I know I am not getting that position.

But I would at least like a shot at proving myself. 

I have never attended an interview, where I haven't been offered a position *till last year. It was a bit of a shock to my system, since the guy that ultimately got the position was less experienced, educated and could have tried to be a better engineer. So I don't know why he was picked.*",https://www.reddit.com/r/careerguidance/comments/dk791n/how_do_i_craft_a_resume_to_avoid/,148,"Maybe consider that you're just no longer benefiting from sex discrimination?

It's pretty unusual to land every single job you interview for. ",2019-10-19 17:58:38
792,cgbugi,False,,47,Why do hiring managers tell you at the beginning of the interview they are interviewing other people?,careerguidance,I personally think this is quite silly. It’s a given that they would do this so why waste time saying this. It put a real damper on the interview.,https://www.reddit.com/r/careerguidance/comments/cgbugi/why_do_hiring_managers_tell_you_at_the_beginning/,71,[deleted] ,2019-07-22 11:09:36
617,8ujivo,False,,42,How do I apply for new jobs when I already work 10 hour days?,careerguidance,"When I get out of the office I need to run errands, cook, clean, be in bed by 10:30. I’m suffocating here and there is no energy left to apply for jobs, I feel like I’m trapped. I just want my life back.

Edit: Honesty, I just want out ASAP. Which places hire quickly? I’m on the verge of tears from the stress.",https://www.reddit.com/r/careerguidance/comments/8ujivo/how_do_i_apply_for_new_jobs_when_i_already_work/,100,"Temp jobs replacing someone leaving a company tend to hire fast and have less interviews. 

It might mean you have to be up a few extra hours to apply to other jobs but it would only be till you find something. Wish you the best! Stay strong. ",2018-06-28 13:42:51
71,ghyob1,False,answered,149,"CANNOT think of ANYTHING that I want to do as a career. It's so frustrating! I've been researching it for years and I'm at my wit's end. Help. I can't do retail anymore, I might go insane. How do I choose when nothing seems to call to me?",careerguidance,"When I was a kid, I wanted to be a teacher. Then it turned into a book writer, then I switched to architecture. none of those panned out but I still think about them.

some other ones I've been interested in: entertainer, librarian, lawyer, doctor (lofty, I know, but why not), musician, artist. Just all over the place.

My parents have told me that I should do something creative but that's never panned out. 

And then there's the fact that so many people I know went through the whole college thing and now they're secretaries or working in retail and it scares me and confuses me. What if I waste my money? what if I can't hack it? what if my IQ is low and that's why I have nothing to show? I am so stressed about this. I'm terrified to go back to retail (I quit before covid and now I'm in quarantine-- how am I supposed to get a job like that when I live with vulnerable age groups?!?!!)

Anything you got for me would be a great help. Thank you so much.",https://www.reddit.com/r/careerguidance/comments/ghyob1/cannot_think_of_anything_that_i_want_to_do_as_a/,316,"Don't follow your passion. Do what is in demand. You're not going to enjoy it right away. It's called work for a reason. If you deliver pizzas, do it well. If you become a secretary, be a good secretary. Become invaluable to your workplace. Passion will follow success in whatever field you find yourself. ",2020-05-11 23:04:19
238,hcznj3,False,,66,Graduating next year with a BS in Psychology at the age of 30 with a lowish GPA (3.1). What jobs do I qualify for to become an ACTUAL career?,careerguidance,"The title is self-explanatory; possibly a bit vague. I was hoping to go to grad school, but that seems hard with my GPA. I would like to work a job that I can find growth and not a glass ceiling. Stable income that can grow nicely with experience, as well as growth within the company or my title to carry to other organizations would be ideal. I was thinking I would qualify for HR or office manager jobs. Any advice is helpful! Thanks!",https://www.reddit.com/r/careerguidance/comments/hcznj3/graduating_next_year_with_a_bs_in_psychology_at/,188,Why would you major in this? At your age you should have known better ,2020-06-21 03:09:49
351,go32r2,False,,122,Unhappy with my degree | How to move out of copywriting / advertising ?,careerguidance,"I’m about to turn 26 and I’m tired of feeling unmotivated and directionless.

I studied advertising and journalism with plans to be a copywriter, and I realized it’s not the path for me. I worked really hard in my classes, interned at a major ad agency, pulled all nighters for my school’s ad competition, and read every copywriting book I could get my hands on. By the time I graduated in 2016, I had no desire to work in the industry. I’ve been trying to figure things out since. I’ve jumped around from different jobs and plans, and now I’m unemployed and living at home. I’ve become pretty depressed because I always took pride in my drive.

I don’t want to rant *too* much about what I dislike about copywriting because I’m trying to move forward. I learned a lot about myself in college, became more introverted, and I don’t feel like I value anything about the ad industry. For example: I don’t care about trends / social media / ads in general. I value people who are genuine and don’t like the culture of selling and people pleasing. I tried to suck it up because I know this is a privileged ‘problem’ to have, but it’s hard to pretend, especially in an industry where there are so many passionate people trying to break in.

Anyways, I’m looking for ideas or suggestions on what I could do next and how I can use my time now. I consider myself a creative, but I’ve developed a lot of non-work related hobbies and passions and don’t feel the need for my job to be that ‘cool.’ I think some variety would be nice, though. I’m hoping to find something with decent pay and more stability than the more creative routes I’ve considered (freelance writing, photography, etc).

Some background info and ideas:

* Since graduating: I worked at a restaurant while getting an ESL certification and student teaching, but my plans to teach abroad fell through. Then I worked as a writer at a very tiny marketing firm for a year and a half. I moved to NY and have lived off of temp agency work and sporadic freelance writing and photo assisting. I was interested in learning about becoming a photographer (I’ve had some photos published in magazines), but ultimately there isn’t enough stability and too heavy of a barrier of entry for me.
* I feel ‘unmotivated,’ but there are a lot of things I am interested in (work and non-work related). I’m really interested in people/ethnography, language, visuals / art / design / clothes, psychology, music, and nature / conservation. Obviously no job will encompass all of these things, but it’s a start.
* This isn’t a priority, but I’d like to be in a less conservative work environment if possible. I am a photographer and artist and like a lot of esoteric music and film. It would be great to not feel like I’m hiding at work.
* I’ve got job ideas related to my interests but most of them don’t seem that viable, especially now. I care about money and stability more than I did before, and I’d rather pursue freelance writing and photo projects outside of work.
* I’ve been interested in and looking into tech / coding related jobs, but I feel like this has become a go-to for people not knowing what they want to do. Is this worth looking into? Is it realistic to start learning now and find a job soon?
* I've been working on side projects to keep some motivation. I'm working on a website / social account with a friend right now highlighting style and aesthetics in jazz. I'm working on a long-term photo project, making playlists and a fake ""radio station,"" and hoping to take some drawing and French classes for fun.

Thanks to anyone who took the time to read this. I need to figure something out soon since I lose my health insurance in the next couple months, but I’m trying to break this pattern of lulling around. Any ideas, suggestions, reality checks, etc are welcome!

TLDR: Majored in advertising and it doesn’t fit my personality or values. Out of school for four years jumping around and am now unemployed. What can I do next?",https://www.reddit.com/r/careerguidance/comments/go32r2/unhappy_with_my_degree_how_to_move_out_of/,156,"So, whenever I see these posts I ask one question in two parts.

What generally do you want to do with your life?
What do you love to do?

You need to answer this first.

General answers are usually;
I want to be rich.
I want to help the world.
I want to get stoned and play videogames.
I don't know.

This helps determine the direction you want up go.

What do you love to do helps determine the path.

So can you answer these questions? Preferably not in 50 paragraphs.

An Insane Squirrel ",2020-05-21 19:09:19
374,h8g0x8,False,,29,How to deal with feeling stupid?,careerguidance,"So im in the process of training at a new job and in an new field ive never worked in before. Because of the pandemic and some loss of business i havent been able to come in and get consistent hands on trainingm so far fornthe last 3 months ive only had 5 or 6 days where ive come in and done 4 to 5 hours of hands on training for tasks. Then ive been off for two weeks straight because they couldnt schedule me. Anyways, im still making mistakes and the environment isnt a warm place for new people who need to ask a lot of questions. I can tell as soon as i leave the room or clock out forbthe day in being talked about. Its all women so it doesnt really vother me honestly. I expect it. But its frustrating going through this same process while training where by not knowong something you feel stupid. Im pretty sure my boss thinks I'm retarded.

Whats the best move on how to deal with this. Should i be asking my boss how she thinks I'm doing or things she sees in struggling with? Its been communicated that the covid situation has messed up the opportunity to train more hours. But still I feel the pressure to get and remember things right a way and if I dont I'm not competent.

Appreciate any advice and experiences.",https://www.reddit.com/r/careerguidance/comments/h8g0x8/how_to_deal_with_feeling_stupid/,144,"You need to push back on your boss.

Tell her that your training is subpar and you are not being trained properly.   Tell her that you don't want to be making mistakes like this and you wouldn't be if you were trained properly. ",2020-06-13 21:15:17
226,9dbkb8,False,,175,"People who love their job, what is it?",careerguidance,"Most jobs seem miserable to me. The whole 9-5 idea of sitting at a desk all day is really killing me. If you love your job, what do you do? ",https://www.reddit.com/r/careerguidance/comments/9dbkb8/people_who_love_their_job_what_is_it/,190,community outreach. ,2018-09-05 22:07:21
50,el4vlp,False,,198,"People who seem to always interview well and get the job, what do you think you do that sets you apart from the rest?",careerguidance,,https://www.reddit.com/r/careerguidance/comments/el4vlp/people_who_seem_to_always_interview_well_and_get/,378,Show up drunk ,2020-01-07 02:38:04
953,hr46b3,False,Advice,32,Should I remove my photo on Linkedin?,careerguidance,"I have been having such a difficult time with finding getting interviews and finding jobs. I apply mainly on indeed and linkedin. Basically, I belong to a religion which is often stereotyped and I dont want a negative bias to happen before the interviewer meets me at least. I wear the hijab and will also be wearing it at work. 

I was just wondering whether I should:
1. Keep the picture and keep applying 
2. Upload a new picture, maybe so zoomed in that they cant see my hijab? 
3. Remove the pic completely 

What do you guys think? Tired of not getting interviews and I just want a chance.",https://www.reddit.com/r/careerguidance/comments/hr46b3/should_i_remove_my_photo_on_linkedin/,56,"I don't know what a hijab is, but as you mention wearing it, I presume it's either an article of clothing like a headpiece or perhaps jewelry of some kind. Could you have a picture taken without it and post that? ",2020-07-14 16:01:30
462,e52lzm,False,,53,What's a nice way to explain to potential employers that my previous boss abused and gaslit me?,careerguidance,"I'm currently applying for a new job and their online form is asking why I left a certain job. Some of the highlights from this past job:

Immediately after signing me on, the boss said point blank I was under qualified but promised to give me formal training

He actually didn't provide any training and waited 8 months before telling me that I was crap at my job. He started verbally listing all the things I was doing wrong, the stupidest one being that I always played with my hair while working. Note that there was not a single complaint about my work up until this point. 

He said that he had written a list of things I needed to improve on. When I asked for the list, he refused and said that I needed to fix everything on my own.

Finally when he did provide me actual training, he brought in someone that worked from home due to chronic illness and fatigue. After each meeting when this employee was gone, my boss would pull me aside and berate me again for taking advantage of a sick employee. 

This along with several other issues left me so depressed an anxious that when he finally fired me I felt suicidal. 

Now as I fill out this new job application, I'm trying to figure out the nicest way to be honest. Anyone have any tips?",https://www.reddit.com/r/careerguidance/comments/e52lzm/whats_a_nice_way_to_explain_to_potential/,126,"OP was fired, so all the “it was a bad fit” is not only lazy bad advice but straight-up non sequiturs. ",2019-12-02 17:50:29
