Num,ID,is_Original,Flair,num_comments,Title,Subreddit,Body,URL,Upvotes,Comments,creation_date
963,8hzw6y,False,,43,Did I ruine my life?,careerguidance,"I am a 38 yr old man. Only done dead end jobs. Nothing worth mentioning think kid jobs fast food to retail and even garbage telemarketing, bill collector which i hated.

I finally got my G.E.D. at 31.  Now, i am trying to fix my life at a older age. 
My favorite school subjects was math/science. English is my kryptonite.

I am a bigger guy that needs to lose weight and slowly working on that which will make physical jobs hard for me. Not to mention i injured my back at a young age 21 working as a CNA.

I am not a fast paced person. I am slow to average in speed. I chicken peck typing around 20-30wpm. I have basic computer skills turn on and off and web surf or put in a application. If you have other questions please ask if needed.

I am looking for careers that will not age me out since i am older. I have a family, kids so can not be gone weeks and months at a time. I am looking for suggestions for a carrer that someone in my postion can get into. Lets hope it has future growth potential as well.

Your advice would be helpful or Is my life ruined by all of my life mistakes. Btw, my background/criminal record is clean.

Thank you for all your personal and thoughtful opinions or experience advice.
",https://www.reddit.com/r/careerguidance/comments/8hzw6y/did_i_ruine_my_life/,58,"31 is so young!!! If you like science, why not get some kind of cert to be a lab tech or hospital tech of some sort? You should also def take some classes to improve your computer skills so it's not a barrier for your future career choice! Being tech savvy is super important and it's really easy to learn... just gotta get over that initial mental block!  ",2018-05-08 20:13:00
357,f7qfdx,False,,46,How do you go about applying for a job in a different state before you move there?,careerguidance,"I currently live in Arkansas, and by the summer I'm hoping to have saved enough to move to Portland. However, due to how volatile the area is, I want to have a guaranteed job lined up before I move. My question is, how do you go about getting a job in a state that you don't live in? Like, how would the interview process go? Would I just have to hope that they'd do an over the phone interview?",https://www.reddit.com/r/careerguidance/comments/f7qfdx/how_do_you_go_about_applying_for_a_job_in_a/,151,"I relocated from WA to AZ last summer and ended up with multiple job offers before I moved. Because I wanted to be sure I could easily find work, I looked in my current field (Education) that I have years of experience in and is in high demand. That made the process a lot easier. 

I just explained the situation when asked to interview and offered to do it via Skype or phone call instead and everyone I spoke to was very flexible. 

I think if you are a desirable enough candidate, employers are going to be more accommodating to try and hire you. Good luck! ",2020-02-22 09:32:07
171,c6k93y,False,,51,How do you succeed in business as a shy/introverted person?,careerguidance,"So far the biggest thing holding me back in business is being shy. I can typically turn on the charm when I have to, like for a client or for an interview. But I’m more of a quiet reserved person. 

It doesn’t necessarily hold me back professionally, such as I still make and exceed my sales goals, I am very quick to learn new skills, I am patient and calm with clients and can turn around a bad situation by being nice and “sweet”

But it does hold me back in the social aspect of my business life. Some example of this are I have trouble networking and making connections. I don’t make friends easily at the office (6 months in I’m loved by everyone, but up until then I get a lot of heat. They don’t understand why the quiet girl is doing so well and the loud people are just doing ok). I once had a boss call a meeting with me just tell me the thing she hated about me most was that I was shy. I asked her if she thought I wasn’t doing my work well, she said it was all great but she didn’t like that I wasn’t loud and chatty like her. I could understand if a client said something, but I didn’t work with clients at that point, I did research for her. 

I learn by listening and observing, then trying and then asking questions along the way. I’ve had employers tell me that if I’m not asking questions while learning, I’m not paying attention. So then I end up thinking of questions I don’t really need to ask just to appease them by asking *something* and they point this out as a negative also. 

I don’t know how to succeed in business as a shy person in a field that is run and dominated by extroverted people. All answered are greatly appreciated!",https://www.reddit.com/r/careerguidance/comments/c6k93y/how_do_you_succeed_in_business_as_a/,226,"Be attractive, don't be unattractive. ",2019-06-28 13:33:26
547,avpim5,False,,29,"Left banking job on bad terms after 6 years and have done nothing for over a year - how to approach CV, recruiters, etc?",careerguidance,"Hi,

&#x200B;

I worked in investment banking for 6 years straight out of college. This was a stressful, front office, client facing role. I was in the top performing quartile of peers each year, and my immediate bosses had a high opinion of me (not trying to toot my own horn, just hope this might mitigate some of what follows). The 1st section below describes what happened, and the 2nd section gives more personal details (not shared with my former employer). My questions are:

1. Given my situation, do I need to list anything specific on my CV (obviously other than my employment ending on so-and-so date 15 months ago)? I'm thinking of 2 things: do I need to describe how my employment ended? Do I need to explain the \~15 month gap in my employment history?
2. When (if...) I speak to recruiters / at job interviews, what should I say about how my previous job ended? I can explain what happened (kind of like I do below in the ""external perspective""), but I assume when they call my previous employer as a reference they will be told I was fired on bad terms?
3. How do I explain the long gap since my previous job to recruiters? I obviously can't give the ""personal perspective"" below. I was thinking of simply saying ""personal/family issues I had to deal with""

&#x200B;

The story (from an **external perspective**) goes like this: 

The job (and especially one person in the team) was very toxic, I was literally the only junior who managed to stay in that team for more than a year or two (those before me either quit or were fired). Around a year before we ""parted ways"" (more on this below), the stress and toxicity had really gotten to me, and despite the very high pay, I had decided to resign. I tried to resign twice but unfortunately since I was a little bitch, my boss managed to talk me into staying. Ultimately he convinced me to take a sabbatical for a few months and said if I still wanted to leave after that, I was welcome to. 

I took him up on the offer but when I subsequently met with HR in the coming days/weeks, it turned out my boss had told them I needed to take stress related sick leave. There's obviously a big difference between that and a sabbatical - HR made me see a doctor, demanded updates every week, etc. Basically after a few months of this, I went MIA (not answering phone/emails) and a few months after that, the company terminated me.

&#x200B;

The story (from a **personal perspective** \- my employer didn't know any of this): 

\~2 years before I left I started using drugs quite heavily, partly due to the very demanding job, partly due to the toxic co-worker, and partly due to my addictive personality (can't blame everything on the job alone!). No one knew (knows) about the drugs and they never affected my ability to do the job (in fact I achieved my highest rankings vs. peers in those last 2 years). As soon as my ""leave"" started, the drug use spiralled completely out of control, which contributed to depression, which made drug use worse, etc. (vicious cycle). A few months in, I stopped caring about everything, never left my house, stopped talking to family/friends/work. All I did was do drugs and play video games. Some of my family/friends literally thought I had died! This continued until \~8 months ago, when I ran out of money/savings and had to move back in with my parents. On the bright side, hitting rock bottom finally made me get clean - I've been off drugs (but still battling with depression) for around 6 months now. I've finally found the motivation to get a damn job so today is literally the first time I've logged into LinkedIn in years!",https://www.reddit.com/r/careerguidance/comments/avpim5/left_banking_job_on_bad_terms_after_6_years_and/,108,"I hope you don't mind this off topic response.
I'm considering studying economics and going into a career in investment banking or as an analyst. What did you study in college and what was your day to day work life like? Do you feel confident investing in the stock market for your own personal portfolio because of what you studied or do you think you could achieve the same level of success just studying and paying attention instead of taking 4 years of courses? If you don't feel like answering that's fine and also good luck on your job hunt. ",2019-02-28 10:13:46
510,dxx5sk,False,,32,How to stay calm and separate work anxiety from my personal life?,careerguidance,"Hi,
I work as a financial analyst and recently things have been very very high stress. I recently was assigned a new department 3 weeks ago. My director demands immediate & accurate results, while everything I turn in never seems good enough. I’m expected to take ownership of my own work and to figure things out on my own (about the department because my director is fairly new as well and doesn’t have the bandwidth or knowledge of how things were done in the department in the past to answer all my questions). Basically, every night I dream about work and barely can rest peacefully. Even when I nap on weekends, I am scared to check my phone in case I see a message..and whenever I do, my heart skips a beat and my anxiety is activated. I don’t have an appetite at work and I think I’ve lost 2-4lbs in these past 2 weeks. I really want to be able to relax on the weekend without thinking of the impending doom that is the weekday...please, does anyone have any tips on how to separate work and personal life? I’m the type of person who gets fixated on things easily, so it’s hard to be 100% present with my friends/family because my mind wanders back to work. I don’t want to look for a new job yet because this is my first job out of college, and a lot of the positions I see in other companies require at least 1-2 years of experience in finance. And I’ve tried methods of distraction (watching TV, exercising, socializing), but my mood is ALWAYS ruined the minute I see another message from my director, and I lose motivation/joy in those activities. I just want to be able to look at a message and be able to write off any emotion until Monday so I can properly recharge, sleep, & enjoy my weekend.",https://www.reddit.com/r/careerguidance/comments/dxx5sk/how_to_stay_calm_and_separate_work_anxiety_from/,118,"I user to work 100h weeks, i still do, but i uses to too. Here is my trick. Thankfully they are much less frequent now.

1) When I'm at work I'm 110% committed to do what needs to be done, and I god damn do it WITHIN WORKING HOURS. I don't mind coming at 7am and leaving a 8pm if that's whats needed to meet the deadlines. But once I left my desk, unless its a life or death situation, I'm not answering emails, I'm not answering texts. Remember, you're not in the business of saving babies or rescuing old ladies, it can wait till tomorrow! 

My off time is mine. Learn to put boundaries or else you will spend 8 months trying to get back on your feet again after you burn out. I survived my burn out and I hope you don't get to experience what I have been through. Never again. 

2) My second lesson is learn to delegate. If you can't do it on your own, bitch about it until they give you someone to help you out or give that task to someone else. It might sound desperate or at times unprofessional, but your health comes first. Never forget that. 

3) Nobody ever regrets not spending more time at the office while on their death bed. Just sayin'. So chill, smell the flower, and adopt a more stoic mindset. ",2019-11-18 02:55:16
538,ealigy,False,,42,"5 months in new job, still incompetent - should I quit?",careerguidance,"It's been 5 months since I started my new job in a new field (2nd job after uni, 1st job was a diff field). And I feel as lost as when I just started. I feel like i'm drowning every day I come in to work. At times, I just feel like ending it all.

I write for social media, and don't feel like I have the skills for it, or that i'm getting better at it. I want to perform, but because of my lack of skill, as much as I want to I can't. And I feel really bad for it - I don't like disappointing people. I've stayed up nights trying to catch up on work but it doesnt feel like its enough. There seems to be a huge writer/creative block that I cant get over - I cant seem to write or think fast enough.

Honestly I feel like that incompetent fool in the office. And I think my colleagues think that way too, although they've never said anything about it, and they have been really nice so far. 
I've seen them rant about other colleagues before to each other, and sometimes I can see that I frustrate some of them with my lack of ability to apply their advice.

My dad tells me that it takes time to learn the skills, and to stick it out - i'll get better with time. That i'm being too much of a perfectionist, and that i'm thinking too much. Colleague (a friend) who introduced me to job also says that I should stay and not give up so early. But is that the case for a skill based job like writing? I've been struggling since the start... and it doesn't seem to be getting better.

Also, I don't know what other career paths I can explore. I feel like I lack so much intellectually, with no skills (not even leadership or social skills), and where can I fit in like that?  I feel so stuck and lost, I just don't know what to do. What should I do?",https://www.reddit.com/r/careerguidance/comments/ealigy/5_months_in_new_job_still_incompetent_should_i/,114,"Lol, no offence but how can you be incompetent at writing for social media? ",2019-12-14 16:10:01
559,ah58zq,False,,32,Is it a valid reason to resign due to a toxic work environment?,careerguidance,"My manager has never had an issues with my performance or attendance. I have stayed with the department because it is in the industry related to my career interests, the job market is rough and I needed experience.


I am exhausted from being targeted by co workers and working in an environment where I'm made sure everyday that I am not welcome. I filed a harassment complaint with HR and everyone was required to complete workplace harassment training. I am tired of documenting.

Management is rejecting my requests to become part time or taking leave of absences. I cannot continue to work in a poisoned environment. I don't have another job ready (even though it would be ideal). 

I hate that there will be a gap in employability and
its obvious that I have to leave but I'm hesitant:
- should I state my reason for leaving due to toxic environment (edit: lack of fit), detailing everything I've done to resolve the situation without any luck. 
- would management and hr provide references for my future employment?

Edit: Thank you everyone for your insight. I did what was best considering my circumstances. This is a learning experience in my career development, I'm also networking and also learning from other experienced professionals as well as upgrading my skills. ",https://www.reddit.com/r/careerguidance/comments/ah58zq/is_it_a_valid_reason_to_resign_due_to_a_toxic/,109,"Shift your mindset.

Even though it sucks to work there, the bottom line is that your providing a service and being compensated for it 

Those other people there are just meat. Just inanimate objects you need to work around to get paid.

With this in mind, continue to collect that pay check until youve found yourself a new job. ",2019-01-18 01:38:23
128,eva9ib,False,,197,What are some high-earning jobs that can be done remotely?,careerguidance,"I hate my job and the field I've found myself in as a whole. I loathe cities. I want to travel full time. I'm looking for input/suggestions on any careers or jobs you know of that can be performed remotely and have starting salaries/realistic earning potential over $100k.  Any field/type of job welcome, as I'm completely open to suggestions.  Just trying to get an idea of what's possible.",https://www.reddit.com/r/careerguidance/comments/eva9ib/what_are_some_highearning_jobs_that_can_be_done/,262,Following ,2020-01-28 19:33:15
794,9vytlm,False,,79,I think I fucked up the last 24 years of my life. Should I go back to get another degree?,careerguidance,"I thought I always had everything in the bag. Graduate, go to law school, and then live an okay life. But as I worked an internship at a law office and was unable to take the LSAT this year (law school admission test) due to family reasons, I’m beginning to realise more and more that this may not be what I wanted.

Unfortunately, all the jobs I’ve been able to find with my useless BA degrees (Criminology/Film, God knows why) are in sales and marketing and that is definitely something I do not want to do for the rest of my life. It never actually occurred to me to try my hand at anything STEM related, but I’m beginning to think I should go back to school to get a BS instead. I literally have nothing else gunning for me except for some job experience (peer academic counselor) and good grades. It’s kind of depressing. I also have some stupid dream to work in the game industry someday and I’m nowhere near that at all. 

Thank you for reading and I would greatly appreciate any advice! I’m afraid of wasting the next few years of my life as well...or even the rest of my life in pursuit of something I may not even like in the end. ",https://www.reddit.com/r/careerguidance/comments/9vytlm/i_think_i_fucked_up_the_last_24_years_of_my_life/,70,This is pretty common advice and I'm surprised no one said it: get a 2nd bachelor's in computer science. It is the STEM degree that will get you a high paying job. You might even get a job in the game industry someday. Take out whatever debt you need to and take however many years you need. ,2018-11-10 23:07:34
192,fd2vcf,False,,71,How to quit a job without telling the truth?,careerguidance,"So I've just been offered a job today in a different company and I am really scared of telling my manager/CEO the truth of why I will be leaving.

So our company is quite small - growing moderately - and without sounding big headed, I have helped the company grow a lot. I know they really need me and my skills as a designer, however my manager takes most of the credit of my work, therefore he is getting promoted more than me (I also get the fact he is the manager) and instead I have received a small salary increase instead.

Anyways, the manager treats me like crap most of the time, our boss can also be horrible and demands the best quality of work with the shortest amount of time possible (so working OT/working over weekends) and if you don't deliver, you're just not good enough for their company. My manager has honestly been horrible to me, even the staff in different departments commented on how he speaks to me.

My notice period is a month, and I know for a fact he's going to be so horrible when I tell him I will be moving to a different company (sort of a competitor too), and I'm just not willing to sit through for a month of hell. He's currently been nice because one of our ex assistant had left a horrible glassdoor review of working for the company.

What should I do? Should I lie that I'm leaving the city to go back home? I know he will be constantly asking and prying for the rest of my notice period so I can't exactly say 'I can't tell you/I don't need to tell you'.

Help/advice will be appreciated!

Thank you.

&#x200B;

\*Edit

Wow, I didn't expect so many responses, I was hoping to get 1 or 2 advices. Thank you so much for all your replies, it's helped me feel more confident to hand in my notice tomorrow! Nervous still - but I'm going to do it! ",https://www.reddit.com/r/careerguidance/comments/fd2vcf/how_to_quit_a_job_without_telling_the_truth/,212,just stfu ,2020-03-03 22:34:37
640,f3nfcv,False,,50,How damaging is it for me to leave a new job to accept a more desirable job offer?,careerguidance,"tl;dr - I'm considering accepting a high-paying job but only working it for a month or two before accepting a lower paying job that would make me happier. Wondering what reasons exist not to do that that I may not have considered yet.  

I'm in the military with a gross annual income of about $92,000. I've decided to leave once my contract is up in early April instead of reenlist. I'm stationed in Maryland but I really want to move back home to Colorado, I've just been holding out for a decent enough job there. I figured it wouldn't be hard to land a job here in Maryland (basically doing the same job I have in the military but as a civilian) so my plan was to do that first just to keep paying the bills while I look for a Colorado job.

I interviewed for a Maryland job on Wednesday and a Colorado job on Thursday. Both sent recommendations to HR to hire me, and both hiring managers said this almost certainly means an impending job offer. Maryland job pays $118,000 and aligns perfectly with my experience, while the Colorado job pays around $66,000 and is a sort of partial career shift since it aligns with only part of my experience. Now you probably think I'm crazy for preferring the Colorado job but living there is my dream and I'm not happy here in Maryland.

Anyway, I *could* just accept the Colorado job and decline the Maryland job. But I'd be lying if I said I don't want to collect at least one month of that fat salary from the Maryland job (about $9,800 gross) before moving to Colorado to start the other job. And the Colorado job could probably be flexible with the start date by a month or two. But of course, that means I'd be having the Maryland company commit whatever resources to getting me spun up on that job only to quit soon after.

Both companies do a lot of government contracting work. The Maryland company even has jobs out in Colorado too, similar to the Colorado job I'd be taking. If I leave Maryland company so soon, do you think it will burn the bridge for any job opportunities with them in Colorado? Is there a way to mitigate that aside from NOT leaving so early? Do you reckon it could damage me professionally beyond my relationship with the Maryland company, like other companies finding out how I left that company?",https://www.reddit.com/r/careerguidance/comments/f3nfcv/how_damaging_is_it_for_me_to_leave_a_new_job_to/,95,QQ: would staying at a job for 2 months look bad at a resume? ,2020-02-14 05:17:06
693,c1z0vu,False,,81,"Boss said he'd fully support me for an internal promotion, just informed me he's applying for same promotion. Shitty or illegal?",careerguidance,"I'm currently working as assistant director and a position opened up for a director spot in another department. In order to apply, I had to tell my direct supervisor (my director) that I was interested in the position. So I did. He told me that he thought that I'd be an awesome fit for that position, that he would recommend me, that he'd fully support me going for that role, and that he wasn't interested in the position for himself. 

I applied for the position before the closing date (along with submitting an updated resume and portfolio), came into the office from paternity leave and interviewed for the position (2 weeks ago), and just submitted an assessment (spent about 35 hours putting it together) for the position today.

My director pulled me aside just before i submitted my assessment to tell me that he wanted to apply for the same position and that he wanted to ""clear the air"" around it and ""may the best man win"".  Along with that he told me that he had pitched a new position above the one that we are applying for and got rejected and that was one of the reasons he was now applying. He also said that he had been given the same assessment task.

A few other things really got me pissed even more:

* The deadline to apply was 3 weeks ago.
* I'm not sure if he had to actually apply and interview before being given the assessment but it sounds like he didn't.

I just want to make sure I have an even playing field and I'm not getting dicked around. I have a good rapport with the individuals doing the interviewing and evaluation of the assessments who are outside of the HR department. Should I bring up my concerns to them or should I go straight to HR with my concerns? Is what he's doing just shitty or is the special treatment he may be getting potentially illegal?",https://www.reddit.com/r/careerguidance/comments/c1z0vu/boss_said_hed_fully_support_me_for_an_internal/,82,"Not unfair or illegal, but I'd term that shitty for sure. When your boss says they'll back you up and then goes back on that, that's exactly what that means. I don't care if his circumstances changed or not.

Unfortunately, pretty par for the course in the corporate world. ",2019-06-18 07:01:41
