Num,ID,is_Original,Flair,num_comments,Title,Subreddit,Body,URL,Upvotes,Comments,creation_date
110,hpbm4b,False,"Cleveland, OH",110,Is it morally wrong to choose a career that doesn't work to solve the world's most severe problems?,careerguidance,"I'm 22 and just graduated college. Naturally, I'm focusing on establishing a career. I've always been interested in the concept of work. Ever since the end of high school, I've thought a lot about why people work and how to have a fulfilling career. This is easily the aspect of my life which I seem to value most, although this value comes from a sense of duty/social obligation rather than my own interest. So there's this question that's been bugging me for awhile.

As I explore different career paths people are pursuing, I can't help but notice that so many of them seem to be kind of... worthless. I make this statement with a lot of skepticism because I don't want to be judgmental with so little information. It's just that I notice so many problems happening in the world: hunger, disease, mental illness, violent crime, oppression, war, poor education, accidents, etc. However, few of these issues are directly effecting me. I live a comfortable life of abundance, security, and all the pleasures one could ask for. Some of this is a result of my own doing, as I enjoy rewards I have earned, but far more of it is just a result of circumstance. I was born in the USA, I'm intelligent, I'm able-bodied, I have a close family, I had access to relatively good education, to name a few of my blessings. But I earned none of this. I don't feel guilty for winning the lottery of circumstance, but I do feel guilty for not helping those who didn't. So here's my question: **is it morally wrong to pursue a career that primarily serves or benefits those on the higher end of the quality of life scale instead of dedicating one's life to solve the world's more severe problems?**

I realize that it's difficult to measure the value produced by, say, a film studio. What if someone is inspired by a movie and decides to travel to a third world country and build a school? But still, it seems that a film studio is just a bunch of people spending time, money, and energy playing with cameras and lights, like a game, when there's people in the world who don't have food. How about another example, a marketing firm that works with fashion brands to sell more expensive sunglasses? I mean seriously? You're working day in and day out to push pieces of plastic people wear on their face so they're a little more comfortable seeing outside? While people are dying of infections diseases because they don't have sanitation infrastructure? Or how about a business accountant? Crunching numbers to make sure you're getting the best tax return so that you can pay your dividends to shareholders so they can buy a new set of golf clubs to hit balls around on huge grass fields where homeless people would be kicked out for sleeping because they have nowhere else to go? I know my perspective is limited and ill informed, but there is truth to the basic concept: people spend resources solving comparatively minor problems when there are very serious issues affecting others in the world.

**What do you think about this? Is it morally wrong to not try to solve the world's biggest problems, if you have the ability to do so? If so, how might we change this about the world? How do we motivate people to create value where is more needed?**",https://www.reddit.com/r/careerguidance/comments/hpbm4b/is_it_morally_wrong_to_choose_a_career_that/,276,"You’re 22 - there’s a lot of world and a lot of opportunity out there. Now is your chance to do something you’re passionate about, something exciting.  That may mean helping others, or it may mean another path.  

First you need to keep your lights on, food on your table, and to not be a burden yourself, on the public dole.  If you pursued a marginal value degree, think about what you might need to do to monetize it. Consider risk, and manage it - don’t run from it or run towards it.  Be smart. 

The greatest benefit to others will be when you have the time, resources and energy to put towards things that matter to you personally.  The bleeding heart, eating cat food and earning minimum wage, bless them for doing so, might not be the right path for everyone.  

And capitalism and creating “value” of different types isn’t the evil that the leftists would try to indoctrinate you into thinking. I agree with the sentiment of movie production or fashion.  But people, even the socialists who want to own more of people’s’ labor for supposed betterment, like that stuff. Entertainment, storytelling, fashion, these aren’t modern things - they’re ages old. They’re human nature. The fact that there’s so much money in that vs other greater challenges is indeed sad, but it’s humanity’s making, and it’s not going to change.  Best you can do is vote with your wallet and route your resources when you have them, elsewhere. 

The good news is you’re young. You’ll mess up, reset, and carry on.  Just make sure you’re learning and passing on what you learn. ",2020-07-11 15:14:22
741,e98ofd,False,,42,"They think I am an Architect, what should I do?",careerguidance,"Hi guys I've worked for this small architecture and engineering firm for about two years. When I sent my resume for a drafter position I was very clear I had completed x credits in the architecture program in my home country, never said I had graduated. However, all my coworkers think I am an architect. I am doing very good here, I started with a low salary but now I make more money than all of them that are actual architects. I didn't do anything wrong, I never lied about it, they got it wrong for some reason. However, I did have the opportunity to correct them last time a new employee was being introduced to us and they said ""everyone in this row are architects"", but I didn't say anything. What should I do?

ps: by ""architect"" I mean bachelor in Architecture, not a licensed Architect.

**UPDATE**: Probably I wasn't clear enough or I shouldn't have used the term ""architect"". Here in the office, we all know that there is only one person who is the licensed architect. He is the one signing and stamping all architectural projects.

However, it's a common practice when introducing someone to call them ""architect"" or ""engineer"" even though they are not licensed. When referring to the licensed professional, we say ""he is the licensed architect"". I know this is technically wrong, but this is not the point here.

The point is that they think I am a bachelor in Architecture but I am not and now after two years I feel very uncomfortable having to explain them I didn't finish architectural school.",https://www.reddit.com/r/careerguidance/comments/e98ofd/they_think_i_am_an_architect_what_should_i_do/,80,"As long as you don’t call yourself a licensed architect or try to stamp official documents/plans as a licensed architect you should be fine. If a client asks you directly, you can always say that someone else will be stamping and signing the plans you submit to the state office. Keep making money, don’t worry about your coworkers.  It’s their problem for misunderstanding and not your job to correct them. Sounds like you’re doing well.

Many of the licensed architects I’ve met are gatekeeping morons. Never lifted a hammer or understand what they’re ‘designing’. Especially boomers that rely on the younger generation to produce documents. Either learn competitive skills that are industry standard, or retire.  Point being; if you do your job well and are compensated accordingly, you’re actually in a good place. Let somebody else take on all the liability and you do you. ",2019-12-11 15:42:33
832,92u49a,False,,57,"Want to quit my first job after the first shift, what do I do?",careerguidance,"I'm 18 and never had a job, so when I got an email saying I got accepted for the position of kitchen porter at a restaurant up town I was ecstatic. I thought, kitchen porter you just wash dishes and take out the bins, easiest thing ever! plus its £8 an hour plus tips. I thought I must have lucked out big time. But after 8 hours straight of nothing but washing dirty dishes, getting wet, moving around heaps of clean dishes and pans and knifes, mopping the floor at the end of the day, cleaning everything, drying everything, just when you think you maybe have done the bulk of the dishes and can relax a bit thats when the clock turns 8 and a tsunami of customers come in and you realise the past agonising 5 hours were mere childs play. on many occasions i thought about just completely walking out and not looking back. On my break they gave me something to eat which was nice (if only i didn't have to eat it on the fire exit stairs because the lounge was full) when eating it i found my self with tears pouring down my face onto the plate. After my 20 minutes were up I got back to it, and when the day was over and everything was as good as new for the chefs in the morning I finally got to go home at midnight, straight to bed with aching muscles everywhere. When i woke up i find that i can't move my right wrist too well and have rashes on both arms. my next shift is in 3 hours and i'm so tempted to not show up, sure the job is ""easy"" as in easy to understand what to do and where things go, but fucking hard physical labour. I talked about it to my mum but she said i must not quit and that its always like that. I'm torn between the dread of everyone being disappointed in me and the dread of having to go back to it all for another 8 hours. whether i should care about my physical and mental health or care about if everyone sees me as a failure. what the hell do i do?",https://www.reddit.com/r/careerguidance/comments/92u49a/want_to_quit_my_first_job_after_the_first_shift/,70,liberals ,2018-07-29 11:25:42
994,hdgd64,False,Advice,48,Bat Shit Plan: Go fully remote for US job and live in Central America to dramatically lower cost of living?,careerguidance,"Edit: after a a little constructive feedback I see this post is better in the expat digital nomad community as the cometary would be more well informed. Much of the feedback thus far can be used in a constructive way, much of it is... lacking. The main issue remains logging into work systems with an asset that would be located in a far way country. 

I could just say my mother sick and I need to move to rural America to take care of her. I’ll tell the US government her place is my address. Heck I’ll even throw some money her way every month for the favor(her health is fine). 

Then I’ll work remotely from panama. It’s in the same time zone so I can do virtual meetings as if I was in the USA assuming my WiFi is good. At first I can only stay 6 months but later I can get a better permit. 

I’m thinking there may be issues with my work laptop location, that’s the only hitch I can think of here. That might be solvable. 

Am I stupid or genius???

This could free up way more money for saving/investing yeah?",https://www.reddit.com/r/careerguidance/comments/hdgd64/bat_shit_plan_go_fully_remote_for_us_job_and_live/,57,Check out /r/digitalnomad/ and look for Panama. It's frequently discussed and for the same reasons you gave. ,2020-06-21 22:53:33
765,binfaf,False,,21,"Company refuses to promote worthy people, forces them out, then advertises their job at higher grade. Why?",careerguidance,"I work for a large engineering firm in the UK.

The company has a culture whereby effective, valuable and worthy candidates for promotion can spend months - or even years - operating at the level of the grade above, but simultaneously being denied a promotion.

The usual outcome to this is that the employee in question gets fed up and either moves role internally or leaves the business, after which the company invariably re-advertises their position **at the higher grade anyway**.

I have been with the company for 8 years now and have seen this happen time and time and time again. 

The obvious explanation is that the personnel asking for promotion are effectively ""dead wood"", and the managers are happy to see the back of them, or that they feel it is an opportunity to bring in outside talent. However, this is not the case. The ones being pushed to leave are often the hardest working and most ambitious, and usually have very niche and specialised knowledge/experience. The ""dead wood"", by comparison, seem to know they are on to a good thing and try not to rock the boat.

Is this common practice in other businesses? What is the justification behind this kind of approach to personnel management?",https://www.reddit.com/r/careerguidance/comments/binfaf/company_refuses_to_promote_worthy_people_forces/,77,"Not necessarily common practice.  To be honest, does it matter what their reasons are?  If you think you're going to be a victim of this and that doesn't suit you then it's probably time to get out. ",2019-04-29 09:20:14
288,b6zbgy,False,,40,I recently accidentally found out that I'm going to be terminated this week or next week (sometime soon) through an email that wasn't meant for me. What should I do about this?,careerguidance,"It's a tad complicated but long story short, I use an iPad that I share with my boss at my job for doing my daily duties. I unlocked it and on the screen was an email between my boss, his manager and the HR rep about how my time there is limited and originally they were going to let me go last week but the new hire was on vacation. The language in the email was pretty insulting tbh as I have a medical condition that involves a compromised immune system, so I get sick about once per month for a day or two, and they were calling me a 'pussy' and a 'punk' for calling in sick so frequently. Nobody knows about my condition because my boss has repeatedly said, ""if you're sick, just call in sick, I don't need a reason or an excuse."" Is this grounds to terminate me? Personally I hate this job so it might be a blessing in disguise but it's hard to find a decent paying job out here with my job experience (or lack thereof). I've been spending a lot of my time looking for a new job already but nothing so far. I live in Vancouver, BC of that helps anything. I've also been made aware that starting this month, each employee is entitled to 5 sick days per year. I have two documented. Is it a really bad idea to take a few sick days to get my max because they're firing me anyway? (Obviously I wouldn't say it that way to management...) Any advice on this would be appreciated.

Edit: I was diagnosed last week with an immunosuppressive disorder so I didn't know about it going into the job. 

Edit 2: Well as of an hour ago I'm jobless. I get two weeks of severance pay and 1 month until my benefits run out. I think that's not terrible considering I was about 2 weeks away from quitting because I hate the job anyway. Blessing in disguise? Thanks y'all for your responses. Still peeved I couldn't find the damn 'pussy' email...",https://www.reddit.com/r/careerguidance/comments/b6zbgy/i_recently_accidentally_found_out_that_im_going/,167,You should have made your condition known before being hired. ,2019-03-29 16:22:57
852,a9nmrn,False,,36,Entry level jobs that teach valuable skills?,careerguidance,"I'm 22 and feel like I have no real skills that would help me get a decent job. Right now I'm an Aerospace Warehouse Support. For the most part I answer emails from branches and ship parts out to them or fulfill orders for customers. For example Lockheed Martin, Raytheon and a bunch of other places you've probably never heard of. I get paid $13 an hour (30 hours a week) and a little bonus every month if we meet certain goals. I want to start saving up for a house but I need something that pays more. Which I understand in order to get paid more I need a better job and those require skills.

So my question is what are some jobs a person without lots of experience or degree could get that teach valuable skills that could help me get a better job down the line? Also that pay better. (Excluding anything that has to do with sales, automobiles, and construction) 

As of right now I'm leaning to going to work for FedEx. My GF has a friend who is not the smartest guy, but after working there part-time through college he is now making over $100k a year. My GF's sister's boyfriend has been working there for around a year or so and is making $19 hour which probably isn't much to some people, but that's night and day difference for me.",https://www.reddit.com/r/careerguidance/comments/a9nmrn/entry_level_jobs_that_teach_valuable_skills/,66,Military. ,2018-12-26 10:46:20
703,fjsira,False,,27,"I lost my job because of Coronavirus, What should I do now?",careerguidance,"What’s up everyone, I recently got laid off from my electrical job as a helper.Work was slowing down because no one wants us in there houses or offices. My company is looking to lay off a couple more because of it. I worked there for 8 months and now I’m looking to go into a different career field, any suggestions? Is right now a good time to look for a job? I still got bills to pay so I need to find something for the mean time. I’m 18 btw 
Thank you!",https://www.reddit.com/r/careerguidance/comments/fjsira/i_lost_my_job_because_of_coronavirus_what_should/,87,Military ,2020-03-16 21:12:37
750,8qhuzg,False,,39,Why am I expected to sit and do nothing all day?,careerguidance,"I'm on my 3rd corporate job and I make a lot of money as a statistical programmer in finance. I have about $100k in student loans that I am already aggressively paying down, but getting to a net worth of $0 is going to take about 3 years. 

In every job I've had (1 consulting, 2 finance), I probably have 1-2 hours of real work to do each day but I am expected to keep the chair warm from 9 to 6. My team doesn't work in the same city as me, so I don't really understand why I need to be in the office. I've tried to create my own projects in every job, but (1) we are a regulatory function and there isn't much to add; and (2) I'm there to complete work that needs done, not dream up time-wasting projects to look busy with. 

The people in my office are on other teams so we don't have anything to talk about. They are also in very different life stages than me. We say hi but that's about it.

The usual advice in this situation seems to be ""use that free time to study for your next job."" Well I have been studying for the past 3 years post-grad, and that's exactly how I got this job. It's just going to get me into a different variant of this situation. Let me know which jobs don't require 9-6 desk sitting for statistical modelers and I'll definitely start studying.

I don't want to sit at a desk doing nothing all day. It's pointless, unhealthy, and rather lonely. My reviews are positive as when there is work, I do it quickly and with good quality. There just isn't enough work. 

This results in me trying to look busy all day when I'm really staring into space. I don't want another job in my field because they are all the like this (I'm on my 3rd one now) and I don't want to switch fields because I'd likely end up in the same situation for a lot less pay. 

**I want to work but there doesn't seem to be any worthwhile work to be done.** I am a bored, soulless desk sitter waiting for 6. 

EDIT: I can't work remotely. It is discouraged on my team and in my field. Ironic, because we are geographically dispersed, so we are all technically remote, we just have to sit in the office and listen to that guy Steve's fucking theories about who's making it to the playoffs and his cell phone arguments with his wife. ",https://www.reddit.com/r/careerguidance/comments/8qhuzg/why_am_i_expected_to_sit_and_do_nothing_all_day/,79,Whatever job you have I would like to have too.  Can I PM you over that someday? I believe I would be highly qualified. ,2018-06-12 10:27:04
257,eg3img,False,,168,Has anyone ditched their 9-5 for something with weirder hours?,careerguidance,"Im a 22M 4 months into my (accounting) 9-5 job, which is actually more like an 8-6. Sometimes worse. I hate it. My SO is an overnight nurse who works 36 hours a week (3- 12 hour shifts), makes more, and sometimes even has 6 days in a row off. I’m so envious of her work life.

So, has anyone here left their 9-5 for something with less structure? I have no responsibilities outside of myself, so it’s not like kids are preventing me from doing this. I can’t stand sitting at my desk 10 hours, barely moving, and then doing it again 4 more times.",https://www.reddit.com/r/careerguidance/comments/eg3img/has_anyone_ditched_their_95_for_something_with/,178,"Try applying for some retail management positions. In many cases, shifts change weekly, flexible schedule and not wasting time. And if under commission you can make good money too. ",2019-12-27 00:26:34
158,hrptg7,False,Portugal (Europe),37,I have made a huge mistake and switched to a new company mid-pandemic. I hate it. What should I do?,careerguidance,"A few months ago I was contacted by a head hunter for a job with a much higher salary in a very prominente company, better benefits and lots of flexibility.  
At this point, I was employed for 2,5 years in a fairly good company, which had its problems, but I could deal with them. They didn't pay very well, though, but I had lots of flexibility, a great team and super interesting projects.  
At the same time I was contacted by this head hunter, I was going through the selection process to my dream job and I had made it until the last phase where it was just me or another person.    
So, I had 2 very good opportunities on the table: my dream job and the other job which was better. I decided it was safe to quit.  
As you may imagine, I was not selected for my dream job. So I was left with a very good job offer, which was ok for me. I took it and here I am, 2 months later.  
My mistake was that I was so convinced I was going to get the dream job that I didn't pay attention to the signs in my interactions with my current employer that this was bad, nor did I dedicate any effort to get to know a bit more of the company.   
This new company is absolutely the worst. They literally lied in the interviews about the company’s working culture, their stance about flexibility and even about some aspects of my contract.  
I got in the company in the middle of a HUGE crisis where I immediately took a ton of responsibility and I felt it would not be correct for my colleagues if I quit during my experience period and leave them with all of this by themselves. 2 of them are really great, one of them actually quit last week. The company has a huge turnover, as you can imagine.  
I am finding out more and more horrific things about this company every day. My boss is a hypocrite, liar, has no empathy, treats women poorly, and everything revolves around him and how brilliant he is. Overall a sick narcissist. Last year alone, 2 people had burnouts and 1 had a stroke after working 4 days without sleeping.  
I worked 2 national holidays and 1 full weekend, plus a million extra hours for an event, which I would not do in a normal situation, but everything was very badly managed and if I didn’t, nothing would work. The day after the event I was told we could take one day off (which is not enough either way), so I took it, but apparently it just meant that instead of arriving at 9:30 I could arrive at 10:00. And this is not even a joke or me exaggerating.  
I’m not going to rant anymore, but many other very horrible things have happened and I honestly don’t know what to do. There should be an economic crisis coming up and I’m not sure I can just quit without anything lined-up. I don’t want to be unemployed when it hits. I have applied to 3 jobs so far that I’m waiting for an answer. 1 of them with people I know and who really appreciate my job, another one for a position that I’m 100% qualified, and another one that actually I will not take at all even if I’m selected because it is not very interesting. In addition, I have a volunteer project writing articles in my area for a think tank and I would like to take a programming bootcamp.  
I was absolutely naïve and I didn’t even make an effort to try to research about them, I know this is my fault. I never thought this was ever a possible scenario. But I just feel that coming here every day is doing a number on my mental health. I absolutely HATE being here and I’m actually scared that they can screw up my career if I stay longer. I’ve heard stories.  
Should I just quit? Should I suck it up and train my resilience skills?   
  
Edit: format",https://www.reddit.com/r/careerguidance/comments/hrptg7/i_have_made_a_huge_mistake_and_switched_to_a_new/,233,🤷🏻‍♂️ ,2020-07-15 15:38:24
