Num,ID,is_Original,Flair,num_comments,Title,Subreddit,Body,URL,Upvotes,Comments,creation_date
456,hmy8ts,False,,127,Should I take a COVID gap year?,college,"I'm entering a very small, liberal arts college in the fall. As of right now, my school plans on reopening in early September for in-person classes, with two weeks of online classes after Thanksgiving. Social-distancing will be in effect, which means most social gatherings and clubs (ie. theatre) will not occur. I'm scared that our school is going to go virtual mid-semester, meaning I will be paying for sub-par online classes. I'm equally scared about my social life. I'm usually a pretty reserved person.  I was hoping the social events at college would give me a push into new friendships. My school isn't even giving us roommates. I don't want to be so secluded that my already crappy mental health takes another plunge. That being said, I'm not sure if staying at home will be better or worse. I know all I will do is spend time with my family and work- I've even been offered a position as a supervisor at my job, as long as I'm still at home. My parents think that, since so many people are taking a gap year this year, I will have an advantage in the job market after college. This is probably true, but I also think it would be a bad idea to pay for an education that is not the experience I would otherwise have.

&#x200B;

I'm not sure what to do. There are pros and cons to both sides. Any advice?",https://www.reddit.com/r/college/comments/hmy8ts/should_i_take_a_covid_gap_year/,568,"Please help Michigan State University to decrease tuition due to online learning!!

[https://www.change.org/msutuitiondecrease](https://www.change.org/msutuitiondecrease) ",2020-07-07 16:51:42
409,atmh8q,False,USA,72,What to do when a professor refuses to accommodate student disabilities????,college,"I have a learning disability--I have a pretty severe stutter and an auditory processing disorder, so I go through my community college's Disability Center to get academic accommodations that allow me:

\*extra time on exams

\*a note-taker

\*recordings of lectures

\*reduced weight on public speaking assignments (because of the stutter)

&#x200B;

I have a professor who has completely refused to accommodate this. No extra time on exams because... Idk, she just likes making arbitrary rules. No note-takers because ""your notes should be your own"". No recordings of lectures because ""I don't want to be put on Youtube"". No reduced weight on public speaking because ""your professors at four-year universities won't cut you any slack"". 

&#x200B;

So, she's giving me Fs on everything. I have not been understanding things in class because I don't have note-taking assistance or recordings of the lectures to refer back to (if a professor is iffy on one, they usually allow the other and so I at least have ONE method of self-help). I filed an exam request at the Disabled Center anyway, and she wouldn't sign it, so I got a C- on the exam. I knew all the questions, I just felt so rushed, I couldn't do my best. And I've failed a public speaking assignment BECAUSE of my stutter. 

&#x200B;

I dropped the class, resulting in a W on my transcript. I'm kind of pissed because that W might hurt me when I go to transfer to a four-year university or apply for grad school. I have an appointment with my counselor at the Disabled Center next week, but is there anything I can do about that W? Should I file a grievance? I'm really lost.",https://www.reddit.com/r/college/comments/atmh8q/what_to_do_when_a_professor_refuses_to/,607,"Everyone says sue, but you don't need to. 

You can get the W removed from your record. Explain the circumstances. Tell them you want this professor educated on the importance of disability accommodations.  ",2019-02-22 20:35:55
872,5f6uub,False,,62,3 more weeks guys! We can do this!,college,,https://www.reddit.com/r/college/comments/5f6uub/3_more_weeks_guys_we_can_do_this/,270,"Four exams and two days more to go for me. I'm dying on the inside, three of those tests are for only one class. ",2016-11-27 19:01:43
816,24tfup,False,,23,Got this in a fortune cookie after bombing a final. I'm a physics major.,college,,http://i.imgur.com/NcsUK7R.jpg,294,I just recently made a C- on a Physics quiz... I had an A ,2014-05-05 23:18:27
519,dyli08,False,,195,Should I fail this class on purpose?,college,"No not actually fail! I’m currently sitting at a 74% in one of my science classes. I always come to class and sit in the front. I also am constantly asking and answering questions but I can’t do well on the exam no matter how much I study. All of my other grades are As which is why this breaks my heart to ask... At this point should I stop showing up for class so my grade can Drop to a D? At my school if you get a D you get the option to retake the class. I’m so stressed out and despite organizing study groups with classmates I’m doing poorly.

TLDR: if I get a D I can retake the class and possibly get a B the next time with a different professor (The first grade will be dropped)


Update: commonly asked questions
* Can you drop the class? - No it's too late
* Will the grade be curved? - Not according to the syllabus
* Its just a C! get over it - I can't accept anything lower than a B or it will tank my gpa
* How would getting a D help? - If I get a D I will be allowed to retake the class for a better grade
* Just accept the C. - I need a specific gpa for my graduate program which I can achieve if I retake this class and get a B
* it will just average out. - every university is different. my university drops the first grade and only counts the retake on the gpa

I have scheduled to talk to my advisor on Thursday, I will see my scholarship advisor tomorrow and my professor next week so no final decision has actually been made.",https://www.reddit.com/r/college/comments/dyli08/should_i_fail_this_class_on_purpose/,503,[deleted] ,2019-11-19 15:00:13
571,9rjqmv,False,,64,Maine will help you pay off your student loans if you move there. (news article),college,,https://www.cnn.com/2018/10/25/health/maine-student-loan-relief-trnd/index.html?no-st=1540551690,458,[deleted] ,2018-10-26 11:02:17
373,fbg3x4,False,,21,Groupmates kicked me out of the group last minute.,college,"I made a post about this earlier, but I wasn’t clear enough. So the three of us had to turn in two parts of the video, a research part, showing our research and the second part being the actual video. I did my fair share with research, and during the day it was due, we discussed. During the discussion, I asked “what can I do for the video?” Because to my knowledge, we’ve only done research. One guy said “I’m almost done with it already, I’ll send it to you guys to review and turn it in at 7:00pm” he never sent me the video to review, so i texted the other guy who is also waiting for it to review, because he promised to make a groupchat but didn’t so he is the only one I can text directly about the group, and he never responded. I was able to see it on the class playlist, and there it was, the name of the two other guys, and a third guy that wasn’t even in our group to my knowledge, so again, I text other guy who also didn’t help build the video, but still had his name in the video, because he was good friends with the guy who did the video. I don’t know if there’s anything I can do, on my first post, I was told to take the L, because to be fair, I could have been more proactive which makes sense, but any other advice is welcome.

Edit: he finally responded!!! The third guy that I didn’t know who it was, was me, he just got my name wrong!!!",https://www.reddit.com/r/college/comments/fbg3x4/groupmates_kicked_me_out_of_the_group_last_minute/,660,I was reading this thinking there’s no way college kids kicked you out of a group there’s gotta be a more logical reason for this. Glad it all worked out. ,2020-02-29 17:46:39
819,4tdgpm,False,,3,Found an old notebook. I apparently took very thorough notes during lectures.,college,,http://imgur.com/Dobobpw,296,Truly a historic document. ,2016-07-18 04:49:54
157,gel6nh,False,USA,647,what’s one thing that you wish you knew before college?,college,that’s it that’s the post.,https://www.reddit.com/r/college/comments/gel6nh/whats_one_thing_that_you_wish_you_knew_before/,1194,"First week is the only opportunity you have to make friends. After that, you’re fucked ",2020-05-06 14:37:21
495,9q7ox7,False,,78,Does anyone feel constantly overwhelmed ?,college,"I was curious if anyone is experiencing the same feeling as me. I am constantly overwhelmed with every task I receive. I look at a homework problem and I feel discouraged and roll my eyes. I don't know why I feel like this all the time. I was never this bad in highschool. to be fair my highschool didn't give out hard task. They were easy. 

Just wanted to know if this was a normal thing. thanks! ",https://www.reddit.com/r/college/comments/9q7ox7/does_anyone_feel_constantly_overwhelmed/,534,nah im smashing it ,2018-10-21 22:12:12
709,hr3h0p,False,USA,67,Is it bad if I don’t talk to my advisor much as a Freshman?,college,"I’m a Freshman at a community college. Since going online, it has been hard to get ahold of advisors. For example, I will send an email out saying I need something. Then I won’t receive a response back until a week or more later. Because of this, I have avoided talking to my advisor. For scheduling, I have looked at this thing called a degree plan in my student portal. This tells me everything I need to graduate. This has helped me plan out my four semesters so far. I’m also going to reach out to the university I want to transfer to and ask them all of the courses I need. Because of this, I don’t really see the need to go to them. Is this a bad idea?",https://www.reddit.com/r/college/comments/hr3h0p/is_it_bad_if_i_dont_talk_to_my_advisor_much_as_a/,358,School advisors are useless and usually give out terrible information. Because of them I wasn’t able to get coop because they gave me wrong info. ,2020-07-14 15:23:08
590,dxedxw,False,,107,How to deal with weed-smoking roommates if you're a wimp?,college,"I have recently moved into a shared apartment with a couple who smoke weed on a daily basis. Upon viewing the apartment, they informed me about it and made a whole fuss about downplaying it, telling me ""ooh its only a little bit and at night, to sleep better"". I don't smoke weed, tobacco or anything else, don't drink or do drugs, but I agreed to this because they generally seemed nice and, as a foreign student, I didn't have many other options. I also get my own room so I figured I'd always have some smoke-free space behind the door if I needed.

One and a half months after moving in, I can say that, even if I don't really know what is considered ""a little bit"" among smokers, it's pretty much frustrating to me; they don't mind doing it in the shared space, during any part of the day if they feel like it, or if they have some friends over (of which I am almost never informed in advance). They also light up these aromatic sticks and do not seem to think that these strong smells could be a bad thing for anyone in the vicinity. They almost never smoke in their room, and if they did, it wouldn't make much difference since it's not technically separated by a proper wall (it's like a big balcony over common area). Usually I think of myself as having a weak sense of smell, but this shit is messing with my work badly.

And yep, they were the ones who ""got there first"", they're locals and in any situation it would be 1 vs 2 fight. The obvious solution for me would be to leave, but I am locked into the contract for at least half a year. I have no idea how to bring the issue up. After all, technically, they warned me about it right away and I can see that they're trying very hard to act all sweet and nice. So far I just leave the common area immediately at any sign of smoke coming and stupidly hope they get the message.",https://www.reddit.com/r/college/comments/dxedxw/how_to_deal_with_weedsmoking_roommates_if_youre_a/,439,"You may want to check your apartment contract and see if there is a no smoking/drugs policy. Then, you can tip off the managers of the apartment. ",2019-11-16 23:13:33
230,haue6p,False,,134,"I (19F) want to start investing. I know a little bit, but very much an amateur and would love advice from fellow college investors",college,"The title is pretty much says it all, but to expand, I really want to get a head start on this. They say start when you're young and I figured maybe it's time. 

My parents have no experience and no investments of their own and they will be retiring in 15 years or so. They are worried about how they will afford it or if they will even be able to. I struggled a lot financially growing up and have been low class nearly my entire life. I want to break that cycle. 

I have 2k in savings at the moment which I managed to save in just one year. This is the most money I've EVER had. I worked really hard for it and I'm looking to maybe investing some of it. But I have no clue where to really begin or if right now is a good time to get into the market. Any advice from any who is investing would be very appreciated!

Edit: thank you so much for the great advice everyone! I definitely think I'll hold on till I get more money saved up and during that time I will continue to educate myself so when I do start I'll have more knowledge.",https://www.reddit.com/r/college/comments/haue6p/i_19f_want_to_start_investing_i_know_a_little_bit/,892,"Ok, there are these things called “puts” and some other things called “calls”. Put 1k into calls on a stock you think will go up, and 1k into puts on a stock you think will go down. Or just put all of it into calls, because stocks don’t go down. Boom, you’re a millionaire. If you need more advice, hit up
 r/wallstreetbets ",2020-06-17 16:19:30
687,36riyw,False,,22,My transcript this semester is trying to shame me for my grades.,college,,http://i.imgur.com/SKwxJHJ.png?2,370,[deleted] ,2015-05-21 15:33:32
38,hfp354,False,,312,Do not ask your parents to contacts your professors. (College Success Tip),college,"I see people online occasionally talk about how they are an incoming freshman/sophomore in college and they provide a detailed explanation of how they plan to get their parents to “talk” with their professors. This is generally taken 
 negatively. Once you get into college, you are expected to handle difficult or potentially awkward confrontations yourself. If you are having trouble in a course it’s always best to take the initiative and schedule an appointment/send an email yourself.

EDIT: *Contact.",https://www.reddit.com/r/college/comments/hfp354/do_not_ask_your_parents_to_contacts_your/,2390,People still waste their time & money on college.. ? Why? ,2020-06-25 16:25:52
497,aio18u,False,,50,At the end of this semester I will be 54% done my Associate's degree 1 year 7 months in while working full time,college,"Just as the title says I started school in the fall of 2017 and have been taking 2 classes a semester with one winter and one summer class during those times. 

Before starting school I was on this and many other subreddits all the time to get an idea of how school was because I was nervous. Although my GPA is only a 2.9 at the moment I am proud of how far I've gotten and am happy with my progress considering I was a D and F student in highschool.

I'm a computer science major and I cannot wait to get my Associate's degree in CS (my school offers an A.S in computer science) and maybe find an entry job in the field while I work on my B.S!",https://www.reddit.com/r/college/comments/aio18u/at_the_end_of_this_semester_i_will_be_54_done_my/,531,"Good job, keep going! ",2019-01-22 15:41:59
257,agpb2s,False,,84,PSA to all students (specifically freshman),college,"STOP PACKING YOUR STUFF EARLY!

It's extremely rude to start shuffling papers, zipping up your bags, and chatting to your neighbor with 5-10 minutes left of class while the prof is still talking. Especially when it's a big lecture hall, it's very hard to hear for students around you.

I say specifically freshman because I'm in 3rd year and people still do it in my programs, but it's the odd couple first year classes I have that are the worst.

Just wait till the end of class. If you are really in a hurry then arrange yourself so that when the prof is finished speaking, it's easy to pack your things and leave.

Edit: If you must leave early to not be late for your next class then so be it. But have some sort of exit strategy, keep your bag unzipped till you leave the classroom, sit as close to a door as possible, generally don't make a ruckus. My post was more aimed at the cumulative effect of the whole class who think packing up and chatting before the prof is finished is acceptable. The odd few people who must leave early can very well do so in manner that doesn't disrupt anyone and that is totally fine.",https://www.reddit.com/r/college/comments/agpb2s/psa_to_all_students_specifically_freshman/,849,"I’m paying 10k a year, I’ll stack my papers if I want to.  ",2019-01-16 20:20:57
307,g0m7v6,False,,112,What are the benefits on moving out of your parents home in college?,college,"My family is arab, and most arab families sometimes make their college kids stay with them until they finish college or until they get married. My family is okay with me moving out of the house but what are the benefits with moving out during college with housemates? 

Is it worth the $700+ rent, while most of us college students are working paycheck to paycheck?",https://www.reddit.com/r/college/comments/g0m7v6/what_are_the_benefits_on_moving_out_of_your/,781,"I’m gonna be blunt, bringing women over and being as loud as I want to. Walking around swinging in the breeze. I can bring over people when I wish it’s fucking great. 


That being said my parents were always the “free roam” kind. They were never on me just had general guidelines that were very acceptable. I get on great with my dad so it’s almost no different other than I can bring home booty calls. 🤷 ",2020-04-13 16:24:09
220,hmgpmc,False,,148,IMPORTANT NEWS for All International Students in the US,college,"If you want to continue your studies in the US with a valid visa status, you need to meet these new rules! As an international student myself, this is a big announcement that everyone needs to read!   
[https://www.ice.gov/news/releases/sevp-modifies-temporary-exemptions-nonimmigrant-students-taking-online-courses-during](https://www.ice.gov/news/releases/sevp-modifies-temporary-exemptions-nonimmigrant-students-taking-online-courses-during)

TLDR: You cannot remain in the US if all the classes you are taking are online in the Fall.",https://www.reddit.com/r/college/comments/hmgpmc/important_news_for_all_international_students_in/,916,[removed] ,2020-07-06 21:16:20
735,c9lyml,False,,21,The school I was set to transfer to this fall canceled my offer of admission,college,"As mentioned in the title, I was finally going to transfer to a four year this fall after spending 3 years at a CC in California. If you guys aren't familiar with how CC to four year transfer works, you need to have completed a minimum of 60 IGETC units to be able to transfer.

Spring 2019 was supposed to be my last semester, however something really bad happened to me during the last two weeks of classes. I was sent to the ER with really bad pains in my feet and hands, turns out I was diagnosed with a highly contagious disease and prevented me from going anywhere. Because of this I reached out to all my professors right away to make arrangements on what I could do in regards to me being unable to set foot on campus to take my finals. Luckily I was was able to work something out with 2 out of 3 of my professors and passed both of those. However, my bio professor never got back to me, even after countless emails and phone calls to his office. Long story short: he gave me an F and I was scared shitless so I reached out to my new college ASAP.

&#x200B;

I informed them about the whole situation and asked what I needed to do so that my admission offer would stay in tact. The told me to contact them right away with unofficial transcripts and a letter of explanation. I explained the whole situation with the medical problem and unresponsive professor. Even after all that they said because of the missing credits from the bio class, they have to cancel my offer of admission. Ever since then I've honestly been really down and can feel my depression coming back despite my efforts of staying positive.

&#x200B;

So I reached out to the dean of natural sciences at my CC and basically snitched on my professor for not responding to students and for giving me an inaccurate grade because of my medical situation. An administrative assistant got back to me and informed me that because of the 4th of July they won't get back to me until Monday but she told me that she informed the dean right away to get a hold of this professor to see if they could change the status of the class to incomplete or get a grade change for me.

&#x200B;

Now my question is, has this happened to anyone before? If so what happened in your situation? If I got a grade change and contacted the university, could they reinstate my offer of admission? Because I honestly don't want to wait another year and reapply to universities all over again. As a first-gen, my family is all really psyched for me to be finally going to a university and so am I. But if I don't end up going to university this fall, I'll have to wait a whole year and I really don't want to waste anymore time. Please offer my any advice, because I'm deadass terrified.

&#x200B;

Edit: Professor never responded, dean & department sided with him. I am now waiting a whole year to be able to transfer, thanks to this stupid professor. I am also forced to retake Bio in the fall because no grade change. Thanks for everyone who responded though, I tried everything you guys told me to!",https://www.reddit.com/r/college/comments/c9lyml/the_school_i_was_set_to_transfer_to_this_fall/,336,I would get a lawyer and file a lawsuit ,2019-07-05 22:12:17
482,eazam2,False,,103,I can't study anymore I feel so disconnected from university and my courses and I'm afraid to fail. Help,college," I have 18 credit hours this semester and in this point I'm not studying anymore and getting worst results in second exams than first exams and I'm worried that I'm gonna fail a course which worries me a lot. This is my 4th year in engineering and I feel lost, I need guidance but I'm not finding it and I've been like this from the start.
Anyone can relate to this? How can I improve myself? Thanks in advance!",https://www.reddit.com/r/college/comments/eazam2/i_cant_study_anymore_i_feel_so_disconnected_from/,542,Just study ,2019-12-15 14:05:06
714,dk2nvl,False,Europe,43,How to get rid of test anxiety?,college,"Basically, I’m having a lot of test anxiety... it feels like I’m looking to the test so close that I can’t and I don’t understand what I’m doing. 
How can I get rid of this bull crap of anxiety, it ruins my intelligence and I can’t think properly. 
Help! Do I make a lot of practice tests with timers???",https://www.reddit.com/r/college/comments/dk2nvl/how_to_get_rid_of_test_anxiety/,350,marijuana ,2019-10-19 11:43:23
273,ekfbwy,False,,79,Should I tell my professor I'm homeless?,college,"I'm taking a winter class online to boost my GPA so I can graduate. I am completely homeless and am working whatever jobs I can find while taking this class. All my savings were used to pay for class(in fall). I am wondering if it is a good idea to tell the professor my situation?

Edit: He didn't respond or seem to care.",https://www.reddit.com/r/college/comments/ekfbwy/should_i_tell_my_professor_im_homeless/,829,"In general, you do not want to tell people you're homeless just to elicit sympathy.

If you have specific needs, then you might want to discuss it with your professor. For example, let's say your professor normally assigns homework Tuesday evening and expects it done Wednesday morning. You could go to them and explain that your only access to computers is during daylight hours at the library, so the schedule doesn't work for you - for example, if you could get the homework early, you'd be willing to turn it early.

However, 'homelessness' isn't really a disability he can accommodate. While homelessness does cause stress, it doesn't inherently interfere with your studies. Indeed, a fair number of homeless people specifically go back to school because it's something useful they can do to reconnect into society while still being homeless.

Also, you mentioned using your savings. If you're homeless, you should also certainly qualify for Pell Grants and subsidized loans. While this can impose certain requirements on the rate at which you take classes, you should maximize your use of these sources before you raid your other funds. ",2020-01-05 16:41:08
