Num,ID,is_Original,Flair,num_comments,Title,Subreddit,Body,URL,Upvotes,Comments,creation_date
520,apgw7k,False,,121,Is it true that you shouldn’t room with a friend?,college,I’m a senior in high school this year and I met this dude we’ll call Matt. He’s pretty cool and we’re pretty much each other’s best friends at our school. We’re planning on both going to Texas tech and rooming together. However my parents said this is a bad idea and we would get tired of one another. Is this true?,https://www.reddit.com/r/college/comments/apgw7k/is_it_true_that_you_shouldnt_room_with_a_friend/,502,Roomed with a friend and we both loved it. Not trying to be misogynistic but almost every pair of female best friends that roomed together my freshman year hated each other or moved out by the end of the first year. Definitely can happen for guys too though  ,2019-02-11 14:41:42
55,gs87ss,False,,136,"The idea of a ""senior gift"" is so absurd",college,"The first time I got approached about it (pre-covid on campus) I thought they were giving *us* some kind of token gift for finally graduating... but no, they suggest that you give $50+ more to this place where I had to take out tens of thousands of loans and pay about as much directly to them over the last 4-6 years? Is this common or is it just my school that has the gall to ask for this?",https://www.reddit.com/r/college/comments/gs87ss/the_idea_of_a_senior_gift_is_so_absurd/,1877,"I mean it costs more to run a college than we realize. Most professors have PhDs and that’s 8 years of loans they need to pay off as well so they  need to make high salaries to make it worth it. Most big colleges have hundreds and hundreds of professors. Then they also have to pay people in dining services, dozens (and in my school probably hundreds since it’s so big and there are so many places to eat) and hundreds of people serving the food, and the hundreds of people cleaning it up. Then they have to pay for transportation, they have to pay for busses, bus drivers, gas, and any sort of repairs the buses may need. They have to pay an advising staff, administration staff, financial staff, dorming staff, they have to pay for hundreds of janitors to keep that huge campus clean. And labs are insanely expensive, the cost of the equipment alone for one lab can be in ten of thousands of dollars, and most schools have dozens of labs. They have to pay for property maintenance, keeping the grass cut, cleaning up the snow, removing garbage etc.. They also have to pay for computers and library stuff, and the SA gives money to clubs as well. Most schools have on campus pharmacies and doctors too for sick students which costs a lot of money to maintain. Universities are almost mini cities. It takes a lot to keep them running. ",2020-05-28 15:22:09
702,9wpvjm,False,,95,Dealing with arrogant people in a class,college,"Day 1 of Calculus 1 class. A few of us students are gathered around, talking about their previous experience in calculus. This kid walks into the room, and announces ""I got a 5 on the AP calculus BC exam. *I'm* only here for an easy A"". then proceeds to brag about how he got an A in honors physics in high school. 

Oh boy.

I sit next to this kid, because we both sit in the front row. He is *so* annoying. Every class, he's either:

\-  bragging about how easy he finds calculus (Prof: ""Ok this can be a tricky concept....."" Kid: ""I get it!! I think it's easy!!"")

\-making comments about how much he knows, etc. ("" I did something like this in honors physics!!"")

\- asking tangentially related questions to the syllabus

\- sucking up to the professor. Like, he told the professor, ""I'm going to change my major and become a math professor because you've inspired me so much"" then asked if he could help the professor grade papers.

\- brags about how little sleep he gets and how hard his workload is. He says he's taking 7 classes this semester, which I *know* is complete bullshit because the engineering department wouldn't let you take 7 classes. 

  
Just.....how do I deal with him for the next month? I literally want to roll my eyes or tell him how arrogant he's being every time I see him. ",https://www.reddit.com/r/college/comments/9wpvjm/dealing_with_arrogant_people_in_a_class/,355,It sounds like a class populated by /r/The_Donald subscribers.  ,2018-11-13 15:13:57
87,fsyum9,False,Global,290,"Graduates from the 2008 Financial Crisis, what tips/advice can you offer to students who will be graduating soon?",college,,https://www.reddit.com/r/college/comments/fsyum9/graduates_from_the_2008_financial_crisis_what/,1545,"This isn't even as bad as 2008, relax. 2008 was so much more complex. ",2020-04-01 12:29:13
748,biaeb2,False,North America,65,"I got academically dismissed and now I don’t know what path to take,",college,"so you know how you can either be either a master at one thing OR good enough at a lot of things?

i’m [22F] the second one. i used to love that about myself because i could try so many things but now its kind of fucking me over. 

my parents were always very strict and on top of me about my grades. they paid for me to go to college a couple years, and i didn’t do so well. 

i was academically dismissed and basically wasted 2 years of college. my parents are still so disappointed in me. 

a big reason i failed was because i kept changing majors and didn’t know what the hell i wanted to do. i still don’t know what i want to do.

i have spent all the time since then taking courses at a community college and bartending. 

i know the importance of getting a degree but i just feel like i’m not getting the hang of college and i never will. but i don’t want to disappoint my parents or myself. 

also, if i get back into the university i would have to pay loans and i don’t know if its even worth it anymore. 

here are the 4 career paths that i would be okay with. 

1. interior designer: i absolutely love and enjoy interior design, but its a very risky path to take. 
2. stand up comedian: my dream job since day 1, but not very realistic.
3. social psychologist: i am super interested in how/why people interact with each other. but i feel like i would never get a job. 
4. computer scientist: my parents dream job for me, which is understandable because of the salary. i am really good in all math courses but i don’t think i would enjoy coding for the rest of my life. 

what would you do if you were me? should i listen to my parents or should i follow a passion instead, even if its a risk?",https://www.reddit.com/r/college/comments/biaeb2/i_got_academically_dismissed_and_now_i_dont_know/,336,"Look at the department of labor website for interior design and social psychology. They are not good options. Stand up comedy does not get you paid until you make a name for yourself, even then you’re poor. Plus you can do that on the side. At least if you apply yourself and get your degree in computer science, you will have enough stability to go out and pursue other passions. You can find jobs all over the U.S. if you live there. ",2019-04-28 11:42:59
835,7r4lpw,False,,80,How many people actually love the academic aspect of college?,college,"At my school I feel like I'm the only one that loves going to class and learning. I even loved the academic side of High School. (Fuck the social aspect of HS) Of course I enjoy interacting with people and socializing, but I just love sitting in a classroom learning. I'm considering staying in school for my Masters and maybe even my PhD just because I enjoy it that much. The past 2 days classes have been canceled due to snow and since Monday was MLK day I've been out of school all week and it's been so boring! 

Does anyone feel the same way? 

",https://www.reddit.com/r/college/comments/7r4lpw/how_many_people_actually_love_the_academic_aspect/,282,"I hate it. I'm there just for the degree. I can't stand sitting down and having to read a book for hours on end. Or sitting through lectures. I need to do something with my hands! Like fixing parts or something. Plus, it's too expensive just to ""learn"" things. Plus, it's not learning, it's just memorizing facts from the book and putting them down on an exam on subjects you'll probably never use in your life and forget a few weeks after the semester. I'll ""learn"" when I have the money, settled down and actually find the time and desire to do it. Until then, I just need a job. However, I do enjoy language classes since we're usually practicing as we're being taught. ",2018-01-17 21:48:19
274,dkz20q,False,,77,How do y’all manage it,college,I was very productive the first few weeks until exams started popping in. Now I can’t focus after I finish each exam cause I’m getting burned out. Is there a way to manage this easier?,https://www.reddit.com/r/college/comments/dkz20q/how_do_yall_manage_it/,828,I’m in love with the coco ,2019-10-21 11:20:43
431,e17wk4,False,,44,Is it tacky to cite my fathers research?,college,"Basically I have a project and I am wondering if it would look weird or tacky to cite my fathers research. I have used plenty of different references in my project so far. My dad has a phd in the area I'm writing in, and he sent me some pdf files of some of the stuff he has written on the topic, and I feel like it would make my project better, but also make myself seem like I'm lazy or it's tacky.",https://www.reddit.com/r/college/comments/e17wk4/is_it_tacky_to_cite_my_fathers_research/,594,[deleted] ,2019-11-25 00:44:22
382,7j0jt8,False,,44,Good luck to everyone who has finals in less than 8 hours and is up on reddit instead of sleeping,college,Virtual fist bump from one person about to fail a final to another.,https://www.reddit.com/r/college/comments/7j0jt8/good_luck_to_everyone_who_has_finals_in_less_than/,643,Godspeed everyone!!! I hope everyone has an easy final and a nice well deserved vacay after. ,2017-12-11 06:48:44
398,diz8cv,False,,214,Would you rather 8am -3pm classes or 12-9pm,college,I’m currently doing 8-3 and my mental health has never been worse. I’m not a fucking morning person,https://www.reddit.com/r/college/comments/diz8cv/would_you_rather_8am_3pm_classes_or_129pm/,631,"I prefer morning classes, but here’s why. If I have something planned I will stress and obsess about it until it’s over with. For no reason, it’s just knowing that there is something I need to do that I have not yet done.

But whatever makes you happy! They offer afternoon and evening classes for a reason! Enjoy! ",2019-10-17 01:29:45
881,bt963b,False,Global,59,How do I convince a professor to let me keep the course?,college,"English isn’t my first language so please bear with me.

On Friday I took my final and then later on found out that the course was forcefully dropped. I studied very hard and so far all I’ve been getting is A+‘s. I talked to the professor today and he was very upset over my bad attendance and he wouldn’t listen to any excuses or apologies i would give. A lot of people got involved and i feel like that just made the situation worse. I’m going again tomorrow. How do I convince him to not make me repeat a course im very likely to get an A+ in? I literally cannot bear the idea of of all the hours ive spent studying going to waste.

P.s: I skip a lot because i have really bad mental health but in my country they don’t believe in that also yes, he does have the authority to not give me a W.",https://www.reddit.com/r/college/comments/bt963b/how_do_i_convince_a_professor_to_let_me_keep_the/,262,"Bear* is the word you're looking for unless you meant bare as in you were showing up for class naked. In which case you deserve to be dropped because that is crude and unbecoming.

EDIT: Well OP secretly fixed both bare's that were previously in his original post :( My joke will live on. ",2019-05-26 15:26:57
133,hirq4u,False,,104,"College students could be leaving up to $5,000 in coronavirus stimulus money on the table - as of late-April only 1% had actually been distributed, partially because students may have been unaware they were eligible.",college,,https://finance.yahoo.com/news/college-students-could-be-leaving-up-to-5000-in-coronavirus-stimulus-money-on-the-table-110808246.html,1274,Or most college students have 0 drive to do anything in late April except maybe study for finals ,2020-06-30 17:21:48
626,b0njj3,False,,74,I need your opinion on this roommate issue,college,"So it was 10pm and I jumped in the shower. When I came out less than 15 minutes later, all the lights were out including my desk lamp. I've never turned out all the lights on him, in fact, I've kept his on all night when he went out before. So I stumbled across the dark room and turned my lamp on so I could get ready for bed. Being frustrated that he turned my lamp off, I sat down for a while and started doing work on the computer for my class. he preceded to tell me to go to the library if i needed light. Keep in mind it was only 10:30 at this point. he yelled at me a bunch and even ignored me when I was talking. he is always loud when I am sleeping and I try to be quiet, but I guess i'm done trying to tip toe around. I'm always as considerate as can be while he has issues with that I guess. We usually turn the big light off around 10, but it's been later in the past when he's doing homework still or he takes a shower. he gets up before me most mornings and his desk lamps, plural, face right into my eyes, but i flip over and go back to sleep. I would understand him if it was later in the night, but it was 10:30. If he wouldn't have turned my lamp off, it wouldn't have been an issue. Petty, I know but it was my breaking point I guess. Oh, i just heard his phone go off, he never turns the ringer off at night, but I live with it because that's what you do as a roommate. You can't have everything your way. So what do you all think?",https://www.reddit.com/r/college/comments/b0njj3/i_need_your_opinion_on_this_roommate_issue/,419,It sounds like you guys are just getting tired of eachother. Find a new roommate! ,2019-03-13 15:51:36
514,g7st9j,False,,56,Tips on how to do well academically?,college,"I used to be really nerdy and on-the-ball with my academic life in high school, however things changed when I entered college because I have found a life outside just studying (boys, parties, beauty, fashion, an actual job etc), and I admit I am getting so carried away to the point where I’m neglecting my studies. I’m in my second year and I’m struggling to find motivation to do well. I didn’t do great last year so I really need to pick up the slack. I’ve gotten into a really bad habit of starting things last minute, for example I have an essay due in 3 days and I’ve barely started. Please help :(",https://www.reddit.com/r/college/comments/g7st9j/tips_on_how_to_do_well_academically/,508,"Take some time off.   Take a year to get it out of your system.  Get a job in campus, have fun.

Then get down to studying again. ",2020-04-25 12:35:53
411,al1d3c,False,,118,Am I the only one who can’t do online textbooks?,college,"If a textbook is heavily used in a particular class, I need to get myself a hard copy. I don’t know why, but online textbooks make it somehow harder to focus. Just me? ",https://www.reddit.com/r/college/comments/al1d3c/am_i_the_only_one_who_cant_do_online_textbooks/,607,I hated them until I got a surface pro then it turned into basically a book ,2019-01-29 15:55:54
731,ax5if6,False,USA,126,What are the essential skills for U.S. college students?,college,"I'm talking about skills similar to critical reading, diversity awareness which I can learn from a book, not those general stuff like time management, money, stress, etc. all over the internet (don't get me wrong, I know these are important skills, maybe, meh... I want something more ""tangible"" to entertain myself for the rest of senior year in high school).",https://www.reddit.com/r/college/comments/ax5if6/what_are_the_essential_skills_for_us_college/,339,"Learning how to deal with failure. In HS, a lot of people including me just kinda cruised, but there will be a times where no matter how hard you try, things just don't work out in college ",2019-03-04 10:05:11
517,dwse6l,False,USA,23,I was Publicly Humiliated by my Group Member,college,"I am part of an engineering program, first year, but not my first year in college. We had a project to create an arcade cabinet, this project was used to show us how to do minor programming, wiring, building, and using certain machines like a water jet. For this project I was in a group with J, T, and K. It started out well enough, eventually though, T left the program, leaving us to only have 3 group members in a project ment for 4. K and I worked together on the programming, and k helped J with the building. Once I was done with all of the electrical stuff, I also helped J with the building, but J kept complaining that he gets no help. When it came for the presentation at the end, we wrote a final document, and I wrote up most of the PowerPoint. J asked to finish the PowerPoint, and I knew I wasn't the best at PowerPoints so I figured it would be better for our grade. J decided to write in there that I did nothing, he did the whole project, and he berated me for not helping build the arcade cabinet in front of the entire class. I was so angry and betrayed that once our presentation was over, I just left class. 

What should I do? The professor told me that he should have never done that, and she wished she would have stopped our presentation. She said that J was going to be reprimanded, but I still feel horrible. Most of the class seemed to think it was funny, and were agreeing with him. I don't know if I can go back.",https://www.reddit.com/r/college/comments/dwse6l/i_was_publicly_humiliated_by_my_group_member/,508,[deleted] ,2019-11-15 15:35:37
340,bqyqzr,False,North America,144,Heelys as transportation?,college,"So I’m gonna be a freshman at a private school this year. I’m an athlete and the fields and the freshman dorms are literally on opposite sides, so I’m gonna have to walk 40ish minutes to practice everyday. I’m really considering buying heelys cause they were fun as fuck to ride and if I’m gonna get them im gonna get them in black. Just wondering if this is a good idea or am I stupid

Update: Yall I might just do it with all this gassing. Also my school does not have a shuttle, and if I actually do get heelys, I won’t be wearing them all the time. I would probably just switch out of them and put them in my bag lol",https://www.reddit.com/r/college/comments/bqyqzr/heelys_as_transportation/,715,"Just get a bike. 

I don't make fun of people to others, but I would  definitely think, ""That's kinda weird"" to myself. There was a girl that would literally skip to classes and, while I liked her confidence, I thought of her as 'weird.' And there are plenty of people meaner than I am who will probably record you and post it online. 

A bike or skateboard will do. I cannot picture a grown man or woman in Heelys. 

Sorry if I come off as a jerk. ",2019-05-20 17:44:16
724,b8mvma,False,,202,Is complimenting clothing weird?,college,"I was in the halls the other day and I noticed a really nice XXXTentacion sweater on a woman, which was quite rare, and costly. 
Being a fan of X, i decides to go out of my comfort zone and say how nice it is.

As I walked by, I said ""that's a dope sweater!"" Being the awkward individual I am.

The remark I got back was simply a look of distress and she just kind of started at the ground and didn't respond.

Was this a weird thing to do or was my remark not appropriate?!",https://www.reddit.com/r/college/comments/b8mvma/is_complimenting_clothing_weird/,342,[deleted] ,2019-04-02 18:19:48
212,7la86u,False,,75,"Decided to be one of ""those kids"" and asked for grade rounding. Looks like the college gods were on my side!",college,,https://i.redd.it/g7f6gjx3qa501.png,946,"I ask whenever I have a grade that I want to be slightly better. I don't care if the prof doesn't like it. It should never hurt to ask. And besides, everybody else is going to ask anyways. ",2017-12-21 15:44:15
856,7qww5t,False,,135,"Shared a textbook PDF with class, got reported by one of the students. What should I do?",college,"Found the newest edition of the textbook a week into class, after sharing it I got an email from the prof saying one of the students reported me for sending copyrighted textbook or some shit (maybe because they already bought the $150 textbook??). Will I get in trouble/fined? ",https://www.reddit.com/r/college/comments/7qww5t/shared_a_textbook_pdf_with_class_got_reported_by/,271,"Don't confess. Say ""What're you talking about? I never shared anything with anyone."" ",2018-01-17 00:08:55
80,a09q25,False,,179,Does anyone else get discouraged when people who cheat on everything and learn nothing make better grades than those who put the work in?,college,"I know I am furious about it. I used to never care if people cheated, but a classmate made a comment that sent me over the edge. I should mention I am nervous as hell this time of year because I need to maintain my GPA to stay eligible for classes. So I take my grades super seriously lately. 

But there are a few people who blatantly cheat on everything and never learned a single thing all semester except how to say 'no comprendo' to every single question (I'm talking about a Spanish class) and then laugh about it with their group. Those guys also all have A's. 

One guy mentioned to me that he bets I have a high grade if he can get a 90% for the class. I was instantly furious because my average is less than a 80 even though I bend over backwards for that class and need the B to stay in school. 

Is it normal for people to get discouraged like that? You freak out over this class yet someone else barely remembers they're in it and they are the one with the better grade. I'm really not sure how to feel or if I should bring it up with the professor. ",https://www.reddit.com/r/college/comments/a09q25/does_anyone_else_get_discouraged_when_people_who/,1585,"Why don’t you do both? 

I will admit I have cheated before because I knew it would get my grade up compared to what I would get if I did it normally. You can do both though, cheat for the final answers but try to learn as you go on. Just get the correct hw answers. ",2018-11-25 16:18:38
717,5snm55,False,,66,San Francisco will be first in nation to make city college free,college,,http://abc7news.com/education/san-francisco-will-be-first-in-nation-to-make-city-college-free/1740415/,350,FANTASTIC. JUST AS I'M IN MY LAST SEMESTER  ,2017-02-07 19:43:51
