Num,ID,is_Original,Flair,num_comments,Title,Subreddit,Body,URL,Upvotes,Comments,creation_date
285,f2jvyo,False,USA,39,Would it be ok to give my professor new markers?,college,"She teaches Stat and absolutely the best professor I've ever had. Teaches with enthusiasm, explains things very well, and she also cares a lot. 

She always uses the classroom's markers which are pretty shitty, so she ends up throwing at least one out every class. 

Some classes ago I joked with her saying she needed her own markers, she had a good laugh and said she agreed with me. She still didn't get markers. 

My mom is also a Prof and she has a lot of markers still inside their boxes, and I was thinking of offering her one of those.

Would this be inappropriate?",https://www.reddit.com/r/college/comments/f2jvyo/would_it_be_ok_to_give_my_professor_new_markers/,810,"Buy a box of 4 markers, put a stick-on xmas bow on it, and leave it on her desk before class one morning. ",2020-02-12 02:30:10
650,c3sz2o,False,,89,"People who had really strict/controlling/helicopter parents, What was your first year of college away from home like?",college,,https://www.reddit.com/r/college/comments/c3sz2o/people_who_had_really_strictcontrollinghelicopter/,398,getting all Cs & Ds lol they were not lying about that shit. but now ive found a healthy balance ,2019-06-22 18:17:03
236,gxp2fs,False,,118,Is there any point for me to try to continue college with a 0.80 GPA? Is there even any possibility?,college,"To put it simply, my college career is completely screwed up. Over the last four years, I’ve taken four semesters of college (2 semesters in physical classes and a 2 semesters of online classes). Somehow, for no good reason other than lack of interest/drive to do the work, I’ve managed to fail nearly every single class I have attempted. At it’s lowest, my gpa was a 0.39. I took 3 classes online last summer in which I managed to achieve 2 Bs and an F. That brought my GPA up to 0.80 and I haven’t given it another run since. 

This is a very different picture than my academic profile in high school: 3.8 GPA, highest SAT score, National Merit Scholar, etc. Needless to say, I lost any and all scholarships I had.

I wish I had a better reason for why I’ve done so horribly in college. My father died shortly after I graduated high school, so I used that as an excuse in the mandatory meetings I had to have with advisors due to being on academic probation. But while that was definitely a very sad experience, I can’t honestly say I felt any depression or sadness that was impacting my desire to do school work.

The only real reason is that I have been spending my time working on other things, but I know this isn’t a solid justification as I know plenty of people who have excelled in college while working on other business and/or creative ventures on the side.

Now, as I watch all the people from my high school class graduating and getting their degrees, I can’t help but wonder if I should give another pass at this or throw in the towel. I haven’t officially thought of myself as a “college dropout” yet, but I also don’t have any concrete plans of returning.

Currently, I’m running a small video production company, learning a few instruments and DAW software in hopes of finding success (and skill lol) as a musician, and studying/practicing screenwriting with aspirations to write for (and one day create/executive produce) television shows. 

While I like to think I’m confident that I can realize my dreams without college, there are times where I can’t help but wonder if I need to give it another shot, just in case. I also feel like I’ve been socially cut off from people in my age group these last few years and worry that it’s negatively impacting my ability to make social connections that could be beneficial in my fields of interest. I’m an introvert so it can be difficult for me to actively place myself in social situations at times. College seems like a bit of an easier way to accomplish this. 

But then I think about how much of a waste of money and potentially time it could be and go back to square one.

I’m not sure what the point of this post is, I guess I just felt like ranting but also would be interested to hear other people’s perspective on if it is even worth trying to go back with my GPA where it is. If you actually read all of this I appreciate you!!

TL;DR: College GPA after 4 semesters is a 0.8. Is it even worth trying anymore?


Edit: WOW, this in-my-feelings rant got way more attention than I expected! I appreciate all of the responses, advice, words of inspiration, and reality checks. 

To everyone who suggested I pick up a trade - luckily I’ve managed to make a decently lucrative gig out of the video production thing so far. Had a full time job as video production specialist (ironically for a school district) for a couple of years that I recently quit in favor of doing my production company full time, so I’ve been fortunate enough to at least have that for the time being as an income source while I work on my other passions. 

If I went back to college now, it would likely be the same story. I will focus these next few years on trying on putting my time, money, and energy into the things I’m truly committed to and reassess college a few years down the line. Thank you Reddit!!",https://www.reddit.com/r/college/comments/gxp2fs/is_there_any_point_for_me_to_try_to_continue/,883,[deleted] ,2020-06-06 11:09:09
199,fkkrns,False,,121,"With many colleges cancelling all on campus activities, kicking kids out of the dorms, and moving to completely online for the semester...should they be required to refund money for these now cancelled programs and fees?",college,,https://www.reddit.com/r/college/comments/fkkrns/with_many_colleges_cancelling_all_on_campus/,995,"adults\*

if you are over 18 you are no longer a child (just a little sidenote because scholarships and FAFSA tend not to get this concept)

but yes they should ",2020-03-18 06:01:20
518,dhr3ls,False,,112,Struggling to wake up on time,college,"I’m a freshman and have a 9:30am class, I know it’s not that early but on Monday’s I’ve had a hard time getting up.  I’ve missed class twice and can’t afford to miss another.

What’s a good way to ensure I wake up on time instead of sleeping through?",https://www.reddit.com/r/college/comments/dhr3ls/struggling_to_wake_up_on_time/,505,maybe just stay up? ,2019-10-14 14:11:18
167,goo7cm,False,USA,56,A Note From Your University About Its Plans for Next Semester,college,,https://www.mcsweeneys.net/articles/a-note-from-your-university-about-its-plans-for-next-semester,1163,Higher education is a shit show with no respect for students. Thanks liberals. ,2020-05-22 17:53:07
471,dengsv,False,,64,Failing my classes and confused about my major/future,college,"I am currently a second year student at a California community college. I began as an environmental studies BA hoping to transfer to a UC in 2 years. I aced all my classes my first year, falling in the top 10%, taking a few humanities, Bio, Calc 1, and English. Now my second year comes along and I want to switch my major to something more science based since I was never interested in the career opportunities associated with the BA in the first place. I see a counselor and he tells me I will need to take a bunch of sciency courses this year in order to transfer next fall.

So this year I am in Environmental Science, supposed to apply to transfer, and have a course load of Physics, Chemistry, and Calculus 2.  After failing a couple tests and quizzes, I came to the realization that I never had a science brain to begin with. I don’t enjoy nor excel at solving science problems and I have no idea what I’m doing with myself. The idea of studying and saving the natural world just appealed to me. But I have no motivation to study forces, integrals, and orbitals. I enjoy learning about the world from a more holistic perspective. 

I don’t know what to do. I would like to withdraw from all my classes, get a job and come back next semester to take an easier course load but at least knowing what I want to do. But that’s my parents’ money. I’m so scared and confused and stressed. My parents keep telling me to just finish off this semester but I know I won’t do well at all. I need at least a C in my classes to fulfill UC requirements which I don’t think I can do. Any advice will help, I’m extremely stressed right now.

Edit: Thank you for all the thorough replies! I’m going to see a counselor and will likely withdraw from physics and calc, stay in chem and find a job.",https://www.reddit.com/r/college/comments/dengsv/failing_my_classes_and_confused_about_my/,551,"Dont drop your classes. Grind it out as best you can. Go to tutoring, talk to your professors for help. Try to do whatever you can. Do some self reflection and ask yourself whether youre putting in enough work. 

I say this cuz i dropped my classes and quit school. I did come back but it was VERY hard. A LOT of people dont come back after they drop out. I would do this as a very last resort or you know yourself well enough that in the future you will come back 200% and with a different mindset.

Edit* let me add that i know its a very stressful situation. I was in three semesters that i failed and dropped classes till i dropped out. I kept trying and trying but it didnt work out. I know all about the stress youre going through. Be honest with yourself because you will know whether youre giving 100% effort or not. If youre not giving 100% then its hard to justify it. If u feel like u gave it all and didnt work out then drop it and save your brain the stress and yourself the time. Good luck. Whatever choice you make will be the correct one. ",2019-10-07 18:24:43
391,durdp7,False,,98,"Too ""lazy"" to do work. Any suggestions? Please help.",college,"Recently, I've been unable to do any of the schoolwork, no matter how much I try to bring myself to do it. At first I looked at it as a sign of laziness and lack of discipline. I viewed the getdisciplined subreddit for some tips. However, when I start doing the work, it does not simply flow smooth for me as people simply suggest. This essentially happens for assignments that I find absolutely boring. They feel like such a terrible pain to do. So I immediately get distracted without any will to touch them. I've read that you have to learn to accept the pain now to be less stressed later on. However, this just doesn't go for me. Even fear, the biggest motivator, doesn't do it for me. The fear makes me stressed to the point of sweating, but it is hard to get myself to do work.   I know that such behavior during education often leads to struggling to survive working a minimum wage or even being homeless. I wish I could be the person who could work 16 hours a day, achieving their goals and dreams. Any suggestions on how to get out of this terrible mental state?",https://www.reddit.com/r/college/comments/durdp7/too_lazy_to_do_work_any_suggestions_please_help/,630,See if your college has a Marxism club! ,2019-11-11 11:54:14
0,7ggf3v,False,,125,Professor learned my mom died 6 months ago and wrote me this letter. The last 2 sentences... I'm crying,college,,https://i.redd.it/qazxzy5k5z001.jpg,7718,[removed] ,2017-11-29 20:31:26
587,9nwzjg,False,,35,Professor is accusing me of cheating off another student I've never spoken to. Wtf do I do? Online class.,college,"

EDIT: 
The other student took my discussion board post and used it for their essay. I used my own post for the essay, just added fluff to it. This is why it got flagged as word for word. Hopefully he changes my grade, since I can't control what another student takes from discussion boards that are visible for all. 




----OP-----


I checked my grade on an essay yesterday, it was a 0 and had a comment from the professor ""did you cheat off of x or did x cheat off of you?"" I didn't recognize the name, so I replied asking what they meant, I only used one source for my work and it was the text book given, and I quoted every source. 

Then I looked through the students names and realized x is another student in the online class with me, I've never even replied to one of their comments on a discussion board. 

I emailed the professor again explaining that I don't know the student, and would like to see their work to compare. 

Professor replied with my essay and highlighted a part that was ""almost word for word"" from the other students. And said ""this is not a coincidence""

This guy obviously is not going to believe me, but I know the truth. The other student knows the truth. What can I do to get this figured out? I can't fail this class. I don't want to be accused of something I did not do, especially when it's plagiarism. 

",https://www.reddit.com/r/college/comments/9nwzjg/professor_is_accusing_me_of_cheating_off_another/,440,"Your best bet is to try to prove that it's your work, not the other students. Helping him to see that you posted this onto what I assume is a class discussion board before any of these essays were turned in will likely help your case.

In either case, the professor *should* have given you both zeroes if he/she was unable to determine who plagiarized. That's the fairest approach to this if they can't pin down who copied the other's work. It's basically in the school of ""either you copied person X or you helped person X cheat"", both of which could be considered violations of academic integrity.

Hope the prof. hears your argument and is willing to give you your points.  ",2018-10-13 20:29:51
745,g4zy7d,False,,54,"How did you get your parents to understand that online school is more work, not a free vacation?",college,"I'm a sophomore in college who, like so many of us, was kicked off my campus due to the pandemic and now all my classes are online. I'm a biology major taking 18 credits, as well as having my 2 on-campus jobs that can be done remotely, and participation in clubs and councils that is also remote now, so I find myself busier and more stressed than I was on campus. The issue is that my parents seem to think that me being home for the rest of the semester is a free vacation? They ask me to do chores every day (clean, walk dogs, make dinner, etc.) that I quite frankly don't have the time for and when I try to explain how busy I am, I get mocked. I'm not sure how to explain to them that my school schedule was built without having to do all of the extra time-consuming chores I do at home, so I won't be able to do everything that I can normally do until the semester is over. They're both essential employees and not home during the day, so I think they think I sit around all day doing nothing.

If anyone had similar troubles, how did you get your parents to realize that you're actually busy and not just exaggerating or pretending?? This is driving me insane, so thanks in advance!",https://www.reddit.com/r/college/comments/g4zy7d/how_did_you_get_your_parents_to_understand_that/,336,Walking the dog takes 15 minutes and can easily be done during a break. Making dinner less than an hour. Doing basic chores like cleaning and washing tables takes very little time. It’d be different if they asked you to do something that took a long time. Balance is very important ,2020-04-20 19:58:11
740,dx7nee,False,,16,Should I quit my on-campus job or not?,college,"I am seeking advice from peers, but I’ll keep it short and sweet; currently, I am  senior in school. I have two semesters on campus still after this one, so I will be around for a while. I started an on-campus office job this past August. While I have loved it for the most part, one specific manager has made me hate going into work every morning for the last two months. I have vast work experience (DCP, other jobs), and money isn’t an issue for me currently. 

The issue here is for future employment. I would like to either go into education when I graduate, or try my cards at a Disney Professional Internship. If I quit this job, I would spend the free time volunteering in my community, do more post-collegiate career research, and enjoy my last two semesters on campus. 

If you were in my position, would you stick with the campus job because it looks good on a resumé, or quit in a few weeks when this semester ends and try something else?",https://www.reddit.com/r/college/comments/dx7nee/should_i_quit_my_oncampus_job_or_not/,334,"> one specific manager has made me hate going into work

Why?  You'll have people like this throughout your entire career, you should learn how to deal with it, not just quit.

Identify the problem and address it, don't just run away from it.

What is the specific problem with the manager? ",2019-11-16 14:38:55
458,dy70cn,False,USA,25,I was publicly humiliated by my group member (update),college,"Original post

https://www.reddit.com/r/college/comments/dwse6l/i_was_publicly_humiliated_by_my_group_member/?utm_medium=android_app&utm_source=share

In class today, J apologised to the class, and our group. I still don't feel ready to forgive him, but I don't hold grudges. This is good enough for me to move forward, but I still feel hurt. I hope we can both move past this in the future.",https://www.reddit.com/r/college/comments/dy70cn/i_was_publicly_humiliated_by_my_group_member/,565,RemindMe! 2 hour ,2019-11-18 18:19:06
707,7diiib,False,,19,"Part of me is excited that winter break is almost here...the other part of me is screaming ""OH MY GOD FINALS. NO. NO. NO.""",college,,https://www.reddit.com/r/college/comments/7diiib/part_of_me_is_excited_that_winter_break_is_almost/,356,"Yeah... I feel that too but I'm the prof.

I get near the end of the term and I'm SUPER excited for a break, but............ HOLY SHIT THERE IS STILL SO MUCH LEFT TO GRADE.

I've been up until midnight the past 2 nights grading. I'm not done yet.  ",2017-11-17 05:04:26
850,92qjfg,False,,633,Back to School Megathread!,college,"As its the ~~beginning of August~~ start of back to school sales, it becomes that time of year where many people start preparing (and perhaps panicking) about moving to college. We expect a decent amount of people coming to our subreddit as college freshman unsure about many aspects of college. We create this thread every year as a resource for anyone to ask any questions they have about this upcoming college year- both for freshman and returning students.

In addition to asking your own questions we hope some of the previous questions will be useful in case you had similar concerns. Also for our more ""experienced"" college students- feel free to post any guides or resources for people that may be useful. Sidebar rules still apply so don't use it as an opportunity to spam your own website or blog.

Feel free to leave feedback about this megathread either in this thread as a comment or PM me if you wish.

----

**SCHEDULING QUESTIONS** 

Questions pertaining to ""rate my schedule"" or ""am I taking too many credits"" or similar for the upcoming semester should be posted in this thread. Automod has been set up to direct users here for scheduling help. Feel free to give general scheduling advice or answer specific personal questions people have about their schedules. Scheduling questions outside this thread will be removed to maintain high quality posts on the subreddit 

----

For your convenience here are some **useful threads or comments** that may be worth checking out before asking a question here. If I see any super helpful comments posted in this thread I will be adding them to this list. 

[What to Bring to your Dorm](https://www.reddit.com/r/college/comments/4xetni/what_to_bring_with_you_to_your_dorm/)

[College Majors Thread](https://www.reddit.com/r/college/comments/8q3vfr/college_majors_megathread/)

[What to do your first week on campus](https://www.reddit.com/r/college/comments/92qjfg/back_to_school_megathread/e37qtm5/)

[What would you do differently if you could start college over](https://www.reddit.com/r/college/comments/93xeva/what_would_you_do_differently_if_you_could_start/)

Good luck this upcoming semester!! 

",https://www.reddit.com/r/college/comments/92qjfg/back_to_school_megathread/,276,"Another semester of the worst fucking time on my whole life. Time to give as little of a shit as possible. People who say college is great are lying to themselves, full stop.

Just gotta stick to myself as much as possible. If anyone tries talking to me I'll just tell them to go fuck themselves so I can be alone. ",2018-07-28 23:40:06
539,ch8cg1,False,,139,"[19f] Assigned 3 male roommates for my student living apartment, any advice?",college,"So last night I received my roommate assignment for my student living apartment and I have 3 male roommates (presumably, one name could be female but it's unlikely). The email only gave me their first name and their phone number, so I can't look them up on Facebook. When I was living in a dorm I lived with a good female friend of mine, so having 3 complete strangers be my roommate is a little scary. Luckily I got my top choice of room and floor preference, and I have my own bathroom. We also each have deadbolts on our bedrooms doors in addition to the front door of the apartment.

If I call and ask to be switched to a new apartment with different roommates, it's likely I won't get the room or floor I want, which is really important to me. Because of this I think I want to stick it out and stay with these roommates, because at least I'll have a nice room to myself. And Im either in class or working most of the time, and I like to keep to myself, so they probably wouldn't see much of me anyway.

All this being said, do you guys have any advice as how-to make this living situation less awkward for both me and them? What should I expect from these guys? Anyone else have a similar experience, either as a guy or girl? I'm a bit nervous about the whole situation.

Update: Thanks for all the great advice everyone! I appreciate all your responses, I think we've reached the limit of new info everyone has to say. Thanks again!",https://www.reddit.com/r/college/comments/ch8cg1/19f_assigned_3_male_roommates_for_my_student/,485,"I would ask to get a new one... three guys one girl doesn’t sound safe... sexual assault, alcohol, feelings, or anything could complicate this.

How is this even allowed? ",2019-07-24 13:42:32
642,370euw,False,,53,"Just a reminder to all of the recent HS grads, this is a scam. Don't do it.",college,,http://imgur.com/7iStPEa,403,"Hey former Vector rep here. Absolutely not a scam, and a legitament business. The major difference between Vector and something like Vemma is that with Vector you sell the product and get commission. Vemma you get paid for advertising and recruitment. With vector, you directly sell Cutco Cutlery to the customer instead of having them in the store. 

Let's clear up some misconceptions:

1. You do not pay for your set anymore.  That practice stopped about 6ish years ago. When you paid for your set it was yours. Now the knives are yours and you can buy them from your manager if you'd like, return the set when you're done, or have your manager get charged for them

2. You make money via sales OR per demo. You make 15-18 per demo or commission,  whichever is more at the end of the week.

3. It's a great product with a great warrenty. That being said it is difficult to sell them, mainly because of sticker shock. Shits expensive, yo.

4. You don't get paid for training, but since you're an independent contractor so they don't have to. It's shitty but it's only a day or two but can be done online in a few hours (dont recomend). They do feed you during training which was cool

5. When you get through tier 1 and 2 of your recs, thats when it gets really hard. Tier 1 is friends/family. Tier 2 are their friends/family

I learned a lot about sales at Vector, but it's definetly not for everyone. If anyone has any questions, I'd be more than happy to answer them. I worked there from March 13-July 13. I stopped because i wasn't making enough money. But because I didn't make money doesn't mean it's a scam. It's sales, sometimes you make money, sometimes you dont.

Again, any questions let me know.  ",2015-05-23 18:24:44
