Num,ID,is_Original,Flair,num_comments,Title,Subreddit,Body,URL,Upvotes,Comments,creation_date
461,clwjd9,False,,40,Is it ethical/legal for a college to create a new required course 2 weeks before someone’s final semester before graduation begins?,college,"My college added an extra 1 credit course that will consist only of materials to take the college exit exam.  These materials used to be included in the coursework for the 3 credit Senior Seminar course, but the school has decided to split the two while keeping Senior Seminar at 3 credits and creating this new course for 1 credit. It’s great that they separated the two since they don’t really go together, but why not make Senior Seminar 2 credits then? I am affected negatively because I had the option to take a summer course for either 3, 4, 5, or 6 credits (for the same exact course, just different credit options) and I took 4 because that is the amount that I needed to reach 120 credits and graduate. Now I will be finishing with 121 which means that I spent an extra $400 on 1 extra credit I don’t need. I’ve spoken with the Assistant Dean and they basically told me good luck disputing this. Is this ethical/ legal? What are my options?

Thanks in advance.",https://www.reddit.com/r/college/comments/clwjd9/is_it_ethicallegal_for_a_college_to_create_a_new/,566,"You should have catalog rights,  which means you graduate based on the catalog (degree requirements) that were in effect when you started.

Read the fine print and see what your school's policy is on this. If it's a public/state school external policies may apply. ",2019-08-04 13:53:18
226,gft0ne,False,,261,13 minute finals,college,"Hey all. I seriously need feedback on this. For 2 of my classes with the same professor, our finals worth 40% of our grade will be online. 13 minutes, that's it. You don't get to see every single problem in one go - you can only see them as you take the exam (so you do question 1, then question 2, etc). So if you trip up on #1, you can't spend more time thinking. IDK how anyone can even \*think\* per question. There's 10 questions. They're multiple choice, true/false but half the questions are paragraphs long based on the midterm of the same format. (Not exaggerating, I saved the exam when I got my instant grade, and the ""10 questions"" were more than 3 pages single-spaced.) Prof. said finals is same thing so I'm going to be presumptuous and say we'll have paragraphs long questions on the 13-minute finals as well.

Is this even rational? When I took the midterm, I was 2 minutes in when my internet was \*\*\*\*\*\*\* up and then I lost 4 minutes to the exam. BAM, I failed the exam because I couldn't even get to question 5. How was I supposed to think through any of the questions when I have 4 minutes to do a bunch of other questions? The midterm average among 80 students was a 30/100. The professor \*graciously\* said our midterm can be worth nothing and our finals worth 40%, depending on how well we do. (Originally each was worth 20%.) Well, the finals is the same format, and I'm annoyed. I am more scared about my internet disconnecting than me not knowing the answer. I literally don't even want to start the exam because my internet hasn't been stable for the past 60 days, just like every other American. I can't even sit through a 50-minute Zoom without disconnecting every minute. What's up with this professor? I've raised this issue with her before, she either misinterpreted me or was a d\*\*\* and said, ""I can't just accommodate you or else I'll have to accommodate everyone else."" I'm baffled because I'm positive out of her 160 students total (in both classes), there's at least 50 of us going through hell.

Please let me know what you think - I'm seconds away from raising this to higher ups but I want some rationalization of why a final worth 40% with 10 questions only allows 13 minutes. If we could see all the questions at once, I would say it's a little bit ""better"" b/c we can do what we know and think about the hard ones last. But that's not the case. I don't even know how any of this is feasible when this reddit post absolutely undermines other factors of my life tht are f\*\*\*\*\* up such as having to be home 24/7 with an abusive family. This is ridiculous. Someone enlighten me. Let me know if you're confused on why I am complaining b/c I am thoroughly annoyed with my school and don't know how to write, talk, w/e. This is the 1,000,001th time I've complained in the last 60 days.

edit 5/19: thank you for everyone's comments! Wanted to say that I scored above the curve for both finals, so I should still be getting my A's at the end of all this. No - the 13 minutes never got changed. The finals did become 20% rather than 40% though. President, 2 deans, 4 chairs - nothing was done. I guess all of their brains think 13 minutes is right for a finals during a coronavirus pandemic. Absolutely outrageous but farewell to this pathetic school. I'm graduating, and I don't know this college.",https://www.reddit.com/r/college/comments/gft0ne/13_minute_finals/,900,"Just form a study group and all of you work as group during the test this way. All will score good and also, get better internet connection of possible. ",2020-05-08 13:15:18
676,87vabi,False,,34,Is it a long way away? Yes. But taking 15-18 credits each semester in a major I love will surely pay off,college,,https://i.redd.it/uwb9f14udko01.jpg,375,Oh to be naive again ,2018-03-28 20:30:20
602,f3txef,False,Global,95,Academic Dishonesty - Somewhat a cultural thing?,college,"This is inspired by a post from like 9 hours ago, in which some people voiced the opinion, that studying with the same test bank (which includes the answers) that the professor gets all their quiz and exam questions from, would be considered cheating/academic dishonesty.

I am very careful when it comes to plagiarism, checking everything a thousand times to make sure I cited everything correctly and didn't for some dumb reason forget a footnote somewhere. So, I would generally consider myself (academically) an honest person.


However, I've used exams from a prior year to help me study for upcoming exams (they're available through student unions), some of those were almost identical to those I had to take - which in two cases I had actually been given a heads up for by older students.

I had an oral exam and right after leaving the examination I jotted down all the questions I could remember having been asked and forwarded those to my friends who have to take the same exam (and to another girl who asked me to).

I had to take a test later than everyone else in class because of a stay abroad and a friend of mine send me an approximate overview of the questions in the test. Those were the same questions I got, two months later. I had, before going abroad, even offered my professor to take the test before I would leave and he responded that he'd rather have one person in class knowing all the questions beforehand than having everyone else know.

So, apparently in my country or at least at my university it seems pretty standard to profit off of other students sharing their knowledge and professors being too lazy to change up the questions. Even professors obviously know about it. It's not considered academically dishonest here.

Is it different for you in whatever country you're going to university? Would any/all of my examples be considered academically dishonest?

Btw: this is in Germany",https://www.reddit.com/r/college/comments/f3txef/academic_dishonesty_somewhat_a_cultural_thing/,431,It is. And it only hurts everyone so stop doing it you cheater mick cheater pants. ,2020-02-14 15:42:34
659,b2h43o,False,USA,6,Help my roommates are passed out drunk in the bathroom,college,What do I do lol. Do I try to like shoulder-carry them to their beds? What if they hit their heads. Or throw up. Do I leave them on the floor for the night? I also need to pee and ones lying next to the toilet,https://www.reddit.com/r/college/comments/b2h43o/help_my_roommates_are_passed_out_drunk_in_the/,390,So what did you do? ,2019-03-18 10:39:05
756,b42tjt,False,USA,46,How to Confront A Bad Roommate,college,"I really need some help. I have an awful roommate and I’m in tears writing this. I am very socially anxious and my roommate (shared bedroom) needs to have a lot more respect for me. I have no idea how to talk to her and I can’t go to an RA because I feel like she is gonna tell me to talk to her before I even mention anything to the RA. She never goes to class and doesn’t have a car or job so she is in the room 24/7 almost. She is not paying the school any money because FAFSA denied her since she failed last semester and is failing this one. It makes me so upset she is here. I am a nursing student and I work up to 35 hours a week as a nurse’s assistant. I have lots of late nights and early mornings and sometimes I do not sleep for over 24 hours because I work two part time jobs. My sleep is so important to me. She is constantly going in and out of the room from 10pm - 4 am. She has had multiple boys over in the room without warning me and I feel very uncomfortable because they come in at 2 am when I’m asleep and I get woken up by them. I often sleep in a nightshirt and I can’t even get up to go to the bathroom because I don’t want the guy to see my in my nightshirt, maybe I am just bashful I don’t know. She sleeps with the TV very loud on after I asked her to turn it down and I physically went over and turned it down because she’s not even watching it I thought she was asleep. She often leaves the door unlocked and does not take her keys and asks me to leave it unlocked. A few nights ago, in the middle of the night, a girl came into the room without knocking because my roommate had asked me to leave it unlocked and she was gone for over two hours. Her friend rummaged around looking for food. I cannot sleep here. I’m sorry if this post is a mess but I don’t know what to do. I feel as if she is not going to change and it’s not fair I’m paying to live here and I feel awkward and honestly a bit unsafe. I feel trapped and I want to start sleeping in my car. ",https://www.reddit.com/r/college/comments/b42tjt/how_to_confront_a_bad_roommate/,331,[removed] ,2019-03-22 09:07:53
165,edddyy,False,,149,My Professor played an EPIC prank on us for finals [Help],college,"My professor said several times the past couple weeks that we had four hours to take our final in a 400 level circuits class. Anyways come finals time today two hours in he walks up to me and says, ""the reaper cometh"" and starts collecting finals. Me and everyone else are like wtf because we thought we still had two hours left but he said he was 'joking'. Now all finals are scheduled in 2 hour slots but we all thought he was giving us extra time to be nice if we needed it. Not once before or during the final did he say we only had 2 hours instead of 4 and never warned us our time was almost up. This man has been teaching the course for years and is tenured, how the hell do you get this far as a professor acting so childish and unprofessional? 
Who can I contact to file a complaint about this, me along with several other people may have failed the course because of this.

tl;dr my professor said we had 4 hours for a final in a 2 hour time slot but collected finals after 2 hours saying he was joking. No one finished because we thought we had extra time. What should I do?",https://www.reddit.com/r/college/comments/edddyy/my_professor_played_an_epic_prank_on_us_for/,1167,This is good there is a lot of lazy people in college. ,2019-12-20 17:44:42
31,fk5nrz,False,Global,191,TIP for people using Zoom,college,Your teachers will know if you’re not on zoom. Like if you joined the meeting but are on a another app or website. They have timers next to each students name.,https://www.reddit.com/r/college/comments/fk5nrz/tip_for_people_using_zoom/,2766,I don't think so. How can they tell if you have two windows up on the screen at once? Doubt it. ,2020-03-17 13:55:59
8,e30jnd,False,,76,"My doodle entry for the new subreddit icon :) snoo did it, and so can you!",college,,https://i.redd.it/mvfr1l62ig141.jpg,4308,kinda looks like a nazi salute ngl ,2019-11-28 16:48:28
368,9dxpza,False,,267,What's the dumbest thing your college has wasted money on?,college,"My college just spent $50,000 on a reflexology path. Where you walk barefoot on a bunch of rocks because it supposedly has healing properties. Yes, the student government association allowed that to happen. And then everyone wonders why college gets so expensive and kids go into so much debt. ",https://www.reddit.com/r/college/comments/9dxpza/whats_the_dumbest_thing_your_college_has_wasted/,674,You see it on the front page every week or so.  ,2018-09-07 19:33:36
706,8cpbfj,False,,125,"Current college students, if someone were to send you a care package for finals week, what items would you love to receive?",college,"My niece is finishing up here freshman year as a nursing student and I want to send her the ultimate care package for her finals this year. 

Edit: wow, thank you guys so much for all the suggestions! I’m really excited to put this all together for her :)

As a side note, I’m only six years older than my niece so I haven’t been out of college that long myself, but wow I do not remember Adderall being such a thing in college! I actually take stimulants for ADD on a daily basis and for me, they just make me feel normal. Low key jealous of everyone who can use them to hyper-focus! ",https://www.reddit.com/r/college/comments/8cpbfj/current_college_students_if_someone_were_to_send/,355,Starbucks gift cards and put it in a travel tumbler mug thing ,2018-04-16 17:29:47
253,cxr1rr,False,,109,It’s been over two weeks and I still don’t know anyone at my school,college,"I haven’t made one friend yet. I feel so alone. I go to a “party school” and everyone else seems to have a ton of friends and go out a lot, and I’m alone in my dorm all the time. I want to have people to hang out with and talk to and have a good college experience but for some reason it just seems impossible. It’s like everyone else on campus already has friends and is out having fun tonight and I’m here, typing this. Even though I’m on a sports team none of my teammates talk to me and I’m definitely not close with any of them. I’m also busy for most of the day with work and classes so I probably can’t join any other clubs or anything, I’ll probably try to though. I feel judged all the time when I’m eating alone at the dining hall while everyone else is with a friend group or when I’m walking around campus alone or doing literally everything else alone. My family has already made fun of me for not having made any friends yet too. I’m scared I’m never going to make any friends and I’m just going to be a hermit for the rest of my life. What can I do? How do I stop being so alone?",https://www.reddit.com/r/college/comments/cxr1rr/its_been_over_two_weeks_and_i_still_dont_know/,862,It's too late ,2019-08-31 03:19:18
534,f88a5d,False,Global,86,Notes!!!!,college,"Hi. I just started college as a freshman. I want to take my studies seriously. I never really studied in high school because I would do very well regardless. I want to know how or when to take notes. I see that many take notes during lectures and others talk about taking notes at home. Should I be doing both meaning I'll be having two sets of notes or only take notes during class?

Thanks in advance😁",https://www.reddit.com/r/college/comments/f88a5d/notes/,485,If you are a business major notes are useless ,2020-02-23 11:24:28
281,az43sj,False,,129,Can I leave a note on the toilet stall wall telling a girl to go to the doctor or learn how to use a toilet?,college,"There’s a girl on my floor who completely destroys the toilet stalls. They’re always covered in her feces. The other day there was crap on the toilet seat itself and somehow on the wall behind it. I feel so bad for the custodian who has to clean it up. 

Would it be mean to put a note near the toilet next time it happens that’s says “Either go to the doctor or clean your crap up. It’s absolutely disgusting and immature that this keeps happening” ",https://www.reddit.com/r/college/comments/az43sj/can_i_leave_a_note_on_the_toilet_stall_wall/,816,[deleted] ,2019-03-09 14:39:02
184,hdsnil,False,,99,How do I come to terms with the fact that I’m mediocre at best?,college,"I’m a first year student and my hopes of ever achieving something are already dying, exam after exam. No matter how hard I try, I never do as good as others - from the people who put zero effort and cheat their way through uni just to get some degree, to the ones who are really into their studies. For example, I could spend weeks learning something I’m genuinely interested in, and my absolute best would be a 50%.

I know comparison kills, but almost everyone does it whether it’s in college, their job, or life in general. Sometimes it’s a good to see where you stand, keep yourself in touch with reality in a way. Everything just makes me feel extremely inadequate and incompetent in the field I’m supposed to be knowledgeable in.

How do you overcome that? I’m not by any means striving for perfection, I just can’t help but feel as if I’m not doing something right, and wish it didn’t bother me that much.


EDIT: I wrote this before bed and didn’t expect so many people to see it. I only replied to a few of you, cause I don’t really have anything to add except thank you so, so much! I’m reading & appreciating everything and I hope others who struggle with the same stuff go through the replies too. You’re all some wholesome people who really made me feel less alone im this and I wish you all the best in your studies or whatever you’re up to. Peace <3",https://www.reddit.com/r/college/comments/hdsnil/how_do_i_come_to_terms_with_the_fact_that_im/,1079,"Or you could stop being so self defeating, learn and get better. It's not that you're mediocre, you just aren't managing your time properly. All of those straight A students around you just learned what they needed to do faster, and their grades reflect that. 

Read how to become a straight A student by Cal Newport, get a gym membership, find a hobby, and get to work. Justifying your lack of success by telling yourself ""oh I'm just not good enough"" is a lazy cop out. 

Not trying to be a dick but that's the truth. ",2020-06-22 13:48:00
57,fwmun9,False,,244,Are your professors giving you more work than usual because of being online?,college,I'm seeing a lot of people say this so I'm wondering how many other people are experiencing it as well.,https://www.reddit.com/r/college/comments/fwmun9/are_your_professors_giving_you_more_work_than/,1850,Mine are giving less. ,2020-04-07 15:51:48
101,e3x7lt,False,,97,"A Small adivce I thought I'd share, helped me a lot",college,"if you have to write an essay, whatever is the required font size, start writing it on a smaller one. For me, the required right now is 12, and i'm writing at 9. The stress and the focus of writing will easily make you forget you made this change, and when you are absolutely desperate, on the cusp of the panic attacks that are a basic component of writing essays:  Select your whole text, and adjust the font size up. 

I just checked where my progress is actually at, and I'm legit almost crying from happiness. It's a great source of catharsis. Helped me finish a lot of essays without nervous breakdowns.",https://www.reddit.com/r/college/comments/e3x7lt/a_small_adivce_i_thought_id_share_helped_me_a_lot/,1470,Change punctuation size to a higher font. Near unnoticeable and spaces out words more ,2019-11-30 14:34:39
508,g91h7a,False,,236,Can I do 45-54 hour work weeks with full time college online?,college,"Currently working at a trade job that pays $26/hr, they aren’t willing to work around a college schedule and the hours fluctuate, sometimes I’ll work 8am-3pm, sometimes I’ll work 8am-11pm, you don’t know when you’re getting off until you’re getting off. 

Just give it to me straight, do I have to leave this job and take a lower paying part time job in order to do college full time? If so, I’ll do it for a better future, this job isn’t easy on my body and I’m not about to take 8 years to get my bachelor’s.",https://www.reddit.com/r/college/comments/g91h7a/can_i_do_4554_hour_work_weeks_with_full_time/,519,"I'm doing just about that right now. I work a full-time professional job and have been taking 12 credit hours every semester and another 4-10 credits over the summer for two years now. Here's what I can tell you:

1. Get into a rhythm. On Monday's I do this, on Tuesdays I do this, on Wednesdays.... Follow through on that rhythm. It's more important than you can understand. You do the project work on the weekend. If you want a day off (*good fucking luck*), know that you are going to have to schedule that in advance.

2. Let the stakeholders in your group projects (shudders) know what your availability is going to be. If you aren't reachable on a time or day, they need to know.

3. Keep your bosses/colleagues/professors informed. I got a free day off because I needed time to prepare a speech. Another professor excused me from a lab report because I had a stupid crazy shitty week at work and could only put together half the work required.

4. Your social life is going to *suffer*. Accept that. Job. School. Friends > pick two

I believe you can do it internet stranger. I did. ",2020-04-27 14:16:01
552,9vg1g1,False,,94,Crippling loneliness is ruining college for me.,college,"I am at a fairly large public school in Georgia, and have zero friends. Zero. I have people that I occasionally speak to, but I’d hardly consider them friends since we don’t ever speak outside of class. I’m totally, utterly, completely without someone to talk to.   I also have Asperger’s, which makes socialization doubly difficult. 
My grades are great, but it’s only because all I ever do is study. I’m transferring to another school next fall, out of state, and I really want to make some sort of turnaround when I get there. This can’t be what college is about. 
Is there anything I can do in the meantime to meet people like me, even if it’s online? I’m just so tired of having no one to talk to. It’s making me ornery and spiteful, which I know isn’t right. ",https://www.reddit.com/r/college/comments/9vg1g1/crippling_loneliness_is_ruining_college_for_me/,473,">	This can’t be what college is about.

What can't it be about? Working hard, and making good grades for your future? 

Contrary to the belief of some people, you don't get to college and you magically become friends with everyone (I don't know why people think that on this subreddit so often). If you're going to college to make friends, drop out now. It's cheaper to go to a bar or join a board game meet up.

College isn't about making friends or socializing. People who are into that do that stuff but the primary reason for going to college is to learn and prepare yourself for your future. ",2018-11-09 01:20:27
752,9b87bx,False,,50,Girlfriends professor asking to stay 45 minutes late for class.,college,My girlfriend went back to college this week for her second degree.  This is a biology class that meets twice a week 5:30-10:15pm.  She already has to get up at 6pm to be at work at 7:30.  The instructor has asked that the students stay an extra 45 minutes for each class for the semester.  Is this reasonable?  She is furious and upset.  Already on less than 6 hours of sleep this morning.,https://www.reddit.com/r/college/comments/9b87bx/girlfriends_professor_asking_to_stay_45_minutes/,334,my teacher never tell us to stay after for 45 minutes cause we got another class every class of mine is 1 hour for undergrad idk about graduate cause im not there yet. No class in my university is longer than 2 hours O\_o yours is 5 hours big waste of your life. ,2018-08-29 10:52:16
224,9sdj45,False,,84,Do you ever feel weird when you have more free time than usual?,college,"Just spent Friday evening up to this point on Monday morning relaxing. Is this abnormal to do?

EDIT: A flood of final projects and essays are coming for me this week :(
",https://www.reddit.com/r/college/comments/9sdj45/do_you_ever_feel_weird_when_you_have_more_free/,908,"Haha that’s me right now. I had work at 4:30am, I got out at 8:30, now I’m eating breakfast and relaxing and I don’t have class for two hours!!😁 ",2018-10-29 14:24:41
