Num,ID,is_Original,Flair,num_comments,Title,Subreddit,Body,URL,Upvotes,Comments,creation_date
1513,20mfmu,False,[advice],1,9 Things To Do In The First Week Of A New Job.,jobs,,http://www.businessinsider.com/9-things-to-do-in-the-first-week-of-a-new-job-2013-8,4,"It's weird that 9 specifically mentions finding your ""go-to"" pharmacy, sort of implying that absolutely everyone is medicated. ",2014-03-17 11:49:17
734,csfbrw,False,Unemployment,17,"What counts as an employment gap, and how damaging is it for a graduate?",jobs,"Since graduating last year I've tried to get a job that's relevant to my degree sector and failed miserably. All I've managed was a temporary minimum wage job for two months that was nothing to do with my degree. I have some relevant volunteering from my time at university and a bit since I finished, but that's it.

Will it harm my prospects at degree relevant jobs if I've still not got a job in the sector a year after graduating? At what point do I just give up?",https://www.reddit.com/r/jobs/comments/csfbrw/what_counts_as_an_employment_gap_and_how_damaging/,12,What's your major? ,2019-08-19 10:39:20
1741,hbnqy5,False,Recruiters,1,Site for resume fixing,jobs,Is there a site anyone knows of that can fix up my resume if I pay? I’m beginning to think my resume might be why I’m not landing interviews :(,https://www.reddit.com/r/jobs/comments/hbnqy5/site_for_resume_fixing/,2,First try r/resumes ,2020-06-18 21:46:11
1290,bsmbix,False,Onboarding,4,"Accepted public service job with the city, no word from HR yet",jobs,"Hi!

I accepted a job with the city on May 13th over the phone, and then was told that HR would be contacting me shortly afterwards. I followed up a few days after (the 15th?), and was told that they just finished signing the paperwork for my position. Person told me that I should receive correspondence from HR by the end of next week.

End of next week rolls around today, and still no e-mail from HR. I left the manager a voicemail, but I'm not expecting to hear back until next week because of the Memorial day weekend.

I am kind of a paranoid person, and am already thinking that the offer was probably withdrawn, however I understand that public service jobs probably go through an extensive process.

Any thoughts/personal experiences to share? Thanks!

TL;DR I accepted a job with the city over the phone almost 2 weeks ago, no word from HR yet despite follow ups with the department manager.",https://www.reddit.com/r/jobs/comments/bsmbix/accepted_public_service_job_with_the_city_no_word/,2,Be patient.  Governments can be slow. ,2019-05-24 21:09:17
297,bl1o99,False,Discipline,7,Toxic work environment situation. Is it my fault?,jobs,"I started my current job 2 years ago. From the beginning I noticed some cattiness amongst a few of my coworkers  and so had decided to take a stance of keeping a professional distance between myself and my coworkers so as to not get involved. I leave everything that is personal at the door in the morning. I do my job the best I can, collect my paycheck and go home. I make sure to smile and greet people and be cordial but otherwise keep to myself. 

In the early stages, I was able to be an unproblematic fly-on-the-wall, minding my own business, while those around me did their catty rants about each other. One coworker, let's call her ""Coworker A"", seemed particularly hostile to another coworker behind her back, referring to her as ""that bitch"" in a rant for going to management about an issue she had with Coworker A. I ignored it and got on with being respectful to both coworkers without picking sides.

One day, I had to go to Coworker A for some work materials that she dispenses to myself and my immediate team. Coworker A, asked about materials she had previously dispensed to me, and I said that was for [""that bitch""]. She became hostile and said ""it's not my fault you stupidly gave [materials to ""that bitch""], I don't have any more!""

I asked ""why is that stupid?"" 

She quickly backtracked, and said ""I never called you stupid!"" and went on a mini-rant about her suspicion that I will to go to management about her now (like [""that bitch""]) and "" you wear glasses and can't see"" (presumably the discord between coworker A and ""that bitch"".  I saw it, I just ignored it.)

After this incident I went to the manager after work for advice on how to deal with an unnamed coworker who seemed particularly hostile. Without naming Coworker A, they seemed to know exactly who I was talking about. They seemed sympathetic. They said they had several complaints about her but every time they confronted her about it, Coworker A denied it. They suggested I use my cell phone to record her next time, and call a meeting with management armed with that evidence. 

Over time coworker A's hostility toward me grew into mild bullying. She would tell me to perform my job differently from how I am used to performing it. I would politely decline and give reasons,  she would get upset and say ""everybody else does it [the way she told me to], you always have to be different"" etc. 

It escalated until one day she was ranting about me being ""stupid"" for not following her instructions on how to do my job. Mind you, she is not my superior, I don't report to her. The managers have no issue with how I do my job, and had Coworker A gone through the appropriate channels to express displeasure about the way I did my job, I'm certain the managers would have told her I was doing my job the correct way. But it wasnt about how I did my job, Coworker A  wanted to exert power over me and wanted to punish me for not being submissive enough. On this occasion, I was able to pull out my cell phone as she ranted about me in the other room and record her calling me stupid and making derogatory remarks about the somewhat prestigious high school I attended. She referred to me as ""weird"" etc. 

I did as the managers suggested and called a meeting. They asked me to describe the circumstances around the recording I made, asked me to write a report and I did. The managers agreed that the way I was doing my job was the appropriate way. I played them the recording and they heard clearly the verbal abuse from coworker A. Other coworkers were interviewed and the manager mentioned to me that at least one (not [""that bitch""]) corroborated that Coworker A is difficult to work with.

Shortly afterward, I was told that she was asked to apologise and she refused.

Thereafter. Nothing. Coworker A has since been a lot less overtly hostile toward me but she just ignores me and there is constant tension since I have to go to her for materials etc.  Months later, I asked the manager what was the outcome of my report and I was told that because I stopped short of sending the managers the actual recording, relinquishing control over its propagation, there was no proof they could take to the president and board of management to have disciplinary action taken against coworker A. So it's as if there is no evidence at all and nothing can be done, even though the managers heard it with their own ears. I was also told that the fact that Coworker A has a rapport with the president was also a factor.

I am left confused about what I could've done differently in this situation. Coworker A and [""that bitch""] now have seemingly repaired their work relationship since then and are cordial with each other,  while I am now Coworker A's number 1 enemy. Having an ""enemy"" at work is something I find slightly awkward and I wonder if there was something I should have done differently. I feel as though my biggest mistake was taking management's advice.",https://www.reddit.com/r/jobs/comments/bl1o99/toxic_work_environment_situation_is_it_my_fault/,10,"I'm sorry to hear you're going through this.  It appears to me you handled it the best you can for the most part.  What I would do differently is stop going to the manager from here on out.  You've stated your case, you've shown evidence, they've done nothing about it.  

Document everything.  Every word she says and every meeting thus far; every refusal to give you the equipment you need to do your job, etc.  It is very hard and it will feel like you're reliving it but it is so important to do this.  The reason for this is so that if this place decides they want you out and you can't find another job quickly, you have proof of what happened.  You can consider filing for unemployment, or suing if you find out you have legal grounds (unfortunately bullying still isn't illegal but if the harassment gets especially nasty or there is other evidence of legally-protected harassment/hostility such as racism, sexism, etc. you might end up having a case). 

If you end up out of a job or decide to leave, consider hiring a professional reference-checking company to see what they say about you (something I should've done) and have that conversation about what they plan on telling future employers about you so that you can be on the same page when job-hunting if you list the job in your history.  

In the meantime, when she tells you how to do your job, go ahead and tell her politely but firmly that you know how to do it.  Don't JADE (justify, argue, defend, explain).  She's not your boss.  Doing this with a toxic person just feeds the fire and oftentimes that's all they're really looking for is attention.  That said, it's a good idea to remember how dangerous people who have been honing their socially predatory skills since grade school can be.  Keep your distance, remain polite, do your job but definitely keep your distance.  I can't stress that enough.  Take the time to separate yourself from this stress outside of work and take care of yourself; sleep well, eat well and get enough exercise.  

Also if you're on Facebook there is a group called Workplace Dignity (they also have a blog) with people dealing with these issues in their lives.  

There are other pages on Facebook and also elsewhere online against workplace bullying such as the Workplace Violence Prevention Institute, Healthy Workplace Bill advocates in many states (I used to follow Massachusetts for example which posted many very informative articles and insight into workplace bullying).  I hope this helps! ",2019-05-05 19:09:13
1744,h9rkdd,False,Recruiters,2,How do I talk with a recruiter?,jobs,"Sorry if I sound dumb. Anyway, I have my linkedin set so it shows I am looking for a new job. A recruiter (with many mutual contacts) reached out to me and sent me a kind of vague message saying ""Let me know how I can help you!"". Is this a usual recruiter approach?

How do I respond that isn't ""Please give me new job."" Should I let them know what industry/field I am interested in or tell them my experience?",https://www.reddit.com/r/jobs/comments/h9rkdd/how_do_i_talk_with_a_recruiter/,1,"Is it someone from a recruiting firm, or internal HR person at a company?

Assuming a recruiting firm, remember how these people get paid.  The hiring company pays them a very large fee if they successfully find a candidate that they hire.  Some recruiters do a lot of fishing for candidates when they don't actually have many roles available, to expand their network and so that they have lots of candidates ready to go when a role does arise, that they can pick and choose from.

That said it's a good idea to maintain relationships with them.  They may or may not have good openings right now.  They are often eager to talk to you if you have some experience in the fields they focus on, so it's a little different than normal interviews, and it doesn't necessarily reflect their likelihood of finding you a job.

Just respond,
Hi, thank you for reaching out!  I'm looking for new opportunities right now and would love to connect.  If you know of any openings I'd be a good fit for, or if you would be open to having a short call to discuss my background in anticipation of future openings, please let me know.
Best regards,
Your name ",2020-06-15 23:31:29
2226,7akes5,False,Startups,7,CEO sounds like he's mentally ill.,jobs,"So i started a new job about 3 months ago with a startup that does sales for other tech companies. This isn't my field, so it's an entry level position with entry level pay. My boss said that health insurance is ""coming"" but haven't heard anything so far. We're about 20 employees. Anyways, last week my boss starts posting extremely bizarre shit on our skype account, saying that ""we're all slaves"" and to ""set ourselves free"" ""You know this"" and then says he has to go away for awhile, not sure when he'll be back. It's been a week and we're all wondering what the hell is going on. Anyways, the pay isn't great, i'm 28, and the commute is not the best to this job. Wondering if anyone has any advice on this situation. Our CEO seems like he's off his rocker though, legitimately sounds mentally ill. ",https://www.reddit.com/r/jobs/comments/7akes5/ceo_sounds_like_hes_mentally_ill/,5,Probably read the Communist Manifesto and had an epiphany ,2017-11-03 16:14:12
2113,b6987a,False,Layoffs,2,"I was Terminated/Laid Off my job, need advice",jobs,"I was recently let go from my job not due to performance but because the company said they are heading in a ""different direction.""

A little back story - Around December 2018, new ownership came in and started making a lot of changes, one of those changes were letting people go. My department was one of the first hit and there were obvious signs that my deparment would be reduced greatly. 

&#x200B;

Fast forward to March - I was brought in and was told that they are letting me go and said that they are moving in a different direction. I asked for what reason based on the direction of the company, why I would not be kept. They would not provide me any information. They would not give me any type of feedback as much as I probed. I have never had any discplinary action nor have I ever signed any type of Performance improvement plan prior to the meeting. 

I never spoke to HR as well. 

I am trying to figure the best way to let future employers know of my situation. I am just being upfront, giving them the whole story. 

I look at this sitation as being laid off due to downsizing but I know the company is going to say they fired me. 

Any advice or thoughts would be apprecaited. 

&#x200B;",https://www.reddit.com/r/jobs/comments/b6987a/i_was_terminatedlaid_off_my_job_need_advice/,2,"it's not a big deal.

Why did you leave company X?

new ownership came in and they replaced a lot of people.

 ",2019-03-27 20:23:01
2191,9wi5o9,False,Startups,8,"Resources for ""corporatizing"" my Startup Office",jobs,"Hey /r/Jobs. 

So I recently started at a small business / startup running the office operations and my boss has been talking more and more about wanting to implement processes/procedures to ease our transition from a small startup-style, two-to-three person passion project to a more organized, efficient operation that can scale upward and not miss a beat. 

I've always worked for small businesses that have prized their ability to adapt and change on the fly, and I don't want to lose that adaptability. However, we need a solid foundation in place and a structure to grow into and expand beyond and I'm a little intimidated being the boots-on-the-ground point person to execute my CEO's vision. 

Any books or resources anyone could point me toward to better analyze my company's workflow and get things running like a well-oiled machine? 

Also, if this isn't allowed here, please let me know and I will delete and post to the appropriate sub. 


Edit: I initially wrote this question like a moron. Hopefully I come off less like a moron. ",https://www.reddit.com/r/jobs/comments/9wi5o9/resources_for_corporatizing_my_startup_office/,2,"You might look for books and blog articles that specifically mention scaling your startup. Many of those resources will mention the pitfalls and must-haves. Another search strategy would be to investigate small business growth resources. When a business goes from a few employees to 15+ different laws start to kick in, so there are many HR articles focused on how to manage those growth stages.  ",2018-11-12 21:07:35
1853,eoqysb,False,Recruiters,3,Information needed on recruiting services and how they can help a recent graduate land a job!,jobs,"I just graduated with my Bachelor's degree in Finance in December and I have been applying to Financial Analyst positions posted on LinkedIn, Glassdoor, etc. I have no experience in Finance other than my academic projects. I responded to a post on LinkedIn last night for a Financial Analyst position and the man that I emailed my resume and cover letter to called me today. He works for Parker and Lynch which is a recruitment service. He made it sound like the position I applied for was not for me (a person fresh out of college with no related work experience) but we did set up an interview anyway so that he could potentially find me a position.

Is a recruiting service the way to go for someone in my position? I'm concerned that it'll basically be a temp agency where they'll match me with clerical work that pays hourly when what I'm after is a career with growth potential. I am also concerned that this service will cost money and, as someone fresh out of college, money is in short supply but I have no problem investing in my future if the opportunities they can offer me are worth it.

I'm unsure about how recruiting services work for the job seeker so any information is helpful. Thank you.",https://www.reddit.com/r/jobs/comments/eoqysb/information_needed_on_recruiting_services_and_how/,1,"> Is a recruiting service the way to go for someone in my position? 

Sure!  It's a common misconception to think that recruiters and temp roles are restricted to secretarial type work.  You should not pay them any money to work for them or through their service. Typically, the employer pays the temp agency $X per hour of your work and they pay you a smaller $x per hour.  The temp agency makes money on the margin between what the employer pays them and the lesser amount they pay you.  

These are often project and overflow positions where the big name company doesn't want the expense of on and off boarding lots of people quickly and the liability of legal action resulting from early terminations, worker's comp, etc.  If you have no experience, it would definitely be worth your time and, as you say, investment in your future self, to take a financial analyst position through a temp agency.  Maybe there's a company that is has a seasonal business and needs an extra hand for three or six months.  I'd gladly take that or a few months of project work so that my resume looks great -- plus the people you meet and connections you make can actually put you in long term roles. ",2020-01-14 20:30:55
340,c42axs,False,Discipline,2,How to deal with not doing something your boss asked you to do?,jobs,"Me and my manager were off on holiday at the same time last week. 

Before I went on holiday my manager asked me to sign something in her name and send off once she’d had a read through as she was on holiday that day. 

I waited for the go ahead, nothing so I text her as she was at the airport if she’d managed to read it so I can sign and send and I got no response. I even waited an hour after work in case she messaged then. Still nothing but I had to leave to pack and go to the airport and couldn’t wait longer. I signed the form and sent it to myself so if she messaged me in the evening I could send from my phone. Still nothing. When I was on holiday I couldn’t get my work emails due to lack of connection and I just left it as I couldn’t enjoy myself as I was worrying. 

Well I’m back to work tomorrow and now I’m so scared I’ll be in huge trouble for not sending it as she said it had to go that Friday. But she also said she would read through to check it was fine. As it was signing and agreeing to something on behalf of the company and I didn’t get her response I didn’t send it. 
Am I to blame? Should I have just done it? My heart is pounding for tomorrow. But imagine it was wrong and I signed it?",https://www.reddit.com/r/jobs/comments/c42axs/how_to_deal_with_not_doing_something_your_boss/,1,"i think you handled this appropriately, but i might have recommended that while you were staying late the night before your trip, you'd sent an email pinging her and reminding her you hadn't sent the document yet pending her review.  [that said, your unanswered text serves that purpose.]

i'd shoot her an email first thing tomorrow morning to remind her the item is still pending her review.  this will show that you didn't blow it off or forget about it, while also illustrating that you were responsible enough to not send without her review (per her instructions).

unless she's an irrational tyrant, i doubt you have much to worry about here, other than perhaps she might instruct you to, going forward, to not wait for her if the item is going to be late.  if she does say something like that, don't take it personally - just observe it going forward. ",2019-06-23 10:21:30
1491,1zzb07,False,[advice],1,Four Easy Ways to Network without Attending Networking Events,jobs,,http://www.lumicontact.com/networking/four-easy-ways-to-network-without-attending-networking-events,12,"This is so true. I've joined some Meetups that were professional in nature and not once have I really connected with anybody at any of these networking events. For a lot of these people, there is no real passion there. They're all there because they feel obligated as part of their profession. Clock in, clock out. After hours.

I've joined more hobby based clubs or activity based organizations and I've connected with more people as opposed to just being added as #1800 on their rolodex or LinkedIn. But you need to take the time to get to know people and eventually they will reveal what they do and maybe your paths can cross. But you're in a better mind set and it's about meeting more people as opposed to seeking opportunities.

This is also why many businessmen join religions. Religions often require members to regularly meet: a crucial criteria for building rapport.

I've joined hiking clubs, biking, and gaming groups. I've meet so many different kinds of people. ",2014-03-09 18:13:21
469,ex3vl2,False,Qualifications,3,"Phone Interview Monday. How can I make a case of my work experience, even though I was fired from my last job?",jobs,"Hello Reddit,

I have a question regarding work experience as I’m currently job hunting. 

I’ve been fired from my last job as a assistant fashion designer as of December 2019. I’ve had this job since mid October so roughly 2 months.

I was also also working part time in evenings during this time but only as a seamstress.

As an assistant fashion designer, I did tech packs for the company that included fabric type, trim info, colour way, etc. We then send my tech pack to one of our suppliers in China with a sample. 

The sample and the actual product that I designed in the tech pack comes back and we make revisions. This means I have to update the measurement spec sheet. This goes along with doing a fitting where someone wears the product I’ve made and then we make adjustments and send it back to China where hopefully all the mistakes were corrected. 

So everything I’ve mentioned here is the basis of being an assistant fashion designer or technical designer in the fashion industry.

Since job hunting, a lot of companies are looking for a year experience or more in terms of technical design.

Since I only had a technical job for 2 months, and I’ve been fired, I was wondering where else could I put that experience in my resume?

The only experience that I have that are slightly similarly related to that was my seamstress jobs or my job as a student entrepreneur where I made my own clothing, or my time in college where I learned these things. 

I guess what I’m asking is, what is the best case I can make for myself that I do have some experience as a assistant fashion designer/technical designer without mentioning that my last job that I was fired?

I",https://www.reddit.com/r/jobs/comments/ex3vl2/phone_interview_monday_how_can_i_make_a_case_of/,3,"You could still speak to the experience you mentioned, you just need to find a context that works.  It's very common for people to do things outside of their job description, but that means for professional experience there's a risk of corroboration.  Qualifying the experience as volunteer or entrepreneurial somehow is worth considering. ",2020-02-01 09:46:48
321,ahb701,False,Discipline,13,Telemarketing - How to deal with being cursed out on a daily basis,jobs,"So, I landed a new job and it's comparable to telemarketing. I'm not the greatest salesperson (i'm working on my aggressiveness), but I can land a few sales per day which averages to about $17-20 per hour.

&#x200B;

Does anyone here do this or have done this in the past? 

If so, do you have any advice for confidence/angry customers?",https://www.reddit.com/r/jobs/comments/ahb701/telemarketing_how_to_deal_with_being_cursed_out/,3,Never had a job doing outbound calls but I have call center experience (inbound calls) and that is almost as bad.  ; P ,2019-01-18 14:54:06
