Num,ID,is_Original,Flair,num_comments,Title,Subreddit,Body,URL,Upvotes,Comments,creation_date
1541,f9xgar,False,Companies,121,You should stop participating in Indeed’s online assessments: and here’s why.,jobs,"Let’s talk about Indeed Assessments.

Over my time of applying for jobs in the past, I have done a few of these so called assessments from Indeed. Personally, I will no longer be doing these, and neither should you. Here’s why. 

The job market is tough enough as it is and people who are applying to jobs day in and day out don’t need to waste anymore of their time. 

If the employer doesn’t see enough value in the applicant’s resume and experience (which also holds their contact information) and decides to automate one of the most important areas of researching job candidates, then that indicates to the job applicant that his/her respective company is a waste of time. 

It’s yet another way of attempting to get something for nothing by companies, which is the only thing that businesses revolve around these days. 

Indeed Assessments are gimmicks used by companies who are not capable of making job hiring decisions based on qualifications and interpersonal communication. 

People are more than happy to answer questions over the phone, in person, or email IF  the employer is willing to invest their time.

E: Can’t forget about the companies wanting you to film yourself answering useless questions and sending the video to them as part of an “interview” (thx to the people in the comments for reminding me)",https://www.reddit.com/r/jobs/comments/f9xgar/you_should_stop_participating_in_indeeds_online/,509,The assessments are not great.  However Indeed is pretty good as a job search engine and I've gotten more interviews from there vs. LinkedIn or any of the other job boards. ,2020-02-26 18:12:42
876,fm2cml,False,Education,3,"Those in the Health Informatics field, is the school where you get your masters important?",jobs,"Planning to go back to get an MS in HI (unrelated background) and I’m looking into some programs and I’m leaning towards the programs in Chicago as they’re nearby and in the city so I’m hoping it would be a bit easier to find an intern or part time job. I’m also coming from an unrelated background (Environmental Science) so some are more lenient when it comes to prerequisites. So, back to the question, is the school where you get your masters important if you get work, and possibly research, experience? 

Thanks!",https://www.reddit.com/r/jobs/comments/fm2cml/those_in_the_health_informatics_field_is_the/,1,The school where you get any degree matters. Go to the best one you can. ,2020-03-20 20:41:56
1034,guthvl,False,Covid-19,8,Should I wear a face mask for my job interview?,jobs,I have an interview for Subway tomorrow and I was wondering if I should wear a face mask there since it is a fast food restaurant?,https://www.reddit.com/r/jobs/comments/guthvl/should_i_wear_a_face_mask_for_my_job_interview/,6,100% yes. ,2020-06-01 21:29:38
1903,cpdjaj,False,Recruiters,18,"""The Recruiting Professionals"".. anyone heard of them?",jobs,"Based in Virginia.. address is to an office space building right off a main access road. Domain hosted by GoDaddy and every time you call their main number I get a recording to leave a voicemail... no receptionist.  Email appears to be hosted by Yahoo.

Reason I'm asking? $150k work from home for an IT Generalist with overseas travel.

Sounds too good to be true.

So here I am hoping others here have heard of this place.",https://www.reddit.com/r/jobs/comments/cpdjaj/the_recruiting_professionals_anyone_heard_of_them/,1,Scam. ,2019-08-12 15:02:06
1180,ey1xxx,False,Onboarding,3,Bringing cupcakes on my first day of work?,jobs,"Hi! Nervous about my first day of work tomorrow. Would it make me too much of a suck up to bring in treats on my first day? My interviewers were very kind, especially HR. Would it be bad to give them vegan cupcakes? There’s a specialty shop that I love.",https://www.reddit.com/r/jobs/comments/ey1xxx/bringing_cupcakes_on_my_first_day_of_work/,1,I’m sure any kind of treat would be a good ice breaker! ,2020-02-03 05:13:43
2374,ctr3hr,False,Training,0,Third-Year Nursing Student starting at a Dental Office tomorrow. Any tips?,jobs,Any tips to help make the training process go smoother? I don’t want to disappoint!,https://www.reddit.com/r/jobs/comments/ctr3hr/thirdyear_nursing_student_starting_at_a_dental/,1,,2019-08-22 02:27:47
1211,e54x58,False,Onboarding,1,The First 90 Days,jobs,I am moving to a different state and accepting a position within the same field as I currently work in. I know the first 90 days is critical when starting a new position. Any advice or suggestions on how to be the most successful?,https://www.reddit.com/r/jobs/comments/e54x58/the_first_90_days/,2,"Take notes, pay attention, be friendly and pleasant and interested, don’t be a know-it-all. ",2019-12-02 20:25:57
2347,cl0h9l,False,Training,4,improperly trained and no one will believe me.,jobs,"so to avoid a rant i'll just give the details.

two weeks ago i was hired on as a shipper at a local warehouse, there are a number of them around so they sent me off to get trained in another building a city or two over.

From the very start i was given very little explanation on how to do anything and whenever i asked a question i was given an exasperated sigh and retold the same thing i was just told which doesn't explain the task only how to complete it, not what im doing, just push these buttons, input this number, press enter.

i figured it was a bad day but it went on like this for 2 weeks with my trainer steadily growing more and more angry with me but not telling me anything, I had no idea what i was doing to make them upset so in the end i basically just shut down and waited to be told what to do, I did have a moment or two of extreme frustration bordering on anger because I had no idea what i was doing and ever question was answered with something like ""that's just what we do""

the building i was training at no longer wants me to show up for the last two days of training, so im going to the building im supposed to be working in, the problem is word of my negativity and attitude have spread so my reputation is already sullied in my actual work environment.

I've talked with 3 different managers and expressed that I really don't know what i know and what i don't know, that my training isn't going well, and in effect i was told to shut up and do what im told, the man training me eventually tried to get me sent back to my building but was unsuccessful at first.

Im pretty sure im going to get fired tomorrow over something i can no longer fix, and issues no one will care to listen too.

we also have a whatsapp group to ask questions to each other and get information on whats coming up, I was removed from that group. I feel like i've already been fired.",https://www.reddit.com/r/jobs/comments/cl0h9l/improperly_trained_and_no_one_will_believe_me/,3,"Omg I'm having this issue myself in a different line of work, in my case I was made to watch videos and be on a conference call and my trainer was SO annoyed every time I had a question. Now I still don't know how to do major parts of my job months later. I brought it up to my supervisor telling her I need an actual person and she just seems me an email to watch more videos. 

Some companies just suck. The only solution in these cases is to find a different job because you will just be beating your head against a wall since nobody listens or cares. ",2019-08-02 06:36:37
704,emgfbe,False,Unemployment,5,What am I doing wrong?,jobs,"Hey all,

Recently I moved from a rural area to a metropolitan and I'm struggling to find employment. I've gone online and filled out at least 100 applications, and tried to go through temp agencies, all to no avail. Generally with these applications I include a simple but definitive resume along with a note saying I'm looking for immediate employment. I've had two interviews, one for a pyramid scheme and another that told me I wasn't exactly what they were looking for. I moved to this area because of some health issues along with divorcing. What am I doing wrong and what can I do to fix it?",https://www.reddit.com/r/jobs/comments/emgfbe/what_am_i_doing_wrong/,2,"What kind of jobs are you looking for? What kind of experience do you have?   

Also r/resumes might be able to help. ",2020-01-09 21:37:32
2041,d1rqtr,False,Layoffs,3,"If I get salary continuation as apart of layoffs, am I technically still ‘employed’ when applying to other jobs",jobs,"Layoffs are coming, and I’m looking into my situation.  Instead of severance, my employer offers a salary continuation plan where I receive a regular paycheck and benefits for a period.  Legally, if I take another job, the salary/benefits cease.

My question is if I’m laid off, can I present myself as employed to potential employers?  Obviously, being employed is more attractive to potential employers and gives me more leverage for salary negotiations.  It feels like salary continuation is basically a long paid vacation to my mind.  And the fact that I can’t collect unemployment under this arrangement also leads me to believe that I’m ‘employed’ in some sense.

Not sure how the background/employment verification process works with these situations...",https://www.reddit.com/r/jobs/comments/d1rqtr/if_i_get_salary_continuation_as_apart_of_layoffs/,1,"I would say it depends.  In my experience, I have seen it where people say on Linkedin they are still employed by the company even though they were laid off and are getting paid via salary continuation or a severance.  Technically, they are not employed anymore, but most people do this to avoid a gap.  From my perspective, its a technicality.  I would probably just leave Linkedin alone and continue to job hunt as if I still have my job. ",2019-09-09 14:37:32
1369,1n8or5,False,[advice],23,What you need to know when interviewing for a job in IT,jobs,"As a hiring manager, I got so fed up with some of the recent candidates I've interviewed, that I decided to write these posts to help out entry level candidates.
I have just finished writing the first blog post of the series on ""What you need to know when interviewing for a job in IT"" - Check it out: http://www.technoideas.com/what-you-need-to-know/.
Cheers!",https://www.reddit.com/r/jobs/comments/1n8or5/what_you_need_to_know_when_interviewing_for_a_job/,34,"OP forgot the most important piece of advice in regards to IT, don't go into this field unless you dont mind competing with brown skinned labor for pennies on the dollar.  ",2013-09-27 11:06:56
360,c8epvz,False,Discipline,0,Manager tried to make me choose if i wanted to fire his brother or not.,jobs,"So long story short me and my manager havent been seeing eye to eye. His brother used to work for the company but quit and he decided to hire him back when our other delivery driver got fired. He told me the complete opposite of what his brother is and i absoloutely hate working with him. Last week his brother got caught smoking weed right in front of the store... Yes i know hes an idiot. The manager which again is his brother calls me into his office and tries to make me make the decision on whether or not he should escalate the problem to head office. I just straight up told him "" if it was me id be fired instantly, you are the manager and this is your decision not mine"". He then said he wouldnt fire me and made me write up a statement of what happened the day his brother got caught. Is this unprofessional of him and should i let the higher ups know he tried to pin it off on me? Or do i just let it go.",https://www.reddit.com/r/jobs/comments/c8epvz/manager_tried_to_make_me_choose_if_i_wanted_to/,1,,2019-07-02 20:39:14
287,cfh6vu,False,Discipline,6,Not sure how to approach situation I was hired into (I'm a new manager and one employee doesn't respect me).,jobs,"This is a long post, but I'm desperate for advice...

I got hired two weeks ago as a manager in my new company (one position lower than the general manager). There is one employee in particular (I'll call her RD) who is very harsh and has an attitude problem towards me specifically. Turns out, RD interviewed for my position but didn't get it, and I did. The problem now is that she is VERY obviously bitter towards me for it and she is openly that way in front of other employees and even my boss. 

The problem is that when the previous manager was preparing to leave, she taught RD a lot of her responsibilities. Now RD has taken over and won't let me touch anything or really do anything that is part of my responsibilities. When I answer the phone she will talk in my other ear about how to answer a question I've been asked like I have no idea what I'm doing. When a client comes in to talk to me, she INTERRUPTS me while I am talking to them to answer herself. It's very rude and is obviously awkward for me and the client. 

I've talked with my boss (who I'll call GM) about it and long story short, he told me that it is going to be an uphill battle for me because she is still bitter about the position. He told me that if I feel the need to talk to her, to talk to her. GM told me that he will try to let us figure it out between ourselves, but if it becomes a real issue he will step in. He also made it clear to me that if I ever needed to talk about it or need advice I can ask. 

GM also made it clear that RD has had issues with the manager before me, GM himself, and even other office staff. He even told me that I'm ""going to make her mad no matter what. That's just how RD is"".  He also said that he doesn't trust her at all with anything personal and that if she walked out tomorrow, we would be okay because her job is just an unnecessary extension of my own. 

RD even admitted to me that she is ""a control freak and has to do things herself"" and that she had a ""tough childhood and that's why she is the way she is"" neither of which are excuses to treat anyone, let alone your boss, the way she treats me. 

I had the opportunity to talk with the girl who had my position before me and she made it very clear that my boss wanted ME for the position and that I need to establish my position with RD quickly. My latest experience with her happened today when I told her that she doesn't need to worry about what I'm doing because I can manage on my own (this is my second week on the job), to which she never made eye contact and responded with ""well I just need things done right"" gave me a slight look, and turned around and walked away. Which leads me to my main question that I really need advice for...

I have never been a manager before, and I'm even amazed that I got this job because I had zero experience in this particular field when I applied. So how the heck am I supposed to handle this situation? I have accepted that I will not be her friend, which I am 100% okay with because she is not a kind person, but how do I go about this in a professional manner? I need her to understand that even though I am newer than her (she only started 3 months ago) I am still her boss and she needs to respect that. And how do I reclaim my responsibilities that she jumped on to take over? 

TLDR; Started a management position and an employee that also applied for the job is bitter that I got it over her. As a result, she is disrespectful, doesn't let ANYONE tell her what to do, and has on multiple occasions shown me attitude in front of other employees and my boss. How do I handle this situation?",https://www.reddit.com/r/jobs/comments/cfh6vu/not_sure_how_to_approach_situation_i_was_hired/,1,"> How do I handle this situation? 

Fire her.  If you say you can't then you aren't really a manager.  They just call you that.

I have had to do it to show that there is a new sheriff   in town. Its Machiavellian but it sometimes has to be done. ",2019-07-20 03:25:00
136,cjnls6,False,Rejections,9,What am I doing wrong?,jobs,"I need advice badly as I feel so defeated right now. I have 14 years of automotive experience. From dealer level to on site OEM support. I have Customer support and sales experience. I dealt with high profile Customers and cases in the past as an escalations manager in a well known American automakers Customer Relations Center. For the past 9 years I have been assisting their dealer network in all markets globally with parts catalog related queries and also have a lot of training experience under my belt.

In spite of all this knowledge it would appear I am completely and utterly unemployable. And its getting to the point where Just ending it all seems like a good option. I apply for parts sales jobs and then get told they will be pursuing candidates who's skill set more closely matches the job spec???? I'm literally the guy your parts guy calls when they cant identify a part! How am I not the perfect candidate? I have applied for parts manager jobs, I have applied for the same job I am doing now but at other OEMS. No takers...

Everywhere I apply I get blocked, what am i doing wrong???? I cant find another job, I cant move up and I have been in the same job for the Last 9 years and I am so hungry for a new challenge, but it appears i am completely unemployable...",https://www.reddit.com/r/jobs/comments/cjnls6/what_am_i_doing_wrong/,17,"In addition to the other comments, is suggest reaching out to the interviewer after they rejected you. I did this a few times, asking if they can make time to provide me productive feedback, so I can improve on my interview skills and better understand my skill gaps. This process helped me how to perform better in future interviews as well as be prepared to talk about my gaps in a positive light. ",2019-07-30 06:10:06
434,g533xo,False,Qualifications,3,"I'm 24, in a construction field, and realize now I know very little about construction (but I'd love to learn)",jobs,"I work for a very small construction company. The point of taking the job was that the pay (at the time) wasn't bad, the work that was pitched to me was very interesting, and there are a multitude of jobs that I would be qualified for when I left. What I didn't figure into the equation when I was hired was that the workplace was toxic. Supervisors calling you stupid, insisting you're stealing from them any time there's a discrepancy in AP/AR, calling you at home at 9 PM to complain about how the office is running, and constantly telling you you're doing a bad job. This has had a genuine impact on my mental health.

&#x200B;

As such, I decided to leave about 4 months into the position. I did not have much time to apply to jobs, due to having to be on call every day from sunrise to sunset (which is no excuse and now I regret not making more time). Now though, I have put my foot down and started applying with vigor. The issue I'm running into is that the work I am doing is not the traditional role for someone of my title. I have received a few inquiries with that same title, and I'm realizing that I don't know near as much as I should because of the way my company is run.

&#x200B;

What should I do? Keep applying for the same position and see if I get lucky? Tell the company I apply to that I'm intelligent enough to pick up anything they can throw at me? I'd love to stick to the same position and actually learn what I was promised to learn at my current job.",https://www.reddit.com/r/jobs/comments/g533xo/im_24_in_a_construction_field_and_realize_now_i/,3,"I feel your pain. I’ve been working in construction 10 years now (over in the UK), first as a quantity surveyor and now as a project manager. I still feel like a fish out of water at times and struggle with the demands. Unfortunately this industry is very unforgiving and falls down badly on adequate training for fresh graduates and experienced hires alike. The undergraduate degrees don’t prepare you for the real world and many companies are not prepared to invest in tailored graduate schemes.

I’ve learnt through a combination of trial and error and luck. In the process, I’ve been through 6 jobs and can say it’s been mixed. Some companies have been awful toxic environments and I’ve left after 6 months, while my last company was bearable so I ended up staying 3 years.

My advice is to accept you won’t know everything and just do what you can. Don’t let people walk on you - speaking from experience the industry is full of bullies who prey on the weak.
If you want to avoid another toxic workplace, you may want to explore opportunities with larger consultancies with well established systems and HR protocol where It’s less likely a sociopathic manager will get away with bullying and harassment.

From a personal perspective, I don’t know if I want to stay in the industry much longer but have always struggled to establish what else I’d like to do instead. So for now, I’ll continue to plod along and do my best. ",2020-04-20 22:43:18
2389,blna13,False,Training,4,Frustrated about not getting a work term,jobs,"I just wanted to rant a little bit, and let out some steam.


So I just finished my 2nd year as a civil engineer, and haven't gotten a coop work term yet. I applied to about 80 jobs but only got 5 interviews, and no offers. Getting no offers really sucks. It seems like my confidence lowers everytime after an interview. One interview that hit my confidence was an interview with the city of Edmonton. They were looking for 2 students and interviewed 3 people (including me), and I still didnt get the job. It really sucks.


I've been going to my university job office for resume/interview help, but still had no luck. Even before going for help, I realize the biggest weakness I have compared to other students is my lack of work experience (ie. I have no work experience at all). I thought that grades were everything and dint focus on getting any experience. And it's a mistake in my part, and probably should have tried to look for jobs during highschool, but no point in regretting in the past. 


With my lack of work experience, I have been volunteering and joined an engineering club to compensate for the lack of experience. With those, I gained amazing memories, but it still doesnt feel the same as getting a work term. 


I feel like a part of not getting interviews is my interviewing skills. I generally don't have very good experience with talking to people, but I felt that most of my interviews felt really good (only 1 interview felt unprepared). But I guess that wasn't the case since I'm still looking for jobs. 


Since the first work term started today, they waived my first work term since they saw I was actually applying to jobs/put some effort into looking for jobs. However, if I don't get a job in my next work term, I'll be dropped out of coop. Furthermore, the experience I hear from my friends about their first day, makes me really depressed since I cant partake in the same experience.  Also since about 90-95% of civil students got a job makes me even more depressed about it.


Being dropped out would kill me inside. I worked so hard during my first year since I needed a higher GPA to apply for coop, but I feel like that was just a waste if I end up being dropped out. In addition, if I don't get a job for my coop, what are the chances that I get a job after I graduate? Thoughts like this scare me. 


At this point, I kinda accepted the fact that I'll be dropped out of coop, but the future terrifies me. I basically don't see a future in what I do right now 


Thanks for anyone that read my rant. Hope you guys have a great day.",https://www.reddit.com/r/jobs/comments/blna13/frustrated_about_not_getting_a_work_term/,2,"Keep your head up, you're doing a lot of things right.

1. Do you qualify to get a on-campus job?
2. Try to get leadership positions in the clubs, not just be a participant
3. I interned at SpaceX and Tesla -- the number one thing they look for is actually participation on the SAE formula teams. it shows you have hands-on engineering experience. What school do you go to, do they have baja, solar car, SAE? I know you're civil versus mechE.
4. Is your career center not actively helping you find a coop? Other than providing resume reviews?
5. The art of interviewing is just sounding confident and practicing. You can do this in normal discourse, spend a little bit of time to think before you speak and make sure you articulate well - even on a colloquial basis, this will go far.
6. honestly, see if you can get any presentation opportunities in classes. this will help your interview prep.
7. If your school expects you to find your own co-op how have you been networking with your peers. Can you get a mentor in this co-op program and get help that way? 
8. Network with other students and see if they can get you into a co-op. ",2019-05-07 06:24:43
