Num,ID,is_Original,Flair,num_comments,Title,Subreddit,Body,URL,Upvotes,Comments,creation_date
259,93frua,False,Discipline,380,A good employee is a no-show and won't answer her phone. What should I do?,jobs,"I'm a manager of a  small business, a store. We are a little short staffed. Last night, I was called in on my only day off (I hate that, sorry.)  because one of my employees was a no-show. We have a process where if there's no call/no show they get written up and potentially fired. It's a few steps. ( still, we're an At will State and it's in the policy so if corporate decides to, yikes.)

I'm worried. She's one of my best employees. She always is on time, does a good job. I recently gave her a raise and she was excited about that. I worked on Sunday and she switched shifts with me. She said ""Hey, I'll see you tomorrow!"" But then, didn't show up. It's really uncharacteristic. My employee who was working the morning shift texted her, called her and informed me her line had been disconnected. So I tried calling and texting; also disconnected. I emailed her, no response. She has a few longer shifts on Sat/Sun and I'm nervous about it. She hasn't reached out to me at all.

What if something bad happened? How do I approach this? I've had employees skip out but it was usually just because they were being irresponsible, as I said. I just don't want to overstep my boundaries as boss but I'm worried she's hurt or something. What do you think?

Edit: Okay, I called non-emergency and requested a welfare check on her. I hope she's okay and that this is all for nothing. I'll update if anything comes of it.

Edit: I should probably mention she recently broke up with her boyfriend and she told me he was mad about it so that's another factor.

UPDATE: I got home from work. The police haven’t called me back. There’s a staff member at the shop, I told him to stay vigilant. He’s aware of the situation and is just as worried. I looked her up on Facebook and found her profile. It hasn’t been active for months but I still sent a message. Turns out, she lives in a shady part of town. Nothing to report from driving by. It’s like she’s just a ghost. I’m preparing to deal with the possibility that I won’t hear from her again. I have no idea how I’m going to deal with covering her shifts cause I’m on almost 8 days straight of working. Stressed. Some of you have suggested maybe she just skipped town. Seems unlikely but if her boyfriend situation was really bad... who knows? I’m wondering if the police checked on her and it was fine and they just didn’t tell me? Either way, I’m going to reach out to them and try to get an update tomorrow. If she turns up Friday to her shift I’ll be floored and relieved. If she did this just because she “felt like it” I’m going to be disappointed. I doubt it though, she cares.  Thank you for the support guys, I appreciate it. And your kind words. Either way I’m probably going to be hiring.

\---

**FINAL UPDATE:** She got back to me this morning on Facebook and quit over text. She waited until Friday to contact me. Why? Because I called for a Welfare check.  She didn't give me a reason why she skipped work, cut all contact and ghosted me and our staff. But she was mad I sent the cops to do a Welfare check. The police must have done a check and it was fine so they didn't bother calling me back. 

 I woke up to this from her*:* 

*""As a manager you don't send no cops to nobody house you can get me evicted for the fucked up move you just pulled I could've been in jail or out of town somewhere with bad reception I'm taking it personal because you're being unprofessional  now I'll be there to drop off this key y'all did the most ""*

I'm not sure how this is logical, but I guess I don't know her private life. I don't think you can get evicted for a welfare check. Unless she's doing something illegal?  I politely explained that I was worried about her because it was completely out of character for her to be irresponsible. Also, the break up. She was silent for five days. She's was a valuable asset for our store and I'd just given her a raise?  I doubt I'll get a response. I'm a little upset that she doesn't understand why suddenly disappearing would alarm me, the staff. I'm floored. She was with us for three months. Regardless, I hope she does okay out there and I'm happy she is safe and well. At least this didn't end with someone dying, right? I'm disappointed but relieved. I don't think I was unprofessional, just following procedure from email, phone, emergency contact to welfare check. People will notice and care if you're gone. I think it would have been unprofessional if I showed up at her door as her boss. Anyway, thank you for the conversations, support and advise everyone. I appreciate you all.",https://www.reddit.com/r/jobs/comments/93frua/a_good_employee_is_a_noshow_and_wont_answer_her/,802,"Tbh, everyone saying this is a great manager move is kind of being creepy.  Work is where you go to get paid to live your own life.  If someone quits without saying a word, that's on them.  If this person happens to make friends that care for him/her, they can do a welfare check as a friend.

If OP was a friend, his move would be justified.  He was just a boss missing out on an employee he felt was reliable.  I'm guessing that the OP also had some sort of attraction to her as well because if this was some ugly, fat, girl in her late fifties, nobody would care.

The lesson here is that the OP, as a manager, has an obligation to care for his employees to an extent, which is in the boundary of the workplace. ",2018-07-31 16:06:25
1488,17xnvb,False,[advice],2,Fake Amazon resume proves the power of personal branding,jobs,,http://edition.cnn.com/2013/01/31/business/fake-amazon-resume-cv-philippe-dubost/index.html?hpt=hp_c4,10,"Here is how cynical I am: I thought for sure this was an article about how someone lied on their resume and listed Amazon as a former job - and scored something big because of it. 

Glad I was wrong!  ",2013-02-05 15:11:07
1927,hd3hz6,False,Layoffs,61,"I was laid off two days ago, closure interview?",jobs,"  My job closed down mid March with plans to reopen after the lockdown was over. I worked here for 5 years and during this time had my son and unfortunately became a single parent. 

 My (then, when my son came) bosses reassured me that they would accommodate my childcare schedule no problem. Year 4, new management came in (young with no children) and basically got fed up with accommodating my schedule restraints (9-5, daycare hours). 

  Lockdown came and I was told I would have a job no problem as soon as the county reopened. Well they called on Friday and told me that they could no longer work with my schedule and decided on separation. When I asked what the official reason for separation was, they replied “my inability to get childcare”. As if I could afford to have an on-call nanny, who is completely available 24/7. (My job has double shifts and puts out the schedule 3 days before the work week).


 Now they want me to come in on Tuesday for  a “closure” interview. I’m terrified they’re going to offer me the option to resign on good terms (no unemployment) or be fired (unemployment but bad on resume).

  I feel betrayed by a workplace who preaches family values and job security. 

What should I do?",https://www.reddit.com/r/jobs/comments/hd3hz6/i_was_laid_off_two_days_ago_closure_interview/,169,"Do you live in a state where it is legal to record your conversations without the knowledge to other parties?  If so, record it and go on record documenting how the work conditions changed and they became more aggressive about it to you.

If you are a female, drop “sexual discrimination “ in the text of the conversation.

Then let a civil rights attorney listen to the recording. ",2020-06-21 08:38:03
629,ftruyh,False,Unemployment,34,"I have nothing holding me down, where should I work?",jobs,"I have a BA in psychology and I'm a 27 year old male. I live about an hour away from NYC. I know the climate for jobs is weird now but I have nothing holding me to where I live. I recently worked in New Zealand for a year and it was every part as good as it sounds. I have no significant other, my family is doing fine, I live at a friends so I don't have a lease. I'm curious, what would you do if you had nothing holding you down? I plan on going somewhere to experience a different way of life and possibly culture. Idea?",https://www.reddit.com/r/jobs/comments/ftruyh/i_have_nothing_holding_me_down_where_should_i_work/,26,Find a job somewhere else and start over ,2020-04-02 18:40:04
1608,dx0q9h,False,Companies,6,Any job that allows you to sit down?,jobs,"Ive always had issues with my feet and was curious if there any jobs other than office work / developer / etc that let you sitdown on the job.

I always thought a hotel receptionist would be able to but I was wrong lol.",https://www.reddit.com/r/jobs/comments/dx0q9h/any_job_that_allows_you_to_sit_down/,2,"I used to be a fraud analyst. Sat in front of a computer all day working online orders. Takes a bit of training, but anyone can do it.

Also they are in high demand for holiday season.

Customer service is another option. ",2019-11-16 02:11:56
1380,3dut5w,False,[advice],8,"I have been offered a position that would be the equivical to the US Presidents ""body man."" How do I figure out what my on-call downtime and travel time is worth. The offer is generous for 40 hours, but I want to be fair to myself for being always available.",jobs,"Been offered a job and need help figuring out different parts of compensation. Please and thank you.

* Available at employers whim. I will need to make my schedule his schedule, even when they do personal errands and somedays being available without much if any notice. Basically I will give up my life for a year to a year and a half because of this position. He can't afford to give up a year while he develops more business opportunities in his family's company and deals with some big franchises that have approached and what his family currently has going on, which is substantial.
* There will be a lot of downtime while I travel for days with them.
* I am being paid to be available, discrete, professional and reliable. I will also use my degree, industry knowledge, life experience and sound advice. He knows I can do it because I recently worked for his family in a much different capacity but as he said, they were very impressed how I demonstrated these things. He would use me as a personal assistant for those skills. But the most important duty is to be able to drive him where he needs to go, which is almost daily for work in a large region. I would learn a lot on how his organization operates but after a year to a year and a half there is no guarentee of a position or expectation of a position with this organization.
*  He has offered a salary but it doesn't seem to cover all the on-call time or the 3 or 4 days I will need to travel with him out of town. 
*  I will be paid by him and not his family's organization right now becaise he is trying to keep his circumstances quiet to others in his organization.  At certain times when he meets with people I will need to stay out of site or in the deep background because of what their perceptions of this situation might be.
* I will be given a housing allowance that would pay for a place I could live or about 60 to 70 percent of a great place to live. I am having to move an hour away to where he lives. And despite the move, the move isn't an inconvenience.
* I will have very few expenses when in his company. And because his family owns two different restaurant groups, I could eat for free all throughout this region even when I'm not in his company. Basically a credit card to use at those 16 locations. Not bad food but I wouldn't eat there all the time because I like to go out and eat and cook as well.
* I will probably save about half of what I make when this if through, and that would include being debt free except a student loan but aggressively paying it off. But I am worried I will get extremely bored quickly and in a year be out of a job and have another year short of starting a career.
* How do I figure out what my time is worth beyond 40 hours and although there is downtime, I'm still on call. What is that time worth?
",https://www.reddit.com/r/jobs/comments/3dut5w/i_have_been_offered_a_position_that_would_be_the/,15,Go for it... The amount of experience and knowledge you are going to gain also is very valuable... I think in the long run will pay off as well  ,2015-07-19 18:08:57
71,eml5ac,False,Rejections,10,Applying to a place more than once. Would you do it?,jobs,"Have you/would you ever consider reapplying to a job you didn't get hired for the first time around? I've applied to a few companies/positions I've interviewed for already but didn't make the final cut, and am thinking of reapplying when the position reopens. What do you think is the likelihood you'd get the job a second time around?",https://www.reddit.com/r/jobs/comments/eml5ac/applying_to_a_place_more_than_once_would_you_do_it/,8,"The tl;dr version I’m gonna give you is that at the end of the day, it doesn’t hurt to try. 

The longer version is that it depends on the situation. Why did I get rejected in the first place? Was it something that wasn’t too personal or was I missing a skill.. have I improved since then?

Funny enough, there’s this job I’ve been literally staring down for months to pop back up and it finally did after like 8 months (crazy, right?). The first time I reached out to the recruiter but it got me nowhere. Now it’s up again and I’ve apples. Changed up my resume and really tried to showcase why I am beyond a perfect fit. 

I’m hoping for the best. 

Also, I’ve gotten a job once that I applied twice to - my last job that is. I applied in early December and kinda felt like they didn’t look at it and then I saw the position pop up again over the holidays and I tried it out. ",2020-01-10 03:29:15
1774,goes4i,False,Recruiters,0,"What seemingly innocent questions can I ask recruiters, so that I can infer how their company's truly performing?",jobs,"Because of COVID-19, due diligence requires me to *politely* question the future prospects, and in some cases, current under-performance of HR of companies who contact me. But HR always answers with just [meaningless corporate jargon or weasel words](https://redd.it/alzkov).  So what other seemingly innocent questions can I ask instead as a workaround proxy? 

These HR are legitimate, and prove their identity by emailing from their corporate address or allowing me to phone their  extension. I research Cash Flow, Income Statements, and Balance Sheets,  but accounting can be forged!",https://www.reddit.com/r/jobs/comments/goes4i/what_seemingly_innocent_questions_can_i_ask/,1,,2020-05-22 07:29:29
1309,cgxrkv,False,Onboarding,2,Tips on how to ease into first job,jobs,"I just got my first offer for a job related to my degree and I'm really excited! I'm still thinking about my decision, but I'll most likely say yes to it. I'm nervous about going into a job for the first time and not messing up. My boss says I'll be shadowing and doing training for a bit before I do stuff on my own so that helps me relax a little bit. What advice do you guys have on calming your nerves when taking on a new job?",https://www.reddit.com/r/jobs/comments/cgxrkv/tips_on_how_to_ease_into_first_job/,1,"Take good notes:

1. Vocabulary.  Get the buzzwords down first.
2. Sequencing. What has to happen first, then next.  I like charting the operations.
3. Speed drills.  Come early, stay late, get faster. ",2019-07-23 20:10:26
437,gl2zkz,False,Qualifications,1,Softwares to know for Architecture and Civil Engineering,jobs,"I'm a sad 1st year undergrad student of physics and want to shift my major to either Architecture or Civil Engineering.
Due to the pandemic, everything has stopped and I want to be productive and learn a software which is both useful for Archi and Civil.

I've started Sketchup but I feel like I need a Autodesk certification down the line. So the main question is:

Which autodesk software to learn that has both uses in Civil and Archi?

Also, any other software recommendation is appreciated.",https://www.reddit.com/r/jobs/comments/gl2zkz/softwares_to_know_for_architecture_and_civil/,1,"Civil 3d, though obviously that’s not going to matter for architecture. Revit is great for architecture and most other forms of engineering. Maybe building on that with Navisworks for coordination/schedule integration ",2020-05-16 21:42:46
249,d95gd9,False,Discipline,18,Can an employer discipline for social media?,jobs,"My coworker is in several Facebook groups made up of installers in our same industry who all work for different companies. We have some products in common, and it has been a good place to find tips and support from other people who have hands-on experience.


He made a post about an issue we have noticed with a product that originates in our company. He asked the group if anyone else had seen the same issue. Within minutes, our manager came and told him to take the post down, because it had caused a ""big uproar"" at corporate. They are talking about disciplinary action because he was ""bad-mouthing"" our products on social media.


Is there a legitimate case for discipline here? I did a Control+F on our employee handbook .pdf and ""social media"" isn't anywhere in there",https://www.reddit.com/r/jobs/comments/d95gd9/can_an_employer_discipline_for_social_media/,7,"If you signed a contract in regards to social media, yes. If not, then no. ",2019-09-25 16:10:38
2051,bfc413,False,Layoffs,13,Two week leave- just started work.,jobs,I just was hired last weekend and now I have to take two weeks off of work because I can't leave from Indiana for those two weeks to take over two hours to get to work. Can my job fire me?,https://www.reddit.com/r/jobs/comments/bfc413/two_week_leave_just_started_work/,1,On the train that's from Indiana there's a 10 ride ticket for $100. A. I don't have $100 right now and I still have to figure out how to pay for the CTA costs. ,2019-04-20 13:20:48
2432,am04n2,False,Training,4,Training/Certificates to boost resume,jobs,"Hello, I have a question that Google has failed to answer (maybe I'm just asking it wrong) and I was hoping someone here could help. 

I'm a recent psychology graduate and I want to get into grad school except all of the schools I want to apply to require so many hours (or years) of work experience and I'm struggling to get a job in the field. I was wondering if there were any training courses or certificates I could get to improve my resume and make me a more competitive candidate. When I say courses I mean short term like a day or two (I don't have the time or money to get another degree ATM). I already have CPR/First-aid but there are so many different courses out there and of the jobs I've been applying to no one seems to be looking for the same certification. Can anyone help with this? Thanks in advance.",https://www.reddit.com/r/jobs/comments/am04n2/trainingcertificates_to_boost_resume/,2,Get a masters in a related field.  ,2019-02-01 08:49:32
1664,bs77c7,False,Companies,13,Job has no breaks and it sucks,jobs,"(AZ) 

I just got hired at this local coffee shop, i had my first day yesterday of a 6.5 hour shift. I did great on the job, everything came really easy. But there were a couple red flags before I started that sort of make sense now.


I got a call the day after i applied online. He asked a few questions about scheduling and all, then mentioned there's a high turnover rate. Red flag #1


On Monday I got an interview, the girl was young and very chill. She asked maybe 3 questions , forgot my name and what experience I had on my resume. Then said ""well i like you, when can you start?"" I'm desperate for money right now, so i said asap.


 Then we went into the shop and she was telling me about it all. Then she mentioned that two people just started and left suddenly for no reason. Red flag #2

Now during my shift, I asked about breaks, she ignored that part and answered another part of my question. The other 2 people working with me didn't get a break, nor was the word even said. My feet hurt so bad after standing for over 6 and a half hours, on top of Walking to and from the shop.


Now i know in arizona, there are no laws regulating breaks, employers don't have to give on. But do you think this is some kind of sign about the company itself?",https://www.reddit.com/r/jobs/comments/bs77c7/job_has_no_breaks_and_it_sucks/,6,No breaks??   WOW...  No sure I could do that!!!  And doesn't sound right at all.  For 6 hours worked we are allowed a 15 min break and then optional half hour lunch/dinner.   Now you know why people are leaving. ,2019-05-23 19:31:43
2083,7xkwa3,False,Layoffs,44,Do you care about your job?,jobs,"Or are you just doing something that can pay the bills?

I was laid off on Monday, part of the Barnes & Noble “we’re going out of business” layoffs. I loved my job. I was there for 10.5 years. I hated the company, have hated them for several years, but I loved my job. I cared about my job, not just in the work ethic sense but in a passionate way. Bookstores are important, even with the continued rise of the web and digital, it’s important to have physical bookstores. I could go on an on but that’s not what this post is about. That old phrase “turn your hobby into a job and you’ll never work a day in your life.”

I’ve casually looked at job boards, I’m not in a rush I have a severance through the end of April, I see a lot of openings that I’m well qualified for all of them making quite a bit more money than I did. I’ve known for years I could move and make more money. The problem is when I look at the jobs they are things I literally don’t care about. Sure I could easily get hired at Macy’s doing the same thing but I don’t care if someone buys a new shirt or not, for Best Buy I don’t care if anyone buys another TV just because a new model came out that is 4% better than the one they bought last year. I’ve looked outside of retail and am trying to figure out how to translate my skills (I’ll be making a different post about that) but again everything I see is for things I don’t care about. It feels like no matter what I do I will be doing something merely because I get a paycheck. I cared about selling books, I care about literacy, I care about expanding your mind by reading. 

Do you care about what you do, or is it just a paycheck?",https://www.reddit.com/r/jobs/comments/7xkwa3/do_you_care_about_your_job/,27,"Anyone who doesn't is an idiot, Colossians 3:23 ",2018-02-14 20:10:15
1805,g1jpmq,False,Recruiters,0,Phone screen follow up?,jobs,"Hi all, 

Had a phone interview/screen not last Friday but the Friday before and haven’t heard anything back from the recruiter. The recruiter didn’t give me any concrete dates or timelines for next steps, just outlined what the next steps were and that she’d flag my profile for both hiring managers/teams and go from there. I know with COVID19 a lot of things are on hold but it’s also a tech company. Thoughts? When is it okay to reach out?",https://www.reddit.com/r/jobs/comments/g1jpmq/phone_screen_follow_up/,1,,2020-04-15 02:58:41
847,gl9f7w,False,Education,0,If I want to be a pilot in Europe will I basically be okay if I don't have a college degree?,jobs,"By the way I don't necessarily want to be an airline pilot, I am okay with many different pilot jobs, so long as it's not military. My eyes are mostly on Ireland and the UK. Do you guys think I should be good there if I don't have a college degree?",https://www.reddit.com/r/jobs/comments/gl9f7w/if_i_want_to_be_a_pilot_in_europe_will_i/,1,,2020-05-17 04:46:12
