Num,ID,is_Original,Flair,num_comments,Title,Subreddit,Body,URL,Upvotes,Comments,creation_date
1991,elhq90,False,Layoffs,6,Lost my first full-time office job yesterday and want some help,jobs,"Thankfully it was through no fault of my own (I hope?), they just couldn't afford to have me. The company was a startup in a way and while I knew that startups are notorious for not being able to continue the way they anticipate and that the position could be unstable, I didn't think it was going to be that soon. It's a bit of a bummer because I loved everything about this work and the people around me. I told everyone how much I loved everything about the company.

After being told this news, I went home and felt sorry for myself (only a few tears were shed!) and had dinner with my family as a consolation. But today I've filed for unemployment, made an outline of things to do while I have so much time on my hands (which includes a lot of time for applying for jobs) because I can't stand not having structure, and will be working on updating my resume.

Since I haven't been unemployed for the past 7 years, I'm almost at a loss of what to do. I'm a bit discouraged because I graduated from college 2 years ago with a BA in Social Science and stayed working at the daycare program while I've been searching for work up until September 2019. Before the daycare, I worked in retail for 4 years, the last year being a supervisor. Now I have a 2-month position for my only office job in marketing, a career that I want to pursue after having no direction to work towards. Just a few questions:

&#x200B;

1. How do I list the 2-month job on my resume? Should I even list it because it was such a short term position? If I do list it, how can I talk about it when it was a short amount of time?
2. Is there anything I should know about being unemployed? I know I need to keep busy, so I'm making sure that I'm continuing to take the online courses for marketing as I have been for the past several months so I can show that I serious about this, and the fact that I didn't go to school for this industry. And exercise for stress relief.
3. Should I just get another job as soon as I can, no matter what it is? I'm not talking about going back to part-time work, but another entry-level office job? I'm aware that I have bills/loans to pay, so that does add weight. I live at home now though.
4. I will also have no health insurance. I turn 26 next week. Happy birthday to me? What do I do about that?
5. If you don't have any answers to those questions, I'd still love to hear about anyone's past/current experience in any similar position!

Edited for formatting.",https://www.reddit.com/r/jobs/comments/elhq90/lost_my_first_fulltime_office_job_yesterday_and/,3,"I would definitely put the position in your CV with no time-frame. I would explain what I did and how I did and I would explain to any prospective recruiters/employers that you were happy there and they were happy with you, however as it was a start-up they had to make some budget-cuts/layoffs. Be honest about it. Be enthusiastic about working in the field and if you are then you will definitely be hired. 

I wouldn't worry too much about courses, any popular high-demand ones I would take if I could but the normal online ones are normally no value. 

I wouldn't hurry. Think about your direction in life and what you want to accomplish for the next 10 years. Do you see yourself in retail or marketing? Do you see yourself in a different field. It is always easy to change a job, however building up is hard. You normally need years of experience for high-level positions so if you liked marketing and you want to do marketing in the future then you should try and get into marketing or a similar sounding role - PR for example. I know it will be though for a few weeks/months but stick it out and apply for any marketing jobs. It might be even worth getting a below market value with 1-2k per year but staying there for 1-2 years so you can build experience.

About the health insurance - are you in the US? If so then I can't help as I'm UK based. Ask maybe a friend or a relative that has experienced unemployment at some point. Surely you're not the only one ever to be layed off. 

5. I got layed off a position during my 8th month there. It was a bit sad but it was absolute hell to work for them. They killed my joy in work and it was a blessing in disguise. I now work for a letting agency (property sector), which is what I wanted to work as for a long time but was not really qualified to do so yet. My previous, although not significant, experience helped me out. ",2020-01-07 21:04:52
897,en4orh,False,Education,10,So I plan on getting a BS in Biotechnology and MSc in Animal Molecular and Cellular Biology,jobs,"So, as the title states, I want to study Biotechnology as an undergrad and Animal Molecular and Cellular Biology in grad school. I am currently working on my AA degree right now, but have no concrete idea on my job opportunities after getting each of these degrees. I know I may be jumping the gun, but I am just curious on how useful these degrees will be. That being said, I thought it wouldn't hurt to ask you guys a few questions.

1. I heard it's hard to get a job with a Biotechnology degree, especially if you don't live in the right place. I live in Florida, how good are my chances of landing a job and how much should I expect to make?
2. With a BS in Biotech, what type of jobs would I have available to me? (Research, academia, etc.)
3. Considering I don't change my mind later on, what value would a Master's in Animal Molecular and Cellular Biology have when it comes to me getting a job? Would it be at all useful compared to other grad degrees I could go for? (Bioengineering, bioinformatics, etc.)
4. Would I be limiting myself with this potential Masters since it is ***Animal*** Molecular and Cellular Biology or am I just overthinking it?
5. After getting these degrees, would job hunting be a lot easier for me or would it be just as much a struggle as with other bio-degrees?
6. What can I do to help better my chances of getting a job whenever I get either of these degrees?

I don't plan on getting a PhD because I feel like that's not for me, so I'm hoping I can still be successful with these two degrees if I like them as much as I think I will and pursue them. Any advice or answers will be greatly appreciated.",https://www.reddit.com/r/jobs/comments/en4orh/so_i_plan_on_getting_a_bs_in_biotechnology_and/,3,"Biomedical PhD here. Unfortunately most biotech/ pharma have hard requirement of a PhD or MD for any jobs thet are past entry level in R and D.  That being said a lot of PhD programs have recently focused on getting the graduation time down ( I personally did mine in a top research institute in ~4.5 years, our program average was a little over 5).  Its a lot of training but could be really rewarding.

I would suggest reaching out to people that work in research and setting up informational interviews. Theres a wide range of jobs and day to day responsibilities within the industry

Also echoing on a earlier point. The industry is heavily concentrated in Boston and SF.  I've had well published friends search for jobs for 6+ months with a  phD because they were looking for jobs in non boston/SF city. 

Good luck OP! ",2020-01-11 07:52:30
2164,bvu8fu,False,Startups,2,"The Start Up I work for was bought, and nothing has been changing. Is it a bad sign?",jobs,"Hello everybody! I don’t know if this is the right place to post this. But I’m working for a startup and I’m seeing some concerning things.

I was really excited about working for a startup. It would be lots of work and it was a major leap after struggling to find a full time job. I’ve been there 7 months or so and over time I was seeing things I didn’t like but thought I’d tough it out.

Now, things are getting bad it feels like. We were just purchased by another company. The CEO and his wife, whom he works with, met with us individually. Not one big meeting, but meeting with employees alone. It was weird but tried not to think too much of it. Yet everything has slowed down. To the point that there is nothing to do. And the CEO does not like seeing his employees not working. He already has an attitude, is quicker to criticize than reward. Priorities shift on his whim. He once said to me “if I find that thing, I’m gonna be pissed. I’ll fucking kill you”. I tried not to read too much into it, but it was shocking. But he talks to everybody that way.

We also have not seen the people who bought us. They have not spoken too any of the employees or anything. Yet we know we will be moving locations. But we don’t know where.

That’s just some of the stuff. It always seemed like there were all these pieces, yet none of them were moving in the same direction. Now it just seems like we are in a sort of limbo and not being told anything. Especially since I just learned from a coworker our last two paychecks were paid out of the CEO’s pocket. Too anyone who has worked or owned a start up, is this sort of thing normal after a buy out? Is there always a strange period of silence or not knowing what’s going to happen?

A lot of us are looking for new jobs. We have even made jokes that we’re going to come to work and the doors are barred or we’re raided. Are we being paranoid or do we have a right to be afraid?",https://www.reddit.com/r/jobs/comments/bvu8fu/the_start_up_i_work_for_was_bought_and_nothing/,1,"Whenever an acquisition happens, expect for there to be layoffs and changes in the company structure. I was recently laid off from my company because of this. If I was you, I would begin priming your resume and put feelers out there as a backup. ",2019-06-02 05:32:59
1781,ghtyao,False,Recruiters,1,would you email your HR manager on whether or not you are still going to be starting in August ?,jobs,"o recently, i got a job offer with a company that is going to be starting in August. 

And as a college graduate, it is really hard for me to find a job right now. So i am banking on this job offer quite a bit. 

a few of the people who were going to start in June had their job offers rescinded but I got in touch with one of the recruiting people and they told me that my job offer still stands for I start in August. However, that was back in march. 

considering the outlook of what things are looking like, and the lack of communication that im now getting with the company, should i consider getting back in touch with her ? 

&#x200B;

Thanks !",https://www.reddit.com/r/jobs/comments/ghtyao/would_you_email_your_hr_manager_on_whether_or_not/,1,"Things are so much up in the air right now with this hype, I would suggest waiting until after the 4th of July before asking.  Keep applying for other roles just in case. ",2020-05-11 18:58:58
2282,gwo16f,False,Training,0,How can I learn a job quicker?,jobs,"I recently started a new job a couple of months back and I am currently training as a backup for another position for 2 weeks. I have one week left and I just want some advice on how to make the most out of the final week I have in order to not be a total screw up and hopefully get the position whenever one opens up.

So far I've picked up some things but after the two weeks is up I'll fill in whenever someone is on vacation or they need help. This position pays more but it is difficult to get in since there are only 3 spots and most people have been there for 10+ years. TIA for any advice",https://www.reddit.com/r/jobs/comments/gwo16f/how_can_i_learn_a_job_quicker/,1,,2020-06-04 19:14:45
226,djw9b4,False,Discipline,80,300 Job Applications Down And I’ve Finally Landed My First Job!,jobs,"I don’t know who needs to hear this but here‘s a reminder to keep going if you’re job searching. This past year has been the toughest of my life and I have faced rejections from over 200 companies, the majority of which never even had the decency to get back to me. As I sent off my 300th job application, I wondered how long it would be before I was employed. As I was thinking that exact thought, a leading multinational company got back to me and offered me a job I had interviewed for.

The job search is brutal - companies are really shitty and it takes a lot to keep pushing through the rejections. My advice as someone who has finally made it through it all is to KEEP GOING. Your break is coming. Out of 300 job applications, one company saw something in me. If it’s attainable (which it is), it’s all a matter of time and effort to make it happen so keep going. You owe it to yourself.",https://www.reddit.com/r/jobs/comments/djw9b4/300_job_applications_down_and_ive_finally_landed/,539,[deleted] ,2019-10-19 00:12:59
1418,17154a,False,[advice],12,"Lots of companies are asking for video resumes. We put together a quick ""how to"" video for video resume success.",jobs,,http://www.youtube.com/watch?v=s71eF3xbcf8,4,But... none of them could speak... ,2013-01-22 02:55:07
2172,bf9nxy,False,Startups,3,Tips on how to get a job,jobs,"Job experts of Reddit. What are some ways on how to ask for a job and show that I am interested in the position? My way of asking is saying ""Y'all hiring"" or ""May I speak to the manager?"" and the  ask for a job application. I greatly appreciate your responses and need a job to keep myself occupied in the summer. Thanks.",https://www.reddit.com/r/jobs/comments/bf9nxy/tips_on_how_to_get_a_job/,0,"One of the best ways to get hired is to prove that you can follow directions.  Most modern employers take their applications over the internet.  There's nothing wrong with asking, 'Where should I apply for a job?""  They will almost always point you to their internet portal.  Most managers switched to online applications precisely because they don't want to interact with every applicant face-to-face until they are ready for an interview. ",2019-04-20 07:17:27
1420,1fe21s,False,[advice],6,I got hired! Plus- my tips on filling out a memorable (min. wage job/retail) application!,jobs,"I was underemployed, working part-time retail at a clothing store at the mall.  I've been looking for a second job for months, and finally got hired!  I am now also a cake decorator at a local grocery store.  I had work experience working in a bakery but no cake decorating experience but applied anyway even though they were asking specifically for ""experienced cake decorators.""  I'm very excited!  Today I finished day two of training.

It's rough looking for minimum wage jobs.  It takes a lot of time.  It's a pain in the ass!  

**Here are some tips I have and things I've done that have helped me get (retail) jobs:**

* Keep applying!  Don't bank on one job.  Put in as many applications as you can.  

* Make a professional looking resume, and staple it on top of your application.  You can even make a cover letter, too if you'd like, but I never did.  (In some cases, I guess a cover letter might be over-kill for this type of job, but I don't know.)

**When you're ready to turn in your application:**

* Go to the store in person dressed very professionally.

* Smile and be nice to everyone you see.  Try to be confident.

* Ask for the manager.

* Shake his/her hand and introduce yourself.  Give him/her your resume + application.  ""Hello; how are you.  I'm so-and-so, I'm a student here/new in town.  I'm applying for the [whatever] position.""  Smile your face off (but not in a [scary way](http://media.tumblr.com/tumblr_mag4auYoHa1qcja3b.jpg)).  
EDIT: If you're not applying for a specific position but are willing to do whatever job they give you, that can be a strength.  (Some people thinks it's a weakness because it makes you seem direction-less, but it's only a weakness if you let it be.  Realize that if you're open to any position, it can help the company out.  I mentioned that I'm willing to work in different departments, so if a cashier calls out, they can call me in to cover for them, which will help your employer out a lot.)  


**On the application:**

* Write as neatly as possible.  Seriously, take your time.  I have good hand-writing, but I really slow myself down on the applications to make sure everything's clearly legible and spelled correctly.  Use white-out if necessary.

* Of course, fill it out as completely as possible.  

* Sometimes the applications will have optional questions like ""What other skills or technical training do you have that could be relevant to this job?""  DON'T BE AFRAID TO BE CHEESY!  I don't have technical training, but on my application, I wrote ""Teamwork!""  It's cheesy, sure, but it's also true- in my past jobs I've had to work on teams, and I'm good at it.  You could also write hard-working, fast learner, determined, ambitious, or something along those lines.  If you fill out more info than necessary on the application, it shows that you really do want the job and are willing to put time and thought into your app.

* Also, on some apps, there will be a space with a question like ""Why do you want this job?"" or ""Why do you think you'd be good for this position?"" or ""Why should we hire you?"" or something like that.  Tell them!  They want to know that you want the job for more reasons than just ""I need money.""  If you like the products they sell or the atmosphere of the store, tell them that's a reason.  If you could be passionate about the position, tell them!  On my cake decorator application, I knew I was lacking the experience they wanted so in this section, I wrote a short paragraph something along the lines of: ""I loved my time working at [competitor] in the Bakery.  I liked the work, and it's given me relevant experience.  I wasn't a cake decorator; however, I had some experience baking/icing cupcakes/writing on cakes/blahblah, and I really want to be a cake decorator.  I may need some training, but I'm a hard worker and a fast learner.  I'm reliable, and always show up on time.  Thank you for this opportunity, and I look forward to hearing from you.""  <- I think that answer is what got me the job.  When I came in for my interview, it wasn't really an interview.  We chatted casually for a bit, talked about what I'd done before in the bakery, and then she showed me the area, introduced me around, had me ice a cake, and then gave me my uniform!!  

* Be genuine.  Don't take my advice and say you're great at teamwork if you go into the interview and can't back up that claim with a story about how you once had to be a team player in some work scenario.  Just be honest, be yourself, and be willing to try new things.  

Well, I think that's about it.  I hope some of these tips help any of you looking for retail jobs.  These are tips I've acquired within the past two-to-three years of looking for work and working.  :)",https://www.reddit.com/r/jobs/comments/1fe21s/i_got_hired_plus_my_tips_on_filling_out_a/,11,"To add another point to this excellent list: when you get to the ""personality"" questions, answer it so that it makes you look *good* (lie even if you have to).

For example, the question may ask: ""everyone knows someone who has stole something"".  Answer may range from ""strongly disagree"" to ""strongly agree.""  In this scenario, you might be inclined to answer somewhere in the middle: ""Agree.""  But that's the **wrong** answer!  For the sake of scoring an interview, you are an honest person who only associate with honest folks!

I'm pretty sure answering these kind of questions honestly resulted my application being sorted automatically by computer into the ""no"" pile many times.  While it may seem like I am encouraging lying, I am a strong believer that these kind of questions shouldn't even be asked on applications if the employers aren't expecting honest answers. ",2013-05-31 06:17:30
2151,bx3bbv,False,Startups,8,Given 2 Equally Awful Options at My Company,jobs,"**Edit**: I do have equity in this company. Forgot to include that.

To put it in perspective, I've been working with this company before it became an official LLC. I worked for free for almost 3 years to make this happen because I was passionate about the we were doing and I wanted to see this company succeed. I still do, but after what I was informed I'm actually shook right now.

I was originally brought on as remote full-time and eventually I'd have to move to their HQ (where the majority of the workers were.) Fair enough, I didn't get paid even close to what I should be making at the start but we were an early company and I believed in the vision, so I understood that my fiancee (girlfriend at the time) and I would have to move there eventually. My thought process was if I got a salary adjustment, my fiancee and I would discuss it more in depth and finally decide when the time would be right (which would primarily be with the salary adjustment since I live in a very expensive area currently, and saving up has almost been impossible.)

So the months go on and here I am at about 9 months as a full-time employee. I get informed last night that I have two options:

**1.)** Move there with a slight salary increase (a super small percentage of an even lower than entry-level salary given 6 years in my field), 12 months of guaranteed employment, and they'd give me a small amount for travel (less than $1,000.)

**2.)** Become a contractor and lose all my benefits (and eventually be pushed out when they found someone more local to them.)

I am absolutely devastated right now. The incentive for moving is not there, and even made worse that I have to pay an absurd amount for a lease break among other financial commitments coming up (we literally just signed for a wedding venue *yesterday*.) Since I couldn't save up a lot I would clearly be going into the red for this move, and as much as my fiancee is well-off financially and can help afford things, I can't place her into this financial burden with me. On top of this, she would have to find a new job there and disconnect from all of her friends and social activities she does. I feel ashamed

On the other hand, going contractor literally feels like I'm losing my job but in a ""nice corporate way."" I would have to get on my fiancee's health insurance through eloping early because I have a reoccurring medical condition and I *have* to have decent insurance for, less I pay an absurd out-of-pocket every year. Then finding a job around where I live would be insanely difficult because the market for my career here is abysmal. I worked too hard for this...

I'm at a loss. I talk to my CEO today in a few hours to hear more about it, but after busting my ass for almost 5 years working 60-80 hour weeks... I don't know. 

I have nothing to ask of anyone, so I suppose this is just a warning to people: a company doesn't give a fuck about you if it means saving them money.

Be careful out there.",https://www.reddit.com/r/jobs/comments/bx3bbv/given_2_equally_awful_options_at_my_company/,5,[deleted] ,2019-06-05 14:39:43
1722,86cno7,False,Companies,48,Does anyone else feel like they're just not cut out for corporate life?,jobs,"I feel like I will miserable being in any cubicle, behind any computer, ass-kissing any executives. I just don't like it. I don't know what to do. ",https://www.reddit.com/r/jobs/comments/86cno7/does_anyone_else_feel_like_theyre_just_not_cut/,37,Do you currently work in a cube or is this a hypothetical? I can't really tell. ,2018-03-22 16:08:04
1639,cgz2hv,False,Companies,9,Is this company legit?,jobs,"I recently went for an interview at an investment firm but am unsure if they are legitimate or not.

My concerns:

* Website is full of jargon and doesn't mention anything about who works there
* No social media presence (or Glassdoor)
* Saw only other employee at their office building (they were in a serviced office)
* Address listed on website is different to the service office address
* Job description didn't specify hours
* The interviewer doesn't have the company on his LinkedIn profile",https://www.reddit.com/r/jobs/comments/cgz2hv/is_this_company_legit/,1,"Did you ask about why there was no one was there? 

Did they automatically hire you? 

Did they ask for any personal information? ",2019-07-23 21:52:03
