Num,ID,is_Original,Flair,num_comments,Title,Subreddit,Body,URL,Upvotes,Comments,creation_date
374,ffapr7,False,,25,"Iranian lawyer who defended women’s right to remove hijab gets 38 years, 148 lashes.",Feminism,,https://womenintheworld.com/2019/03/11/iranian-lawyer-who-defended-womens-right-to-remove-hijab-gets-38-years-148-lashes/?fbclid=IwAR2_ETSMoalu5qnQYTIbvUwki_vVttJQbco2rYL2sP2Ez9nRR6NZQ6LbG08,1205,I wish something like this would happen to White women in America just so they’d be grateful for what they have for change. ,2020-03-08 10:15:00
226,da13n5,False,,83,True,Feminism,,https://i.redd.it/fwfkxvk0l4p31.jpg,1553,[removed] ,2019-09-27 14:20:55
50,csg08v,False,,97,Protest against state-sanctioned misogyny,Feminism,,https://i.redd.it/275zdrh49eh31.jpg,2504,[removed] ,2019-08-19 11:50:46
953,ewf8wi,False,,59,Wooo man if only i could show this to all men who blame me specifically for them not being a feminist jfc,Feminism,,https://i.redd.it/5bfd4izoa0e41.jpg,554,[removed] ,2020-01-31 00:11:03
462,cqri8u,False,,56,Female Artists,Feminism,,https://i.redd.it/wwqwgih7umg31.jpg,1048,"Does anyone seriously think there weren't female artists before the 1500s? Like that seems so glaringly obvious I can't imagine someone honestly taking the position that it was all men, all the time before then. ",2019-08-15 15:39:10
525,c7mzgp,False,,70,Some Light Bedtime Reading,Feminism,,https://i.redd.it/rkv76znssl731.jpg,959,[removed] ,2019-07-01 02:32:10
422,eckmtf,False,,64,More men like him please,Feminism,,https://i.redd.it/rli7yjkisf541.png,1115,"Were the bra's pre-worn? If so, I find that kind of gross, even if they were deep-cleaned. ",2019-12-18 23:39:28
629,abztnj,False,,51,"""Radical Feminist """,Feminism,,https://i.redd.it/17kj8e61t3821.jpg,829,[removed] ,2019-01-03 00:36:43
113,bqd6w0,False,,93,I graduated from nursing school!,Feminism,,https://i.redd.it/kx2ya5x5o3z21.jpg,1999,[removed] ,2019-05-19 05:01:50
579,dzo4w0,False,,81,"""6/BDSM is now a strategic defense for men in the way that 'provocation' has previously been. And to see it increasingly being used, and working, over the last few years is hugely troubling. 7/There is nothing a woman can do to cause a man to kill her""",Feminism,,https://i.redd.it/4aujgs4t83041.jpg,891,[removed] ,2019-11-21 19:07:59
42,br7475,False,,268,Abortion,Feminism,,https://i.redd.it/5n56idmehiz21.jpg,2605,[removed] ,2019-05-21 06:49:54
590,27n838,False,[Comic],78,"In short terms, I'm a feminist",Feminism,,http://imgur.com/Sn1M9a8,872,[removed] ,2014-06-08 21:09:46
273,e3chqz,False,,40,Not a Girl Boss. Just a Boss.,Feminism,,https://i.redd.it/l380szk2fl141.jpg,1401,But it’s fun to call myself a girl boss ,2019-11-29 09:19:14
387,a15a8e,False,,70,Not O/C but my girlfriend told me to post it,Feminism,,https://i.redd.it/lt5lfvyh12121.jpg,1185,[removed] ,2018-11-28 11:11:40
612,9is9yd,False,,70,Man who slapped woman's bottom gets first fine under new French 'cat-call' law,Feminism,,http://news.trust.org/item/20180925124532-jsj3y/,836,It's about damn time. ,2018-09-25 13:49:06
675,6hq5fv,False,[Gender norms],37,Role models,Feminism,,http://i.imgur.com/JftsH3T.jpg,775,"I never went into medicine or law enforcement (I am a historian and an archaeologist), but I consider Dana Scully as the ultimate fictional feminist goddess from the 90's... the one I looked up to growing up.

Also, I know both her and Captain Picard would be proud of me. :)

https://en.m.wikipedia.org/wiki/Dana_Scully#.22The_Scully_Effect.22 ",2017-06-16 23:26:39
820,bf2e0a,False,,36,Female student burned to death for reporting sexual abuse,Feminism,,https://www.aljazeera.com/news/2019/04/nusrat-rafi-burnt-death-reporting-sexual-abuse-police-190419070341185.html,653,[removed] ,2019-04-19 18:16:10
408,2epkd6,False,,43,Playboy weighs in on catcalling/street harassment with an easy flowchart. Surprisingly good!,Feminism,,http://i.imgur.com/DziIt9T.jpg,1137,"under ""does she look sad"" there should be 2 more options 

1. ""yes sad, but i'm not gonna cat call""

2. ""not  sad, but i'm gonna cat call""

this is flow chart 101 people!!! ",2014-08-27 08:52:56
853,840g69,False,[Activism],105,"""Transwomen are women shutup"" sign at the IWD march in Karachi, Pakistan",Feminism,,https://i.redd.it/0iy5wtskofl01.jpg,621,[removed] ,2018-03-13 01:30:11
816,gci173,False,,52,Rape and Intersectional Feminism,Feminism,,https://i.redd.it/4681h9etcgw41.jpg,655,"The comment section in a nutshell (with few exceptions): 

Black feminists: white rapists should be held to the same standards as black rapists. Men who rape women should suffer some consequence as rape is a form of gendered terrorism. 

MRAs of Reddit: Black feminists are racist and we should silence them by sending a slew of misogyny with the aid of our white brethren. ",2020-05-03 01:25:53
330,bg65et,False,,297,I think this portrays it perfectly,Feminism,,https://i.redd.it/fdi3kjst8vt21.jpg,1291,[removed] ,2019-04-22 19:20:13
685,6tlli9,False,[Race][Politics],49,Trump is the reason a woman is dead (xpost /r/EnoughTrumpSpam),Feminism,,https://i.redd.it/5g3aeyfuxlfz.jpg,772,[removed] ,2017-08-14 10:41:12
602,eyrvau,False,,12,Women in Science,Feminism,,https://i.redd.it/ybfy48ligxe41.jpg,857,"It really can't be overstated how totally revolutionary Lane-Claypon's 1926 report was.

The actual nature of her work (breast cancer research) was obviously important on its own, but the methods she employed completely changed our concept of scientific studies. 

She literally created the idea of comparing case studies (in this case, those with breast cancer) against control groups (those without). She also pioneered the use of statistical analysis to determine the likelihood that the difference between the groups was due to random chance. 

Lane-Claypon's name should be known to every student of biological science. She should be right up there with Darwin, Mendel, Hooke, and Pasteur. ",2020-02-04 15:42:30
924,a2h71w,False,,61,George H.W. Bush was an enemy of women's rights. No Tears for Racist War Criminals.,Feminism,,http://leftvoice.org/No-Tears-for-Racist-War-Criminals?var_mode=calcul&fbclid=IwAR3LlLqSASRz6nY12Ctyzj_zRDRZz4de2ZIIqyYig3M0x5esSRUAS4qghWg,571,[removed] ,2018-12-02 20:56:57
133,dza9s2,False,,136,Practice makes perfect,Feminism,,https://i.redd.it/9jev6590fxz31.jpg,1899,[removed] ,2019-11-20 23:31:59
6,a1cqk0,False,,264,About abortion,Feminism,,https://i.redd.it/k4at3i36c6121.jpg,3741,[removed] ,2018-11-29 01:38:36
41,dcdzec,False,,260,I hate getting this question,Feminism,,https://imgur.com/yEFq84x,2636,[removed] ,2019-10-02 18:09:15
586,cppd55,False,[Trigger Warning],67,"they don't protect us, they rape us. Police officers raped a 17-years old girl",Feminism,"This is the first time I post on this subreddit. Last week a 17-year-old girl was raped by 4 police officers inside the patrol car, she made her complaint but someone leaked the basic data of her complaint as her name (this is illegal) so the women of Mexico City decided to protest , your integrity was violated by filtering your personal data. The protest went out of control and some women in despair of being heard decided to exert violence by breaking doors and writing on walls ""rapists"" and the hashtag of the protest that is ""#NoMeCuidanMeViolan"" which means ""they don't protect me, they rape me"". Many are judging the fact that women used violence and damage to other people's property, but it is a desperate act for a situation that warrants it, in recent years Mexico has been increasing in femicide and rape. However, the authorities still do nothing. I share that because this situation is not being sufficiently viralized, we need the eyes of the world to focus on the crisis that women in Mexico experience because of the little importance that our authorities give it.",https://www.reddit.com/r/Feminism/comments/cppd55/they_dont_protect_us_they_rape_us_police_officers/,870,[removed] ,2019-08-13 06:49:02
925,hht0er,False,,29,I Reported My Assault and Learned First-Hand Why So Few Survivors Do,Feminism,,https://medium.com/@julietfessel/i-reported-my-assault-and-learned-first-hand-why-so-few-survivors-do-c5cb61902a64,574,"the reason so few survivors report is someone tweets about it on twitter 2 years after it happened in Detroit and the complains nothing is done about it, scaring people into not reporting because they think nothing will be done about it, well yeah if you don't report nothing will be done ",2020-06-29 04:08:21
972,e1xk3s,False,,27,"Subtle exposure to religious words can increase benevolent sexism, suggests a new study (n=670), which found that brief exposure to Judeo-Christian religious words can increase the endorsement of sexist attitudes among both men and women.",Feminism,,https://www.psypost.org/2019/11/new-psychology-research-indicates-that-subtle-exposure-to-religious-words-can-increase-benevolent-sexism-54956,545,This is not a secret ,2019-11-26 12:53:41
806,2f627m,False,,23,"""welcome to reddit"" - xpost from /r/Shitty_Watercolour",Feminism,,http://i.imgur.com/eVagkul.jpg,670,But how is this different from all of the shitty magazines who stalk celebrities and gossip? ,2014-09-01 13:35:04
536,hd7ct5,False,,50,"It's not funny to say sexual things to a customer service worker and it's a ""prank"" is not a valid excuse.",Feminism,"There's a video posted on Instagram by Toerrey where he tells the employee she forgot to ""shake that ass""

It's supposed to be a ""prank""

She clearly doesn't find it funny. 

This has happened to me multiple times working in customer service positions. And I have never found it funny, rather it makes me replay the situation several times in my head, kills my mood for the rest of the shift/day, makes me feel sad and think about what I could have done differently. At the end of the day, it isn't about what I could have done differently, it's about people understanding that this kind of stuff is inappropriate. 

If she laughed, okay that's fine. But she clearly didn't find it funny.

I hope that bringing awareness to this video helps educate ""pranksters"" how uncomfortable it makes people feel in the workplace and it needs to stop. These aren't ""pranks"" this is making women feel unsafe and sexualized in the workplace. 

She wasn't doing anything wrong. She was doing her job. People seem to take advantage of the fact that the ""customer is always right"" and take it too far.",https://www.reddit.com/r/Feminism/comments/hd7ct5/its_not_funny_to_say_sexual_things_to_a_customer/,938,[deleted] ,2020-06-21 13:58:12
311,gty0v4,False,,122,"Regis Korchinski Paquet, another young Black woman was recently murdered by the Toronto police. One can draw interesting pictures from the facts that 40% of north American male cops are domestic abusers & Derek Chauvin's Asian wife chose the night he was in protective custody to file for divorce",Feminism,,https://i.redd.it/56k9ojund3251.jpg,1323,"To the extremely objective egalitarian trollflakes -- 

[""... the family lawyer, Knia Singh, says Korchinski-Paquet's mother does not believe her daughter was pushed, but does think police were involved with the fall to her death"". ""A lot of times when people call the police for mental health issues, it ends in death — and it shouldn't""](https://www.blogto.com/city/2020/05/regis-korchinski-paquet-protest-march-toronto/) 

The only sceptics who believe police are blameless are police themselves and their extremely egalitarian enablers. ",2020-05-31 12:12:16
862,8iq006,False,,3,"TIL In 2010, the Forest Service made Betty White an honorary forest ranger. White said in previous interviews that she wanted to be a forest ranger as a little girl but that women were not allowed to do that then. When White received the honor, more than 1/3 of Forest Service employees were women.",Feminism,,https://www.wikipedia.org/wiki/Betty_White,610,I thought this was /r/outdoors or something like it when I first saw it which means progress right? ,2018-05-11 18:24:26
573,7zci3b,False,,35,Regulating while ignorant,Feminism,,https://i.imgur.com/fRVwDEO.jpg,890,"To be fair, an AR-15 being a non assult weapon, is like saying the Female reproducitve system gives live birth. Both are very general statments, thy arent saying to understand every aspect of the gun ",2018-02-22 05:32:11
483,ekwb6e,False,,70,"Nike had depicted a great woman mathematician in a hijab, despite the fact she chose not wear the garment while she was alive. She died of breast cancer in 2017. Glorification of hijab is a form of gendered Islamophobic attack against Muslim women.",Feminism,,https://i.redd.it/ca8pk7rhp6941.jpg,1032,[removed] ,2020-01-06 16:24:02
927,9yy2qn,False,,65,"Two men who raped a woman in Korean army for ""being lesbian"" have been found not guilty by the High Court for Armed Forces.",Feminism,"[http://news20.busan.com/controller/newsController.jsp?newsId=20181119000186](http://news20.busan.com/controller/newsController.jsp?newsId=20181119000186)

Two men who sexually assaulted a female soldier in Korean army for ""being lesbian"" both separately have been found not guilty by the High Court for Armed Forces.

in  2010, a female soldier ""A"" was repeatedly sexually assaulted by Lieutenant Commander ""B"" and was made pregnant.

After she got an abortion, she told Commander ""A"" what happened, but instead, he sexually assaulted her as well. 

According to her, after she told ""B"" about her sexuality, he replied ""That's because you don't know about men. I'll teach you how it feels"" and sexually assaulted her.

Suffering from PTSD, she reported it in 2016 and the perpetrators were arrested last September.

 She pressed charges against them, in a first trial, ""B"" was sentenced to 10 years in prison, and ""A"" to 8 years.  But the HCAF overturned the first ruling, acquitting ""B"" today(Nov. 19. 2018). Commander ""A"" was already acquitted on Nov. 8.

&#x200B;

[http://www.koreaherald.com/view.php?ud=20181120000687](http://www.koreaherald.com/view.php?ud=20181120000687)

[https://www.koreatimes.co.kr/www/nation/2018/11/251\_258994.html](https://www.koreatimes.co.kr/www/nation/2018/11/251_258994.html) ",https://www.reddit.com/r/Feminism/comments/9yy2qn/two_men_who_raped_a_woman_in_korean_army_for/,568,I feel greatful for living in America. ,2018-11-21 00:25:01
222,cazjb0,False,,92,Feminism is the reason we expect better.,Feminism,,https://i.redd.it/4xes7egvh9931.jpg,1565,"yet here you are, perpetuating the notion that women are prey and men are predators, speaking of rape culture, patriarchy etc. Every step of the way you proclaim yourself to be a victim of some oppression or some male aggression or toxic masculinity. At every turn, here you are, victimizing yourself. How is it not at least partially a failure of feminism that these notions still exist? You obviously keep perpetuating them, then you pretend like you're not, but you still point out that women need to be strong in order to be able to protect themselves from male predators. Because you have to fight against 'boys will be boys', but what does that mean except males being a form of predators? ",2019-07-09 11:17:48
992,5oj5zj,False,,8,Three Times As Many Bus Permits Have Been Requested For The Women's March Than For Trump's Inauguration,Feminism,,https://www.buzzfeed.com/juliareinstein/three-times-as-many-bus-permits-have-been-issued-for-the-wom?utm_term=.yc86BqldJ#.afy3RqXr8,523,I'm happy with the statistic but I still think liking a Buzzfeed article is poop.  ,2017-01-17 16:54:46
400,azf75j,False,,88,Affairmative Consent,Feminism,,https://i.redd.it/monnyw9bcal21.jpg,1165,[removed] ,2019-03-10 12:29:14
634,e0ghgc,False,,10,"Gladys Mae West contributed to the mathematical modeling of the shape of the Earth, & her work on the development of the satellite geodesy models that were eventually incorporated into the GPS & on an astronomical study that proved the regularity of Pluto’s motion relative to Neptune.",Feminism,,https://i.redd.it/c5neps1h3f041.jpg,822,But she sees none of the profits :( ,2019-11-23 10:59:26
896,1b6u9z,False,,45,"I was on Urban Dictionary, and, among some other terms, I decided to look up 'feminist'. Given the site, I was pleasantly surprised.",Feminism,,http://imgur.com/UkHokwH,595,That's a damn simplification. For me the most important thing about being a feminist is recognizing privilege. ,2013-03-28 17:55:07
682,1o1upz,False,,43,Just Remember...,Feminism,,http://i.imgur.com/A6bpn7A.jpg,773,"Inherently no, but in the context of certain patriarchal gender norms, one may be more liberating than the other. Choice is important, but it's not everything. ",2013-10-09 08:39:32
165,g0hhv9,False,,54,Feminism is Sexy,Feminism,,https://i.redd.it/phckwgk7qks41.png,1743,"We all know why the guy is a **""feminist""** lol ",2020-04-13 11:51:45
917,7456y7,False,,59,Hypocrisy between gun control and abortion rights highlighted,Feminism,,https://i.redd.it/q9b5u59y1qpz.jpg,581,[removed] ,2017-10-04 02:09:41
110,a5x8w2,False,,216,"""It's a dangerous time for men""",Feminism,,https://i.redd.it/oiv3tad2t3421.jpg,2015,[removed] ,2018-12-13 20:21:08
741,cwmqsb,False,,19,Women in Physics,Feminism,,https://i.redd.it/kwcsdtclp7j31.jpg,721,[removed] ,2019-08-28 15:58:55
832,5a4g1u,False,,30,Suffragette postcard from 1924. The top rung of the ladder says “presidency”.,Feminism,,https://i.redd.it/n3bk60mcejux.jpg,637,[removed] ,2016-10-30 04:10:06
994,12ruie,False,,20,Good work Missouri. ,Feminism,,https://sphotos-b.xx.fbcdn.net/hphotos-ash4/396699_169075293216759_1500267266_n.jpg,527,I like how half the country has independently come up with some version of this joke.  I guess he really set himself up for it. ,2012-11-07 04:05:34
765,cufjbx,False,,7,"Lisa Calan, Kurdish Filmmaker whom lost her legs by ISIS bombing, dances freely",Feminism,,https://v.redd.it/1tb5sjcxw7i31,695,This is genuinely so heartwarming ,2019-08-23 15:37:12
288,bt5ujc,False,,27,"The fight for equality, and the truth.",Feminism,,https://i.redd.it/1j053st9ui031.jpg,1383,Planned parenthood’s founder also believed in racial purification and sterilization of minorities... ,2019-05-26 09:06:19
852,cyc3tw,False,,5,This was posted on r/welding ♀️ thought I'd share here,Feminism,,https://i.redd.it/dkbt1znxsyj31.jpg,620,This is so cool! Her smile is contagious ,2019-09-01 16:32:43
703,de69m4,False,,106,Religion and Forced Prostitution,Feminism,,https://i.redd.it/xh325egfgyq31.jpg,744,[removed] ,2019-10-06 17:24:36
750,6glwlt,False,[Abortion rights],16,Delaware becomes first state under Trump to ensure abortion will remain legal,Feminism,,https://news.vice.com/story/delaware-becomes-first-state-under-trump-to-ensure-abortion-will-remain-legal,707,"Trump didn't outlaw abortion though, just made it so it's a state issue rather than federal issue. ",2017-06-11 15:21:54
257,cptlg4,False,,48,"After the brutal rape, torture, mutilation & murder of a 32 y old woman,12 women assembled outside the Assam Rifles headquarters in Kangla Fort, Imphal, and stripped all their clothes and screamed slogans of “Indian Army rape us… we all are Manorama’s mothers” & “Kill us. Rape us. Flesh us.”",Feminism,,https://i.redd.it/jasqvu5l38g31.jpg,1458,[deleted] ,2019-08-13 14:04:56
158,bqi5ct,False,,54,Banning abortions isn't the solution.,Feminism,,https://i.imgur.com/ulzIpnq.jpg,1760,[removed] ,2019-05-19 15:24:17
711,diqlxe,False,,14,Physicist Lise Meitner with students in 1959. She was nominated 48 times for the Nobel (but never won),Feminism,,https://i.redd.it/5ah3akxpmws31.jpg,740,She does have an element named after her though! ,2019-10-16 15:08:48
517,hoq26g,False,,7,Instagram is banning all content promoting LGBT conversion therapy,Feminism,,https://www.businessinsider.com/instagram-bans-all-content-promoting-lgbt-conversion-therapy-2020-7,961,"That's some good stuff, bs like this needs to stop. Is it only me or has the world started to get more woke since this pandemic because if it has then that is just great. ",2020-07-10 14:38:05
984,86j6k5,False,,7,In Poland today we strike against dangerous abortion restrictions,Feminism,,https://www.amnesty.org.uk/press-releases/poland-mass-demonstrations-against-dangerous-abortion-restrictions,534,Solidarność ,2018-03-23 08:49:26
886,b8xext,False,[Disability feminism],94,"English judge says man having sex with wife is ""fundamental human right""",Feminism,,https://amp.theguardian.com/law/2019/apr/03/english-judge-says-man-having-sex-with-wife-is-fundamental-human-right,602,[removed] ,2019-04-03 12:38:18
961,8gznpd,False,,88,"What do incels, fascists and terrorists have in common? Violent misogyny",Feminism,,https://www.theguardian.com/commentisfree/2018/may/04/what-do-incels-fascists-and-terrorists-have-in-common-violent-misogyny,553,"When I saw incel in the title, I looked it up in two dictionaries, and then found it on urban dictionary. 

This article talks about an incel 'movement'. And that is is part of right wing populism.

I've never heard of this. Where is incel a movement? ",2018-05-04 14:28:35
795,g9am33,False,,102,"Jessica Valenti: ""Believing women means doing so whether it's politically convenient or not."" And what about other 7 survivors? They are also entitled to feminist solidarity.",Feminism,,https://i.redd.it/it4b33x0pfv41.jpg,679,"Didn't women and people of color overwhelmingly nominate Biden? Looking at the publicly available primary stats, it sure looks like they did. No one stole the nomination from anyone. The will of the democratic people was heard and the verdict is, they want an assailant before a progressive. It's gross but that's the world we live in, not the world this meme was imagined in. ",2020-04-27 22:08:24
341,brb76t,False,,94,"Not sure if this has been shared here before, so if it was, do feel free to tell me. Source in comments.",Feminism,,https://i.redd.it/b3o4gy1wmiz21.jpg,1266,Does society suddenly not want people to produce? Why would there be a problem with men (or anyone) being potent? I'm confused as I assume this is about abortion but it doesn't make sense as taking away peoples ability to make children shouldn't have anything to do with the discussion about the morality of abortion. If I'm misinterpreting this post lmk ,2019-05-21 14:39:14
217,az2wy0,False,,62,"Yesterday in March 8 we had protests and a women's labor strike all over my country. This is how women day looks like in Spain, and this is just my city (Sevilla) with 170k people protesting for woman rights. Madrid protests was bigger: 375k people. I am proud",Feminism,,https://i.redd.it/x7hiv8qq43l21.jpg,1569,"Are they stopping traffic?
If so they need to stop being selfish, instead of having a peaceful protest they're stopping everyone's day, if not good for them, if it's a peaceful protest in all for it
 ",2019-03-09 12:14:18
856,gu3ouj,False,,18,White Women: Think about this before you defend our law enforcement system...,Feminism,"If you were raped, what are the odds your rape kit would even be tested? 

[Why Did Police Department Throw Out Rape Kits - NPR](https://www.npr.org/2018/12/05/673795500/why-did-police-departments-throw-out-rape-kits)

Would you be able to trust the cop you were talking to to not be a rapist? 

https://www.google.com/amp/s/www.washingtonpost.com/local/public-safety/former-police-officer-charged-with-exposing-victim-to-hiv-during-rape-following-traffic-stop-authorities-say/2020/01/22/4f6f5d6e-3d33-11ea-baca-eb7ace0a3455_story.html%3foutputType=amp

https://policecrime.bgsu.edu/Home/Crimes

If you had an ex send around revenge porn of you, would you be able to trust the cop you were interacting with to not save it to his personal phone? 

https://www.sltrib.com/news/education/2020/05/17/university-utah-police/

If your ex was stalking you, could you trust police to help? 

https://archive.thinkprogress.org/mccluskey-university-of-utah-warned-police-about-ex-boyfriend-6-times-bc08aed0fad5/

https://www.google.com/amp/s/www.independent.co.uk/news/world/americas/lauren-mccluskey-murder-utah-police-warning-ex-boyfriend-melvin-rowland-a8705411.html%3famp

https://www.google.com/amp/s/www.independent.co.uk/news/uk/crime/laura-stuart-murder-jason-cooper-domestic-abuse-death-north-wales-police-denbigh-a9062361.html%3famp

Our law enforcement system needs to change.",https://www.reddit.com/r/Feminism/comments/gu3ouj/white_women_think_about_this_before_you_defend/,621,[removed] ,2020-05-31 18:02:36
604,bnf2v7,False,,6,Mary Wallace: First female bus driver for Chicago Transit Authority (1974),Feminism,,https://i.redd.it/4q9nljqaykx21.jpg,850,And she is also black ,2019-05-11 18:10:38
709,btqfvt,False,,23,"Engineer Karen Leadlay working on the analog computers in the space division of General Dynamics, 1964",Feminism,,https://i.redd.it/n3zdm270wq031.jpg,741,Yall know sumtins up when her names Karen ,2019-05-27 19:46:32
595,aq94sr,False,,43,Night Witches - The Female Fighter Pilots from WW2,Feminism,,https://i.redd.it/w0u7fdo8jbg21.jpg,866,"I’ve heard of women in ww2 being Russian snipers but never this before, the story seems a bit exaggerated but cool nonetheless.  ",2019-02-13 17:37:44
930,5d2mnp,False,[Workplace/Career],26,"When Google was losing a lot of female employees because they weren't coming back to work after giving birth, Google lengthened maternity leave to five months from three and changed it from partial pay to full pay, and the amount of women who didn't come back after maternity leave dropped by 50%.",Feminism,,http://www.tvovie.com/2016/11/in-googles-inner-circle-falling-number.html,569,Fathers get seven weeks. The family also gets a 'congrats' check.  ,2016-11-15 14:00:09
