Num,ID,is_Original,Flair,num_comments,Title,Subreddit,Body,URL,Upvotes,Comments,creation_date
519,cwyckp,False,,26,Overlooked Women of Science: Mother of Climate Science.,Feminism,,https://i.redd.it/bpn4vu0itcj31.jpg,963,"Happy her efforts are getting recognized. Sad that we set up a society where one gender is so fragile they couldn't even handle another having ownership of ideas. I hope we can work to a point where all ideas are credited properly, the good along with the bad ones. ",2019-08-29 09:09:44
827,gqltiy,False,,18,New Mexico may elect historic all-female U.S. House delegation,Feminism,,https://www.latimes.com/politics/story/2020-05-25/new-mexico-may-elect-historic-all-female-us-house-congressional-delegation,639,But why? ,2020-05-25 23:33:46
253,71govb,False,,109,"This can never go away, this needs to continue to get posted over and over again. This should never be forgotten",Feminism,,https://i.reddituploads.com/2e9b230c2c5345339761941f7645bc1a?fit=max&h=1536&w=1536&s=66a4ebc053466f3fcf4d0c239e39a06b,1476,[removed] ,2017-09-21 04:04:18
670,f0fb47,False,,85,"I've definitely been told ""god you get so offended!"" or ""why can't you take a joke?"" No.. I just won't laugh along to sexist jokes anymore",Feminism,[https://www.theguardian.com/commentisfree/2016/jun/20/cant-you-take-a-joke-love-why-the-banter-isnt-funny-anymore](https://www.theguardian.com/commentisfree/2016/jun/20/cant-you-take-a-joke-love-why-the-banter-isnt-funny-anymore),https://www.reddit.com/r/Feminism/comments/f0fb47/ive_definitely_been_told_god_you_get_so_offended/,784,"Tbh, this is my opinion, you can joke about anything but it has to be funny ",2020-02-07 19:17:45
23,crxr7d,False,,119,Hmmmmm,Feminism,,https://i.redd.it/evnbvoopg5h31.jpg,2960,[removed] ,2019-08-18 06:17:16
307,dj6zxa,False,,81,Body Autonomy,Feminism,,https://i.redd.it/946qb0cu04t31.jpg,1323,[removed] ,2019-10-17 14:16:08
959,97lq10,False,,27,Young woman develops a security necklace to counter sexual assaults and harassments.,Feminism,,https://v.redd.it/sjq7shlq2bg11,556,"Wow, I can imagine how this would empower many women who live in cultures where women are not treated as equals. Awesome. But as I sit here typing, realizing my own privilege within my own culture, but yet we still have a very long way to go.  ",2018-08-15 20:26:30
999,4tx0rz,False,,85,"Donald Trump accused of child rape in a federal lawsuit, with a co-defendent who is a convicted pedophile.",Feminism,"Donald Trump is accused of violently raping a 13 year old girl, whom he tied to a bed, in 1994. She was allegedly being held as a sex slave at the home of Jeffrey Epstein, who was a friend of Trump's and is a convicted pedophile with a preference for young girls. After the alleged attack from Trump ended, the girl says Epstein proceeded to rape her. An employee of Epstein's witnessed the rape and corroborates the survivor's story. Trump has been accused of a violent rape before by his ex-wife Ivana Trump, and of attempted rape by a former business colleague.

The mainstream media hasn't reported on this lawsuit, reminiscent of the underreporting of the Cosby rape allegations for over a decade. Another sign that the media reflects the interests of the wealthy and powerful. Infuriating.

Links: 
http://www.dailylife.com.au/news-and-views/dl-opinion/the-presumption-of-innocence-isnt-a-free-pass-for-powerful-men-to-avoid-scrutiny-20160703-gpxp28.html

http://www.huffingtonpost.com/lisa-bloom/why-the-new-child-rape-ca_b_10619944.html


Edit: I previously wrote that the attempted rape allegation was from a former employee, but it was from a former business colleague. 
",https://www.reddit.com/r/Feminism/comments/4tx0rz/donald_trump_accused_of_child_rape_in_a_federal/,524,[removed] ,2016-07-21 13:42:33
723,690nww,False,[Sports],44,You throw like a girl...,Feminism,,http://i.imgur.com/vpsldDd.gifv,732,[removed] ,2017-05-03 14:27:18
157,bdp1s2,False,[Abortion rights],179,This goes here.,Feminism,,https://i.redd.it/v9txzh74tes21.jpg,1767,[removed] ,2019-04-16 03:11:35
905,ckx9rg,False,,16,Saudi women no longer need permission of male guardian to travel: Okaz,Feminism,,https://english.alarabiya.net/en/News/2019/08/01/Saudi-women-no-longer-need-their-guardian-s-permission-to-issue-a-passport-Okaz.html,586,"Some people are saying that the fact that Nicki Minaj pulled out of performing in Saudi Arabia with respect to women’s & LGBTQ rights, might have influenced this progress. ",2019-08-02 01:12:49
428,fz66w1,False,,140,Landlords asking for sex instead of rent during COVID-19 crisis- Fucking Disgusting,Feminism,,https://www.9news.com.au/world/coronavirus-sex-for-rent-reports-increase-in-hawaii-since-covid19-pandemic/b5954e87-5f1b-47b8-9406-ea3826142323,1098,[removed] ,2020-04-11 14:19:24
899,eff858,False,,164,Reddit is becoming more and more sexist - or is it just me?,Feminism,"I started using reddit around 2010 and stopped for a while for no particular reason then joined again like 2 years ago.

I don't know if I'm just more aware of this now but the ammount of sexism and hate towards women and lgbt+ on reddit these days is damn too high. 

Everyday there is at least one sexist shit on the frontpage. I see so much hate towards famous women who are basically hated for speaking their mind, line Lena Dunham, Amy Schumer, Cardi B... Sure you don't have to like what they do or agree to what they say but the sexism behind these memes is real. Joking about trans and non binary people seems to be totally acceptable for so many users. Joking about how dads are cooler than moms and how boys are funnier and smarter than girls. That's just the basic stuff there is so much more. 

I'd like to say that there is also more feminist and just generally kinder / more understanding and open content too, but not as much as the hate stuff.

Am I the only one noticing that? Honestly I unsuscribed from so many subs I'm thinking about leaving reddit completely.",https://www.reddit.com/r/Feminism/comments/eff858/reddit_is_becoming_more_and_more_sexist_or_is_it/,589,[removed] ,2019-12-25 10:53:28
776,bm10ag,False,[Cultural issues],29,"Jill Biden says it's time to 'move on' from her husband's treatment of Anita Hill.How About We Don’t Sweep Destroying a Woman’s Credibility and Character in front of the National Press, Public, and Congress Under The Rug. Kavanaugh was a National Embarrassment let’s not Repeat That.",Feminism,,https://www.businessinsider.in/jill-biden-says-its-time-to-move-on-from-her-husbands-treatment-of-anita-hill-during-the-1991-clarence-thomas-confirmation-hearings/articleshow/69225164.cms,690,https://joebiden.info/ ,2019-05-08 04:42:20
61,dvlf9a,False,,72,In a nutshell.....,Feminism,,https://i.redd.it/2jr406euddy31.jpg,2344,[removed] ,2019-11-13 03:06:02
704,5n6lwn,False,[Fashion],59,This 1992 image reminds me of a time when boys and girls fashion was much less differentiated.,Feminism,,https://i.redd.it/u8i4eco6ex8y.jpg,751,I remember seeing kids wearing the exact haircut as that boy. Man I loved the 90's!   ,2017-01-10 18:12:46
245,h0yo8n,False,,52,That. Example: Women who cry are considered irrational by heteropatriarchal standards but men who demonstrate an extremely unnecessary burst of anger are not.,Feminism,,https://i.redd.it/cviuh6642a451.jpg,1502,[removed] ,2020-06-11 12:48:22
618,gwh2wf,False,,14,"They are few of the 100s of women & girls kidnapped by armed groups there since 2018. The governor in Turkey-occupied Afrin refuses to disclose the status of the kidnapped women, further confirming that the kidnapping of Kurdish women is carried out with the knowledge & supervision of the Turkey.",Feminism,,https://i.redd.it/j9brba3v6w251.jpg,831,"A lie of a terrorist organization that sees women as toys and suicide bombers.They lie all the time. If you want reliable sources, facts will come out.

Truths

I have previously written the views about women of Abdullah Öcalan, the founder of the terrorist organization PKK / YPG, who told these lies . I am writing again. The person they support and worship is someone who humiliated women.

In many videos, Abdullah Öcalan (founder PKK/YPG) says that he sees women as toys and that ugly women have no place in the terrorist organization.

One of the videos.

[https://www.youtube.com/watch?v=X9ALJys0zgk](https://www.youtube.com/watch?v=X9ALJys0zgk)

This is the book written by Abdullah Öcalan.

[https://odatv4.com/images/resimler/%C3%B6calan.jpg](https://odatv4.com/images/resimler/%C3%B6calan.jpg)

In the book, he writes the following statements for Kurdish women.

""**It may sound strange to some of them, but it is useful to open it. The bodies of most Kurdish women are dead, rotten, cold, and very rude. Their physique is a bit like this, their souls are dull. There is no level of opinion**""

So don't expect more than a terrorist organization that uses women as a suicide bombs. They are experts in telling lies.

[https://www.nytimes.com/2018/01/28/world/middleeast/kurds-female-suicide-bomber-syria.html](https://www.nytimes.com/2018/01/28/world/middleeast/kurds-female-suicide-bomber-syria.html)

[https://insamer.com/en/-the-point-of-no-return-suicide-bombers-amphetamines-and-the-ypgpkk\_1213.html](https://insamer.com/en/-the-point-of-no-return-suicide-bombers-amphetamines-and-the-ypgpkk_1213.html)

**You can watch the video of a Kurdish woman whose child was kidnapped by this terrorist organization.**

 [https://www.aa.com.tr/tr/vg/video-galeri/teror-orgutu-ypg-pkk-magduru-suriyeli-kurt-annenin-aci-feryadi](https://www.aa.com.tr/tr/vg/video-galeri/teror-orgutu-ypg-pkk-magduru-suriyeli-kurt-annenin-aci-feryadi) 

Articles about how they kidnap children and turn them into militants.

 [https://www.aa.com.tr/en/todays-headlines/surrendered-terrorists-expose-child-woman-abuse-in-pkk/1395809](https://www.aa.com.tr/en/todays-headlines/surrendered-terrorists-expose-child-woman-abuse-in-pkk/1395809)

[https://www.france24.com/en/20180803-syria-kurd-YPG-child-soldiers-refugees-camps](https://www.france24.com/en/20180803-syria-kurd-YPG-child-soldiers-refugees-camps)

[https://www.hrw.org/news/2018/08/03/syria-armed-group-recruiting-children-camps](https://www.hrw.org/news/2018/08/03/syria-armed-group-recruiting-children-camps)

[https://www.aa.com.tr/en/politics/pkk-ypg-terrorists-admit-to-recruiting-child-soldiers/1521384](https://www.aa.com.tr/en/politics/pkk-ypg-terrorists-admit-to-recruiting-child-soldiers/1521384)

[https://link.springer.com/chapter/10.1057/9781137291998\_6](https://link.springer.com/chapter/10.1057/9781137291998_6) ",2020-06-04 13:05:49
378,earjnn,False,,104,"/r/BlackPeopleTwitter cruelly mocking a woman for her natural looks. I messaged the mods saying that people have killed themselves over less, they acknowledged it but didn't delete the post. The casual misogyny over there is disgusting.",Feminism,,https://i.imgur.com/fLs9bUy.jpg,1202,[removed] ,2019-12-15 00:05:06
967,ax0c5z,False,,54,They do not speak for us: Feminists hit back at trans-exclusionary activists in open letter,Feminism,,https://www.thenational.scot/news/17472564.they-do-not-speak-for-us-feminists-hit-back-at-trans-exclusionary-activists-in-open-letter/,550,I love stuff like this ,2019-03-03 23:56:11
76,cj910o,False,,252,Acid Attacks,Feminism,,https://i.redd.it/tt1awem7r7d31.jpg,2230,[removed] ,2019-07-29 09:43:10
548,7io574,False,,108,A picture that was hanging on my friends bathroom wall.,Feminism,,https://i.redd.it/micdtzshox201.jpg,933,[removed] ,2017-12-09 17:43:24
652,c4ryxl,False,,33,"Why It Matters How Powerful Men Treat Women: A rape allegation for Donald Trump, a domestic abuse allegation for Boris Johnson, and a filmed assault by Mark Field—all in the same week.",Feminism,,https://newrepublic.com/article/154274/matters-powerful-men-treat-women,806,""" The more powerful the perpetrator, the greater is his prerogative to name and define reality, and the more completely his arguments prevail.""

&#x200B;

Trump for sure. All the ""Not my type"" bullshit makes it seem like sexual assault is at all about attraction. It's about power, not looks. Fuck this crappy president, and all the violence he rode in on. ",2019-06-24 17:30:33
393,dbclf2,False,,125,This is absurd,Feminism,,https://i.imgur.com/aypTbUI.jpg,1176,Ffs listen my best friend and I kept getting interrupted at Harry Potter trivia and I assure you we were highly intense. ,2019-09-30 14:45:21
174,ffha5s,False,,39,Intersex women are women,Feminism,,https://i.redd.it/stoccqx8zhl41.jpg,1714,Weird flex but ok ,2020-03-08 19:07:57
486,6gv76z,False,[Gender norms],161,48 sexist things men might hear in their lifetimes.,Feminism,,https://i.redd.it/zwksc8dm5a3z.jpg,1026,"Lol dude, men don't suffer for this kind of shit. Women do. If men didn't have a sexist view towards women, they wouldn't call each other ""pussy"" or ask stupid questions like ""she earns more than you do?"", as if women didn't deserve to earn more than men. These are just side effects of sexism, which, lets remind ourselves, women suffer from, NOT men.  ",2017-06-12 21:10:48
714,bpbiqs,False,,22,Almost like they don’t actually care about children - states with the worst anti-abortion laws have worst infant mortality rates,Feminism,,https://www.latimes.com/business/hiltzik/la-fi-hiltzik-anti-abortion-infant-mortality-20190515-story.html,734,Most of these are poor people and people of color who die. And most of the people signing anti-abortion pills are white. ,2019-05-16 11:45:41
143,a348id,False,,23,"Ruth Buffalo, the first Native American Democratic woman elected to the North Dakota Legislature, took her oath of office today. She unseated the representative who sponsored the law that disenfranchised native voters in ND.",Feminism,,https://i.redd.it/di8tst78hb221.jpg,1838,"That’s so awesome to see a real Native American who is and looks native. Not some these other “natives” who claim to have some native in them but are 100% white. 

Also awesome that she is a woman!!! 

Congratulations!!! ",2018-12-04 19:59:59
512,e7qlhs,False,,87,Takes off Muslim dress to dress differently. Gets pelted with mean comments (xpost r/exmuslim),Feminism,,https://i.redd.it/xkabqk41u6341.jpg,969,"I’m drunk and am not really a sexist but if you feel like you own a beautiful object would you not take care of said object weather it be car or statue or house or well a woman whatever, why would you deface/dent/harm your shit? If you spent time and effort to get something why would you bruise the expensive fruit you brought home? DONT PUNCH THE MANGO!

edit; To those upset please understand I was not meaning that I feel that women are objects, just the absurdity of men that do feel like women are objects and yet treat them like shit. Also I apologize for my drunk ass not making it more clear that I love and support women and have the utmost respect for the fight and struggle that you all go through. So please don’t take a drunks rambles as fact. ",2019-12-08 06:48:44
103,bshhyb,False,,80,Interesting how some constitutional rights are prioritized over others,Feminism,,https://i.pinimg.com/originals/6c/9f/98/6c9f98f520d395a7aa5e7fd1c0f96450.jpg,2064,[removed] ,2019-05-24 14:19:48
678,b1pxbc,False,,22,Catty Suffragette,Feminism,,https://imgur.com/l5mpa9Y,770,Cat ,2019-03-16 07:36:00
409,c6zipd,False,,126,Prostitution,Feminism,,https://i.redd.it/kliehhhq1b731.jpg,1132,"I agree, prostitution is bad and we should shame anyone that participates in it. ",2019-06-29 14:22:40
666,fed3fj,False,,31,26 Year Old Slits 13 Year Old's Throat After She Rejects His Advances,Feminism,,https://m.mid-day.com/articles/stalker-proposes-13-year-old-girl-slits-her-throat-when-refused/22659210,786,"Happy International Women’s Day, Ladies!  It’s an official holiday, too! No Work on Monday! Viva Clara Zetkin and Rosa Luxemburg! ",2020-03-06 12:57:31
353,e00j14,False,,87,BDSM and Male violence against women,Feminism,,https://i.redd.it/liayom42i8041.jpg,1246,[removed] ,2019-11-22 12:48:45
474,eqg45r,False,,187,Breastfeeding Vs. Public Urination,Feminism,,https://i.redd.it/s0jrp4q5cjb41.jpg,1035,The difference here is that the man pissing in public is probably drunk off their ass. And no one wants to fight a drunkard because they feel no pain. ,2020-01-18 13:00:45
453,7e1xnw,False,[Social media],122,Preach,Feminism,,https://i.redd.it/qscwsaouuyyz.jpg,1060,"I think people will just blame ""drunk"" for a problem they have if they can. Otherwise being drunk had no effect  ",2017-11-19 17:23:08
47,apw6dm,False,,130,The Lord of the Rings as antidote to toxic masculinity? Sign me the fuck up,Feminism,,https://i.redd.it/mxm6905u84g21.jpg,2557,[deleted] ,2019-02-12 18:02:16
753,942k31,False,,20,I thought you all might like my cross stitch of a stylized woman power symbol.,Feminism,,https://i.redd.it/b47e8g2vhqd11.jpg,713,"You’re right, I do ",2018-08-02 19:47:15
224,h8lxpz,False,,114,I just realized Americans have to choose between 2 alleged rapists/sexual assaulters for President on the 100th anniversary of women being allowed to vote,Feminism,America needs to step the fuck up and fast.,https://www.reddit.com/r/Feminism/comments/h8lxpz/i_just_realized_americans_have_to_choose_between/,1557,"Eh, write in Bernie. Or vote third party. ",2020-06-14 03:00:27
747,1i3hik,False,,137,George R. R. Martin on writing women,Feminism,,http://i.imgur.com/nu2Mipb.jpg,713,To all Song of Ice and Fire fans/feminists: Who do you think is the most self-empowering/independent/strongest female character? ,2013-07-11 18:19:39
847,hljiww,False,,33,"The study author Dr. Conard cautions against presuming a pornographic context, or even that it was created for men Vs. women. But the sex positive English media simply chose to quote another archaeologist, Paul Mellars of the University of Cambridge, who had nothing to do with the discovery.",Feminism,,https://i.redd.it/xzxnv0qp60951.jpg,623,Wow. This is really eye opening ,2020-07-05 08:56:57
736,gmhmop,False,,113,Stop telling me to be quieter,Feminism,"I’m so sick of people telling me to be quiet. I have a loud voice and it carries I can admit that. My boyfriend has a megaphone for a mouth and no one has ever told him to lower his voice in his life. 

I am constantly told to lower my voice by my friends and mother, though when I ask why it doesn’t bother them that my boyfriend is loud they complain that it’s not the same. Stop putting me down for being confident I do not need to be quiet. When I ask people if they think he’s louder than me they say without question. If I ask am I louder than most guys they say no. Ok. So then why is it such a problem. My mother likes to say it’s my pitch and that maybe boys aren’t considered as shrill. 

That is my rant. I am just really frustrated I feel like I can’t speak because even when I think I’m speaking normally it’s considered loud.",https://www.reddit.com/r/Feminism/comments/gmhmop/stop_telling_me_to_be_quieter/,722,[removed] ,2020-05-19 04:25:45
