Num,ID,is_Original,Flair,num_comments,Title,Subreddit,Body,URL,Upvotes,Comments,creation_date
923,hpba0y,False,,19,Study Finds Low Skilled Men More Likely to Object to Feminism and Women in Male Fields,Feminism,,https://journals.plos.org/plosone/article?id=10.1371%2Fjournal.pone.0131613,571,"But haven't other studies found that white collar men in a married couple put less time and effort into taking care of home and children than blue collar men in a married couple?

What is the explanation for these seemly conflicting study results? ",2020-07-11 14:54:15
921,7xc12u,False,,36,This Dominatrix makes her clients read black feminist theory,Feminism,,https://m.huffpost.com/us/entry/us_5a822b50e4b00ecc923d4eba,574,[deleted] ,2018-02-13 19:41:35
516,fhlz1c,False,,29,"Vaginismus, Vulvadonya, Endometriosis and candidiasis",Feminism,,https://i.redd.it/aqmblisbmam41.jpg,971,I dont complain :v) ,2020-03-12 19:27:10
87,e8ocxu,False,,93,"REDO: Amen! (Sorry I cross-posted from a gross sub, please see comments)",Feminism,,https://i.redd.it/a2u6euq6wr341.jpg,2170,[removed] ,2019-12-10 09:14:08
879,hbn13z,False,,4,"In the 1998 book Women in Chemistry, Marelene and Geoffrey Rayner-Canham argue that Fulhame was “the first solo woman researcher of modern chemistry.” Even when contemporaries have acknowledged the contribution of a female scientist, there’s been no guarantee that she would make it into the history.",Feminism,,https://i.redd.it/39wb0lkchq551.jpg,602,"I’m planning to become a physics teacher, and I am making a list of female scientists of whom I can hang a portrait in my classroom. Thanks for expanding that list! ",2020-06-18 21:06:18
463,ei6wa0,False,,175,Going into 2020 like 👇😁,Feminism,,https://i.redd.it/i14b9z7dk0841.jpg,1052,[removed] ,2019-12-31 18:40:27
112,ebzi8o,False,,36,This whole thread is gold,Feminism,,https://i.redd.it/g6xhse89j8541.jpg,2002,[removed] ,2019-12-17 18:16:04
297,fm09at,False,,93,"a drawing I made and wanted to share the message off here :) don't judge, empower instead✨",Feminism,,https://i.redd.it/td1fyn8lhvn41.jpg,1356,[removed] ,2020-03-20 18:42:08
417,9t5299,False,,42,My girlfriends pumpkin protest!,Feminism,,https://i.redd.it/as69ykdjfmv11.jpg,1118,YES!!!! ,2018-11-01 01:21:13
658,fsdpdg,False,,9,"Judges: Texas, Ohio cannot stop abortion access",Feminism,,https://www.mercurynews.com/2020/03/30/judge-texas-cannot-stop-abortion-access-during-lockdown/,801,"I think the fact that it's time critical makes it pretty essential. No access to abortion is a clear human rights violation, it is essential that people's human rights are not violated. ",2020-03-31 14:19:10
344,fk61cr,False,,25,Trapped at home: Coronavirus could be disastrous for domestic violence victims,Feminism,,https://www.latimes.com/entertainment-arts/story/2020-03-16/social-distancing-coronavirus-domestic-violence,1254,I work as an advocate at a DV/SA shelter and that is my nightmare right now. ,2020-03-17 14:20:20
830,94i79k,False,,81,WHY SOME WOMEN AVOID GOING OUT LIKE IT IS THEIR JOB.,Feminism,"STORY TIME BECAUSE I AM ANGRY.

*****IF YOU ARE A ""NICE GUY"" WHO CLAIMS TO RESPECT WOMEN, BUT TURN AROUND AND CALL US ""BITCHES"" ""SLUTS"" ""FEMINAZI'S"" WHEN WE REFUSE YOUR ROMANTIC OR SEXUAL ADVANCES, THIS POST IS NOT FOR YOU. I, AS WELL AS MANY OTHERS, ARE NOT INTERESTED IN HEARING YOUR OPINIONS ON HOW WOMEN (AND MEN) ARE TREATED. WE ARE NOT HERE TO LISTEN TO YOU DEFEND YOURSELF.*****

I was at the bar earlier, walking back in from having a smoke, and some wife-beater-wearing-fuck-boy GRABS my waist, forcibly pulls me in, and demands that I kiss him. I looked at him and with a calm, but VERY stern voice, told him to let go of me, and to not touch me again. He was persistent, grabbing me with more force and continuing to demand that I kiss him.. 

He did not let go of me or stop grabbing me until I looked at his group of guy friends with a stare that said ""come get your fucking dog off of me"". One of them stepped in and told him to forget about it, they were leaving anyways. Only then did this asshole loosen his grip and walk away from me. 

WHY DO YOU RESPECT YOUR FRIEND TELLING YOU TO STOP MORE THAN YOU RESPECT A WOMAN YOU DONT EVEN KNOW TELLING YOU TO STOP? So I'm really angry.

Not once did I give even the slightest indication that he could touch me. I honestly didn't even notice his presence until he put his hands on me. I should have hit him square in the face right then and there, after I very clearly told him to take his hands off of me and he refused.

But that's the problem right? Us ""feminazis"" are overreacting. We are ""violent"". Our cries for help and our demands for personal space and respect, our screams of being uncomfortable, it is just us ""crazy bitches, sluts, whores"" getting what we deserve. 

This has turned into a drawn-out ramble, I am aware. But I think its very important. I guess the main message I want people to take away is, instead of saying ""NOT ALL MEN"" try saying ""THE MEN THAT ARE GIVING YOU A HARD TIME NEED TO BE STOPPED"". Once again, a very important PSA from yours truly.

ALSO, why am I being made to feel like I was in the wrong? Why am I made to feel like I should have brushed it off because he was drunk? Why am I trying to make excuses for HIS obscene and brash behavior? 

For far too long, men and women who have been harassed or abused in any way have felt the need to make excuses for their abusers behavior. ""They were drunk."" ""I started the argument."" ""They are only angry because they care so much."" 

THAT IS ENOUGH. NO MORE EXCUSES. Drunk guy at the bar isn't being held accountable for his actions? Then neither am I, tell your face to say hello to the curb 🙃",https://www.reddit.com/r/Feminism/comments/94i79k/why_some_women_avoid_going_out_like_it_is_their/,638,[removed] ,2018-08-04 10:27:58
10,fj5qem,False,,63,Happy 87th Birthday to the legendary RBG,Feminism,,https://i.redd.it/5sg9lz9qovm41.jpg,3494,Cool that she chose to endanger the reproductive rights of women and the right to safety and security of immigrant women by continuing to sit on the Supreme Court rather than stepping down when we had a Democratic president ,2020-03-15 18:18:00
56,ab9aj1,False,,115,Happy New Year!,Feminism,,https://i.redd.it/4y8ntf8zgn721.jpg,2390,[removed] ,2018-12-31 17:40:37
615,9q5rjk,False,,16,Wholesome post in /r/MadeMeSmile... but it would be even better to not have such a stigma around periods tbh,Feminism,,https://i.redd.it/lx2tggcyeit11.jpg,835,"I just saw the post and thought the same! Why do we have to feel so embarrassed? No one feels ashamed of a bloody nose or a deep cut or a wound. 
And also, assuming is the mother who educate the kid, why not thanking the father? Or both? 
 ",2018-10-21 18:18:33
479,cmb81u,False,,17,Emma Watson and Time's Up launch free hotline for women experiencing workplace harassment,Feminism,,https://mashable.com/article/emma-watson-times-up-uk-advice-line/,1034,"She’s the best.

/r/EmmaWatsonHQ ",2019-08-05 13:50:56
577,8zc9ax,False,[Rape culture],29,"#MeToo was a powerful movement, however, no one should have to publicly share details of a traumatic assault in order for people to accept that there’s a problem.",Feminism,,https://www.verveup.com/shesaid/me-too,887,"I think journalists and media should be criticized for this issue, not the brave women who stood up for us.  ",2018-07-16 16:19:56
411,b7qctq,False,,142,And yet there are assholes who thinks feminism is unnecessary,Feminism,,https://i.redd.it/5fk9gpj85gp21.jpg,1129,"Sooo mondern day women who are given, at the very least, the same equal opportunities as their male counterparts have to act like victims because some women in the past were abused?

Openly admit others were the victims, not you, then play the victim card.... ",2019-03-31 17:39:52
521,9aeey8,False,,24,Truth and funny all in one.,Feminism,,https://i.redd.it/bcso7i0bmdi11.jpg,966,"Same for females.
Also lesbians can get crazy .  ",2018-08-26 09:37:18
935,9s9nub,False,,58,"I just watched ""Feminists"" on Netflix. It has completely changed how I see the world.",Feminism,"I am 25 years old. I am from Canada. I have always taken equality for granted. Within my living memory, I have perceived little to no inequality. I was not raised by a feminist. My mother was a strong, independent woman who was the breadwinner for our family. I always assumed that women's rights have been entrenched in society for a very long time. I don't know exactly how long ago I assumed that these rights were achieved, but I never really thought about it.

I just finished watching the Netflix documentary ""Feminists."" I don't even know what prompted me to press play. But oh boy, was it an eye-opener. The images of the rallies, the stories from women who had terrible experiences, and they're not even that old. It wasn't so long ago.

I had no idea how much these women had fought for. They built a better world for me, and I took it for granted. Some of them, I even knew of in some capacity, but nothing beyond the superficial surface of their work. What especially bothered me as I watched the documentary was the memories of my family making fun of Jane Fonda because of the time that she had done aerobics videos. I wonder if they knew about her contributions to furthering women's rights, or if they chose to just ignore this and reduce her to a ditzy actress, just in it for the money.

I cried a few times during the documentary. I want to reach out to these women and thank them for all they've done to make the world a better place for the next generations. It's so sad how people my age view feminism now; we don't fully grasp why it's necessary and so many people equate it with ""man-hating."" I myself am guilty of shying away from the term, preferring to say ""egalitarian"" when asked. From now on, I will be proud to say I am a feminist, and will dedicate time to learning about the history from which I benefit.

Thanks for listening.",https://www.reddit.com/r/Feminism/comments/9s9nub/i_just_watched_feminists_on_netflix_it_has/,558,[removed] ,2018-10-29 03:31:58
996,1n78em,False,,43,"Double standards comic. (Betty and Veronica #326, October 1983)",Feminism,,http://31.media.tumblr.com/f00897f499a746390f32919ab506ba57/tumblr_mtjn82jzWL1qe04zro1_500.jpg,525,[removed] ,2013-09-26 20:29:49
340,bb8oig,False,,174,"Good point, well made!",Feminism,,https://i.redd.it/rwlztxcb29r21.jpg,1268,[removed] ,2019-04-09 14:36:11
152,d9t2hu,False,,25,What A Good Ally Looks Like,Feminism,,https://i.redd.it/az2gs7fhazo31.jpg,1806,an actual guy who is nice ,2019-09-27 01:04:11
348,aet4cz,False,,177,If anti-abortion/contraception logic was applied to men.,Feminism,,https://i.redd.it/iwtrrnd31r921.jpg,1250,[deleted] ,2019-01-11 07:47:03
199,7unccc,False,,44,why haven't I heard about this until now!?,Feminism,,https://i.redd.it/lvhgsn4nzod01.jpg,1631,[removed] ,2018-02-02 00:14:34
779,bohy74,False,,33,"Surprising no one, Trump campaign paid women employees nearly 20% less than male counterparts",Feminism,,https://www.cnbc.com/2019/05/13/trump-campaign-paid-women-like-omarosa-less-than-men-filing-says.html,696,It's easy to find quality female employees. Just grab em by the pussy./s ,2019-05-14 11:55:10
988,atueii,False,,74,We may have to fight our generation of men': Read Jameela Jamil's powerful speech on ending toxic masculinity,Feminism,,https://www.yahoo.com/lifestyle/may-fight-generation-men-read-jameela-jamils-powerful-speech-ending-toxic-masculinity-235720491.html?fbclid=IwAR2yl3e8pddCJ2icI60OJJkgh0rcdfN-yBm5-kc6CD9ho_5FlIBR8nISKoE,530,[removed] ,2019-02-23 11:06:03
373,9lyvek,False,,119,Fixed it! That’s better!,Feminism,,https://i.redd.it/zxypy50kcmq11.jpg,1198,[deleted] ,2018-10-06 19:43:48
734,ajlkjq,False,[Domestic Abuse/Violence],43,Man Arrested For Threatening To Kill 'As Many Girls As I See' On Day Of Women's March,Feminism,,http://huffp.st/N7xvTBC,728,[deleted] ,2019-01-25 04:53:01
648,d7n5vt,False,,29,First time?,Feminism,,https://i.redd.it/pfx5a0smmrn31.jpg,815,[removed] ,2019-09-22 07:15:32
331,aqmj9z,False,,146,Countries where paid maternity leave is mandated by law,Feminism,,https://i.redd.it/z4lbl5khzjg21.jpg,1286,[removed] ,2019-02-14 17:59:53
148,b0agtp,False,,28,For those offended by breastfeeding,Feminism,,https://i.redd.it/9g61r6wynjl21.jpg,1812,[deleted] ,2019-03-12 17:26:11
817,etofuk,False,,169,"When a woman speaks up about women's rights, and a guy bring up statistics about mens issues feels like the all lives matter bs again",Feminism,"Honestly a girl could speak up about something traumatic and some guys will go out of their way to say something about men falling off of roofs

Edit: It's so upsetting. I saw a girl speak up about something revolting that happened to her and then this guy thought it was the right time to express other issues about men. I support men obviously but they have to wait their turn and listen instead of literally ignoring girls and bring up things that aren't related. I forget if it was her or another person in the comments but they replied with something along the lines of ""this isn't about you right now"" bc same


Edit:

This isn't an example because I saw this in a comment section on YouTube.

But anyways in a nutshell: Girl speaks up about sexual abuse, guy comments under her comment and comments statistics about mens issues which has nothing to do with her story. That's it. It was disrespectful. Good intentions or not just inconsiderate.


Edit 2: I'm not even a feminist yet (because I want to be more educated on the topic first) but the opinions I have are what a ""liBtArD wOuLd hAvE"" and this feels like the ONLY place where I can feel accepted and not ridiculed. To the people that clearly don't like feminism, why are you here? Yes you have tHe riGht to be here but what are you expecting? For us to get owned? You guys are literally full of yourselves and can't see where women are trying to sympathise with you. Let us breathe",https://www.reddit.com/r/Feminism/comments/etofuk/when_a_woman_speaks_up_about_womens_rights_and_a/,655,[deleted] ,2020-01-25 08:46:56
100,cg3ea5,False,,129,Antifeminist Tactics,Feminism,,https://i.redd.it/81ur558zqpb31.jpg,2077,[removed] ,2019-07-21 20:05:41
945,7ezy18,False,[Workplace/Career],85,Because socialist programs are for commies[X-Post r/LateStageCapitalism],Feminism,,https://i.redd.it/de4799p06dzz.jpg,556,[removed] ,2017-11-23 14:25:15
454,flbz8k,False,,23,"When They (economists, male politicians & religious leaders) talk about polygamy, they mean polygyny -- one husband, multiple wives -- consequences & cause of misogyny. Majority of Kazakh women (78%) & Kazakh (62%) oppose polygyny, but 43% of men support (Pew).",Feminism,,https://i.redd.it/mz6w293bfnn41.jpg,1058,"Why are you hating on Economist, though? ",2020-03-19 15:35:07
724,hei5p4,False,,29,My former highschool is rampant with sexual harassment from teachers and I'm going after them. I'm scared.,Feminism,"I recently wrote a long facebook status about my friend's assault 12 years ago back in highschool. I did it because she wanted to finally call out the perpetrator but was afraid, so I offered to do it for her. It included a story about a teacher's failure to investigate the matter after she reported it.

After posting it, plenty of people who graduated at the school started reaching out to me about sexual harassment and bullying either done by or enabled by teachers. I've discovered this has been a long cycle of abuse, and I decided to contact someone from the school. My complaints have fallen on deaf ears, though. They just flat out told me that times have changed, the school wasn't the same as it used to be. And to be careful about posting about the school because I might get sued. 

I can't just ignore all these girls being sexually harassed by their teachers. Some of them have recently graduated and confirmed that this is still happening today. I want to fight for them but I'm also afraid to get into any legal trouble. (I live in the Philippines)

What do I do?",https://www.reddit.com/r/Feminism/comments/hei5p4/my_former_highschool_is_rampant_with_sexual/,727,"Civil suits will allow for monetary compensation but depending where you are there may a statute of limitations. There are also criminal proceedings, you could tip off the police. ",2020-06-23 16:48:37
3,8e6c84,False,,178,"This can never go away, this needs to continue to get posted over and over and over again. This should never be forgotten",Feminism,,https://i.redd.it/ar0tu4fi2jt01.jpg,3957,This reminds me so much of when Steve carrel talks about touching a boob in 40 year old virgin. If in that movie his character had been a sleazy rich douche bag instead of an endearing TV salesman this is exactly what he would’ve said ,2018-04-22 21:25:44
212,ap3np9,False,,107,Body Autonomy and Reproductive Rights,Feminism,,https://i.redd.it/b3cg4exgnqf21.jpg,1587,[removed] ,2019-02-10 12:55:28
815,2xtoq6,False,,129,"""Let's not forget that the people who make Dove also make Axe.""",Feminism,,http://imgur.com/qlJQhbv,660,Maybe y'all are taking the ad too seriously. Not everything is meant to be hyperbole. I think it's funny tbh.  ,2015-03-03 20:18:26
505,cc7a6x,False,,234,TERFS ARE NOT FEMINISTS THEY’RE JUST PIECES OF SHIT,Feminism,In case anyone needed reminding.,https://www.reddit.com/r/Feminism/comments/cc7a6x/terfs_are_not_feminists_theyre_just_pieces_of_shit/,980,People who don't agree with you are deficient in moral character.  I hear that more  from trans advocates than TERFs ,2019-07-12 06:37:32
841,8d058y,False,,29,Statue of doctor who experimented on enslaved women removed from Central Park,Feminism,,https://www.cnn.com/2018/04/17/us/james-marion-sims-statue-removed-from-central-park/index.html?sr=twCNN041718james-marion-sims-statue-removed-from-central-park0448PMVODtop,628,[deleted] ,2018-04-17 21:17:20
492,8mn522,False,,82,Character limit made this difficult,Feminism,,https://i.redd.it/jk7hyrtsoi011.jpg,1004,What's bigger issue than feminism ? ,2018-05-28 03:37:48
80,bps81y,False,,288,But fucking honestly. LEAVE MY BODY THE FUCK ALONE,Feminism,,https://i.redd.it/ytab9nyjbsy21.jpg,2217,[removed] ,2019-05-17 14:50:46
932,c04v7u,False,,25,"Stop Child Abuse, Digital Painting, Medha Srivastana, 2018",Feminism,,https://i.redd.it/wc23m1nt8z331.jpg,565,[removed] ,2019-06-13 11:53:20
107,dh85si,False,,53,"43 + 2 dozen = total number of women accusing him of rape, sexual assault, violence, harassment, inappropriate touching etc.",Feminism,,https://i.redd.it/1s5eurrww9s31.jpg,2040,[removed] ,2019-10-13 09:00:40
385,fuvjr1,False,,120,Women and Ageing,Feminism,,https://i.redd.it/lmgms5iiktq41.jpg,1181,[removed] ,2020-04-04 15:27:23
88,dp4j3k,False,,68,"Be beautiful, be successful, and don't judge a book by its cover.",Feminism,,https://i.redd.it/legemtd0gnv31.jpg,2167,"Those guys are assholes but to be fair no body says I can program code in python, C++, Java, MIPS, objective-C.
The way the headliner has tried to list the techy names makes it sound like they were just trying to make a big list ( after all that’s what we programmers do in our resumes )

So if they just said: and she’s a lead iOS developer, I would be much more impressed than listing language names. ",2019-10-30 09:51:15
908,au1y0m,False,,122,Planned Parenthood Cut Off From Federal Funding Under Trump Rule,Feminism,,https://news.yahoo.com/planned-parenthood-cut-off-federal-201153087.html,587,You exclusively post nude photos on reddit. Clearly you have no problem with men.  ,2019-02-24 00:07:46
389,fgffdc,False,,36,"Painful menstruation is not a public health priority, according to male centric medical community.",Feminism,,https://i.redd.it/7xj664qg4vl41.jpg,1183,Annenizi sikeyim orospu çocukları ,2020-03-10 15:20:21
672,c9t2yf,False,,84,"Wow, super sexist listing description on Amazon - link in comments",Feminism,,https://i.redd.it/8jvoi7b3go831.png,781,[deleted] ,2019-07-06 12:30:25
663,heshz5,False,,66,A feminist puzzle I did this week!,Feminism,,https://i.redd.it/rciay1kgrr651.jpg,796,"also khalo is not a feminist icon. talented, but not feminist 🥴 ",2020-06-24 02:28:58
69,apm4zb,False,,162,And the biggest Mansplainer award goes to...,Feminism,,https://i.redd.it/h0ul02k8q0g21.jpg,2272,[removed] ,2019-02-11 22:48:47
661,bs1ubm,False,,107,Epic capitalism: nestle has a page on their website literally explaining that they use child slaves,Feminism,,https://i.redd.it/xfpxx3wsotz21.png,793,"Just doing the bare minimum, so consumers won't feel bad about the exploitation behind their consumption. ",2019-05-23 11:36:06
637,7a3r6b,False,,40,x-post: trollxchromosomes,Feminism,,https://i.redd.it/6xcpgxotedvz.jpg,814,[removed] ,2017-11-01 14:03:29
196,ak0i6h,False,[Satire/Humor],59,"Why men shouldn't vote, according to 1915 suffragette satire by Alice Duer Miller .",Feminism,,https://i.redd.it/kpx7k689irc21.jpg,1651,[removed] ,2019-01-26 12:35:36
541,9r8pog,False,,98,"Ladies, meet Jair Bolsonaro, soon to be President of the world's fourth-largest democracy, telling a female colleague she ""doesn't deserve his rape"", shoving her and calling her a whore. This was the first time he was recorded saying this, he said something similar again in 2014.",Feminism,,https://v.redd.it/h7t4adyzvau11,942,[removed] ,2018-10-25 09:30:32
731,8dsqdj,False,,28,"""The place of a woman is wherever she wants to be""",Feminism,,https://i.redd.it/w7kv51ml26t01.jpg,726,"This is like a vegan cat, we all know who’s making the decisions. ",2018-04-21 01:43:45
973,btlbs1,False,,139,Why are guys so obsessed with women’s sexuality in fantasy but not in reality?,Feminism,"Why are guys always making porny hot elf art, writing stories about their wifu pillow, and obsessing over oversexualized female characterizations...but then in real life they slut shame, have no understanding of actual female sexuality (yes we’d like to get off too) and clearly just don’t understand women. It’s like they think real women have no sex drive and shouldn’t be allowed to show skin, but then salivate over Lara Croft materializing in a sling bikini drooling to suck some dick. 

They love girls that are sexy but can’t stand girls being sexy?? I don’t understand how so many guys can think like that.",https://www.reddit.com/r/Feminism/comments/btlbs1/why_are_guys_so_obsessed_with_womens_sexuality_in/,541,Us men are weird we like things that women don’t and it is only some of us like the weebs and it is called a fetish  so don’t dis ,2019-05-27 12:14:13
0,6fphas,False,[r/all],966,Some words from Maisie Williams,Feminism,,https://i.redd.it/ka0kgautv32z.jpg,10022,"Agreed, if your not for equal rights of men and women you are sexist, but we can’t act like we’re apart of an unpopular opinion. ",2017-06-06 23:01:05
266,at60tr,False,,186,"Feminist fathers: it’s your son you need to worry about, not you daughter",Feminism,"Men come to this sub all the time, asking for tips on how to raise their daughters the feminist way. Empower your daughter and allowing her self expression is well and good. But the real trouble for a feminist parent is to raise better sons.

Women don’t get attacked and harassed because they weren’t feminist enough. Those things happen because men think it’s something they can do.

Raise your sons to understand consent. Raise your sons to respect people. Raise your sons to stand up for others instead of bringing them down. 

The problem starts and ends with men. 

Edit: turning off notifications at this point because the post says everything I wanted to say, and most comments at this point aren’t made in good faith",https://www.reddit.com/r/Feminism/comments/at60tr/feminist_fathers_its_your_son_you_need_to_worry/,1424,"oh don't worry, nice guys are going extinct.  ",2019-02-21 17:44:37
21,ho6dmz,False,,55,They were asking for it,Feminism,,https://i.redd.it/0va12zd01v951.jpg,3014,[removed] ,2020-07-09 16:40:08
963,7fkol7,False,,23,r/Feminism has reached 80k subscribers! Thank you for being here promoting the rights of all women and empowering girls everywhere.,Feminism,,http://gph.is/2u6mCoM,551,"I only recently begun learning about Feminism while going through my undergrad degree at university. I've for the most part believed in much of what Feminism says (without really knowing I did) and I think a large part of that was being raised by my mom in a single parent household. However, university has truly helped shape my beliefs and given me the resources to do my own research. 

If university's made topics like Feminism required for an elective, I believe we'd have a more progressive society. It hurts going from my arts faculty to the engineering faculty down campus and hearing bullshit. ",2017-11-26 04:44:46
357,epr3xs,False,,69,"""Inevitably, I get some snide remark like ""well, that's not a fair representation,"" and I can only smh. Dude, the real world doesn't hold up to your sexist bullshit, the fictional ones don't stand a chance"".",Feminism,,https://i.redd.it/juahr08hz7b41.jpg,1235,This is the dumbest thing I've seen on this sub. I have literally no idea what this sub is any more. ,2020-01-16 22:50:09
171,cp0euf,False,,52,We stan,Feminism,,https://i.redd.it/y1yv0ad6eqf31.jpg,1716,[removed] ,2019-08-11 18:32:55
547,7wuqgg,False,,13,"Today is the International Day of Women in Science. Marie Curie was the first woman to win a Nobel Prize, and only woman to win two. She encouraged women into science, her own daughter Irène also winning a Nobel Prize (Chemistry). From a woman in science (with a Marie S. Curie scholarship!), thanks!",Feminism,,https://i.imgur.com/wfU2DEk.jpg,927,[removed] ,2018-02-11 19:01:20
510,9kakqw,False,,43,"Women, too emotional for politics",Feminism,,https://i.redd.it/uk2hytsv9dp11.jpg,974,"You try being attacked constantly and then staying calm.

But you wouldn't, because you lot are the ones doing the attacking.  GG. ",2018-09-30 22:17:30
