Num,ID,is_Original,Flair,num_comments,Title,Subreddit,Body,URL,Upvotes,Comments,creation_date
538,5p44bt,False,,18,"Forbes: Man Boasts Of Sexual Assault, Later Inaugurated 45th President Of United States",Feminism,,http://www.forbes.com/sites/tarahaelle/2017/01/20/man-commits-sexual-assault-later-inaugurated-45th-president-of-united-states/#482ef1876310,935,[removed] ,2017-01-20 14:20:52
559,hpl9sf,False,,112,"Reddit just banned & quarantined some major misogynistic subreddits, including pornographic ones. But major pedophilic & transmisogynistic pornographic subreddits remain unbanned.",Feminism,"Banned:

/r/strugglefucking

/r/struggleporn 

/r/rektwhores

/r/abuseporn2

/r/degradedfemales

/r/fuckmeat

/r/abusedsluts

/r/ropedancers

/r/misogynyfetish

/r/deadeyes 

/r/sex_violence_art

/r/dolcettkingdom

/r/brokenfucktoys

/r/womenintrouble

/r/putinherplace

/r/slasherchicks

/r/cryingcunts

r/MisogynyFetishGW

r/PedophiliaDiscussion

r/MAPPositivity 

Quarantined:

/r/rapekink 

/r/rapeconfessions 

/r/rapefantasy 

/r/rapeworld 

/r/rapestories",https://www.reddit.com/r/Feminism/comments/hpl9sf/reddit_just_banned_quarantined_some_major/,911,[removed] ,2020-07-12 00:40:36
128,gswkjn,False,,35,Feminism is Intersectional - An Annotated Unpacking of the Invisible Knapsack,Feminism,,https://i.redd.it/v0blzn5rhq151.jpg,1925,"To boil it down, it’s a pain when you’re appearance doesn’t settle down well with everyone else and as a result you get associated to every awful thing that’s happening in the world and its outside your control. It’s just another form of objectification which harms the victims who are objectified, while benefiting only the objectifiers. ",2020-05-29 16:52:01
794,609heg,False,,40,UK rape victims to get pre-trial recorded interview option instead of having to be cross-examined in front of the accused.,Feminism,,http://www.bbc.co.uk/news/uk-39319495,682,[removed] ,2017-03-19 10:36:26
192,f3sxua,False,,218,This needed to be shared,Feminism,,https://i.redd.it/3iyv3h7pgwg41.jpg,1673,[removed] ,2020-02-14 14:30:00
640,azsmqm,False,,113,"FGM, Feminism, Patriarchy and Sexist Gender Roles",Feminism,,https://i.redd.it/5k9ya4jbchl21.jpg,818,[removed] ,2019-03-11 12:01:43
693,fe1de9,False,,38,"What would a world without women look like? On March 9, Mexico may find out — Women across the country are being urged to skip work next Monday, stay off the streets and purchase nothing for 24 hours after a recent rash in femicides.",Feminism,,https://www.latimes.com/world-nation/story/2020-03-05/mexico-feminist-women-protest,762,[removed] ,2020-03-05 20:20:53
281,ere9g4,False,,80,"Feminism is here to make sure that girls do not grow up thinking that their lives revolve around marriage, motherhood and taking care of dysfunctional men.",Feminism,,https://i.redd.it/89tj7sot6yb41.png,1395,I think any 3 year old should just enjoy being a 3 year old and that's probably a good age to start doing chores a little ,2020-01-20 15:00:31
653,a20q7n,False,,64,Why Terry Crews is on a mission to completely eradicate toxic masculinity,Feminism,,https://abcnews.go.com/GMA/Culture/terry-crews-toxic-masculinity-completely-eradicated-culture/story?id=59503701,799,This is good ,2018-12-01 06:27:36
939,glpexn,False,,67,"The 'gender critical' feminist movement is a cult that grooms, controls and abuses, according to this lesbian who escaped",Feminism,,https://www.pinknews.co.uk/2020/05/17/terf-gender-critical-feminism-movement-lesbian-cult-amy-dyess-transphobia/,563,"i haven't read this at all but by the others commenting, it is quite horrid :/ ",2020-05-17 22:58:32
180,bibvr3,False,,49,A simple way to explain the concept,Feminism,,https://i.redd.it/uygmrsrhoyu21.jpg,1700,[removed] ,2019-04-28 14:39:39
399,6u95kh,False,,48,"Malala, 20-Year-Old Nobel Peace Prize Winner, Accepted Into Oxford University",Feminism,,http://www.usjournal.net/issues/women/malala-20-year-old-nobel-peace-prize-winner-accepted-into-oxford-university/,1165,[removed] ,2017-08-17 10:47:20
503,aul2oi,False,,50,I'm not even surprised 🤷‍♀️,Feminism,,https://en.wikipedia.org/wiki/Artificial_insemination#History,987,[removed] ,2019-02-25 13:08:49
578,aet8oi,False,,73,Archie on Double Standards (xpost from /r/comicbooks),Feminism,,https://i.redd.it/n7m7hj638n921.jpg,887,[removed] ,2019-01-11 08:07:01
660,1d5elt,False,,23,The First Ever Saudi Arabian Female Abuse Ad: It's a start.,Feminism,,http://i.imgur.com/XZpS2PT.jpg,801,[removed] ,2013-04-26 12:38:06
310,6h6tj2,False,[Abortion rights],49,Women Dressed As Handmaids Descend On Ohio Statehouse To Protest Anti-Abortion Law (xpost r/pics ),Feminism,,https://i.redd.it/el7z1pw0vh3z.jpg,1325,[removed] ,2017-06-14 11:13:40
785,gfitdw,False,,121,Lesbian feminists,Feminism,"Little rant here. I hate how some people insult feminists by calling us lesbians. In this show im watching called Mrs America they insult feminists by calling them ""commie lesbians"" but it obviously happens more then that. Firstly, lesbian is not an insult, it just means youre a woman who likes women. Secondly, not all feminists are lesbians. Thirdly, being a lesbian doesnt mean you hate men it just means youre not attracted to them. Also, as a lesbian feminist myself it really hurts me because I feel insulted and stereotypical",https://www.reddit.com/r/Feminism/comments/gfitdw/lesbian_feminists/,686,[removed] ,2020-05-08 00:31:19
786,ft2flr,False,,33,"Don't Nag Your Husband During Lockdown, Malaysia's Government Advises Women",Feminism,,https://www.npr.org/2020/04/01/825051317/dont-nag-your-husband-during-lock-down-malaysias-government-advises-women,687,[removed] ,2020-04-01 15:58:20
167,dqjywk,False,,156,As a female streamer I encounter this a lot. Somehow they justify hostility while still wanting access to our bodies.,Feminism,,https://i.redd.it/9k5r82q1w9w31.png,1732,"these are two different groups of people: 

\- legit streamers and people that respect twitch, don't like the titty streamers and that they  are above the rules just cause;

\- the people watching titty streamers are young, lonely, lost or just the kind of guy that watches live ""porn"";

I highly doubt that there are many people in both camps.  

Also [twitch.tv](https://twitch.tv) is for live-streaming games and game related stuff,  not for softcore porn - twitch allowing it on their platform is just wrong. But titty streamers bring in enough money, to skirt the guidelines and even lessen bans. ",2019-11-02 13:12:20
533,e3oecc,False,[Trigger Warning],57,Violence against Women in India,Feminism,,https://i.redd.it/au6uqxrd5q141.jpg,943,"Christ on a stick, that first one is particularly brutal. ",2019-11-30 01:13:57
132,acosfs,False,,76,"This can never go away, this needs to continue to get posted over and over and over again. This should never be forgotten",Feminism,,https://i.redd.it/4jplr1bu3i821.jpg,1909,This the equivalent of people today tweeting about eating ass. Dude was way younger give him a break ,2019-01-05 00:42:29
237,clzt75,False,,154,Women are so emotio- oh,Feminism,,https://i.redd.it/mgveg5facge31.jpg,1522,[removed] ,2019-08-04 18:36:35
248,fin1ok,False,,52,Female bots are more likely to be harassed than male bots.,Feminism,,https://i.redd.it/1oz3vhnimom41.jpg,1489,"This is interesting but is it harassment if no humans are involved?

My response to this was facile, and for that I apologize. ",2020-03-14 18:33:09
275,g32755,False,,35,"COVID-19 & male violence against Latin American girls: ""She was so scared she didn't tell them she was in labor and walked back home"". ""If my dad sticks a pen down there, is that sexual violence?"" ask another 12-year-old girl.",Feminism,,https://i.redd.it/h2zymoxatdt41.jpg,1399,[removed] ,2020-04-17 13:40:33
849,67ikqx,False,[Politics],30,Oh look. The creator of Red Pill is a Republican state representative to New Hampshire,Feminism,,http://www.thedailybeast.com/articles/2017/04/25/the-republican-lawmaker-who-secretly-created-reddit-s-women-hating-red-pill.html,623,[removed] ,2017-04-25 18:44:32
349,gqzlx3,False,,123,I'm tired of being a Feminist...,Feminism,"Ever since integrating into the world as an independent adult, I've identified as a feminist. 
I've learned a bit about feminism growing up, but it wasn't until I began entering the world as my own, individual person, that I ever felt much of a connection to this so-called 'feminism'.

But then, I grew up. 
I entered the real world. 
I learned of injustices ranging from severe human rights violations, down to subtle differences in social acknowledgment.

I began hearing of atrocities happening around the world, while also becoming more and more aware of when people treat me differently than a male counterpart.

And, to be honest? I'm tired.
I'm tired of explaining why that joke just isn't funny.
I'm tired of explaining why his advances are inappropriate.
I'm tired of explaining why progress doesn't negate the fact that there's still work to be done.
I'm tired of keeping my composure during someone's inappropriate behavior.
I'm tired of justifying why bodily autonomy is so important to me.
I'm tired of holding my tongue while his eyes slide over my body, as if I'm a piece of meat being considered in a market.

I'm tired of explaining that, no, feminism isn't about hating men.
I'm tired of breaking down the need for feminism to someone who has no interest in actually hearing them.
I'm tired of having to demonstrate that feminists care about issues involving men as well. 
I'm tired of having to prove why my experience does, in fact, matter.


I want to scream-
How do you know? 
Why don't you care? 
How can you justify that? 
What do you feel that you are owed by us?

I'm just... tired.

But I see all the feminists of today, keeping their composure and continuing the fight, day after day. 
So, I'll continue explaining, educating, and gently correcting.

But I still wonder to myself....
How aren't you tired?",https://www.reddit.com/r/Feminism/comments/gqzlx3/im_tired_of_being_a_feminist/,1253,[removed] ,2020-05-26 15:53:35
520,bduld8,False,[LGBT &amp; GSRM],58,"Scared girl knees boy in crotch after group of boys busted in the bathroom, locked the door and cornered her, gets expelled.",Feminism,,https://www.themarysue.com/girl-expelled-self-defense-bathroom-protest/,961,[removed] ,2019-04-16 14:30:22
316,dxa16d,False,,265,Be the CEO your parents always wanted you to Marry 👏,Feminism,,https://i.redd.it/ojlc8y7463z31.jpg,1317,[removed] ,2019-11-16 17:48:43
301,e753eb,False,,68,That,Feminism,,https://i.redd.it/nzvco7tp23341.jpg,1339,The only difference: now we have enough autonomy and support to make ourselves heard. ,2019-12-06 21:46:12
825,dz04dm,False,,11,The sexual abuse of Filipina women and children by so-called ‘sex tourists' (part 1),Feminism,,https://i.redd.it/17kxplkegtz31.jpg,642,omg this is heartbreaking ,2019-11-20 10:12:43
876,aofdrg,False,,42,"Research shows that women don't get projects funded, only when gender is removed from the pitch process the projects get funded",Feminism,"Yet another demonstration of gender bias in science and technology. 

Women don't get their scientific research funded when they do the pitching themselves, only when we let 'the science speak for itself' do women's projects get the necessary funding. 

Instead of teaching women how to 'pitch' better we should teach investors and selecting committees now not to be so sexist.

Spare us the trolling boys",https://www.reddit.com/r/Feminism/comments/aofdrg/research_shows_that_women_dont_get_projects/,605,[deleted] ,2019-02-08 10:50:56
623,accd26,False,[Rape culture],184,Rapists lie too,Feminism,,https://i.redd.it/e3zmjm1zxa821.jpg,834,[removed] ,2019-01-04 00:36:53
190,eg9irj,False,,141,"""If I don't get pants, nobody gets pants"" 😁",Feminism,,https://i.redd.it/s12dx2r5j5741.jpg,1672,[removed] ,2019-12-27 10:18:27
274,gl2wpt,False,,111,"“[Porn] corporations prey on callow young women and trap them legally into contracts when they’re vulnerable"" -- Mia Khalifa, adult actor. ""As with all types of media, porn is not made in a vacuum, but has largely escaped the encroaching conversation about"" male supremacy & male violence.",Feminism,,https://i.redd.it/1jxv1row47z41.jpg,1401,Ok. ,2020-05-16 21:37:56
524,gg39v4,False,,93,"Globally, Women’s subordination (Unpaid Labor) is Worth $10,900,000,000,000. ""India has the largest gap: Women there spend almost six hours a day managing the home; Indian men spend a paltry 52 minutes. The smallest divides are found in Sweden, Denmark and Norway."" Link in the comment section.",Feminism,,https://i.redd.it/v6l9ob9nbmx41.png,964,[removed] ,2020-05-08 22:34:08
893,8sli4g,False,,170,"Porn actress Stoya: ""I increasingly believe there can be no feminism under capitalism.""",Feminism,,https://jezebel.com/stoya-is-over-talking-about-feminist-porn-1826771529,592,I can't take this lady seriously because capitalism has brought more people out of poverty than any other monetary system and she sells her body for money. ,2018-06-20 20:06:14
947,1xcu67,False,,61,George R. R. Martin on writing women. (from r/funny),Feminism,,http://i.imgur.com/lKki3JK.jpg,552,"[That would be a george stroumboulopoulos interview. here's the full interview.](http://www.youtube.com/watch?v=b3Guf-T3U1U)
 ",2014-02-08 14:24:02
127,aigobl,False,[Activism],138,"As a teacher, this was my favorite sign from the Women’s March. I’d been trying not to cry all day, but this one broke me.",Feminism,,https://i.redd.it/g0tiqw176vb21.jpg,1937,[removed] ,2019-01-21 23:50:59
345,dv86no,False,,26,Young Mathematician,Feminism,,https://i.redd.it/9cebfpvnf8y31.jpg,1254,WHO RUN THE WORLD? ,2019-11-12 10:27:02
613,fc9n2l,False,,28,"During the 1971 Bangladesh war for independence, members of the Pakistani military & Razakar rapedbetween 200,000 & 400,000 Bangladeshi women & girls in a systematic campaign of genocidal rape to terrorise both the Bengali-speaking Muslim majority & the Hindu minority of Bangladesh.",Feminism,,https://i.redd.it/wc21n73na8k41.jpg,837,"For those interested, The Blood Telegram is a fascinating book on this. Basically, the Awami League won a democratic election in what was then East Pakistan (now Bangladesh), and West Pakistan (now Pakistan) didn't like that - it would mean too much autonomy for East Pakistan, they thought. West Pakistan wanted all political power to say concentrated. So the Pakistani military, in large part led by Yahya Khan, started raping and slaughtering Bangladeshis. Hindus were specifically targeted, and Muslims were targeted essentially because they associated with Hindus. India took in hundreds of thousands of Hindu (and Muslim) refugees from Bangladesh, as they were driven from their own country.  The Hindu population in Pakistan continues to dwindle, and reports of religious discrimination against non-Muslims is very common. Pakistan has insanely archaic blasphemy laws (punishable by death), which are supported by their P.M., Imran Khan.  Asia Bibi, a Christian Pakistani woman who allegedly insulted Mohammed is the most recent/famous case. She was on death row for years, but due to international attention and criticism, was able to seek asylum abroad. ",2020-03-02 09:29:49
220,fyjmxl,False,,287,Queens do what queens gotta do 👑✨,Feminism,,https://i.redd.it/1ph5cjvpt0s41.jpg,1560,[removed] ,2020-04-10 16:56:07
931,fcmyhl,False,,29,Argentina on the verge of becoming the first major Latin American country to legalize abortion,Feminism,,https://www.theguardian.com/world/2020/mar/01/argentina-set-to-become-first-major-latin-american-country-to-legalise-abortion,573,That sucks ,2020-03-03 01:35:25
644,cfsv1q,False,,126,"""Being third world poor is key""",Feminism,,https://i.redd.it/zri6xhhoujb31.jpg,814,[removed] ,2019-07-21 00:15:43
290,eu3w24,False,,101,Teen sold as a sex slave to men an estimated 1000 times(over a 2-year period.5 times a day) by mom who placed an advertisement on the website Craigslist. None of rapists had been arrested but the mom has been jailed for 6 years & 11 months. Punting/pimping/brothel keeping is decriminalised in NZ,Feminism,,https://i.redd.it/3glmpe51v2d41.jpg,1374,haha men bad xD ,2020-01-26 07:44:29
692,8axvq1,False,,267,Man explains art to it's creator.,Feminism,,https://i.redd.it/hud8uvr4ivq01.png,766,"You can say he ""missed"" the point, but maybe author missed HIS point (and that of the teacher). The point being: make feminist art, just not as much, dial it down, you're a ""raging feminist"" at 10, the middle ground is best, 5. ",2018-04-09 12:02:51
543,9k4tib,False,[Rape culture] [Sexual assault],32,"Story of a woman who came forward when she was raped. After being threatened with homelessness, she recanted and was arrested for a false rape accusation. Years later they caught a serial rapists with her picture. This is why women don't come forward",Feminism,,https://www.propublica.org/article/false-rape-accusations-an-unbelievable-story/?lang=eng,938,[removed] ,2018-09-30 08:47:39
594,cnyxku,False,,81,Nooooooooooooooooooo shit,Feminism,,https://www.vice.com/en_ca/article/7xgaje/men-who-send-unsolicited-dick-pics-are-bigger-narcissists-study-finds,860,Just men being men... well... ,2019-08-09 07:21:59
250,fct0ww,False,,15,"Remembering pregnant teen Claudette Colvin today, who refused to get up off the bus 9 months before Rosa Parks did the same. On this day, March 2. Civil rights leaders avoided taking up her case due to her pregnancy from statutory rape, dark skin and working class background, fearing public opinion.",Feminism,,https://i.redd.it/8cq2nts0xfk41.jpg,1480,Wait is this something people judge as wrong? Rosa Parks was the face they needed to win a case. ,2020-03-03 11:07:44
12,bygszg,False,,203,Bennyboy gets rekt with facts and logic,Feminism,,https://imgur.com/f6AYIRA.jpeg,3344,r/wokekids ,2019-06-09 04:56:44
191,9mfudj,False,,70,Genna's right,Feminism,,https://i.redd.it/eilfbg8aquq11.jpg,1676,[removed] ,2018-10-08 15:28:44
910,bxhia1,False,,104,This poll is absolutely horrifying and should worry women everywhere.,Feminism,,https://gosar.house.gov/forms/form/?ID=15,585,Just asking how is it horryfying ,2019-06-06 14:42:47
707,ddwwvi,False,,37,"My body, my choice always",Feminism,,https://i.redd.it/fkood34lttq31.jpg,748,[removed] ,2019-10-06 01:49:22
209,f1rjoj,False,,18,I laughed out loud at this. And then I felt bad.,Feminism,,https://i.redd.it/x3d4qko0n0g41.jpg,1594,"Me, a trans man: this but unironically, and then I'm gonna keep screaming about it but it's important for all of us, I'll just also be a little happier because I sound like a dude ",2020-02-10 15:06:06
809,d6gyqx,False,,26,Programmer creates dick pic filter after getting sick of receiving them,Feminism,,https://www.theguardian.com/lifeandstyle/2019/sep/19/its-a-violation-the-war-on-unwanted-dick-pics-has-begun,671,"Dick Pics. Frankly, the act of a moron. ",2019-09-19 17:02:41
38,7mu0r9,False,[Sexual harassment],96,Terry Crews: “men need to hold other men accountable”,Feminism,,http://time.com/5049671/terry-crews-interview-transcript-person-of-the-year-2017/,2658,[deleted] ,2017-12-29 12:22:41
593,a9p0zj,False,,145,My 9yo sister got this for Christmas. It came with a juice box to further the imagery of this being a baby. She got a huge box filled with these. Wtf. How can people deny the sexualization of little girls anymore?? This is disgusting.,Feminism,,https://i.redd.it/aahgzl7nvm621.jpg,866,[removed] ,2018-12-26 14:36:58
101,dlx73f,False,,117,440 pairs of women’s shoes hung on a wall in Istanbul.,Feminism,,https://i.redd.it/dua7infjn9u31.jpg,2075,Isn't Islam the greatest religion ,2019-10-23 10:16:25
74,d4zj71,False,,240,Men Vs. WOMEN,Feminism,,https://i.redd.it/5k80dku62ym31.jpg,2243,[removed] ,2019-09-16 11:48:15
55,bt5qjm,False,,39,It's so realistic!,Feminism,,https://i.redd.it/8te5uoykri031.png,2416,[removed] ,2019-05-26 08:51:17
607,hgajm4,False,,16,New Zealand supermarket chain becomes first to use 'period' label on menstrual products | New Zealand,Feminism,,https://www.theguardian.com/world/2020/jun/26/new-zealand-supermarket-chain-countdown-becomes-first-to-use-period-label-on-menstrual-products,852,[removed] ,2020-06-26 16:15:07
679,h9quw3,False,,4,"Neuroscientist Emily Jacobs is awarded a $5M NIH grant to advance women’s health through brain imaging. This will allow her team to establish the effects of ovarian hormone depletion on the body, teasing apart the effects of hormone suppression from the natural course of chronological aging.",Feminism,,https://www.news.ucsb.edu/2020/019935/science-women,772,"More funding for women's health, lead by a woman neuroscientist, is amazing news! ",2020-06-15 22:53:13
94,c38jgs,False,,87,Great to see men standing up for women's rights. We need more of this!,Feminism,,https://i.redd.it/vx2u1b004k531.jpg,2110,His first comment is sexist. ,2019-06-21 09:37:15
793,g6pa7k,False,,165,Why are men so mad at OnlyFans?,Feminism,"This is a rant- kind of??; This is something that’s been bothering me since the beginning of 2020 and feel like I need to address it.

If people wanted to argue that more young women turning to sex work for money Is a growing issue, I would be on board. A woman shouldn’t feel like selling her body is her only option. That would be oddly enough, an actual way to help women in need and protect teenage girls. Of course that’s not the case. None of these men want to help these women, none of these men would even consider donating to a women’s charity because they don’t think the oppression of women exist anymore. Societal views on women are enough to argue that we are not “equal” and aren’t treated with the same respect as men. Just because women can legally “do whatever they want” doesn’t mean women don’t face a significant amount of societal pressure for so many things it’s ridiculous. A woman can’t even own her own body without men putting their 2cents regarding it. 

For clarity, I’m speaking about the men that shame women for sex work. Apparently, a woman benefitting from her own body is so obscene that these men feel the need to retaliate and get angry at women they don’t even fucking know. News flash, just because you are attracted to a woman doesn’t mean her actions are of ANY importance to you. YOU.DO.NOT.OWN.HER. I’m sorry that a chick you would fuck in the right circumstances isn’t all what you hoped to be, go look at the other women you thirst for on a daily basis. You are not loyal to her, so why would she have loyalty towards you or any of the other men that follow her only because she’s hot?

Women are grown ass adults that can hold themselves accountable and know exactly what they’re doing. We don’t need men’s approval and I don’t know why these men react to Onlyfans as if we do. 



Unrelated comment (not necessary to read):
Judging by social media, a lot of men have an issue with the use of the word ‘men’. They’re so quick to take the blame off of other men by pouting “not all men!” It’s as if they are purposely taking feminist/women out of context. Of course we aren’t talking about EVERY SINGLE man in existence. If certain men are willing to be offended by the general use of the word “men”, they should be willing to accept and admit the privileges they have as a man. If I say, “men created beauty standards for women” do not respond with “not all men!” It doesn’t make what I said any less of a problem and doesn’t generate hope for men because I’m not talking about the men who don’t perpetuate the problem. I don’t need to “hope” that there’s good men, my hope is reserved for the men who can’t comprehend something so simple as respecting women and their decisions.",https://www.reddit.com/r/Feminism/comments/g6pa7k/why_are_men_so_mad_at_onlyfans/,676,[removed] ,2020-04-23 16:01:04
427,985oj4,False,,70,What a strange concept,Feminism,,https://i.redd.it/nvel6g70qpg11.png,1104,[removed] ,2018-08-17 20:23:40
858,5ll1uy,False,,145,Denmark will become first country to no longer define being transgender as a mental illness,Feminism,,http://www.independent.co.uk/news/world/europe/denmark-will-be-the-first-country-to-no-longer-define-being-transgender-as-a-mental-illness-a7029151.html,617,[removed] ,2017-01-02 12:36:57
201,d4l9rb,False,,148,Every negative stereotype about women is actually men projecting.,Feminism,,https://i.redd.it/lrxiuq06jnm31.jpg,1629,[removed] ,2019-09-15 14:39:56
381,cjr03v,False,,235,"""They are not victims, they are heirs.""",Feminism,,https://i.redd.it/c57n39xqofd31.jpg,1190,[removed] ,2019-07-30 12:23:36
792,b8jke5,False,[Disputed content],197,This cartoon was posted as an attempt to accept religious freedoms. But all it made me think was: does she really have a choice. Muslim women in the west do but who will stand with those living under Shari law without a voice at all? Are we normalizing oppression under the guise of tolerance?,Feminism,,https://i.redd.it/2be3n7d7xup21.jpg,681,[removed] ,2019-04-02 13:58:28
617,85z0dm,False,,50,Pretty accurate,Feminism,,https://i.redd.it/230b9ve0b1n01.jpg,833,[removed] ,2018-03-21 03:16:29
71,erxev5,False,,156,Double standards,Feminism,,https://i.redd.it/q6d2rcstw5c41.jpg,2252,[removed] ,2020-01-21 16:55:46
238,g3q6oc,False,,10,"She identified what became known as the first human coronavirus, but her paper to a peer-reviewed journal was rejected ""because the referees said the images she produced were just bad pictures of influenza virus particles"". She also helped take novel pictures of the HIV virus in the late 1980s.",Feminism,,https://i.redd.it/m01l8ebyqlt41.jpg,1526,Great job ,2020-04-18 16:21:39
351,9jvezc,False,[Quotes/Posters] [Sexuality] [Movies/TV],45,Austin frikken Powers,Feminism,,https://i.imgur.com/nKKG9F6.jpg,1251,"Okay, c’mon. He’s a movie character so “most sexed up man in all of history” is ridiculous. There is no point here.  ",2018-09-29 10:10:19
