Num,ID,is_Original,Flair,num_comments,Title,Subreddit,Body,URL,Upvotes,Comments,creation_date
282,jwl45,False,,0,"Carnival Against Child Abuse, August 2011",kidsrights,,http://astridetal.wordpress.com/2011/08/26/carnival-against-child-abuse-august-2011/,3,,2011-08-28 00:43:12
399,af1q1m,False,,0,‘Trapped in a box’: Sheriff shutters unit that kept teen inmates in solitary confinement,kidsrights,,https://www.charlotteobserver.com/news/local/article223927000.html,1,,2019-01-12 00:00:39
155,e6smq9,False,,0,AP Exclusive: 629 Pakistani girls sold as brides to China,kidsrights,,https://abcnews.go.com/International/wireStory/ap-exclusive-629-pakistani-girls-sold-brides-china-67483177,3,,2019-12-06 03:08:41
344,1x3thz,False,,0,New Coloring Pages at Coloring99.com,kidsrights,,http://www.coloring99.com/,2,,2014-02-05 19:02:29
281,lcyu5,False,,1,"Map shows the approximate locations of about 300,000 unique computers identified as trafficking in the most brutal & violent child pornography movies & images. due to lack of resources, fewer than 2% are even being investigated",kidsrights,,http://www.protect.org/images/stories/us-12_month07-08.jpg,3,"more info
http://www.protect.org/component/content/article/808 ",2011-10-15 07:05:01
22,cffyhe,False,,0,"Trump administration won't ban pesticide tied to childhood brain damage - Evironmental Protection Agency rejects proposed ban on chlorpyrifos, despite growing evidence of its toxicity",kidsrights,,https://www.theguardian.com/us-news/2019/jul/18/epa-chlorpyrifos-ban-children-brain-damage-trump,7,,2019-07-20 01:14:29
74,e931sb,False,,0,‘Parents Can Relax a Little’: The Problem With Academic Redshirting,kidsrights,,https://www.theatlantic.com/education/archive/2015/08/beyond-the-pros-and-cons-of-redshirting/401159/?utm_campaign=the-atlantic&utm_medium=social&utm_source=facebook&fbclid=IwAR3GPacx6g9Fqo3CrL506S4ndrOKQXW3KTq1QoH42SvOdZG0oALGPzHEhWU,3,,2019-12-11 05:51:03
100,bm1rfe,False,,0,High Lead Contamination Found in Children Living by Battery Plant in LA,kidsrights,,https://news.usc.edu/156523/lead-in-baby-teeth-exide-battery-plant/,5,,2019-05-08 06:16:40
286,ep2r97,False,,0,Exposure to flame retardants is causing US kids to lose millions of IQ points. They're more damaging than lead or mercury.,kidsrights,,https://news.yahoo.com/exposure-flame-retardants-causing-us-051500780.html,2,,2020-01-15 14:08:53
443,163i55,False,,0,"How Watching Physical Bullying Can Cause Substance Abuse in Kids: Children who observe physical or verbal bullying while in school, experience as much psychological stress as the victims of bullying, a UK study claims",kidsrights,,http://suite101.com/article/watching-physical-bullying-could-cause-substance-abuse-in-kids-a226124,0,,2013-01-07 03:00:21
329,aiw7oe,False,,0,"Advocates slam thousands of child marriages in U.S., demand Congress act: Last year, Rep. Bobby Rush, D-Illinois, introduced legislation to end child marriages in the United States, but the bill never made it out of committee.",kidsrights,,https://www.nbcnews.com/politics/politics-news/us-immigration-system-approved-thousands-child-marriages-past-decade-n960416,2,,2019-01-23 05:05:58
338,6uchsv,False,,0,I have started a child/family friendly lets play channel and would love feedback/support,kidsrights,"Hello everyone. I have started a [gaming YouTube channel](https://www.youtube.com/channel/UCwn6-MD4tWZQ0loPpYUQBUw/videos) for children and young people where the content can be reliably content appropriate.

I have worked with children and young people for over 8 years, and I have been a gamer for even longer.

With a lot of gaming content aimed at children and young people I believe that some of the games are not suited for them, e.g. grand theft auto and even five nights at Freddy’s can have a negative impact on younger children who are watching let’s play. In addition some of the language used by a lot of youtubers can be seen as offensive and most would not want their children repeating what is said.

There is also a flood of content aimed at children with a [malicious intent](http://www.bbc.co.uk/news/blogs-trending-39381889) (such as the videos with the most popular random tags to generate views or videos made to look friendly only to have shock value)  with many still getting though the YouTube kids app.

So, that’s why I have started this channel. The games I play will range between E for everyone and T for teens (e.g. overwatch). I will also be keeping the language clean.

This is the first time I have ever done video/sound editing as well as video game commentary. So it will be a learning process. I fear that it will start off abit cringey and low quality, but the more I do it the better I will get. 
As of this post I have only a few videos on the channel but I aim to have at least 3 videos added each week.

And as a final note, I just want to point out that I am not against violent or scary games and play them in my spare time myself. But having seen first-hand children’s reactions to content that they were not ready for (I have met parents whose children as young as 3 have had nightmares about five nights at Freddy’s and not being aware that the game was even from the horror genre or that their children were watching it).

So, I am the Good Natured Gamer. And I hope you and your family enjoy my videos.",https://www.reddit.com/r/kidsrights/comments/6uchsv/i_have_started_a_childfamily_friendly_lets_play/,2,,2017-08-17 19:45:13
214,bfj6nq,False,,0,School bullying increases chances of mental health issues and unemployment in later life. Being bullied in school increases the extent of mental health problems at age 25 by 40%. It also increases the probability of being unemployed at age 25 by about 35%,kidsrights,,https://www.lancaster.ac.uk/news/school-bullying-increases-chances-of-mental-health-issues-and-unemployment-in-later-life,3,,2019-04-21 00:41:34
254,vvh31,False,,0,‘Who Would Believe A Kid?’ The Sandusky Jury,kidsrights,,http://www.npr.org/2012/06/23/155621728/sandusky-verdict-answers-who-would-believe-a-kid?ft=1&f=1001&sc=tw&utm_source=twitterfeed&utm_medium=twitter,3,,2012-07-01 09:20:06
345,1qnpmq,False,,0,Did the Disturbing Philosophy of “How to Train Up a Child” Lead to Hana Williams’ Death?,kidsrights,,http://www.slate.com/blogs/xx_factor/2011/10/03/did_the_disturbing_philosophy_of_how_to_train_up_a_child_lead_to.html,2,,2013-11-15 01:10:35
319,b19zo9,False,,0,147-8: Mass. House Overwhelmingly Votes To Ban Conversion Therapy For Minors,kidsrights,,https://www.wbur.org/news/2019/03/13/house-vote-conversion-therapy-ban,2,,2019-03-15 03:40:00
193,by01ci,False,,0,"Germany registers shocking number of child abuse cases - Police have said that this year's crime statistics paint a grim picture of the state of child welfare in Germany. More than 100 children were killed in 2018, and thousands were sexually abused.",kidsrights,,https://www.dw.com/en/germany-registers-shocking-number-of-child-abuse-cases/a-49094444,3,,2019-06-07 21:23:20
458,17xp0h,False,,0,"The 4th Annual MACs Kids Expo Will Take Place on February 24th, 2013 in Ardsley, NY | PRLog",kidsrights,,http://www.prlog.org/12073753-the-4th-annual-macs-kids-expo-will-take-place-on-february-24th-2013-in-ardsley-ny.html,0,,2013-02-05 15:29:43
147,jl8ya,False,,0,An In-Depth Series on Abuse at Teen Challenge: Coercive Religious Groups Disguised as Rehab,kidsrights,,http://teenchallengecult.blogspot.com/2008/05/daily-kos-dogemperor-teen-challenge.html,4,,2011-08-17 04:24:01
117,4u0o35,False,,1,[Rant] We need to change they way we parent children,kidsrights,"Parents should not be able to own their children. 

It might sound like hyperbole to say that the nuclear family is a system of ownership. However, when I compare what I know about parenthood to what I know about slavery, I see a resemblance between the two. I think that parenthood is slavery. I'm not saying this out of resentment for my own parents: I think that the parent-child relationship is systemically oppressive towards children. Consider the concept of ""setting rules"" for your children. ""Do not eat that"", sure, when your child is a baby, is a reasonable rule for you to enforce. But children quickly develop traits that naturally defy authority, such as: logical thinking grounded in empirical observation, the ability to perform risk assessment, a coordinate body possessing rudimentary athletic skills, and an individual willfulness operating within an emotional context. 

It is  natural and necessary that children defy their parents, and that they are immune to most or all of adult law and politics. To deliberately force your child into a prefabricated adult worldview is the very definition of grooming. Whether the parent's rule-making is sexual or simply authoritarian, they are social conditioning their children. You might believe that conditioning your child in certain ways is absolutely necessary in particular instances. For example, isn't it essential that you raise a child to protect themselves from danger? We do not live in an intuitive world, nor a safe one for young people. This is obvious to everyone. ""Won't someone please think of the children"" has fallen so far into the realm of cliche that it is never said in earnest. Everyone knows that the world is unsafe for children, and that is how parents rationalize owning their children. Parents believe, perhaps correctly, that they are owning their children for their children's own good. That raises two possibilities. 

In the first place, a parent could be mistaken. Believing their actions to be just, these parents take risk on their children's behalf. And it is principally the children, and not the parents, who suffer from the decisions that parents make. But suppose that a parent is acting in their child's best interest. Even if it's true that a parent is doing good for their child, it is still uncertain whether they are doing *the best* for their child. The concept of what should be best for a child is staggering in its complexity, and I am worried when people do not seem to ever doubt their own instincts when it comes to parenting. Parents have lived through weeks, months and years of direct, hands-on parenting, whereas I have none of that. But I am not trying to say that ""this type of parent is good"" or ""this type of parent is bad"". Parenting looks incredibly difficult from my point of view. (Although a lot of the work can be subsidized if you have the money.) The poor make hard decisions yet still cannot take away their children's hardship. The child of a subaltern grows into an adult who has suffered. But I think that all children suffer under our model of parenting, and all grow into adults who have suffered. But children suffer in a myriad of ways, and consequently grow into adults that relate only people who have suffered similarly to themselves.

What our society does is not only raise children to suffer, but also alienates them. From birth, every child is born into unique personal circumstances. These are the people who raised me, That is the home I live in, These are the things that interest me, that I am afraid of, that I want to do, These are the rules I must follow. But our child-owning culture has developed its own taxonomy of children, as if they were so many breeds of dogs. The black and white children. The girls and the boys. The poor and the rich. Children are alienated from their community of fellows. For every child who suffers in a given society, every adult is a participant in that suffering. Society owes children certain freedoms, protections, and opportunities. A just society would not normalize child ownership and *laissez-faire* parenting. Much as corporate freedoms do to the working class, so does parental freedom do to children.

My argument is not that no argument for child ownership is just. My argument is that the nuclear family is a monopoly that ought not exist, at least not as the only option a child has. I am in favor of children being allowed to decide (freely and without duty or punitive enforcement) to leave their nuclear family and spend time within a community network where no single individual has parental control, but rather the democratic community at large speaks in the voice of a parent. And, just as freely as a child may walk away from their parents, so too may they walk away from their community at any time, without consequence.  But even with the addition of community-model parenting as an alternative to nuclear-model parenting, the child is still not sufficiently free from the danger of ownership. A third option must be supported: voluntary exile from the community, and into an autonomous region which is available to children who wish to live independently, and where children are self-governing. These three institutions must come together to liberate children from tyranny, and they must be fully permeable so that a child's choice is never irrevocable. Parental-social contracts must be unenforceable except to the extent which they benefit the child.

Therefore: every child deserves free travel among these three institutions: 1) nuclear-model parenting, represented by their biological, adoptive, and alternative parents, 2) community-model parenting, represented by their extended family, neighbors, and community residents, and 3) self-model parenting, represented by the capabilities that the growing child possesses, which allows them to operate autonomously. And each of these institutions must prioritize the child over the needs of the parents or community, at least to the extent that the child is incapable of taking care of themselves. Even a child whose decision-making capabilities are wanting deserves to attempt to live autonomously, most of all because they deserve to learn for themselves what they are capable of, rather than merely taking the word of a well-meaning authority who would deny them the freedom to try. Children learn by doing, and any society that infringes on its children's capacity to learn is grooming them to perform a social function.

It is a goal among liberals and socialists alike, but especially among the postmodernists, that power must be diffused among many hands, because tyrants blossom when power is contained by the few. Power is itself the problem. A just society is one which recognizes principles of inalienable human rights. Martha Nussbaum recognizes ten central capabilities: life; bodily health; bodily integrity; senses, imagination and thought; emotions; practical reason; affiliation; other species; play; and control over one's environment [(Nussbaum 2006: 76–78)](http://plato.stanford.edu/entries/capability-approach/#SelAggCap). To treat children as fully-human, they must be assured each of these.",https://www.reddit.com/r/kidsrights/comments/4u0o35/rant_we_need_to_change_they_way_we_parent_children/,5,"Thank you.
https://stinneydistro.wordpress.com ",2016-07-22 02:38:27
21,ciddse,False,,0,Top CBP Officer Testifies He’s Unsure if 3-Year-Old Is “a Criminal or a National Security Threat”,kidsrights,,https://slate.com/news-and-politics/2019/07/cbp-chief-brian-hastings-family-separation-judiciary-hearing-not-mueller.html,7,,2019-07-27 04:56:47
239,8z2xfk,False,,0,"Detaining immigrant kids is now a billion-dollar industry: International Educational Services also was a big recipient, landing more than $72 million in the last fiscal year before folding amid a series of complaints about the conditions in its shelters.",kidsrights,,https://abcnews.go.com/US/wireStory/detaining-immigrant-kids-now-billion-dollar-industry-56546291,3,,2018-07-15 16:33:32
435,l4c9m,False,,0,I found a neat PDF here for working with Adolescents,kidsrights,,http://thoughtshopfoundation.org/movies/CSA_Sn_E.pdf,1,,2011-10-07 17:55:11
178,c6yc06,False,,0,"He’s Built an Empire, With Detained Migrant Children as the Bricks",kidsrights,,https://www.nytimes.com/2018/12/02/us/southwest-key-migrant-children.html,3,,2019-06-29 12:22:38
167,cv9nc4,False,,0,Students and Teachers Are Writing Wills in Case They Are Killed in a School Shooting,kidsrights,,https://www.teenvogue.com/story/students-teachers-writing-wills-in-case-killed-school-shooting,3,,2019-08-25 15:10:29
453,j2y6i,False,,16,"Meta: Looking for ideas for the sidebar, volunteer 
mods, and possibly a logo submission.",kidsrights,,https://www.reddit.com/r/kidsrights/comments/j2y6i/meta_looking_for_ideas_for_the_sidebar_volunteer/,0,"If you want to spread out the mod workload, I'll volunteer, if you think I'll be helpful. (Feel free to demod if I'm not doing a good job.) ",2011-07-29 05:30:31
92,c0p159,False,,0,Teen Mom And Prematurely Born Baby Neglected At Border Patrol Facility For 7 Days,kidsrights,,https://www.huffingtonpost.com/entry/teen-mother-and-her-premature-infant-neglected-in-border-patrol-custody-for-seven-days_n_5d02ae24e4b0304a120c411b,4,,2019-06-14 20:42:28
350,1bxgcb,False,,0,Silent Victims-Effects of Domestic Violence on Children,kidsrights,,http://www.youtube.com/watch?v=itmvLytrN-s&feature=share,2,,2013-04-08 17:27:46
285,j30lp,False,,0,Choices for Children,kidsrights,,http://www.alfiekohn.org/teaching/cfc.htm,3,,2011-07-29 07:17:04
238,95k79p,False,,0,"Girls in polygamous Kingston Group continue to marry as young as 15, records show, sometimes leaving Utah to marry cousins",kidsrights,,https://www.sltrib.com/news/polygamy/2018/08/04/girls-polygamous-kingston/,3,,2018-08-08 08:23:27
124,1xhc4w,False,,2,Sub to Stop Spanking of Children,kidsrights,"[This](http://www.reddit.com/r/StopSpanking) is my newly created subreddit to advocate for the abolition of spanking, a practice that studies have consistently shown doesn't work and is harmful for children later in life. This will be the place to post articles, discuss ideas, post news, and support the abolition of this practice. Thanks for your time to read this and enjoy the sub if you decide to look around.

Please note that this page isn't really for debate, it's more for people already opposed to hitting to pass around links and articles, and for people to learn about our side of the issue. However, I would be more than happy to debate spanking here and in other places, and my cohorts would be too.

Thanks everybody for your time, and please continue to fight for the rights of children. I can't even tell you how my I respect people who fight for those who can't fight for themselves.
",https://www.reddit.com/r/kidsrights/comments/1xhc4w/sub_to_stop_spanking_of_children/,5,"I joined, but honestly there's got to be a better name for this movement than ""stop spanking.""

Maybe ""TeachNotHit?""
 ",2014-02-10 01:37:21
90,c9fnv9,False,,0,"California's 1st Surgeon General Spotlights Health Risks Of Childhood Adversity: the toxic stress of childhood trauma as among the root causes ""of many of the most harmful and persistent health challenges facing Californians.""",kidsrights,,https://www.npr.org/sections/health-shots/2019/07/02/733896346/californias-first-surgeon-general-spotlights-health-risks-of-childhood-adversity,3,,2019-07-05 12:58:05
248,1cn48a,False,,1,"Child Abuse and Physical Health 25 years Later: Adverse Childhood Experiences (ACE’s, like abuse, neglect and severe family dysfunction) are correlated not only with mental illness and addiction, but also with physical illnesses like heart disease, lung disease and even auto-immune diseases (mp3)",kidsrights,,http://safespaceradio.com/2013/04/child-abuse-and-physical-health-25-years-later/,3,">An interview with Dr. Vincent Felitti about his groundbreaking research to show that Adverse Childhood Experiences (ACE’s, like abuse, neglect and severe family dysfunction) are correlated not only with mental illness and addiction, but also with physical illnesses like heart disease, lung disease and even auto-immune diseases.  He reports that **just asking patients about the presence of such painful experiences results in fewer medical emergencies and need for extra doctors visits.**   Over 17,000 patients were part of a study, showing that the prevalence of ACE’s is terribly high (28% of children experience harsh physical abuse like beatings, and 22% suffer sexual abuse, 16% of boys, and 28% of girls).  He reports that despite these findings about the frequency of child abuse, and the relationship to adult health, many doctors are still very reluctant to ask about it, or to include it in how they think about their patients.  This is especially sad given that the simple act of asking one follow up question about how the abuse is affecting them now, reduces the need for medical care (not to mention the cost!) even further… ",2013-04-18 23:30:52
259,tj1h3,False,,0,Ultra-Orthodox Jews Shun Their Own for Reporting Child Sexual Abuse ,kidsrights,,http://www.nytimes.com/2012/05/10/nyregion/ultra-orthodox-jews-shun-their-own-for-reporting-child-sexual-abuse.html,3,,2012-05-12 00:58:46
237,9bmtpm,False,,0,BUILDING BABIES BRAINS: Brazil’s audacious plan to fight poverty using neuroscience and parents’ love,kidsrights,,https://qz.com/1298387/brazils-wildly-ambitious-incredibly-precarious-program-to-visit-every-poor-mother-and-change-their-childrens-destiny/,3,,2018-08-30 19:40:08
67,f2opo4,False,,0,A Victim’s Account Fuels a Reckoning Over Abuse of Children in France: A French author wrote for years about his predilection for children and continued to win acclaim. Now one of them has spoken out.,kidsrights,,https://www.nytimes.com/2020/01/07/world/europe/france-pedophilia-gabriel-matzneff.html,4,,2020-02-12 09:29:31
438,jgjep,False,,0,NBC Kansas City affiliate does a decent -- albeit far too short -- job on signs of child abuse.,kidsrights,,http://www.nbcactionnews.com/dpp/news/local_news/what-to-look-for-and-how-to-react-if-you-suspect-your-child-has-been-sexually-abused,1,,2011-08-12 06:39:18
304,cfpr9p,False,,0,If a school LOST 1 CHILD every week ... What would you do?,kidsrights,,https://www.change.org/p/us-department-for-health-and-human-services-if-a-school-lost-1-child-every-week-what-would-you-do,2,,2019-07-20 19:26:19
245,1jkcgk,False,,0,Violence Witnessed by Children Fuels School-Age Aggression: Children age three and younger who witness intimate partner violence are likely to increase their aggressive behavior when they reach school age,kidsrights,,http://www.psychcongress.com/article/violence-witnessed-children-fuels-school-age-aggression-12312,3,,2013-08-02 14:19:44
103,augycb,False,,0,The Trump administration cannot be allowed to make orphans out of migrant children,kidsrights,,https://www.washingtonpost.com/opinions/the-trump-administration-cannot-be-allowed-to-make-orphans-out-of-migrant-children/2019/02/24/024628a8-36e3-11e9-af5b-b51b7ff322e9_story.html,4,,2019-02-25 04:32:37
129,1hr37r,False,,2,"Inner-City Women’s Health Problems Linked to Childhood Traumas: After ruling out factors such as age, education, race, the researchers found that childhood trauma affects physical health in adulthood through lifetime drug dependence, smoking, more adverse life events & greater psychological distress",kidsrights,,http://psychcentral.com/news/2013/07/06/inner-city-womens-health-problems-linked-to-childhood-traumas/56890.html,5,one more reason for society to take child abuse seriously in order to prevent later costs to society ... since to some children's right to be free from abuse apparently is not good enough to be bothered with... ,2013-07-06 15:51:21
463,28u3mh,False,,0,Đồ chơi cho bé,kidsrights,,http://www.babysol.vn/do-choi-cho-be.html,0,,2014-06-23 01:31:19
220,b20yk1,False,,0,Doctors ‘lied to 11-year-old girl to get her to have rapist’s baby’,kidsrights,,https://www.independent.co.uk/news/world/americas/argentina-young-girl-rape-abortion-doctors-vitamins-11-year-old-victim-lucia-a8821596.html,3,,2019-03-17 03:22:07
396,akkjac,False,,0,We Spoke To Kids Held At Tornillo's Tent City For Migrant Children (HBO),kidsrights,,https://www.youtube.com/watch?v=cTHeFIB_-js,1,,2019-01-28 05:57:27
230,a8fxf1,False,,0,"In Immigrant Children’s Shelters, Sexual Assault Cases Are Open and Shut: again and again, the reports show, the police were quickly — and with little investigation — closing the cases, often within days, or even hours.",kidsrights,,https://www.propublica.org/article/boystown-immigrant-childrens-shelter-sexual-assault,3,,2018-12-22 00:08:03
60,m4k7u,False,,1,"Michael Pearl on 'training' children ""After a short explanation about bad attitudes & the need to love, patiently & calmly apply the rod to his backside. Somehow, after eight or 10 licks, the poison is transformed into gushing love and contentment. The world becomes a beautiful place.""",kidsrights,,http://www.guardian.co.uk/commentisfree/2006/jun/08/comment.usa1,5,Yikes. I remember that kind of discipline. Pretty fucked up. ,2011-11-08 06:42:18
31,mts43,False,,0,Hartmann: Countries that Don't Beat their Children,kidsrights,,http://www.youtube.com/watch?v=RKnlpG7itqM&feature=relmfu,5,,2011-11-29 21:02:01
427,pubd2,False,,0,"UK how wealth affects health: 4 in 10 children are failing to master the basic skills expected of a 5 year old. # of failing pupils in poorer areas almost 2x wealthier. ""children's lives are being 'blighted' from an early age by inequality""",kidsrights,,http://www.telegraph.co.uk/health/healthnews/9081670/Children-are-being-failed-on-a-grand-scale.html,1,,2012-02-17 20:14:52
408,29fdg6,False,,0,How to Talk to Your Kids About Homosexuality,kidsrights,,http://deaquialpans.wordpress.com/2014/05/28/como-hablar-de-homosexualidad-con-ninos-y-ninas-pequenos-2/,1,,2014-06-29 22:51:24
