Num,ID,is_Original,Flair,num_comments,Title,Subreddit,Body,URL,Upvotes,Comments,creation_date
387,bxmvk5,False,,0,"Experiences early in life such as poverty, residential instability, or parental divorce or substance abuse, can lead to changes in a child’s brain chemistry, muting the effects of stress hormones, and affect a child’s ability to focus or organize tasks, finds a new study.",kidsrights,,http://www.washington.edu/news/2019/06/04/how-early-life-challenges-affect-how-children-focus-face-the-day/,1,,2019-06-06 22:22:48
392,b43bvq,False,,0,"ACLU says schools need more mental health professionals, not police",kidsrights,,https://www.cnn.com/2019/03/12/us/aclu-school-suspension-report/index.html,1,,2019-03-22 10:13:54
0,ewvmnw,False,,21,"In Egypt, 12-year-old girl dies after genital mutilation: a 2015 government survey found that 87% percent of all Egyptian women between 15 and 49 years of age have been circumcised.",kidsrights,,https://abcnews.go.com/International/wireStory/egypt-12-year-girl-dies-genital-mutilation-68663774,14,that's similar to the rate of men between 15 and 49 years in america who have been circumcised. ,2020-01-31 21:51:07
157,dwsbtn,False,,0,'False wall' found in Colorado Springs day care owner's house with 26 kids in basement,kidsrights,,https://www.wndu.com/content/news/False-wall-found-in-Colorado-Springs-day-care-owners-house-with-26-kids-in-basement-564956262.html?fbclid=IwAR1BvGdcwAQfGGBLyDdw19cvdOB-8IDmGSmlhXoWd4tnfZ5qm4bOmttHwOM,3,,2019-11-15 15:31:04
110,9st4gn,False,,0,"Foster care cases increase in Kentucky, highlighting serious need for foster parents",kidsrights,,http://www.wdrb.com/story/39378960/foster-care-cases-increase-serious-need-for-foster-parents,4,,2018-10-30 23:07:43
164,d6bt8e,False,,0,(Sept 11 2019) The Administration’s Apparent Revocation of Medical Deferred Action For Critically Ill Children,kidsrights,,https://oversight.house.gov/legislation/hearings/the-administration-s-apparent-revocation-of-medical-deferred-action-for,3,,2019-09-19 09:56:36
208,bkh4es,False,,0,Police took a cancer-stricken toddler from his parents. Their supporters call it a ‘medical kidnapping.’,kidsrights,,https://www.washingtonpost.com/nation/2019/05/02/police-took-cancer-stricken-toddler-his-parents-their-supporters-call-it-medical-kidnapping/?utm_term=.6de0bfc1674a,3,,2019-05-04 03:40:26
142,n4eh9,False,,0,Gingrich on child labor,kidsrights,,http://www.youtube.com/watch?v=0gsc9ElmJEs&feature=mfu_in_order&list=UL,3,,2011-12-08 04:34:51
197,bplx2n,False,,0,Trump’s pick for ICE director: I can tell which migrant children will become gang members by looking into their eyes,kidsrights,,https://www.politico.com/story/2019/05/16/mark-morgan-eyes-ice-director-1449570,3,,2019-05-17 02:59:37
366,mgolj,False,,0,Circle of Trust : The Zero - The Official Website of Andrew Vachss,kidsrights,,http://www.vachss.com/help_text/circle_of_trust2.html,2,,2011-11-18 06:51:17
431,myl4r,False,,0,"Immigration amnesty issue snags sex-trafficking bill - “These child victims of prostitution are being treated like prostitutes. This bill is seeking to address the victim — and make them be just that: Victims. Right now, they’re treated as criminals.""",kidsrights,,http://www.miamiherald.com/2011/12/02/2529106/immigration-amnesty-issue-snags.html,1,,2011-12-03 09:04:57
61,lwjoi,False,,0,And this is for...,kidsrights,,http://www.smbc-comics.com/?db=comics&id=83#comic,5,,2011-11-01 16:19:06
150,euqpri,False,,0,"Despite Findings Of 'Negligent' Care, ICE To Expand Troubled Calif. Detention Center",kidsrights,,https://www.npr.org/2020/01/15/794660949/despite-findings-of-negligent-care-ice-to-expand-troubled-calif-detention-center,3,,2020-01-27 17:03:55
166,cv9p40,False,,0,"Pete Buttigieg Is Going All In On The Youth Mental Health Crisis: ""We can’t pretend there’s no health consequences to what’s going on in the White House.""",kidsrights,,https://www.teenvogue.com/story/pete-buttigieg-mental-health-plan-interview,3,,2019-08-25 15:14:41
159,dgvvh9,False,,0,‘Big Win For Public Health’: California Bans Widely Used Pesticide Chlorpyrifos Linked To Brain Damage,kidsrights,,https://khn.org/morning-breakout/big-win-for-public-health-california-bans-widely-used-pesticide-chlorpyrifos-linked-to-brain-damage/,3,,2019-10-12 14:31:23
315,bb1hw8,False,,0,"The U.S. Is Tracking Migrant Girls' Periods to Stop Them From Getting Abortions: We still don’t know where 1,488 migrant children are. The U.S. government lost them. But by God, they can keep track of teenage migrant girls' menstrual cycles.",kidsrights,,https://www.harpersbazaar.com/culture/politics/a26985261/trump-administration-abortion-period-tracking-migrant-women/,2,,2019-04-09 00:41:38
305,cfppqn,False,,0,It’s not hard for foster kids to just disappear. One Traverse City author is trying to change that.,kidsrights,,https://www.michiganradio.org/post/it-s-not-hard-foster-kids-just-disappear-one-traverse-city-author-trying-change,2,,2019-07-20 19:22:38
132,zwa4y,False,,0,"""Sentenced to Abuse"": Problems of Juvenile Corrections Facilities",kidsrights,,http://www.psychologytoday.com/blog/child-myths/201001/sentenced-abuse-problems-juvenile-corrections-facilities,5,,2012-09-14 21:15:00
42,c7pid8,False,,1,Fox’s Shep Smith Torches Trump: We Treat Migrant Children Worse Than Prisoners of War,kidsrights,,https://www.thedailybeast.com/fox-news-anchor-shep-smith-torches-trump-we-treat-migrant-children-worse-than-prisoners-of-war,4,"I’m not usually a big fan of Fox, but this is something I can really respect. It’s sad that growing the balls to defend literal defenseless children is notable, but here we are. Still, I’m glad someone at Fox is at least saying something about it instead of just being complacent. ",2019-07-01 07:16:46
236,9io863,False,,0,"Witnessing violence in high school as bad as being bullied - ""Over the long term, being a bystander of high-school violence can be as damaging to mental health as being directly bullied, a new study finds.""",kidsrights,,https://nouvelles.umontreal.ca/en/article/2018/09/17/witnessing-violence-in-high-school-as-bad-as-being-bullied/,3,,2018-09-25 02:17:00
417,1il3w3,False,,0,Government takes action against FLDS company over child labor violations: Investigation » Company allegedly used hundreds of kids as farm workers,kidsrights,,http://www.sltrib.com/sltrib/news/56198633-78/labor-barlow-department-harvest.html.csp,1,,2013-07-18 21:00:47
128,1l0p8l,False,,0,Child Forced Labor Part II: Agriculture in the Americas,kidsrights,,http://humantraffickingsearch.net/wp/child-forced-labor-part-ii-agriculture-in-the-americas/,4,,2013-08-24 20:16:01
198,bp96k0,False,,0,Poland shaken by documentary about pedophile priests,kidsrights,,https://abcnews.go.com/International/wireStory/poland-shaken-documentary-pedophile-priests-62999758,3,,2019-05-16 06:40:32
279,lzd1g,False,,0,An Alternate Approach to Stop School Bullying: Fix the Victims - Hans Villarica - Life - The Atlantic,kidsrights,,http://www.theatlantic.com/life/archive/2011/10/an-alternate-approach-to-stop-school-bullying-fix-the-victims/247548/,3,,2011-11-03 19:57:24
188,c0g8ou,False,,0,School: Videos of unwanted sexual contact aren't harassment,kidsrights,,https://apnews.com/38362a73fc774024ba3aa9e352f5b452,3,,2019-06-14 05:16:11
373,lvs28,False,,1,Keep Kids Out of Coal Mines - Loopholes in Indian child labor laws allow children as young as 8 to leave school to earn money mining.,kidsrights,,http://www.thepetitionsite.com/takeaction/130/675/608/,2,,2011-10-31 23:27:53
291,dl8phi,False,,0,"Uncertain work schedules linked to food and housing insecurity, anxiety in kids",kidsrights,,http://mainebeacon.com/uncertain-work-schedules-linked-to-food-and-housing-insecurity-anxiety-in-kids/,2,,2019-10-21 23:12:39
249,1bx6cp,False,,0,"Sibling Abuse: An interview with author and professor, Dr. Vernon Wiehe about sibling abuse and how it differs from sibling rivalry (mp3)",kidsrights,,http://safespaceradio.com/2012/02/sibling-abuse/,3,,2013-04-08 15:17:41
133,z5tyy,False,,0,A Hard Life in the Fields Starting at Age 7: A first-hand account of life as one of the voiceless people who put food on your table.,kidsrights,,http://www.alternet.org/immigration/hard-life-fields-starting-age-7?paging=off,4,,2012-08-31 23:36:47
217,bcoqya,False,,0,"More children were shot dead in 2017 than on-duty police officers and active duty military, study says",kidsrights,,https://www.newsweek.com/kids-and-guns-alarming-rise-firearm-deaths-among-american-children-1370866,3,,2019-04-13 09:16:15
385,ce80yz,False,,0,We have set up a system to sex traffic American children,kidsrights,,https://www.newsweek.com/we-have-set-system-sex-traffic-american-children-779541,1,,2019-07-17 04:29:42
3,akkmfi,False,,0,"Immigrant Youth Shelters: “If You’re a Predator, It’s a Gold Mine” —“You have full access and then you have kids that have already had this history of being victimized.”",kidsrights,,https://www.propublica.org/article/immigrant-youth-shelters-sexual-abuse-fights-missing-children,7,,2019-01-28 06:08:54
303,ciddg9,False,,0,"Exclusive: On family separations, one arm of the Trump administration raised hundreds of red flags to another - In many cases, family separation happened without warning and without giving the children the chance to say goodbye to their families",kidsrights,,https://www.cnn.com/2019/07/25/politics/family-separation-documents/index.html,2,,2019-07-27 04:55:48
235,9keq44,False,,0,Hundreds of Migrant Children Quietly Moved to a Tent Camp on the Texas Border,kidsrights,,https://www.nytimes.com/2018/09/30/us/migrant-children-tent-city-texas.html,3,,2018-10-01 09:05:17
280,lvsdh,False,,0,"Beating the Devil Out of Them  - While studying children with serious conduct problems, those researchers found that the children's behavior improved AFTER their parents stopped spanking. ",kidsrights,,http://www.neverhitachild.org/straus.html,3,,2011-10-31 23:36:20
342,28zexb,False,,0,"High-Level Former Employee of The Old Schoolhouse (Global Christian Homeschooling Company) Accuses Owners, Paul and Gena Suarez, of Protecting Child Molesters; Shaming/Silencing Victims.",kidsrights,,https://homeschoolersanonymous.wordpress.com/2014/06/24/paul-and-gena-suarez-old-schoolhouse-publishers-accused-of-protecting-known-child-predators/,2,,2014-06-24 17:51:14
257,twcg6,False,,0,"Uzbekistan: End Forced, Child Labor in Cotton Fields",kidsrights,,http://www.hrw.org/news/2012/04/25/uzbekistan-end-forced-child-labor-cotton-fields,3,,2012-05-20 19:37:14
402,4ma32z,False,,2,"Strange question: does the arrest and imprisonment of children who are sexually active on their own terms count as police abuse, or as sexual abuse?",kidsrights,"I know that is a completely stupid question, I'm probably going to get banned. But, it's something I want to ask.",https://www.reddit.com/r/kidsrights/comments/4ma32z/strange_question_does_the_arrest_and_imprisonment/,1,What do you mean? I can't answer this without clarification and elaboration. ,2016-06-02 23:41:26
38,ctebr0,False,,0,Senate Democrats Vow to Fight Reopening of For-Profit ‘Child Prison’ Homestead,kidsrights,,https://www.thedailybeast.com/senate-democrats-vow-to-fight-reopening-of-for-profit-child-prison-homestead,6,,2019-08-21 09:19:51
141,n4f1o,False,,0,The Rachel Maddow Show: Gingrich: Let students do janitors’ jobs,kidsrights,,http://www.bing.com/videos/watch/video/gingrich-let-students-do-janitors-jobs/6ksv9j7,4,,2011-12-08 04:47:42
27,vywa1,False,,0,"ADHD—or Is It Trauma? ""preschoolers who had experienced multiple traumatic events were 16 times more likely to have attention problems—and 21 times more likely to be overly emotionally reactive and/or to show symptoms of depression and anxiety""",kidsrights,,http://healthyliving.msn.com/diseases/adhd/diagnosis-adhd%E2%80%94or-is-it-trauma-1,6,,2012-07-03 07:21:05
87,cck8p0,False,,0,"New Staff Report Shows Administration’s Child Separation Policy More Harmful, Traumatic, and Chaotic Than Previously Known",kidsrights,,https://oversight.house.gov/news/press-releases/new-staff-report-shows-administration-s-child-separation-policy-more-harmful,4,,2019-07-13 02:44:54
200,boucze,False,,0,"Suicides Among Black Children Are at Crisis Levels. The Congressional Black Caucus Aims to Do Something About It: Black students are 25 to 50 percent less likely than their white counterparts to receive adequate mental health services, even after being diagnosed with a mental illness,",kidsrights,,https://www.theroot.com/suicides-among-black-children-are-at-crisis-levels-the-1834479583,3,,2019-05-15 06:29:22
53,9jlefe,False,,0,"The EPA Just Put A Top Official On Leave. She Says They’re Trying To “Disappear” A Children’s Health Program: OCHP publishes ...reports...data on such things as illness rates, body contaminants,, & environmental pollutants as they affect children, mothers, & mothers-to-be",kidsrights,,https://www.buzzfeednews.com/article/nidhisubbaraman/ruth-etzel-epa-childrens-health-office,6,,2018-09-28 09:09:02
192,by0ulc,False,,0,115 million men and boys were married as children: UN - UNICEF estimates 650 million women and girls worldwide married at 17 or younger.,kidsrights,,https://abcnews.go.com/US/wireStory/115-million-men-boys-married-children-63564904,3,,2019-06-07 22:37:47
126,1sxfgw,False,,0,"Spanking children slows cognitive development and increases risk of criminal behavior, expert says",kidsrights,,http://www.sciencedaily.com/releases/2013/12/131211103958.htm,4,,2013-12-15 11:26:18
215,bf1as9,False,,0,Judge Halts Deportation of Laura Maradiaga-Alvarado: Judge Halts Deportation of 11-Year-Old Girl Who Was Ordered to Leave Without Her Family,kidsrights,,http://time.com/5572443/laura-maradiaga-deportation-houston/,3,,2019-04-19 16:43:58
426,rp474,False,,0,To Spank or Not to Spank ,kidsrights,,http://www.youtube.com/watch?v=CaQKfaVXyvM,1,,2012-04-02 05:10:32
35,eawqab,False,,0,Children Keep Dying of the Flu in Immigration Custody,kidsrights,,https://www.thecut.com/2019/12/children-keep-dying-of-the-flu-in-immigration-custody.html,5,,2019-12-15 08:49:29
454,2wuce6,False,,0,When we were kids,kidsrights,,http://i.imgur.com/jcDYGj0.jpg,0,,2015-02-23 05:23:36
47,bcr8ys,False,,0,Eleven-year-old ordered deported without her family,kidsrights,,https://www.chron.com/news/houston-texas/houston/article/Eleven-year-old-ordered-deported-without-her-13760566.php,5,,2019-04-13 14:50:16
374,lvksh,False,,0," Beating the devil out of them:
corporal punishment in American families and its effects on children - Murray Arnold Straus, Denise A. Donnelly (book preview)",kidsrights,,http://books.google.com/books/about/Beating_the_devil_out_of_them.html?id=RbpT9Ln5WZMC,2,,2011-10-31 20:28:21
70,ewh89s,False,,0,A man authorities say faked his death to avoid prosecution in a child rape case has been arrested,kidsrights,,https://edition.cnn.com/2020/01/30/us/faked-death-child-rape-case/index.html,3,,2020-01-31 02:29:07
138,orsho,False,,0,Priming a Child for Victimization or Predatory Behavior Through Poor Regard for Developing Personal Boundaries and Vulnerability,kidsrights,,http://undermuchgrace.blogspot.com/2012/01/priming-child-for-victimization-or.html,4,,2012-01-22 20:09:50
181,c4ewmn,False,,0,"TX Gov. Greg Abbott vetoes bill protecting kids from prosecution for prostitution: legislation would have taken victims of child sex abuse to a legal guardian or protective services, not the courts.",kidsrights,,https://www.texastribune.org/2019/06/21/abbott-vetos-child-prostitution-bill/?utm_campaign=trib-social&utm_content=1561133262&utm_medium=social&utm_source=facebook&fbclid=IwAR1MO5CnVTQAWjPtqy_6BAWQmwNUwijduywOm5jrEYjo7x9onqE6HMsl50c,3,,2019-06-24 00:00:53
205,bkq68i,False,,0,Maine Senate rejects ending religious exemptions for vaccinations,kidsrights,,https://www.reuters.com/article/us-usa-measles-maine/maine-senate-rejects-ending-religious-exemptions-for-vaccinations-idUSKCN1S826E,3,,2019-05-04 21:41:35
448,myl1i,False,,0,"Petition asking Congress & President Obama to increase law enforcement funding for prosecuting Internet predators and child pornography traffickers known to the U.S. Justice Department purpose, making rescue of child victims a national priority",kidsrights,,http://protect.org/childrescuepetition,0,,2011-12-03 08:59:39
314,bbjqvb,False,,0,"Kids living near major roads at higher risk of developmental delays, NIH study suggests",kidsrights,,https://www.nih.gov/news-events/news-releases/kids-living-near-major-roads-higher-risk-developmental-delays-nih-study-suggests,2,,2019-04-10 08:54:23
174,ca75fs,False,,0,"Enforcer of Philippines War on Drugs Defends Killing a Toddler: ""Shit Happens"" - Ronald Dela Rosa, known as Bato, is now a senator in the Philippines government, but as police chief led the bloody war on drugs that has come to symbolize Duterte’s reign.",kidsrights,,https://news.vice.com/en_us/article/bj94jd/enforcer-of-philippines-war-on-drugs-defends-killing-a-toddler-shit-happens,3,,2019-07-07 14:03:44
409,21hrlz,False,,0,Research involving children and their rights,kidsrights,"Hi,

I study international development and work for an organisation that cares for children (without parental care) part-time. I have been given the opportunity to write my thesis at work, as long as I share my findings with my employer. In fact they are actively encouraging me to do it because they have so little research on my topic. I find that pretty cool, because I know the channels I need to go through to do one thing I've been wanting to do for a long time: interview the kids in our care, and find out what they think about their rigths situation (particularly with regards to privacy and fundraising). I think this is something my org needs to improve on dramatically so I am very motivated.

My initial instinct is to interview a few of them, rather than write out some forms for them to fill out. I could adapt to their stories and opinions more easily, maybe find out more than I would from a piece of paper filled out by an eight year old.  I think the vast majority of the younger ones are not aware that they have rights, and the older ones only have a vague concept that I want to encourage and reveal.

Does anyone here have experience with ethical research involving children? How do I best go about receiving a child's consent / willing participation in something like this? Do you have any advice on working with children from difficult backgrounds? Also, this would likely be happening in West Africa - I am a white male, but at least I speak French. What kind of problems do you see me encountering?

Thanks for any help and advice",https://www.reddit.com/r/kidsrights/comments/21hrlz/research_involving_children_and_their_rights/,1,,2014-03-27 09:42:07
340,29gksf,False,,0,How to explain a child about homoparental families?,kidsrights,,https://deaquialpans.wordpress.com/2014/06/02/familias-homoparentales-cambio/,2,,2014-06-30 09:16:21
361,p19hi,False,,0,Randye Kaye on Raising a Child with Mental Illness,kidsrights,,http://www.pbs.org/ttc/bth_video/randyekaye.html,2,,2012-01-29 03:03:48
224,av3nk1,False,,0,"Maine lawmaker calls lack of placements for kids ‘shocking’: whether it’s staying at an ER, a hotel, or even at the office, these caseworkers are having to basically on a whim disrupt their own lives to try to take care of these children because there’s no place for them to go",kidsrights,,https://www.timesrecord.com/articles/maine-1/maine-lawmaker-calls-lack-of-placements-for-kids-shocking/,3,,2019-02-26 19:46:51
118,382m1c,False,,0,Duggar case illustrates how poorly we treat child victims,kidsrights,,http://lancasteronline.com/opinion/columnists/duggar-case-illustrates-how-poorly-we-treat-child-victims/article_eec85a22-063e-11e5-aafc-f3e82b55bef1.html,5,,2015-06-01 12:11:57
76,d5d4w5,False,,0,"The first sexual experience for 1 in 16 U.S. women was forced or coerced intercourse in their early teens, encounters that for some may have had lasting health repercussions, a study suggests.",kidsrights,,https://abcnews.go.com/Health/wireStory/us-women-1st-sexual-experience-forced-teens-65642330,6,,2019-09-17 06:37:32
154,egoopd,False,,1,“Nobody Saw Me.” How Sex Trafficking Happens in America.,kidsrights,,https://slate.com/news-and-politics/2019/12/sex-trafficking-in-america-native-women-lack-of-screening.html,3,"> *One Navajo girlâs experience shows how sex trafficking happens in America.*

Decluttered version of this Slate Magazine's article archived on December 17, 2019 can be viewed on https://outline.com/sLKnwk ",2019-12-28 09:07:31
413,1jkclr,False,,0,Bullying Among Siblings — Not as Harmless as We Think,kidsrights,,http://abcnews.go.com/blogs/health/2013/06/17/bullying-among-siblings-not-as-harmless-as-we-think/,1,,2013-08-02 14:21:57
10,agei9e,False,,0,New York State Bans LGBT Conversion Therapy Aimed at Minors,kidsrights,,https://www.thedailybeast.com/new-york-state-bans-lgbt-conversion-therapy-aimed-at-minors,9,,2019-01-15 23:00:34
346,1p9wy1,False,,0,Indian child slavery - in pictures,kidsrights,,http://www.theguardian.com/world/gallery/2013/jul/20/child-slavery-india-assam-trafficking,2,,2013-10-26 20:46:19
