Num,ID,is_Original,Flair,num_comments,Title,Subreddit,Body,URL,Upvotes,Comments,creation_date
599,98zkmj,False,Social Science,1860,"The Militarization of Police Does Not Reduce Crime - new study reveals that SWAT tends to be deployed in majority black communities. Further, militarization doesn't reduce crime or increase officer safety. Lastly, militarization was also found to reduce trust in police.",science,,https://psmag.com/social-justice/militarization-of-police-does-not-reduce-crime,42105,"You do know that the police gets more Militarized because 1. The Bad guys get even more powerful weapons and sometimes even body amor so they need better gear. And 2. The departement of defense sells exactly that equiptment for really cheap to the Departements.

So yeah they could either put more money into eqiuptment that isnt really better than the milirary stuff but way more expensive or for Training their officers, what would you prefer?  ",2018-08-21 03:07:12
734,bacrps,False,Psychology,2597,"Researchers use the so-called “dark triad” to measure the most sinister traits of human personality: narcissism, Machiavellianism, and psychopathy. Now psychologists have created a “light triad” to test for what the team calls Everyday Saints.",science,,http://blogs.discovermagazine.com/crux/2019/04/05/light-triad-traits/#.XKl62bZOnYU,39268,Isn’t a basic tennent of Christianity/Catholicism that humans are by nature evil? Would that preclude Mother Theresa from testing positively on this Light Triad? ,2019-04-07 04:23:47
417,8ex7p6,False,Computer Science,1836,"Most Cubans have no internet access, but get a rich variety of media and information in ""El Paquete"" (the weekly package), a 1 Tb collection of info distributed on USB keys. Selling EP is the largest occupation in Cuba, and challenges notions of how networks operate & what they mean to citizens",science,,https://dl.acm.org/citation.cfm?doid=3173574.3174213,47056,"There is internet in Cuba, but it’s a pain to get access to. Typically, there are WiFi cards that are distributed every day, and Cubans can use to access public hot spots. Typically these hot spots are around hotels or in high density areas.
But it is usually really slow, and often times these USB drives are an easy way to access content. ",2018-04-25 21:20:40
731,c4vh9l,False,Psychology,1768,"Music students do better in school than non-musical peers, suggests a new study, which found that high school students who take music courses score significantly better, and were about one academic year ahead, on math, science and English exams than their non-musical peers (n=112,916 Grades 7–12).",science,,https://news.ubc.ca/2019/06/24/music-students-do-better-in-school-than-non-musical-peers/,39321,So you’re saying learning hot cross buns wasn’t just a waste of my time? ,2019-06-24 20:51:13
868,7wky1y,False,Psychology,843,"As is true in humans, chimpanzees’ general intelligence is correlated to their ability to exert self-control and delay gratification, according to new research, which finding relates back to the famous “marshmallow test,” an experiment originally performed at Stanford University in the 1960s.",science,,http://news.gsu.edu/2018/02/08/chimpanzee-self-control-related-intelligence-georgia-state-study-finds/,36748,"REMINDER that correlated doesn't mean shit and certainly doesn't mean CAUSED BY. There's a million reasons why we could be seeing this link. (not least among which the Marshmallow test sucks to test ability to delay gratification). Besides, there's not even proof that there is such an ability as ""Ability to exert self control"" in a general manner, it could be self control is subject specific or that we have a total budget per period. We just don't know enough about the basics. It could be we're measuring the same thing twice by using an intelligence test that also requires self control on the part of the monkey, etc, etc.  ",2018-02-10 11:28:51
192,gvdfba,False,Social Science,2075,"Faced with a choice between democracy and the interests of their political party, Americans will chose party over democracy.",science,,https://www.cambridge.org/core/journals/american-political-science-review/article/democracy-in-america-partisanship-polarization-and-the-robustness-of-support-for-democracy-in-the-united-states/C7C72745B1AD1FF9E363BBFBA9E18867,57404,"There was a statistic that showed democrats supported Syrian air strikes 38% under Obama, and 37% under Trump.

Republican supported air strikes 22% under obama, 86% under Trump.

Which Americans choose party over democracy?


https://nymag.com/intelligencer/2017/04/gop-voters-love-same-attack-on-syria-they-hated-under-obama.html ",2020-06-02 19:01:52
266,eh9l77,False,Health,2431,"Nearly three quarters of Americans don’t care about the religious affiliation of their hospital or healthcare network, but an equal number say they expect their healthcare preferences to take priority over the facility’s religious doctrine",science,,https://uk.reuters.com/article/us-health-hospitals-religion/patients-dont-care-about-provider-religious-ties-expect-all-needed-care-idUKKBN1YV1KP?rpc=401&,53023,"This isn't surprising to me.  I am a Christian and I don't care what religious affiliation a hospital has.  I care more about the reputation of the medical facility from a technical perspective.  Regardless of where I am treated, I would expect them to honor my wishes.  If something I want is against their religious beliefs as an organization, I would understand and want treatment elsewhere.  Otherwise, it really would not matter to me. ",2019-12-29 18:42:03
519,b4jtau,False,Medicine,755,"Scientists studied a ""super-smeller"" who claimed to smell Parkinson’s disease. In a test, she smelled patients clothes and flagged just one false positive - who turned out to be undiagnosed. The study identified subtle volatile compounds that may make it easier for machines to diagnose Parkinson's.",science,,http://blogs.discovermagazine.com/crux/2019/03/21/parkinsons-disease-super-smeller-joy-milne/#.XJZBTOtKgmI,43951,Saw this on answerswithjoe on youtube... Really cool  ,2019-03-23 14:35:26
457,6te4e4,False,Medicine,1229,"Royal jelly, a substance secreted by bees and fed to larvae, has traditionally been used to heal wounds. Now, scientists have discovered the molecule in royal jelly that is responsible for wound-healing.",science,,http://www.acsh.org/news/2017/08/12/molecule-bees-royal-jelly-promotes-wound-healing-11683,45875,Didn't Bruce Lee eat spoonfuls of the stuff? ,2017-08-13 08:52:45
273,f7f3w2,False,Cancer,1837,"One dose of “Magic Mushroom” drug reduces anxiety and depression in cancer patients, study says",science,,https://www.cnn.com/2020/01/28/health/magic-mushrooms-psilocybin-cancer-patients-study-wellness/index.html,52940,[removed] ,2020-02-21 18:13:00
128,96wvek,False,Health,1644,"A Kaiser Permanente study of more than 80,000 children born over a 4-year period showed that the prenatal Tdap vaccination (tetanus, diphtheria, acellular pertussis) was not associated with increased risk of autism spectrum disorder in children.",science,,https://www.eurekalert.org/pub_releases/2018-08/kp-sft080918.php,63206,Does anyone think this will change the mind of anti vac'ers?  ,2018-08-13 09:25:18
248,aeannd,False,Social Science,2051,An estimated 8.5% of American adults shared at least one fake news article during the 2016 election. Age was a big factor. People over age 65 were seven times more likely to share a fake news article.,science,,http://advances.sciencemag.org/content/5/1/eaau4586,54175,"You mean, like this one?? ",2019-01-09 19:59:14
885,aa9or8,False,Psychology,1434,"A drug used to treat PTSD may actually be harmful, a new study suggests. Prazosin is sometimes used to treat PTSD-related nightmares and insomnia that can increase suicide risk, but the drug may actually make nightmares and insomnia worse and not reduce suicidal thoughts in PTSD patients.",science,,https://www.upi.com/Health_News/2018/12/27/PTSD-drug-may-increase-nightmares-insomnia-suicide-risk/6621545946626/,36436,[removed] ,2018-12-28 11:52:21
427,c91nrk,False,Health,1840,"In California, parents could claim a personal belief exemption to vaccination, and the rate of kindergartners without up-to-date vaccinations was 9.84% in 2013. In 2016, due to measles outbreaks, California passed a bill banning all personal belief exemptions. The rate was halved to 4.87% in 2017.",science,,https://www.cnn.com/2019/07/02/health/california-vaccine-laws-study/index.html,46806,So these figures say ~5% of people in California are idiots. Another ~5% live off the grid. ,2019-07-04 11:48:06
454,698yjp,False,Animal Science,1881,"A new study has found a parasite living inside fish eyeball controls its behaviour. When the parasite is young, it helps its host stay safe from predators. But once the parasite matures, it does everything it can to get that fish eaten by a bird and so continue its life cycle.",science,,https://www.newscientist.com/article/2129880-parasite-living-inside-fish-eyeball-controls-its-behaviour/?utm_campaign=RSS%7CNSNS&utm_source=NSNS&utm_medium=RSS&utm_content=life&campaign_id=RSS%7CNSNS-life,45941,Add this to the growing list of [brain-controlling parasites](http://www.bbc.com/earth/story/20150316-ten-parasites-that-control-minds). Warning: maybe Not Safe For Life. ,2017-05-04 17:28:44
407,9r97yq,False,Medicine,2101,"Cannabis pain relief without the 'high' - In the wake of cannabis legalization, Canadian scientists have pinpointed the effective dose of marijuana plant extract cannabidiol (CBD) for safe pain relief without the typical ""high"" or euphoria produced by the THC.",science,,https://www.eurekalert.org/pub_releases/2018-10/muhc-cpr102418.php,47450,[removed] ,2018-10-25 10:59:10
434,a530xs,False,Social Science,2998,"'Dropout' rate for academic scientists has risen sharply in past 50 years, new study finds. Half of the people pursuing careers as scientists at higher education institutions will drop out of the field after five years, according to a new analysis.",science,,https://news.iu.edu/stories/2018/12/iub/releases/10-academic-scientist-dropout-rate-rises-sharply-over-50-years.html,46627,"Thats similar to the education field in Australia as well. 80% of graduate teachers are likely to leave the industry within the first five years as well. 

I'm very curious to learn and understand what the main causes are and if there are similarities or variables between the two industries for causes of leaving their respective industries. ",2018-12-11 03:23:49
588,ecddvu,False,Health,1072,Depression and suicide linked to air pollution in new global study - cuts in dirty air could prevent millions of cases,science,,https://www.theguardian.com/environment/2019/dec/18/depression-and-suicide-linked-to-air-pollution-in-new-global-study,42333,Seattle would like to have a word with you. we have clean air and hella suicide. ,2019-12-18 14:33:12
341,eu42u7,False,Neuroscience,1427,"Psychedelic drugs (e.g. psilocybin, LSD, DMT) may reduce depression and anxiety by increasing psychological flexibility, which describes the ability to connect with the present moment and manage one’s feelings, according to a new survey of 2,120 individuals.",science,,https://www.psypost.org/2020/01/psychedelic-drugs-may-reduce-depression-and-anxiety-by-increasing-psychological-flexibility-55365#.Xi1I7ngjaoA.reddit,49913,"I’d say this is true to a certain extent.. like micro dosing or with minimal drug usage. Being around substances and people who do them regularly. Regular use of these drugs actually increases severely anxiety, depression etc. and cause people to hide from their emotions, covering them up with the feelings of being high. ",2020-01-26 08:09:42
12,axd4l4,False,Epidemiology,2576,"MMR vaccine does not cause autism, another study confirms",science,,https://www.cnn.com/2019/03/04/health/mmr-vaccine-autism-study/index.html,94091,[removed] ,2019-03-04 22:10:23
573,au7iwh,False,Chemistry,798,"Material kills 99.9% of bacteria in drinking water using sunlight - Researchers developed a new way to remove bacteria from water, by shining UV light onto a 2D sheet of graphitic carbon nitride, purifying 10 litres of water in just one hour, killing virtually all the harmful bacteria present.",science,,https://www.sciencealert.com/a-2d-material-can-purify-10-litres-of-water-in-under-an-hour-using-only-light,42747,Things are looking up for Africa  ,2019-02-24 12:28:25
679,6qgxwz,False,Biology,1437,"New Theory Suggests Life Wasn't a Fluke of Biology, but Physics: an inevitable outcome of thermodynamics. Groups of atoms will naturally restructure themselves so as to burn more and more energy, facilitating the incessant dispersal of energy and the rise of “entropy” or disorder in the universe.",science,,https://www.wired.com/story/controversial-new-theory-suggests-life-wasnt-a-fluke-of-biologyit-was-physics/,40523,"It's not a theory, though...  ",2017-07-30 11:43:24
795,8qrfhj,False,Psychology,2735,"Today’s dads spend more time, provide more care and are more loving toward their kids than ever before, finds national study of 2,194 fathers. There was also a correlation between fathers who exhibit negative aspects of traditional masculinity and fathers who are less involved with their children.",science,,https://news.byu.edu/news/study-today’s-dads-are-engaging-more-their-kids,37867,Is that right? Tribes would often all watch children not just the females or just the biological dads. But I guess that was in out hunter/gatherer stage mo? I'm not too sure. Teach me please ,2018-06-13 10:42:02
199,e4pos6,False,Psychology,2564,"New female flirtation study suggests that direct pick-up lines by women on men were most successful, and innocuous lines least effective. Men rated all forms of pick-up lines from attractive females as effective. For women perceived as less attractive, flippant pick-up lines had most male interest.",science,,https://www.psychologytoday.com/au/blog/social-instincts/201911/what-pick-lines-work-best-men,57213,[removed] ,2019-12-01 23:18:13
641,7smgsu,False,Social Science,1449,"Blockbuster films ignore the real harbinger of the apocalypse: ignorance of science - A new UCLA study that analyzed disaster films between 1956 and 2016, published in the journal Futures, finds that the public would rather blame global disaster on human greed or ego than on simple ignorance.",science,,https://www.theverge.com/tldr/2018/1/23/16924510/apocalypse-blockbuster-movies-tech-greed-villains-science-climate-change,41280,evil is more dramatic and makes for a better story ,2018-01-24 11:29:21
38,e61p2u,False,Medicine,1911,"Breast cancer linked to permanent hair dye and chemical hair straighteners in study of almost 50,000 women",science,,https://www.newsweek.com/breast-cancer-linked-permanent-hair-dye-chemical-hair-straighteners-study-almost-50000-women-1475328,77394,"I thought hair color didn't cause cancer? It seems like this always happens. Like 1 day coffee causes cancer, the next day it doesn't. My mom had cancer. It was an accumulation of grief. She had a horrific childhood but we don't talk about bad things in our family. We just stuff it all down, pretend it never happened & hope it goes away. When they found tumors inside me- my ass went to therapy! I'm not killing myself to keep from tarnishing the family name ",2019-12-04 16:28:41
587,d36cbu,False,Psychology,1081,"7 positive childhood experiences (PCEs) linked to better adult mental health, finds study (n=6,188): Family talks about feelings; Family by me during difficulties; Traditions; Sense of belonging in high school; Supportive friends; Non-parent adults genuine interest; Safe/ protected by adult in home.",science,,https://www.psychologytoday.com/au/blog/the-athletes-way/201909/seven-positive-childhood-experiences-adulthood-benefits,42358,Did they mention a definition of non parent? I'm very curious. ,2019-09-12 11:13:25
101,bif86n,False,Neuroscience,1873,"Insomniacs tend to have a hard time getting past embarrassing mistakes, even when the stressful event occurred decades ago. The finding suggests that insomnia could primarily be caused by a failing neutralization of emotional distress.",science,,https://nin.nl/insomniacs-unable-emotional-distress-mind/,66219,Sorry to be that guy I don’t know if I’m an insomniac but I just never wanted to sleep I always wanted to utilize all my time to entertain my self in many different ways but when I smoke some indica I can’t not go to sleep after a few hours. ,2019-04-28 19:51:35
74,cmosn6,False,Social Science,5307,"Men on Tinder do not appear to be intimidated by highly educated women, suggests new study (n=3,600), which found no evidence that men have an aversion to a highly educated romantic partner. Both men and women on Tinder tended to prefer better educated partners, though women were far more selective.",science,,https://www.psypost.org/2019/08/men-on-tinder-do-not-appear-to-be-intimidated-by-highly-educated-women-according-to-new-research-54187,69312,[removed] ,2019-08-06 10:20:58
55,cqfep6,False,Social Science,2500,"""Climate change contrarians"" are getting 49 per cent more media coverage than scientists who support the consensus view that climate change is man-made, a new study has found.",science,,https://www.tvnz.co.nz/one-news/new-zealand/climate-change-contrarians-receive-49-per-cent-more-media-coverage-than-scientists-us-study-finds,73569,"People who are experts on climate change have better things to do than appear on a morning television programme. But people to people who are not climate change experts, appearing on TV is the best thing to happen to them all week. ",2019-08-14 20:30:06
973,frc7qs,False,Neuroscience,945,"Individuals with low psychological well-being are more likely to experience a positive mood change after use of LSD, psilocybin or MDMA than those with normal well-being, new study shows (n=1,967) . The findings suggest that psychedelics could be a therapeutic option for individuals with low mood.",science,,https://www.psypost.org/2020/03/people-with-low-psychological-well-being-more-likely-to-report-positive-outcomes-after-psychedelic-use-56296,34935,[removed] ,2020-03-29 20:02:16
94,d5hnn0,False,Psychology,1302,"In marriage, conflict is inevitable. Happy couples tend to take a solution-oriented approach to conflict, and rarely chose to argue about issues that are more difficult to resolve. A new study suggests that this strategic decision may be one of the keys to their marital success.",science,,https://news.utk.edu/2019/09/16/new-research-sheds-light-on-how-happy-couples-argue/,67079,[removed] ,2019-09-17 14:19:05
554,et5eym,False,Biology,2099,"Researchers say they've mimicked the voice of a 3,000-year-old Egyptian mummy by recreating much of its vocal tract using medical scanners, 3D printing and an electronic larynx. This is the first reconstruction of an ancient human voice—one belonging to a 3000-year-old Egyptian mummy named Nesyamun.",science,,https://www.nature.com/articles/s41598-019-56316-y,43172,Now make it say the bee movie script ,2020-01-24 04:42:00
486,9mszrp,False,Environment,791,"The 1972 Clean Water Act dramatically cut pollution in U.S. waterways, according to the first comprehensive study of water pollution over the past several decades.",science,,http://news.berkeley.edu/2018/10/08/clean-water-act-dramatically-cut-pollution-in-u-s-waterways/,44993,I learned about this during my Public Health lecture today. Awesome. ,2018-10-09 20:57:23
127,eocds2,False,Social Science,2800,"For many Americans, talking about the news has become synonymous with talking about President Trump, according to new research. The participants tended to express a high level of emotionality when recalling their experiences with the news. Many also reported feeling overwhelmed, anxious or angry.",science,,https://www.psypost.org/2020/01/for-many-americans-talking-about-the-news-has-become-synonymous-with-talking-about-president-trump-55219,63245,"Pretty sure they forgot to put """" around adults in ""... adults in the greater metropolitan areas of Chicago, Miami and Philadelphia from January to October 2017.""  In this day and age there seems to be a widening gap between emotional maturity and the age of adulthood. ",2020-01-13 23:27:07
902,etci94,False,Environment,1064,"The western United States has experienced such intense droughts over the past decade that technical descriptions are becoming inadequate. In many places, conditions are rocketing past “severe,” through “extreme,” all the way to “exceptional drought.”",science,,https://www.news.ucsb.edu/2020/019761/warmer-dryer-browner,36175,[removed] ,2020-01-24 16:16:27
453,6f0lyc,False,Medicine,2605,"Low-dose THC can relieve stress; more does just the opposite - researchers report that low levels of THC, the main psychoactive compound in marijuana, does reduce stress, but slightly higher doses, enough to produce a mild “high”, actually increased anxiety.",science,,https://news.uic.edu/low-dose-thc-can-relieve-stress-more-does-just-the-opposite,45953,"So, what does it mean low dose, and how am I suppose to get that dose? ",2017-06-03 10:50:11
377,h895zs,False,Health,1845,"Face Masks Critical In Preventing Spread Of COVID-19. Using a face mask reduced the number of infections by more than 78,000 in Italy from April 6-May 9 and by over 66,000 in New York City from April 17-May 9.",science,,https://today.tamu.edu/2020/06/12/texas-am-study-face-masks-critical-in-preventing-spread-of-covid-19/,48611,"\> The curve flattening in China can be attributed to extensive testing, quarantine, and contact tracing 

Japan did none of those things and it has a lower infection mortality rate than the ""lauded"" successes of South Korea and New Zealand. ",2020-06-13 15:04:03
652,a5ykty,False,Earth Science,2645,"Organically farmed food has a bigger climate impact than conventionally farmed food, due to the greater areas of land required.",science,,https://www.mynewsdesk.com/uk/chalmers/pressreleases/organic-food-worse-for-the-climate-2813280,41041,"Seriously people? MyNewsDesk? This isn't news, it's a PR firm. Click the logo and look FFS.  ",2018-12-13 22:40:11
479,cfmf36,False,Health,761,"New research found optimal timing of warm baths and showers for cooling down of core body temperature in order to improve sleep quality is about 90 minutes before going to bed, which aids the natural circadian process and increase chances of falling asleep quickly and have better quality sleep.",science,,https://news.utexas.edu/2019/07/19/take-a-warm-bath-1-2-hours-before-bedtime-to-get-better-sleep-researchers-find/,45272,I wonder if it has something to do with the fact that 90 minutes is a typical sleep cycle and showers and baths are very relaxing. ,2019-07-20 14:30:49
572,9fqrit,False,Social Science,2557,Men whose first child is a girl are more likely to support policies that promote gender equity than men whose first child is a boy.,science,,https://www.washingtonpost.com/news/monkey-cage/wp/2018/09/14/yes-stephen-curry-is-right-having-a-daughter-does-change-fathers-political-outlooks-but-only-if-shes-the-firstborn/,42752,[removed] ,2018-09-14 10:10:04
917,dkefhq,False,Psychology,1565,"Being single beats being in bad relationships, and even neutral ones that aren't particularly bad, suggests new study. On 7 different measures, single people did better than people in bad romantic relationships. But they also did better than people in relationships that were not that bad at all.",science,,https://www.psychologytoday.com/au/blog/living-single/201910/being-single-beats-bad-relationships-and-even-neutral-ones,35987,Poorly written article. Not much data that can be used here unfortunately. Probably would have been better to let the study speak for itself instead of providing a subjective and narrow interpretation of the study. Even the selection criteria is odd for a study like this. ,2019-10-20 03:39:46
449,b24k9e,False,Medicine,1196,"Drug which makes human blood 'lethal' to mosquitoes can reduce malaria spread, finds a new cluster-randomised trial, the 'first of its kind' to show ivermectin drug can help control malaria across whole communities without causing harmful side effects (n=2,712, including 590 aged<5).",science,,https://www.independent.co.uk/news/health/malaria-mosquito-drug-human-blood-poison-stop-ivermectin-trial-colorado-lancet-a8821831.html,46045,"Noob here, I know eradicating bees would bring end to the world, does eradicating mosquitoes do the same? Same question for rats. ",2019-03-17 12:11:43
71,c9f8rn,False,Cancer,1322,"Bladder cancer infected and eliminated by a strain of the common cold virus, suggests a new study, which found that all signs of cancer disappeared in one patient, and in 14 others there was evidence cancer cells died. The virus infects cancer cells, triggering an immune response that kills them.",science,,https://www.bbc.com/news/health-48868261,69660,"Ok, maybe the anti vaxxers where just trying to avoid cancer with the dumbest way possible. ",2019-07-05 12:11:23
512,6vzuth,False,Psychology,2106,"Although high school students may think popularity is of the utmost importance, a new study found that it may not lead to long-term happiness. What mattered more, according to the study, is whether the teens had close friendships they maintained over time.",science,,http://abcnews.go.com/Health/high-school-popularity-lead-happiness-study-finds/story?id=49355214,44192,[removed] ,2017-08-25 17:12:38
