Num,ID,is_Original,Flair,num_comments,Title,Subreddit,Body,URL,Upvotes,Comments,creation_date
849,de1ss4,False,Health,1576,"Under the Affordable Care Act (ACA), nearly 2 million diabetics, many of them poor, got health insurance, a new study shows (n=2,400). Increasing coverage rates can enhance health equity, because people with undiagnosed or untreated diabetes disproportionately belong to underserved groups.",science,,https://www.usnews.com/news/health-news/articles/2019-09-27/affordable-care-act-insured-millions-of-uninsured-diabetics,36936,Of course the question of whether they can afford the insulin to treat the disease is a whole other matter ,2019-10-06 10:59:16
651,6u2lr3,False,Health,3193,"People working in low paying, unstable jobs show more signs of chronic stress than people who are unemployed.",science,,https://www.researchgate.net/blog/post/having-a-bad-job-may-be-worse-for-your-health-than-having-no-job-at-all,41062,"What stable, but low paying. ... My wife is a teacher. ",2017-08-16 15:01:45
482,8cw7sk,False,Engineering,1204,"Nearly 70% of energy produced in the US each year is wasted as heat, and comes from things like computers. Engineers at UC, Berkeley, developed a thin-film system that can be applied to sources of waste heat to convert such heat from electronics into energy, as reported in Nature Materials.",science,,http://news.berkeley.edu/2018/04/16/thin-film-converts-heat-from-electronics-into-energy/,45106,How many resources does the film cost? How much energy is used? When’s the break even? ,2018-04-17 12:42:23
617,dalbah,False,Psychology,769,"Expectations shape your relationship, suggests a new study (n=253), which found that people were more grateful, had more respect, and were more satisfied with their relationships if they had low expectations of sacrifice by their partners, supporting the theory that “expectations kill gratitude”.",science,,https://www.psychologytoday.com/au/blog/between-you-and-me/201909/how-expectations-are-shaping-your-relationship,41793,"Tony Robbins says “trade your expectation for appreciation and your whole life changes in that moment”. Love that, so true. ",2019-09-28 20:21:33
386,9h3iai,False,Astronomy,1262,Astronomers have discovered a planet twice the size of Earth orbiting the nearby star 40 Eridani — precisely where Star Trek character Spock’s home planet Vulcan supposedly lies.,science,,https://www.nature.com/articles/d41586-018-06725-2,48277,"> The planet candidate has a mass of 8.47 ± 0.47MEarth, period of 42.38 ± 0.01 d

(*deleted*)

Also, its surface is like an oven, its orbital period is 6 Earth-weeks long so it's way closer to its star system's gravimetric center than Mercury is in our own system.

So, we need something that can withstand (*deleted*) a who-knows-how-blazingly-hot a surface temperature to ever even send a probe to land there, unless it has a very slow rotation that could allow a landing in a shaded side, if one exists with a trinary star system.  

edit: I assumed equal planet size to Earth, but reading up a little more shows that such is unlikely given known material composition densities.  Assuming now double Earth's radius, 2G is something you can walk around in, you'd just get tired quickly but that could be overcome with time. ",2018-09-19 08:59:57
643,basuvr,False,Psychology,1350,"Testosterone increased leading up to skydiving and was related to greater cortisol reactivity and higher heart rate, finds a new study. “Testosterone has gotten a bad reputation, but it isn’t about aggression or being a jerk. Testosterone helps to motivate us to achieve goals and rewards.”",science,,https://www.psypost.org/2019/04/new-study-reveals-how-skydiving-impacts-your-testosterone-and-cortisol-levels-53446,41280,[removed] ,2019-04-08 11:53:47
974,9792s4,False,Neuroscience,837,"New evidence from the University of California Berkeley shows that sleep deprivation spurs a vicious, self-sustaining cycle of loneliness.",science,,https://www.inverse.com/article/48046-sleep-deprivation-leads-to-social-isolation-in-new-study,34928,I think it's odd that for them the intuitive thought was people would seek out social interaction when sleep-deprived.   ,2018-08-14 15:00:42
0,84aiy6,False,Breaking News,3897,Physicist Stephen Hawking dies aged 76,science,"We regret to hear that [Stephen Hawking died tonight at the age of 76]( http://www.bbc.com/news/uk-43396008)

We are creating a megathread for discussion of this topic here. The typical /r/science comment rules will not apply and we will allow mature, open discussion. This post may be updated as we are able.

A few relevant links: 

[Stephen Hawking's AMA on /r/science](https://www.reddit.com/r/science/comments/3nyn5i/science_ama_series_stephen_hawking_ama_answers/)

[BBC's Obituary for Stephen Hawking](http://www.bbc.com/news/science-environment-15555565)

If you would like to make a donation in his memory, the Stephen Hawking Foundation has [the Dignity Campaign](http://www.stephenhawkingfoundation.org/dignity-campaign/) to help buy adapted wheelchair equipment for people suffering from motor neuron diseases.  You could also consider donating to [the ALS Association](http://www.alsa.org/donate/) to support research into finding a cure for ALS and to provide support to ALS patients.",https://www.reddit.com/r/science/comments/84aiy6/physicist_stephen_hawking_dies_aged_76/,199296,"And now, he belongs to the ages. RIP. ",2018-03-14 04:06:14
21,bxmxri,False,Environment,2960,"Industrial methane emissions are 100 times higher than reported, and have been vastly underestimated, finds a new study using a Google Street View car equipped with a high-precision methane sensor. They also were substantially higher than the EPA estimate for all industrial processes in the US.",science,,http://news.cornell.edu/stories/2019/06/industrial-methane-emissions-are-100-times-higher-reported-researchers-say,85484,"I think the first question we should all be asking is how accurate of a measurement is sticking a sensor on top of a car and driving through the neighborhood going to give yoh? 

The conditions on top of a car are going to vary quite a bit and I can only wonder how this affects their readings. In general, The more precise an instrument the more controlled the environment has to be for accurate measure. ",2019-06-06 22:28:33
637,81qpk9,False,Psychology,3139,"Researchers have found that individuals who took even a single dose of psychedelic drugs like LSD, ""magic"" mushrooms and ayahuasca could experience sustained personality changes that lasted several weeks, months or even years",science,,https://www.ncbi.nlm.nih.gov/pubmed/29452127,41348,My brother switched from gansta rap to Phish almost immediately ,2018-03-03 15:18:45
349,5smdeu,False,Engineering,727,"Dragonfly wings naturally kill bacteria. At the molecular scale, they are composed of tiny ""beds of nails"" that use shear forces to physically rip bacteria apart.",science,,http://acsh.org/news/2017/02/06/why-dragonfly-wings-kill-bacteria-10829,49489,"Wasn't there a similar effect in bee venom, except of freefloating  nail balls? ",2017-02-07 16:32:43
495,89cjpb,False,Animal Science,938,"Birds can sense Earth's magnetic field, thanks to a newly identified protein behind their eyes. This would mark the first time a specific molecule responsible for the detection of magnetic fields has been identified in animals.",science,,https://www.sciencenews.org/article/birds-get-their-internal-compass-newly-id-eye-protein?utm_source=reddit&utm_medium=social&utm_campaign=r_science,44758,I read that some sea turtles have this. ,2018-04-03 11:05:45
69,eu9fi6,False,Neuroscience,1522,"Oxytocin, often dubbed the ‘love hormone’, is known to promote social bonding. Researchers have now discovered that administering oxytocin to adult men with autism makes them more open to close emotional bonds with others. The hormone has positive long-term effects as well.",science,,https://nieuws.kuleuven.be/en/content/2020/love-hormone-improves-attachment-issues-in-people-with-autism,70478,[deleted] ,2020-01-26 17:11:18
845,blass9,False,Neuroscience,765,"Early-stage detection of Alzheimer’s in the blood: Using a simple blood test, the disease can be detected approximately eight years before the first clinical symptoms occur, with a sensitivity of 90%. Adding a second diagnostic validation step offers an overall specificity of 97%, finds a new study.",science,,https://news.rub.de/english/press-releases/2019-05-03-protein-research-early-stage-detection-alzheimers-blood,36991,How to crush your soul 8 years beforehand... ,2019-05-06 11:12:28
922,bk6voe,False,Economics,2674,"In 1996, a federal welfare reform prohibited convicted drug felons from ever obtaining food stamps. The ban increased recidivism among drug felons. The increase is driven by financially motivated crimes, suggesting that ex-convicts returned to crime to make up for the lost transfer income.",science,,https://www.aeaweb.org/articles?id=10.1257/pol.20170490,35873,[removed] ,2019-05-03 10:28:03
167,afmxkx,False,Social Science,5661,Americans' unconscious bias on the basis of sexual orientation and race dropped dramatically over the past decade but bias against people based on body weight increased,science,,https://www.wbur.org/commonhealth/2019/01/11/implicit-bias-gay-black-weight,59758,[removed] ,2019-01-13 19:40:19
112,d8kayi,False,Psychology,2424,"Impostor Syndrome, when people feel like frauds even if they are actually capable and well-qualified, is more common than you think, with 20% of college students experiencing it in a new study. Seeking social support from those outside their academic program, like family and friends, reduced it.",science,,https://news.byu.edu/intellect/imposter-syndrome-is-more-common-than-you-think-study-finds-best-way-to-cope-with-it,65101,"How do you know if you’re suffering from imposter syndrome, particularly as most everyone around you is conditioned to be “nice” to you (read: supportive of your “personal experience”)?

And as the saying goes...the more you know, the more you realize how much you don’t know. ",2019-09-24 08:35:01
879,606k0i,False,Medicine,3129,"With a 10-day supply of opioids, 1 in 5 become long-term users",science,,https://arstechnica.com/science/2017/03/with-a-10-day-supply-of-opioids-1-in-5-become-long-term-users/,36477,The prescription needs to match the condition AND the doctor/pharmacy's ability to renew. My wife got a 3-day post surgery with a renewal order which was OK except it was Thursday so they were telling her they expected her to need more but that she'd have to get a new scrip on Saturday night. No docs available until Monday because it was a specialty issue. I am all for not overprescibing but it has to be done within a wholistic treatment system that can deal with shorter scrips ,2017-03-18 21:36:08
676,ebcmnv,False,Psychology,2891,"Eye-tracking study suggests men are more concerned than women with other men’s upper bodies. Men appear to devote more visual attention to the chest region of other men than women do, according to new research in Evolutionary Psychological Science.",science,,https://www.psypost.org/2019/12/eye-tracking-study-suggests-men-are-more-concerned-than-women-with-other-mens-upper-bodies-55074,40621,"Let's be honest, men are predisposed to staring at chests anyways... ",2019-12-16 08:46:29
10,dqysmm,False,Chemistry,1648,"Scientists replaced 40 percent of cement with rice husk cinder, limestone crushing waste, and silica sand, giving concrete a rubber-like quality, six to nine times more crack-resistant than regular concrete. It self-seals, replaces cement with plentiful waste products, and should be cheaper to use.",science,,https://newatlas.com/materials/rubbery-crack-resistant-cement/,97233,"Just going to go out on a limb, haven't read the article, but going to guess it's not as strong as concrete in one way or another.  Or there's some other major problem.  Believe me.  If foundation / construction companies could use some miracle concrete half made out of cheap trash, they would.

Also you generally don't want things that support other things to have a 'rubber-like quality'. ",2019-11-03 10:46:58
340,f2pv6y,False,Social Science,2054,"The use of jargon kills people’s interest in science, politics. People exposed to jargon when reading about subjects like surgical robots later said they were less interested in science and were less likely to think they were good at science.",science,,https://news.osu.edu/the-use-of-jargon-kills-peoples-interest-in-science-politics/,49969,"Yeah, it really sucks how people don’t want to learn words. I guess we should just revert to grunting and pointing at things. ",2020-02-12 11:31:12
238,8yflh0,False,Cancer,1442,Cancer cells engineered with CRISPR slay their own kin. Researchers engineered tumor cells in mice to secrete a protein that triggers a death switch in resident tumor cells they encounter.,science,,https://www.sciencenews.org/article/cancer-cells-engineered-crispr-slay-their-own-kin,54687,"This makes me so incredibly happy. I read the article hoping to see what type of cancer they were trying to target and they mentioned a glioblastoma! I watched my mother die from this type of tumor and the fact they are making headway on a cure brings me tears of joy. I hope that someone very soon gets this treatment. A cure before now hasn't been possible since the glioblastoma grows into normal brain tissue so chemo, radiation and targeted drug treatment can only sometimes reduce the size. She ended up finally trying surgery and the aftermath of that was devastating for her and my sister and I. She was not even the same person anymore. I apologize if those facts are not entirely correct with the new medicine this was something I remember hearing from the doctor when I was 12. ",2018-07-13 01:13:07
316,7s114q,False,Animal Science,1481,"The average rooster crow is about 130 dB, about the same volume as standing 15m from a jet taking off. To prevent deafness from their own calls, roosters have evolved soft tissue that covers half of the eardrum while crowing.",science,,http://www.sciencemag.org/news/2018/01/how-roosters-protect-themselves-their-own-deafening-crows?utm_campaign=news_weekly_2018-01-19&et_rid=306406872&et_cid=1800664,50987,"I’m no scientist, but from my time in the field and on airplanes, I’m pretty sure all human babies have this ability as well.  ",2018-01-21 22:19:33
718,6t81ig,False,Chemistry,1104,"Handheld spectral analyzer turns smartphone into diagnostic tool - Costing only $550, the spectral transmission-reflectance-intensity (TRI)-Analyzer attaches to a smartphone and analyzes patient blood, urine, or saliva samples as reliably as clinic-based instruments that cost thousands of dollars.",science,,http://bioengineering.illinois.edu/news/article/23435,39587,"Somebody is going to get rich, and somebody is going to lose a lot of money. ",2017-08-12 11:54:56
634,9w3e5u,False,Psychology,952,New research suggests that even non-verbal displays of synchrony (when movements between people become coordinated and synchronized) during ordinary activities in everyday lives can deepen the experience of closeness and sexual desire between partners.,science,,https://www.psypost.org/2018/11/behavioral-synchrony-between-partners-linked-to-heightened-intimacy-and-sexual-desire-52553,41410,[deleted] ,2018-11-11 12:24:19
344,bi440p,False,Psychology,1979,"Being mistreated by a customer can negatively impact your sleep quality and morning recovery state, according to new research on call centre workers.",science,,https://www.psypost.org/2019/04/customer-mistreatment-can-harm-your-sleep-quality-according-to-new-psychology-research-53565,49794,[removed] ,2019-04-27 21:56:12
794,dxq1sb,False,Psychology,1028,Research has found that toddlers with fewer spoken words have more frequent and severe temper tantrums than their peers with typical language skills. About 40% of delayed talkers will go on to have persistent language problems that can affect their academic performance,science,,https://news.northwestern.edu/stories/2019/11/toddler-speech-delays-and-temper-tantrums,37888,Explains why I’m like that ,2019-11-17 18:10:28
152,g0pny0,False,Medicine,1950,Loss of Smell and Taste Validated as COVID-19 Symptoms in Patients with High Recovery Rate,science,,https://ucsdnews.ucsd.edu/pressrelease/loss-of-smell-and-taste-validated-as-covid-19-symptoms-in-patients-with-high-recovery-rate,60985,"“Our study not only showed that the high incidence of smell and taste is specific to COVID-19 infection, but we fortunately also found that for the majority of people sensory recovery was generally rapid,” said Yan ",2020-04-13 19:19:15
381,b0qbe7,False,Physics,1975,"Physicists ""turn back time"" by returning the state of a quantum computer a fraction of a second into the past, possibly proving the second law of thermodynamics can be violated. The law is related to the idea of the arrow of time that posits the one-way direction of time: from the past to the future",science,,https://www.eurekalert.org/pub_releases/2019-03/miop-prt031119.php,48478,"Could this possibly be, instead of science, the work of an enemy [STAND]????  ",2019-03-13 19:40:57
848,48njxg,False,Astronomy,1700,"Repeating radio signals coming from a mystery source far beyond the Milky Way have been discovered by scientists. While one-off fast radio bursts (FRBs) have been detected in the past, this is the first time multiple signals have been detected coming from the same place in space.",science,,http://www.ibtimes.co.uk/frbs-mystery-repeating-radio-signals-discovered-emanating-unknown-cosmic-source-1547133,36948,[removed] ,2016-03-02 18:47:12
909,bkk1t3,False,Psychology,1301,"Mental arousal may be more important for women with low sexual desire, suggests a new study.",science,,https://www.psypost.org/2019/05/study-indicates-mental-arousal-may-be-more-important-for-women-with-low-sexual-desire-53603,36087,[removed] ,2019-05-04 11:06:55
148,99f4ia,False,Anthropology,2431,"Bones of ancient teenage girl reveal a Neanderthal mother and Denisovan father, providing genetic proof ancient hominins mated across species.",science,,https://www.inverse.com/article/48304-ancient-human-mating-neanderthal-denisovan,61267,"No wait a damn minute. What?
Can someone give me a bible timeline? 
Being raised on the bible - not bringing religion in this, but I'm confused...  ",2018-08-22 17:07:01
391,fxtzlt,False,Anthropology,1638,"Scientists discovered a 41,000 to 52,000 years old cord made from 3 twisted bundles that was used by Neanderthals. It’s the oldest evidence of fiber technology, and implies that Neanderthals enjoyed a complex material culture and had a basic understanding of math.",science,,https://www.inverse.com/science/neanderthals-did-math-study,48089,When are we gonna admit they were just as advanced as us? ,2020-04-09 15:04:27
839,7cjsr4,False,Psychology,1887,Moderate alcohol consumption improves foreign language skills,science,,https://digest.bps.org.uk/2017/11/10/moderate-alcohol-consumption-improves-foreign-language-skills/,37128,I'm going to throw out a different hypothesis. Speaking a different language requires your face muscles and tongue to be used in a certain way. Alcohol relaxes those muscles that are hardwired to speak the language you can speak allowing for more freedom to use those muscles in a way that works better for another language. ,2017-11-13 01:38:00
237,8z1lg0,False,Cancer,600,"HPV vaccine eliminates skin cancer in 97-year-old, doctors report in a new paper in JAMA Dermatology. The woman had developed a severe case of squamous cell carcinoma, and chemotherapy and surgery were ruled out as treatments. Each tumor was injected with Gardasil, and all of them disappeared.",science,,https://www.upi.com/Health_News/2018/07/13/HPV-vaccine-eliminates-skin-cancer-in-97-year-old-doctors-report/5551531492416/,54727,Was there any reason to think HPV would effect the cancer before trying this? Or do doctors just start trying random shit once they run out of ideas? ,2018-07-15 13:08:20
132,86vtnj,False,Health,2854,States that restricted gun ownership for domestic abusers saw a 9% reduction in intimate partner homicides. Extending this ban to include anyone convicted of a violent misdemeanor reduced it by 23%.,science,,https://msutoday.msu.edu/news/2017/broader-gun-restrictions-lead-to-fewer-intimate-partner-homicides/,62929,[removed] ,2018-03-24 20:40:53
387,6yna3m,False,Psychology,4251,Study: Atheists behave more fairly toward Christians than Christians behave toward atheists,science,,http://www.psypost.org/2017/09/study-atheists-behave-fairly-toward-christians-christians-behave-toward-atheists-49607,48271,[removed] ,2017-09-07 13:43:13
957,7mlw45,False,Health,970,"Offering young people testing kits for sexually transmitted infections (STIs) over the internet almost doubles testing uptake compared with inviting them to a clinic, finds randomised, single-blind, controlled trial.",science,,https://www.theguardian.com/society/2017/dec/27/online-sti-kits-double-testing-uptake-in-young-people-study-suggests,35201,Outstanding and satisfying result. This is good:) ,2017-12-28 10:37:05
930,c27lwi,False,Social Science,2048,"The legal cannabis market in Washington has put a significant dent in the illegal market, as many established users switched from the illegal to the legal market, finds a new study that analyzed three years of sewage samples and cannabis sales.",science,,https://www.inverse.com/article/56835-washington-sewers-show-legalization-is-working,35767,The young entrepreneurs by the Jack In The Box in the U just kinda *vanished*. ,2019-06-18 20:44:31
442,5yguh3,False,Health,1700,"More than 60% of people surveyed in a new study supported marijuana legalization because they agreed with arguments saying it would increase tax revenues, create a profitable new industry, reduce prison crowding and lower the cost of law enforcement, finds Cornell University researchers.",science,,http://mediarelations.cornell.edu/2017/03/08/pro-pot-arguments-fly-higher-with-likely-voters/,46364,[removed] ,2017-03-09 18:40:25
642,cifuxi,False,Health,2138,"When temperatures in Southwestern U.S. climb to over 100 degrees, the pavement can get hot enough to cause second-degree burns on human skin within 2 seconds, finds a new study. The pavement on a 111-degree day, for example, can get as hot as 147 degrees in direct sunlight.",science,,https://www.unlv.edu/news/release/study-sizzling-southwest-summers-can-cause-pavement-burns-seconds,41282,And it took some kind of study for this?  Crap.   Maybe the next study will be if you go naked in Maine in the winter you get frost bite (if you live long enough. ) ,2019-07-27 10:14:51
220,7u0f9q,False,Health,1754,"A study found that from 2014 to 2016, there was a reduction in infant deaths in states under the Affordable Care Act (ACA), while average infant mortality rates rose in states that had not expanded Medicaid coverage.",science,,https://saludmovil.com/fewer-infants-died-in-states-that-allowed-affordable-care-act/,55787,[removed] ,2018-01-30 11:37:22
323,d17qm9,False,Health,4298,"Doctors have identified previously unrecognized characteristic of the vaping-related respiratory illness that has been emerging in clusters across the U.S. in recent months. Within the lungs of these patients are large immune cells containing numerous oily droplets, called lipid-laden macrophages.",science,,https://healthcare.utah.edu/publicaffairs/news/2019/09/vaping-cells.php,50776,"They are trying so so f'ing hard to not say ""Lipid Pneumonia"", which is what they got from vaping the ""Oil"" laden items. 

This is what I said they had when the number was 8 patients... ",2019-09-08 06:59:09
353,7oar8k,False,Biology,4153,"Promising anti-obesity drug that shrinks fat without suppressing appetite - Researchers discover a drug that has been shown to selectively shrink excess fat by increasing fat cell metabolism, to significantly reduce body weight and blood cholesterol levels without lowering food intake in obese mice.",science,,https://www.utmb.edu/newsroom/article11716.aspx,49255,[removed] ,2018-01-05 11:55:39
571,d7abvz,False,Health,1702,"Human hearts have evolved for endurance, and we need it to stay healthy, suggests a new study comparing the hearts of humans, chimpanzees and gorillas, which found that the human heart can change shape to reflect more of a chimplike structure when people don’t do endurance exercise.",science,,http://blogs.discovermagazine.com/d-brief/2019/09/19/human-hearts-evolved-for-endurance-and-they-need-it-to-stay-healthy-isns/,42762,"I remember watching a video in an anthropology class where a group of african bushmen shot a giraffe with a poisined arrow.  The poisin wasnt strong enough to kill the giraffe outright.  So they simply chased it for hours.  The giraffe eventually collapsed from exhaustion and the poisin.  Then one of the three men ran back to the village to get others to help haul the meat, while the other two butchered their kill.  I dont remember how far it was exactlt but these hunters literally ran for hours.  Probably a pretty good example for how we developed more endurance than other animals.  A cheetah or lion will quickly give up a chase, we dont give up so easy. ",2019-09-21 13:13:40
