Num,ID,is_Original,Flair,num_comments,Title,Subreddit,Body,URL,Upvotes,Comments,creation_date
190,diojxj,False,Social Science,2516,"Both Democrat and Republican voters strongly support sex education in schools even though they disagree on other policies, suggests a new study (n=965), which found a strong majority of them support sex education and the continued funding by the government for teenage pregnancy prevention programs.",science,,https://news.rutgers.edu/both-democrat-and-republican-likely-voters-strongly-support-sex-education-schools/20191014,57539,"Doesn't matter, Republican politicians will still pander to the extremists because of our primary system (not being socially conservative can kill them in the primaries because the average moderate Republican that supports this stuff doesn't vote in the primaries). ",2019-10-16 12:23:20
171,ac4x3c,False,Environment,1721,"Texas might have the perfect environment to quit coal for good. Texas is one of the only places where the natural patterns of wind and sun could produce power around the clock, according to new research from Rice University.",science,,https://www.houstonchronicle.com/business/energy/article/Texas-has-enough-sun-and-wind-to-quit-coal-Rice-13501700.php,58879,Would it be inefficient to cover the turbine blades with solar panels? ,2019-01-03 11:36:37
275,bcpuxn,False,Health,3190,"Medicaid could save $2.6 billion within a year if just 1% of its recipients quit smoking, according to new research by UCSF.",science,,https://www.ucsf.edu/news/2019/04/413921/medicaid-could-save-26-billion-within-year-if-just-1-percent-recipients-quit,52773,"We could also stop spending $700 billion a year on ""defense"". Everyone could have free healthcare. But hey, that's crazy. ",2019-04-13 12:10:33
913,fsa6ug,False,Environment,496,"Ancient air pollution, trapped in ice, reveals new details about life and death in 12th Century Britain. In a study, scientists have found traces of lead, transported on the winds from British mines that operated in the late 1100s.",science,,https://www.bbc.com/news/science-environment-52095694,36024,Why is the picture shown the murder of the archbishop of Canterbury? ,2020-03-31 09:55:12
915,9zo830,False,Neuroscience,576,DNA vaccine reduces both toxic proteins linked to Alzheimer’s: A vaccine delivered to the skin prompts an immune response that reduces buildup of harmful tau and beta-amyloid in mice modeled to have Alzheimer’s disease. Scientists say the vaccine is getting close to human trials.,science,,https://www.utsouthwestern.edu/newsroom/articles/year-2018/dna-vaccine-alzheimers.html,36018,"Yeah great, but it increases toxic proteins linked to autism soooo</s> ",2018-11-23 13:21:45
396,bz5q5f,False,Health,5078,"Having an abortion is not harmful to a woman's health, finds a study (n=874) of women at 30 U.S. abortion facilities from 2008-2010: ""Our study indicates that having an abortion is not detrimental to women’s physical health, but being denied access to a wanted abortion likely is.""",science,,https://www.inverse.com/article/56612-abortion-deny-chronic-pain-study,48011,I’m curious as to the affect of multiple abortions on a woman’s health though. I’d imagine there has to be some sort of detriment. ,2019-06-11 00:39:40
806,6oufus,False,Health,2307,"The next time you tuck into a protein rich dinner, it may be a good idea to hold off on the sugary drinks. A new study published in BMC Nutrition found that a combination of sugar sweetened drinks and a protein rich meal decreases metabolic efficiency, which can lead to more fat being stored.",science,,https://blogs.biomedcentral.com/bmcseriesblog/2017/07/21/sugar-sweetened-drinks-and-your-metabolism/,37677,[removed] ,2017-07-22 11:04:29
87,fyezu0,False,Social Science,2475,Government policies push schools to prioritize creating better test-takers over better people,science,,http://www.buffalo.edu/news/releases/2020/04/011.html,67978,[removed] ,2020-04-10 12:26:36
916,cp2goq,False,Psychology,969,"Pathological gaming may be a symptom of bigger problems, rather than a unique mental disease, suggests new Korean study. Those who felt they had overprotective parents and less parent communication had higher academic stress, which predicted lack of self-control and an increase daily gaming hours.",science,,https://www.psypost.org/2019/08/study-suggests-pathological-gaming-is-a-symptom-of-bigger-problems-rather-than-a-unique-mental-disease-54231,36006,"goodness, it's almost like gaming is some sort of *vice*, like smoking or railing coke. Glad we have a study to tell us this. ",2019-08-11 21:12:48
56,hrv7pu,False,Epidemiology,1850,"A new study makes it clear: after universal masking was implemented at Mass General Brigham, the rate of COVID-19 infection among health care workers dropped significantly. ""For those who have been waiting for data before adopting the practice, this paper makes it clear: Masks work.""",science,,https://www.brighamandwomens.org/about-bwh/newsroom/press-releases-detail?id=3608,73542,You severely underestimate willful ignorance. ,2020-07-15 20:19:15
88,6pgpym,False,Epidemiology,3595,110 of 111 (99%) of NFL Players in Autopsy Study Had Chronic Traumatic Encephalopathy,science,,https://www.methodsman.com/blog/football-cte,67827,ALL of the brains submitted to this study were from people suspected of having CTE in the first place. Important to note ,2017-07-25 15:07:11
505,7i2os1,False,Cancer,1915,Birth control may increase chance of breast cancer by as much as 38%. The risk exists not only for older generations of hormonal contraceptives but also for the products that many women use today. Study used an average of 10 years of data from more than 1.8 million Danish women.,science,,http://www.newsweek.com/breast-cancer-birth-control-may-increase-risk-38-percent-736039,44449,Think this is known for the contraceptive patch. Increases risk of breast cancer but reduces risks of other ones. They won’t give it to you if you have history of breast cancer. Not sure if the % match up ,2017-12-07 00:54:32
80,ed8kr2,False,Neuroscience,1748,Some parents have noticed that their autistic children’s behavioral symptoms diminished after a fever. A new study from MIT and Harvard in mice found that an immune molecule sometimes produced during infection suppresses a small region of the brain’s cortex linked to social behavioral deficits.,science,,http://news.mit.edu/2019/explain-infections-fever-reduce-autism-1218,68635,"The internet has ruined me, I thought this was going to be about anti vax moms ",2019-12-20 10:45:44
516,e0fxao,False,Biology,653,"Crows have self-control and the ability to delay gratification as well as kids, suggests new study that compared New Caledonian crows to 3- to 5-year old children. Both succeeded in waiting for a delayed reward when it was better than an immediate reward, with a preference for quality over quantity.",science,,https://www.psychologytoday.com/au/blog/animal-minds/201911/delay-gratification-in-kids-and-crows,43991,Crows give actual gifts to humans that feed them! Like little shiny bits or colorful plastics. ,2019-11-23 09:56:01
408,7rg62r,False,Cancer,731,"Scientists edge closer to creating a blood test that can detect multiple types of cancers, seeing success rates of around 70% in cancerous individuals",science,,https://www.npr.org/sections/health-shots/2018/01/18/578620342/scientists-edge-closer-to-a-blood-test-to-detect-cancers,47425,"I think the big one is that this can test for Pancreatic tumours. Pancreatic Cancer is one of the worst kinds. By the time symptoms appear, it’s practically too late to survive it.  ",2018-01-19 05:27:34
201,6grvts,False,Social Science,1811,The introduction of medical marijuana laws lead to a decrease in violent crime in states that border Mexico. This is consistent with the theory that marijuana decriminalization reduces violent crime in markets traditionally controlled by Mexican drug trafficking organisations.,science,,http://onlinelibrary.wiley.com/doi/10.1111/ecoj.12521/full,57111,[removed] ,2017-06-12 12:23:59
297,9y7e9l,False,Social Science,1506,"Students who receive sexuality education, including refusal skills training, before college matriculation are at lower risk of experiencing sexual assault during college.",science,,https://www.mailman.columbia.edu/public-health-now/news/sexuality-education-received-college-can-prevent-student-experiences-sexual-assault-college,51949,[removed] ,2018-11-18 16:40:56
217,6xs76y,False,Cancer,1717,"Duke University scientists have created a ""lethal injection"" for tumors. When injected into them, their ethanol-based gel cured 100% of the oral tumors in a small sample of hamsters. This treatment might work for some kinds of breast, liver, and other cancers, and it only costs about $5.",science,,https://www.acsh.org/news/2017/09/02/ethanol-lethal-injection-tumors-11779,55999,"Sure it costs $5, but the drug companies will sell it in five installments of $1,000 each. ",2017-09-03 09:11:35
830,e74tay,False,Health,2056,"BPA levels in humans higher than previously thought, study suggests. A new method suggests that measurements used by the FDA underestimate BPA exposure by as much as 44 times. BPA is used in plastic products, food and drink containers, and animal studies have shown that it interferes with hormones.",science,,https://www.upi.com/Health_News/2019/12/06/BPA-levels-in-humans-higher-than-previously-thought-study-suggests/6751575662179/,37279,I used to chew plastic straws when younger can I get compensation ,2019-12-06 21:25:20
602,5kfw6w,False,Animal Science,1939,"Cheetahs heading towards extinction as population crashes - The sleek, speedy cheetah is rapidly heading towards extinction according to a new study into declining numbers. The report estimates that there are just 7,100 of the world's fastest mammals now left in the wild.",science,,http://www.bbc.com/news/science-environment-38415906,42091,[removed] ,2016-12-26 21:30:00
609,c64wc7,False,Health,1277,"HPV vaccine has significantly cut rates of cancer-causing infections, including precancerous lesions and genital warts in girls and women, with boys and men benefiting even when they are not vaccinated, finds new research across 14 high-income countries, including 60 million people, over 8 years.",science,,https://www.newscientist.com/article/2207722-hpv-vaccine-has-significantly-cut-rates-of-cancer-causing-infections/,41986,I got the 3 shots (24f) very worth it just to be safe. ,2019-06-27 12:26:20
368,ch79wa,False,Nanoscience,1434,"Scientists designed a new device that channels heat into light, using arrays of carbon nanotubes to channel mid-infrared radiation (aka heat), which when added to standard solar cells could boost their efficiency from the current peak of about 22%, to a theoretical 80% efficiency.",science,,https://news.rice.edu/2019/07/12/rice-device-channels-heat-into-light/?T=AU,48888,Can someone tell me why we will never get close to 80%?   Even a jump to 30% would be a game changer and incredibly disruptive to the entire energy industry.  80% would solve global warming over night.  Why is this wrong?    Or if its right what is the prohibitive factor?  Does this increase the cost of the panel 10x? ,2019-07-24 12:01:25
107,hrm82i,False,Health,2123,"Among 139 clients exposed to two symptomatic hair stylists with confirmed COVID-19 while both the stylists and the clients wore face masks, no symptomatic secondary cases were reported",science,,https://www.cdc.gov/mmwr/volumes/69/wr/mm6928e2.htm,65452,"I think this study is better at proving that masks are effective for use by people who are symptomatic, rather than being argument for mask use by healthy people on the off chance they may be sick. 

Furthermore, it’s unknown how long a person has to be exposed in order to actually get sick to begin with. I’ve seen estimates of 10, 15 or even more minutes of direct, no mask contact being used as the yardstick.

My argument is that in this case, with the hair stylists wearing masks, and the haircuts being mostly under thirty minutes, along with the fact the salon was likely employing hand sanitizer, the patrons could have used no masks and likely seen similar results.

I know there will be opposition to my statement, but there are plenty of studies shooting down masks as an effective measure for stopping the spread of something like Covid. 

I understand covid is serious, but I think we are focusing too much on masks instead of focusing on better ways to manage the situation. Like, it’s an easy way for politicians to get you to focus your frustrations and blame on fellow citizens.

From the New England Journal of Medicine

https://www.nejm.org/doi/full/10.1056/NEJMp2006372

“We know that wearing a mask outside health care facilities offers little, if any, protection from infection. Public health authorities define a significant exposure to Covid-19 as face-to-face contact within 6 feet with a patient with symptomatic Covid-19 that is sustained for at least a few minutes (and some say more than 10 minutes or even 30 minutes). The chance of catching Covid-19 from a passing interaction in a public space is therefore minimal. In many cases, the desire for widespread masking is a reflexive reaction to anxiety over the pandemic.” ",2020-07-15 11:57:19
288,9hu6e7,False,Psychology,1482,"Scientists proposed a “Minimal Turing Test” where you get to use only one word to convince others you are human, and not a machine. The single word that people found most likely to distinguish a human from a machine based on a new study (total n = 3,000) was the word “poop”.",science,,http://www.sciencemag.org/news/2018/09/want-convince-someone-you-re-human-one-word-could-do-trick,52356,[removed] ,2018-09-21 21:23:22
691,8s7zny,False,Health,2538,The first pilot study to examine the 16:8 diet (8 hours of free eating between 10 am to 6 pm and 16 hours of fasting in-between) suggests that daily fasting is an effective tool to reduce weight and lower blood pressure in obese individuals.,science,,https://today.uic.edu/daily-fasting-works-for-weight-loss,40284,"Crap! Do I give up coffee at the beginning or wine at the end? Decisions, decisions... ",2018-06-19 11:07:40
780,870658,False,Psychology,829,"Researchers reviewed claims that meditation reduced violence, quoting the Dalai Lama: “If every eight-year-old in the world is taught meditation, the world will be without violence within one generation”. Study found it caused a modest increase in compassion and empathy, but noted potential biases.",science,,https://blogs.scientificamerican.com/cross-check/can-meditation-make-us-nicer/,38201,"So in short, we don't know but there is no evidence that lets us say yes? ",2018-03-25 11:35:22
838,98sggs,False,Environment,2416,"Summer weather is getting 'stuck' due to Arctic warming. Rising arctic temperatures mean we face a future of ‘extreme extremes’ where sunny days become heatwaves and rain becomes floods, study says",science,,https://www.theguardian.com/environment/2018/aug/20/summer-weather-is-getting-stuck-due-to-arctic-warming,37133,"As someone who lived through Harvey a year ago, I have no idea what you people are talking about. No climate change, you’re climate change! ",2018-08-20 10:30:29
301,7wtzme,False,Medicine,1458,"After six months of treatment with medical cannabis, over 14 percent of elderly patients stopped using opioids altogether, while another 3.7 percent were able to reduce their dosage of opiates.",science,,https://botanika.life/elderly-medical-cannabis-stop-reduce-opioid-use/,51755,[removed] ,2018-02-11 17:12:20
854,b49teq,False,Medicine,1128,"Car crash ER visits fell in states that ban texting while driving, study says",science,,https://cnn.it/2HyA2Sp,36890,100% chance a bunch of replies to this thread were done while driving. ,2019-03-22 20:10:45
290,9sbkwo,False,Psychology,2955,"Religious fundamentalists and dogmatic individuals are more likely to believe fake news, finds a new study, which suggests the inability to detect false information is related to a failure to be actively open-minded.",science,,https://www.psypost.org/2018/10/study-religious-fundamentalists-and-dogmatic-individuals-are-more-likely-to-believe-fake-news-52426,52221,So is that saying it's like their willingness to accept the existence of an all powerful being without scientific proof extends into basically all of their life?  ,2018-10-29 09:31:49
613,ddmckf,False,Health,1349,"Expanding Medicaid to more low-income adults helped many of them feel healthier, and do a better job at work or a job search, in just 1 year after new health coverage. Those with mental health disorders such as depression or addiction got an especially big boost in health and work-related measures.",science,,https://labblog.uofmhealth.org/industry-dx/benefits-for-mind-body-and-work-ability-seen-medicaid-expansion,41902,"Once again this country needs to have a scientific study conducted to explain the obvious. And once again, most people in this country wont fuckin care ",2019-10-05 12:01:44
257,cnctmt,False,Biology,1376,"Staring down seagulls can stop them stealing your chips, suggests a new study. Seagulls are sensitive to human gaze and change behaviour when being watched, suggesting that they have theory of mind, the capacity to infer the mental states of others, or associate being watched with being chased away.",science,,https://www.newscientist.com/article/2212592-staring-down-seagulls-can-stop-them-stealing-your-chips/,53553,Bullcrap. They know when a predator bigger than they are is watching them. ,2019-08-07 22:39:06
3,7e1jo1,False,Subreddit Discussion,11056,Raising the taxes of graduate students by as much as 300% will be a disaster for the USA,science,"Science and technology development has been the story of the past 100 years.  The discoveries and innovations are progressing at a dazzling rate, much of this lead by researchers at universities in the USA.  At these universities, a substantial amount of the work is done by graduate students, who work long hours (80 hours weeks aren't unusual) for little pay.  These graduate students go on to work in good paying jobs, where their innovations make more jobs for others.  


Start-ups develop to bring new innovations based on the skills graduate students learn (Google was the project of a couple of Stanford grad students, even Reddit benefited from the skills of a physics grad student/PhD, /u/keysersosa, the current CTO.)  Grad school has been for decades a path to prosperity for  those who come from humble beginnings but are willing to work hard, and make sacrifices, a system that has greatly benefited all of us.


This is why we scientists are shocked and appalled by the recently passed tax bill in congress which will result in the tax bills of already poor grad students [going up by as much as 300%](http://fortune.com/2017/11/08/graduate-students-say-gop-tax-plan-could-increase-their-taxes-by-nearly-300/), which would see their take-home pay drop by 25%. As a former grad student myself, I can tell you that I would not have been able to continue if my pay had be reduced by $7,000, and many students would make the same conclusion.  Instead, some will not go into science or they will leave the USA to be a grad student in Europe or Asia, most of these students will never return to the USA. 


This is why every major science organization has [voiced opposition to the current tax plan](https://www.aaas.org/sites/default/files/AAAS%20Multisociety%20Letter%20on%20Tax%20Reform.pdf?D1fnCM0H.C.qegz_Yo2wJwPV7IWBzuGy), make no mistake, this plan will [undermine research and eventually the economy of the USA](https://www.nature.com/articles/d41586-017-05925-6).

In comic form from [PhD Comics](http://phdcomics.com/comics/archive.php?comicid=1985).


What can we do to stop it?  Call your representatives in congress and let them know.  It hasn't passed yet, but it's about to.  If we don't raise voices now, we will all regret it.

Edit: There is an official White House petition you can sign to express your opposition: https://petitions.whitehouse.gov/petition/opposition-taxation-graduate-student-tuition-waivers-and-remissions

Aslo: https://medium.com/@avandervort/an-open-letter-to-the-senate-concerning-h-r-1-and-the-graduate-student-tax-provision-5ff7ace9262d

 ",https://www.reddit.com/r/science/comments/7e1jo1/raising_the_taxes_of_graduate_students_by_as_much/,124372,Maybe it's time for universities to pay a living wage?  That should include the money needed to cover taxes. ,2017-11-19 16:24:07
923,7koc0m,False,Environment,823,"A new NASA sea level simulator lets you bury Alaska's Columbia glacier in snow, and, year by year, watch how it responds. Or you can melt the Greenland and Antarctic ice sheets and trace rising seas as they inundate the Florida coast.",science,,https://www.jpl.nasa.gov/m/news/news.php?release=2017-308#.Wi_eQDfTU2x,35879,"Hey, place your bets on climate change related real-estate investments now. It may not be waterfront property today, but in 2030 it will be. ",2017-12-18 21:28:00
226,ekmj1w,False,Psychology,2685,"Women dress modestly to defend themselves against aggression from other women, suggests new study (n=726), which provides evidence that women strategically dampen signals of sexual permissiveness and desirability to avoid provoking intrasexual aggression.",science,,https://www.psypost.org/2020/01/study-suggests-women-dress-modestly-to-defend-themselves-against-aggression-from-other-women-55157,55578,[removed] ,2020-01-06 01:25:33
100,bgtfsb,False,Psychology,2331,"People diagnosed with depression are more inclined than healthy controls to choose to listen to sad music. A new study in the journal Emotion suggests that depressed people are not seeking to maintain their negative feelings, but rather that they find sad music calming and even uplifting.",science,,https://digest.bps.org.uk/2019/04/24/why-do-people-with-depression-like-listening-to-sad-music/,66302,I wonder if the reverse is also true? People who prefer sad music are more likely to be depressed? ,2019-04-24 11:28:03
307,84e4yq,False,Astronomy,1623,"Astronomers discover that all disk galaxies rotate once every billion years, no matter their size or shape. Lead author: “Discovering such regularity in galaxies really helps us to better understand the mechanics that make them tick.”",science,,http://www.astronomy.com/news/2018/03/all-galaxies-rotate-once-every-billion-years,51333,"Misleading title

""About once every billion years"".  

This is really subjective as mind you depending where one considers the ""outside edge"" and what is ""about"" there's a huge margin of error making this questionably useful. ",2018-03-14 15:14:58
332,g3kt1p,False,Psychology,1656,"People who base their self-worth on their financial success feel pressure to focus most of their efforts on making more money rather than on building their relationships with family and friends, and, as a result, often end up feeling isolated and lonely",science,,https://www.minnpost.com/second-opinion/2020/04/basing-self-worth-on-financial-success-leads-to-greater-feelings-of-isolation-and-loneliness-study-finds/,50299,I mean cool that there’s data but isn’t that the theme of like a quarter of all world literature? ,2020-04-18 09:27:09
657,d7hiqo,False,Medicine,1313,"Herpes vaccine to be tested in humans after best result yet in animals, finds a new study on herpes simplex 2 virus (HSV2). An experimental vaccine prevented genital lesions in all mice and guinea pigs tested. In 98% of mice and 80% of guinea pigs it also prevented the low-level “hidden” infections.",science,,https://www.newscientist.com/article/2217255-herpes-vaccine-to-be-tested-in-humans-after-best-result-yet-in-animals/,40945,"Once animal testing is completed, how can this safely be tested in humans, given that symptoms can present long after exposure? ",2019-09-21 22:32:37
493,88a25x,False,Medicine,2632,"What If A Drug Could Make Your Blood Deadly To Mosquitoes? Three high doses of a drug, ivermectin, make human blood deadly to mosquitoes for up to one month after the third treatment, finds a randomised, double-blind, placebo-controlled trial in The Lancet Infectious Diseases.",science,,https://www.npr.org/sections/goatsandsoda/2018/03/29/597996321/what-if-a-drug-could-make-your-blood-deadly-to-mosquitoes,44765,Isn't the point to avoid them biting you at all? Killing them after the fact doesn't stop you from itching or contracting something. ,2018-03-30 12:45:14
924,7giooa,False,Environment,847,"Study finds 80% of publications from climate deniers, denying the impacts of AGW on polar bears, cite UVic zoologist Susan Crockford as a source of their arguments. Crockford has neither conducted any original research nor published any articles in the peer-reviewed literature on polar bears.",science,,https://www.cheknews.ca/study-says-uvic-zoologist-cited-on-many-climate-change-denier-blogs-392632/,35857,[removed] ,2017-11-30 01:47:48
692,ft90bu,False,Psychology,1103,"Study shows that negative emotions, such as fear, distress, and guilt, can lead to procrastination",science,,https://solvingprocrastination.com/study-procrastination-negative-affect/,40206,This is the reason I haven't applied for grad school yet. I'm terrified of being rejected or not finishing the program so I just keep procrastinating and getting nothing done. It's a stupid way of thinking but fear and anxiety is so consuming. ,2020-04-01 21:24:57
209,7ogmrk,False,Psychology,2236,"Magic mushroom compound might treat depression by reviving emotional responsiveness in the brain as part of psilocybin-assisted therapy, finds new research in journal Neuropharmacology.",science,,http://www.psypost.org/2018/01/magic-mushroom-compound-might-treat-depression-reviving-emotional-responsiveness-brain-50533,56724,[removed] ,2018-01-06 03:10:40
