Num,ID,is_Original,Flair,num_comments,Title,Subreddit,Body,URL,Upvotes,Comments,creation_date
640,b631mc,False,Social Science,5405,"A national Australian study has found more than half of car drivers think cyclists are not completely human. The study (n=442) found a link between dehumanization and deliberate acts of aggression, with more than one in ten people having deliberately driven their car close to a cyclist.",science,,https://www.qut.edu.au/news?id=141968,41311,"Well to be fair, most cyclists I come across think that they're both a pedestrian and a car. When convenient they ignore traffic laws because they currently identify as ""pedestrian"", and also when they feel like it they'll dominate an entire lane on a 45 mph arterial when there's a bike path next to the road. Some cyclists DON'T act with humanity, so I get where these results came from. Point being, follow the rules for biking on the road dammit. You don't get to weave through cars and go through a red light just to get ahead of cars to then block them. Yes. I'm mad, I drive for a living and cyclists piss me off just as often as BMW drivers, empty oversized pickup trucks, and motorcyclists who think they're bicycles (another huge issue).  ",2019-03-27 10:58:52
756,e33mji,False,Psychology,1909,"From digital detoxes to the fad of “dopamine fasting”, it appears fashionable to abstain from digital media. In one of the few experimental studies in the field, researchers have found that quitting social media for up to four weeks does nothing to improve our well-being or quality of life.",science,,https://digest.bps.org.uk/2019/11/28/abstaining-from-social-media-doesnt-improve-well-being-experimental-study-finds/,38758,This study brought to you by Facebook. ,2019-11-28 20:18:59
448,dx5avg,False,Psychology,742,"By 7 years old, kids get that hypocrisy is wrong, suggests new research, which discovered that children who were at least 7 years old began to predict future behavior based on a person’s statement about morals (n=435, age 4-9).",science,,https://www.futurity.org/hypocrisy-kids-morals-2213662/,46062,Had to read the caption twice before I understood that kids didn’t suggest new research. Slightly disappointed. ,2019-11-16 10:34:43
205,en719d,False,Environment,1997,Study Confirms Climate Models are Getting Future Warming Projections Right,science,,https://climate.nasa.gov/news/2943/study-confirms-climate-models-are-getting-future-warming-projections-right/,56921,"Am I wrong to say that many models thus far have actually underestimated future warming?

Edit: I’m asking a question because I don’t understand something. Why downvote? ",2020-01-11 12:48:56
239,ey3wu0,False,Health,1913,"The sounds that wake us up could be affecting how groggy and clumsy we are in the morning, new study shows. Harsh alarm tones can disrupt or confuse our brain activity when waking, while more melodic sounds can help us transition to a waking state in a more effective way and improve alertness level.",science,,https://www.rmit.edu.au/news/media-releases-and-expert-comments/2020/feb/melodic-alarms,54652,This moderator.. really would be nice to see what others have to say ,2020-02-03 08:15:35
188,gxzbvm,False,Psychology,3379,Men are drawn to borderline personality traits in physically attractive women; this instability might be exciting in terms of sensation seeking and being impulsive,science,,https://www.psypost.org/2020/06/men-are-drawn-to-borderline-personality-traits-in-physically-attractive-women-study-finds-56961,57594,How come the participants only looked ar faces for attractiveness. The face doesn't tell the full story. ,2020-06-06 21:23:24
259,9aext4,False,Neuroscience,1714,"Brains of doers differ from those of procrastinators - Procrastinators have a larger amygdala and poorer connections between it and part of the cortex that blocks emotions, so they may be more anxious about the negative consequences of an action, and tend to hesitate and put off things.",science,,http://news.rub.de/english/press-releases/2018-08-22-neuroscience-how-brains-doers-differ-those-procrastinators,53270,Looks like I just need a brain transplant then all my life’s problems would be solved. Simple enough.... ,2018-08-26 11:40:17
24,5vk7pv,False,Astronomy,2866,Seven Earth-sized planets found orbiting an ultracool dwarf star are strong candidates in the search for life outside our solar system.,science,,https://www.researchgate.net/blog/post/system-of-seven-earth-like-planets-could-support-life,83680,40 light years away. We could get there in my lifetime if we left soon and at light speed. It's a long shot but not impossible.  ,2017-02-22 18:00:09
431,bfoj4c,False,Paleontology,1549,"Scientists found the 22 million-year-old fossils of a giant carnivore they call ""Simbakubwa"" sitting in a museum drawer in Kenya. The 3,000-pound predator, a hyaenodont, was many times larger than the modern lions it resembles, and among the largest mammalian predators ever to walk Earth's surface.",science,,http://blogs.discovermagazine.com/deadthings/2019/04/18/simbakubwa/#.XLxlI5NKgmI,46733,Hyaenodon’t you think a lion that big is overkill? ,2019-04-21 12:57:11
34,7opvxp,False,Psychology,3403,"Sleeping less than the recommended eight hours a night is associated with intrusive, repetitive thoughts like those seen in anxiety or depression, according to new research from Binghamton University, State University of New York.",science,,https://www.ncbi.nlm.nih.gov/pubmed/29111422,78470,[removed] ,2018-01-07 10:15:30
216,d91niz,False,Computer Science,1879,"AI equal with human experts in medical diagnosis based on images, suggests new study, which found deep learning systems correctly detected disease state 87% of the time, compared with 86% for healthcare professionals, and correctly gave all-clear 93% of the time, compared with 91% for human experts.",science,,https://www.theguardian.com/technology/2019/sep/24/ai-equal-with-human-experts-in-medical-diagnosis-study-finds,56069,[removed] ,2019-09-25 11:00:08
44,8si2i9,False,Psychology,1366,"Instead of ‘finding your passion,’ try developing it, Stanford scholars say. The belief that interests arrive fully formed and must simply be “found” can lead people to limit their pursuit of new fields and give up when they encounter challenges, according to a new Stanford study.",science,,https://news.stanford.edu/2018/06/18/find-passion-may-bad-advice/,75800,"They need to understand that ""finding your passion"" and ""developing it""  are two sides of the same coin.

It's like ""finding you true love"" and developing it studies are usually NOT based on this so they tell people how long, on average it will be before a marriage crumbles. This assumes that neither partner is continually maintaining and developing that relationship like it is a cherished garden.

Most studies have this sort of issue because they throw out the natural history data. ",2018-06-20 12:55:22
77,9n2vj8,False,Animal Science,1740,"Bees don't buzz during an eclipse - Using tiny microphones suspended among flowers, researchers recorded the buzzing of bees during the 2017 North American eclipse. The bees were active and noisy right up to the last moments before totality. As totality hit, the bees all went silent in unison.",science,,https://www.smithsonianmag.com/science-nature/busy-bees-take-break-during-total-solar-eclipses-180970502/,68969,Can anyone link to the audio here? ,2018-10-10 19:53:52
698,e86ugj,False,Neuroscience,582,"In areas with low literacy rates, showing videos demonstrating agricultural techniques results in high retention and adoption rates of those techniques. Being shown an animated video on a postharvest bean storage method, farmers had a 97% retention rate and 89% adoption of the storage solution.",science,,https://www.eurekalert.org/pub_releases/2019-12/msu-ava120619.php,40027,"I mean, of course? If you want to explain someone something you do it in a way they can understand. If they don't understand writing don't do it in writing... ",2019-12-09 07:37:44
544,92198y,False,Health,1281,"Giving children omega-3 fatty acid supplements reduces disruptive behavior, which in turn had a positive effect on their parents, making them less likely to argue with each other and engage in other verbal abuse, finds new randomized, double‐blind, placebo‐controlled trial.",science,,https://www.uml.edu/News/press-releases/2018/Omega-3sresearchrelease.aspx,43340,"Is that the same kind of fats in fish? 
Could one achieve similar results from a dietary change alone? ",2018-07-26 10:58:06
346,8uj62k,False,Medicine,1891,"Double-blind placebo trial of psychedelic tea ayahuasca shows significant, rapid anti-depressant effect",science,,https://theconversation.com/amazonian-psychedelic-may-ease-severe-depression-new-study-shows-98814,49691,[removed] ,2018-06-28 13:00:12
856,b2qu1l,False,Psychology,650,A study found that treating the parents of anxious kids can be just as beneficial as treating the kids themselves. Parents can inadvertently perpetuate their kid's anxiety by accommodating anxious behaviors.,science,,https://tonic.vice.com/en_us/article/wjmy9b/giving-parents-therapy-can-help-their-anxious-children,36872,Believe it or not mental health issues are not always caused by trauma.  ,2019-03-19 01:06:31
306,cwnktf,False,Computer Science,1278,"The first computer chip made with thousands of carbon nanotubes, not silicon, marks a computing milestone. Carbon nanotube chips may ultimately give rise to a new generation of faster, more energy-efficient electronics.",science,,https://www.sciencenews.org/article/chip-carbon-nanotubes-not-silicon-marks-computing-milestone?utm_source=Reddit&utm_medium=social&utm_campaign=r_science,51411,Is Silicon(carbon) lottery still happen with carbon nanotubes? ,2019-08-28 17:01:31
177,f2e8nn,False,Psychology,1947,"Scientists tracks students' performance with different school start times (morning, afternoon, and evening classes). Results consistent with past studies - early school start times disadvantage a number of students. While some can adjust in response, there are clearly some who struggle to do so.",science,,https://arstechnica.com/science/2020/02/do-morning-people-do-better-in-school-because-school-starts-early/,58416,"School times are set up the way they are to convenience parents, and administrators, and to train children for typical business hours. 

If school were 11-6 the students would do MUCH better. ",2020-02-11 20:17:01
135,7my58a,False,Social Science,7236,"Females are four times more sensitive than males to economic status cues when rating opposite sex attractiveness, indicating that higher economic status can offset lower physical attractiveness in men much more easily than in women.",science,,http://www.ehbonline.org/article/S1090-5138(17)30315-X/fulltext,62793,[removed] ,2017-12-30 00:07:39
256,cc78kb,False,Environment,1149,"Being able to see green spaces from your home is associated with reduced cravings for alcohol, cigarettes and harmful foods. It's the first study to demonstrate that passive exposure to nearby greenspace is linked to both lower frequencies and strengths of craving.",science,,https://eurekalert.org/pub_releases/2019-07/uop-sgl071019.php,53625,"People with schizophrenia are far more likely to smoke cigarettes, figuring out why is the trick, one theory is brains that function better (or simply adequately) in a low oxygen environment are more likely to survive, ambient tests of war-zones shows a clear reduction in oxygen meaning schizophrenia may be related to war, not as an individual but as a species, evolution.

Smoking is considered to be related to stress, even if it doesn't actively reduce stress it does seem to be a kind of nervous coping device or fixation, that's related to the pressures of job or environment, a calm environment naturally would counter corporate ladder-climbing or whatnot, or even just the monotony of the daily grind in regular 9-5 or blue-collar jobs.

Our environmental circumstances impact our moods, our moods impact our habits, our health is related to if our habits are going for a jog or going for a burger, all seems fairly basic as conclusions go. ",2019-07-12 06:32:28
725,aim1a1,False,Chemistry,1489,"Carbon capture system turns CO2 into electricity and hydrogen fuel: Inspired by the ocean's role as a natural carbon sink, researchers have developed a new system that absorbs CO2 and produces electricity and useable hydrogen fuel. The new device, a Hybrid Na-CO2 System, is a big liquid battery.",science,,https://newatlas.com/hybrid-co2-capture-hydrogen-system/58145/,39405,But Is the net energy positive ,2019-01-22 11:41:23
176,9oxgzh,False,Psychology,1633,"Overparenting or helicopter parenting, a narcissistic parenting style, may impede the development of young adult independence, and be linked to development of narcissistic traits, which may be how narcissism can be passed on from generation to generation, suggests new study (n=380 college students).",science,,https://www.psychologytoday.com/au/blog/fulfillment-any-age/201810/why-narcissistic-parents-treat-their-children-babies,58434,[removed] ,2018-10-17 10:38:10
786,dy271y,False,Medicine,826,"Researchers have discovered a way to stop rabies from shutting down critical responses in the immune system, a breakthrough that could lead to new and improved vaccines, including oral vaccines for dogs. “If you can get high enough immunity in the dog population, rabies will die out.”",science,,https://www.theguardian.com/global-development/2019/nov/15/rabies-breakthrough-offers-fresh-hope-in-battle-against-deadly-virus,37964,">“If you can get high enough immunity in the dog population, rabies will die out.”

Perhaps die out in dogs, but this won't affect other rabies vector species like raccoons, bats, or foxes. Those are the carriers that the general public needs to worry about. Over 90% of rabies cases are attributed to wild animals. 

That said, rabies exposure via dogs is more of a problem in underdeveloped or developing countries, although it remains to be seen how you'd vaccinate tens of millions of stray dogs in poor countries. ",2019-11-18 11:51:50
654,81zqjg,False,Health,1593,"The 2008 Great Recession led to an increase in obesity, diabetes and mental health issues",science,,"https://www.city.ac.uk/news/2018/march/2008-great-recession-led-to-increase-in-obesity,-diabetes-and-mental-health-issues,-says-study",41026,How do I know when stuff is the president's fault and when it's not? ,2018-03-04 19:06:32
550,905n6a,False,Social Science,1751,"A new study exploring why rich countries tend to be secular whilst poor countries tend to be religious finds that a decline in religion predicts a country's future economic prosperity, when it is accompanied by a respect and tolerance for individual rights.",science,,http://www.bristol.ac.uk/news/2018/july/secularisation-economic-growth.html,43209,Really depends on the nature of religion and on the religion itself. ,2018-07-19 13:02:39
22,eyp2nd,False,Social Science,1164,"Babies, even when hungry, are willing to give a tasty snack to a stranger in need, new study shows. The findings demonstrate that altruism (the act of giving away something desirable, even at a cost to oneself) begins in infancy and suggest that early social experiences can shape altruism.",science,,https://edition.cnn.com/2020/02/04/health/altruistic-infants-wellness/index.html,84779,"So, how are the researchers certain the babies have the cognitive ability to realize that giving the treat to someone else is at their own expense? ",2020-02-04 12:04:54
709,9ttz4w,False,Social Science,1151,"Dads may be more likely to vote for female political candidates if they have a daughter - but only if the daughter is their first-born child, finds new research. This phenomenon is called the “first-daughter effect,” and is stronger in Democrats than Republicans.",science,,http://www.brandeis.edu/now/2018/november/dads-politics-greenlee.html,39801,[removed] ,2018-11-03 13:14:00
313,cudnl2,False,Animal Science,583,"Like humans, crows are more optimistic after making tools to solve a problem",science,,https://news.harvard.edu/gazette/story/2019/08/like-humans-crows-are-more-optimistic-after-making-tools-to-solve-a-problem/,51140,well crows dont have ex wives who take the kids please karen I'm begging bring back my kids oh god ,2019-08-23 13:08:46
931,cazz65,False,Cancer,730,"Scientists have discovered an entirely new class of cancer-killing agents that show promise in eradicating cancer stem cells. Their findings could prove to be a breakthrough in not only treating tumors, but ensuring cancer doesn't return years later.",science,,https://www.eurekalert.org/pub_releases/2019-07/uot-kts070519.php,35770,"Reminder that bleach also kills cancer. Headlines like this can really give false hope to people. It's a real shame we keep seeing them, and it's sad that the reason is precisely because of the false hope they bring. ",2019-07-09 12:05:05
671,cqntfa,False,Environment,1543,"A new study shows that if every building in California sported “cool” roofs by 2050, these roofs would help contribute to protecting urbanites from the consequences of dangerous heatwaves. Coating roofs white or installing sunlight-reflecting tiles in urban clusters could be one solution.",science,,https://newscenter.lbl.gov/2019/08/14/cool-roofs-can-help-shield-californias-cities-against-heat-waves/,40709,Thankfully it's California so it might actually happen.  If it were a red state they would choose to open a coal mine in the area instead. ,2019-08-15 10:04:16
413,5nkhf2,False,Animal Science,1414,Killer whales go through menopause to avoid competition with their daughters. This sheds light on why menopause exists at all.,science,,https://www.researchgate.net/blog/post/why-do-killer-whales-go-through-menopause,47127,"I can kind of see how this would have evolved:

-Mother has menopause mutation which allows her daughter to easily reproduce.

-Daughter also caries the menopause mutation and passes it on to her daughters

-Each daughter in line carries the menopause mutation and is able to reproduce at a greater rate, slowly outnumbering the whales not carrying the menopause gene. ",2017-01-12 17:00:13
706,81fx60,False,Biology,1007,"Previously Unknown ""Supercolony"" of more than 1,500,000 Adelie Penguins Discovered in Antarctica.",science,,http://www.whoi.edu/news-release/unknown-supercolony-Adelie-Penguins-Discovered-in-Antarctica,39837,[removed] ,2018-03-02 17:28:52
510,4e12g8,False,Engineering,1386,"Scientists have added a one-atom thick layer of graphene to solar panels, which enables them to generate electricity from raindrops",science,,http://sciencenewsjournal.com/future-solar-panels-will-generate-energy-raindrops/,44252,"""Every drop counts"". Its not much. But enough to store in a battery and use later on.  ",2016-04-09 12:25:47
729,cnk36d,False,Health,2320,"Legalized recreational marijuana may be a substitute for alcohol, but not tobacco, suggests a new study comparing number of online searches, which also found that after recreational cannabis is legalized, teenagers appear to lose interest in it, rather than gain interest.",science,,https://www.informs.org/About-INFORMS/News-Room/Press-Releases/New-research-shows-legalized-recreational-marijuana-a-substitute-for-alcohol-but-not-tobacco,39352,"I don’t know that number of searches is really a good proxy for “interest”.  Could just be they have a much easier way of locating it, it fifty other alternate things. ",2019-08-08 10:55:47
398,a6tbhu,False,Health,1573,"Healthy levels of Vitamin D are linked to a 75% lower risk of depression, new research finds. The Irish study followed almost 4,000 older adults for four years.",science,,https://www.irishcentral.com/news/trinity-dublin-irish-scientists-vitamin-d-depression,47860,"Or it could be that people who are depressed tend to spend less time outside, and therefore get less vitamin D? ",2018-12-16 21:53:53
108,dnccrv,False,Psychology,5423,"There is a stereotype that men are funnier than women. New research (n=5,057) found that, on average, men appear to have higher humor production ability than women. Humor may play a role in mating, with an evolutionary basis. It is correlated with intelligence, which may explain why women value it.",science,,https://www.psychologytoday.com/au/blog/humor-sapiens/201910/are-men-really-funnier-women,65328,"Humor, according to Jerry Seinfeld, is also like a muscle. Men could also have higher humor production because they're taught to practice it more, whereas women aren't invited to speak as much. A recent study showed that men think women are dominating a conversation if they are only speaking 30% of the time, and perceive the dialogue equal when women have spoken for only around 15%.

[https://allthingslinguistic.com/post/145374253955/do-women-talk-too-much-hint-science-says-no](https://allthingslinguistic.com/post/145374253955/do-women-talk-too-much-hint-science-says-no)

Basically, if you can't practice, you won't have the chance to get better–which men who love to hear themselves talk are able to give themselves all the time without the same fear of repercussion a woman might have to have. ",2019-10-26 10:51:07
547,7mhvvf,False,Social Science,1542,New study reveals that the majority of the anti-vaccination movement on Facebook is female and that the comment networks exhibit 'small world' characteristics,science,,https://doi.org/10.1080/1369118X.2017.1418406,43282,"I think that one of the reasons that women are more likely to be talking about this on social media. Is simply because they think more about children and things that have to do with them.

 ",2017-12-27 21:20:47
334,a73lhw,False,Cancer,644,"New cervical cancer test has 100 percent detection rate, detecting all of the cancers in a randomised clinical screening trial of 15,744 women, outperforming both the current Pap smear and human papillomavirus (HPV) test at a reduced cost, according to a new study.",science,,https://www.qmul.ac.uk/media/news/2018/smd/new-cervical-cancer-test-has-100-per-cent-detection-rate.html,50183,"Now that we can detect them, let's cure that shit. Just lost my mother to 3 of these cancer, dont wish it to anyone. Christmas is going to be hard  ",2018-12-17 20:31:07
624,g7t0j9,False,Psychology,955,"A study has found men view traditional symptoms of depression as more severe than other types of symptoms, and men with traditional depressive symptoms are perceived as more feminine and less masculine. This has major implications for stigma and help-seeking",science,,https://today.ku.edu/2020/04/08/studies-show-men-view-traditional-depression-more-severe-those-suffering-less-masculine,41606,"That explains a lot. I've been struggling with depression for a couple of years. Even though I have had treatment, it's been really hard for me to be in control. Although cardiovascular excersive help, it's not enough, but for the most people it might help. I really recommen it ",2020-04-25 12:51:06
765,6ve5je,False,Health,2083,"Study finds teaching teens only the ""wait-until-marriage"" kind of sex ed doesn't work. It not only fails to delay the age when teens first have sex, but also fails to reduce unintended pregnancies and the spread of sexually transmitted infections.",science,,https://tonic.vice.com/en_us/article/paa387/huh-another-study-says-abstinence-only-sex-ed-doesnt-work,38548,I went to a christian middle school in California and my sex ed class was in the church/gym. I hope some day all schools teach sex ed. ,2017-08-22 21:16:20
622,d3nue8,False,Environment,465,"It’s not just bees that are being harmed by the pesticides called neonicotinoids, it’s birds too. A study in Canada has shown that migrating white-crowned sparrows lose weight just hours after eating seeds treated with the neocotinoid imidacloprid, delaying their onward migration by several days.",science,,https://www.newscientist.com/article/2216318-decline-of-migrating-birds-could-be-partly-due-to-pesticides/,41643,And then there are politicians in Germany who more or less quietly accept another five years of Monsantos toxic on our fields ,2019-09-13 11:28:21
754,7xn8mx,False,Health,1781,A link between highly processed foods and cancer has been suggested by French researchers.,science,,http://www.bbc.co.uk/news/health-43064290,38853,[removed] ,2018-02-15 02:02:33
870,c8n59d,False,Health,1236,"In survey of people who maintained 30 lbs of weight loss in a year, 68% worked out at the same time each day, 47.8% of whom worked out in the early morning. Timing was key to forming an exercise habit, but specific time of day is not as important as working out at the same time every day. (n=375)",science,,https://www.inverse.com/article/57334-work-out-at-the-same-time-every-day,36715,Working out first thing in the morning starts my metabolism and it's the only way to make certain I get my workout in every day. ,2019-07-03 11:50:36
159,9ihgph,False,Social Science,1964,Police departments that collect more in fees and fines are less effective at solving crimes.,science,,https://www.washingtonpost.com/news/monkey-cage/wp/2018/09/24/want-your-police-department-to-collect-more-fines-it-will-solve-fewer-crimes/,60448,The Federal government is attempting to crack down on asset forfeiture and it appears regulating bail is also on the agenda. Freedom should not be bought.  ,2018-09-24 12:24:23
436,5kqfi8,False,Neuroscience,1896,"People find it hard to maintain eye contact when talking, possibly because the dual task of maintaining eye contact while also racking the brain for a word is just too demanding, so the brain pushes for breaking eye contact to focus exclusively on finding a word that will fulfill the obligation.",science,,http://medicalxpress.com/news/2016-12-explanation-people-hard-eye-contact.html,46536,[removed] ,2016-12-28 14:19:43
