Num,ID,is_Original,Flair,num_comments,Title,Subreddit,Body,URL,Upvotes,Comments,creation_date
99,ao7d03,False,Health,4808,Study finds that Juul pushed the vape market into more than doubling the concentration of nicotine in a single pod. Experts say a single 5% vape pod delivers the same amount of nicotine to the body as a pack of cigarettes which in turn makes the product highly addictive for nicotine-naive teens.,science,,https://www-m.cnn.com/2019/02/07/health/juul-nicotine-arms-race-study/index.html,66321,I wish I could buy pods that were lower. It's the thing that made me move to another vape. ,2019-02-07 19:18:20
511,c6j2vp,False,Physics,1599,Researchers teleport information within a diamond. Researchers from the Yokohama National University have teleported quantum information securely within the confines of a diamond.,science,,https://www.eurekalert.org/pub_releases/2019-06/ynu-rti062519.php,44228,What a time to be alive. Teleporting information and not being burned at the stake ,2019-06-28 11:31:25
872,bm3zu4,False,Psychology,725,"“Shooting the messenger” is a psychological reality, suggests a new study, which found that when you share bad news, people will like you less, even when you are simply an innocent messenger.",science,,https://digest.bps.org.uk/2019/05/08/shooting-the-messenger-is-a-psychological-reality-share-bad-news-and-people-will-like-you-less/,36715,Seems tough to quantify ,2019-05-08 11:18:31
352,ee0bpw,False,Psychology,1909,"Parents’ socioeconomic status and children’s inherited DNA differences are powerful predictors of educational achievement. However, new research (n=5,000) suggests that having the genes for school success is not as beneficial as having parents who are highly educated and wealthy.",science,,https://www.york.ac.uk/news-and-events/news/2019/research/genesandfamilyarebiggestpredictorofacademicsuccessstudysuggests/,49275,"You mean nepotism? No kidding. It doesn’t matter how intelligent you are. You could be dumb as rocks and instantly more successful without the ability to fail if you have rich well connected parents.

It’s getting a little ridiculous. ",2019-12-22 04:16:21
156,ghkspi,False,Medicine,1398,Antibodies from a 4-year-old llama have neutralized coronavirus and other infections in lab experiments,science,,https://www.cell.com/cell/pdf/S0092-8674(20)30494-3.pdf?_returnURL=https%3A%2F%2Flinkinghub.elsevier.com%2Fretrieve%2Fpii%2FS0092867420304943%3Fshowall%3Dtrue,60657,[removed] ,2020-05-11 10:05:00
904,9hzfmq,False,Psychology,755,"People can handle the truth more than you think, suggests a new study. Most people value the moral principle of honesty. At the same time, they frequently avoid being honest with people in their everyday lives. New research suggests people can often afford to be more honest than they think.",science,,http://newschicagobooth.uchicago.edu/newsroom/people-can-handle-truth-more-you-think?T=AU,36161,at the same time in the corporate world or amongst politicians being open and honest is a terrible quality in the sense that anything that make one look like a human with flaws is despised. ,2018-09-22 12:49:15
630,e7rloy,False,Psychology,1494,"“Instagram vs. Reality” posts exposing the fake side of Instagram might help body image, suggests a new US study (n=305), which found that unrealistic images with photo editing tools increase women’s body dissatisfaction, but posts exposing these images as fake can improve women’s body image.",science,,https://www.psychologytoday.com/au/blog/beauty-sick/201912/do-instagram-vs-reality-posts-make-difference,41491,"Super fascinated by this.  We are at the cusp of research into how social media affects people, especially with not fully developed brains such as adolescents and younger (20-24) year adults.  The tendency of these individuals to be influenced is higher but even at my age I still think “damn I’m a slack ass” when I see posts.

Good stuff. ",2019-12-08 09:00:20
497,azfb7b,False,Psychology,1518,"Victims of workplace mistreatment may also be seen as bullies themselves, even if they've never engaged in such behavior, and despite exemplary performance. Bullies, on the other hand, may be given a pass if they are liked by their supervisor, finds a new study about bias toward victim blaming.",science,,https://www.eurekalert.org/pub_releases/2019-03/uocf-ggv030819.php,44736,It also makes me wonder how many bullies see themselves as the victims in the workplace. Interesting study ,2019-03-10 12:46:07
208,hr0lgv,False,Medicine,1053,"Italian scientists have successfully completed a socially distant, remote-controlled surgery from 9-miles away. Using lasers, robots, and a 3D camera, this approach could be used for surgeries in remote parts of the world and in space aboard the ISS.",science,,https://www.inverse.com/innovation/5g-telesurgery-is-here,56749,I don’t want my surgery to be messed up due to lag or hacking ,2020-07-14 12:28:35
504,8jbeib,False,Psychology,1371,"Study suggests your adulthood self-esteem has its roots in the way you were raised as a child - The higher the quality of home environment when aged between 0 and 6 years (warm and responsive parenting; cognitive stimulation; and safe), the higher their self-esteem many years later in adulthood.",science,,https://digest.bps.org.uk/2018/05/14/study-suggests-your-adulthood-self-esteem-has-its-roots-in-the-way-you-were-raised-as-a-child/,44455,[removed] ,2018-05-14 11:09:44
585,82rl2n,False,Anthropology,1251,"Bones found on South Pacific island belonged to Amelia Earhart, study concludes. The first woman to fly solo across the Atlantic disappeared while attempting to circumnavigate the globe. Along with her plane and her navigator",science,,https://news.utk.edu/2018/03/07/researcher-new-forensic-analysis-indicates-bones-were-amelia-earharts/,42404,"The methodology used is borderline hillarious. With the help of a ""historic seamstress"" they compared the size of the bones found to estimates based on old photographs of earhart. No margin of error there then...  ",2018-03-07 20:37:41
661,d6lj9b,False,Psychology,1016,"Researchers got 2,700 college students from five countries to progressively narrow down which characteristics were most important to them in a lifetime mate, and the one that emerged from all cultures was kindness.",science,,https://time.com/5674697/relationship-traits-priorities-kindness/,40856," 

I question how much people consciously know what they want ",2019-09-19 22:36:08
791,br8s3w,False,Environment,981,"Plastic makes up nearly 70% of all ocean litter. Scientists have discovered that microscopic marine microbes are able to eat away at plastic, causing it to slowly break down. Two types of plastic, polyethylene and polystyrene, lost a significant amount of weight after being exposed to the microbes.",science,,https://www.sciencemag.org/news/2019/05/these-tiny-microbes-are-munching-away-plastic-waste-ocean,37900,"Sounds like a bad idea, based on the fact that there is not much actual info in this article.  I infer that the microbes are just making microplastic particles.  7-11% by weight?  The authors need to report on the conservation of mass...where did the mass go?
Also, “it needs to sit in the sun for a little while first”.
I would rather have it stopped at the source and not wandering in the environment. 

This article seems like it would fuel the viewpoint of “I’ll just leave this here, because I read this scientific research article that said microbes will break it down...so it doesn’t matter” ",2019-05-21 10:35:19
324,8j0lqn,False,Environment,1319,"Plastic Bag Found at the Bottom of World's Deepest Ocean Trench - It is now the deepest known piece of plastic trash, found at a depth of 36,000 feet inside the Mariana Trench.",science,,https://news.nationalgeographic.com/2018/05/plastic-bag-mariana-trench-pollution-science-spd/,50781,[removed] ,2018-05-13 01:35:07
202,dhom38,False,Psychology,850,"Humility is unrelated to downplaying your positive traits and accomplishments, suggests new research. Rather, what separates the humble from the nonhumble is the belief that your positive traits and accomplishments do not entitle you to special treatment, known as ‘hypo-egoic nonentitlement’.",science,,https://www.psypost.org/2019/10/new-psychology-study-identifies-hypo-egoic-nonentitlement-as-a-central-feature-of-humility-54657,57100,Okay but what exactly consititutes special treatment... ,2019-10-14 10:21:00
130,f8fsdz,False,Biology,1812,Bumblebees were able to recognise objects by sight that they'd only previously felt suggesting they have have some form of mental imagery; a requirement for consciousness.,science,,https://www.abc.net.au/news/science/2020-02-21/bumblebee-objects-across-senses/11981304,63088,"Isn't that discovery practically useless if we try to prove or disprove that bumblebees have a conscious? If the study had found out that they'd have no mental imagery, it would've proof that they have no conscious. But with these results it's equally possible that bumblebees do or do not have a conscious, thus no further knowledge was acquired. ",2020-02-23 21:00:23
518,3recdd,False,Social Science,3821,"Mass killings and school shootings spread ""contagiously."" Not dependent on location, leading researchers to believe that national media coverage of a mass shooting might play a role",science,,http://www.cnn.com/2015/07/02/health/contagious-mass-killings-study/index.html,43969,"Though graphic and not for the faint of heart,  the movie natural born killers touches on this subject. Two mass murderers named Mickey and Mallory Knox kill random people, and leave one to tell the story.
At one point of the movie, a tv host is interviewing people and asking them thoughts on the two killers. The people are saying how much they love them, comparing them to American cultural figures, and one teen says that he's not for murder, that he's pro-life, but if he could be a mass murderer he would Mickey and Mallory.
The host them goes on to say that the viewers in tv land don't remember things, that this is all junk food for the brain.
The movie is very graphic an intense, but it really makes a statement about this type of thing IMO ",2015-11-03 20:17:48
897,ajpj7u,False,Biology,1071,"Muscle memory discovery ends 'use it or lose it' dogma - ""New research shows that extra nuclei gained during exercise persist even after a muscle shrinks from disuse, disease or aging -- and can be mobilized rapidly to facilitate bigger gains on retraining""",science,,https://www.eurekalert.org/pub_releases/2019-01/f-mmd011719.php,36223,"Makes a ton of sense, used to be able to squat 3 plates, had 2 knee surgeries and have just gotten back into it and went from 95 lbs back up to 150 in a couple months  ",2019-01-25 14:28:23
20,67qs7r,False,Anthropology,3579,"Paleontologists have dug up a 130,000-year-old mastodon skeleton that looks like it was butchered by humans. But they found it in America, where people were not supposed to have arrived for another 100,000 years. Findings could upend our understanding of human history.",science,,http://www.nbcnews.com/science/science-news/mastodon-bone-findings-could-upend-our-understanding-human-history-n751406,87279,Dating is always the controversy but it's the interpretations of the findings that is truly controversial . No one would think this I out of place If People would stop using speculation to give an absolute answers for the evolution of humans. We just do not know when humans migrated. Concentration of fossil records in Africa could be indicitave of a safer climate not a starting point for humans. ,2017-04-26 20:22:45
783,6uosih,False,Environment,696,"The Montreal Protocol successfully outlawed harmful chemicals that deplete ozone in the atmosphere, but new research shows the ban had an amazing, unforeseen side effect: drastically slashing greenhouse gas emissions in the US.",science,,http://www.sciencealert.com/turns-out-saving-the-ozone-layer-was-the-best-thing-we-ever-did-to-fight-climate-change,38082,Thanks for the help buds ,2017-08-19 12:28:33
892,dex00w,False,Cancer,913,"Scientists believe that starving cancer cells of their favorite foods may be an effective way to inhibit tumor growth. Now, a group has developed a new molecule called Glutor that blocks a cancer cell’s ability to uptake and metabolize glucose. The drug works against 44 different cancers in vitro.",science,,https://www.acsh.org/news/2019/10/02/starving-cancer-cutting-its-favorite-foods-glucose-and-glutamine-14314,36346,Would a similar method be effective as a cancer treatment for say preventing cells metastasising? Replace the Glutor with another molecule? ,2019-10-08 08:12:29
70,d0b0zg,False,Environment,1126,"Crops under solar panels can be a win-win, and in dry places, photovoltaic shade can even reduce water use, suggests new study in journal Nature Sustainability. For example, cherry tomatoes saw a 65% increase in CO2 uptake, a 65% increase in water-use efficiency, and produced twice as much fruit.",science,,https://arstechnica.com/science/2019/09/crops-under-solar-panels-can-be-a-win-win/,69937,I hope to spread the news in all regions to benefit everyone Thanks for this wonderful information ,2019-09-06 03:08:17
590,6g94lr,False,Social Science,2330,People are less likely to accept new information when it conflicts with the political outcomes they want,science,,http://www.psypost.org/2017/06/study-trump-clinton-supporters-accept-new-information-conforms-desires-49118,42330,"I thought about this in the subway today... no matter what, CNN can say anything they want about Trump and the masses will be 'in accord.' Like a article that you never read but the headline. I got a degree in political science because I was curious as to how to analyze political statements. And I'm so grateful I did. Now I can ascertain when CNN is *puffing* and when Fox is exaggerating. Literally--all people should get to the stage where they don't ""need"" news anymore. You have all the skills to analyze it yourself. Don't be someone's muse. ",2017-06-09 15:30:44
15,eoomwz,False,Health,3456,"Marijuana use among college students has been trending upward for years, but in states that have legalized recreational marijuana, use has jumped even higher. After legalization, however, students showed a greater drop in binge drinking than their peers in states where marijuana is not legal.",science,,https://today.oregonstate.edu/news/college-students-use-more-marijuana-states-where-it%E2%80%99s-legal-they-binge-drink-less,90866,"It will be inyeresting to see in 10 years from now what adverse mental health effects arise from heavy marijuana use, with data being more prominent and quantifiable given use on much wider scale than ever before. ",2020-01-14 17:49:49
595,f1x4ia,False,Psychology,1947,"Marijuana consistently increases susceptibility to false memories, study finds. Researchers suggest these findings mean that stoned witnesses/suspects may not be giving accurate statements, and should be treated as a “vulnerable” group by police. (n=64)",science,,https://www.inverse.com/mind-body/vape-study-reveals-link-marijuana-false-memories,42185,"Yeah, ya heard that cops. Leave me alone. ",2020-02-10 21:19:29
653,7pg49f,False,Psychology,2065,False modesty isn’t fooling anyone: humblebragging makes people dislike you according to a new study from researchers at Harvard and the University of North Carolina Chapel Hill.,science,,http://time.com/5095144/humblebrag-bragging/,41041,Harris Wittels would be so proud to see “humblebrag” outlives him.   ,2018-01-10 15:04:11
774,gme7c7,False,Epidemiology,1999,"Of the 863 adults tested for SARS-CoV-2 antibodies in Los Angeles County, California, on April 10-11, approximately 4-5% were positive. The estimate implies that roughly 367,000 adults in the county had been infected, which is much greater than the 8,430 cumulative confirmed infections.",science,,https://jamanetwork.com/journals/jama/fullarticle/2766367,38374,[removed] ,2020-05-19 00:43:47
228,boxazl,False,Psychology,3477,"Millennials are becoming more perfectionistic, suggests a new study (n=41,641). Young adults are perceiving that their social context is increasingly demanding, that others judge them more harshly, and that they are increasingly inclined to display perfection as a means of securing approval.",science,,https://www.psychologytoday.com/au/blog/fulfillment-any-age/201905/the-surprising-truth-about-perfectionism-in-millennials,55521,"Something Ive been thinking about lately is how western culture differs from eastern culture in one particular way.  When we greet each other by asking, ""how are you?"" or ""how are you 'doing?'""  it elicits a response in the form of a judgement call.  In eastern cultures, the difference is that they greet each other by asking, ""how are you feeling?"" Which elicits a more natural response.  

However, we're also a pretty emotionally retarded (sorry, I cant think of another word to describe our emotional quotient on a macro level) society (Im in the U.S.) so I don't know how much good it would do to ask people in western cultures how they're feeling.  

Ive noticed that many people are unable to distinguish the difference between anxiety & depression, I wonder if the same is true for the way we use the word 'judged.'

I realize there are other factors, social media being one of the biggest, but I don't think what I'm saying here is irrelevant. ",2019-05-15 12:26:39
563,a07fn8,False,Chemistry,1416,"Scientists have developed catalysts that can convert carbon dioxide – the main cause of global warming – into plastics, fabrics, resins and other products. The discovery, based on the chemistry of artificial photosynthesis, is detailed in the journal Energy & Environmental Science.",science,,https://news.rutgers.edu/how-convert-climate-changing-carbon-dioxide-plastics-and-other-products/20181120#.W_p0KRbZUlS,42967,[removed] ,2018-11-25 10:07:46
562,crs2f8,False,Neuroscience,1449,"Psilocybin-assisted mindfulness meditation linked to brain connectivity changes and persisting positive effects, suggests a new randomized, double-blind brain scan study. Psilocybin-induced changes in brain connectivity predicted positive changes in attitudes about life, social behavior, and mood.",science,,https://www.psypost.org/2019/08/psilocybin-assisted-mindfulness-meditation-linked-to-brain-connectivity-changes-and-persisting-positive-effects-54256,42983,I find this very interesting as I have read about micro dosing shrooms being helpful for cluster headaches. I have suffered from these totally horrible headaches for over 17 years and feel like this could be a very good answer for not only them but many other medical issues. Let's hope more research can be done to legalize this maricle drug. ,2019-08-17 21:15:18
789,bt0dxs,False,Health,938,Using Waze to monitor when and where car collisions happen might cut the emergency services response time to the scene by 60%,science,,https://www.informatics.uci.edu/uci-school-of-medicine-new-study-shows-crowdsourced-traffic-data-could-save-lives/,37936,"Nothing ever prevented us from calling these things in since cell phones became mainstream.  Any accident, car or pedestrian I see in lane of travel or in potentially harm's way I call in.  Any threats to one or more people should be- that's why we fund 911.  Many times I have reported ma stranded car in traffic ( not shouldered), sometimes in the middle of multiple lanes, sometimes with the driver out of their car, to find out that I was the only one to call it in. ",2019-05-25 22:16:48
865,cgsy5n,False,Epidemiology,5614,"States with more gun owners have more murders in the home, with women being disproportionately affected, making up 72% of all intimate partner homicides, finds a new study looking at U.S. census bureau and several sources of state-level panel data from all 50 states over 26 years.",science,,https://www.newsweek.com/states-more-gun-owners-have-more-murders-home-women-most-common-victims-1450162,36775,[removed] ,2019-07-23 13:58:54
682,edmvz7,False,Paleontology,635,"Smaller than a sparrow, a 99-million-year-old bird preserved in a piece of Burmese amber has traits not seen in any other bird, living or extinct. The animal’s third toe is extremely elongated — longer than the entire lower leg bone. The new fossil is the first avian species recognized from amber.",science,,https://www.discovermagazine.com/planet-earth/this-99-million-year-old-bird-trapped-in-amber-had-a-mystifying-toe,40491,"Looks like a bird, 99 million years of evolution didn’t do all that much... ",2019-12-21 07:12:43
355,anpxea,False,Psychology,1493,"Girls with highly critical mothers are more likely to have engaged in non-suicidal self-injury, including cutting and burning, according to a new study of 204 children (ages 7-11) published in Psychiatry Research.",science,,https://www.psypost.org/2019/02/girls-with-critical-mothers-are-more-likely-to-have-self-injured-53083,49128,Does self-injury include self destructive behaviors such as trichtilliomania?  ,2019-02-06 11:48:48
515,fqnfzq,False,Psychology,3323,"The desire to matter and feel significant among Donald Trump supporters is associated with support for hostile and vindictive actions against the president’s political rivals, according to new research published in the journal Political Psychology",science,,https://www.psypost.org/2020/03/new-study-identifies-a-psychological-factor-linked-to-trump-supporters-vindictiveness-56280,44028,[removed] ,2020-03-28 16:33:52
299,a2tyd6,False,Psychology,1002,"Study finds bad bosses could turn you into a great boss - When offered leadership opportunities, prior victims of workplace abuse are more likely to treat their own subordinates better by learning from the bad behavior of their bosses.",science,,https://www.eurekalert.org/pub_releases/2018-12/uocf-sfb120318.php,51874,It's certainly been a motivating factor for me to become a teacher. I've had a lot of abusive teachers and I'm entering the field with the intention of giving kids a better experience than I ever had. ,2018-12-03 22:33:12
553,87hke8,False,Biology,1314,"A newly discovered network of fluid-filled channels in the human body may be a previously-unknown organ, and it seems to help transport cancer cells around the body.",science,,https://www.newscientist.com/article/2164903-newly-discovered-human-organ-may-help-explain-how-cancer-spreads/,43191, And the [mesentery](https://en.wikipedia.org/wiki/Mesentery) another recently discovered organ. The lymphatic system reaching into the brain as noted by a commenter below. And now these channels. Crazy stuff! ,2018-03-27 11:13:27
857,f9ahup,False,Environment,1096,"Fossil-Fuel Subsidies Must End - Despite claims to the contrary, eliminating them would have a significant effect in addressing the climate crisis",science,,https://blogs.scientificamerican.com/observations/fossil-fuel-subsidies-must-end/?utm_campaign=Hot%20News&utm_source=hs_email&utm_medium=email&utm_content=83838676&_hsenc=p2ANqtz-9s_xnrXgnRN6A9sz-ZzH5Nr1QXCpRF0jvkBdSBe51BrJU5Q7On5w5qhPo2CVNWS_XYBbJy3XHDRuk_dyfYN6gWK3UZig&_hsmi=83838676,36859,"ELI5 I paid $2.57 per US gallon yesterday and filled my tank with 17 gallons. When the oil companies pass on the end of those subsidies by increasing the cost to me how does me spending $7 per US gallon help the environment?

Also, are we going to reduce taxes to offset these no longer existing subsides we currently pay for? ",2020-02-25 13:47:16
319,ez6gy0,False,Environment,1788,"Cuba’s rivers run clean after decades of sustainable farming. Despite the island’s history of large-scale agriculture, the rivers studied had much lower levels of dissolved nitrogen — an indicator of fertilizer use — than did the Mississippi River Basin in the United States.",science,,https://www.geosociety.org/GSA/Publications/GSA_Today/GSA/GSAToday/science/G419A/article.aspx,50899,[removed] ,2020-02-05 08:32:01
914,grdyn8,False,Engineering,1081,"As 5G hits the market, new US Army-funded research has developed a radio-frequency switch that is more than 50 times more energy efficient than what is used today. The impact of these switches extends beyond smartphones. Satellite systems, smart radios, and Internet of Things",science,,https://www.army.mil/article/235923,36018,[removed] ,2020-05-27 05:59:12
146,gakfmf,False,Psychology,2971,American voters view Donald Trump has having traits associated with sadistic personality disorder and narcissistic personality disorder. The study found that even those who personally voted for Trump perceived him as having a highly disordered personality,science,,https://www.psypost.org/2020/04/trump-perceived-as-abnormally-sadistic-and-narcissistic-by-both-conservatives-and-liberals-study-finds-56646,61315,"It's interesting because I agree that he's a massive problem but I, like so many others, was so relieved when Clinton didn't win. I wonder what *her* psychological profile is. ",2020-04-29 23:33:54
369,b9gcjn,False,Paleontology,1195,"Scientists Discover an Ancient Whale With 4 Legs: This skeleton, dug out from the coastal desert Playa Media Luna, is the first indisputable record of a quadrupedal whale skeleton for the whole Pacific Ocean.",science,,https://www.inverse.com/article/54611-ancient-whale-four-legs-peru,48882,What did whales find on land that made them want to go back into the ocean? ,2019-04-04 18:21:39
