Num,ID,is_Original,Flair,num_comments,Title,Subreddit,Body,URL,Upvotes,Comments,creation_date
678,8nrxzy,False,Anthropology,2473,"About 7,000 years ago, something weird happened to men: the genetic diversity of their Y chromosomes collapsed. It was as if there was only one man left to mate for every 17 women. The collapse may have been the result of generations of war between patrilineal clans structured around male ancestry.",science,,https://news.stanford.edu/press-releases/2018/05/30/war-clan-structubiological-event/,40529,"So, does this mean that they recovered from this eventually? If so, how and how long did it take? I wonder what kind of repercussions were seen from this.  ",2018-06-01 13:38:28
825,grmffg,False,Neuroscience,1364,"The psychedelic psilocybin acutely induces region-dependent alterations in glutamate that correlate with ego dissolution during the psychedelic state, providing a neurochemical basis for how psychedelics alter sense of self, and may be giving rise to therapeutic effects witnessed in clinical trials.",science,,https://www.nature.com/articles/s41386-020-0718-8,37366,Didn’t read the whole study yet. Anyone know if meditation may induce similar changes in the brain?? ,2020-05-27 16:03:11
985,92lntd,False,Psychology,2638,"Parents should use caution when pushing your picky eater - Using coercion to get your kid to eat healthy foods doesn’t really have effect, good or bad, on their weight. But it can cause meal-time tension and damage the parent-child relationship, a new study suggests.",science,,https://www.futurity.org/parents-food-childrens-health-1821322/,34723,"Mmhhh... Parents should just patiently explain to the kid the importance of eating good food, starting with always eating well themselves. Then, a pizza a week, a couple of ice creams are ok. Don't buy anything which has high quantitative of sugar. Try to limit carbohydrates within 2pm. Let them play, run, stay outdoor. Then he/she will eat the damn spinach with no complains. ",2018-07-28 12:07:35
594,a7whqo,False,Health,1213,"New battery-free device less than 1 cm across generate electric pulses, from the stomach’s natural motions, to the vagus nerve, duping the brain into thinking that the stomach is full after only a few nibbles of food. In lab tests, the devices helped rats shed almost 40% of their body weight.",science,,https://www.engr.wisc.edu/implantable-device-aids-weight-loss/,42232,[removed] ,2018-12-20 10:13:28
717,8y8q4t,False,Health,3332,"Enjoying full-fat milk, yogurt, cheese and butter is unlikely to send people to an early grave, according to new research, which found no significant link between dairy fats, and heart disease and stroke. Certain types of dairy fat may even help guard against having a severe stroke.",science,,https://www.uth.edu/media/story.htm?id=1692785a-5886-46e8-8186-230d71b834ac,39582,"There is actually a lot of articles/research supporting this. From reduced fat dairy products; a lot of the nutrients are lost in the processing of the food. Generally, sticking with the most “organic and pure form” (staying close to natural as possible without preservatives/processing) is what’s best. 



I personally like “The Science of Skinny” by Dee McCaffery. She’s a chemist gone food scientist and breaks down the chemical benefits of choosing full-fat diary products. Bonus info on processed sugars, GMO’s, trans fats, organic eating, etc etc.  ",2018-07-12 10:56:28
506,70jopx,False,Animal Science,2143,"About 40% of ""worker"" ants, just hang around, doing nothing",science,,https://boingboing.net/2017/09/12/living-larders.html,44456,[removed] ,2017-09-16 21:59:10
936,7z4lr6,False,Psychology,1107,"How a person responds to a difficult life event such as a death or divorce helps shape the development of their wisdom over time. For many, the difficult life event also served to disrupt their sense of personal meaning, raising questions about their understanding of their world",science,,http://today.oregonstate.edu/news/how-people-cope-difficult-life-events-fuels-development-wisdom-study-finds,35654,Holy crap why are basically all the top comments removed? ,2018-02-21 10:29:06
222,djs465,False,Health,2362,"When men exercise pre-breakfast, they burn twice the amount of fat than men who waited until after breakfast. The study authors believe that the fasting overnight is key factor behind the increased fat burning.",science,,https://www.inverse.com/article/60259-effects-of-fasted-workouts-insulin-fat-burning,55722,"It still follows the guide of calorie restriction and physical activity. So basically calories in and calories out. Eat properly, don't eat random things throughout the day because that builds up your daily intake, and **move around** ",2019-10-18 19:01:25
979,dl5wu9,False,Social Science,509,"Violent crime in large US cities dropped by about 4% on days with high pollen counts, likely due to the impact of seasonal allergies (n=19,752 days, 16 cities)",science,,https://www.sciencedirect.com/science/article/abs/pii/S0167629618308221,34835,Something else to load a gun with...flowers! Spray pollen everywhere and make people less vilent!. ;-) ,2019-10-21 19:53:40
158,bfb5q4,False,Social Science,4515,"Airbnb’s exponential growth worldwide is devouring an increasing share of hotel revenues and also driving down room prices and occupancy rates, suggests a new study, which also found that travelers felt Airbnb properties were more authentic than franchised hotels.",science,,https://news.fsu.edu/news/business-law-policy/2019/04/18/airbnbs-explosive-growth-jolts-hotel-industrys-bottom-line/,60515,"Smart hotels (and the ones who can) have (or will) diversified and invested in real estate properties that they then can use as Airbnb. Like selling arms to both sides of a war, either way they win. ",2019-04-20 11:16:25
400,dpog3i,False,Health,3288,"New study says construction workers are the most likely out of all workforces to use cocaine and opioids; they are the second most likely to use marijuana, after those in the service industry",science,,https://thriveworks.com/blog/construction-workers-are-the-most-likely-to-use-cocaine-and-opioids/,47689,"Who would've thought that the miserable jobs have higher drug uses. Construction is great money and experience but it's taxing on the body in so many ways. 
The service industry just sucks cock and is 100% unneeded. Let alone some people are just ignorant and hence dicks to customers. ",2019-10-31 14:38:30
250,ckmyua,False,Neuroscience,1708,"The brains of people with excellent general knowledge are particularly efficiently wired, finds a new study by neuroscientists using a special form of MRI, which found that people with a very efficient fibre network had more general knowledge than those with less efficient structural networking.",science,,https://news.rub.de/english/press-releases/2019-07-31-neuroscience-what-brains-people-excellent-general-knowledge-look,54085,"They say something similar about musicians, particularly drummers. I’m a drummer and I’m good down the pub quiz with my useless facts. Maybe I’m wired that way. ",2019-08-01 11:12:16
667,fl12bm,False,Economics,850,"Government investments in low-income children’s health and education lead to a five-fold return in net revenue for the government, as the children grow up to pay more in taxes and require less government transfers.",science,,https://academic.oup.com/qje/advance-article/doi/10.1093/qje/qjaa006/5781614,40785,"Researching this area is wonderful, and I am inclined to believe the results. However, using ""existing causal estimates"" doesn't really engender confidence in the results. It would be much more powerful to actually track recipients and their tax contribution relative to their socioeconomic peers. I don't know who's you legally obtain that information, but I can't help but not find this convincing enough yet, and I'd love to see more research, and such that clearly explains their models/calculations in the abstract. ",2020-03-19 01:06:14
419,b5ofdy,False,Medicine,1380,"Cancer patients favor medical marijuana with higher THC, which relieves cancer symptoms and side effects, including chronic pain, weight loss, and nausea. Marijuana higher in CBD, which reduce seizures and inflammation, were more popular among non-cancer patients with epilepsy and MS (n=11,590).",science,,https://www.eurekalert.org/pub_releases/2019-03/nlh-sst032219.php,46991,[removed] ,2019-03-26 11:17:27
788,6kfv9b,False,Animal Science,724,"The blue wings of the morpho dragonfly may be surprisingly alive. Scientists found a respiratory system in its wings, the first time this has been seen in any insect.",science,,https://www.sciencenews.org/article/blue-wings-dragonfly-may-be-surprisingly-alive,37938,"""Morbo the Annihilator has veins on his head -and- on his wings!""
http://imgur.com/v1OdlCG ",2017-06-30 13:20:01
508,f09z7q,False,Health,629,Air pollution is responsible for nearly half of all childhood asthma cases in Barcelona. This is the first quantitative health impact assessment to include multiple pollutants and the development of childhood asthma,science,,https://airqualitynews.com/2020/02/07/air-pollution-responsible-for-half-of-childhood-asthma-cases-in-barcelona/,44275,"Yea i've been there and never going back, The air was so bad i didnt want to leave The hotell room. ",2020-02-07 12:44:11
818,brg3qf,False,Psychology,2633,"More intelligent individuals are more likely to enjoy instrumental music, suggests a new study (n=467), which found that higher scores on the intelligence test were associated with a preference for instrumental music, including ambient/chill out electronica, big band jazz, and classical music.",science,,https://www.psypost.org/2019/05/more-intelligent-individuals-are-more-likely-to-enjoy-instrumental-music-study-finds-53723,37506,"When just listening to music to relax, I like lyrics that either tell a story, or have some kind of relatively apparent metaphor. A lot of lyrics are just kind of nonsense poetry.

I like Marty Robbins. All his songs have characters, a plot, and a beginning, middle, and end. Johnny Cash is good too.

When focusing on something, background noise distracts me incredibly easily, so something loud and meaningless is usually good to basically shut off my ears entirely. Nightcore remixes, certain kinds of party music, and video game OSTs are usually pretty good on that front. ",2019-05-21 21:22:29
598,blxp5b,False,Medicine,519,"When doctors and nurses can disclose and discuss errors, hospital mortality rates decline - An association between hospitals' openness and mortality rates has been demonstrated for the first time in a study among 137 acute trusts in England",science,,https://www.knowledge.unibocconi.eu/notizia.php?idArt=20760,42121,"A noble thought, but unless we have a major legal overhaul in the United States there is no way it can spread here. To admit mistakes opens an institution up to huge losses, leading to not being able to treat patients. ",2019-05-07 23:11:07
378,a1mftv,False,Environment,1390,"The Amazon is worth $8.2 billion a year if it’s left standing, finds a new study in Nature. In many parts of the rainforest, that economic benefit far outweighs the short-term gain of tearing it down. “The forest should unambiguously be saved when measured in a purely economic sense”.",science,,https://motherboard.vice.com/en_us/article/bje7wd/the-amazon-is-worth-more-money-left-standing-study-shows,48606,"Of course, the economy! There is no other valid way of considering anything than in a dollar amount! ",2018-11-29 22:57:07
674,b7w2sh,False,Psychology,1765,"Intellectually humble people tend to possess more knowledge, suggests a new study (n=1,189). The new findings also provide some insights into the particular traits that could explain the link between intellectual humility and knowledge acquisition.",science,,https://www.psypost.org/2019/03/intellectually-humble-people-tend-to-possess-more-knowledge-study-finds-53409,40672,I am something of a humble intellectual myself. ,2019-04-01 02:19:59
481,5x55sm,False,Computer Science,2800,"Operating system and a film stored on DNA, and recovered with no errors.",science,,https://www.researchgate.net/blog/post/dna-could-be-the-future-of-data-storage,45127,legitimately mind blowing. ,2017-03-02 19:00:00
793,80pfgi,False,Paleontology,813,"Ancient puppy remains show human care and bonding nearly 14,000 years ago",science,,https://www.sciencedirect.com/science/article/pii/S0305440318300049,37891,"So, was it coincidental that they died the same time as the dog(s) or was the dog buried after or before them, and then someone just dug up the grave to place the dog or people together? I'm confused... ",2018-02-27 19:45:41
921,6oaf5m,False,Environment,1972,"Humans have produced 9 billion tons of plastic throughout history, with half of this total made in the last 13 years. About 5.5 billion tons of plastic waste has ended up in landfills and the environment.",science,,http://www.newsweek.com/plastic-production-pollution-9-billion-tons-recycling-639226,35896,I wonder how many trees we would have had to grow and cut down if we had to use wood and cardboard instead of plastic. ,2017-07-19 18:25:41
607,g15tk6,False,Psychology,1896,New research finds that sexual intercourse has greater sedative properties for women than it does for men. Women reported a higher likelihood of falling asleep after heterosexual penile–vaginal intercourse than did men and were also more likely to report falling asleep before their partner,science,,https://www.psypost.org/2020/04/new-research-indicates-that-women-are-more-likely-to-fall-asleep-after-sex-than-men-56467,42017,">women that remain in a spline position after sex 

I think they meant ""supine"". ",2020-04-14 13:47:13
310,9immmj,False,Animal Science,1280,"Honey bees exposed to glyphosate, the active ingredient in Roundup, lose some of the beneficial bacteria in their guts and are more susceptible to infection and death from harmful bacteria. Glyphosate might be contributing to the decline of honey bees and native bees around the world.",science,,http://www.pnas.org/content/early/2018/09/18/1803880115,51227,[removed] ,2018-09-24 22:41:01
23,91b8gd,False,Psychology,1827,"Children as young as age 4 express dislike of and are willing to punish those who freeload off the work of other group members, a new study has found. But kids also make a clear distinction between those who freeload intentionally and those who have good reasons why they can’t contribute.",science,,https://news.yale.edu/2018/07/23/even-4-year-olds-dislike-freeloaders,83999,"So, how does some of those kids grow to forget how to distinguish between bad or innocent freeloaders? ",2018-07-23 21:35:48
575,8dex2o,False,Biology,1301,Half the Coral in the Great Barrier Reef Has Died Since 2016 (paper sourced in article),science,,https://www.theatlantic.com/science/archive/2018/04/since-2016-half-the-coral-in-the-great-barrier-reef-has-perished/558302/?single_page=true,42647,[deleted] ,2018-04-19 14:11:04
784,cmzj8n,False,Computer Science,1325,"Researchers reveal AI weaknesses by developing more than 1,200 questions that, while easy for people to answer, stump the best computer answering systems today. The system that learns to master these questions will have a better understanding of language than any system currently in existence.",science,,https://cmns.umd.edu/news-events/features/4470,38055,So you're saying there's a chance we can be an AI in Jeopardy. ,2019-08-07 01:48:48
485,713b3t,False,Medicine,2430,Playing tackle football under the age of 12 exposes children to repetitive head impacts that may double their risk of developing behavioral problems and triple their chances of suffering depression later in life,science,,http://www.bostonglobe.com/sports/2017/09/19/study-links-youth-football-greater-risk-later-health-problems/UF3vWIAraotnJnbU8o8TDP/story.html,45048,"






From Livestrong.com:

Injuries in Soccer

In 2011, the Bleacher Report ranked soccer at sixth place in the top 10 most dangerous sports. The U.S. Consumer Product Safety Commission's statistics for 2009 reveal that 88,000 soccer players between the ages of 5 and 14 were seen in emergency rooms for sports injuries. In 2011, Safe Kids Worldwide reported that 104,190 soccer players between ages 12 and 17 were seen in emergency rooms, with 13 percent of those injuries involving concussions. The types of injuries most commonly sustained by soccer players are musculoskeletal injuries to the lower body.

Injuries in Football

Football was ranked as the third most dangerous sport in 2011 by the Bleacher Report, due to the sheer numbers of football related injuries. The U.S. Consumer Product Safety Commission reports that in 2009, 212,000 children were seen in emergency rooms for football injuries. By 2011, there were 275,050 emergency room visits for football players between ages 12 and 17, with 13 percent involving concussions. Knee injuries are relatively common among football players, with lower-extremity injuries overall accounting for half of all injuries. Thirty percent of other injuries involve the upper body. Strains, sprains, contusions, fractures and concussions are the most common types of injury sustained.

Comparing the Two Sports

Both sports carry a risk of injury, and it is impossible to quantify an individual player's overall risk of injury during a game of a season. In general, both sports take a relatively heavy toll on the knees and lower extremities. The risk of injury to the upper extremities is much higher in football than in soccer -- with the exception of the goalkeeper, soccer players do not use their hands and arms to handle the ball. However, concussion injuries are equally likely in soccer and football players. Football players are more likely to suffer injuries to the cervical spine, which can be catastrophic or life-threatening. ",2017-09-19 14:26:04
501,7d4x24,False,Psychology,2325,"A new study suggests that marijuana users are more creative, but it's probably not because of their marijuana use",science,,http://www.psypost.org/2017/11/study-marijuana-users-creative-might-not-marijuana-50178,44521,[deleted] ,2017-11-15 15:44:06
157,ae5z09,False,Psychology,3192,"Girls and boys may learn differently in virtual reality (VR). A new study with 7th and 8th -grade students found that girls learned most when the VR-teacher was a young, female researcher named Marie, whereas the boys learned more while being instructed by a flying robot in the form of a drone.",science,,https://news.ku.dk/all_news/2019/virtual-reality-research/,60653,[removed] ,2019-01-09 11:29:14
766,94qlf3,False,Biology,1138,Humans are giving many other species cancer: Meta-analysis finds enough to classify Homo sapiens as an “oncogenic species”,science,,https://cosmosmagazine.com/biology/humans-are-giving-many-other-species-cancer,38523,So if I call my teammates online cancerous am I not flaming but stating a fact? 🤔 ,2018-08-05 08:59:43
428,akmdhy,False,Economics,2166,"A moderate level of piracy can have a positive impact on the bottom line for both manufacturer and retailer - and not at the expense of consumers - finds a new study. Because piracy can affect pricing power of manufacturer and retailer, it injects ""shadow"" competition into a monopolistic market.",science,,https://www.eurekalert.org/pub_releases/2019-01/iu-tht012519.php,46781,Let's be honest most people who pirate something were never actually going to buy it ,2019-01-28 10:55:26
891,5wgvvm,False,Social Science,1295,"People living in neighbourhoods with more birds, shrubs and trees are less likely to suffer from depression, anxiety and stress.",science,,https://www.eurekalert.org/pub_releases/2017-02/uoe-wbn022417.php,36351,[removed] ,2017-02-27 14:05:38
601,fouxrq,False,Environment,436,"Research show skies above the Southern Hemisphere have recovered since a 1987 treaty banned chemicals that eat away at the atmosphere’s protective layer. Over the last 15 years, the ozone hole has shrunk by about 20%, which scientists credited to the 1987 Montreal Protocol",science,,https://www.bnnbloomberg.ca/southern-skies-benefit-from-a-rare-climate-diplomacy-success-1.1412228,42091,[deleted] ,2020-03-25 18:02:56
61,dw6x95,False,Health,2174,Recent study in Vaccine reveals that the majority of anti-vaxx ads on Facebook are funded by just two organizations. Pro-vaccination ads were funded by 83.,science,,https://www.theguardian.com/technology/2019/nov/13/majority-antivaxx-vaccine-ads-facebook-funded-by-two-organizations-study,71780,Cause most of their audience died of preventable diseases... ,2019-11-14 09:04:10
724,5s73mt,False,Psychology,1702,"When preschoolers spend time around one another, they tend to take on each others’ personalities, indicates a new study by Michigan State University researchers, which suggests personality is shaped by environment and not just genes.",science,,http://msutoday.msu.edu/news/2017/personality-traits-contagious-among-children/,39417,[removed] ,2017-02-05 12:18:36
752,e6gnf0,False,Environment,828,"Half a million crabs killed by plastic debris on remote islands. Marine plastic is a problem worldwide, and comparable hermit crab losses on a global scale would have important implications for ecosystems",science,,https://www.utas.edu.au/research-admin/research-news/half-a-million-crabs-killed-by-plastic-debris-on-remote-islands,38953,Damn. Think about every human alive rn has a 500 thousand kd v crabs ,2019-12-05 12:41:24
612,7gu0tv,False,Biology,1128,"Evolution row ends as scientists declare sponges to be sister of all other animals. Sponges were first to branch off the evolutionary tree from the common ancestor of all animals, finds new study in Current Biology.",science,,https://www.theguardian.com/science/2017/nov/30/evolution-row-ends-as-scientists-declare-sponges-to-be-sister-of-all-animals,41910,Sponges are sessile and do not have a nervous system like jellies. Makes sense. ,2017-12-01 09:44:13
253,bx1sr1,False,Environment,2818,"The average person eats at least 50,000 particles of microplastic a year and breathes in a similar quantity, according to the first study to estimate human ingestion of plastic pollution. The scientists reported that drinking a lot of bottled water drastically increased the particles consumed.",science,,https://www.theguardian.com/environment/2019/jun/05/people-eat-at-least-50000-plastic-particles-a-year-study-finds,53809,"Calling it now, this is going to be the asbestos of the era. ",2019-06-05 12:07:05
963,dtu5n3,False,Psychology,2787,"Men who endorse social hierarchies are more likely to objectify women when their own power is threatened, suggests new research. The sexual objectification of women by heterosexual men is driven not only by sexual motives, but also by power-related motives (the wish to maintain male dominance).",science,,https://www.psypost.org/2019/11/new-psychology-research-uncovers-power-related-motives-behind-mens-objectification-of-women-54841,35108,Tell me one place that does not have a social hierarchy? ,2019-11-09 10:06:13
76,9emmr2,False,Cancer,1880,"New cancer vaccine is 100 percent successful in mouse model. Scientists have developed a new vaccine that — in conjunction with existing therapies — can not only treat aggressive melanoma, but also prevent its recurrence.",science,,https://www.drugtargetreview.com/news/35232/anti-pd-l1-cancer-vaccine/,69160,Actual study: https://www.ncbi.nlm.nih.gov/m/pubmed/30150374/ ,2018-09-10 12:24:40
367,bshtew,False,Epidemiology,2323,A law restricting abortions in Texas resulted in more second trimester abortions due to women having more limited access to abortion services.,science,,https://www.ncbi.nlm.nih.gov/pubmed/30870293,48889,[removed] ,2019-05-24 14:48:37
864,636co4,False,Health,1247,"Less people get hospitalized for opioid abuse in states where medical cannabis is legal, according to a recent study, published in the journal Drug and Alcohol Dependence.",science,,https://housely.com/opioid-abuse-drops-in-states-with-legal-cannabis/,36785,A story in the Boston Globe today on the rate of opioid-related ER visits: [Mass. had highest rate of opioid-related ER visits] (https://www.bostonglobe.com/metro/2017/04/02/mass-had-highest-rate-opioid-related-visits/6vJ4kwtO1dvQGf7TGuXueN/story.html) ,2017-04-03 12:10:17
705,brgpao,False,Health,694,"Adults with low exposure to nature as children had significantly worse mental health (increased nervousness and depression) compared to adults who grew up with high exposure to natural environments. (n=3,585)",science,,https://www.inverse.com/article/56019-psychological-benefits-of-nature-mental-health,39882,Then why does Montana have the [highest suicide](https://flatheadbeacon.com/2018/06/20/montana-grapples-highest-suicide-rate-nation/)  rate in the nation? ,2019-05-21 22:14:58
174,b3uywt,False,Psychology,1373,"Low-quality sleep can lead to procrastination, especially among people who naturally struggle with self-regulation.",science,,https://solvingprocrastination.com/study-procrastination-sleep-quality-self-control/,58571,[removed] ,2019-03-21 19:38:59
983,azopzp,False,Psychology,977,"Study suggests humor could be an emotion regulation strategy for depression - Humor can help decrease negative emotional reactions in people vulnerable to depression, according to new preliminary research of 55 patients with remitted major depression.",science,,https://www.psypost.org/2019/03/study-suggests-humor-could-be-an-emotion-regulation-strategy-for-depression-53298,34758,[deleted] ,2019-03-11 04:04:33
