Num,ID,is_Original,Flair,num_comments,Title,Subreddit,Body,URL,Upvotes,Comments,creation_date
190,btqb7i,False,,1000,"90% of posts here are from self-described ""broke college kids"". Anyone here a broke ass adult?",povertyfinance,This magical spell of becoming financially stable after college still hasn't happened for me. Anyone else here relate?,https://www.reddit.com/r/povertyfinance/comments/btqb7i/90_of_posts_here_are_from_selfdescribed_broke/,4581,"Nope, i dont blow my money on shots and carnival cruises. ",2019-05-27 19:35:49
171,eqgjjw,False,,165,you guys will like this,povertyfinance,,https://i.redd.it/d7jjexrwufb41.jpg,4825,[removed] ,2020-01-18 13:45:08
275,fnr5fc,False,Success/Cheers,204,It took a pandemic,povertyfinance,Well last month we were facing eviction and having an impossible time finding an affordable apartment. Then COVID shut down happened and everyone left my town. Broke leases and moved back home when school canceled. Then apartments got cheaper and I got a bigger apartment than I currently have in an affordable price range! We used our tax return to pay off our previous eviction. The Governor canceled all evictions so we are able to finish our lease and we can pay off the money we owe in back rent instead. The apartment isn't going to file anymore. Now we wont have any negative marks on our credit. We still have money to get a (new to me) bigger couch too a benefit of school closing is students dont move with their stuff. I feel like I can breathe for the first time since I left my job for a comission based travel company (covid said no to this venture at least for now),https://www.reddit.com/r/povertyfinance/comments/fnr5fc/it_took_a_pandemic/,3581,I feel same way. Love this virus ,2020-03-23 20:20:56
963,93ozr6,False,,17,"Hidden Brain Does an Episode on how having money problems can lead to an inability to make sound financial decisions due to ""Tunnel Vision"" a focus/justification that leads to bad financial decisions.",povertyfinance,"Obviously you have to listen to the entire episode to understand the topic better. I hope my title is not misleading. i tried to best explain the concept in 1 sentence, but hour from now i will possible realize an error or un-intentional mis-representation of the issue. So apologies if that turns out to be the case.  

Listen to the episode, it discusses how people in certain types of stress, like financial stress essentially justify purchases without realizing it is a bad idea.  

This can even effect those of us with plenty of money. It is about the mental blocks we create when we feel a scarcity in some way. so this is also a good listen for people in all kinds of situations even the middle class and wealthy. It just happens to focus on financial scarcity.  

Anyways, even if it does not directly solve an issue, i always find it good to understand how our minds work, and then maybe we can catch ourselves when and if we go into these mental states.  

If only to stop us at checkout and make us think ""Hey, wait. Am i doing that mental Justification and not actually making a good choice right now?""  

Here is the link to the Episode: [https://www.npr.org/2018/04/02/598119170/the-scarcity-trap-why-we-keep-digging-when-were-stuck-in-a-hole](https://www.npr.org/2018/04/02/598119170/the-scarcity-trap-why-we-keep-digging-when-were-stuck-in-a-hole)  

If you have a podcast app and look up ""Hidden Brain"" it is the April 2nd, 2018 episode, shouldn't be too far down the list.

DISCLAIMER: This is hidden brain not some media news show trying to tell you how to think and live. Hidden Brain tends to be an extremely open minded podcast. It simply discusses studies and observations. It is not always delivering absolute facts. Sometimes it is just debating a topic and has no final conclusion. In fact it often leaves many things up in the air and just gives you various sides of the topic to think about.  I am not saying this is some absolute fact and neither are they. It is just an interesting thing to think about and possibly watch out for. If it can help 1 person and applies to no one else. Well at least 1 person was helped and the rest of us have a nice conversation starter.",https://www.reddit.com/r/povertyfinance/comments/93ozr6/hidden_brain_does_an_episode_on_how_having_money/,801,One of my favorite podcasts. Great host and fascinating topics ,2018-08-01 13:33:55
914,d1pkgg,False,,29,"3 and a half years later, I can finally feel proud of my accomplishment. Never thought I’d get here!",povertyfinance,,https://i.redd.it/clorb0p7zjl31.jpg,884,Nice work 😀 ,2019-09-09 11:22:27
396,9q8o4b,False,,104,"Thanks to my homebrew personal finance spreadsheet, I know exactly how much is left out of last Friday's paycheck!",povertyfinance,,https://i.redd.it/zg232nutrmt11.jpg,2686,In my country you’d be a king with that amount of US dollar ,2018-10-22 00:22:33
989,ehp010,False,,183,Poverty Finance essentials,povertyfinance,"I did a top posts of all time search looking for a few good pieces of PF advice. I figure I would start a conversation today regarding some PF essentials. Hopefully this thread will help lay a good foundation to start (or continue) our journey towards financial freedom.  

Things that I learned from this sub and have implemented:

1. Spend less: Pretty obvious but you would be surprised how much spending we do when we are not conscious of spending money. 

2. Make a budget and stick to it: I count calories in order to lose weight on a weekly basis. I applied the same concept to spending money. I can only spend X amount on groceries, X amount at a coffee shop, X amount when I go out, etc. 

3. Get on a plan to pay off debt: Paying credit card debt can take some months, even years, but the more CC debt you pay down (and not add too) the more the debt will decrease. If you stick to a payment plan and are disciplined it is just a matter of time before your cards are paid off. Also, if you have school loan debt seek out forgiveness options. Thanks to this sub I was able to get on a 10-year plan to have my debt forgiven. 

4. Find a low-cost lifestyle: Nights out in the club and checking out the new movie releases every week can crush a budget. Some cheaper options for entertainment I’ve enjoyed include reading at the library (or coffee shop), writing on a blog (free on WordPress), playing fighting games (high cost of entry but once established it is “free” to play and improve), and not drinking alcohol.

5. Get in shape: I feel it is easier to deal with being poor if you are shredded compared to if you are in bad health. Working out has really helped me with the day to day stress of dealing with denying myself in an effort to save more money. Also, make sure you are getting an adequate amount of sleep. If you suffer from insomnia or struggle to sleep look into remedies (meditation, consistent bed time, exercise, journaling). 

Any other pieces of wisdom will be appreciated!",https://www.reddit.com/r/povertyfinance/comments/ehp010/poverty_finance_essentials/,719,"These are all great ideas! I catch up with friends at their house every couple of weeks for drinks and just bring my own alcohol, which I usually limit to a couple of beers. Also making pizza is super cheap at home especially if you make your own dough. I'm watching calories so instead of making my own dough I use flat bread. ",2019-12-30 17:27:32
87,bb0wrl,False,,190,"Three years ago I had a 434 Credit Score. After making a plan and laying the groundwork, today it's at 703!",povertyfinance,,https://i.imgur.com/G2zm15S.jpg,7412,"Wow.... 
how much precious metal do you have? Like gold and silver ",2019-04-08 23:45:01
560,fmtcj1,False,Success/Cheers,69,It paid off.,povertyfinance,"It finally paid off.

Foregoing the fun Friday nights.

Not spending my salary on a new vehicle.

It all paid off.

Me and my girlfriend can afford our normal lifestyle for a year. No matter what happens. A year. I haven't been laid off, but if it does happen we're okay. I'm so proud of us, even though it took sacrifice. We're not scrambling to figure out ""what next?"", because we budgeted and planned for this.

*EDIT* Below I have included financial information. A recent job change has possibly made me not ""poverty"" level anymore. If so, I will remove my post. I dont want this to be a ""pat me on the back"", and would like to share how we have prepped for the ""apocalypse"".

Financial Information:
Job: Inside sales. (27K base, extra 13K if quota is reached)

Previous Employment: Truck unloader

Education: Bachelor's in Business Administration (cheapest state school I could find. Had one scholarship).

Current Debt: 16.5K (All Student Loans).

Rent $736 a month

All Bills: Approx. $200 a month. The season is a factor.

How we did it:
Canned foods, Intermittent fasting to put us at 2 meals max. Paid off my vehicle with double employment. Cheap meals where leftovers gave us 2-3 meals a week. Light prepping in the pantry, so we wouldn't have to shop if something kept us in. MOST IMPORTANT: Odd Jobs. I made some very decent money on ranches, and farms. Hard work but it paid. In some cases I lived on the ranch, did work, left for my evening job, then woke up to do it again. It was how I paid for my car, and a chunk of my education.

Sorry if the salary no longer makes me poverty. It was a pretty recent promotion.",https://www.reddit.com/r/povertyfinance/comments/fmtcj1/it_paid_off/,1988,no one cares LOL ,2020-03-22 03:45:10
56,g4qs3l,False,Links/Memes/Video,129,This hit close to home,povertyfinance,,https://i.redd.it/jidnh8r8gyt41.jpg,9706,Damn. It sucks when it’s something that’s like $6 or $7 too. I remember those days ,2020-04-20 11:04:43
88,eqp08f,False,,393,It never ends,povertyfinance,,https://i.redd.it/s3wbdusvylb41.jpg,7297,andrew yang babeeeey 😎👉🏻👉🏻 ,2020-01-19 00:24:24
409,bn05bu,False,,84,It's FINALLY done!,povertyfinance,,https://i.redd.it/t0v4oum0rex21.jpg,2646,Never finance again! ,2019-05-10 16:08:21
80,gqar2q,False,Success/Cheers,333,Paid off my car!!,povertyfinance,,https://i.redd.it/mz20i622uw051.png,7830,[removed] ,2020-05-25 13:13:52
573,ale8y6,False,,286,A Warning About TurboTax,povertyfinance,"I went to file my taxes yesterday the same way I have done for several years, with the TurboTax free file. I noticed a few things that I thought I'd share: 

When I got to the section for the child and dependent care credit, the software kept telling me that I don't qualify. I knew that I still qualified for the credit so I googled it. Turns out, when you enter your W2 at the beginning for you and your spouse, it defaults both of them to one persons name (so it appeared that I made too much money for the credit, while my husband had no income). As soon as I went back and assigned one of the W2 to my husband I qualified for the credit, which boosted my refund by $600. 

Because I filed for a specific credit, TT software said I needed to pay the $39.99 as the free software didn't cover one of the forms I'd need done to file. I was already finished by this point and was getting money back so I figured ok, I'll pay it, and that I will just file by hand next year. TT gave me the option to pay this fee out of my refund, saying something like ""no need to reach for your wallet, we can just take this from your refund"". Nowhere on this page did it indicate that there would be a fee to do so. When I was completely done and ready to file, TT asked me to consent to the charges and hit submit. I noticed that the fees suddenly went from $39.99 to 79.99 and I didn't understand why until I searched the internet and found dozens of complaints from last year. Apparently TT is charging an extra $39.99 in order for them to take the original fee from your return with very little explanation and quite deceptive language on their website. I paid the original fee with my credit card and filed without issue. 

I know this is a bit strange and I am not trying to blast TT in general, but I do think it is fair that people be aware of these fees and quirks of the software. Hope this helps someone! 



EDIT: WOW Silver! Thank you kind stranger! 

This is by far my biggest post on Reddit! I've compiled some of the resources suggested but it appears that the most popular free tax filing this year is Credit Karma. 

In USA: 
The VITA Program: https://www.irs.gov/individuals/free-tax-return-preparation-for-you-by-volunteers
Description of this program in the top comment, thanks u/meowmeowmeow_meow

IRS Free File: https://www.irs.gov/filing/free-file-do-your-federal-taxes-for-free
This is the place to start for free filings, particularly if you're going to stick with TurboTax (which I do not recommend). There are many other options on this site though and it is a valuable resource the IRS provides.

Free Tax USA: https://www.freetaxusa.com/
This was suggested by many commenters

Credit Karma Tax: https://www.creditkarma.com/tax
Also suggested by many commenters


In Canada: 
Simpletax: https://simpletax.ca/

I really hope all you beautiful people get the most of YOUR MONEY back that you possibly can!!! 

",https://www.reddit.com/r/povertyfinance/comments/ale8y6/a_warning_about_turbotax/,1921,"Why the fuck do all of these people piss and moan about having to pay to do a tax return?

God damnit.

If you have any brains at all, find a free site. Kudos to you! Then you get zero support, and will start crying when the free service fucks up your dad's 1099-R.

Paying 80$ for a federal and a state isn't so bad, especially when you can call 10 times for assistance if you need it.

Fucking crybabies.

 ",2019-01-30 16:16:08
407,g7xxo5,False,Success/Cheers,64,Feels like a weight lifted off my shoulders.,povertyfinance,,https://i.redd.it/2h6pkagq50v41.png,2655,Ok now cut it up!!! ,2020-04-25 17:54:33
201,drj4i0,False,,347,Don’t rent to own,povertyfinance,,https://i.redd.it/1zgpczh81kw31.jpg,4394,"Yeah, rent to own is garbage, but sometimes, that's the only way you can afford some of these purchases. For people who can't even get high interest credit cards from a store, what is the other option? ",2019-11-04 15:27:42
297,dileyc,False,,203,Money can’t buy happiness but it sure as hell can buy freedom from financially-induced sadness.,povertyfinance,"Car and laptop repair estimates are about to break my bank account and I’m laying awake unable to sleep because I can’t believe the bad luck I just had. 

At this point I don’t even want happiness, if I have money I don’t care how bland my life is as long as I never feel this stressful or anxious again.

Edit: Thanks for the inbox messages dudes and dudettes of Reddit. This site truly is a wonderful
place. I was just a little spooked when I posted this because it was just terrifying that the two of them happened around the same time. That being said I asked for an advance on my paycheck so I’ll make it through this month. I also found some great
local repair places that are willing to let me pay in increments. I’m very grateful to my irl support network as well. Thanks ya’ll, ya boi will survive.",https://www.reddit.com/r/povertyfinance/comments/dileyc/money_cant_buy_happiness_but_it_sure_as_hell_can/,3381,"So reposting this as it seems to be a common topic in this subreddit. 


I grew up extremely poor. When I say poor I mean 12 people in my family sharing a single bedroom condo in Chinatown, Rummaging through lost in found for abandoned clothes to wear poor. I could go on but I’ll spare you the walk down poor memories lane. 

Fast forward, I’m a self made millionaire today. And I can honestly say money buys me moments of joy, reduces anxiety and stress in some areas of life... but the thing about having money now is that I don’t really care that I have it and my mind has gone on to stress and be unhappy  over other life issues (relationships, work, life, etc.).  

TLDR money doesn’t buy happiness because as you solve ‘the money problem’ for yourself you move on to things like existential dread ",2019-10-16 06:43:02
217,hlu7jf,False,Links/Memes/Video,78,Here's a version of this meme that I feel is a little more realistic.,povertyfinance,,https://i.redd.it/y9gt6q4ms3951.jpg,4141,[removed] ,2020-07-05 21:04:59
829,9vod9c,False,,58,Paid off 99% of my credit card debt!,povertyfinance,"I have been a longtime lurker on here.. Soaking in all the tips and tricks I could and finally feel accomplished enough to post. 

I sold my condo this week and made a little money off of it- $24K. The second the wire hit my account I paid off all of my credit card debt except $2k which will be paid off in 2 weeks.

I feel 10 pounds lighter and am so hopeful for my financial future. 

Thank you to this community for being so positive and inspirational. ",https://www.reddit.com/r/povertyfinance/comments/9vod9c/paid_off_99_of_my_credit_card_debt/,1125,[removed] ,2018-11-09 21:16:12
601,ajp2jg,False,,139,"Food Bank Visit (6th time) (Today I was last in line) (leftover veggies, sliced meat & ""glitter potions"")",povertyfinance,,https://i.redd.it/mx6e0j6rnkc21.jpg,1820,"So my work had food pantry items brought to us this morning because of the shutdown. I checked it out because even tho I'm doing good, who knew how long the shutdown would last and if it could save me some money and prolong my savings why not right? So I go and look with my co workers and theres all this great food. I'm talking different types of bread, cakes, cookies, popcorn, fruit, some veggies. I think this is awesome, I start grabbing stuff and there ALL EXPIRED! Some of it was expired over a year!  I thought it was a joke or something but my co worker said that's how things are. I immediately put everything back but I just cant believe that they give people EXPIRED food! I've never been near a food bank in my life so it was kind of a shock to me. How do they expect people to eat EXPIRED food?  ",2019-01-25 13:35:23
863,88apnn,False,,82,"I just learned that is you have a valid Medicaid or gov't. benefits EBT card, you can get discount Amazon Prime.",povertyfinance,"It's $5.99 a month if you have that proof.

That's pretty cool for them to do that. So many businesses typically soak the poor for every dime they can get. 

I know - even $6 a month can be too much sometimes. ",https://www.reddit.com/r/povertyfinance/comments/88apnn/i_just_learned_that_is_you_have_a_valid_medicaid/,1006,That’s how Bezos gives bennies to his workers!  ,2018-03-30 14:25:20
368,bdt7q8,False,,151,Finally paid off all credit card debt. Had to be seriously planned. Was planned 4 months ago but only happened today because of unexpected reasons. Repeat after me: my spending power is the amount in my debit and not my credit line. Never again spending a penny I cannot immediately pay off.,povertyfinance,,https://i.redd.it/1328vddfbms21.jpg,2940,"Your spending power is your debit line *minus* your expenses and debt.

It took me *two decades* to crawl out of my college debt (cards and student loans). I closed all my lines of credit except one the I use only when traveling (no international fees).

Are you going to close these lines? ",2019-04-16 12:14:33
107,a9kfr8,False,,325,"Ate nothing but oats, water, and sugar for the last month, barring a few exceptions. After giving my last $6 to a homeless guy to help me carry my things when I first came into town over 4 months ago, he surprised me with this. I wish I could tell you how good this tastes right now. Merry Christmas!",povertyfinance,,https://i.redd.it/hxstww0o4j621.jpg,6681,[removed] ,2018-12-26 02:00:23
288,hlgex6,False,Links/Memes/Video,103,"Saw this on another sub and I was like, “Feel like a millionaire?” Nope. Still “Help help help” come payday.",povertyfinance,,https://i.redd.it/264n8i9dqy851.jpg,3450,"omg guys ... i posted this last night half asleep and didn’t expect all this ... thanks for the silver whoever that was ! PS, eat the rich and their out-of-touch ness with reality ",2020-07-05 04:03:29
690,ho5vfh,False,Vent/Rant,263,I get the poor now,povertyfinance,"I am very lucky.

I will never have housing problems because I live with my family ( mom, grandparents, aunt and uncle)
or hospital bill because I live in Italy. 

I thought nobody could get poor because I couldn't

But my shoulders are covered by a sound family without debt.
Now I am in a small financial struggle and I owe my mother € 1k 

My payment will come at the 28th of this month  and it will be €650

What will I do without my family? What about who doesn't have a family? 

From my privileged prospective I couldn't get the prospective of poverty but getting in debt really opened my eyes. 

I really appreciate all your struggles and keep it up with your effort to get a better life

Edit: some comment made me realize that the title is wrong.  I Cannot say that I get all poor people and their strugle just because I am 1k in debt with my mum. 

Since I cannot edit the title pretend that it was:
 
""Now I get how someone can get poor """,https://www.reddit.com/r/povertyfinance/comments/ho5vfh/i_get_the_poor_now/,1581,"For just $18/ month you can help support a struggling American trying to afford an apartment, pay medical bills, student loans, and basically survive while earning a federal minimum wage of $7.25/ hour. ",2020-07-09 16:13:06
779,es2pqy,False,,43,Paid off 2 cards,povertyfinance,"I paid off 2 cards this month. Each had a $400 balance. I also paid on another card and did a balance transfer of my remaining balance to a 0% interest card with $0 balance transfer fee. I’m so excited for my progress. Now only $2,600 to go...",https://www.reddit.com/r/povertyfinance/comments/es2pqy/paid_off_2_cards/,1262,Amazing job! ,2020-01-21 22:59:29
637,dz4sio,False,,270,"Hey broke lady's, I know the struggle of finding bras that don't cost an arm and a leg.",povertyfinance,"So over at r/abrathatfits. We a while back I asked them about where I could find bra sizes that wasn't +45 bucks per bra. And they sent me over to https://lingerieoutletstore.co.uk/

I've ordered three times from them and the bras are great good quality and they hold up, my last order I got 5 bras for around 70 bucks.

They do take a very long time to get to the US but they are worth waiting for at that price. (I do suggest playing a little more for the shipping. Cause that last order took a little over a month)",https://www.reddit.com/r/povertyfinance/comments/dz4sio/hey_broke_ladys_i_know_the_struggle_of_finding/,1709,I just buy the sports bras at Walmart. They are something like three for $15. ,2019-11-20 16:57:54
301,fawgdt,False,,175,"Never have I ever had 4 digits in a saving account of any kind. Starting saving mid-Dec 2019. Working a second job, donating plasma monthly and putting $100/month from my full-time job and just got my tax returns this week. Slowly making a dent in my debt and savings! It is possible!",povertyfinance,,https://i.redd.it/2fq7fn97poj41.jpg,3361,Should YOLO on options make real money ,2020-02-28 15:35:46
607,8k48nv,False,,75,I found a full time job!!!,povertyfinance,"Its at a call center which I am not a fan of and I am hoping this job Im interviewing for on friday for a warehouse goes through but its a job none the less!!!  After four years of treatment Im finally getting off SSDI (Bipolar II), Medicaid, Medicare and food stamps!  I'm still poor but I will be a fully fledged productive member of society again! 😀


Edit: Thanks to everyone for their kind words and updoots! :)",https://www.reddit.com/r/povertyfinance/comments/8k48nv/i_found_a_full_time_job/,1807,"Good for you, but probably 10 other people who wanted that job didn’t get it.  Capitalism
Is a nightmare and it’s almost like being happy another 10 families will continue to struggle to survive. ",2018-05-17 13:27:22
290,e2ez3a,False,,156,"Paid off 22k in debt, credit score up 150+ points... relieved is an understatement. You can do this.",povertyfinance,"I posted a while ago when we were at the halfway mark of paying off our debt. Today I finally made the last big payment. We are officially debt free. We had 22k in CC debt in January of this year. It’s been hard to see almost all of your hard earned money go toward those balances but I am SO relieved. My credit score has gone up significantly. We have a little money in our savings account. We can maybe even start thinking about buying a house in the next year or two. 

I had no idea how much the stress of CC debt was affecting me emotionally and physically. Thank you to the tips and tricks and also just support of this sub - it’s HUGE to know you aren’t alone.  Next mountain is student loan debt (20k) and our car (7k)....",https://www.reddit.com/r/povertyfinance/comments/e2ez3a/paid_off_22k_in_debt_credit_score_up_150_points/,3433,[removed] ,2019-11-27 11:46:59
612,evx3c4,False,,102,"I just got a $4,500 performance bonus and a $1,700 raise and it couldn’t have come at a better time.",povertyfinance,"I’m out of cards today so balance transfers. I have 11k in credit cards and one card with $4,400 on it. I’m going to use that bonus money to pay that card off.

October backtracked because over $2,000 of unexpected things came up. Slowly I’m digging myself out of this hole..",https://www.reddit.com/r/povertyfinance/comments/evx3c4/i_just_got_a_4500_performance_bonus_and_a_1700/,1777,[removed] ,2020-01-30 01:21:11
