Num,ID,is_Original,Flair,num_comments,Title,Subreddit,Body,URL,Upvotes,Comments,creation_date
761,fxlywf,False,Vent/Rant,311,Ever notice people get treated better when they are rich?,povertyfinance,"You might think I'm joking, but some types of businesses can literally smell the poor on you.

Walk into a dealership dressed in nice clothes and tell them you wish to buy a brand new $60,000 luxury car.

Now have your brother, cousin, etc walk into the same place dressed in Walmart clothes and tell them you want the $2,000 beater in the corner of the lot.

I can bet you 100% you will be treated like garbage.

It really pisses me off too, because I have worked in retail and service most of my life and treat people with the same level of respect regardless of how rich or poor they appear to be.

But I've noticed anytime I've bought a car, even at reputable large dealerships, I am talked to with much less formality and rushed out of there and have witnessed rich old boomers buying brand new Cadillac's treated like the Queen of England.",https://www.reddit.com/r/povertyfinance/comments/fxlywf/ever_notice_people_get_treated_better_when_they/,1329,Also they can smell when your “nice” clothes aren’t nice enough.  Like if your clothes are from Macy’s or Kohl’s. ,2020-04-09 04:40:53
306,97yz6o,False,,140,"We did it!! Took us almost a year to get to $1,000 and stay there. (we've gotten close and then had to empty it a few times) but we did it! And you can too!!!",povertyfinance,,https://i.redd.it/5q7l4b12qkg11.jpg,3328,[removed] ,2018-08-17 03:34:36
177,9tmr4b,False,,189,Worked three jobs last week and they all hit at once. It’s been a while since my account has looked this good!,povertyfinance,,https://i.redd.it/oekjcr6eoyv11.jpg,4749,"Curious what city you live in and age. Also your qualifications and skills, just wondering if I should be happy for you or sad, like for instance if your younger and just starting out in life your doing great or in a city with a poor economy also doing great, and some possible advice instead of working so hard/much at your jobs work less and work harder at getting qualified for a better job where you don’t have to work multiple jobs and so much much to make good money, just my 2 cents take it for what it is ",2018-11-02 18:32:11
135,ensjpj,False,,135,I never thought an email could make me cry.,povertyfinance,,https://i.redd.it/5r453cs8mea41.jpg,5672,[removed] ,2020-01-12 20:04:11
256,g1ppjy,False,COVID-19,233,"Literally as good as Christmas Day! I didn’t file taxes since 2018, and this just direct deposited without issue. So relieved.",povertyfinance,,https://i.redd.it/cttoyw0dpys41.jpg,3715,[removed] ,2020-04-15 10:51:42
536,ezw94l,False,,111,"If you have struggled with grocery shopping like I have, I cannot recommend the app Mealime enough",povertyfinance,"I really don't want to sound like some corporate shill, but I want to share this because it has helped me tremendously with my food budget. If this is against any rules, please take down.

I started using the app called Mealime in September and it has changed my life. It is a free app, I get it through iOS. You pick meals that you're interested in making for the week and it creates a grocery list for you. Then when you are ready to cook it gives you step by step instructions. It also has an option for picking meals together that use up the same ingredients, so you aren't letting anything perishable go to waste. The meals are using mostly fresh produce and they have the option to change preferences based off of allergies and foods you dislike. 

Before mealime I would have a really hard time grocery shopping. I didn't know how to shop for meals. Instead I would just get random stuff that I thought maybe could feed me throughout the week. Usually this was sweet potatoes and frozen chicken breasts. I would end up not getting enough food and eat out, spending through my food budget, getting depressed, and not feeling healthy. 

Since using mealime, I'm gotten my food budget for the week down to a science. I have favorite meals that I will use consistently, and sometimes i'll feel spontaneous and try something new. The meals sizes you can choose are 2 servings to 6 servings. I'm a single person so I do the 2. Sometimes I will cook for both me and my boyfriend or I will take leftovers for lunch the next day to work. I've noticed how much healthier I've felt, I actually like what I'm eating, I'm enjoying cooking, and I've saved so much money because mealime is forcing me to plan out my meals throughout the week. Usually I'll chose 3 meals for the week, then get a couple things I can make quick on days I'm not super hungry/short on time (Potatoes, quick soups, rice).   


Not sure if it would work super well for families, but for a single person like me it's been a lifesaver.",https://www.reddit.com/r/povertyfinance/comments/ezw94l/if_you_have_struggled_with_grocery_shopping_like/,2069,Thank you! I actually deleted it recently cuz I never got around to using it and wanted to reduce clutter on my phone. I’m going to give it another shot now ,2020-02-06 18:08:52
176,b3cdkx,False,,84,Feeling Rich,povertyfinance,,https://i.redd.it/ugjxtr4u5an21.jpg,4794,I dunno if I’m just not sensitive but I just buy the basic Scott paper. Works fine and lasts like 1 month/roll ,2019-03-20 14:01:10
578,egc58u,False,,82,I'm crying in relief.,povertyfinance,"It's payday today. Last week I started a second job to try to get a little more money to help ease my fear of being so broke I have to go back on the ramen only diet, twice a day. (That's where I was before I found this sub. Just ramen, no add ins.) 

I was told that even though I started mid-pay period that my first paycheck wouldn't be until next check. They were wrong. I had a deposit when I woke up this morning. 

I woke up Christmas morning and realized I would be short some hours on my paycheck because of holiday flight reduction (like 2 days/16hours short on my next check) and I panicked because that's when some of my larger bills are due. 

I also worried when first starting this job because I always fear I entered my direct deposit information wrong. 

It wasn't much, because I didn't have many hours when i started, but it was enough to ease my stress a bit. I'm just so excited and I needed to tell someone.",https://www.reddit.com/r/povertyfinance/comments/egc58u/im_crying_in_relief/,1906,You might appreciate /r/daveramsey. ,2019-12-27 15:01:30
810,883cqz,False,,149,"LPT: Never ""Post-Date"" Rent Checks To Your Landlord",povertyfinance,"Like most renters, I use to mail out my rent check a few days before the first of the month to ensure the rent check got to my landlord before the due-date.

Landlords in my town are notoriously scummy, so I would make it a habit to ""post-date"" my rent check for the first of the month to ensure it wouldn't be cashed before it was due. I thought this would work. I thought I was ""adulting.""

But I was wrong. A few years ago: two days before the first, I got an alert on my phone that my checking account had been overdrawn with a negative -$647.12 balance. Panicked, I checked my bank account only to find that my landlord has already cashed my rent check. ""That doesn't make sense,"" I told myself. ""There's no way he could have cashed it before the first. I wrote the first of the month on the check. Somethings wrong.""

So I called my bank's customer service number only to find out that my bank has honored the check and posted it to my account, overdrawing my account to the tune of a sweet $38 free. And trust me, back then, $38 was the difference between two weeks of cheap Top Ramen and two weeks of luxuriously baked spaghetti.

Contrary to popular belief, banks are under no legal obligation to the honor your request to postpone processing a check until the date written on a check. Even if you ""post-date"" a check for some date in the future, the payee can immediately cash the check upon receipt. Why? Once a check is signed, the check becomes legal tender and a bank can process the check at their discretion – even if that includes disregarding a check's written date.

The bottom line: Never write a check you an amount you cannot cash when you sign your name. It is up to the individual recipient of the check to honor the date written on the check. While there is a long-standing tradition of post-dating checks, there is no legal requirements for banks or payees to honor your request to post payment to a later date.",https://www.reddit.com/r/povertyfinance/comments/883cqz/lpt_never_postdate_rent_checks_to_your_landlord/,1163,I work at a bank. It is not legal to cash a check earlier than the date written on the check. Point blank. No discretion involved. Landlord either put a number behind the “1” or the bank teller simply missed it due to muscle memory. ,2018-03-29 17:50:24
735,cu3npq,False,,71,"Tired of seeing this, today is the start of change",povertyfinance,,https://i.redd.it/0aj7h3vse2i31.jpg,1437,"First thing...start paying on whatever is dropping your credit 91 points. That’s a huge drop. Something has got to be 30+ days late. Get that current asap. You can get with them and pay tiny payments, but anything to stop your credit from going lower.

Edit: 91 points not 97 ",2019-08-22 21:05:20
22,e6ih5d,False,,201,povertymarriage,povertyfinance,,https://i.redd.it/84mmbf81es241.jpg,18969,Or you could both get jobs? ,2019-12-05 15:11:39
708,gwheub,False,Debt/Loans/Credit,111,You are more than your credit score.,povertyfinance,"I’ve paid a few very old debts in recent days. My unemployment was delayed ten weeks and when it finally came through it was literally more money than I had ever had at my disposal in my entire life. I don’t think most people would consider the amount of money I received to be \*that\* much money. But it shook me a little.

Suddenly, with the snap of the government’s fingers, I was able to make a twelve year old debt disappear so I could get the piece of paper that proves I did in fact earn the bachelors degree I should have gotten when my now teenage son was a toddler.

Suddenly, I was able to repay two months’ rent on an empty apartment to the predatory property management company Premier. A company who makes a fucking killing exploiting tax breaks for providing “low income housing” that is substandard and still far too expensive for many of its residents. A company that regularly overworks and undertrains it’s property managers so empty apartments sit open and they get to extract profit from the most vulnerable in our communities instead of paying their workers to do the job needed swiftly and fill the damn apartment.

Suddenly I had the back up I needed to look at my credit report and call about an unknown $644 medical debt. To call my health insurance and see if they could help bring that down. To navigate the fucking labyrinth of people I needed to tell my story to in order to get the basic fucking information about how this debt was created.

Guys. I am EXHAUSTED.

I know that it’s controversial to say that when Black and POC folks are being literally fucking trampled. I’m not looking for sympathy. I will be ok. I just had to fucking write something just in case any of you find yourselves, like I did yesterday, just fucking drained after a day of phone calls that felt like whack-a-mole. I couldn’t figure out why I felt like I’d just been put through the fucking wringer but I think I know now.

Doing the work to repair one’s credit can be painful and difficult. It can be so hard that it is re-traumatizing. Living in poverty is trauma. Dealing with institutions that systematically make you feel less than and actively separate you from the resources you need to survive and thrive is traumatic.

A LOT of people are struggling financially because of the pandemic, but some of us have suddenly gotten enough money to make a dent in what was previously a hopeless cause — our financial well being. It was something so profoundly out of reach that we simply put it out of our minds. No amount of budgeting or sacrificing or side hustling was going to make the money we needed appear because that’s not how poverty works. You are so deep in the hole that getting out of the hole isnt even a coherent thought that makes sense. You’re just trying to keep the dirt from completely enveloping you. You’re just trying to keep breathing.

PLEASE — my internet stranger friends who are doing the hard work of requesting your credit report, of calling these collection agencies, of remembering the circumstances around why you couldn’t pay, of re-living the shame around not having enough money to protect your future self from debt — UNDERSTAND THAT THE STRUCTURES IN PLACE TO KEEP POOR FOLKS DOWN ARE MUCH MORE POWERFUL THAN A LIFETIME OF MISTAKES ANY ONE PERSON CAN MAKE.

There is nothing wrong with YOU because you do not have enough money to provide for yourself, your family, and keep some aside for emergencies.

I of course understand that there are exceptions — some people do squander their resources. But the vast majority of us poor folk try incredibly hard to live on an absolutely TINY amount of money. We sacrifice everything we can and then go deeper and sacrifice things we can’t. We have learned to put a wall between our own sweet, vulnerable selves and the SHAME of not being able to pay an important bill. We forget about it because we HAVE TO. We throw away the multi-colored 2nd and 3rd and 4th notices because we have NO OTHER CHOICE. We hang up on bill collectors because we literally do not have $10/month with which to bargain.

If you find yourself suddenly in a position to do the hard work of paying these companies that have fucked you over, or overcharged you, or that you don’t even fucking remember why you owe them money any more, and you find yourself overwhelmed, or anxious or confused and you can’t quite understand why you’re having such a large reaction to “just” paying a bill... I beg you, be gentle with yourself. Being poor is scary. It is stressful and painful and difficult. You are strong and brave and WORTHY of having ENOUGH.

We are not here on this planet to feel BAD about circumstances beyond our control. Pay those debts, and hold yourself gently while you do it. Take a day off between debts. Allow yourself time to decompress and grieve for an economic and legal structure that incentivizes those with money and penalizes those without. You didn’t create it and it’s not your fault that you are at its mercy. I see you. I’m here. If you need support, please reach out. You are more than your fucking credit score.

&#x200B;

EDIT: grammar",https://www.reddit.com/r/povertyfinance/comments/gwheub/you_are_more_than_your_credit_score/,1516,">THE STRUCTURES IN PLACE TO KEEP POOR FOLKS DOWN

I get that you're frustrated and have some real problems, but there are no structures in place keeping poor people down. none. 

if there were structures in place keeping poor people down, then Oprah Winfrey would still be living in poverty in Mississippi and Starbucks founder Howard Schultz would still be living in subsidized housing in Brooklyn and George Soros would still be living broke in Hungary after the Nazis destroyed his nation and Peter Lynch, one of the most successful investors in history, would still be living poor in Boston where the family barely scraped by after his father's death. 

only about 4% of Americans stay in the bottom 20% of earners for their entire adult lives. a majority of Americans are in the bottom 20% and the top 20%, only at different times in their lives. See Economic Facts and Fallacies by Thomas Sowell, a black economist. Over half of Americans are in the top 10% by income at some point in their lives, see Skin in the Game by Nassim Nicholas Taleb. Immigrants to America, who often face major language and cultural barriers, are about 4x more likely to become millionaires than native-born Americans. See Immigrant Edge by Brian Buffini, an Irish immigrants who became one of the most successful real estate agents in America. ",2020-06-04 13:26:41
313,cliog7,False,,190,"Some day, I will pay rent without being broke for the rest of the week.",povertyfinance,"Some day, I’ll pay rent without panicking and scrounging for $30 extra just to make it. And one of these days, I’ll actually have a savings account and won’t have to put my/my family/my pets health on the back burner just make ends meet.

Hopefully some day soon. It seems like literally no one else I know struggles as hard as me. It’s really starting to get to me, and I can’t keep up like this. I know I’m not a failure, but god damn if I don’t feel like one sometimes. I just wanna buy a new fucking outfit to make myself feel good without making it hard to pay bills. It hurts, and I’m constantly embarrassed by my financial situation. Fuck me.

Edit: I was seriously just feeling emotional off a $3 bottle of Aldi wine and venting about being broke and was not expecting so much support and good advice (and a silver lol). ily guys. One day we’ll all look back at our posts on here and be so proud of where we came from. You are not alone in your struggle. Keep grinding and make things better for yourself, everyone. You have tremendous power in your own life. Stay fucking positive.",https://www.reddit.com/r/povertyfinance/comments/cliog7/some_day_i_will_pay_rent_without_being_broke_for/,3259,"Not sure about the full picture but a lot of people that look well off are in serious debt. If you have low debt, you're already miles ahead/above of those folks.

Thinking about buying a new outfit to make yourself feel good seems like a dangerous line of thinking though (in that equating spending money for happiness leads to spending issues). ",2019-08-03 13:20:30
422,gx3z8n,False,Links/Memes/Video,119,Making fat bankroll off dividends from my local credit union,povertyfinance,,https://i.redd.it/0k6ukj8v83351.png,2559,"Why don’t we take all these piddly little dividends, pool that money and some random, lucky guy/gal wins $100 each period. Note— I got the idea from a planet money podcast years ago. ",2020-06-05 12:51:21
640,eq2x7c,False,,42,"Today is the day, thank you all",povertyfinance,"So I finally did it... I paid back my student loans today, I'M DEBT FREE!!!  

Thank you all for helping me through the low times, you may not know it but still.   Everyone else still working through the grind hang in there, feeling the weight off my shoulders is so much greater than i even imagined it.  Now I'm off to save for a down payment.",https://www.reddit.com/r/povertyfinance/comments/eq2x7c/today_is_the_day_thank_you_all/,1705,Congratulations! I know the feeling! We paid off my husband's student loan last year and are working on mines. The amount of money saved not paying for two student loans is liberating. I can't imagine what life would be like once mines is gone and our educational debt is completely gone. I can only dream. 🤩 ,2020-01-17 16:49:45
751,8cwzbf,False,,64,"LPT: When looking for a new job and you know a friend works at a large company you are interested in, don't just ask them to help you get a job or send them your resume. Instead, look at the company's opportunities listed on the company site and ask if they can help you with the XYZ posting you saw",povertyfinance,"I work for a large financial company. We are large. And people always ask ""can you help me get a job at MyCompany?"" As an entry-level, non-manager employee I have a little influence over who is hiring and very limited knowledge of all the groups and their job postings out there. I'm one of 25,000 employees in 1 department out of literally 100s. But I can still help you in the job you're interested in.

We have a wonderful referral program (as do many companies). If you go on to the job site, see a position you qualify for, and are reliable then there's no problem referring you to a different application link for that specific position. Every job has a code and all we need is that code. Can't promise an interview but they do put a different consideration on the application when being referred. That's how I can help. A lot of large companies work this way.
",https://www.reddit.com/r/povertyfinance/comments/8cwzbf/lpt_when_looking_for_a_new_job_and_you_know_a/,1378,[deleted] ,2018-04-17 14:35:20
705,hgzwck,False,Misc Advice,86,Half Christmas heads up for easy houseplant gift,povertyfinance,"It was halfway to Christmas this past week. If you had a hard time thinking of low cost gift ideas and have a bit of time this summer, this is the perfect time to get some cuttings off a houseplant or succulents (either your own or if you have a friend or relative with big healthy plants see if they will share). A cute little cactus or pothos or similar grown in a pretty coffee mug (50 cents to a dollar at thrift shops) on a sunny windowsill could be a nice gift for a coworker or plant obsessed friend this Christmas.",https://www.reddit.com/r/povertyfinance/comments/hgzwck/half_christmas_heads_up_for_easy_houseplant_gift/,1533,Or just gift them with your time and love not your money. Giving gifts doesn't equate to buying gifts. ,2020-06-27 19:35:07
509,a8h75t,False,,57,It feels good to be buying groceries for next week instead of tomorrow for once :),povertyfinance,,https://i.redd.it/yve811ixuq521.jpg,2184,I guess California sucks haha ,2018-12-22 02:56:41
687,ebg3w5,False,,35,"Just, this morning, made my last credit card payment!",povertyfinance,"I'm still waiting for the confirmation email, but I just paid my last credit card payment and I wanted to share it with someone because it's such a relief!

&#x200B;

I still have other debts to focus on, but having one out of the way helps me stay motivated to keep going!  I've been trying to focus on reducing my debt for about two years now.  Until recently, I simply wasn't making enough money to really make any progress toward my goals.  I was taking a ton of credits in school and paying for that out of pocket and, because of my school schedule, I was working a crappy job with flexible hours but garbage pay.  I started selling as much random old stuff as I could on eBay to make some extra cash.  Then traded in my car for a cheaper, more efficient car.  I found a better job, closer to home, with better pay.  I have also chosen to ride my bike to work a LOT (about 8 miles one-way), but it's getting incredibly cold/windy/rainy where I live so I might take a few months off of that!!  I will say, that time spent commuting by bike really helped my mental state in so many ways, I think exercise is so important, especially when life is getting you down because of things like finances.

&#x200B;

If you asked me this time last year if I would've been able to do all of this, I would've said no way.  I was drowning and though there was no way to get out.  I was getting so anxious about my debt that I couldn't sleep.  Some nights I would just lay awake and sweat profusely from the anxiety of it all.  But with little steps, I'm making progress!  Thanks for listening to my story/rant, I hope maybe it can help someone else who is where I was only a year ago!",https://www.reddit.com/r/povertyfinance/comments/ebg3w5/just_this_morning_made_my_last_credit_card_payment/,1594,Those are some random commas. ,2019-12-16 14:54:06
108,g55m9v,False,Links/Memes/Video,215,"In trying times like these, it's important to remember this advice",povertyfinance,,https://i.redd.it/qarijjmin2u41.jpg,6662,[removed] ,2020-04-21 01:13:47
501,8na4e6,False,,163,I turned down a job that would have started at $17 an hour,povertyfinance,"Which would have seemed insane to me 2 years ago but it feels so good to be in a position that I can actually turn down jobs that seemed unreal to me before.

My current job pays $15 an hour plus I average 4 hours of overtime each week, so after doing the math I realized I would actually be taking a slight pay cut if I took the new job working a straight 40 hours a week. Factor in that I would be driving more than twice as much plus an unpaid lunch vs getting a paid lunch now and I'm actually better off where I'm at.

Just over 2 years ago I was working for minimum wage, 6 months ago I was unemployed completely after getting laid off and borderline suicidal. I stopped smoking weed so I could get my current job, which was really hard for me but proving to be worth it. I guess I'm posting this just to say that things can always get better when they seem the worst and to not give up hope even when things seem hopeless like I almost did.",https://www.reddit.com/r/povertyfinance/comments/8na4e6/i_turned_down_a_job_that_would_have_started_at_17/,2214,For anyone out there...go into sales i make 80k a year selling cellphones LOLLLLL ,2018-05-30 16:46:55
