Num,ID,is_Original,Flair,num_comments,Title,Subreddit,Body,URL,Upvotes,Comments,creation_date
752,hdy8gz,False,Income/Employement/Aid,46,PTO requested. PTO approved. PTO used. PTO denied a week after the fact. Is that even legal?,povertyfinance,"PTO was approved, and I spent the day at home watching my kid due to lack of available childcare that day.  Now, I am being told that I can't use it because it would bring my hours for the week to over 32.",https://www.reddit.com/r/povertyfinance/comments/hdy8gz/pto_requested_pto_approved_pto_used_pto_denied_a/,1373,[removed] ,2020-06-22 18:49:17
230,b4l623,False,,118,Baby steps. The first two are often the most difficult for us.,povertyfinance,,https://i.redd.it/huvsb6lecwn21.jpg,4044,"Holy shit, so many fucking loans. ",2019-03-23 16:37:11
929,8jflg4,False,,104,"If you have kids and are worried about paying for college (or your kids incurring debt), work for one that offers free tuition to your kids as a benefit.",povertyfinance,"I just found out my friend, who got a job as a janitor at a very good, very expensive college, will have free tuition for his kids if they get in.  That amounts to $200k per 4 year degree.  ",https://www.reddit.com/r/povertyfinance/comments/8jflg4/if_you_have_kids_and_are_worried_about_paying_for/,858,[removed] ,2018-05-14 20:29:54
31,f1wbpv,False,,453,This single mom works two jobs and has a bachelor's degree. She wants lawmakers to know poverty is not about being lazy. (Reposted from r/videos),povertyfinance,,https://youtu.be/-ptHavHrDuE,15638,[removed] ,2020-02-10 20:28:16
8,e8zd2f,False,,634,"Just wanted to share my happy news. After ten years of a mattress and box springs on the floor, I finally have a bed!",povertyfinance,,https://i.redd.it/eej3bpdvew341.jpg,32244,10 fucking years? Bed frames do not cost that much. And FUCK YOU REDDIT! ,2019-12-11 00:26:08
461,asp9fu,False,,120,Beginning of the year my balance was $5K. I saw a post saying something along the lines of “a savings isn’t a savings if you have debt” with the help of my tax return and my entire emergency fund I’m debt free.,povertyfinance,,https://i.redd.it/ipkx8grkmqh21.jpg,2393,"This sub has turned out to be very disgusting
 ",2019-02-20 14:58:43
889,drgmbc,False,,112,Marshall's is a good resource for cheap shoes,povertyfinance,"I've seen a few posts about people looking for cheap high quality shoes, and I just wanted to share my results.  I've bought my last 2 pairs of shoes at Marshall's.  The first pair cost $8 a couple years ago and the second was $16 this weekend.  The first pair are essentially knockoff Converse All Stars from Lugz, and the second pair are similar but from Tommy Hilfiger. 

I don't need new shoes right now, but now I don't have to worry about finding a deal when my current pair eventually wears out.  I check the local Marshal's a couple times a month just to see what big sales might be going on.  Usually the really cheap shoes are down to the last pair and are the wrong size.  Marshall's is a good resource for super cheap business casual clothes too.",https://www.reddit.com/r/povertyfinance/comments/drgmbc/marshalls_is_a_good_resource_for_cheap_shoes/,945,"I'm seriously unsure how anyone's shoes wear out? I haven't had a pair of shoes actually wear out since I skateboarded in high school. What are you guys doing to your shoes!?

Edit: I guess the common denominator here is probably cheap shoes as well. \*insert quote about poor people staying poor because of cheap shoes wearing out or whatever ",2019-11-04 11:58:50
436,g0ucd8,False,,188,Just in time 😎,povertyfinance,,https://i.imgur.com/A3wyYY1.jpg,2503,It figures the government gives us money and I don’t have a current bank account or taxes filed for the past like 2 years. Oh well. At least I’m essential enough to work through this. ,2020-04-13 23:36:07
454,9zjt04,False,,47,"When my grandmother was born, the bank gave her this little bank to put loose change in and when it was full, you took it to the bank and the teller had the key to unlock it and deposit the coins. I think you guys would like this saying",povertyfinance,,https://i.redd.it/jup7qlt2fzz11.jpg,2442,It’s a shame banks don’t take coins anymore though :(. But your grandma has a real opportunity here and it’s great to see! ,2018-11-23 01:18:18
236,fqzzng,False,COVID-19,78,12 million elderly or disabled Americans rely on food stamps. COVID-19 risk prevents them from accessing grocery stores to use their food stamps. Sign this petition urging Congress to expand online food stamps nationwide,povertyfinance,,https://www.change.org/onlinefoodstamps,3913,"Nah, let it burn through... we'll be clear by Easter /s ",2020-03-29 04:40:13
930,cqueey,False,,20,"I've worked three jobs for the last few years. I finally got this message. Thanks for your support, all.",povertyfinance,,https://i.redd.it/wb6z7jv9vng31.png,855,Great work! Keep it up! ,2019-08-15 19:07:46
197,d666at,False,,491,Outlining a paper that asked about family finances growing up. My family couldn't have been the only ones to do this right?,povertyfinance,,https://i.redd.it/kwztt4ot2gn31.jpg,4446,That’s literally skim milk ,2019-09-19 00:23:52
184,gxqp86,False,Links/Memes/Video,75,Ignorance is bliss,povertyfinance,,https://i.redd.it/fllfjgmcha351.jpg,4612,You must be my wife. ,2020-06-06 13:09:30
57,b09jhh,False,,465,Has anybody else just ignored car troubles out of sheer poverty?,povertyfinance,,https://i.redd.it/leguy48dppl21.jpg,9407,[removed] ,2019-03-12 16:09:05
200,gekxe4,False,Vent/Rant,586,Finally had to leave r/personalfinance,povertyfinance,"If I saw one more post of ""I only have $80,000 in savings, ugh, what do I DO with it??? :("" I was gonna lose my entire mind lmao",https://www.reddit.com/r/povertyfinance/comments/gekxe4/finally_had_to_leave_rpersonalfinance/,4406,Give it to someone who knows what to do with it? I know what I'd do with it. ,2020-05-06 14:22:58
219,emv26j,False,,160,"Just moved across the US, started a new job, and cut my bills In half after getting clean and not touching drugs. If I can do this, you guys can too!",povertyfinance,,https://i.redd.it/tfzpcbowvz941.jpg,4140,[deleted] ,2020-01-10 18:31:37
798,beznvl,False,,200,Don't be loyal to your car insurance. Just saved $1000.,povertyfinance,"I live in a state where car insurance is mandatory. A few years back I was unemployed and completely broke. Like -$200 to my name. My car insurance was canceled and a few months later when I was working again I was trying to get insurance. The fact that I had lapsed for so long made it nearly impossible to get insurance. Finally I was able to get [Company A] for around $190 a month. Recently I got a different car. I paid $500 cash for this car. I switched it over on my car insurance and they upped my policy to $300 a month. I called to find out what happened and tried to negotiate. I ended up bringing it down to around $250 a month or $1490ish every 6 months. I told them it was still unacceptable as I don't want anything more than the absolute basic coverage. In two months I would have paid as much in insurance as I paid for my car. If my car gets hit to the point of being non functional I am junking it. It's nearly 20 years old. 

Anyway I started shopping around and ended up switching to [Company B]. I got basic coverage through them and it ended up only costing me $487 for six months if I paid up front (around $600 if I paid month to month). I don't have a lot in savings but I felt this was a good reason to use some savings funds. The idea that I'm going to saving nearly $200 a month is a good feeling. Even compared to my old policy I'm saving around $100 a month. I feel silly for not switching earlier. 

TL;DR: Insurance company jacked up my policy to nearly $1500 every 6 months, shopped around and was able to get a policy for around $500 every 6 months. 

P.S. be prepared to get a million emails and phone calls if you put your information into any sort of car insurance quote site.",https://www.reddit.com/r/povertyfinance/comments/beznvl/dont_be_loyal_to_your_car_insurance_just_saved/,1194,I pay like 180 a month for car insurance. Haven’t gotten into any accidents since I bought the car a year back. Great I wasted over 2000 dollars for no benefit. Insurance is a complete scam. ,2019-04-19 14:22:08
825,bqa0w0,False,,40,Too true,povertyfinance,,https://i.redd.it/cqe5phznw0z21.jpg,1143,Traveling by plane or automobile is pretty immoral now considering all we know about its devastating effects on climate change. So is eating meat. ,2019-05-18 23:10:01
626,cc1396,False,,48,"My last collections account finally got removed from my credit report, still a long way to go but it’s a start!",povertyfinance,,https://i.imgur.com/8jjSVGT.jpg,1758,How did you get it that low? ,2019-07-11 20:47:10
277,bsvetl,False,,387,Rant: I paid off my car and student loans and my credit score tanked,povertyfinance,"US Specific Rant: I completely wiped out my student loans and car note this month. I worked so fucking hard to make it happen, it took so much time and dedication, and how do the credit bureaus recognize this hard work? Tanking my score over 30 points! 

&#x200B;

In a system that thrives on people being chained to debt their whole life, I'm not sure why I'm so shocked and disgusted. But I'm both. Fuck the American debt system.",https://www.reddit.com/r/povertyfinance/comments/bsvetl/rant_i_paid_off_my_car_and_student_loans_and_my/,3511,Love the way Americans get shocked by Chinas new credit system but are completely crontrolled by the Jewish one ,2019-05-25 14:58:38
657,fj5cxt,False,COVID-19,63,I do not know if this applies to all areas. Our area schools are shut down for 2 weeks. YMMV but it's worth a try.,povertyfinance,,https://i.redd.it/vpqcyyypkvm41.jpg,1671,Ugh we had an announcement of all schools and daycares closing. Rumor its closed until September. ,2020-03-15 17:55:32
124,ctjra8,False,,106,goodbye forever!,povertyfinance,,https://i.redd.it/oit85pvh3uh31.jpg,5991,and next year Bernie Sanders passes an executive order eliminating all  outstanding student loan debt HAHAHAHAHA ,2019-08-21 17:07:43
683,87xdba,False,,102,Happy 24 hours /r/povertyfinance!,povertyfinance,"It's officially been one day since this sub was made!  We already have 61,218 subscribers!  Amazing!  Keep up the good work everyone! ",https://www.reddit.com/r/povertyfinance/comments/87xdba/happy_24_hours_rpovertyfinance/,1607,"What? wow, its amazing that this is so new and so popular :p ",2018-03-29 01:23:52
685,flxm30,False,COVID-19,47,Burger King to offer free kid's meals during coronavirus pandemic,povertyfinance,https://www.usatoday.com/story/money/food/2020/03/19/burger-king-offer-free-kids-meals-during-coronavirus-pandemic/2878859001/,https://www.reddit.com/r/povertyfinance/comments/flxm30/burger_king_to_offer_free_kids_meals_during/,1601,Why is BK even open!? We’re so screwed ,2020-03-20 16:11:15
59,d2vw65,False,,182,Tomorrow is payday. This is the most I've ever had in my account the day before payday.,povertyfinance,,https://i.redd.it/gr0bzbkyr0m31.png,9355,"Is a ""Checking"" account one that you're supposed to check often? Or is it just a misspelling of ""chequing""? ",2019-09-11 19:52:03
610,gkvadi,False,Success/Cheers,47,I finally have an emergency fund!!,povertyfinance,"I am 22 years old and have been on my own for years struggling to make rent from shitty check to check jobs. 

Over the last 3 months I have gotten better employment and have managed to save some money, Finally!!

I feel 1000 lbs lighter. I feel like the shit can hit the fan and I won't freak out, I can cover it. Flat tire? Gotcha. Fridge gpes out and ruins all my food? I'm not gonna starve. Get sick and have to take time from work? I have an extra paycheck saved just in case of that. 

I found when I plan for the worst, and expect the worst, when something less than savoury happens I have the tact to handle it with grace instead of letting it ruin my day, week or month.",https://www.reddit.com/r/povertyfinance/comments/gkvadi/i_finally_have_an_emergency_fund/,1788,Step 1 baby step complete! Gratz and keep it up ,2020-05-16 14:12:45
596,cix2u2,False,,302,I'm making $13.50 per hour with an Aerospace Engineering degree. Need advice. It's really stressing me out.,povertyfinance,"I already posted this on 2 other subreddits and everyone has been of great help since I was keeping this to myself but the stress was too much and I wanted to talk to someone. 
And as someone who is an avid looker here on Povertyfinance, I wanted to hear your advice.

Long story short, I have an Aerospace Engineering degree with 1 year experience with the current company I work at. I started in production not working as an engineer but as a production employee, then moved to another position as a technician assistant operating HAAS machines, then to the office to work in the quality department as an administrator.
So far my hourly rate is $13.50 per hour. I haven't had a raise in a year or when I was moving up positions. I understand that it's really low for engineers but I had to take that offer last year because I had no experience. 
The company where I work at is currently having some slowdown in production but will eventually be more busy in the upcoming months. 
Should I wait a couple of months more for things to start picking up again or should I do it now? Not sure when it's the right time to do it since it's my first job out of college as an engineer. I have been given more responsibilities around the office as people have seen that I have the skills to do whatever they put me to do 

I currently live in California and not working as an Aerospace engineer but as a Quality administrator.


I love what I'm doing and my colleagues are awesome. Just the pay is what is really killing me since everything in California, especially in Orange County is really expensive and it's really frustrating and depressing. I can't relocate because I need to help my family. I'm single but I'm helping my sister who is a college student and parents who are of old age.

Edit: Im single currently live in California with an Aerospace Engineering degree. Currently not working as an Aerospace engineer but as a Quality administrator making $13.50 per hour. Best time to ask for a raise?

Edit: thank you to everyone who took the time to read my post and for your feedback. There was a lot of positive feedback and I am trying as fast as I can to reply to your messages. Thank you so much and I will keep you guys updated! :)",https://www.reddit.com/r/povertyfinance/comments/cix2u2/im_making_1350_per_hour_with_an_aerospace/,1843,[removed] ,2019-07-28 15:22:47
547,cil594,False,,183,One week of not buying anything at all! 7 things I chose not to buy this week.,povertyfinance,"I made it successfully for one entire week of not buying anything.

It was enlightening. Heres the top 7 things I did NOT buy

1. Number one thing i wanted to buy, but did not need, was.... ALCOHOL AT BARS. Approximate total that I would have spent was $36. I did make myself many mystery cocktails this week using what was in my bar at home.

2: SNACKS. I used a few recipe sites to find out what I could make at home usong whats already in the cupboards. Turns out, it was A LOT.

3: ice cream. I have a thrifted ice cream maker. I had eggs. I had sugar, milk, and just a smidge less cream than the recipe called for, but this is easily the best ice cream Ive ever made anyway.

4: Uber rides. I walked. I realized most of my rides were under 2 miles. So i walked. I lost 2 lbs this week and saved about $30.

5: cat toys. I spent an hour  hot gluing the feather toys back together and my cats did not notice they were not new.

6: laundry: i have a portable washer. I hung my clothes to dry. Laundry was free mc free all week.

7: books and movies: HELLO LIBRARY!!

ZERO ZERO ZERO DOLLARS.

These are just the 7 things I repeatedly wanted to buy this week... but chose not to buy.

A list of the nonrecurring items of thing I WANTED to buy is fucking stupid, but heres a sample:

UV light for cat pee (just used my nose for free), a laser automatic cat toy (i got a laser on my keychain, and i am not that lazy), a swimsuit (still gonna buy this, but I will shop arpund for prices), a proper bread machine (i have one from a thrift store, but it only does 1 setting. I will check other thrift stores for a multi setting bread maker).

I feel personally so gratified to see a gap in my online bank statement between july 18 and july 24th  with zero debits.

Try going 3 days without buying ANYTHING. Nothing. It just kind of forces you to re evaluate your stuff.

Edit: i need better glasses, edited. Edit2: need to learn to format better but its fixed now.",https://www.reddit.com/r/povertyfinance/comments/cil594/one_week_of_not_buying_anything_at_all_7_things_i/,2032,What's a portable washer?? ,2019-07-27 18:36:29
93,gpstkm,False,Housing/Shelter/Standard of Living,439,My boyfriend and I just bought our first appliance that wasn’t secondhand. Neither of us have ever owned anything this nice. We’re so excited.,povertyfinance,,https://i.redd.it/tzj04zqcrq051.jpg,7125,[removed] ,2020-05-24 16:41:41
493,d434mx,False,,269,"Finally, set my first $2 aside! Really though, going through unfortunate time right now. Just need some good vibes",povertyfinance,,https://i.redd.it/do5ospr95jm31.jpg,2248,Wells Fargo? WTF ,2019-09-14 09:38:45
694,hr0cxn,False,Success/Cheers,151,I made it out of poverty.,povertyfinance,"Not to say I don't still struggle with certain things, poverty spend mindset is a killer. But I've never missed a rent payment, I have always been able to pay my bills and buy clothes and food. Some months I'd have nothing left over from spending superfluously. But I wasn't in poverty anymore.

I have had to deal with my personal monetary issues and learn the value of money because no one told me when I was young.

When I was a kid, my mom got 800 dollars from social security, 400 in ebt and 400 dollars a month.She was a raging drug addict and it got worse the older I got so she would end up spending all of her money on drugs and sell her food stamps for 70 cents on the dollar. She was abusive and to top it off the rest of our family was rich. It was just her. We lived in a shitty trailer park.I remember understanding that I was different from the rest of my classmates, I would show up to school in clothes that didn't fit and were full of holes because they were hand-me-downs and all the kids would make fun of me and tell me I smelled like cigarette smoke constantly.

A lot of the time school lunches were the only meal I was getting. My elementary school would give me bags of clothes, coats for winter and stuff like that, I didn't realize for a while that this wasn't something normal.I couldn't go on class trips, sometimes my mom would be too konked out to sign the waivers or we didn't have enough money.I was truant in school because I was worried my mom was going to die, so I would ditch.

Everyone could see that something was wrong.My mom got cps called on her 5-6 times growing up, she would teach us what to say and said that if we told the truth, we would go in foster care and get molested. So we lied and said everything was fine. I hate that I didn't say anything. But I was scared.On my 10th birthday, my mom got so mad at me that she threw pots and pans at my head.I hate my family for never helping. I hate my family so much. I hate them for being rich and entitled and letting us suffer all the while talking shit about us.

But I made it, when I was 16, my mom and I got in a huge fight. She wanted to smash my xbox because I never left my room and I told her that the xbox was a better mother than she would ever be. She called my sister and told her to take me. Thank god.I then spent time living with my sister then moved out when I was 18.

It's been a bit rocky, I have cptsd, anxiety disorders and major depressive disorder so that makes it harder on me. But recently I got an amazing job opportunity, it's QA testing for a big game company, it ain't fancy but it pays really well. I live with my fiance and we just got an apartment together.

It's gonna be a battle but after big important purchases, like a new bed and stuff. I'm going to boost my savings and save for a trip to japan with him.

I made it out, you guys can too.If you have any specific questions or want advice if your situation is or was similar, I will help. I learned a lot of wisdom and I think I have advice to give, may not be the best advice, but maybe I can help.

Thank you.

Also I still have that xbox to this day. Still a better mother than she was.  


Edit: I didn't expect this to gain any kind of traction and the fact that it has, has gotten me a little whoa o:  
I wanna reply to all of your comments, and I will. It'll just be taking me some moments.  


Thank you all for the kind words and for your interest, I have laughed and also cried. I appreciate you all and if you have any specific questions on how I do things or accomplish things, please ask and I'll do my best to answer.  
",https://www.reddit.com/r/povertyfinance/comments/hr0cxn/i_made_it_out_of_poverty/,1570,[removed] ,2020-07-14 12:12:05
331,gjqrl2,False,Success/Cheers,105,I’ve paid off one of my credit cards. Only two more to go!,povertyfinance,,https://i.redd.it/faqba0yylry41.jpg,3120,Are shredding the card? ,2020-05-14 17:25:12
809,8g3isf,False,,49,It never hurts to ask....even if you don't know you are asking.,povertyfinance,"I am trying to make my home more energy efficient and had looked into having foam insulation blown into my attic. I had a couple of estimates but they were out of my budget. (House built in 1952, literally no insulation in my attic, just dust) I was looking on my city's website and saw that they offered a weatherization program for low income families. I printed off everything, filled out the forms, made copies of the required information (i.e.: ID, birth certificate, utility bills) and mailed it last week. 

I just got a call from the city and the lady I spoke with said she had received my application and asked if I was just needing help with my electric bill. I explained that my bill isn't high, yet....summer is coming and this is Texas....lol, but that I was actually trying to get assistance for having insulation blown in my attic and just weatherizing my house in general. She said that she saw that I signed that form and that she would be sending it to that department as well....but, that I would also receive assistance with my electric bill and they would send me a letter to let me know what months they will pay and how much they will help pay!!!! 

I was BLOWN away....I had to confirm with her that not only was someone from the electric company going to come out and do an energy review for weatherization but that I was ALSO going to receive some help with my electric bill!!
She said yes and also wanted to let me know that the weatherization appointments can be as long as 8 months out because of how backed up they are. I told her I understood and thanked her profusely.

Just wanted to put this out there for people. I've been in my house for almost 20 years and had no idea that this program existed in my city. :)",https://www.reddit.com/r/povertyfinance/comments/8g3isf/it_never_hurts_to_askeven_if_you_dont_know_you/,1170,[removed] ,2018-04-30 22:28:06
137,eix1kn,False,,739,ALDI legitimately changed our lives,povertyfinance,"No joke, we went from spending almost $300 at Walmart or Kroger every week for 2 adults and a toddler to $160 at Aldi. The produce is so much greener too, meat is always fresh. Seriously, cannot be overstated enough how amazing this place is by literally saving me like $7000+ a year.",https://www.reddit.com/r/povertyfinance/comments/eix1kn/aldi_legitimately_changed_our_lives/,5660,"Nice try Aldi PR DEPT

Here in the UK Aldi have made a big impression on the market.
But I have to say I think there business model sucks.
Every corner is cut to maximize profits, they seem cheap but cost per kilo is often not dramatically different from the budget ranges from the other supermarkets...sometime more expensive.
Quality is definitely an issue...which is why the focus on it in advertising.
Staff worked hard.
The shops stock limited range so consumer  choice is restricted.
Fewer staff....smaller shop...limited choice...poorer quality....
It is not about cheaper food for the masses. it is all about maximum profit for the company.
I absolutely know I can feed our family for the same cost at a number of other supermarkets, I refuse to be sucked in to the Aldi swindle. ",2020-01-02 11:19:06
348,e1j6v2,False,,218,PSA: You can shop at Costco with nothing but a Costco gift card (no membership required!),povertyfinance,"If you want to shop at Costco occasionally but can’t afford the membership, all you have to do is find a friend or family member with a membership and have them buy you a stack of $10 gift cards. Every time you want to go to Costco, you bring in one of the gift cards and show it to the person at the door.

Depending on the store they might have you stop by the membership desk, or just let you in. Then at the register, you pay for $10 of stuff with the gift card and the balance with cash or credit.

As far as I know, this works for every Costco in every state – it has to, otherwise Costco gift cards wouldn’t really work as gifts.",https://www.reddit.com/r/povertyfinance/comments/e1j6v2/psa_you_can_shop_at_costco_with_nothing_but_a/,3034,They can just buy you one gift card and you buy another one each time you pay. ,2019-11-25 17:20:38
