Num,ID,is_Original,Flair,num_comments,Title,Subreddit,Body,URL,Upvotes,Comments,creation_date
373,gdirxs,False,COVID-19,172,Thankful for black beans and jasmine rice today!,povertyfinance,"Money has been tight for me, like it's been tight for everyone I imagine. I have had to go without eating for a couple days at a time due to lack of funds. My last trip to the food bank, I was given 5 cans of black beans, a bag of jasmine rice, a loaf of bread and a box of knock off frosted flakes. That's how low of a quantity things have gotten. But I didn't complain, said thank you and went home.

Today I cooked. Plain jasmine rice on the stove and a can of black beans  with some salt, pepper, paprika and Adobo seasoning. Mixed the beans and rice together and sprinkled some shredded cheese on top. It isn't the greatest tasting thing, but it filled my belly up and it's one more day I don't have to worry about what I'm going to eat. It's the little things to be thankful for right now.",https://www.reddit.com/r/povertyfinance/comments/gdirxs/thankful_for_black_beans_and_jasmine_rice_today/,2883,Jasmine rice taste like pure chlorine to me ,2020-05-04 19:53:53
50,enfbvz,False,,299,"It’s been 22 days since I paid off my debt and it doesn’t feel real. I’m still anxious about any small thing driving me into debt again, or making bad decisions, and I don’t trust my bank account. But I’m getting better, today I made some progress. Here’s a pic of me feeling genuinely secure :)",povertyfinance,,https://i.redd.it/4qiedz22j8a41.jpg,10463,[deleted] ,2020-01-11 23:35:38
520,eilaxm,False,,69,For. the first time in 6 plus years i am not in debt,povertyfinance,"Payday loans really fucked me up all  those years

But for the first time i am debt free  now i can manage to pay rent on time, buy enough food.

Happy i got a new reliable car

Really looking foward to 2020",https://www.reddit.com/r/povertyfinance/comments/eilaxm/for_the_first_time_in_6_plus_years_i_am_not_in/,2139,Congrats to you!  I hope to pay off my debt this year.  Last year my car died so I had to buy another car (paid it off cash though and it's more reliable than my old car). ,2020-01-01 18:00:31
393,f1fo7x,False,,78,Got this at a local food bank. 😁,povertyfinance,,https://i.imgur.com/djzDPaA.jpg,2739,"lol, yuck. only true rice is sticky calrose rice ",2020-02-09 21:43:37
519,fpq3jb,False,Links/Memes/Video,77,Oh lord I feel this too much,povertyfinance,,https://imgur.com/aTVVYh7,2142,In the US all Corona testing and treatment are paid by the Federal government. ,2020-03-27 03:49:11
357,cybt9s,False,,168,"Browsing this sub, noticed a common thread. Some advice.",povertyfinance,"I have started browsing this sub recently and noticed a common thread. I see people who get into financial trouble or lose their job when their car breaks down and they cannot afford the repairs. I have been in the automotive repair business for 15 years and often try my best to help people who are financially stricken. I can offer free advice on how to make repairs yourself to get you back on the road. I regularly service and have in depth knowledge on vehicles of all makes and models (barring exotics). I can tell you how to replace timing belts, CV shafts, wheel bearings, diagnose misfire, ect. Unfortunately, my advice is U.S. centric since that is the market I am familiar with. If someone wants to attempt a repair themselves, I can walk them through the steps and tools required. I started off repairing vehicles for students at a nearby college campus in a Walmart parking lot so I am aquatinted with roadside repair work.",https://www.reddit.com/r/povertyfinance/comments/cybt9s/browsing_this_sub_noticed_a_common_thread_some/,2992,[removed] ,2019-09-01 16:09:05
113,ecmk36,False,,162,It’s worth a shot.,povertyfinance,,https://i.redd.it/j62w52qu1i541.jpg,6492,"You should only do this for debt that doesn’t belong there. If you owe the money and do this you are committing fraud, pay you’re bills when you have the funds to do some don’t run away from debt that you owe. ",2019-12-19 02:16:21
338,ciadf3,False,,59,"I’m seventeen, grew up in poverty and likely gonna be homeless in a couple months. After saving for six years, I opened my first independent bank account with a balance of $700!",povertyfinance,"Super stoked. I’m dual enrolled in high school and community college, so I was able to open a college account without a parent co-signing. I’ve been stressing about money my whole life. It feels really good to have it all safe and in one place - six years of birthday money, selling old clothes, tutoring, and lots of odd jobs and miscellaneous bets. I know it’s not enough to subsist on my own, but I feel much better with something to lean on.

Edit: thanks for the kind words, everyone!",https://www.reddit.com/r/povertyfinance/comments/ciadf3/im_seventeen_grew_up_in_poverty_and_likely_gonna/,3064,"official kudos well done on saving, be advised a hand job in Indiana will get us 50 bucks and sex is like 100 if ur um looking to survive on a single income... ",2019-07-26 23:44:40
503,9pl0hn,False,,146,"I'm not out of the woods yet, but my credit score has gone up 124 points in the past year. When things get tough, focus on your positive progress.",povertyfinance,,http://i.imgur.com/KgO8y8e.jpg,2212,Why do you care about your credit score? ,2018-10-19 15:44:34
525,ai8sip,False,,145,Just got a job that pays me 17.50/hr,povertyfinance,"I’m really happy I’m a  21 year old  college drop out when I got the opportunity to work for a molding company. I’m making 17.50/ hour working 40 hours a week I’m finally able to pay my bills and have some money left over 

Edit:Wow I didn’t expect to get some silver! Thank you so much 😁😁",https://www.reddit.com/r/povertyfinance/comments/ai8sip/just_got_a_job_that_pays_me_1750hr/,2124,"Nice going there.
I making just £8.25/h, but thats 2.5x more than i used to get in my first job,  but its still at the bottom and someday į wish to get above 15/h. ",2019-01-21 10:11:25
899,88igws,False,,101,Should we make a r/poverfinance recipe book in the wiki? How to eat on the cheap?,povertyfinance,"When this place was first created, and everyone mentioned moving over from r/personalfinance, someone mentioned how frustrating it was to see someone asking how to save more money on their $100k annual salary when their problem is they have $3.75 in their bank account until Friday and want to know how to feed their family for the next week. 

Should we put together an r/personalfinance cookbook or recipe book of cheap meals we can link in the wiki? Meals for under $5? A quick search on reddit doesn't show any budget meal subs, so maybe create a sub under this one? r/povertyfinancemeals ? Is this something people would be interested in?

ETA: sorry for the typo in the title, can a mod edit?",https://www.reddit.com/r/povertyfinance/comments/88igws/should_we_make_a_rpoverfinance_recipe_book_in_the/,924,"You can use blue aprol for cheap on-the-go recipes, costs nothing at all except getting your ingredients together.  I don't know what I'd do without it. ",2018-03-31 13:01:12
499,eolqoe,False,,225,I feel like everyone I told is incredibly unimpressed with me,povertyfinance,"But I'm very happy I actually have a four digit number in my savings now!!! 

I'm healthier as a result too, I only buy from the farmers market for my groceries and stay away from junk food! I only go into the city once a week for said farmers market, I walk to campus everyday and avoid using PTV and enjoy the stroll past the park and see cute dogs and enjoy nature 

Instead of loitering outside, I spend more time experimenting in the kitchen (I made a loaf of bread!!!), I read and write more, I've become more introspective and my cats bask in my more constant presence :) 

I know my username says NEET but I am working lol I just feel like a NEET since most times I feel a bit aimless haha but time is precious and I'm happy to be this productive and peaceful and also finally letting my wallet breathe!",https://www.reddit.com/r/povertyfinance/comments/eolqoe/i_feel_like_everyone_i_told_is_incredibly/,2235,"I work with people that are routinely making 90k to 130k and many of them have wives that have jobs also.  You might be amazed at the number of them that cant scratch together $500-$1000 for whatever issue comes up and then complain about how they can't stop buying things.  They have new cars, big houses and they are fucking broke. ",2020-01-14 14:10:03
870,8x1tp0,False,,158,"[Advice] [NV] If you have children, apply to the WiC program. It'll provide you with basic foods like milk, eggs, and cereal. It can make the difference between paying bills and eating.",povertyfinance,"In Nevada, the local WiC officrs are usually by the health centers.",https://www.reddit.com/r/povertyfinance/comments/8x1tp0/advice_nv_if_you_have_children_apply_to_the_wic/,989,"I used WIC with our first child while I was breastfeeding (3 years ago). We had a.difficult time with using it. I qualified for $10 for fruits and veggies but at the register it wouldn't accept fresh fruits and veggies only frozen or canned. And I could only purchase tuna fish no there meats/seafood. And, only qualified for sugary fortified cereals. It wasn't helpful until my kid turned 1 year and was weaned off of breast milk. And it still wouldn't let us get soy milk for her which had more iron. But it was helpful for baby food. 

I'm thinking about going back on it but it was more of a pain to go sit in the office for 2 hours to receive a small amount of food and food that we don't need. Seriously, I was able to get 10 cans of tuna per month. No one should eat that much tuna a especially pregnant women bc of mercury. ",2018-07-08 14:34:25
947,8hq3li,False,,111,Preparing For A Baby: A Single Mom's Guide,povertyfinance,"At the end of 2015. I found myself pregnant with my now 20 month old son. It was not planned, I was not in a position to rely on my son's father, and I've always been poor. I did have a full-time job, a beater car, and an affordable rental home but almost no cash or resources to spare in preparing for my first child. I thought I'd write up a post that may help other women (or fathers/couples!) in a similar situation and explain some of the things I did or learned along the way that really helped me. 


1) I applied for pregnancy Medicaid. I received this immediately and it covered ALL of my routine ob/gyn visits as well as almost the entire labor and delivery. I  had an emergency c-section and ended up staying in the hospital with my son for 9 days. Medicaid covered almost the entire bill; I ended up owing about $200 after the hospital stay but the hospital I delivered at had a financial program for low-income women (you have to ask!!) so my final out-of-pocket cost was $40. Absolutely amazing considering what it costs to have a baby and I was able to attend all appointments and never thought twice about having to see my doctor unexpectedly for issues along the way. All of my prescriptions during pregnancy and for three months afterwards, were absolutely free so ask your doctor to prescribe prenatal vitamins. You should take them anyway but buying them OTC is expensive so get them free from the pharmacy by telling your doctor you need a prescription because of cost. It does seem though that the quality/availability of care through Medicaid is very dependent on your geographical location as I've spoken with other mothers who did not have such an easy or good time with pregnancy Medicaid. Talk to your case manager when you sign up and ask about your best options. It really pays to do your own research as the system is usually really overwhelmed and your case manager only has so much time/effort/care they can give you.  Also, sign up for WIC and SNAP right NOW. 


2) Lean on your family and friends. Everyone loves a new baby! I was very, very fortunate in that I have an incredible, supportive family. My sister bought me so many gifts that I'm not sure I could of done it without her. My dad assembled so much baby equipment and furniture for me that it was basically a second job for him. Cousins, aunts, co-workers, friends all bought gifts. Do not be shy about accepting them or telling them exactly what you need if they ask. Which leads me to number 3.


3) Have a baby shower. If you don't have anyone close enough to you that will throw one for you, plan it yourself. It absolutely does not have to cost a ton of money. You can make cheap but good foods like cold pasta salad and hamburgers; just host it at your home or in a public park (weather permitting of course) to save on a party hall rental. I know this seems like a social sin to throw your own baby shower but you have to do what you have to do and most people won't care anyway. People will bring gifts so I would highly suggest creating a registry. When I was pregnant , babies r us was still around and they had a million options at a million price points. They even gave you a gift card worth 10% of the final amount of things bought off your registry a few months after your due date so search around online for the store offering the best options for deals near you. Even if you don't have a shower, create a registry at any store that offers incentives. Add the items you're going to purchase for yourself and then buy them off the registry to get the incentives. 


4) STOCKPILE. I knew I would not be paid for any type of maternity leave so I began buying supplies I knew I'd need immediately to have them on hand when I was out of work after my son's birth. This GREATLY reduced my financial burden and the accompanying stress because I didn't have to worry about diapers, wipes, etc. Every month of my pregnancy, I bought at least one jumbo box of diapers and one jumbo box of wipes. I also suggest buying bulk sale items when you come across them and have the extra money. I have not bought diaper rash cream, baby lotion/shampoo/soap, or baby sunscreen since I was pregnant because I still have stockpiles of it and my son is now 20 months. I managed this by buying a ton of it whenever I came across a good sale. You will always end up using it and most products have a very long shelf-life. If an item(s) is very heavily discounted and you know for certain that you will need it but not for 9 months or so, I'd buy it as long as you can store it. It's also helpful to stock up on children's Tylenol and such because when you live alone, there is no one you can send to the store at 2 am when baby has a teething fever. 


5) Buy what you can second-hand and then resell it when you no longer need it. Bassinets, pack-and-plays, clothes, etc. Browse thrift stores and places like Once Upon A Child very frequently because they get new items often and you have to be quick when something good comes in. Buy clothes in sizes 1-2 up when you come across good deals on them because you're going to need them soon anyway. I bought my son clothes all the way up until size 12 months when I was pregnant and never had to buy any the first year of his life. Also try Facebook marketplace, Craig's List, and friends with growing children. Do not worry about fancy equipment like electric bottle warmers or lace dresses, buy basic. If baby is clean, fed, and well looked after, it does not matter if his outfit is trendy or if you have a baby wipe warmer. I had never been around babies so I solicited the advice of a million different websites and almost every parent I came across. Gather information about what you'll really actually need and use vs. what you want or are not sure about.


6) Sign up for coupons. Companies love to throw coupons and the occasional free item at new parents. Sign up for formula coupons (I know for sure that both enfamil and similac offer them) even if you plan on breastfeeding. They'll bombard your mailbox with good sized samples and substantial coupons. Look online for rewards programs like the one Pampers offers, too. Sign up for all of it. This is questionably ethical but I also had my sister sign up for the same coupons using her address and my due date. I was able to use twice the amount of coupons this way. 

7) Find out about subsidized daycare. There may be a waiting list so see if you can get on it now and research the daycares that accept it. Research and apply for every single social program available BEFORE baby arrives. 

8) This last part is mostly for the women who are doing it alone like me. Do not be scared to ask for help whenever you need it. I was and I suffered. I look back now and wish I just would of spoken up. If you need a break (and you will) from baby, please reach out to someone you trust who can babysit for a few hours while you take a nap or do something for yourself. Do not burn yourself out because your mental health and parenting skills will suffer. Look into mommy groups, talk with other women online, see a therapist, whatever you need to do. I have found that most of the women in my situation are desperate for friends who understand what they go through so find some. Don't let anyone make you feel ashamed. Ever. These things happen, we do what we need to in order to survive, and we love our children. PM me if you need to talk. Pursue child support adamantly. The state will file for you if you receive assistance but you really have to stay on top of them to actually achieve anything. Also, don't rely too heavily on the child support. Think of it as extra cash because if you end up losing it or never getting it or whatever, it won't hurt your finances so badly. Caring for a baby alone is SO FUCKING HARD and if it ever gets easier, I'll be sure to let you know but it is possible to do it. 


Edit: This is getting some attention so I wanted to add one more bit of advice. If you haven't put any effort into it before, it's now the time to construct a plan for financial longevity. For me personally, this meant education. Be honest with yourself about the amount of effort you are really willing and able to put in so that your plans/goals are achievable and grounded in reality. It's great to dream big but don't end up racking up debt in an attempt to get a BA in your childhood dream field of philosophy only to drop out after two semesters because life is hard (it is!) or eventually graduate with hefty loans with no job prospects. Don't put it off either. It's going to be really difficult but it's going to be difficult in our type of situation anyway so try to do something that will put you in a better earning position within a few years. ",https://www.reddit.com/r/povertyfinance/comments/8hq3li/preparing_for_a_baby_a_single_moms_guide/,817,[removed] ,2018-05-07 19:14:26
428,ckup7n,False,,148,Thought this would fit in here... could really help people in this sub,povertyfinance,,https://i.redd.it/chbsy6yd6vd31.jpg,2538,[removed] ,2019-08-01 21:35:19
389,cjs08a,False,,131,"What to Do When You Are Completely Broke: 8 Steps to Take. One thing I find when most people say they're broke, is they mean they've run out of expendible cash but are still sitting on savings. But when I say I'm broke, I mean there is $0 in the bank. This article has some pretty decent advice.",povertyfinance,,https://centsai.com/must-reads/centsai-sensei/what-to-do-when-youre-broke/?utm_source=redditposts&utm_medium=native&utm_campaign=organic&utm_term=finlit&utm_content=broke,2786,No one is truly broke in a first world country with welfare. ,2019-07-30 13:48:02
849,8h7k2g,False,,471,"How do normal people afford nice things, seriously?",povertyfinance,"Backstory - I just started a new job making $45,000 a year which is huge for me since I was making $11.50/hr!!! (Single mom with two kids and live in a state with low cost of living) I am budgeting my finances for when I get my first paycheck and after the bills are paid, I’m literally going to have the same amount leftover each month as my old job. WTF. I guess the difference is I can finally afford to live in a rent house but I will be paying about $350/mo for daycare, and paying for healthcare now. I just can’t figure out how people buy expensive clothes or afford car payments, vacations, etc...

It makes me kind of rethink this opportunity....I was working from home and while the pay sucked ass, I was off in time to pick up my son from school and had a lot of time to run errands and take them to the park and stuff. Idk, I’m just kind of discouraged right now. ",https://www.reddit.com/r/povertyfinance/comments/8h7k2g/how_do_normal_people_afford_nice_things_seriously/,1048,"Stop buying nice things, make due with what you can afford and invest in yourself and go to school.  ",2018-05-05 13:35:22
281,ezdk6a,False,,59,"A year ago this may I lost my job and my checking went to $100 that I didn’t touch. I had 1¢ in my savings and 1300 outstanding in my credit. This is today, after 5 months of working :)",povertyfinance,,https://i.redd.it/2unf0axma5f41.jpg,3490,These are baby figures. Jesus. ,2020-02-05 18:03:45
730,8gruxr,False,,79,Spent my whole paycheck.,povertyfinance,"Paid rent for this month, power and utilities. Plus I finally paid off a payday loan from two months ago, and I was able to bring my bank account to it’s minimum member amount. After a long time of doing things the hard way this sub has really helped me get a grasp on these basic skills. 

Thanks, see you next paycheck!

Edit: I just want to say thank you guys for all the support, I mostly lurk but I’ve been on redddit for years. Honestly means a lot to have this support, I was kinda bumming about being broke but you’ve helped me see the bigger picture again! Keep on keeping on",https://www.reddit.com/r/povertyfinance/comments/8gruxr/spent_my_whole_paycheck/,1458,"That’s the best kind of broke. When you know you’ve taken care of your stuff, especially the pay day loan!! Good job! ",2018-05-03 16:54:08
777,grrbp0,False,Debt/Loans/Credit,64,Finally done paying my student loans after we started paying off our debt using the snowball repayment method.,povertyfinance,,https://i.redd.it/w287smvm7d151.jpg,1270,What are you going to do when they forgive student loans? ,2020-05-27 20:12:08
595,ahb7ff,False,,153,It took 15 months.....,povertyfinance,"I finally bought a ps4.  It's used, and the controller is kinda busted, but I saved every dime and now I finally have one.

Just wanted to share.  :)

Edit:  I started today just happy to finally buy myself a very rare luxury item.  It snowballed into so many amazing people sending me games they don't play anymore, games they never played and flat out buying games for me.  You all are fucking amazing.  This is crazy.  I just wanted to share that I bought myself something, and you all have made my month.  Thank you all so much.  ",https://www.reddit.com/r/povertyfinance/comments/ahb7ff/it_took_15_months/,1851,[removed] ,2019-01-18 14:55:22
512,b66t4g,False,,385,Driving is MUCH more expensive than most people realize.,povertyfinance,,https://www.investopedia.com/articles/pf/08/cost-car-ownership.asp,2181,Idk where they pulled those numbers from. I dont spend more than 9 grand on my car overall. i spend about 5 grand on my car per year ,2019-03-27 17:09:10
133,dthn3a,False,,158,"Although this situation won’t apply to everyone, I thought I’d share that sometimes you just need to tell your family no. Had to say no to my mother who has a long record of regretful financial decisions when she asked me to help her co-sign a car",povertyfinance,,https://i.redd.it/k2hvzibfmhx31.jpg,5700,You should have bought her the car. Time will tell... ,2019-11-08 16:16:47
6,gak9dd,False,Housing/Shelter/Standard of Living,685,"May not be much, but I’m thrilled. After sleeping on an air mattress for 4 months, I bought a bed!",povertyfinance,,https://i.redd.it/3zmipzaacuv41.jpg,34274,[removed] ,2020-04-29 23:23:42
41,9t78dx,False,,1545,I just unsubbed from /r/personalfinance. People complaining about making six figures and being underpaid just makes me extremely bitter.,povertyfinance,,https://www.reddit.com/r/povertyfinance/comments/9t78dx/i_just_unsubbed_from_rpersonalfinance_people/,12337,"6 figures isn't a lot, 100,000-200,000 is middle class ",2018-11-01 07:00:54
579,chs7ni,False,,254,Is it just me or does looking at openings for higher paying jobs depress you?,povertyfinance,"I mean seriously, I only make 31k a year. Every time I look at a job opening for 35k+ a year, they want a ton of experience, a college degree, certifications, or all of the above. It’s really depressing and super discouraging when you’re just trying to get a career of some sort going. It feels like an endless loop where I’m trapped at a dead-end job that already has me capped out in terms of making more. I’m only 22, but I’ve been working here since I was 20. I’m barely scraping by, and it feels like I’m wasting my time, and that I won’t find a better opportunity because of all the requirements needed to get something else going. It really does feel like I’m alone when it comes to this. Does anybody else feel this way?

Edit: Thanks for all the advice & encouraging words y’all. I’ll definitely try to take most/ all the advice & motivation given to me. its very appreciated.",https://www.reddit.com/r/povertyfinance/comments/chs7ni/is_it_just_me_or_does_looking_at_openings_for/,1900,Get. A. Trade. ,2019-07-25 19:20:21
196,ebocgj,False,,78,The FBI's facebook page doing the lord's work.,povertyfinance,,https://i.redd.it/fb8sgw3t10541.jpg,4464,Like college? ,2019-12-17 01:02:58
